site,title,company,location,date_posted,job_url,job_url_direct,id,job_type,salary_source,interval,min_amount,max_amount,currency,is_remote,job_level,job_function,listing_type,emails,company_industry,company_url,company_url_direct,company_addresses,company_num_employees,company_revenue,company_description,skills,experience_range,company_rating,company_reviews_count,vacancy_count,work_from_home_type
linkedin,Werkstudententätigkeit,MBDA Deutschland,"Schrobenhausen, Bavaria, Germany",2026-04-30,https://www.linkedin.com/jobs/view/4408785937 , ,li-4408785937,fulltime,,,,,,True,internship,Administrative,,,Defense and Space Manufacturing,https://de.linkedin.com/company/mbda-deutschland,,,,,,,,,,,
linkedin,Internship - Data Analytics & Machine Learning in Sales Excellence (d/f/m),Schaeffler,"Regensburg, Bavaria, Germany",2026-04-30,https://www.linkedin.com/jobs/view/4399899536 , ,li-4399899536,fulltime,,,,,,False,internship,Engineering and Information Technology,,,Manufacturing,https://de.linkedin.com/company/schaeffler,,,,,,,,,,,
linkedin,Internship/Working Student for Green Hydrogen Lab - Germany,Sungrow Europe,"Munich, Bavaria, Germany",2026-04-30,https://www.linkedin.com/jobs/view/4408793975 , ,li-4408793975,internship,,,,,,False,entry level,Science,,,Oil and Gas,https://de.linkedin.com/company/sungroweurope,,,,,,,,,,,
linkedin,Working Student for Data Analytics and AI within Aviation Safety and Process Excellence (d/f/m),Airbus Aircraft,"Hamburg, Hamburg, Germany",2026-04-30,https://www.linkedin.com/jobs/view/4406410909 , ,li-4406410909,volunteer,,,,,,False,internship,Administrative,,emsom@airbus.com,Aviation and Aerospace Component Manufacturing,https://fr.linkedin.com/company/airbus,,,,,,,,,,,
linkedin,Abschlussarbeit Big Data & AI - Multimodale KI zur 3D-Modellierung von Industrieteilen (m/w/d),Würth Deutschland,"Berlin, Berlin, Germany",2026-04-29,https://www.linkedin.com/jobs/view/4395438802 , ,li-4395438802,internship,,,,,,False,internship,Information Technology,,,Wholesale,https://de.linkedin.com/company/wuerth-germany,,,,,,,,,,,
linkedin,Internship in Motion Generation for Agricultural Robotics (f/m/x),ZEISS Group,"Eggenstein, Baden-Württemberg, Germany",2026-04-29,https://www.linkedin.com/jobs/view/4408256748 , ,li-4408256748,fulltime,,,,,,False,internship,Information Technology and Other,,,"Appliances, Electrical, and Electronics Manufacturing",https://de.linkedin.com/company/zeiss,,,,,,,,,,,
linkedin,Working Student Drone Prototyping (m/w/d),Alpine Eagle,"Karlsruhe, Baden-Württemberg, Germany",2026-04-29,https://www.linkedin.com/jobs/view/4376592993 , ,li-4376592993,internship,,,,,,False,not applicable,Engineering,,,Software Development,https://de.linkedin.com/company/alpineeagle,,,,,,,,,,,
linkedin,student assistant (f/m/x) - Institute of Robotics and Mechatronics,German Aerospace Center (DLR),"Oberpfaffenhofen, Bavaria, Germany",2026-04-29,https://www.linkedin.com/jobs/view/4407853632 , ,li-4407853632,fulltime,,,,,,False,entry level,Engineering and Information Technology,,,Research Services,https://de.linkedin.com/company/dlr,,,,,,,,,,,
linkedin,Praktikum Data Science Batteriesysteme (w/m/d),Volkswagen Group,,2026-04-29,https://www.linkedin.com/jobs/view/4394783688 , ,li-4394783688,fulltime,,,,,,False,internship,Information Technology,,,Motor Vehicle Manufacturing,https://de.linkedin.com/company/volkswagen-group,,,,,,,,,,,
linkedin,Werkstudent:in Data Science,nerou GmbH,"Berlin, Berlin, Germany",2026-04-29,https://www.linkedin.com/jobs/view/4406996299 , ,li-4406996299,internship,,,,,,False,internship,Information Technology,,jobs@nerou.de,IT Services and IT Consulting,https://de.linkedin.com/company/nerou,,,,,,,,,,,
linkedin,Intern Agent-Based AI Systems and BMW Intelligent Personal Assistant (f/m/x),BMW Group,"Munich, Bavaria, Germany",2026-04-29,https://www.linkedin.com/jobs/view/4374296081 , ,li-4374296081,internship,,,,,,False,internship,Administrative,,,Motor Vehicle Manufacturing,https://de.linkedin.com/company/bmw-group,,,,,,,,,,,
linkedin,Operations & Automations Intern (f/d/m),CEEZER,"Berlin, Berlin, Germany",2026-04-29,https://www.linkedin.com/jobs/view/4408277741 , ,li-4408277741,volunteer,,,,,,False,internship,Management and Manufacturing,,,Internet Marketplace Platforms,https://de.linkedin.com/company/ceezer,,,,,,,,,,,
linkedin,Data Science - Work Student / Intern,Hawk,"Munich, Bavaria, Germany",2026-04-29,https://www.linkedin.com/jobs/view/4408504172 , ,li-4408504172,fulltime,,,,,,False,internship,Engineering and Information Technology,,,Financial Services,https://de.linkedin.com/company/hawk-ai-tech,,,,,,,,,,,
linkedin,Internal AI Tools Specialist,Jobgether,,2026-04-29,https://www.linkedin.com/jobs/view/4406957330 , ,li-4406957330,fulltime,,,,,,True,entry level,Engineering and Information Technology,,,Internet Marketplace Platforms,https://be.linkedin.com/company/jobgether,,,,,,,,,,,
linkedin,"Paint, Software & Data Engineering Internship (m/w/d) – Gigafactory Berlin Brandenburg",Tesla,"Grünheide, Brandenburg, Germany",2026-04-28,https://www.linkedin.com/jobs/view/4407896341 , ,li-4407896341,internship,,,,,,False,internship,Engineering and Information Technology,,,"Motor Vehicle Manufacturing, Renewable Energy Semiconductor Manufacturing, and Utilities",https://www.linkedin.com/company/tesla-motors,,,,,,,,,,,
linkedin,WORKING STUDENT – DATA VISUALIZATION AND ANALYSIS (ANALYSIS & ADVISORY) (M/W/D),HypoVereinsbank - UniCredit - Deutschland,"Munich, Bavaria, Germany",2026-04-28,https://www.linkedin.com/jobs/view/4406561763 , ,li-4406561763,volunteer,,,,,,True,internship,Finance,,,Banking,https://de.linkedin.com/company/hypovereinsbank,,,,,,,,,,,
linkedin,Werkstudent Data Analytics (w/m/div.),Bosch,"Plochingen, Baden-Württemberg, Germany",2026-04-28,https://www.linkedin.com/jobs/view/4406506506 , ,li-4406506506,parttime,,,,,,False,not applicable,General Business,,,Automotive,https://de.linkedin.com/company/bosch,,,,,,,,,,,
linkedin,Data Analysis Werkstudent:in (w/m/d),Enpal,"Berlin, Berlin, Germany",2026-04-28,https://www.linkedin.com/jobs/view/4399889258 , ,li-4399889258,parttime,,,,,,False,internship,Information Technology,,,Energy Technology,https://de.linkedin.com/company/enpal,,,,,,,,,,,
linkedin,Internship in Agentic AI for Cockpit Development,BMW Group,"Munich, Bavaria, Germany",2026-04-28,https://www.linkedin.com/jobs/view/4384051677 , ,li-4384051677,internship,,,,,,False,internship,Education and Training,,,Motor Vehicle Manufacturing,https://de.linkedin.com/company/bmw-group,,,,,,,,,,,
linkedin,Praktikum im Business Development (all genders),VfL Wolfsburg,"Wolfsburg, Lower Saxony, Germany",2026-04-28,https://www.linkedin.com/jobs/view/4380469046 , ,li-4380469046,internship,,,,,,False,internship,"Consulting, Project Management, and Strategy/Planning",,,"Spectator Sports, Sports Teams and Clubs, and Events Services",https://de.linkedin.com/company/vfl-wolfsburg,,,,,,,,,,,
linkedin,Werkstudent Data Science im Entwicklungsbereich (w/m/x),BMW Group,"Munich, Bavaria, Germany",2026-04-28,https://www.linkedin.com/jobs/view/4374290142 , ,li-4374290142,internship,,,,,,False,internship,Engineering and Information Technology,,,Motor Vehicle Manufacturing,https://de.linkedin.com/company/bmw-group,,,,,,,,,,,
linkedin,Working student for Customer Success (f/m/d),VAARHAFT,"Berlin, Berlin, Germany",2026-04-27,https://www.linkedin.com/jobs/view/4405139423 , ,li-4405139423,parttime,,,,,,True,internship,Other,,,Software Development,https://de.linkedin.com/company/vaarhaft,,,,,,,,,,,
linkedin,Research Scientist Intern (PhD),Prior Labs,"Freiburg, Baden-Württemberg, Germany",2026-04-27,https://www.linkedin.com/jobs/view/4407413912 , ,li-4407413912,internship,,,,,,False,internship,Other,,,"Technology, Information and Internet",https://de.linkedin.com/company/prior-labs,,,,,,,,,,,
linkedin,Business Development Intern (m/f/d),Finoa,"Berlin, Berlin, Germany",2026-04-27,https://www.linkedin.com/jobs/view/4407192891 , ,li-4407192891,internship,,,,,,False,entry level,Sales,,,Software Development,https://de.linkedin.com/company/finoa-io,,,,,,,,,,,
linkedin,Werkstudent für die Bereiche Finanzen & M&A (m/w/d),PMB | POSSEHL Mittelstandsbeteiligungen GmbH,"Hamburg, Hamburg, Germany",2026-04-27,https://www.linkedin.com/jobs/view/4405135858 , ,li-4405135858,parttime,,,,,,False,internship,Accounting/Auditing and Finance,,,Financial Services,https://de.linkedin.com/company/possehl-mittelstandsbeteiligungen,,,,,,,,,,,
linkedin,Werkstudent:in AI Product & Solutions (m/w/d),shyftplan,"Berlin, Berlin, Germany",2026-04-27,https://www.linkedin.com/jobs/view/4407190336 , ,li-4407190336,parttime,,,,,,False,entry level,Project Management and Information Technology,,,Software Development,https://de.linkedin.com/company/shyftplan,,,,,,,,,,,
linkedin,AI Engineer - Working Student (m/w/d),Bavest,"Frankfurt am Main, Hesse, Germany",2026-04-26,https://www.linkedin.com/jobs/view/4404630473 , ,li-4404630473,parttime,,,,,,False,internship,Engineering and Information Technology,,career@bavest.co,Financial Services,https://de.linkedin.com/company/bavest,,,,,,,,,,,
linkedin,Internship Detector Characterization (d/m/w),Airbus Defence and Space,"Munich, Bavaria, Germany",2026-04-25,https://www.linkedin.com/jobs/view/4404165736 , ,li-4404165736,volunteer,,,,,,False,internship,Education and Training,,emsom@airbus.com,Defense and Space Manufacturing,https://www.linkedin.com/company/airbus-defence-and-space,,,,,,,,,,,
linkedin,Werkstudent KI / Automatisierung (m/w/d),PSH Personal Service GmbH,"Ostrhauderfehn, Lower Saxony, Germany",2026-04-25,https://www.linkedin.com/jobs/view/4405740952 , ,li-4405740952,fulltime,,,,,,False,internship,Administrative,,,Human Resources Services,https://www.linkedin.com/company/psh-personal-service-gmbh,,,,,,,,,,,
linkedin,Werkstudent Data Science & Machine Learning (m/w/d),Mubea,"Attendorn, North Rhine-Westphalia, Germany",2026-04-24,https://www.linkedin.com/jobs/view/4356454547 , ,li-4356454547,fulltime,,,,,,False,internship,Engineering and Information Technology,,,Motor Vehicle Manufacturing,https://de.linkedin.com/company/mubea,,,,,,,,,,,
linkedin,Internship / Thesis Robotic Foundation Models for Automotive Final Assembly (m/f/d),Volkswagen Group,"Wolfsburg, Lower Saxony, Germany",,https://www.linkedin.com/jobs/view/4387714108 , ,li-4387714108,fulltime,,,,,,False,internship,Information Technology,,,Motor Vehicle Manufacturing,https://de.linkedin.com/company/volkswagen-group,,,,,,,,,,,
linkedin,"Intern – 6G Robotics, AI and ISAC Prototyping",Huawei,"Munich, Bavaria, Germany",,https://www.linkedin.com/jobs/view/4407630094 , ,li-4407630094,internship,,,,,,False,internship,Engineering and Information Technology,,,Telecommunications,https://cn.linkedin.com/company/huawei,,,,,,,,,,,
linkedin,Intern Consultant Data Science and AI (m/f/d)*,Munich Re,"Munich, Bavaria, Germany",,https://www.linkedin.com/jobs/view/4369213399 , ,li-4369213399,fulltime,,,,,,True,internship,Information Technology,,,Insurance,https://de.linkedin.com/company/munich-re,,,,,,,,,,,
