site,title,company,location,date_posted,job_url,job_url_direct,id,job_type,salary_source,interval,min_amount,max_amount,currency,is_remote,job_level,job_function,listing_type,emails,company_industry,company_url,company_url_direct,company_addresses,company_num_employees,company_revenue,company_description,skills,experience_range,company_rating,company_reviews_count,vacancy_count,work_from_home_type
linkedin,"(Senior) Software Engineer - Data Management ( C#, Go or C++)",Snke,"Munich, Bavaria, Germany",2026-05-12,https://www.linkedin.com/jobs/view/4412750810 , ,li-4412750810,fulltime,,,,,,False,associate,"Research, Engineering, and Information Technology",,,Medical Equipment Manufacturing,https://de.linkedin.com/company/snke,,,,,,,,,,,
linkedin,Senior Salesforce Developer (m/w/d),comselect GmbH,"Mannheim, Baden-Württemberg, Germany",2026-05-12,https://www.linkedin.com/jobs/view/4410184010 , ,li-4410184010,fulltime,,,,,,True,entry level,Information Technology,,,Professional Services,https://de.linkedin.com/company/comselect-gmbh,,,,,,,,,,,
linkedin,Softwareentwickler PHP (m/w/d),OHB Digital Services GmbH,"Bremen, Bremen, Germany",2026-05-12,https://www.linkedin.com/jobs/view/4413535435 , ,li-4413535435,fulltime,,,,,,False,mid-senior level,Engineering and Information Technology,,,IT Services and IT Consulting,https://de.linkedin.com/company/ohb-ds,,,,,,,,,,,
linkedin,Software Engineer,Cavendish Professionals,"Berlin, Germany",2026-05-12,https://www.linkedin.com/jobs/view/4408879361 , ,li-4408879361,fulltime,,,,,,True,mid-senior level,Information Technology,,,"Energy Technology and Technology, Information and Media",https://uk.linkedin.com/company/cavendish-professionals,,,,,,,,,,,
linkedin,"Palantir Foundry Engineer (Frankfurt or Munich, Germany)",Unit8,"Frankfurt, Hesse, Germany",2026-05-12,https://www.linkedin.com/jobs/view/4410182454 , ,li-4410182454,fulltime,,,,,,False,mid-senior level,Engineering,,,IT Services and IT Consulting,https://ch.linkedin.com/company/unit8,,,,,,,,,,,
linkedin,"Staff Data Analyst, Marketing Analytics",GetYourGuide,"Berlin, Berlin, Germany",2026-05-12,https://www.linkedin.com/jobs/view/4413465135 , ,li-4413465135,fulltime,,,,,,False,associate,Information Technology and Engineering,,jobs@getyourguide.com,"Technology, Information and Internet and Travel Arrangements",https://de.linkedin.com/company/getyourguide-ag,,,,,,,,,,,
linkedin,IT-Consultant Conversational AI (all genders),adesso SE,"Berlin, Berlin, Germany",2026-05-12,https://www.linkedin.com/jobs/view/4078611992 , ,li-4078611992,fulltime,,,,,,False,entry level,Information Technology,,,IT Services and IT Consulting,https://de.linkedin.com/company/adesso-se,,,,,,,,,,,
linkedin,(Senior) Machine Learning Engineer (f/m/d),Pricenow,"Munich, Bavaria, Germany",2026-05-12,https://www.linkedin.com/jobs/view/4410179466 , ,li-4410179466,fulltime,,,,,,False,associate,Information Technology,,,IT Services and IT Consulting,https://ch.linkedin.com/company/pricenow-ag,,,,,,,,,,,
linkedin,AI & Optimization Engineer,Jobgether,,2026-05-12,https://www.linkedin.com/jobs/view/4413510294 , ,li-4413510294,fulltime,,,,,,True,mid-senior level,Engineering and Information Technology,,,Internet Marketplace Platforms,https://be.linkedin.com/company/jobgether,,,,,,,,,,,
linkedin,AI Technical Mentor - Independent Contractor,Jobgether,,2026-05-12,https://www.linkedin.com/jobs/view/4413509474 , ,li-4413509474,fulltime,,,,,,True,mid-senior level,Other,,,Internet Marketplace Platforms,https://be.linkedin.com/company/jobgether,,,,,,,,,,,
linkedin,Research Assistant (all genders) - Speech and Audio Applications,Fraunhofer IIS,"Erlangen, Bavaria, Germany",2026-05-12,https://www.linkedin.com/jobs/view/4413273704 , ,li-4413273704,fulltime,,,,,,False,entry level,"Research, Analyst, and Information Technology",,,Research Services,https://de.linkedin.com/company/fraunhofer-iis,,,,,,,,,,,
linkedin,Founder&#39;s Associate with a Content &amp; Social Media Touch,mika AI,"Berlin, Berlin, Germany",2026-05-12,https://www.linkedin.com/jobs/view/4413538466 , ,li-4413538466,fulltime,,,,,,True,internship,Business Development and Sales,,careers@getmika.de,Financial Services,https://de.linkedin.com/company/get-mika,,,,,,,,,,,
linkedin,"Director, Generative AI Innovation (m/f/d)",Daiichi Sankyo Europe GmbH,"Munich, Bavaria, Germany",2026-05-12,https://www.linkedin.com/jobs/view/4413595693 , ,li-4413595693,fulltime,,,,,,False,mid-senior level,Product Management and Marketing,,,Pharmaceutical Manufacturing,https://de.linkedin.com/company/daiichi-sankyo-europe-gmbh,,,,,,,,,,,
linkedin,IT-Consultant Conversational AI (all genders),adesso SE,"Hamburg, Hamburg, Germany",2026-05-12,https://www.linkedin.com/jobs/view/4078616301 , ,li-4078616301,fulltime,,,,,,False,entry level,Information Technology,,,IT Services and IT Consulting,https://de.linkedin.com/company/adesso-se,,,,,,,,,,,
linkedin,IT-Consultant Conversational AI (all genders),adesso SE,"Cologne, North Rhine-Westphalia, Germany",2026-05-12,https://www.linkedin.com/jobs/view/4078617998 , ,li-4078617998,fulltime,,,,,,False,entry level,Information Technology,,,IT Services and IT Consulting,https://de.linkedin.com/company/adesso-se,,,,,,,,,,,
linkedin,Software Engineer Full Stack (m/w/d),NT-ware Systemprogrammierungs-GmbH,"Bad Iburg, Lower Saxony, Germany",2026-05-12,https://www.linkedin.com/jobs/view/4413408874 , ,li-4413408874,fulltime,,,,,,False,entry level,Information Technology,,,Information Technology & Services,https://de.linkedin.com/company/nt-ware,,,,,,,,,,,
linkedin,Growth Manager,CoAgentor,,2026-05-12,https://www.linkedin.com/jobs/view/4413292412 , ,li-4413292412,parttime,,,,,,True,mid-senior level,Marketing and Sales,,,"Technology, Information and Internet",https://www.linkedin.com/company/coagentor,,,,,,,,,,,
linkedin,(Senior) Researcher (f/m/x) Labor Market,WifOR Institute,"Berlin, Berlin, Germany",2026-05-12,https://www.linkedin.com/jobs/view/4410154024 , ,li-4410154024,fulltime,,,,,,False,associate,Other,,career@wifor.com,Business Consulting and Services,https://de.linkedin.com/company/wifor,,,,,,,,,,,
linkedin,Entrepreneur in Residence (EIR) – Build New &amp; Exciting Ventures with Us,over99,"Berlin, Berlin, Germany",2026-05-12,https://www.linkedin.com/jobs/view/4413426004 , ,li-4413426004,fulltime,,,,,,False,mid-senior level,Business Development and Sales,,,IT Services and IT Consulting,https://www.linkedin.com/company/over99,,,,,,,,,,,
linkedin,Product Manager - Data-Viz Startup - B2B SaaS,Vizzlo,,2026-05-12,https://www.linkedin.com/jobs/view/4410186643 , ,li-4410186643,fulltime,,,,,,True,entry level,Product Management,,,IT Services and IT Consulting,https://de.linkedin.com/company/vizzlo,,,,,,,,,,,
linkedin,Backend Engineer - Python,turbalance,"Heidelberg, Baden-Württemberg, Germany",2026-05-12,https://www.linkedin.com/jobs/view/4413455598 , ,li-4413455598,fulltime,,,,,,True,mid-senior level,Engineering and Information Technology,,,Software Development,https://www.linkedin.com/company/turbalance,,,,,,,,,,,
linkedin,Business Development Manager,Temu,,2026-05-12,https://www.linkedin.com/jobs/view/4413525295 , ,li-4413525295,fulltime,,,,,,False,not applicable,Business Development,,,"Technology, Information and Internet, Online and Mail Order Retail, and Retail",https://www.linkedin.com/company/temuapp,,,,,,,,,,,
linkedin,Data Engineer,Senovo IT Ltd,,2026-05-12,https://www.linkedin.com/jobs/view/4413538300 , ,li-4413538300,contract,,,,,,False,mid-senior level,Engineering,,,IT Services and IT Consulting,https://uk.linkedin.com/company/senovo-it-ltd,,,,,,,,,,,
linkedin,Junior Research Analyst - survey based (primary research),Nielsen,"Hamburg, Hamburg, Germany",2026-05-12,https://www.linkedin.com/jobs/view/4410186296 , ,li-4410186296,fulltime,,,,,,False,not applicable,Other,,,Broadcast Media Production and Distribution,https://www.linkedin.com/company/nielsen,,,,,,,,,,,
linkedin,Data Scientist/Engineer (m/w/d) – Berlin,Brunel,"Berlin, Germany",2026-05-12,https://www.linkedin.com/jobs/view/4413430206 , ,li-4413430206,fulltime,,,,,,False,associate,Other,,,Industrial Machinery Manufacturing,https://nl.linkedin.com/company/brunel,,,,,,,,,,,
linkedin,Data Science Manager,Auxo Talent,,2026-05-12,https://www.linkedin.com/jobs/view/4413819203 , ,li-4413819203,contract,,,,,,True,mid-senior level,"Consulting, Information Technology, and Analyst",,,Staffing and Recruiting,https://www.linkedin.com/company/auxotalent,,,,,,,,,,,
linkedin,Senior Python Engineer,Trust In SODA,"Berlin, Germany",2026-05-12,https://www.linkedin.com/jobs/view/4413544028 , ,li-4413544028,contract,,,,,,True,mid-senior level,Engineering and Information Technology,,,"Financial Services, Entertainment Providers, and Retail",https://uk.linkedin.com/company/trust-in-soda,,,,,,,,,,,
linkedin,Machine Learning Engineer (m/f/x) - Geospatial AI,osapiens,"Munich, Bavaria, Germany",2026-05-12,https://www.linkedin.com/jobs/view/4413406327 , ,li-4413406327,fulltime,,,,,,True,entry level,Engineering and Information Technology,,,Software Development,https://de.linkedin.com/company/osapiens,,,,,,,,,,,
linkedin,Senior AI ML Engineer,Xcede,,2026-05-12,https://www.linkedin.com/jobs/view/4413535562 , ,li-4413535562,fulltime,,,,,,True,mid-senior level,Engineering and Information Technology,,,"Energy Technology and Technology, Information and Media",https://uk.linkedin.com/company/xcede,,,,,,,,,,,
linkedin,Senior AI/ML Consultant,Netlight,"Berlin, Germany",2026-05-12,https://www.linkedin.com/jobs/view/4410184092 , ,li-4410184092,fulltime,,,,,,False,associate,Information Technology and Consulting,,,"IT Services and IT Consulting, Software Development, and Technology, Information and Media",https://www.linkedin.com/company/netlight-consulting,,,,,,,,,,,
linkedin,"AI Engineer – Build & Deploy AI Systems in Production - €95,000",Findr,"Munich, Bavaria, Germany",2026-05-12,https://www.linkedin.com/jobs/view/4413453631 , ,li-4413453631,fulltime,,,,,,False,mid-senior level,"Information Technology, Engineering, and Analyst",,,"Software Development, Data Infrastructure and Analytics, and IT System Data Services",https://de.linkedin.com/company/findr-tech,,,,,,,,,,,
linkedin,Senior Data Engineer,Bluefish,,2026-05-12,https://www.linkedin.com/jobs/view/4413442973 , ,li-4413442973,fulltime,,,,,,True,mid-senior level,Information Technology and Engineering,,,"Construction, Software Development, and IT Services and IT Consulting",https://www.linkedin.com/company/bluefish-ai,,,,,,,,,,,
linkedin,Consultant - Digital Analytics  (All Genders) Düsseldorf,Digitl,,2026-05-12,https://www.linkedin.com/jobs/view/4413405083 , ,li-4413405083,fulltime,,,,,,True,mid-senior level,"Research, Analyst, and Information Technology",,,Marketing Services,https://de.linkedin.com/company/digitl-group,,,,,,,,,,,
linkedin,(Senior) Learning Expert (w/m/d),Horváth,"Munich, Bavaria, Germany",2026-05-12,https://www.linkedin.com/jobs/view/4406486826 , ,li-4406486826,fulltime,,,,,,True,mid-senior level,Management and Consulting,,,Business Consulting and Services,https://de.linkedin.com/company/horvathpartners,,,,,,,,,,,
linkedin,"Data Scientist – Analytics, Statistics & BI - €130,000",Findr,"Frankfurt, Hesse, Germany",2026-05-12,https://www.linkedin.com/jobs/view/4413462787 , ,li-4413462787,fulltime,,,,,,False,mid-senior level,"Science, Information Technology, and Engineering",,,"Data Infrastructure and Analytics, IT System Data Services, and Information Services",https://de.linkedin.com/company/findr-tech,,,,,,,,,,,
linkedin,SAMSUNG - Manager Marketing Analytics (gn),Grafton Recruitment,"Eschborn, Hesse, Germany",2026-05-12,https://www.linkedin.com/jobs/view/4399558218 , ,li-4399558218,fulltime,,,,,,False,associate,Marketing,,sylvia.rass@grafton.com,"Appliances, Electrical, and Electronics Manufacturing",https://it.linkedin.com/company/grafton-recruitment,,,,,,,,,,,
linkedin,AI Research Engineer - Reinforcement Learning,Jobgether,,2026-05-12,https://www.linkedin.com/jobs/view/4413546025 , ,li-4413546025,fulltime,,,,,,True,mid-senior level,Engineering and Information Technology,,,Internet Marketplace Platforms,https://be.linkedin.com/company/jobgether,,,,,,,,,,,
linkedin,Software Engineer (m/w/d),jobvalley,"Cologne, North Rhine-Westphalia, Germany",2026-05-12,https://www.linkedin.com/jobs/view/4413556872 , ,li-4413556872,fulltime,,,,,,False,associate,Product Management,,,Human Resources Services,https://de.linkedin.com/company/jobvalley,,,,,,,,,,,
linkedin,Software Engineer (m/f/d) Machine Learning & AI,Nanoscribe,"Eggenstein, Baden-Württemberg, Germany",2026-05-12,https://www.linkedin.com/jobs/view/4410306975 , ,li-4410306975,fulltime,,,,,,True,mid-senior level,Engineering and Information Technology,,,Nanotechnology Research,https://de.linkedin.com/company/nanoscribe,,,,,,,,,,,
linkedin,Business AI Consultant (m/w/d),2b AHEAD ThinkTank,"Leipzig, Saxony, Germany",2026-05-12,https://www.linkedin.com/jobs/view/4404034478 , ,li-4404034478,fulltime,,,,,,False,associate,Consulting,,vanessa.moser@2bahead.com,Business Consulting and Services and Strategic Management Services,https://de.linkedin.com/company/2b-ahead-thinktank-gmbh,,,,,,,,,,,
linkedin,AI Engineer (m/f/x),osapiens,"Mannheim, Baden-Württemberg, Germany",2026-05-12,https://www.linkedin.com/jobs/view/4413415245 , ,li-4413415245,fulltime,,,,,,False,mid-senior level,Engineering and Information Technology,,,Software Development,https://de.linkedin.com/company/osapiens,,,,,,,,,,,
linkedin,Senior Data Scientist (f/m/x),Tourlane,"Berlin, Germany",2026-05-12,https://www.linkedin.com/jobs/view/4410187247 , ,li-4410187247,fulltime,,,,,,True,mid-senior level,Information Technology and Engineering,,,Travel Arrangements,https://de.linkedin.com/company/tourlane,,,,,,,,,,,
linkedin,Wissenschaftliche*n Mitarbeiter*in (m/w/d) für ein Entwicklungsprojekt in der Versorgung Post-Covid-Betroffener (Stellenanteil: 25-75%; befristet bis 31.12.2026),Universitätsklinikum Würzburg,"Würzburg, Bavaria, Germany",2026-05-12,https://www.linkedin.com/jobs/view/4413420062 , ,li-4413420062,parttime,,,,,,False,mid-senior level,"Research, Analyst, and Information Technology",,,Hospitals and Health Care,https://de.linkedin.com/company/universit%C3%A4tsklinikum-w%C3%BCrzburg,,,,,,,,,,,
linkedin,Masterarbeit Diagnosedatenintegration in modernen Fahrzeugdiagnosesystemen,Porsche AG,"Weissach, Baden-Württemberg, Germany",2026-05-12,https://www.linkedin.com/jobs/view/4401913840 , ,li-4401913840,fulltime,,,,,,False,internship,Education and Training,,,Motor Vehicle Manufacturing,https://de.linkedin.com/company/porsche-ag,,,,,,,,,,,
linkedin,Account Executive,turbalance,"Heidelberg, Baden-Württemberg, Germany",2026-05-12,https://www.linkedin.com/jobs/view/4413454742 , ,li-4413454742,fulltime,,,,,,True,mid-senior level,Sales and Business Development,,,Software Development,https://www.linkedin.com/company/turbalance,,,,,,,,,,,
linkedin,Data Scientist,Booz Allen Hamilton,"Wiesbaden, Hesse, Germany",2026-05-12,https://www.linkedin.com/jobs/view/4413267986 , ,li-4413267986,fulltime,,,,,,True,not applicable,Engineering and Information Technology,,,Software Development,https://www.linkedin.com/company/booz-allen-hamilton,,,,,,,,,,,
linkedin,Research Engineer - Interpretability and Synthetic Data,Deutsches Forschungszentrum für Künstliche Intelligenz (DFKI),"Saarbrücken, Saarland, Germany",2026-05-12,https://www.linkedin.com/jobs/view/4413589137 , ,li-4413589137,fulltime,,,,,,False,entry level,Engineering and Information Technology,,,Research Services,https://de.linkedin.com/company/dfki,,,,,,,,,,,
linkedin,Wissenschaftliche:r Mitarbeiter:in / Doktorand:in,Friedrich Schiller University Jena,"Jena, Thuringia, Germany",2026-05-12,https://www.linkedin.com/jobs/view/4413450254 , ,li-4413450254,fulltime,,,,,,False,entry level,"Research, Analyst, and Information Technology",,,Internet Publishing,https://de.linkedin.com/school/friedrich-schiller-universit%C3%A4t-jena/,,,,,,,,,,,
linkedin,Founding Data Scientist,Almedia,"Berlin, Germany",2026-05-12,https://www.linkedin.com/jobs/view/4404352613 , ,li-4404352613,fulltime,,,,,,False,mid-senior level,Engineering and Information Technology,,,Advertising Services,https://de.linkedin.com/company/almediaco,,,,,,,,,,,
linkedin,Data Scientist (m/w/d),Motus Partners,,2026-05-12,https://www.linkedin.com/jobs/view/4413459847 , ,li-4413459847,fulltime,,,,,,True,mid-senior level,Engineering and Information Technology,,,"Technology, Information and Media, Software Development, and Data Infrastructure and Analytics",https://www.linkedin.com/company/motus-partners,,,,,,,,,,,
linkedin,Data Analyst Business Intelligence (d/m/w/x),Mercedes-Benz Bank AG,"Stuttgart, Baden-Württemberg, Germany",2026-05-12,https://www.linkedin.com/jobs/view/4413461417 , ,li-4413461417,fulltime,,,,,,False,entry level,Information Technology,,,Financial Services,https://de.linkedin.com/company/mercedes-benz-bank-ag,,,,,,,,,,,
linkedin,Data Analyst,Digisourced.,,2026-05-12,https://www.linkedin.com/jobs/view/4413407202 , ,li-4413407202,contract,,,,,,True,mid-senior level,Information Technology,,,Staffing and Recruiting,https://uk.linkedin.com/company/digisourced,,,,,,,,,,,
linkedin,Key Customers Solutions Architect,Jobgether,,2026-05-11,https://www.linkedin.com/jobs/view/4412779946 , ,li-4412779946,fulltime,,,,,,True,mid-senior level,Engineering and Information Technology,,,Internet Marketplace Platforms,https://be.linkedin.com/company/jobgether,,,,,,,,,,,
linkedin,Lead Data Scientist,Envalior,"Düsseldorf, North Rhine-Westphalia, Germany",2026-05-11,https://www.linkedin.com/jobs/view/4383547049 , ,li-4383547049,fulltime,,,,,,False,mid-senior level,Engineering and Information Technology,,"anne.thomas@envalior.com, Talent.Acquisition@Envalior.com","Technology, Information and Internet",https://de.linkedin.com/company/envalior,,,,,,,,,,,
linkedin,Senior Data Scientist (all genders),JustPlay,"Berlin, Berlin, Germany",2026-05-11,https://www.linkedin.com/jobs/view/4412970075 , ,li-4412970075,fulltime,,,,,,False,mid-senior level,Engineering and Information Technology,,,Entertainment Providers,https://de.linkedin.com/company/justplay-gmbh,,,,,,,,,,,
linkedin,Data Scientist GenAI (m/w/d),Schwarz Corporate Solutions,"Neckarsulm, Baden-Württemberg, Germany",2026-05-11,https://www.linkedin.com/jobs/view/4413063066 , ,li-4413063066,fulltime,,,,,,False,mid-senior level,Engineering and Information Technology,,,Retail,https://de.linkedin.com/company/schwarzcorporatesolutions,,,,,,,,,,,
linkedin,Health Informatics Analyst,Alignerr,,2026-05-11,https://www.linkedin.com/jobs/view/4412592338 , ,li-4412592338,contract,,,,,,True,entry level,Engineering and Information Technology,,,"Technology, Information and Internet",https://www.linkedin.com/company/alignerr,,,,,,,,,,,
linkedin,(Junior) Cloud Data Engineer (all genders),DYMATRIX,"Karlsruhe, Baden-Württemberg, Germany",2026-05-11,https://www.linkedin.com/jobs/view/4412655527 , ,li-4412655527,fulltime,,,,,,False,entry level,Information Technology,,,Software Development,https://de.linkedin.com/company/dymatrix,,,,,,,,,,,
linkedin,AI Research Engineer,Oxygen Digital,"Düsseldorf, North Rhine-Westphalia, Germany",2026-05-11,https://www.linkedin.com/jobs/view/4413092534 , ,li-4413092534,fulltime,,,,,,False,mid-senior level,Engineering and Research,,,Robotics Engineering,https://uk.linkedin.com/company/oxygendigital,,,,,,,,,,,
linkedin,Digital Business Consultant (m/f/x),Virtual Identity,"Munich, Bavaria, Germany",2026-05-11,https://www.linkedin.com/jobs/view/4412761513 , ,li-4412761513,fulltime,,,,,,False,associate,Consulting,,,IT Services and IT Consulting,https://de.linkedin.com/company/virtual-identity,,,,,,,,,,,
linkedin,Mid-Level Backend Software Engineer (f/m/d),IMTF - Excellence in RegTech Solutions,"Bensheim, Hesse, Germany",2026-05-11,https://www.linkedin.com/jobs/view/4412785927 , ,li-4412785927,fulltime,,,,,,False,mid-senior level,Other,,,IT Services and IT Consulting,https://ch.linkedin.com/company/imtf,,,,,,,,,,,
linkedin,Praktikant Data Analytics & KI im Produktionsumfeld (w/m/x),BMW Group,"Munich, Bavaria, Germany",2026-05-11,https://www.linkedin.com/jobs/view/4401624100 , ,li-4401624100,fulltime,,,,,,False,internship,"Research, Analyst, and Information Technology",,,Motor Vehicle Manufacturing,https://de.linkedin.com/company/bmw-group,,,,,,,,,,,
linkedin,AI Business Consultant,HDI Group,"Hannover, Lower Saxony, Germany",2026-05-11,https://www.linkedin.com/jobs/view/4413111214 , ,li-4413111214,fulltime,,,,,,False,mid-senior level,"Consulting, Information Technology, and Sales",,,Insurance,https://de.linkedin.com/company/hdigroup,,,,,,,,,,,
linkedin,QA Test Engineer (f/m/d),FICO TONBELLER,"Berlin, Berlin, Germany",2026-05-11,https://www.linkedin.com/jobs/view/4413430220 , ,li-4413430220,fulltime,,,,,,False,mid-senior level,Quality Assurance,,,IT Services and IT Consulting,https://de.linkedin.com/company/tonbeller-ag,,,,,,,,,,,
linkedin,Imitation Learning Researcher (m/f/d),Sereact,"Stuttgart, Baden-Württemberg, Germany",2026-05-11,https://www.linkedin.com/jobs/view/4412739589 , ,li-4412739589,fulltime,,,,,,True,mid-senior level,Human Resources,,,Software Development,https://de.linkedin.com/company/sereact,,,,,,,,,,,
linkedin,Full-time Backend Developer (f/m/d),VAARHAFT,"Hamburg, Hamburg, Germany",2026-05-11,https://www.linkedin.com/jobs/view/4412923127 , ,li-4412923127,fulltime,,,,,,True,associate,Information Technology,,,Software Development,https://de.linkedin.com/company/vaarhaft,,,,,,,,,,,
linkedin,Leitung Künstliche Intelligenz & Serviceentwicklung (m/w/d),Stiftung Kirchliches Rechenzentrum Südwestdeutschland,"Eggenstein, Baden-Württemberg, Germany",2026-05-11,https://www.linkedin.com/jobs/view/4413127570 , ,li-4413127570,fulltime,,,,,,False,mid-senior level,Other,,,IT Services and IT Consulting,https://www.linkedin.com/company/stiftung-kirchliches-rechenzentrum-s%C3%BCdwestdeutschland,,,,,,,,,,,
linkedin,Senior Lead AI Architect,IBM,"Munich, Bavaria, Germany",2026-05-11,https://www.linkedin.com/jobs/view/4395019419 , ,li-4395019419,fulltime,,,,,,False,mid-senior level,"Design, Art/Creative, and Information Technology",,,IT Services and IT Consulting,https://www.linkedin.com/company/ibm,,,,,,,,,,,
linkedin,Senior Consultant Gen AI / Generative KI (m/w/d) in Hannover,Deloitte,"Hannover, Lower Saxony, Germany",2026-05-11,https://www.linkedin.com/jobs/view/4243065208 , ,li-4243065208,fulltime,,,,,,True,associate,"Consulting, Information Technology, and Sales",,career@deloitte.de,Business Consulting and Services,https://www.linkedin.com/company/deloitte,,,,,,,,,,,
linkedin,KI-Experte (w/m/d) in freier Mitarbeit,BR - Bayerischer Rundfunk,"Munich, Bavaria, Germany",2026-05-11,https://www.linkedin.com/jobs/view/4412759815 , ,li-4412759815,temporary,,,,,,False,associate,Project Management,,,Broadcast Media Production and Distribution,https://de.linkedin.com/company/br-bayerischer-rundfunk,,,,,,,,,,,
linkedin,Senior Lead AI Architect,IBM,"Ehningen, Baden-Württemberg, Germany",2026-05-11,https://www.linkedin.com/jobs/view/4395026242 , ,li-4395026242,fulltime,,,,,,False,mid-senior level,"Design, Art/Creative, and Information Technology",,,IT Services and IT Consulting,https://www.linkedin.com/company/ibm,,,,,,,,,,,
linkedin,Senior AI Builder (w/m/d),H&Z.digital,,2026-05-11,https://www.linkedin.com/jobs/view/4412771946 , ,li-4412771946,fulltime,,,,,,False,mid-senior level,Information Technology and Consulting,,,IT Services and IT Consulting,https://de.linkedin.com/company/hz-digital,,,,,,,,,,,
linkedin,Founder's Associate,CEF.AI,"Berlin, Berlin, Germany",2026-05-11,https://www.linkedin.com/jobs/view/4410141111 , ,li-4410141111,fulltime,,,,,,False,associate,Other,,,Software Development,https://www.linkedin.com/company/cef-ai,,,,,,,,,,,
linkedin,Data Scientist (F/M/X),Acuity Analytics,"Munich, Bavaria, Germany",2026-05-11,https://www.linkedin.com/jobs/view/4413054730 , ,li-4413054730,fulltime,,,,,,False,associate,Project Management,,,IT Services and IT Consulting,https://uk.linkedin.com/company/acuityanalytics,,,,,,,,,,,
linkedin,Product Marketing Manager (Enterprise),Jobgether,,2026-05-11,https://www.linkedin.com/jobs/view/4412726807 , ,li-4412726807,fulltime,,,,,,True,mid-senior level,Marketing and Sales,,,Internet Marketplace Platforms,https://be.linkedin.com/company/jobgether,,,,,,,,,,,
linkedin,Principal Data Scientist - Vendor Recommendations & AI,Delivery Hero,"Berlin, Berlin, Germany",2026-05-11,https://www.linkedin.com/jobs/view/4412922497 , ,li-4412922497,fulltime,,,,,,False,mid-senior level,Information Technology,,inclusion@deliveryhero.com,Software Development and IT Services and IT Consulting,https://de.linkedin.com/company/delivery-hero-se,,,,,,,,,,,
linkedin,Notion User/Specialist - Remote,YO IT Consulting,"Berlin, Berlin, Germany",2026-05-11,https://www.linkedin.com/jobs/view/4412584944 , ,li-4412584944,fulltime,,,,,,True,entry level,Other,,,Software Development,https://ae.linkedin.com/company/yohritconsulting,,,,,,,,,,,
linkedin,Product Analyst (f/m/x),Jobgether,,2026-05-11,https://www.linkedin.com/jobs/view/4412597635 , ,li-4412597635,fulltime,,,,,,True,associate,"Research, Analyst, and Information Technology",,,Internet Marketplace Platforms,https://be.linkedin.com/company/jobgether,,,,,,,,,,,
linkedin,Mathematics & Python Expert - Freelance AI Trainer,Mindrift,"Munich, Bavaria, Germany",2026-05-11,https://www.linkedin.com/jobs/view/4412726163 , ,li-4412726163,parttime,,,,,,False,entry level,Other,,,IT Services and IT Consulting,https://www.linkedin.com/company/mindrift-ai,,,,,,,,,,,
linkedin,AI Engineer (m/w/d) - Fokus auf smarte Produktlösungen,eClear | borderfree,"Berlin, Berlin, Germany",2026-05-11,https://www.linkedin.com/jobs/view/4413033463 , ,li-4413033463,fulltime,,,,,,False,associate,Information Technology,,,Software Development,https://de.linkedin.com/company/eclear-ag,,,,,,,,,,,
