site,title,company,location,date_posted,job_url,job_url_direct,id,job_type,salary_source,interval,min_amount,max_amount,currency,is_remote,job_level,job_function,listing_type,emails,company_industry,company_url,company_url_direct,company_addresses,company_num_employees,company_revenue,company_description,skills,experience_range,company_rating,company_reviews_count,vacancy_count,work_from_home_type
linkedin,AI & Data Science Intern: Research-Led Innovation (Remote-First),FlavorScale,"Berlin, Berlin, Germany",2026-05-13,https://www.linkedin.com/jobs/view/4413932434 , ,li-4413932434,internship,,,,,,True,internship,"Project Management, Marketing, and General Business",,,"Hospitality, Marketing Services, and Advertising Services",https://nl.linkedin.com/company/flavorscale,,,,,,,,,,,
linkedin,Praktikum - Large Language Models & Machine Learning für Automotive-Anwendungen (w/m/d),AUDI AG,"Ingolstadt, Bavaria, Germany",2026-05-13,https://www.linkedin.com/jobs/view/4410616356 , ,li-4410616356,fulltime,,,,,,False,internship,Education and Training,,,Motor Vehicle Manufacturing,https://de.linkedin.com/company/audi-ag,,,,,,,,,,,
linkedin,Bell Labs AI/ML PhD Intern,Nokia Bell Labs,"Stuttgart, Baden-Württemberg, Germany",2026-05-13,https://www.linkedin.com/jobs/view/4364746263 , ,li-4364746263,fulltime,,,,,,False,not applicable,"Research, Analyst, and Information Technology",,,IT Services and IT Consulting and Telecommunications,https://www.linkedin.com/company/nokiabelllabs,,,,,,,,,,,
linkedin,Internship in Machine Learning Research (f/m/x),ZEISS Group,"Oberkochen, Baden-Württemberg, Germany",2026-05-13,https://www.linkedin.com/jobs/view/4413922947 , ,li-4413922947,fulltime,,,,,,False,internship,"Research, Other, and Information Technology",,,"Manufacturing and Appliances, Electrical, and Electronics Manufacturing",https://de.linkedin.com/company/zeiss,,,,,,,,,,,
linkedin,Working Student (f/m/d) - Tax & Accounting AI-driven Strategy & Transformation,SAP,"Walldorf, Baden-Württemberg, Germany",2026-05-13,https://www.linkedin.com/jobs/view/4403985311 , ,li-4403985311,internship,,,,,,False,not applicable,Finance and Accounting/Auditing,,Careers@sap.com,"Software Development, IT Services and IT Consulting, and Business Consulting and Services",https://de.linkedin.com/company/sap,,,,,,,,,,,
linkedin,VR Robot Teleoperator - Working Student (No Technical Background Needed),Poke & Wiggle,"Munich, Bavaria, Germany",2026-05-13,https://www.linkedin.com/jobs/view/4414126947 , ,li-4414126947,parttime,,,,,,False,entry level,Other,,,"Technology, Information and Media",https://de.linkedin.com/company/poke-and-wiggle,,,,,,,,,,,
linkedin,Training Content & Multimedia Intern @ AI Startup (Full-time),Akdo (prev. Empacto),,2026-05-13,https://www.linkedin.com/jobs/view/4410612901 , ,li-4410612901,internship,,,,,,True,internship,Other,,,IT Services and IT Consulting,https://de.linkedin.com/company/akdo-ai,,,,,,,,,,,
linkedin,Werkstudent (m/w/d) Softwareentwicklung  - Python,E.ON Grid Solutions,"Landshut, Bavaria, Germany",2026-05-12,https://www.linkedin.com/jobs/view/4410197026 , ,li-4410197026,parttime,,,,,,False,internship,Information Technology,,,Utilities,https://de.linkedin.com/company/eon-grid-solutions,,,,,,,,,,,
linkedin,Werkstudent (m/w/d) Softwareentwicklung  - Python,E.ON Grid Solutions,"Bayreuth, Bavaria, Germany",2026-05-12,https://www.linkedin.com/jobs/view/4410186766 , ,li-4410186766,parttime,,,,,,False,internship,Information Technology,,,Utilities,https://de.linkedin.com/company/eon-grid-solutions,,,,,,,,,,,
linkedin,Werkstudent Performance Marketing,Hey Marly,"Cologne, North Rhine-Westphalia, Germany",2026-05-12,https://www.linkedin.com/jobs/view/4410173695 , ,li-4410173695,parttime,,,,,,False,internship,Marketing,,,Retail Apparel and Fashion,https://de.linkedin.com/company/heymarly,,,,,,,,,,,
linkedin,Intern Leadership Development & Engagement (all genders),Beiersdorf,"Hamburg, Hamburg, Germany",2026-05-12,https://www.linkedin.com/jobs/view/4413462896 , ,li-4413462896,fulltime,,,,,,False,internship,Education and Training,,_rc@beiersdorf.com,Personal Care Product Manufacturing,https://de.linkedin.com/company/beiersdorf,,,,,,,,,,,
linkedin,Data Analyst Training and Internship,Ededge Groups,"Berlin, Germany",2026-05-12,https://www.linkedin.com/jobs/view/4413572117 , ,li-4413572117,internship,,,,,,True,internship,Production and Strategy/Planning,,,IT System Data Services and IT System Training and Support,https://in.linkedin.com/company/ededgegroups,,,,,,,,,,,
linkedin,Intern AI-based Memory and Context Engineering (f/m/x),BMW Group,"Munich, Bavaria, Germany",2026-05-12,https://www.linkedin.com/jobs/view/4410153252 , ,li-4410153252,internship,,,,,,False,internship,Engineering and Information Technology,,,Motor Vehicle Manufacturing,https://de.linkedin.com/company/bmw-group,,,,,,,,,,,
linkedin,Working Student (f/m/d) Global Retrofits,Siemens Gamesa,"Hamburg, Hamburg, Germany",2026-05-12,https://www.linkedin.com/jobs/view/4413596677 , ,li-4413596677,parttime,,,,,,False,internship,Administrative,,,"Appliances, Electrical, and Electronics Manufacturing",https://es.linkedin.com/company/siemensgamesa,,,,,,,,,,,
linkedin,Werkstudent Data Science und KI Tool Entwicklung für Qualitätsanalyse (w/m/x),BMW Group,"Munich, Bavaria, Germany",2026-05-12,https://www.linkedin.com/jobs/view/4410195524 , ,li-4410195524,internship,,,,,,False,internship,Engineering and Information Technology,,,Motor Vehicle Manufacturing,https://de.linkedin.com/company/bmw-group,,,,,,,,,,,
linkedin,Praktikum Absicherung Infotainment & Connect,Porsche AG,"Weissach, Baden-Württemberg, Germany",2026-05-12,https://www.linkedin.com/jobs/view/4401904904 , ,li-4401904904,fulltime,,,,,,False,entry level,Education and Training,,,Motor Vehicle Manufacturing,https://de.linkedin.com/company/porsche-ag,,,,,,,,,,,
linkedin,Working Student (f/m/d) for Analytics and Modeling for PEM Electrolyzers,Siemens Energy,"Frankfurt am Main, Hesse, Germany",2026-05-12,https://www.linkedin.com/jobs/view/4413588959 , ,li-4413588959,parttime,,,,,,False,internship,Administrative,,,"Appliances, Electrical, and Electronics Manufacturing",https://www.linkedin.com/company/siemens-energy,,,,,,,,,,,
linkedin,Werkstudent (m/w/d) Softwareentwicklung  - Python,E.ON Grid Solutions,"Essen, North Rhine-Westphalia, Germany",2026-05-12,https://www.linkedin.com/jobs/view/4410195708 , ,li-4410195708,parttime,,,,,,False,internship,Information Technology,,,Utilities,https://de.linkedin.com/company/eon-grid-solutions,,,,,,,,,,,
linkedin,AI Engineering Internship (m/w/d),Cheil Germany GmbH,"Eschborn, Hesse, Germany",2026-05-12,https://www.linkedin.com/jobs/view/4410150918 , ,li-4410150918,fulltime,,,,,,True,internship,Other,,,Software Development,https://de.linkedin.com/company/cheil-germany,,,,,,,,,,,
linkedin,Working Student/Intern Full Stack Developer (m/f/d),Allianz Technology,"Unterföhring, Bavaria, Germany",2026-05-12,https://www.linkedin.com/jobs/view/4413448009 , ,li-4413448009,parttime,,,,,,False,internship,Engineering and Information Technology,,,Financial Services and Insurance,https://de.linkedin.com/company/allianz-technology,,,,,,,,,,,
linkedin,Internship as a junior developer for AI-supported development,T-Systems International,"Berlin, Berlin, Germany",2026-05-11,https://www.linkedin.com/jobs/view/4412915498 , ,li-4412915498,internship,,,,,,False,internship,Education and Training,,,Telecommunications,https://de.linkedin.com/company/t-systems,,,,,,,,,,,
linkedin,Intern Physical AI - Imitation Learning (f/m/x),BMW Group,"Munich, Bavaria, Germany",2026-05-11,https://www.linkedin.com/jobs/view/4413067132 , ,li-4413067132,internship,,,,,,False,internship,Education and Training,,,Motor Vehicle Manufacturing,https://de.linkedin.com/company/bmw-group,,,,,,,,,,,
linkedin,Intern - Drug Substance Digital Process Chemistry (all genders),Bayer,"Wuppertal, North Rhine-Westphalia, Germany",2026-05-11,https://www.linkedin.com/jobs/view/4304935050 , ,li-4304935050,fulltime,,,,,,False,internship,"Research, Analyst, and Information Technology",,,"Chemical Manufacturing, Pharmaceutical Manufacturing, and Biotechnology Research",https://de.linkedin.com/company/bayer,,,,,,,,,,,
linkedin,Working Student for Reporting & Analytics Services (f/m/d),Allianz Global Investors,"Frankfurt, Hesse, Germany",2026-05-11,https://www.linkedin.com/jobs/view/4413122230 , ,li-4413122230,parttime,,,,,,False,internship,Education and Training,,recruiting@allianzgi.com,Financial Services and Insurance,https://www.linkedin.com/company/allianz-global-investors,,,,,,,,,,,
linkedin,Praktikum Risk Management – Quantitatives Risikomanagement,Porsche Financial Services GmbH,"Bietigheim-Bissingen, Baden-Württemberg, Germany",2026-05-11,https://www.linkedin.com/jobs/view/4412684436 , ,li-4412684436,fulltime,,,,,,False,internship,Finance and Sales,,,Financial Services,https://de.linkedin.com/company/porsche-financial-services-gmbh,,,,,,,,,,,
linkedin,Working Student Digital Operations d/f/m,RWE,"Essen, North Rhine-Westphalia, Germany",2026-05-11,https://www.linkedin.com/jobs/view/4412903168 , ,li-4412903168,parttime,,,,,,True,internship,Education and Training,,ebru.merdivan@rwe.com,Utilities,https://de.linkedin.com/company/rwe-,,,,,,,,,,,
linkedin,Internship as a junior developer for AI-supported development,T-Systems International,"Hamburg, Hamburg, Germany",2026-05-11,https://www.linkedin.com/jobs/view/4412924302 , ,li-4412924302,internship,,,,,,False,internship,Education and Training,,,Telecommunications,https://de.linkedin.com/company/t-systems,,,,,,,,,,,
linkedin,Student masterthesis (f/m/x) - Robustness analysis of the tumbling motion of a satellite,German Aerospace Center (DLR),"Oberpfaffenhofen, Bavaria, Germany",2026-05-11,https://www.linkedin.com/jobs/view/4411697315 , ,li-4411697315,fulltime,,,,,,False,entry level,Education and Training,,,Research Services,https://de.linkedin.com/company/dlr,,,,,,,,,,,
linkedin,Intern (m/f/d) Market Insights & Analytics 1,C&A,"Düsseldorf, North Rhine-Westphalia, Germany",2026-05-11,https://www.linkedin.com/jobs/view/4412780811 , ,li-4412780811,volunteer,,,,,,False,internship,"Research, Analyst, and Information Technology",,,Retail Apparel and Fashion,https://de.linkedin.com/company/c&a,,,,,,,,,,,
linkedin,Werkstudent*in AI Machine Learning,Fraunhofer Heinrich Hertz Institute HHI,"Berlin, Berlin, Germany",2026-05-10,https://www.linkedin.com/jobs/view/4408673012 , ,li-4408673012,fulltime,,,,,,False,internship,Administrative,,,Research Services,https://de.linkedin.com/company/fraunhofer-hhi,,,,,,,,,,,
linkedin,Working Student – GenAI / LLM Evaluation – Agentic AI / NLP (f/m/d),Cinemo,"Karlsruhe, Baden-Württemberg, Germany",2026-05-09,https://www.linkedin.com/jobs/view/4412438853 , ,li-4412438853,parttime,,,,,,False,entry level,Information Technology,,,IT Services and IT Consulting,https://de.linkedin.com/company/cinemo,,,,,,,,,,,
linkedin,Abschlussarbeit Strukturoptimierung / Generatives Design (KI) (w/m/d),Volkswagen Group,"Brunswick, Lower Saxony, Germany",2026-05-09,https://www.linkedin.com/jobs/view/4362016505 , ,li-4362016505,fulltime,,,,,,False,internship,Research,,,Motor Vehicle Manufacturing,https://de.linkedin.com/company/volkswagen-group,,,,,,,,,,,
linkedin,Applied AI Engineering Intern (m/f/d),GE Aerospace,"Bavaria, Germany",2026-05-08,https://www.linkedin.com/jobs/view/4411734615 , ,li-4411734615,fulltime,,,,,,True,internship,Engineering and Information Technology,,,Aviation and Aerospace Component Manufacturing,https://www.linkedin.com/company/geaerospace,,,,,,,,,,,
linkedin,IT & Artificial Intelligence Internship,Deutsche Telekom,"Bonn, North Rhine-Westphalia, Germany",2026-05-08,https://www.linkedin.com/jobs/view/4412406079 , ,li-4412406079,internship,,,,,,False,internship,Information Technology,,,Telecommunications,https://de.linkedin.com/company/telekom,,,,,,,,,,,
linkedin,AI Engineering Intern,SANOVIO,"Munich, Bavaria, Germany",2026-05-08,https://www.linkedin.com/jobs/view/4409677381 , ,li-4409677381,internship,,,,,,False,internship,Information Technology,,,Software Development,https://de.linkedin.com/company/sanovio,,,,,,,,,,,
linkedin,Praktikum/Abschlussarbeit (m/w/d) im Bereich Nachhaltigkeit,MGRP,"Frankfurt, Hesse, Germany",2026-05-08,https://www.linkedin.com/jobs/view/4409689806 , ,li-4409689806,internship,,,,,,False,internship,Consulting,,,Professional Services,https://de.linkedin.com/company/mg-rp,,,,,,,,,,,
linkedin,Working student (m/f/d) Environmental Sustainability Decarbonization,TUI,"Langenhagen, Lower Saxony, Germany",2026-05-08,https://www.linkedin.com/jobs/view/4411869433 , ,li-4411869433,parttime,,,,,,True,internship,Administrative,,,Hospitality,https://de.linkedin.com/company/tuigroup,,,,,,,,,,,
linkedin,Werkstudent:in Tech SEO (w/m/d),projx GmbH,"Munich, Bavaria, Germany",2026-05-08,https://www.linkedin.com/jobs/view/4411881680 , ,li-4411881680,fulltime,,,,,,True,entry level,Marketing,,,Advertising Services,https://de.linkedin.com/company/projx-gmbh,,,,,,,,,,,
linkedin,Working Student / Internship - Data Analysis & Test Planning,De Nora,"Niederrodenbach, Hesse, Germany",2026-05-08,https://www.linkedin.com/jobs/view/4403409721 , ,li-4403409721,fulltime,,,,,,False,internship,Information Technology,,,Industrial Machinery Manufacturing,https://it.linkedin.com/company/de-nora,,,,,,,,,,,
linkedin,"Internship (d/f/m) in Satellite Operations and Failure Detection, Isolation and Recovery (FDIR)",Airbus Defence and Space,"Immenstaad am Bodensee, Baden-Württemberg, Germany",2026-05-08,https://www.linkedin.com/jobs/view/4400470728 , ,li-4400470728,volunteer,,,,,,False,internship,Management and Manufacturing,,emsom@airbus.com,Defense and Space Manufacturing,https://www.linkedin.com/company/airbus-defence-and-space,,,,,,,,,,,
linkedin,Working Student Robotic Software Development (m/w/d),Alpine Eagle,"Karlsruhe, Baden-Württemberg, Germany",,https://www.linkedin.com/jobs/view/4373988992 , ,li-4373988992,fulltime,,,,,,False,not applicable,Engineering,,,Software Development,https://de.linkedin.com/company/alpineeagle,,,,,,,,,,,
linkedin,Werkstudent:in AI Engineering (w/m/d),Westernacher Solutions,"Heidelberg, Baden-Württemberg, Germany",,https://www.linkedin.com/jobs/view/4392648029 , ,li-4392648029,parttime,,,,,,True,internship,"Sales, General Business, and Education",,bewerbung@westernacher.com,"Wireless Services, Telecommunications, and Communications Equipment Manufacturing",https://de.linkedin.com/company/westernacher-solutions,,,,,,,,,,,
linkedin,Founding Engineer Intern (AI start-up from hackerhouses in Latam),Clera,"Munich, Bavaria, Germany",,https://www.linkedin.com/jobs/view/4410679414 , ,li-4410679414,internship,,,,,,False,internship,Engineering,,,Software Development,https://www.linkedin.com/company/getclera,,,,,,,,,,,
linkedin,Working Student - AI Prototyping & Content Coaching (m/f/d),Allianz Technology,"Unterföhring, Bavaria, Germany",,https://www.linkedin.com/jobs/view/4414239236 , ,li-4414239236,parttime,,,,,,False,internship,Other,,,Financial Services and Insurance,https://de.linkedin.com/company/allianz-technology,,,,,,,,,,,
linkedin,Student Assistant Measuring Success,WHH Uganda - Welthungerhilfe,"Bonn, North Rhine-Westphalia, Germany",,https://www.linkedin.com/jobs/view/4414600668 , ,li-4414600668,fulltime,,,,,,False,entry level,Administrative,,,Non-profit Organizations,https://ug.linkedin.com/company/welthungerhilfe-whh-uganda,,,,,,,,,,,
linkedin,"Intern Digital Method Development and Data Engineering (all genders)
            
                
                    Neu",MTU Aero Engines,"Munich, Bavaria, Germany",,https://www.linkedin.com/jobs/view/4413406214 , ,li-4413406214,internship,,,,,,False,internship,"Design, Art/Creative, and Information Technology",,,Aviation and Aerospace Component Manufacturing,https://de.linkedin.com/company/mtu-aero-engines,,,,,,,,,,,
linkedin,Intern Automation Engineering (m/f/d),tesa,"Hamburg, Germany",,https://www.linkedin.com/jobs/view/4360998813 , ,li-4360998813,fulltime,,,,,,False,internship,Engineering and Information Technology,,,Chemical Manufacturing,https://de.linkedin.com/company/tesa,,,,,,,,,,,
