site,title,company,location,date_posted,job_url,job_url_direct,id,job_type,salary_source,interval,min_amount,max_amount,currency,is_remote,job_level,job_function,listing_type,emails,company_industry,company_url,company_url_direct,company_addresses,company_num_employees,company_revenue,company_description,skills,experience_range,company_rating,company_reviews_count,vacancy_count,work_from_home_type
linkedin,Data Engineer Intern (Mandatory/Pflichtpraktikum) (w/m/d),Novo AI,"Hannover, Lower Saxony, Germany",2026-06-21,https://www.linkedin.com/jobs/view/4428581362 , ,li-4428581362,internship,,,,,,False,internship,Information Technology,,,Software Development,https://de.linkedin.com/company/novo-ai,,,,,,,,,,,
linkedin,Werkstudent Vertrieb / Marketing für KI und Datenplattformen (M/W/D),Ailio GmbH,"Bielefeld, North Rhine-Westphalia, Germany",2026-06-20,https://www.linkedin.com/jobs/view/4428536662 , ,li-4428536662,fulltime,,,,,,True,entry level,Sales,,,Software Development,https://de.linkedin.com/company/ailio,,,,,,,,,,,
linkedin,Internship Data Science,Henkel,"Düsseldorf, North Rhine-Westphalia, Germany",2026-06-20,https://www.linkedin.com/jobs/view/4431189172 , ,li-4431189172,fulltime,,,,,,False,internship,Information Technology,,,Chemical Manufacturing and Manufacturing,https://de.linkedin.com/company/henkel,,,,,,,,,,,
linkedin,Intern - Market Analytics & Pricing (f/m/d),Deutsche Börse Group,"Frankfurt, Hesse, Germany",2026-06-19,https://www.linkedin.com/jobs/view/4429660397 , ,li-4429660397,fulltime,,,,,,False,not applicable,"Research, Analyst, and Information Technology",,,Financial Services,https://de.linkedin.com/company/deutscheboersegroup,,,,,,,,,,,
linkedin,Werkstudent im Bereich Datenanalyse und Reporting (m/w/d),MYNE,"Berlin, Berlin, Germany",2026-06-19,https://www.linkedin.com/jobs/view/4419926987 , ,li-4419926987,internship,,,,,,False,internship,Administrative,,,Real Estate,https://de.linkedin.com/company/mynehomes,,,,,,,,,,,
linkedin,Werkstudent Data & Demo Environment (m/w/d),Disy Informationssysteme GmbH,"Karlsruhe, Baden-Württemberg, Germany",2026-06-19,https://www.linkedin.com/jobs/view/4427547363 , ,li-4427547363,internship,,,,,,False,internship,Information Technology,,,Manufacturing,https://de.linkedin.com/company/disy,,,,,,,,,,,
linkedin,Praktikum im Bereich AI Engineering,AUMOVIO,"Ingolstadt, Bavaria, Germany",2026-06-19,https://www.linkedin.com/jobs/view/4430980051 , ,li-4430980051,fulltime,,,,,,False,internship,Engineering,,,Automotive,https://de.linkedin.com/company/aumovio,,,,,,,,,,,
linkedin,Sales Data Analytics Intern (m/f/x),DHL,"Bonn, North Rhine-Westphalia, Germany",2026-06-19,https://www.linkedin.com/jobs/view/4430978113 , ,li-4430978113,fulltime,,,,,,False,internship,Sales and Business Development,,,"Transportation, Logistics, Supply Chain and Storage",https://de.linkedin.com/company/dhl,,,,,,,,,,,
linkedin,Pflichtpraktikum in der KI-basierten Führungskräfteentwicklung,Bosch,"Gerlingen, Baden-Württemberg, Germany",2026-06-19,https://www.linkedin.com/jobs/view/4429650268 , ,li-4429650268,fulltime,,,,,,False,internship,Human Resources,,,Automotive,https://de.linkedin.com/company/bosch,,,,,,,,,,,
linkedin,Intern / Working Student – Business & Data Support (f/m/d),Renesas Electronics,"Dresden, Saxony, Germany",2026-06-19,https://www.linkedin.com/jobs/view/4430900482 , ,li-4430900482,fulltime,,,,,,True,not applicable,Manufacturing,,,Semiconductor Manufacturing,https://jp.linkedin.com/company/renesas,,,,,,,,,,,
linkedin,Werkstudent AI Engineer (m/w/d),estateanfrage.de,"Munich, Bavaria, Germany",2026-06-19,https://www.linkedin.com/jobs/view/4428216826 , ,li-4428216826,parttime,,,,,,False,internship,Information Technology,,,Real Estate and Equipment Rental Services,https://de.linkedin.com/company/estateanfrage-de,,,,,,,,,,,
linkedin,Working Student Software Engineering Python (all genders),Avelios Medical,"Munich, Bavaria, Germany",2026-06-19,https://www.linkedin.com/jobs/view/4366639059 , ,li-4366639059,fulltime,,,,,,False,internship,Education and Training,,,Software Development,https://de.linkedin.com/company/avelios-medical,,,,,,,,,,,
linkedin,AI Engineering Intern (F/M/*),amber,"Cologne, North Rhine-Westphalia, Germany",2026-06-19,https://www.linkedin.com/jobs/view/4431115874 , ,li-4431115874,fulltime,,,,,,False,internship,Engineering and Information Technology,,,IT Services and IT Consulting,https://de.linkedin.com/company/ambersearch,,,,,,,,,,,
linkedin,Praktikant / Werkstudent (m/w/d) KI-Assistent & Wissensqualität,CHECK24 Vergleichsportal GmbH,"Munich, Bavaria, Germany",2026-06-18,https://www.linkedin.com/jobs/view/4430426579 , ,li-4430426579,fulltime,,,,,,False,internship,Other,,,Software Development,https://de.linkedin.com/company/check24-vergleichsportal-gmbh,,,,,,,,,,,
linkedin,Intern Automation Engineering (m/f/d),tesa,"Hamburg, Germany",2026-06-18,https://www.linkedin.com/jobs/view/4360998813 , ,li-4360998813,fulltime,,,,,,False,internship,Engineering and Information Technology,,,Chemical Manufacturing,https://de.linkedin.com/company/tesa,,,,,,,,,,,
linkedin,Working Student (f/m/d) - Machine Vision Marker Design,B. Braun New Ventures,"Freiburg, Baden-Württemberg, Germany",2026-06-18,https://www.linkedin.com/jobs/view/4429340081 , ,li-4429340081,fulltime,,,,,,False,internship,Administrative,,,Medical Equipment Manufacturing,https://de.linkedin.com/company/b-braun-new-ventures,,,,,,,,,,,
linkedin,Abschlussarbeit (m/w/d) im Bereich KI‑gestützte Codegenerierung,Crown Gabelstapler GmbH & Co. KG - Deutschland,"Feldkirchen, Bavaria, Germany",2026-06-18,https://www.linkedin.com/jobs/view/4427848359 , ,li-4427848359,fulltime,,,,,,False,internship,Other,,,Mechanical Or Industrial Engineering,https://de.linkedin.com/company/crown-gabelstapler-gmbh-&-co-kg,,,,,,,,,,,
linkedin,Internship Machine Learning (Synthetic Data Generation) (f/m/x),ZEISS Group,"Munich, Bavaria, Germany",2026-06-18,https://www.linkedin.com/jobs/view/4430437708 , ,li-4430437708,fulltime,,,,,,False,internship,Engineering and Other,,,"Appliances, Electrical, and Electronics Manufacturing",https://de.linkedin.com/company/zeiss,,,,,,,,,,,
linkedin,Software Engineer Intern (Libra - Legal AI Assistant) (m/w/d),Wolters Kluwer,"Berlin, Berlin, Germany",2026-06-18,https://www.linkedin.com/jobs/view/4429301834 , ,li-4429301834,fulltime,,,,,,False,internship,Engineering and Information Technology,,,Software Development,https://nl.linkedin.com/company/wolters-kluwer,,,,,,,,,,,
linkedin,Praktikum Künstliche Intelligenz / Data Science – Medizintechnik,Dräger,"Lübeck, Schleswig-Holstein, Germany",2026-06-18,https://www.linkedin.com/jobs/view/4430437276 , ,li-4430437276,fulltime,,,,,,False,internship,Health Care Provider,,alessa.bode@draeger.com,Manufacturing,https://de.linkedin.com/company/draeger,,,,,,,,,,,
linkedin,AI Product Owner - International Big Data Team (m/w/d),Würth Deutschland,"Künzelsau, Baden-Württemberg, Germany",2026-06-17,https://www.linkedin.com/jobs/view/4386844286 , ,li-4386844286,fulltime,,,,,,False,associate,Product Management and Marketing,,,Wholesale,https://de.linkedin.com/company/wuerth-germany,,,,,,,,,,,
linkedin,Praktikum im Business Development (all genders),VfL Wolfsburg,"Wolfsburg, Lower Saxony, Germany",2026-06-17,https://www.linkedin.com/jobs/view/4380469046 , ,li-4380469046,internship,,,,,,False,internship,"Consulting, Project Management, and Strategy/Planning",,,"Spectator Sports, Sports Teams and Clubs, and Events Services",https://de.linkedin.com/company/vfl-wolfsburg,,,,,,,,,,,
linkedin,Working Student (m/f/d) – Machine Learning & Vehicle Radar Technology,Keysight Technologies,"Brunswick, Lower Saxony, Germany",2026-06-17,https://www.linkedin.com/jobs/view/4427344756 , ,li-4427344756,fulltime,,,,,,False,not applicable,Administrative,,,"Appliances, Electrical, and Electronics Manufacturing",https://www.linkedin.com/company/keysight-technologies,,,,,,,,,,,
linkedin,Internship - Automated Testing & Surgical Navigation Software (f/m/d),B. Braun Group,"Freiburg, Baden-Württemberg, Germany",2026-06-17,https://www.linkedin.com/jobs/view/4427363258 , ,li-4427363258,volunteer,,,,,,False,internship,Quality Assurance,,,Medical Equipment Manufacturing,https://de.linkedin.com/company/bbraun-group,,,,,,,,,,,
linkedin,Internship Start-Up Innovation - Technologies in Emerging Markets,Henkel,"Düsseldorf, North Rhine-Westphalia, Germany",2026-06-17,https://www.linkedin.com/jobs/view/4430136190 , ,li-4430136190,fulltime,,,,,,False,internship,Sales and Business Development,,,Chemical Manufacturing and Manufacturing,https://de.linkedin.com/company/henkel,,,,,,,,,,,
linkedin,Werkstudent Data Science & Machine Learning (m/w/d),Mubea,"Attendorn, North Rhine-Westphalia, Germany",2026-06-16,https://www.linkedin.com/jobs/view/4426841955 , ,li-4426841955,fulltime,,,,,,False,internship,Engineering and Information Technology,,,Motor Vehicle Manufacturing,https://de.linkedin.com/company/mubea,,,,,,,,,,,
linkedin,Working student - AI Workflow Builder,Hawk,"Munich, Bavaria, Germany",2026-06-16,https://www.linkedin.com/jobs/view/4410545954 , ,li-4410545954,parttime,,,,,,False,internship,"General Business, Management, and Business Development",,,Financial Services,https://de.linkedin.com/company/hawk-ai-tech,,,,,,,,,,,
linkedin,Student Worker – Development of smart manufacturing solutions,Makino Europe GmbH,"Aachen, North Rhine-Westphalia, Germany",2026-06-16,https://www.linkedin.com/jobs/view/4427794865 , ,li-4427794865,parttime,,,,,,False,internship,Education and Training,,,Mechanical Or Industrial Engineering,https://de.linkedin.com/company/makino-europe,,,,,,,,,,,
linkedin,Machine Learning Working Student,World,"Munich, Bavaria, Germany",2026-06-16,https://www.linkedin.com/jobs/view/4429573259 , ,li-4429573259,parttime,,,,,,False,internship,Education and Training,,constantin.ingelheim@toolsforhumanity.com,"Technology, Information and Internet",https://www.linkedin.com/company/worldofficial,,,,,,,,,,,
linkedin,Digital Marketing & Analytics Intern,Impossible Cloud,"Hamburg, Hamburg, Germany",2026-06-16,https://www.linkedin.com/jobs/view/4429247821 , ,li-4429247821,fulltime,,,,,,False,not applicable,Marketing and Sales,,,"Business Consulting and Services, IT Services and IT Consulting, and Professional Training and Coaching",https://de.linkedin.com/company/impossiblecloud,,,,,,,,,,,
linkedin,IT Internship or Bachelor/Master Thesis (m/f/d),Procter & Gamble,"Kronberg, Hesse, Germany",2026-06-16,https://www.linkedin.com/jobs/view/4357362947 , ,li-4357362947,fulltime,,,,,,False,not applicable,"Project Management, Design, and Information Technology",,,Manufacturing,https://www.linkedin.com/company/procter-and-gamble,,,,,,,,,,,
linkedin,"2026 Applied Scientist Intern, Amazon University Talent Acquisition",Amazon,"Munich, Bavaria, Germany",2026-06-16,https://www.linkedin.com/jobs/view/4369763629 , ,li-4369763629,fulltime,,,,,,True,not applicable,"Research, Analyst, and Information Technology",,,Software Development,https://www.linkedin.com/company/amazon,,,,,,,,,,,
linkedin,Intern - Intelligent Vehicle Dynamics Controls,Huawei,"Munich, Bavaria, Germany",2026-06-15,https://www.linkedin.com/jobs/view/4427759196 , ,li-4427759196,internship,,,,,,False,internship,Accounting/Auditing and Finance,,,Telecommunications,https://cn.linkedin.com/company/huawei,,,,,,,,,,,
linkedin,Applied AI Engineering Intern (m/f/d),GE Aerospace,"Bavaria, Germany",,https://www.linkedin.com/jobs/view/4431638910 , ,li-4431638910,fulltime,,,,,,True,internship,Engineering and Information Technology,,,Aviation and Aerospace Component Manufacturing,https://www.linkedin.com/company/geaerospace,,,,,,,,,,,
linkedin,Founders Associate Intern / Working Student,Routine Labs,"Berlin, Berlin, Germany",,https://www.linkedin.com/jobs/view/4428908575 , ,li-4428908575,internship,,,,,,False,internship,Other,,,Professional Services,https://de.linkedin.com/company/routine-labs,,,,,,,,,,,
linkedin,O&M Data & Platform Intern,Sungrow Europe,"Munich, Bavaria, Germany",,https://www.linkedin.com/jobs/view/4431662577 , ,li-4431662577,internship,,,,,,False,entry level,Analyst and Consulting,,,Oil and Gas,https://de.linkedin.com/company/sungroweurope,,,,,,,,,,,
linkedin,Cell Can Stamping Process Engineering Internship (m/f/d) - Gigafactory Berlin-Brandenburg,Tesla,"Grünheide, Brandenburg, Germany",,https://www.linkedin.com/jobs/view/4431702819 , ,li-4431702819,internship,,,,,,False,internship,Engineering and Information Technology,,,"Motor Vehicle Manufacturing, Renewable Energy Semiconductor Manufacturing, and Utilities",https://www.linkedin.com/company/tesla-motors,,,,,,,,,,,
