site,title,company,location,date_posted,job_url,job_url_direct,id,job_type,salary_source,interval,min_amount,max_amount,currency,is_remote,job_level,job_function,listing_type,emails,company_industry,company_url,company_url_direct,company_addresses,company_num_employees,company_revenue,company_description,skills,experience_range,company_rating,company_reviews_count,vacancy_count,work_from_home_type
linkedin,ASIC Analog Layout Engineer (m/f/d),AUMOVIO,"Frankfurt am Main, Hesse, Germany",2026-04-21,https://www.linkedin.com/jobs/view/4404810149 , ,li-4404810149,fulltime,,,,,,False,associate,Engineering and Research,,,Semiconductor Manufacturing and Motor Vehicle Manufacturing,https://de.linkedin.com/company/aumovio,,,,,,,,,,,
linkedin,Engineer for ASIC Development (f/m/d),European XFEL,"Schenefeld, Schleswig-Holstein, Germany",2026-04-21,https://www.linkedin.com/jobs/view/4404538710 , ,li-4404538710,fulltime,,,,,,True,associate,Research,,monica.turcato@xfel.eu,Research Services,https://de.linkedin.com/company/european-xfel,,,,,,,,,,,
linkedin,Dashboard Developer (all gender) 999,ALTEN Germany,"Weeze, North Rhine-Westphalia, Germany",2026-04-21,https://www.linkedin.com/jobs/view/4401946296 , ,li-4401946296,fulltime,,,,,,False,associate,"Engineering, Quality Assurance, and Information Technology",,,"Machinery Manufacturing, Human Resources Services, and IT Services and IT Consulting",https://de.linkedin.com/company/altengermany,,,,,,,,,,,
linkedin,(Senior) ASIC Analog Design Engineer (m/f/d),AUMOVIO,"Frankfurt am Main, Hesse, Germany",2026-04-21,https://www.linkedin.com/jobs/view/4404598677 , ,li-4404598677,fulltime,,,,,,False,associate,Engineering and Research,,,Semiconductor Manufacturing and Motor Vehicle Manufacturing,https://de.linkedin.com/company/aumovio,,,,,,,,,,,
linkedin,Electronics Developer (f/m/d),Agile Robots SE,,2026-04-21,https://www.linkedin.com/jobs/view/4401934159 , ,li-4401934159,fulltime,,,,,,False,associate,Administrative,,,Robotics Engineering and IT System Custom Software Development,https://de.linkedin.com/company/agile-robots-se,,,,,,,,,,,
linkedin,Senior Consultant - HAV (Emulation/FPGA)  - EDA - m/f/d,Siemens EDA (Siemens Digital Industries Software),"Munich, Bavaria, Germany",2026-04-21,https://www.linkedin.com/jobs/view/4374073996 , ,li-4374073996,fulltime,,,,,,True,mid-senior level,"Consulting, Information Technology, and Sales",,-DACH.sisw@siemens.com,Software Development,https://www.linkedin.com/company/siemens-eda,,,,,,,,,,,
linkedin,STRAK Entwickler (all gender),ALTEN Germany,,2026-04-20,https://www.linkedin.com/jobs/view/4389688786 , ,li-4389688786,fulltime,,,,,,False,associate,Engineering,,,Motor Vehicle Manufacturing,https://de.linkedin.com/company/altengermany,,,,,,,,,,,
linkedin,Team Lead Backend Developer (Node.js) - Relocation to Portugal Required,BrainRocket,,2026-04-20,https://www.linkedin.com/jobs/view/4401627494 , ,li-4401627494,fulltime,,,,,,True,mid-senior level,Information Technology,,,Software Development,https://cy.linkedin.com/company/brain-rocket,,,,,,,,,,,
linkedin,Senior Developer Teamsport Footwear,PUMA Group,"Herzogenaurach, Bavaria, Germany",2026-04-20,https://www.linkedin.com/jobs/view/4404351871 , ,li-4404351871,fulltime,,,,,,False,mid-senior level,"Manufacturing, Engineering, and Production",,,Sporting Goods Manufacturing and Retail Apparel and Fashion,https://de.linkedin.com/company/puma,,,,,,,,,,,
linkedin,"Staff Engineer (m/f/d) RF IC circuit design  - Unterschleissheim, Munich",Qualcomm,"Munich, Bavaria, Germany",2026-04-20,https://www.linkedin.com/jobs/view/4403612749 , ,li-4403612749,fulltime,,,,,,False,not applicable,Other,,-accomodations@qualcomm.com,Semiconductor Manufacturing,https://www.linkedin.com/company/qualcomm,,,,,,,,,,,
linkedin,TYPO3-Developer (w/m/d),SCHAFFRATH®,"Geldern, North Rhine-Westphalia, Germany",2026-04-19,https://www.linkedin.com/jobs/view/4403321651 , ,li-4403321651,fulltime,,,,,,False,entry level,Engineering and Information Technology,,,Media Production,https://www.linkedin.com/company/schaffrath-de,,,,,,,,,,,
linkedin,Lead Application Engineer,Cadence,"Feldkirchen, Bavaria, Germany",2026-04-19,https://www.linkedin.com/jobs/view/4363484120 , ,li-4363484120,fulltime,,,,,,False,mid-senior level,Engineering and Information Technology,,,Software Development,https://www.linkedin.com/company/cadence,,,,,,,,,,,
linkedin,"ASIC Digital Design Verification, Staff Engineer",Synopsys Inc,"Munich, Bavaria, Germany",2026-04-18,https://www.linkedin.com/jobs/view/4371897183 , ,li-4371897183,fulltime,,,,,,False,mid-senior level,"Design, Consulting, and Engineering",,,"Semiconductor Manufacturing, Software Development, and Computer Hardware Manufacturing",https://www.linkedin.com/company/synopsys,,,,,,,,,,,
linkedin,Application Architect - SAP HANA Development (m/w/d),IBM,"Frankfurt, Hesse, Germany",2026-04-18,https://www.linkedin.com/jobs/view/4392745607 , ,li-4392745607,fulltime,,,,,,False,mid-senior level,Engineering and Information Technology,,,IT Services and IT Consulting,https://www.linkedin.com/company/ibm,,,,,,,,,,,
linkedin,Entwickler (w/m/d) für Prüfmittel mit Schwerpunkt Prüfsoftwarearchitektur,TRUMPF,"Schramberg, Baden-Württemberg, Germany",2026-04-18,https://www.linkedin.com/jobs/view/4371393409 , ,li-4371393409,fulltime,,,,,,False,entry level,Engineering and Information Technology,,lena.riexinger@trumpf.com,Machinery Manufacturing,https://www.linkedin.com/company/trumpf-se-co-kg,,,,,,,,,,,
linkedin,Webflow-Developer (m/w/d) im Medienhafen Düsseldorf,marketer UX GmbH,"Düsseldorf, North Rhine-Westphalia, Germany",2026-04-18,https://www.linkedin.com/jobs/view/4401223459 , ,li-4401223459,fulltime,,,,,,False,entry level,Information Technology,,,Advertising Services,https://de.linkedin.com/company/marketer-ux,,,,,,,,,,,
linkedin,Staff Software Engineer (R&D Engineering),Synopsys Inc,"Erfurt, Thuringia, Germany",2026-04-18,https://www.linkedin.com/jobs/view/4381486294 , ,li-4381486294,fulltime,,,,,,False,mid-senior level,"Design, Consulting, and Engineering",,,"Semiconductor Manufacturing, Software Development, and Computer Hardware Manufacturing",https://www.linkedin.com/company/synopsys,,,,,,,,,,,
linkedin,DSP ASIC Design Engineer - Optical Transmission Systems,Ciena,,2026-04-18,https://www.linkedin.com/jobs/view/4391707173 , ,li-4391707173,fulltime,,,,,,False,mid-senior level,Engineering and Information Technology,,,Telecommunications,https://www.linkedin.com/company/ciena,,,,,,,,,,,
linkedin,Customer Engineer,Applied Materials Europe,"Dresden, Saxony, Germany",2026-04-18,https://www.linkedin.com/jobs/view/4403850034 , ,li-4403850034,fulltime,,,,,,False,not applicable,Other,,,"Appliances, Electrical, and Electronics Manufacturing, Nanotechnology Research, and Semiconductor Manufacturing",https://nl.linkedin.com/company/applied-materials-europe,,,,,,,,,,,
linkedin,Technical Account Manager - Siemens EDA - f/m/d,Siemens EDA (Siemens Digital Industries Software),"Munich, Bavaria, Germany",2026-04-18,https://www.linkedin.com/jobs/view/4390945788 , ,li-4390945788,fulltime,,,,,,False,mid-senior level,Sales,,,Software Development,https://www.linkedin.com/company/siemens-eda,,,,,,,,,,,
linkedin,Supplier Quality Engineer (m/f/d) - semiconductor industry,Applied Materials Europe,"Heimstetten, Bavaria, Germany",2026-04-17,https://www.linkedin.com/jobs/view/4400836923 , ,li-4400836923,fulltime,,,,,,False,not applicable,Quality Assurance,,,"Appliances, Electrical, and Electronics Manufacturing, Nanotechnology Research, and Semiconductor Manufacturing",https://nl.linkedin.com/company/applied-materials-europe,,,,,,,,,,,
linkedin,Tableau Dashboard Entwickler (all gender),ALTEN Germany,"Weeze, North Rhine-Westphalia, Germany",2026-04-17,https://www.linkedin.com/jobs/view/4387276326 , ,li-4387276326,fulltime,,,,,,False,associate,Information Technology and Engineering,,,Defense and Space Manufacturing,https://de.linkedin.com/company/altengermany,,,,,,,,,,,
linkedin,Developer Softwaresystems Postpress (m/w/d),Heidelberger Druckmaschinen AG,"Wiesloch, Baden-Württemberg, Germany",2026-04-17,https://www.linkedin.com/jobs/view/4369766777 , ,li-4369766777,fulltime,,,,,,False,entry level,Engineering and Information Technology,,,Machinery Manufacturing,https://de.linkedin.com/company/heidelberg,,,,,,,,,,,
linkedin,VIRTIO GPU Device/Driver Developer (m/f/d) - Qualcomm Berlin,Qualcomm,"Berlin, Berlin, Germany",2026-04-17,https://www.linkedin.com/jobs/view/4371131972 , ,li-4371131972,fulltime,,,,,,False,not applicable,Other,,-accomodations@qualcomm.com,Semiconductor Manufacturing,https://www.linkedin.com/company/qualcomm,,,,,,,,,,,
linkedin,Softwareentwickler/Developer (m/w/d),Zweygart Fachhandelsgruppe,"Gärtringen, Baden-Württemberg, Germany",2026-04-17,https://www.linkedin.com/jobs/view/4400835136 , ,li-4400835136,fulltime,,,,,,False,mid-senior level,Information Technology,,,Wholesale Building Materials,https://de.linkedin.com/company/zweygart-fachhandelsgruppe,,,,,,,,,,,
linkedin,Entwickler Systemverkabelung (all gender),ALTEN Germany,"Bremen, Bremen, Germany",2026-04-17,https://www.linkedin.com/jobs/view/4350282045 , ,li-4350282045,fulltime,,,,,,False,associate,Engineering,,,Engineering Services,https://de.linkedin.com/company/altengermany,,,,,,,,,,,
linkedin,Embedded Engineer (Senior),Vyoma,"Munich, Bavaria, Germany",2026-04-17,https://www.linkedin.com/jobs/view/4393805257 , ,li-4393805257,fulltime,,,,,,True,mid-senior level,Engineering,,,Business Consulting and Services,https://de.linkedin.com/company/vyomaspace,,,,,,,,,,,
linkedin,Senior Embedded AI Developer (f/m/x),BMW Group,"Munich, Bavaria, Germany",2026-04-17,https://www.linkedin.com/jobs/view/4391064359 , ,li-4391064359,fulltime,,,,,,False,mid-senior level,Engineering and Information Technology,,,Motor Vehicle Manufacturing,https://de.linkedin.com/company/bmw-group,,,,,,,,,,,
linkedin,ASIC Analog Layout Engineer (m/f/d) - REF5390S,AUMOVIO,"Frankfurt, Hesse, Germany",2026-04-17,https://www.linkedin.com/jobs/view/4403405139 , ,li-4403405139,fulltime,,,,,,False,mid-senior level,Design,,,Automotive,https://de.linkedin.com/company/aumovio,,,,,,,,,,,
linkedin,(Senior) ASIC Analog Design Engineer (m/f/d) - REF5389A,AUMOVIO,"Frankfurt, Hesse, Germany",2026-04-17,https://www.linkedin.com/jobs/view/4403412058 , ,li-4403412058,fulltime,,,,,,False,mid-senior level,Design,,,Automotive,https://de.linkedin.com/company/aumovio,,,,,,,,,,,
linkedin,Staff or Principal Digital ASIC Designer,IC Resources,"Saxony, Germany",2026-04-17,https://www.linkedin.com/jobs/view/4402357243 , ,li-4402357243,fulltime,,,,,,False,mid-senior level,"Design, Art/Creative, and Information Technology",,,Staffing and Recruiting,https://uk.linkedin.com/company/icresources,,,,,,,,,,,
linkedin,PLD/ FPGA-Entwickler Aerospace (m/w/d),Liebherr Aerospace and Transportation,"Lindenberg im Allgäu, Bavaria, Germany",2026-04-17,https://www.linkedin.com/jobs/view/4390954796 , ,li-4390954796,fulltime,,,,,,False,entry level,Engineering and Information Technology,,,Industrial Machinery Manufacturing,https://fr.linkedin.com/company/liebherr-aerospace-and-transportation,,,,,,,,,,,
linkedin,ASIC Analog Design Engineer (m/f/d) - REF5386X,AUMOVIO,"Frankfurt, Hesse, Germany",2026-04-17,https://www.linkedin.com/jobs/view/4403190970 , ,li-4403190970,fulltime,,,,,,False,mid-senior level,Design,,,Automotive,https://de.linkedin.com/company/aumovio,,,,,,,,,,,
linkedin,IC Digital Design Technical Lead,Michael Page,"Munich, Bavaria, Germany",2026-04-17,https://www.linkedin.com/jobs/view/4400802127 , ,li-4400802127,fulltime,,,,,,False,mid-senior level,Manufacturing and Engineering,,,Staffing and Recruiting,https://uk.linkedin.com/company/michael-page,,,,,,,,,,,
linkedin,Senior Optics Engineer (m/f/d),Corning Incorporated,"Berlin, Berlin, Germany",2026-04-16,https://www.linkedin.com/jobs/view/4400469682 , ,li-4400469682,fulltime,,,,,,False,mid-senior level,"Research, Analyst, and Information Technology",,accommodations@corning.com,"Glass, Ceramics and Concrete Manufacturing",https://www.linkedin.com/company/corning-incorporated,,,,,,,,,,,
linkedin,ASIC Digital Design Expert (f/m/div),Bosch,"Dresden, Saxony, Germany",2026-04-16,https://www.linkedin.com/jobs/view/4401871664 , ,li-4401871664,fulltime,,,,,,False,associate,Information Technology,,,Semiconductors,https://de.linkedin.com/company/bosch,,,,,,,,,,,
linkedin,Anwendungsentwickler mit Schwerpunkt Power Platform und RPA,WEVG Salzgitter GmbH & Co. KG,"Salzgitter, Lower Saxony, Germany",2026-04-16,https://www.linkedin.com/jobs/view/4402941514 , ,li-4402941514,fulltime,,,,,,False,entry level,Engineering and Information Technology,,,Utilities,https://de.linkedin.com/company/wevg-salzgitter,,,,,,,,,,,
linkedin,(Senior) Go Developer - Plattform Engineering (m/w/d),Schwarz Digits,"Stadt Heilbronn, Baden-Württemberg, Germany",2026-04-16,https://www.linkedin.com/jobs/view/4402116283 , ,li-4402116283,fulltime,,,,,,False,mid-senior level,Engineering and Information Technology,,,IT Services and IT Consulting,https://de.linkedin.com/company/schwarz-digits,,,,,,,,,,,
linkedin,Developer (ERP) IFS Applications / IFS Cloud™ (w/m/d),DMC Datenverarbeitungs- und Management Consulting GmbH,"Munich, Bavaria, Germany",2026-04-16,https://www.linkedin.com/jobs/view/4402984239 , ,li-4402984239,fulltime,,,,,,False,entry level,Engineering and Information Technology,,,IT Services and IT Consulting,https://de.linkedin.com/company/dmc-datenverarbeitungs-und-management-consulting-gmbh,,,,,,,,,,,
linkedin,Anwendungsentwickler (SAP Entwicklung) (m/w/d),Stadtwerke Düsseldorf,"Düsseldorf, North Rhine-Westphalia, Germany",2026-04-16,https://www.linkedin.com/jobs/view/4402997018 , ,li-4402997018,fulltime,,,,,,False,mid-senior level,Information Technology,,,Utilities,https://de.linkedin.com/company/stadtwerke-duesseldorf,,,,,,,,,,,
linkedin,Anwendungsprogrammierer (m/w/d),Reiser Simulation and Training GmbH,"Berg, Bavaria, Germany",2026-04-16,https://www.linkedin.com/jobs/view/4402945581 , ,li-4402945581,fulltime,,,,,,False,entry level,Information Technology,,,Information Technology & Services,https://de.linkedin.com/company/reiser-simulation-and-training,,,,,,,,,,,
linkedin,Senior Real-Time GPU Developer,Maxon,,2026-04-16,https://www.linkedin.com/jobs/view/4401872573 , ,li-4401872573,fulltime,,,,,,False,mid-senior level,Engineering and Information Technology,,,Software Development,https://de.linkedin.com/company/maxonvfx,,,,,,,,,,,
linkedin,Developer Documentation Writer (all genders),Text Control,"Bremen, Bremen, Germany",2026-04-16,https://www.linkedin.com/jobs/view/4402976332 , ,li-4402976332,fulltime,,,,,,False,entry level,"Marketing, Public Relations, and Writing/Editing",,,Software Development,https://www.linkedin.com/company/tx-text-control,,,,,,,,,,,
linkedin,Lead Mac Developer,Reflow,"Berlin, Berlin, Germany",2026-04-16,https://www.linkedin.com/jobs/view/4403105383 , ,li-4403105383,fulltime,,,,,,False,mid-senior level,Information Technology,,,"Technology, Information and Internet",https://www.linkedin.com/company/reflowai,,,,,,,,,,,
linkedin,Entwickler/in Elektronik FPGA Design (w/m/d),Spectrum Instrumentation,"Großhansdorf, Schleswig-Holstein, Germany",2026-04-16,https://www.linkedin.com/jobs/view/4392895187 , ,li-4392895187,fulltime,,,,,,False,entry level,Engineering,,,Administrative and Support Services,https://de.linkedin.com/company/spectrum-instrumentation,,,,,,,,,,,
linkedin,Field-Programmable Gate Arrays Engineer,Vivid Resourcing,"Munich, Bavaria, Germany",2026-04-16,https://www.linkedin.com/jobs/view/4402913865 , ,li-4402913865,contract,,,,,,False,mid-senior level,Engineering,,,Engineering Services,https://uk.linkedin.com/company/vivid-resourcing-ltd,,,,,,,,,,,
linkedin,FPGA Engineer (m/w/d) Industrial Production Technology (Semiconductors),Amoria Bond,"Freiburg, Baden-Württemberg, Germany",2026-04-16,https://www.linkedin.com/jobs/view/4402953048 , ,li-4402953048,fulltime,,,,,,False,not applicable,Engineering,,,Renewable Energy Semiconductor Manufacturing,https://uk.linkedin.com/company/amoria-bond,,,,,,,,,,,
linkedin,Senior Applications Engineer – Material Information Management (m/f/d),Synopsys Inc,"Otterfing, Bavaria, Germany",2026-04-16,https://www.linkedin.com/jobs/view/4402141649 , ,li-4402141649,fulltime,,,,,,False,mid-senior level,"Design, Consulting, and Engineering",,,"Semiconductor Manufacturing, Software Development, and Computer Hardware Manufacturing",https://www.linkedin.com/company/synopsys,,,,,,,,,,,
linkedin,Director Analog Design (f/m/d),Renesas Electronics,"Munich, Bavaria, Germany",2026-04-16,https://www.linkedin.com/jobs/view/4402957828 , ,li-4402957828,fulltime,,,,,,False,director,Information Technology,,,Semiconductor Manufacturing,https://jp.linkedin.com/company/renesas,,,,,,,,,,,
linkedin,EMC Engineer (f/m/d),NXP Semiconductors,"Munich, Bavaria, Germany",2026-04-15,https://www.linkedin.com/jobs/view/4402531935 , ,li-4402531935,fulltime,,,,,,False,mid-senior level,Engineering and Information Technology,,,"Semiconductor Manufacturing, Computers and Electronics Manufacturing, and Software Development",https://nl.linkedin.com/company/nxp-semiconductors,,,,,,,,,,,
linkedin,Director Analog Design (f/m/d),Renesas Electronics,"Dresden, Saxony, Germany",2026-04-15,https://www.linkedin.com/jobs/view/4364091623 , ,li-4364091623,fulltime,,,,,,True,director,Manufacturing,,,Semiconductors,https://jp.linkedin.com/company/renesas,,,,,,,,,,,
linkedin,Senior Rust Developer,Workato,"Berlin, Berlin, Germany",2026-04-15,https://www.linkedin.com/jobs/view/4402641561 , ,li-4402641561,fulltime,,,,,,True,mid-senior level,Engineering and Information Technology,,,Software Development,https://www.linkedin.com/company/workato,,,,,,,,,,,
linkedin,Senior Rust Developer,Workato,"Munich, Bavaria, Germany",2026-04-15,https://www.linkedin.com/jobs/view/4402648437 , ,li-4402648437,fulltime,,,,,,True,mid-senior level,Engineering and Information Technology,,,Software Development,https://www.linkedin.com/company/workato,,,,,,,,,,,
linkedin,Senior Rust Developer,Workato,"Frankfurt, Hesse, Germany",2026-04-15,https://www.linkedin.com/jobs/view/4402631627 , ,li-4402631627,fulltime,,,,,,True,mid-senior level,Engineering and Information Technology,,,Software Development,https://www.linkedin.com/company/workato,,,,,,,,,,,
linkedin,"Graduate Engineer – Digital Backend (RTL to GDS), Cadence Flow (f/m/d)",Renesas Electronics,"Munich, Bavaria, Germany",,https://www.linkedin.com/jobs/view/4394611301 , ,li-4394611301,fulltime,,,,,,True,associate,Manufacturing,,,Semiconductor Manufacturing,https://jp.linkedin.com/company/renesas,,,,,,,,,,,
linkedin,Senior Analog IC Designer – High speed optical,IC Resources,"Berlin, Berlin, Germany",,https://www.linkedin.com/jobs/view/4404840825 , ,li-4404840825,fulltime,,,,,,True,mid-senior level,Engineering and Information Technology,,,Staffing and Recruiting,https://uk.linkedin.com/company/icresources,,,,,,,,,,,
linkedin,Senior Analog-/Mixed-Signal Design Engineer (f/m/d),GEMESYS,"Bochum, North Rhine-Westphalia, Germany",,https://www.linkedin.com/jobs/view/3389887135 , ,li-3389887135,fulltime,,,,,,True,mid-senior level,,,,Computer Hardware Manufacturing,https://de.linkedin.com/company/gemesys-technologies,,,,,,,,,,,
linkedin,Senior Engineer – Validation and Design,Microchip Technology Inc.,"Dresden, Saxony, Germany",,https://www.linkedin.com/jobs/view/4373803466 , ,li-4373803466,fulltime,,,,,,False,mid-senior level,Engineering,,,"Appliances, Electrical, and Electronics Manufacturing and Semiconductor Manufacturing",https://www.linkedin.com/company/microchip-technology,,,,,,,,,,,
linkedin,"Applications Engineering, Staff Engineer - Lighting (m/f/d)",Ansys,"Ismaning, Bavaria, Germany",,https://www.linkedin.com/jobs/view/4405222194 , ,li-4405222194,fulltime,,,,,,False,not applicable,"Design, Consulting, and Engineering",,,"Semiconductor Manufacturing, Software Development, and Computer Hardware Manufacturing",https://www.linkedin.com/company/ansys-inc,,,,,,,,,,,
linkedin,Customer Operations Engineer (IT-Administration),KLA,,,https://www.linkedin.com/jobs/view/4401975569 , ,li-4401975569,fulltime,,,,,,True,entry level,Other,,talent.acquisition@kla.com,Semiconductor Manufacturing,https://www.linkedin.com/company/klacorp,,,,,,,,,,,
linkedin,Electrical Engineer (m/f/d) - for semiconductor industry,Applied Materials Europe,"Feldkirchen-Westerham, Bavaria, Germany",,https://www.linkedin.com/jobs/view/4402497348 , ,li-4402497348,fulltime,,,,,,False,not applicable,Engineering and Information Technology,,,"Appliances, Electrical, and Electronics Manufacturing, Nanotechnology Research, and Semiconductor Manufacturing",https://nl.linkedin.com/company/applied-materials-europe,,,,,,,,,,,
linkedin,Customer Engineer  - Graduate Program,Applied Materials Europe,"Dresden, Saxony, Germany",,https://www.linkedin.com/jobs/view/4402802252 , ,li-4402802252,fulltime,,,,,,False,not applicable,Other,,,"Appliances, Electrical, and Electronics Manufacturing, Nanotechnology Research, and Semiconductor Manufacturing",https://nl.linkedin.com/company/applied-materials-europe,,,,,,,,,,,
linkedin,Senior DevOps Engineer (m/f/d),KLA,,,https://www.linkedin.com/jobs/view/4401983472 , ,li-4401983472,fulltime,,,,,,False,mid-senior level,Engineering and Information Technology,,talent.acquisition@kla.com,Semiconductor Manufacturing,https://www.linkedin.com/company/klacorp,,,,,,,,,,,
linkedin,FPGA Engineer,agap2 Germany,"Constance, Baden-Württemberg, Germany",,https://www.linkedin.com/jobs/view/4404411250 , ,li-4404411250,fulltime,,,,,,False,entry level,"Consulting, Engineering, and Product Management",,,Business Consulting and Services and Engineering Services,https://de.linkedin.com/company/agap2-germany,,,,,,,,,,,
linkedin,FPGA- & Embedded-Engineer (all gender),ALTEN Germany,,,https://www.linkedin.com/jobs/view/4398216831 , ,li-4398216831,fulltime,,,,,,False,associate,Information Technology,,,IT Services and IT Consulting,https://de.linkedin.com/company/altengermany,,,,,,,,,,,
linkedin,Graduate Developer,Joveo AI,,,https://www.linkedin.com/jobs/view/4405206800 , ,li-4405206800,fulltime,,,,,,True,not applicable,Engineering,,,Software Development,https://www.linkedin.com/company/joveo-ai,,,,,,,,,,,
linkedin,Senior ROS / ROS2 Entwickler – Robotics (all gender),ALTEN Germany,"Mörfelden-Walldorf, Hesse, Germany",,https://www.linkedin.com/jobs/view/4402421997 , ,li-4402421997,fulltime,,,,,,False,associate,Information Technology and Engineering,,,IT Services and IT Consulting and Engineering Services,https://de.linkedin.com/company/altengermany,,,,,,,,,,,
linkedin,Entwickler / Applikationsbetreuer Systemintegration(m/w/d),Universitätsklinikum Erlangen,"Erlangen, Bavaria, Germany",,https://www.linkedin.com/jobs/view/4404261069 , ,li-4404261069,fulltime,,,,,,False,entry level,Information Technology,,,Hospitals and Health Care,https://de.linkedin.com/company/universitatsklinikumerlangen,,,,,,,,,,,
linkedin,Informatiker - Anwendungsentwickler (m/w/d),Kromberg & Schubert,"Abensberg, Bavaria, Germany",,https://www.linkedin.com/jobs/view/4404875045 , ,li-4404875045,fulltime,,,,,,False,entry level,Information Technology,,,Information Technology & Services,https://de.linkedin.com/company/kromberg-schubert-2,,,,,,,,,,,
linkedin,Fachinformatiker Systemintegration als Anwendungsentwickler (m/w/d),DKFZ German Cancer Research Center,"Heidelberg, Baden-Württemberg, Germany",,https://www.linkedin.com/jobs/view/4404871483 , ,li-4404871483,fulltime,,,,,,False,mid-senior level,Information Technology,,,Information Technology & Services,https://de.linkedin.com/school/dkfz-de/,,,,,,,,,,,
linkedin,Mathematiker als Anwendungsentwickler (m/w/d),Marburg University,"Marburg an der Lahn, Hesse, Germany",,https://www.linkedin.com/jobs/view/4404871502 , ,li-4404871502,fulltime,,,,,,False,entry level,Information Technology,,,Information Technology & Services,https://de.linkedin.com/school/philipps-universit-t-marburg/,,,,,,,,,,,
linkedin,Anwendungsentwickler (m/w/d),Reiser Simulation and Training GmbH,"Berg, Bavaria, Germany",,https://www.linkedin.com/jobs/view/4402468276 , ,li-4402468276,fulltime,,,,,,False,mid-senior level,Information Technology,,,Information Technology & Services,https://de.linkedin.com/company/reiser-simulation-and-training,,,,,,,,,,,
linkedin,Prozessverantwortlicher Entwickler (m/w/d),persona service,"Göttingen, Lower Saxony, Germany",,https://www.linkedin.com/jobs/view/4392425292 , ,li-4392425292,fulltime,,,,,,False,mid-senior level,Management and Manufacturing,,nurcan.dastan@persona.de,Staffing and Recruiting,https://de.linkedin.com/company/persona-service,,,,,,,,,,,
