site,title,company,location,date_posted,job_url,job_url_direct,id,job_type,salary_source,interval,min_amount,max_amount,currency,is_remote,job_level,job_function,listing_type,emails,company_industry,company_url,company_url_direct,company_addresses,company_num_employees,company_revenue,company_description,skills,experience_range,company_rating,company_reviews_count,vacancy_count,work_from_home_type
linkedin,Field Application Engineer,Southchip Semiconductor Technology,"Munich, Bavaria, Germany",2026-06-30,https://www.linkedin.com/jobs/view/4434960553 , ,li-4434960553,fulltime,,,,,,False,mid-senior level,Research and Sales,,,Semiconductor Manufacturing,https://cn.linkedin.com/company/%E4%B8%8A%E6%B5%B7%E5%8D%97%E8%8A%AF%E5%8D%8A%E5%AF%BC%E4%BD%93%E7%A7%91%E6%8A%80%E6%9C%89%E9%99%90%E5%85%AC%E5%8F%B8,,,,,,,,,,,
linkedin,Entwickler Hard-/Software (m/w/d),INLIGHT GmbH & Co. KG,"Hünxe, North Rhine-Westphalia, Germany",2026-06-30,https://www.linkedin.com/jobs/view/4435110077 , ,li-4435110077,fulltime,,,,,,False,entry level,Engineering and Information Technology,,,"Appliances, Electrical, and Electronics Manufacturing",https://de.linkedin.com/company/inlight-gmbh-co-kg,,,,,,,,,,,
linkedin,Test & Validation Engineer,Nokia,"Nuremberg, Bavaria, Germany",2026-06-30,https://www.linkedin.com/jobs/view/4405175168 , ,li-4405175168,fulltime,,,,,,False,not applicable,Quality Assurance,,,IT Services and IT Consulting and Telecommunications,https://fi.linkedin.com/company/nokia,,,,,,,,,,,
linkedin,Lead Application Engineer,Cadence,"Feldkirchen, Bavaria, Germany",2026-06-30,https://www.linkedin.com/jobs/view/4414494775 , ,li-4414494775,fulltime,,,,,,False,mid-senior level,Engineering and Information Technology,,,Software Development,https://www.linkedin.com/company/cadence,,,,,,,,,,,
linkedin,(Senior) Development Engineer: Digital Semicustom Design (m/f),Micron Technology,"Munich, Bavaria, Germany",2026-06-30,https://www.linkedin.com/jobs/view/4425229627 , ,li-4425229627,fulltime,,,,,,True,mid-senior level,Other,,"_EMEA@micron.com, _EMEA@micron.com","Computer Hardware Manufacturing, Appliances, Electrical, and Electronics Manufacturing, and Semiconductor Manufacturing",https://www.linkedin.com/company/micron-technology,,,,,,,,,,,
linkedin,Senior Embedded Systems Engineer,Open Ring,"Berlin, Germany",2026-06-30,https://www.linkedin.com/jobs/view/4431901160 , ,li-4431901160,other,,,,,,True,mid-senior level,Engineering and Information Technology,,,"Technology, Information and Internet",https://ee.linkedin.com/company/open-ring,,,,,,,,,,,
linkedin,RESEARCH AND DEVELOPMENT ENGINEER,ROBOVIS,"Berlin, Berlin, Germany",2026-06-30,https://www.linkedin.com/jobs/view/4431576187 , ,li-4431576187,fulltime,,,,,,False,entry level,Engineering,,,Software Development,https://de.linkedin.com/company/robovis,,,,,,,,,,,
linkedin,Field Application Engineer,Arrow Electronics,"Nuremberg, Bavaria, Germany",2026-06-30,https://www.linkedin.com/jobs/view/4435174073 , ,li-4435174073,fulltime,,,,,,False,mid-senior level,Sales and Business Development,,,"Technology, Information and Internet",https://www.linkedin.com/company/arrow-electronics,,,,,,,,,,,
linkedin,Embedded Firmware Developer (FPGA/SoC),T&S (Technology & Strategy),"Berlin, Germany",2026-06-30,https://www.linkedin.com/jobs/view/4422340182 , ,li-4422340182,fulltime,,,,,,False,associate,Engineering,,,"Technology, Information and Media",https://fr.linkedin.com/company/technology-&-strategy-t&s-,,,,,,,,,,,
linkedin,FPGA Engineer (all genders),Kappa optronics GmbH,"Gleichen, Lower Saxony, Germany",2026-06-30,https://www.linkedin.com/jobs/view/4434967404 , ,li-4434967404,fulltime,,,,,,False,associate,Engineering,,,Electrical Equipment Manufacturing,https://de.linkedin.com/company/kappa-optronics,,,,,,,,,,,
linkedin,Hardwareingenieur:in,Scherer Staffing GmbH,"Berlin, Germany",2026-06-30,https://www.linkedin.com/jobs/view/4431901963 , ,li-4431901963,fulltime,,,,,,False,associate,Engineering,,,Industrial Machinery Manufacturing and Computers and Electronics Manufacturing,https://de.linkedin.com/company/schererstaffing,,,,,,,,,,,
linkedin,Design Engineer,Westinghouse Electric Company,"Mannheim, Baden-Württemberg, Germany",2026-06-30,https://www.linkedin.com/jobs/view/4425254743 , ,li-4425254743,fulltime,,,,,,True,entry level,Engineering and Information Technology,,,Utilities,https://www.linkedin.com/company/westinghouse-electric-company,,,,,,,,,,,
linkedin,Automation Engineer (m/w/d),Fore Group,"Landshut, Bavaria, Germany",2026-06-29,https://www.linkedin.com/jobs/view/4434737517 , ,li-4434737517,fulltime,,,,,,False,entry level,Engineering and Information Technology,,,"Appliances, Electrical, and Electronics Manufacturing",https://au.linkedin.com/company/fore-group-au,,,,,,,,,,,
linkedin,Freelance Full-Stack Web App Developer,Mindrift,,2026-06-29,https://www.linkedin.com/jobs/view/4434428780 , ,li-4434428780,parttime,,,,,,True,mid-senior level,Other,,,IT Services and IT Consulting,https://www.linkedin.com/company/mindrift-ai,,,,,,,,,,,
linkedin,stud. Aushilfe - FPGA-Entwicklung (m/w/d),German Aerospace Center (DLR),"Berlin, Berlin, Germany",2026-06-29,https://www.linkedin.com/jobs/view/4433317634 , ,li-4433317634,fulltime,,,,,,False,entry level,Other,,,Research Services,https://de.linkedin.com/company/dlr,,,,,,,,,,,
linkedin,Senior FPGA Engineer (w/m/d),TRUMPF,"Freiburg, Baden-Württemberg, Germany",2026-06-28,https://www.linkedin.com/jobs/view/4367248829 , ,li-4367248829,fulltime,,,,,,False,mid-senior level,Engineering and Information Technology,,mike.loehmann@trumpf.com,Machinery Manufacturing,https://www.linkedin.com/company/trumpf-se-co-kg,,,,,,,,,,,
linkedin,Quantum Error Correction Experiment Engineer,IQM Quantum Computers,"Munich, Bavaria, Germany",2026-06-28,https://www.linkedin.com/jobs/view/4385580162 , ,li-4385580162,fulltime,,,,,,False,mid-senior level,Engineering and Information Technology,,,Computer Hardware Manufacturing,https://fi.linkedin.com/company/iqm-quantum-computers,,,,,,,,,,,
linkedin,(Senior) R&D Ingenieur Elektrotechnik (m/w/d),IABG,"Ottobrunn, Bavaria, Germany",2026-06-28,https://www.linkedin.com/jobs/view/4304040291 , ,li-4304040291,fulltime,,,,,,False,mid-senior level,Engineering and Information Technology,,,"IT Services and IT Consulting, Defense and Space Manufacturing, and Motor Vehicle Manufacturing",https://de.linkedin.com/company/iabg,,,,,,,,,,,
linkedin,Test Design Engineer (M/F/D),Adtran,"Meiningen, Thuringia, Germany",2026-06-28,https://www.linkedin.com/jobs/view/4354369716 , ,li-4354369716,fulltime,,,,,,False,entry level,Quality Assurance,,,Telecommunications,https://www.linkedin.com/company/adtran,,,,,,,,,,,
linkedin,Director Analog Design (f/m/d),Renesas Electronics,"Munich, Bavaria, Germany",2026-06-28,https://www.linkedin.com/jobs/view/4415866651 , ,li-4415866651,fulltime,,,,,,True,director,Manufacturing,,,Semiconductors,https://jp.linkedin.com/company/renesas,,,,,,,,,,,
linkedin,Mission System Engineer (m/f/x),Grob Aircraft,"Tussenhausen, Bavaria, Germany",2026-06-27,https://www.linkedin.com/jobs/view/4390356649 , ,li-4390356649,fulltime,,,,,,False,entry level,Information Technology,,,Aviation and Aerospace Component Manufacturing,https://de.linkedin.com/company/grobaircraft,,,,,,,,,,,
linkedin,Operateur*in / Softwareentwickler*in im Beschleunigerbetrieb (d/m/w),GSI Helmholtz Centre for Heavy Ion Research,"Darmstadt, Hesse, Germany",2026-06-27,https://www.linkedin.com/jobs/view/4424844569 , ,li-4424844569,fulltime,,,,,,False,associate,Information Technology,,,Research,https://de.linkedin.com/company/gsi-helmholtz-centre-for-heavy-ion-research,,,,,,,,,,,
linkedin,"Embedded Software Engineer (m,f,d)",indie.inc,"Munich, Bavaria, Germany",2026-06-27,https://www.linkedin.com/jobs/view/4374721551 , ,li-4374721551,fulltime,,,,,,False,entry level,Engineering and Information Technology,,,Semiconductor Manufacturing,https://www.linkedin.com/company/indieinc,,,,,,,,,,,
linkedin,Senior AI Systems & Platform Engineer (m/f/d),KLA,,2026-06-27,https://www.linkedin.com/jobs/view/4411539251 , ,li-4411539251,fulltime,,,,,,False,mid-senior level,Engineering and Information Technology,,talent.acquisition@kla.com,Semiconductor Manufacturing,https://www.linkedin.com/company/klacorp,,,,,,,,,,,
linkedin,Simulation Flight Model Developer (m/f/x),Grob Aircraft,"Tussenhausen, Bavaria, Germany",2026-06-27,https://www.linkedin.com/jobs/view/4420463512 , ,li-4420463512,fulltime,,,,,,False,mid-senior level,Engineering and Information Technology,,,Aviation and Aerospace Component Manufacturing,https://de.linkedin.com/company/grobaircraft,,,,,,,,,,,
linkedin,ASIC Project Manager,IC Resources,"Baden-Württemberg, Germany",2026-06-27,https://www.linkedin.com/jobs/view/4358542063 , ,li-4358542063,fulltime,,,,,,False,mid-senior level,"Project Management, Design, and Management",,,Semiconductor Manufacturing,https://uk.linkedin.com/company/icresources,,,,,,,,,,,
linkedin,Principal Design Engineer- Emulation (m/w/d),Microchip Technology Inc.,"Karlsruhe, Baden-Württemberg, Germany",2026-06-27,https://www.linkedin.com/jobs/view/4414654469 , ,li-4414654469,fulltime,,,,,,True,mid-senior level,Engineering,,,"Appliances, Electrical, and Electronics Manufacturing and Semiconductor Manufacturing",https://www.linkedin.com/company/microchip-technology,,,,,,,,,,,
linkedin,Field Application Engineer - AI Software & Hardware,Tenstorrent,"Munich, Bavaria, Germany",2026-06-27,https://www.linkedin.com/jobs/view/4433406948 , ,li-4433406948,fulltime,,,,,,True,mid-senior level,Sales and Business Development,,,Computer Hardware Manufacturing,https://ca.linkedin.com/company/tenstorrent-inc.,,,,,,,,,,,
linkedin,Field Application Engineer,Lattice Semiconductor,"Berlin, Germany",2026-06-26,https://www.linkedin.com/jobs/view/4429212272 , ,li-4429212272,fulltime,,,,,,False,mid-senior level,Sales and Business Development,,,Semiconductor Manufacturing,https://www.linkedin.com/company/lattice-semiconductor,,,,,,,,,,,
linkedin,Software Developer Simulation (d/f/m),Airbus Defence and Space,"Manching, Bavaria, Germany",2026-06-26,https://www.linkedin.com/jobs/view/4433597398 , ,li-4433597398,parttime,,,,,,False,mid-senior level,Engineering and Information Technology,,emsom@airbus.com,Defense and Space Manufacturing,https://www.linkedin.com/company/airbus-defence-and-space,,,,,,,,,,,
linkedin,"Senior Developer (f/m/d) - Virtualization (C, Linux, x86/ARM)",SAP,"Berlin, Berlin, Germany",2026-06-26,https://www.linkedin.com/jobs/view/4415082461 , ,li-4415082461,fulltime,,,,,,False,not applicable,Engineering and Information Technology,,Careers@sap.com,"Software Development, IT Services and IT Consulting, and Business Consulting and Services",https://de.linkedin.com/company/sap,,,,,,,,,,,
linkedin,Senior Digital IC Designer,IC Resources,"Bavaria, Germany",2026-06-26,https://www.linkedin.com/jobs/view/4434010558 , ,li-4434010558,fulltime,,,,,,False,mid-senior level,"Design, Art/Creative, and Information Technology",,,Staffing and Recruiting,https://uk.linkedin.com/company/icresources,,,,,,,,,,,
linkedin,Azure DevOps Specialist (m/f/d),KLA,,2026-06-26,https://www.linkedin.com/jobs/view/4411544211 , ,li-4411544211,fulltime,,,,,,True,entry level,Management and Manufacturing,,talent.acquisition@kla.com,Semiconductor Manufacturing,https://www.linkedin.com/company/klacorp,,,,,,,,,,,
linkedin,"Mathematician (f/m/d), Physicist (f/m/d), or Chemist (f/m/d)",KLA,,2026-06-26,https://www.linkedin.com/jobs/view/4411537312 , ,li-4411537312,fulltime,,,,,,False,mid-senior level,"Research, Analyst, and Information Technology",,talent.acquisition@kla.com,Semiconductor Manufacturing,https://www.linkedin.com/company/klacorp,,,,,,,,,,,
linkedin,Entwicklungsingenieur (w/m/d) FPGA-Programmierung,TRUMPF,"Freiburg, Baden-Württemberg, Germany",2026-06-26,https://www.linkedin.com/jobs/view/4392424950 , ,li-4392424950,fulltime,,,,,,False,entry level,Engineering and Information Technology,,.external@trumpf.com,Machinery Manufacturing,https://www.linkedin.com/company/trumpf-se-co-kg,,,,,,,,,,,
linkedin,"ASIC Digital Design Verification, Principal Engineer",Synopsys Inc,"Munich, Bavaria, Germany",2026-06-26,https://www.linkedin.com/jobs/view/4414962146 , ,li-4414962146,fulltime,,,,,,False,mid-senior level,"Design, Consulting, and Engineering",,,"Semiconductor Manufacturing, Software Development, and Computer Hardware Manufacturing",https://www.linkedin.com/company/synopsys,,,,,,,,,,,
linkedin,FPGA Engineer – Quantum Computing (f/m/d),eleQtron,"Hamburg, Hamburg, Germany",2026-06-26,https://www.linkedin.com/jobs/view/4424726740 , ,li-4424726740,fulltime,,,,,,False,mid-senior level,Information Technology,,,IT Services and IT Consulting,https://de.linkedin.com/company/eleqtron-qc,,,,,,,,,,,
linkedin,Senior DevOps Engineer (m/f/d),KLA,,2026-06-26,https://www.linkedin.com/jobs/view/4411540220 , ,li-4411540220,fulltime,,,,,,False,mid-senior level,Engineering and Information Technology,,talent.acquisition@kla.com,Semiconductor Manufacturing,https://www.linkedin.com/company/klacorp,,,,,,,,,,,
linkedin,Director of Analog Design,European Tech Recruit,"Munich, Bavaria, Germany",2026-06-26,https://www.linkedin.com/jobs/view/4433860609 , ,li-4433860609,fulltime,,,,,,False,director,"Engineering, Information Technology, and Management",,,"Semiconductor Manufacturing, Computer Hardware Manufacturing, and Software Development",https://uk.linkedin.com/company/european-tech-recruit,,,,,,,,,,,
linkedin,Senior Software Engineer (m/f/d),KLA,,2026-06-26,https://www.linkedin.com/jobs/view/4411541224 , ,li-4411541224,fulltime,,,,,,False,associate,Engineering and Information Technology,,talent.acquisition@kla.com,Semiconductor Manufacturing,https://www.linkedin.com/company/klacorp,,,,,,,,,,,
linkedin,Senior Staff Engineer Digital Concept (f/m/div),Infineon Technologies,"Munich, Bavaria, Germany",2026-06-26,https://www.linkedin.com/jobs/view/4413994273 , ,li-4413994273,fulltime,,,,,,False,mid-senior level,Engineering and Information Technology,,,"Semiconductor Manufacturing, Appliances, Electrical, and Electronics Manufacturing, and Computer Hardware Manufacturing",https://de.linkedin.com/company/infineon-technologies,,,,,,,,,,,
linkedin,Senior Engineer – Validation and Design,Microchip Technology Inc.,"Dresden, Saxony, Germany",2026-06-26,https://www.linkedin.com/jobs/view/4414650577 , ,li-4414650577,fulltime,,,,,,False,mid-senior level,Engineering,,,"Appliances, Electrical, and Electronics Manufacturing and Semiconductor Manufacturing",https://www.linkedin.com/company/microchip-technology,,,,,,,,,,,
linkedin,Software Formal Verification Engineer,Apple,"Munich, Bavaria, Germany",2026-06-25,https://www.linkedin.com/jobs/view/4432894892 , ,li-4432894892,fulltime,,,,,,False,mid-senior level,Quality Assurance,,,Computers and Electronics Manufacturing,https://www.linkedin.com/company/apple,,,,,,,,,,,
linkedin,Electronics Engineer (f/m/d),Max Planck Society,"Göttingen, Lower Saxony, Germany",2026-06-25,https://www.linkedin.com/jobs/view/4430223732 , ,li-4430223732,fulltime,,,,,,False,entry level,Engineering and Information Technology,,heerlein@mps.mpg.de,Civic and Social Organizations,https://de.linkedin.com/school/max-planck-society/,,,,,,,,,,,
linkedin,Softwareentwickler:in Embedded Systems,yes4match,"Oldenburg, Lower Saxony, Germany",2026-06-25,https://www.linkedin.com/jobs/view/4433058718 , ,li-4433058718,fulltime,,,,,,True,associate,Information Technology,,,Staffing and Recruiting and Nanotechnology Research,https://www.linkedin.com/company/yes4match,,,,,,,,,,,
linkedin,Semantic Developer (all genders),DATAGROUP,"Stuttgart, Baden-Württemberg, Germany",2026-06-25,https://www.linkedin.com/jobs/view/4430234220 , ,li-4430234220,fulltime,,,,,,False,entry level,Engineering,,,Software Development,https://de.linkedin.com/company/datagroup-se,,,,,,,,,,,
linkedin,"Senior FPGA Developer & Testing - BW region, Germany - Up to €110,000 (d / m / w)",Optimus Search,"Baden-Württemberg, Germany",2026-06-25,https://www.linkedin.com/jobs/view/4375960202 , ,li-4375960202,fulltime,,,,,,False,mid-senior level,Information Technology,,arasulo@optimussearch.com,Software Development and Electrical Equipment Manufacturing,https://uk.linkedin.com/company/optimus-search,,,,,,,,,,,
linkedin,Principal Engineer-Applications (f/m/d),Microchip Technology Inc.,"Munich, Bavaria, Germany",2026-06-25,https://www.linkedin.com/jobs/view/4433093417 , ,li-4433093417,fulltime,,,,,,True,mid-senior level,Engineering,,,"Appliances, Electrical, and Electronics Manufacturing and Semiconductor Manufacturing",https://www.linkedin.com/company/microchip-technology,,,,,,,,,,,
linkedin,Principal Engineer-Applications (f/m/d),Microchip Technology Inc.,"Karlsruhe, Baden-Württemberg, Germany",2026-06-25,https://www.linkedin.com/jobs/view/4433099272 , ,li-4433099272,fulltime,,,,,,True,mid-senior level,Engineering,,,"Appliances, Electrical, and Electronics Manufacturing and Semiconductor Manufacturing",https://www.linkedin.com/company/microchip-technology,,,,,,,,,,,
linkedin,Senior Analog IC Designer – High speed optical,IC Resources,"Berlin, Berlin, Germany",2026-06-25,https://www.linkedin.com/jobs/view/4433007536 , ,li-4433007536,fulltime,,,,,,True,mid-senior level,Engineering and Information Technology,,,Staffing and Recruiting,https://uk.linkedin.com/company/icresources,,,,,,,,,,,
linkedin,Senior Principal Computer Architect AI/ML (f/m/d),NXP Semiconductors,"Hamburg, Hamburg, Germany",2026-06-25,https://www.linkedin.com/jobs/view/4433314902 , ,li-4433314902,fulltime,,,,,,False,mid-senior level,"Design, Art/Creative, and Information Technology",,,"Semiconductor Manufacturing, Computers and Electronics Manufacturing, and Software Development",https://nl.linkedin.com/company/nxp-semiconductors,,,,,,,,,,,
linkedin,Senior Principal Computer Architect AI/ML (f/m/d),NXP Semiconductors,"Munich, Bavaria, Germany",2026-06-25,https://www.linkedin.com/jobs/view/4433329456 , ,li-4433329456,fulltime,,,,,,False,mid-senior level,"Design, Art/Creative, and Information Technology",,,"Semiconductor Manufacturing, Computers and Electronics Manufacturing, and Software Development",https://nl.linkedin.com/company/nxp-semiconductors,,,,,,,,,,,
linkedin,FPGA Test & Verification Engineer Aerospace (m/w/d),ep group,"Lindenberg im Allgäu, Bavaria, Germany",2026-06-25,https://www.linkedin.com/jobs/view/4433001463 , ,li-4433001463,fulltime,,,,,,False,mid-senior level,Quality Assurance,,,Alternative Dispute Resolution and Alternative Medicine,https://de.linkedin.com/company/ep-group-gmbh,,,,,,,,,,,
linkedin,Embedded SW Engineer,Hypersonica,"Munich, Bavaria, Germany",2026-06-25,https://www.linkedin.com/jobs/view/4433328656 , ,li-4433328656,fulltime,,,,,,False,mid-senior level,Engineering and Information Technology,,,Defense and Space Manufacturing,https://de.linkedin.com/company/hypersonicagmbh,,,,,,,,,,,
linkedin,RF Expert (m/f/d),Thales,"Ditzingen, Baden-Württemberg, Germany",2026-06-25,https://www.linkedin.com/jobs/view/4433530056 , ,li-4433530056,fulltime,,,,,,False,not applicable,Other,,,Aviation and Aerospace Component Manufacturing and Defense and Space Manufacturing,https://fr.linkedin.com/company/thales,,,,,,,,,,,
linkedin,Senior Digital ASIC Design Engineer Verification (m/f/d),Advantest,"Böblingen, Baden-Württemberg, Germany",,https://www.linkedin.com/jobs/view/4435342447 , ,li-4435342447,fulltime,,,,,,False,mid-senior level,Engineering and Information Technology,,,Semiconductor Manufacturing,https://jp.linkedin.com/company/advantest,,,,,,,,,,,
linkedin,Senior ASIC Design Engineer DfT (m/f/d),Advantest,"Böblingen, Baden-Württemberg, Germany",,https://www.linkedin.com/jobs/view/4435350131 , ,li-4435350131,fulltime,,,,,,False,mid-senior level,Engineering and Information Technology,,,Semiconductor Manufacturing,https://jp.linkedin.com/company/advantest,,,,,,,,,,,
linkedin,AI Engineer (m/f/d),KLA,,,https://www.linkedin.com/jobs/view/4413377042 , ,li-4413377042,fulltime,,,,,,False,mid-senior level,Engineering and Information Technology,,talent.acquisition@kla.com,Semiconductor Manufacturing,https://www.linkedin.com/company/klacorp,,,,,,,,,,,
linkedin,Senior Embedded AI Developer (f/m/x) - Jobbird.com,Jobster,"Munich, Bavaria, Germany",,https://www.linkedin.com/jobs/view/4435567115 , ,li-4435567115,fulltime,,,,,,False,mid-senior level,Engineering and Information Technology,,,Software Development,https://nl.linkedin.com/company/jobster-com,,,,,,,,,,,
linkedin,Engineer Transfer/New Products (m/w/d),Vishay Siliconix Itzehoe GmbH,"Itzehoe, Schleswig-Holstein, Germany",,https://www.linkedin.com/jobs/view/4427022297 , ,li-4427022297,fulltime,,,,,,True,entry level,Engineering and Information Technology,,,Semiconductor Manufacturing,https://de.linkedin.com/company/vishay-siliconix-itzehoe-gmbh,,,,,,,,,,,
linkedin,FPGA- & Embedded-Engineer (all gender),ALTEN Germany,,,https://www.linkedin.com/jobs/view/4398216831 , ,li-4398216831,fulltime,,,,,,False,associate,Information Technology,,,IT Services and IT Consulting,https://de.linkedin.com/company/altengermany,,,,,,,,,,,
linkedin,Field-Programmable Gate Arrays Engineer,agap2 Germany,"Bavaria, Germany",,https://www.linkedin.com/jobs/view/4435536718 , ,li-4435536718,fulltime,,,,,,False,associate,Engineering and Project Management,,,Business Consulting and Services,https://de.linkedin.com/company/agap2-germany,,,,,,,,,,,
linkedin,PLD/FPGA developer for aviation software (m/f/d),K-tronik GmbH,"Lindenberg im Allgäu, Bavaria, Germany",,https://www.linkedin.com/jobs/view/4435829854 , ,li-4435829854,fulltime,,,,,,False,associate,Engineering,,,IT Services and IT Consulting,https://de.linkedin.com/company/k-tronik-gmbh,,,,,,,,,,,
linkedin,Senior Digital IC Designer,IC Resources,,,https://www.linkedin.com/jobs/view/4435828118 , ,li-4435828118,fulltime,,,,,,False,mid-senior level,Engineering,,,Staffing and Recruiting,https://uk.linkedin.com/company/icresources,,,,,,,,,,,
linkedin,Founding Engineer | Full-Stack Developer,Sleak AI,"Munich, Bavaria, Germany",,https://www.linkedin.com/jobs/view/4432356315 , ,li-4432356315,fulltime,,,,,,True,associate,Information Technology,,,Software Development,https://de.linkedin.com/company/sleak-ai,,,,,,,,,,,
linkedin,R Developer with Life Science Background,Jobgether,,,https://www.linkedin.com/jobs/view/4432380563 , ,li-4432380563,fulltime,,,,,,True,entry level,Engineering and Information Technology,,,Internet Marketplace Platforms,https://be.linkedin.com/company/jobgether,,,,,,,,,,,
linkedin,Founding Prototype Development Lead (Equity-Based),Nexar Dynamics,,,https://www.linkedin.com/jobs/view/4431992373 , ,li-4431992373,parttime,,,,,,True,mid-senior level,,,,Environmental Services,https://ee.linkedin.com/company/nexar-dynamics,,,,,,,,,,,
linkedin,Hardwarenaher Softwareentwickler (m/w/d),AXON Innovations,"Leipzig, Saxony, Germany",,https://www.linkedin.com/jobs/view/4434628361 , ,li-4434628361,fulltime,,,,,,True,entry level,Engineering and Information Technology,,,Strategic Management Services,https://de.linkedin.com/company/axon-innovations,,,,,,,,,,,
linkedin,Hardware Development Engineer (m/w/d),SII Germany,"Ulm, Baden-Württemberg, Germany",,https://www.linkedin.com/jobs/view/4435339143 , ,li-4435339143,fulltime,,,,,,False,entry level,Engineering and Information Technology,,,IT Services and IT Consulting,https://de.linkedin.com/company/sii-germany,,,,,,,,,,,
linkedin,Softwareingenieur:in,AKmira optronics GmbH,"Potsdam, Brandenburg, Germany",,https://www.linkedin.com/jobs/view/4432340115 , ,li-4432340115,fulltime,,,,,,False,associate,Engineering,,,Medical Equipment Manufacturing,https://de.linkedin.com/company/akmira-optronics-gmbh,,,,,,,,,,,
linkedin,Embedded Software Engineer – Software Defined Radio (SDR) (m/w/x),K-tronik GmbH,"Munich, Bavaria, Germany",,https://www.linkedin.com/jobs/view/4435849294 , ,li-4435849294,fulltime,,,,,,False,associate,Information Technology,,,IT Services and IT Consulting,https://de.linkedin.com/company/k-tronik-gmbh,,,,,,,,,,,
