site,title,company,location,date_posted,job_url,job_url_direct,id,job_type,salary_source,interval,min_amount,max_amount,currency,is_remote,job_level,job_function,listing_type,emails,company_industry,company_url,company_url_direct,company_addresses,company_num_employees,company_revenue,company_description,skills,experience_range,company_rating,company_reviews_count,vacancy_count,work_from_home_type
linkedin,FPGA Engineer & RTL Expert,imec in Vlaanderen,,2026-05-13,https://www.linkedin.com/jobs/view/4410613411 , ,li-4410613411,fulltime,,,,,,False,entry level,Engineering and Information Technology,,,Research Services,https://be.linkedin.com/showcase/imec-vlaanderen/,,,,,,,,,,,
linkedin,Senior Staff Engineer Digital Concept (f/m/div),Infineon Technologies,"Munich, Bavaria, Germany",2026-05-13,https://www.linkedin.com/jobs/view/4413994273 , ,li-4413994273,fulltime,,,,,,False,mid-senior level,Engineering and Information Technology,,,"Semiconductor Manufacturing, Appliances, Electrical, and Electronics Manufacturing, and Computer Hardware Manufacturing",https://de.linkedin.com/company/infineon-technologies,,,,,,,,,,,
linkedin,Developer GTM,Cloudflare Area 1 Security,"Munich, Bavaria, Germany",2026-05-13,https://www.linkedin.com/jobs/view/4413784688 , ,li-4413784688,fulltime,,,,,,True,mid-senior level,Engineering and Information Technology,,hr@cloudflare.com,Computer and Network Security,https://www.linkedin.com/company/area-1-security,,,,,,,,,,,
linkedin,Robotik-Entwickler (m/w/d) Logistik – Inbetriebnahme Walker S2,Dirk Rossmann GmbH,"Burgwedel, Lower Saxony, Germany",2026-05-13,https://www.linkedin.com/jobs/view/4391128712 , ,li-4391128712,fulltime,,,,,,False,associate,"Engineering, Information Technology, and Supply Chain",,,"Retail, Transportation, Logistics, Supply Chain and Storage, and IT System Custom Software Development",https://de.linkedin.com/company/dirk-rossmann-gmbh,,,,,,,,,,,
linkedin,Anwendungsentwickler (m/w/d),Afra GmbH,"Forchheim, Bavaria, Germany",2026-05-13,https://www.linkedin.com/jobs/view/4413961751 , ,li-4413961751,fulltime,,,,,,False,entry level,Information Technology,,bewerbung@afra.de,Information Technology & Services,https://de.linkedin.com/company/afra-gmbh,,,,,,,,,,,
linkedin,"Graduate Engineer – Digital Backend (RTL to GDS), Cadence Flow (f/m/d)",Renesas Electronics,"Munich, Bavaria, Germany",2026-05-13,https://www.linkedin.com/jobs/view/4394611301 , ,li-4394611301,fulltime,,,,,,True,associate,Manufacturing,,,Semiconductor Manufacturing,https://jp.linkedin.com/company/renesas,,,,,,,,,,,
linkedin,Soft Component Developer (m/f/d),RIMOWA,"Cologne, North Rhine-Westphalia, Germany",2026-05-13,https://www.linkedin.com/jobs/view/4314690612 , ,li-4314690612,fulltime,,,,,,False,mid-senior level,Engineering and Information Technology,,,Retail Luxury Goods and Jewelry,https://de.linkedin.com/company/rimowa,,,,,,,,,,,
linkedin,Hardware / FPGA Developer (m/f/d) for Analog and Digital Electronics - Semiconductor Development Division,PNDetector,"Munich, Bavaria, Germany",2026-05-13,https://www.linkedin.com/jobs/view/4413949857 , ,li-4413949857,fulltime,,,,,,False,entry level,Engineering,,-pnd@pndetector.de,Semiconductor Manufacturing,https://de.linkedin.com/company/pndetector,,,,,,,,,,,
linkedin,Senior Consultant - HAV (Emulation/FPGA)  - EDA - m/f/d,Siemens EDA (Siemens Digital Industries Software),"Munich, Bavaria, Germany",2026-05-13,https://www.linkedin.com/jobs/view/4374073996 , ,li-4374073996,fulltime,,,,,,True,mid-senior level,"Consulting, Information Technology, and Sales",,-DACH.sisw@siemens.com,Software Development,https://www.linkedin.com/company/siemens-eda,,,,,,,,,,,
linkedin,Engineering Manager/Lead Developer for Engineering (all genders),Nect,"Hamburg, Hamburg, Germany",2026-05-13,https://www.linkedin.com/jobs/view/4410381078 , ,li-4410381078,fulltime,,,,,,False,executive,Management,,,IT Services and IT Consulting,https://de.linkedin.com/company/nect.com,,,,,,,,,,,
linkedin,Chiplet Architect,imec in Vlaanderen,,2026-05-13,https://www.linkedin.com/jobs/view/4410399494 , ,li-4410399494,fulltime,,,,,,False,mid-senior level,"Design, Art/Creative, and Information Technology",,,Research Services,https://be.linkedin.com/showcase/imec-vlaanderen/,,,,,,,,,,,
linkedin,Lead Developer (m/w/d) mit Architekturerfahrung,base4IT,"Unterschleißheim, Bavaria, Germany",2026-05-12,https://www.linkedin.com/jobs/view/4404689364 , ,li-4404689364,fulltime,,,,,,True,not applicable,Information Technology,,personal@base4IT.com,Software Development,https://de.linkedin.com/company/base4it,,,,,,,,,,,
linkedin,SAP Business One® Anwendungsentwickler (all genders),DATAGROUP Enterprise,"Ibbenbüren, North Rhine-Westphalia, Germany",2026-05-12,https://www.linkedin.com/jobs/view/4413817733 , ,li-4413817733,fulltime,,,,,,True,entry level,Engineering and Information Technology,,,IT Services and IT Consulting,https://de.linkedin.com/company/sap-datagroup,,,,,,,,,,,
linkedin,Shopware Entwickler/in (w/m/d),Ostend Digital - Online Marketing Agentur,"Stuttgart, Baden-Württemberg, Germany",2026-05-12,https://www.linkedin.com/jobs/view/4413593004 , ,li-4413593004,fulltime,,,,,,True,entry level,Engineering and Information Technology,,"jobs@ostend.digital, jobs@ostend.digital, jobs@ostend.digital, hallo@ostend.digital",Advertising Services,https://de.linkedin.com/company/ostend-digital,,,,,,,,,,,
linkedin,"Mathematician (f/m/d), Physicist (f/m/d), or Chemist (f/m/d)",KLA,,2026-05-11,https://www.linkedin.com/jobs/view/4412907176 , ,li-4412907176,fulltime,,,,,,False,mid-senior level,"Research, Analyst, and Information Technology",,talent.acquisition@kla.com,Semiconductor Manufacturing,https://www.linkedin.com/company/klacorp,,,,,,,,,,,
linkedin,Laboratory Employee / Developer with focus on emulsions (f/m/d),Klüber Lubrication,"Schwelm, North Rhine-Westphalia, Germany",2026-05-11,https://www.linkedin.com/jobs/view/4412946208 , ,li-4412946208,fulltime,,,,,,False,mid-senior level,Research and Product Management,,,Motor Vehicle Manufacturing,https://de.linkedin.com/company/klueberlubrication,,,,,,,,,,,
linkedin,Senior FPGA Entwickler (m/w/d),ABB,"Minden, North Rhine-Westphalia, Germany",2026-05-11,https://www.linkedin.com/jobs/view/4373394026 , ,li-4373394026,fulltime,,,,,,False,mid-senior level,Engineering and Information Technology,,,Automation Machinery Manufacturing,https://ch.linkedin.com/company/abb,,,,,,,,,,,
linkedin,Entwickler Ferndiagnose (all gender),ALTEN Germany,"Mülheim an der Ruhr, North Rhine-Westphalia, Germany",2026-05-11,https://www.linkedin.com/jobs/view/4408857630 , ,li-4408857630,fulltime,,,,,,False,associate,Engineering,,,Energy Technology,https://de.linkedin.com/company/altengermany,,,,,,,,,,,
linkedin,Senior Field Application Engineer,Southchip Semiconductor Technology,"Munich, Bavaria, Germany",2026-05-11,https://www.linkedin.com/jobs/view/4412706210 , ,li-4412706210,fulltime,,,,,,False,mid-senior level,Research and Sales,,,Semiconductor Manufacturing,https://cn.linkedin.com/company/%E4%B8%8A%E6%B5%B7%E5%8D%97%E8%8A%AF%E5%8D%8A%E5%AF%BC%E4%BD%93%E7%A7%91%E6%8A%80%E6%9C%89%E9%99%90%E5%85%AC%E5%8F%B8,,,,,,,,,,,
linkedin,Technical Editor/Writer imec Germany,imec,"Heilbronn, Baden-Württemberg, Germany",2026-05-11,https://www.linkedin.com/jobs/view/4412721746 , ,li-4412721746,fulltime,,,,,,False,associate,Writing/Editing,,,"Semiconductor Manufacturing, Research Services, and Nanotechnology Research",https://be.linkedin.com/company/imec,,,,,,,,,,,
linkedin,Senior FPGA Engineer (m/f/d),ABB,"Minden, North Rhine-Westphalia, Germany",2026-05-11,https://www.linkedin.com/jobs/view/4375015965 , ,li-4375015965,fulltime,,,,,,False,not applicable,Engineering and Information Technology,,,"Appliances, Electrical, and Electronics Manufacturing",https://ch.linkedin.com/company/abb,,,,,,,,,,,
linkedin,Application Architect - SAP HANA Development (m/w/d),IBM,"Munich, Bavaria, Germany",2026-05-10,https://www.linkedin.com/jobs/view/4392742731 , ,li-4392742731,fulltime,,,,,,False,mid-senior level,Engineering and Information Technology,,,IT Services and IT Consulting,https://www.linkedin.com/company/ibm,,,,,,,,,,,
linkedin,SAP Development Lead Public Sector (m/f/d),T-Systems International,"Berlin, Berlin, Germany",2026-05-10,https://www.linkedin.com/jobs/view/4412544719 , ,li-4412544719,fulltime,,,,,,False,mid-senior level,Information Technology,,,Telecommunications,https://de.linkedin.com/company/t-systems,,,,,,,,,,,
linkedin,Anwendungsentwickler (m/w/d),Gerhard Weber Kunststoff-Verarbeitung GmbH,"Minden, North Rhine-Westphalia, Germany",2026-05-10,https://www.linkedin.com/jobs/view/4412356237 , ,li-4412356237,fulltime,,,,,,False,mid-senior level,Information Technology,,,Plastics Manufacturing,https://de.linkedin.com/company/kunststofftechnik-weber-gmbh,,,,,,,,,,,
linkedin,Developer Education Lead,Mistral AI,"Berlin, Berlin, Germany",2026-05-10,https://www.linkedin.com/jobs/view/4412592099 , ,li-4412592099,fulltime,,,,,,True,not applicable,Information Technology,,,"Technology, Information and Internet",https://fr.linkedin.com/company/mistralai,,,,,,,,,,,
linkedin,"ASIC Digital Design Verification, Staff Engineer",Synopsys Inc,"Munich, Bavaria, Germany",2026-05-10,https://www.linkedin.com/jobs/view/4371897183 , ,li-4371897183,fulltime,,,,,,False,mid-senior level,"Design, Consulting, and Engineering",,,"Semiconductor Manufacturing, Software Development, and Computer Hardware Manufacturing",https://www.linkedin.com/company/synopsys,,,,,,,,,,,
linkedin,Application Architect - SAP HANA Development (m/w/d),IBM,"Cologne, North Rhine-Westphalia, Germany",2026-05-09,https://www.linkedin.com/jobs/view/4392758082 , ,li-4392758082,fulltime,,,,,,False,mid-senior level,Engineering and Information Technology,,,IT Services and IT Consulting,https://www.linkedin.com/company/ibm,,,,,,,,,,,
linkedin,(Senior) ASIC Analog Design Engineer (m/f/d) - REF5389A,AUMOVIO,"Regensburg, Bavaria, Germany",2026-05-09,https://www.linkedin.com/jobs/view/4405859425 , ,li-4405859425,fulltime,,,,,,False,mid-senior level,Design,,,Automotive,https://de.linkedin.com/company/aumovio,,,,,,,,,,,
linkedin,Entwickler (w/m/d) für Prüfmittel mit Schwerpunkt Prüfsoftwarearchitektur,TRUMPF,"Schramberg, Baden-Württemberg, Germany",2026-05-09,https://www.linkedin.com/jobs/view/4371393409 , ,li-4371393409,fulltime,,,,,,False,entry level,Engineering and Information Technology,,lena.riexinger@trumpf.com,Machinery Manufacturing,https://www.linkedin.com/company/trumpf-se-co-kg,,,,,,,,,,,
linkedin,ENTWICKLER (W/M/D),Isonet,,2026-05-09,https://www.linkedin.com/jobs/view/4412476695 , ,li-4412476695,fulltime,,,,,,True,entry level,Information Technology,,,IT Services and IT Consulting,https://ch.linkedin.com/company/beedigital446,,,,,,,,,,,
linkedin,PLD/ FPGA-Entwickler Aerospace (m/w/d),Liebherr Aerospace and Transportation,"Lindenberg im Allgäu, Bavaria, Germany",2026-05-09,https://www.linkedin.com/jobs/view/4390954796 , ,li-4390954796,fulltime,,,,,,False,entry level,Engineering and Information Technology,,,Industrial Machinery Manufacturing,https://fr.linkedin.com/company/liebherr-aerospace-and-transportation,,,,,,,,,,,
linkedin,Anwendungsentwickler ERP / Warenwirtschaft (w/m/d),PZ Systeme GmbH & Co. KG,"Landshut, Bavaria, Germany",2026-05-09,https://www.linkedin.com/jobs/view/4411932448 , ,li-4411932448,parttime,,,,,,False,entry level,Information Technology,,,"Technology, Information and Internet",https://de.linkedin.com/company/pzsysteme,,,,,,,,,,,
linkedin,Application Architect - SAP HANA Development (m/w/d),IBM,"Frankfurt, Hesse, Germany",2026-05-09,https://www.linkedin.com/jobs/view/4392745607 , ,li-4392745607,fulltime,,,,,,False,mid-senior level,Engineering and Information Technology,,,IT Services and IT Consulting,https://www.linkedin.com/company/ibm,,,,,,,,,,,
linkedin,Senior Embedded AI Developer (f/m/x),BMW Group,"Munich, Bavaria, Germany",2026-05-09,https://www.linkedin.com/jobs/view/4391064359 , ,li-4391064359,fulltime,,,,,,False,mid-senior level,Engineering and Information Technology,,,Motor Vehicle Manufacturing,https://de.linkedin.com/company/bmw-group,,,,,,,,,,,
linkedin,Senior Physicist (m/f/d) - for semiconductor industry,Applied Materials Europe,"Heimstetten, Bavaria, Germany",2026-05-09,https://www.linkedin.com/jobs/view/4406006258 , ,li-4406006258,fulltime,,,,,,False,not applicable,"Research, Analyst, and Information Technology",,,"Appliances, Electrical, and Electronics Manufacturing, Nanotechnology Research, and Semiconductor Manufacturing",https://nl.linkedin.com/company/applied-materials-europe,,,,,,,,,,,
linkedin,ASIC Analog Design Engineer (m/f/d) - REF5386X,AUMOVIO,"Regensburg, Bavaria, Germany",2026-05-09,https://www.linkedin.com/jobs/view/4405857461 , ,li-4405857461,fulltime,,,,,,False,mid-senior level,Design,,,Automotive,https://de.linkedin.com/company/aumovio,,,,,,,,,,,
linkedin,ASIC Analog Design Engineer (m/f/d) - REF5386X,AUMOVIO,"Frankfurt, Hesse, Germany",2026-05-09,https://www.linkedin.com/jobs/view/4403190970 , ,li-4403190970,fulltime,,,,,,False,mid-senior level,Design,,,Automotive,https://de.linkedin.com/company/aumovio,,,,,,,,,,,
linkedin,(Senior) ASIC Analog Design Engineer (m/f/d) - REF5389A,AUMOVIO,"Frankfurt, Hesse, Germany",2026-05-09,https://www.linkedin.com/jobs/view/4403412058 , ,li-4403412058,fulltime,,,,,,False,mid-senior level,Design,,,Automotive,https://de.linkedin.com/company/aumovio,,,,,,,,,,,
linkedin,Dashboard Developer (all gender) 999,ALTEN Germany,"Weeze, North Rhine-Westphalia, Germany",2026-05-08,https://www.linkedin.com/jobs/view/4401946296 , ,li-4401946296,fulltime,,,,,,False,associate,"Engineering, Quality Assurance, and Information Technology",,,"Machinery Manufacturing, Human Resources Services, and IT Services and IT Consulting",https://de.linkedin.com/company/altengermany,,,,,,,,,,,
linkedin,Jira Admin & Developer (all gender),ALTEN Germany,"Ingolstadt, Bavaria, Germany",2026-05-08,https://www.linkedin.com/jobs/view/4401417146 , ,li-4401417146,fulltime,,,,,,False,associate,Information Technology,,,Aviation and Aerospace Component Manufacturing,https://de.linkedin.com/company/altengermany,,,,,,,,,,,
linkedin,"Senior FPGA Developer & Testing - BW region, Germany - Up to €110,000 (d / m / w)",Optimus Search,"Baden-Württemberg, Germany",2026-05-08,https://www.linkedin.com/jobs/view/4375960202 , ,li-4375960202,fulltime,,,,,,False,mid-senior level,Information Technology,,arasulo@optimussearch.com,Software Development and Electrical Equipment Manufacturing,https://uk.linkedin.com/company/optimus-search,,,,,,,,,,,
linkedin,SIEM Application Developer (ElasticStack) - Clearance Required,"Cydecor, Inc.","Wiesbaden, Hesse, Germany",2026-05-08,https://www.linkedin.com/jobs/view/4409640255 , ,li-4409640255,internship,,,,,,False,mid-senior level,Engineering and Information Technology,,HR@cydecor.com,Business Consulting and Services,https://www.linkedin.com/company/cydecor-inc-,,,,,,,,,,,
linkedin,ServiceNow-Entwickler (m/w/d),Dirk Rossmann GmbH,"Burgwedel, Lower Saxony, Germany",2026-05-08,https://www.linkedin.com/jobs/view/4390830984 , ,li-4390830984,fulltime,,,,,,False,entry level,Engineering and Information Technology,,,Retail,https://de.linkedin.com/company/dirk-rossmann-gmbh,,,,,,,,,,,
linkedin,Entwickler Systemverkabelung (all gender),ALTEN Germany,"Bremen, Bremen, Germany",2026-05-08,https://www.linkedin.com/jobs/view/4350282045 , ,li-4350282045,fulltime,,,,,,False,associate,Engineering,,,Engineering Services,https://de.linkedin.com/company/altengermany,,,,,,,,,,,
linkedin,"Senior FPGA Developer - BW Region, Germany - Up to €110,000 (d / m / w)",Optimus Search,"Baden-Württemberg, Germany",2026-05-08,https://www.linkedin.com/jobs/view/4375967045 , ,li-4375967045,fulltime,,,,,,False,mid-senior level,Information Technology,,arasulo@optimussearch.com,Information Services and Software Development,https://uk.linkedin.com/company/optimus-search,,,,,,,,,,,
linkedin,Technical Editor/Writer imec Germany,imec in Vlaanderen,,2026-05-08,https://www.linkedin.com/jobs/view/4409630834 , ,li-4409630834,fulltime,,,,,,False,entry level,"Marketing, Public Relations, and Writing/Editing",,,Research Services,https://be.linkedin.com/showcase/imec-vlaanderen/,,,,,,,,,,,
linkedin,Electrical Engineer,Specialist Technical Services (STS Group),"Frankfurt, Hesse, Germany",2026-05-08,https://www.linkedin.com/jobs/view/4409689626 , ,li-4409689626,fulltime,,,,,,False,mid-senior level,Engineering,,,Construction,https://ie.linkedin.com/company/specialist-technical-engineering-services-sts-,,,,,,,,,,,
linkedin,"Hardware Engineer (EMC, Design Verification) - (m/f/d)",HARMAN International,"Karlsbad, Baden-Württemberg, Germany",2026-05-08,https://www.linkedin.com/jobs/view/4412146214 , ,li-4412146214,fulltime,,,,,,True,mid-senior level,Engineering and Information Technology,,harmancareers@harman.com,Computers and Electronics Manufacturing,https://www.linkedin.com/company/harman-international,,,,,,,,,,,
linkedin,System Architect / Embedded & FPGA Engineer (all gender) 100,ALTEN Germany,"Berlin, Germany",2026-05-08,https://www.linkedin.com/jobs/view/4411387352 , ,li-4411387352,fulltime,,,,,,False,associate,"Engineering, Information Technology, and Production",,,"Research Services, IT System Custom Software Development, and Medical Equipment Manufacturing",https://de.linkedin.com/company/altengermany,,,,,,,,,,,
linkedin,FPGA- & Embedded-Engineer (all gender),ALTEN Germany,,2026-05-08,https://www.linkedin.com/jobs/view/4398216831 , ,li-4398216831,fulltime,,,,,,False,associate,Information Technology,,,IT Services and IT Consulting,https://de.linkedin.com/company/altengermany,,,,,,,,,,,
linkedin,FPGA / Embedded Software Engineer (all gender) – High Power Systems 100,ALTEN Germany,"Berlin, Germany",2026-05-08,https://www.linkedin.com/jobs/view/4411381470 , ,li-4411381470,fulltime,,,,,,False,associate,"Engineering, Information Technology, and Production",,,"Research Services, IT System Custom Software Development, and Medical Equipment Manufacturing",https://de.linkedin.com/company/altengermany,,,,,,,,,,,
linkedin,Senior NAV/BC Developer (f/m/d),Mister Spex,"Berlin, Germany",2026-05-08,https://www.linkedin.com/jobs/view/4384807001 , ,li-4384807001,fulltime,,,,,,False,mid-senior level,Information Technology,,,Retail and Retail Apparel and Fashion,https://de.linkedin.com/company/mister-spex,,,,,,,,,,,
linkedin,Principal Digital Design Engineer (m/f/d),Micron Technology,"Munich, Bavaria, Germany",2026-05-07,https://www.linkedin.com/jobs/view/4410844306 , ,li-4410844306,fulltime,,,,,,False,mid-senior level,Other,,"_EMEA@micron.com, _TA@micron.com","Computer Hardware Manufacturing, Appliances, Electrical, and Electronics Manufacturing, and Semiconductor Manufacturing",https://www.linkedin.com/company/micron-technology,,,,,,,,,,,
linkedin,Mixed Signal Design Engineer (m/f/d),Micron Technology,"Munich, Bavaria, Germany",2026-05-07,https://www.linkedin.com/jobs/view/4410839324 , ,li-4410839324,fulltime,,,,,,False,entry level,Other,,"_EMEA@micron.com, _TA@micron.com","Computer Hardware Manufacturing, Appliances, Electrical, and Electronics Manufacturing, and Semiconductor Manufacturing",https://www.linkedin.com/company/micron-technology,,,,,,,,,,,
linkedin,Director Analog Design (f/m/d),Renesas Electronics,"Dresden, Saxony, Germany",2026-05-07,https://www.linkedin.com/jobs/view/4364091623 , ,li-4364091623,fulltime,,,,,,True,director,Manufacturing,,,Semiconductors,https://jp.linkedin.com/company/renesas,,,,,,,,,,,
linkedin,Cellular RF Receiver Systems Engineer - DSP (m/f/d),Apple,"Munich, Bavaria, Germany",,https://www.linkedin.com/jobs/view/4414172031 , ,li-4414172031,fulltime,,,,,,False,mid-senior level,Engineering and Information Technology,,,Computers and Electronics Manufacturing,https://www.linkedin.com/company/apple,,,,,,,,,,,
linkedin,"SoC Physical Design Verification Engineer (M, F, D)",Apple,"Munich, Bavaria, Germany",,https://www.linkedin.com/jobs/view/4414157727 , ,li-4414157727,fulltime,,,,,,False,entry level,Engineering and Information Technology,,,Computers and Electronics Manufacturing,https://www.linkedin.com/company/apple,,,,,,,,,,,
linkedin,Design Verification Engineer for Cellular SoC (m/f/d),Apple,"Munich, Bavaria, Germany",,https://www.linkedin.com/jobs/view/4414157709 , ,li-4414157709,fulltime,,,,,,False,mid-senior level,Engineering and Information Technology,,,Computers and Electronics Manufacturing,https://www.linkedin.com/company/apple,,,,,,,,,,,
linkedin,Experienced ESD Engineer (m/f/d),Apple,"Munich, Bavaria, Germany",,https://www.linkedin.com/jobs/view/4414167384 , ,li-4414167384,fulltime,,,,,,False,mid-senior level,Engineering and Information Technology,,,Computers and Electronics Manufacturing,https://www.linkedin.com/company/apple,,,,,,,,,,,
linkedin,ESD Engineer (m/f/d),Apple,"Munich, Bavaria, Germany",,https://www.linkedin.com/jobs/view/4414162512 , ,li-4414162512,fulltime,,,,,,False,mid-senior level,Engineering and Information Technology,,,Computers and Electronics Manufacturing,https://www.linkedin.com/company/apple,,,,,,,,,,,
linkedin,Experienced Cellular IP Design Engineer (m/f/d),Apple,"Munich, Bavaria, Germany",,https://www.linkedin.com/jobs/view/4414160643 , ,li-4414160643,fulltime,,,,,,False,mid-senior level,Engineering and Information Technology,,,Computers and Electronics Manufacturing,https://www.linkedin.com/company/apple,,,,,,,,,,,
linkedin,PMU Design Verification Engineer (m/f/d),Apple,"Munich, Bavaria, Germany",,https://www.linkedin.com/jobs/view/4414163499 , ,li-4414163499,fulltime,,,,,,False,entry level,Engineering and Information Technology,,,Computers and Electronics Manufacturing,https://www.linkedin.com/company/apple,,,,,,,,,,,
linkedin,"STA Engineer (M, F, D)",Apple,"Munich, Bavaria, Germany",,https://www.linkedin.com/jobs/view/4414155738 , ,li-4414155738,fulltime,,,,,,False,mid-senior level,Engineering and Information Technology,,,Computers and Electronics Manufacturing,https://www.linkedin.com/company/apple,,,,,,,,,,,
linkedin,AMS STA / Timing Engineer (m/f/d).,Apple,"Munich, Bavaria, Germany",,https://www.linkedin.com/jobs/view/4414150954 , ,li-4414150954,fulltime,,,,,,False,mid-senior level,Engineering and Information Technology,,,Computers and Electronics Manufacturing,https://www.linkedin.com/company/apple,,,,,,,,,,,
linkedin,Senior ASIC/SoC Development Engineer,Nokia,"Nuremberg, Bavaria, Germany",,https://www.linkedin.com/jobs/view/4372414474 , ,li-4372414474,fulltime,,,,,,False,not applicable,Engineering and Information Technology,,,IT Services and IT Consulting and Telecommunications,https://fi.linkedin.com/company/nokia,,,,,,,,,,,
linkedin,Technical Staff Engineer-Design,Microchip Technology Inc.,"Neu Ulm, Bavaria, Germany",,https://www.linkedin.com/jobs/view/4414653525 , ,li-4414653525,fulltime,,,,,,False,mid-senior level,Engineering,,,"Appliances, Electrical, and Electronics Manufacturing and Semiconductor Manufacturing",https://www.linkedin.com/company/microchip-technology,,,,,,,,,,,
linkedin,Subject Matter Expert – Cleanliness (m/f/d) for the semiconductor industry,Applied Materials Europe,"Heimstetten, Bavaria, Germany",,https://www.linkedin.com/jobs/view/4405595423 , ,li-4405595423,fulltime,,,,,,False,not applicable,Other,,,"Appliances, Electrical, and Electronics Manufacturing, Nanotechnology Research, and Semiconductor Manufacturing",https://nl.linkedin.com/company/applied-materials-europe,,,,,,,,,,,
linkedin,ECAD Software Engineer - PCB/EDM Design - EDA - m/f/d,Siemens EDA (Siemens Digital Industries Software),"Munich, Bavaria, Germany",,https://www.linkedin.com/jobs/view/4374083903 , ,li-4374083903,fulltime,,,,,,False,mid-senior level,Engineering and Information Technology,,-DACH.sisw@siemens.com,Software Development,https://www.linkedin.com/company/siemens-eda,,,,,,,,,,,
linkedin,Senior FP&A (w/m/d),Black Semiconductor,"Aachen, North Rhine-Westphalia, Germany",,https://www.linkedin.com/jobs/view/4366771467 , ,li-4366771467,fulltime,,,,,,False,mid-senior level,Finance and Sales,,,Semiconductor Manufacturing,https://de.linkedin.com/company/black-semiconductor,,,,,,,,,,,
linkedin,Digital Circuit Design Engineer (m/f/d),Apple,"Munich, Bavaria, Germany",,https://www.linkedin.com/jobs/view/4414156780 , ,li-4414156780,fulltime,,,,,,False,entry level,Engineering and Information Technology,,,Computers and Electronics Manufacturing,https://www.linkedin.com/company/apple,,,,,,,,,,,
linkedin,Experienced AMS Digital Design Engineer (m/f/d),Apple,"Munich, Bavaria, Germany",,https://www.linkedin.com/jobs/view/4414153773 , ,li-4414153773,fulltime,,,,,,False,mid-senior level,Engineering and Information Technology,,,Computers and Electronics Manufacturing,https://www.linkedin.com/company/apple,,,,,,,,,,,
linkedin,"Experienced SoC Digital Design Engineer (M, F, D)",Apple,"Munich, Bavaria, Germany",,https://www.linkedin.com/jobs/view/4414156783 , ,li-4414156783,fulltime,,,,,,False,mid-senior level,Engineering and Information Technology,,,Computers and Electronics Manufacturing,https://www.linkedin.com/company/apple,,,,,,,,,,,
linkedin,PMU Design Verification Engineer (m/f/d),Apple,"Stuttgart, Baden-Württemberg, Germany",,https://www.linkedin.com/jobs/view/4414157700 , ,li-4414157700,fulltime,,,,,,False,entry level,Engineering and Information Technology,,,Computers and Electronics Manufacturing,https://www.linkedin.com/company/apple,,,,,,,,,,,
linkedin,PMU Design Verification Engineer (m/f/d),Apple,"Nabern, Baden-Württemberg, Germany",,https://www.linkedin.com/jobs/view/4414162510 , ,li-4414162510,fulltime,,,,,,False,entry level,Engineering and Information Technology,,,Computers and Electronics Manufacturing,https://www.linkedin.com/company/apple,,,,,,,,,,,
