site,title,company,location,date_posted,job_url,job_url_direct,id,job_type,salary_source,interval,min_amount,max_amount,currency,is_remote,job_level,job_function,listing_type,emails,company_industry,company_url,company_url_direct,company_addresses,company_num_employees,company_revenue,company_description,skills,experience_range,company_rating,company_reviews_count,vacancy_count,work_from_home_type
linkedin,Director Analog Design (f/m/d),Renesas Electronics,"Bingen, Rhineland-Palatinate, Germany",2026-05-28,https://www.linkedin.com/jobs/view/4364361378 , ,li-4364361378,fulltime,,,,,,True,director,Manufacturing,,,Semiconductors,https://jp.linkedin.com/company/renesas,,,,,,,,,,,
linkedin,Electronics Developer (m/f/d) with VHDL skills,Emerson,"Baden-Württemberg, Germany",2026-05-28,https://www.linkedin.com/jobs/view/4402006248 , ,li-4402006248,fulltime,,,,,,False,entry level,Engineering and Information Technology,,idisability.administrator@emerson.com,Automation Machinery Manufacturing,https://www.linkedin.com/company/emerson,,,,,,,,,,,
linkedin,SAP Business One Anwendungsentwickler (all genders),Instaffo,"Berlin, Berlin, Germany",2026-05-28,https://www.linkedin.com/jobs/view/4369756427 , ,li-4369756427,fulltime,,,,,,False,mid-senior level,Information Technology and Engineering,,,IT Services and IT Consulting,https://de.linkedin.com/company/instaffo-gmbh,,,,,,,,,,,
linkedin,"Analytical Lead – Protein Analytics in Early Analytical Development R&D (all genders) (full- or parttime, permanent)",AbbVie,"Ludwigshafen, Rhineland-Palatinate, Germany",2026-05-28,https://www.linkedin.com/jobs/view/4401194681 , ,li-4401194681,fulltime,,,,,,False,mid-senior level,"Research, Analyst, and Information Technology",,Talentacquisition.de@abbvie.com,Pharmaceutical Manufacturing and Biotechnology Research,https://www.linkedin.com/company/abbvie,,,,,,,,,,,
linkedin,Bioprocess Development Leader – Germany,Cytiva,"Düsseldorf, North Rhine-Westphalia, Germany",2026-05-28,https://www.linkedin.com/jobs/view/4417636648 , ,li-4417636648,fulltime,,,,,,True,not applicable,Information Technology,,,Biotechnology Research,https://www.linkedin.com/company/cytiva,,,,,,,,,,,
linkedin,(SENIOR) REACT NATIVE ENTWICKLER:IN (m/w/d),Rausgegangen,"Cologne, North Rhine-Westphalia, Germany",2026-05-28,https://www.linkedin.com/jobs/view/4417626196 , ,li-4417626196,fulltime,,,,,,True,associate,Information Technology,,,Software Development,https://de.linkedin.com/company/rausgegangen,,,,,,,,,,,
linkedin,SOC Architect - Chiplet,Tenstorrent,"Munich, Bavaria, Germany",2026-05-28,https://www.linkedin.com/jobs/view/4377756862 , ,li-4377756862,fulltime,,,,,,True,mid-senior level,Information Technology,,,Computer Hardware Manufacturing,https://ca.linkedin.com/company/tenstorrent-inc.,,,,,,,,,,,
linkedin,Scientist for FPGA-based RF signal processing and control,DESY,"Hamburg, Germany",2026-05-28,https://www.linkedin.com/jobs/view/4420299050 , ,li-4420299050,fulltime,,,,,,True,associate,Science,,burak.dursun@desy.de,Research Services,https://de.linkedin.com/company/desy,,,,,,,,,,,
linkedin,Simulation Flight Model Developer (m/f/x),Grob Aircraft SE,"Tussenhausen, Bavaria, Germany",2026-05-28,https://www.linkedin.com/jobs/view/4420463512 , ,li-4420463512,fulltime,,,,,,False,mid-senior level,Engineering and Information Technology,,,Aviation and Aerospace Component Manufacturing,https://de.linkedin.com/company/grobaircraft,,,,,,,,,,,
linkedin,Hardware / FPGA Developer (m/f/d) for Analog and Digital Electronics - Semiconductor Development Division,PNDetector,"Munich, Bavaria, Germany",2026-05-28,https://www.linkedin.com/jobs/view/4420299486 , ,li-4420299486,fulltime,,,,,,False,entry level,Engineering,,-pnd@pndetector.de,Semiconductor Manufacturing,https://de.linkedin.com/company/pndetector,,,,,,,,,,,
linkedin,Mobile App Developer*in (m/w/d),Flender,"Voerde, North Rhine-Westphalia, Germany",2026-05-28,https://www.linkedin.com/jobs/view/4419007417 , ,li-4419007417,fulltime,,,,,,False,associate,Information Technology,,,Machinery Manufacturing,https://de.linkedin.com/company/flenderdrives,,,,,,,,,,,
linkedin,"Sales Account Management, Sr Staff",Synopsys Inc,"Ismaning, Bavaria, Germany",2026-05-28,https://www.linkedin.com/jobs/view/4420280999 , ,li-4420280999,fulltime,,,,,,False,mid-senior level,Sales,,,"Semiconductor Manufacturing, Software Development, and Computer Hardware Manufacturing",https://www.linkedin.com/company/synopsys,,,,,,,,,,,
linkedin,Senior Field-Programmable Gate Arrays (FPGA) Engineer (m/f/x),DSI Aerospace GmbH,"Brunswick, Lower Saxony, Germany",2026-05-27,https://www.linkedin.com/jobs/view/4419585589 , ,li-4419585589,fulltime,,,,,,False,associate,Engineering and Information Technology,,,Defense and Space Manufacturing,https://de.linkedin.com/company/dsi-aerospace,,,,,,,,,,,
linkedin,Digital Engineer for Integrated Circuits (Graduate) (f/m/d),NXP Semiconductors,"Munich, Bavaria, Germany",2026-05-27,https://www.linkedin.com/jobs/view/4419887070 , ,li-4419887070,fulltime,,,,,,False,entry level,Engineering and Information Technology,,,"Semiconductor Manufacturing, Computers and Electronics Manufacturing, and Software Development",https://nl.linkedin.com/company/nxp-semiconductors,,,,,,,,,,,
linkedin,Anwendungsentwickler Kennzahlendienste,Finanz Informatik,"Münster, North Rhine-Westphalia, Germany",2026-05-27,https://www.linkedin.com/jobs/view/4409907471 , ,li-4409907471,fulltime,,,,,,False,associate,"Project Management, Information Technology, and Product Management",,,"IT Services and IT Consulting, Banking, and Financial Services",https://de.linkedin.com/company/finanz-informatik,,,,,,,,,,,
linkedin,Anwendungsentwickler Kennzahlendienste,Finanz Informatik,"Hannover, Lower Saxony, Germany",2026-05-27,https://www.linkedin.com/jobs/view/4409903580 , ,li-4409903580,fulltime,,,,,,False,associate,"Project Management, Information Technology, and Product Management",,,"IT Services and IT Consulting, Banking, and Financial Services",https://de.linkedin.com/company/finanz-informatik,,,,,,,,,,,
linkedin,Anwendungsentwickler Kennzahlendienste,Finanz Informatik,"Frankfurt, Hesse, Germany",2026-05-27,https://www.linkedin.com/jobs/view/4409917336 , ,li-4409917336,fulltime,,,,,,False,associate,"Project Management, Information Technology, and Product Management",,,"IT Services and IT Consulting, Banking, and Financial Services",https://de.linkedin.com/company/finanz-informatik,,,,,,,,,,,
linkedin,Anwendungsentwickler (w/m/d),Lüddemann Investments GmbH,"Verl, North Rhine-Westphalia, Germany",2026-05-27,https://www.linkedin.com/jobs/view/4417200746 , ,li-4417200746,fulltime,,,,,,False,entry level,Engineering and Information Technology,,,Professional Training and Coaching,https://de.linkedin.com/company/l-ddemann-investments-gmbh,,,,,,,,,,,
linkedin,Anwendungsentwickler (m/w/d),Reiser Simulation and Training GmbH,"Berg, Bavaria, Germany",2026-05-27,https://www.linkedin.com/jobs/view/4417224003 , ,li-4417224003,fulltime,,,,,,False,mid-senior level,Information Technology,,,Information Technology & Services,https://de.linkedin.com/company/reiser-simulation-and-training,,,,,,,,,,,
linkedin,PIM Developer (gn),TAKKT Group,"Stuttgart, Baden-Württemberg, Germany",2026-05-27,https://www.linkedin.com/jobs/view/4408847939 , ,li-4408847939,fulltime,,,,,,False,entry level,Engineering and Information Technology,,,Wholesale,https://de.linkedin.com/company/takkt-ag,,,,,,,,,,,
linkedin,Developer Experience (DX) Engineer,Jobgether,,2026-05-27,https://www.linkedin.com/jobs/view/4417206746 , ,li-4417206746,fulltime,,,,,,True,mid-senior level,Engineering and Information Technology,,,Internet Marketplace Platforms,https://be.linkedin.com/company/jobgether,,,,,,,,,,,
linkedin,Shopify Entwickler/in (100% Remote),BlickSolutions GmbH - Shopify Plus Partner,,2026-05-27,https://www.linkedin.com/jobs/view/4416878856 , ,li-4416878856,fulltime,,,,,,True,associate,Information Technology,,,IT Services and IT Consulting,https://de.linkedin.com/company/blicksolutions,,,,,,,,,,,
linkedin,Application Developer (w/m/d),recruitable.tech,,2026-05-27,https://www.linkedin.com/jobs/view/4417221005 , ,li-4417221005,fulltime,,,,,,True,associate,Information Technology,,,Information Services,https://de.linkedin.com/company/recruitable-tech,,,,,,,,,,,
linkedin,Soft Component Developer (m/f/d),RIMOWA,"Cologne, North Rhine-Westphalia, Germany",2026-05-27,https://www.linkedin.com/jobs/view/4314690612 , ,li-4314690612,fulltime,,,,,,False,mid-senior level,Engineering and Information Technology,,,Retail Luxury Goods and Jewelry,https://de.linkedin.com/company/rimowa,,,,,,,,,,,
linkedin,Freelance Full-Stack Web App Developer,Mindrift,,2026-05-27,https://www.linkedin.com/jobs/view/4419935452 , ,li-4419935452,parttime,,,,,,True,mid-senior level,Other,,,IT Services and IT Consulting,https://www.linkedin.com/company/mindrift-ai,,,,,,,,,,,
linkedin,Business Development Specialist – mit Deutschkenntnissen (m/w/d),Blue Projects,,2026-05-27,https://www.linkedin.com/jobs/view/4419855823 , ,li-4419855823,fulltime,,,,,,False,associate,Sales and Business Development,,,Engineering Services and Construction,https://ro.linkedin.com/company/blue-projects-company,,,,,,,,,,,
linkedin,Senior Field-Programmable Gate Arrays (FPGA) Engineer (m/f/x),DSI Aerospace GmbH,"Bremen, Bremen, Germany",2026-05-27,https://www.linkedin.com/jobs/view/4419581713 , ,li-4419581713,fulltime,,,,,,False,associate,Engineering and Information Technology,,,Defense and Space Manufacturing,https://de.linkedin.com/company/dsi-aerospace,,,,,,,,,,,
linkedin,FPGA Engineer (m/w/d) Industrial Production Technology (Semiconductors),Amoria Bond,"Freiburg, Baden-Württemberg, Germany",2026-05-26,https://www.linkedin.com/jobs/view/4419453484 , ,li-4419453484,fulltime,,,,,,False,not applicable,Engineering,,,Renewable Energy Semiconductor Manufacturing,https://uk.linkedin.com/company/amoria-bond,,,,,,,,,,,
linkedin,FPGA Development / System Integration Engineer (f/m/d),Universal Quantum,"Hamburg, Hamburg, Germany",2026-05-26,https://www.linkedin.com/jobs/view/4419412061 , ,li-4419412061,fulltime,,,,,,False,associate,Engineering,,,IT Services and IT Consulting,https://uk.linkedin.com/company/universal-quantum,,,,,,,,,,,
linkedin,Lagerist (m/f/d) - für die Halbleiterindustrie,Applied Materials Europe,"Heimstetten, Bavaria, Germany",2026-05-26,https://www.linkedin.com/jobs/view/4408429789 , ,li-4408429789,fulltime,,,,,,False,not applicable,Management and Manufacturing,,,"Appliances, Electrical, and Electronics Manufacturing, Nanotechnology Research, and Semiconductor Manufacturing",https://nl.linkedin.com/company/applied-materials-europe,,,,,,,,,,,
linkedin,KI-Entwickler (m/w/d),ivv GmbH,"Hannover, Lower Saxony, Germany",2026-05-26,https://www.linkedin.com/jobs/view/4415297053 , ,li-4415297053,fulltime,,,,,,False,entry level,Engineering and Information Technology,,Recruiting@vgh.de,"Technology, Information and Internet",https://de.linkedin.com/company/ivv-gmbh,,,,,,,,,,,
linkedin,Entwickler mit Erfahrungen im Bereich Derivate (30325-23DEV),TPN2,"Frankfurt, Hesse, Germany",2026-05-26,https://www.linkedin.com/jobs/view/4419151801 , ,li-4419151801,fulltime,,,,,,True,entry level,Engineering and Information Technology,,,IT Services and IT Consulting,https://www.linkedin.com/company/tpn2,,,,,,,,,,,
linkedin,Director of Analog Design,European Tech Recruit,"Munich, Bavaria, Germany",2026-05-26,https://www.linkedin.com/jobs/view/4419453299 , ,li-4419453299,fulltime,,,,,,False,director,"Engineering, Information Technology, and Management",,,"Semiconductor Manufacturing, Computer Hardware Manufacturing, and Software Development",https://uk.linkedin.com/company/european-tech-recruit,,,,,,,,,,,
linkedin,"Copilot Studio Entwickler (m,d,w) gesucht / Berlin & Remote",Computer Futures,"Berlin, Berlin, Germany",2026-05-26,https://www.linkedin.com/jobs/view/4419447366 , ,li-4419447366,fulltime,,,,,,True,not applicable,Information Technology,,,Software Development,https://uk.linkedin.com/company/computerfutures,,,,,,,,,,,
linkedin,Principal ASIC Verification Engineer,Synopsys Inc,"Munich, Bavaria, Germany",2026-05-26,https://www.linkedin.com/jobs/view/4369771442 , ,li-4369771442,fulltime,,,,,,False,mid-senior level,"Design, Consulting, and Engineering",,,"Semiconductor Manufacturing, Software Development, and Computer Hardware Manufacturing",https://www.linkedin.com/company/synopsys,,,,,,,,,,,
linkedin,Developer Relations/Experience  Engineer - Kimchi,Cast AI,"Berlin, Berlin, Germany",2026-05-25,https://www.linkedin.com/jobs/view/4418935347 , ,li-4418935347,fulltime,,,,,,True,mid-senior level,Design and Engineering,,,"Construction, Software Development, and IT Services and IT Consulting",https://www.linkedin.com/company/cast-ai,,,,,,,,,,,
linkedin,Application Developer,Haystack,"Horn, North Rhine-Westphalia, Germany",2026-05-25,https://www.linkedin.com/jobs/view/4414879048 , ,li-4414879048,fulltime,,,,,,False,mid-senior level,Engineering and Information Technology,,,"Technology, Information and Internet",https://uk.linkedin.com/company/wearehaystack,,,,,,,,,,,
linkedin,DSP ASIC Verification Engineer - Optical Transmission Systems,Ciena,,2026-05-25,https://www.linkedin.com/jobs/view/4414700934 , ,li-4414700934,fulltime,,,,,,False,mid-senior level,Quality Assurance,,,Telecommunications,https://www.linkedin.com/company/ciena,,,,,,,,,,,
linkedin,Specialist Field Application Engineer for FPGA,Future Electronics,,2026-05-25,https://www.linkedin.com/jobs/view/4407186677 , ,li-4407186677,fulltime,,,,,,False,mid-senior level,Sales and Business Development,,nik.rodway@futureelectronics.com,"Appliances, Electrical, and Electronics Manufacturing",https://ca.linkedin.com/company/future-electronics,,,,,,,,,,,
linkedin,DSP ASIC Design Engineer - Optical Transmission Systems,Ciena,,2026-05-25,https://www.linkedin.com/jobs/view/4414499911 , ,li-4414499911,fulltime,,,,,,False,mid-senior level,Engineering and Information Technology,,,Telecommunications,https://www.linkedin.com/company/ciena,,,,,,,,,,,
linkedin,"ASIC Digital Design, Principal Engineer",Synopsys Inc,"Munich, Bavaria, Germany",2026-05-25,https://www.linkedin.com/jobs/view/4388510623 , ,li-4388510623,fulltime,,,,,,False,mid-senior level,"Design, Consulting, and Engineering",,,"Semiconductor Manufacturing, Software Development, and Computer Hardware Manufacturing",https://www.linkedin.com/company/synopsys,,,,,,,,,,,
linkedin,FPGA Design Engineer (m/f/d),GE Vernova,"Berlin, Berlin, Germany",2026-05-24,https://www.linkedin.com/jobs/view/4362716473 , ,li-4362716473,fulltime,,,,,,False,mid-senior level,Engineering and Information Technology,,,Energy Technology,https://www.linkedin.com/company/gevernova,,,,,,,,,,,
linkedin,Staff Engineer Functional Verification & Methodology (f/m/div),Infineon Technologies,"Munich, Bavaria, Germany",2026-05-24,https://www.linkedin.com/jobs/view/4369737807 , ,li-4369737807,fulltime,,,,,,False,mid-senior level,Engineering and Information Technology,,,"Semiconductor Manufacturing, Appliances, Electrical, and Electronics Manufacturing, and Computer Hardware Manufacturing",https://de.linkedin.com/company/infineon-technologies,,,,,,,,,,,
linkedin,Venture Developer (m/w/d),BFS health finance GmbH,"Dortmund, North Rhine-Westphalia, Germany",2026-05-23,https://www.linkedin.com/jobs/view/4271751566 , ,li-4271751566,fulltime,,,,,,False,mid-senior level,Engineering and Information Technology,,,Financial Services,https://de.linkedin.com/company/bfs-health-finance-gmbh,,,,,,,,,,,
linkedin,"Early Career — DFT Engineer (M, F, D)",Apple,"Munich, Bavaria, Germany",,https://www.linkedin.com/jobs/view/4421047596 , ,li-4421047596,fulltime,,,,,,False,entry level,Engineering and Information Technology,,,Computers and Electronics Manufacturing,https://www.linkedin.com/company/apple,,,,,,,,,,,
linkedin,Director Analog Design (f/m/d),Renesas Electronics,"Dresden, Saxony, Germany",,https://www.linkedin.com/jobs/view/4364091623 , ,li-4364091623,fulltime,,,,,,True,director,Manufacturing,,,Semiconductors,https://jp.linkedin.com/company/renesas,,,,,,,,,,,
linkedin,Mixed Signal Design Engineer (m/f/d),Micron Technology,"Munich, Bavaria, Germany",,https://www.linkedin.com/jobs/view/4410839324 , ,li-4410839324,fulltime,,,,,,False,entry level,Other,,"_EMEA@micron.com, _TA@micron.com","Computer Hardware Manufacturing, Appliances, Electrical, and Electronics Manufacturing, and Semiconductor Manufacturing",https://www.linkedin.com/company/micron-technology,,,,,,,,,,,
linkedin,Package Development Engineer,imec in Vlaanderen,,,https://www.linkedin.com/jobs/view/4417942814 , ,li-4417942814,fulltime,,,,,,False,mid-senior level,Engineering and Information Technology,,,Research Services,https://be.linkedin.com/showcase/imec-vlaanderen/,,,,,,,,,,,
linkedin,Principal Digital Design Engineer (m/f/d),Micron Technology,"Munich, Bavaria, Germany",,https://www.linkedin.com/jobs/view/4410844306 , ,li-4410844306,fulltime,,,,,,False,mid-senior level,Other,,"_EMEA@micron.com, _TA@micron.com","Computer Hardware Manufacturing, Appliances, Electrical, and Electronics Manufacturing, and Semiconductor Manufacturing",https://www.linkedin.com/company/micron-technology,,,,,,,,,,,
linkedin,"DFT Engineer (M, F, D)",Apple,"Munich, Bavaria, Germany",,https://www.linkedin.com/jobs/view/4421048546 , ,li-4421048546,fulltime,,,,,,False,mid-senior level,Engineering and Information Technology,,,Computers and Electronics Manufacturing,https://www.linkedin.com/company/apple,,,,,,,,,,,
linkedin,Engineer Transfer/New Products (m/w/d),Vishay Siliconix Itzehoe GmbH,"Itzehoe, Schleswig-Holstein, Germany",,https://www.linkedin.com/jobs/view/4417677481 , ,li-4417677481,fulltime,,,,,,True,entry level,Engineering and Information Technology,,,Semiconductor Manufacturing,https://de.linkedin.com/company/vishay-siliconix-itzehoe-gmbh,,,,,,,,,,,
linkedin,Principal Engineer: Mixed Signal Design (m/f/d),Micron Technology,"Munich, Bavaria, Germany",,https://www.linkedin.com/jobs/view/4410844304 , ,li-4410844304,fulltime,,,,,,False,mid-senior level,Other,,"_EMEA@micron.com, _TA@micron.com","Computer Hardware Manufacturing, Appliances, Electrical, and Electronics Manufacturing, and Semiconductor Manufacturing",https://www.linkedin.com/company/micron-technology,,,,,,,,,,,
linkedin,Senior System Engineer – Commissioning & Global Product Support (m/f/d),Applied Materials Europe,"Darmstadt, Hesse, Germany",,https://www.linkedin.com/jobs/view/4409613098 , ,li-4409613098,fulltime,,,,,,False,not applicable,Information Technology,,,"Appliances, Electrical, and Electronics Manufacturing, Nanotechnology Research, and Semiconductor Manufacturing",https://nl.linkedin.com/company/applied-materials-europe,,,,,,,,,,,
linkedin,FPGA- & Embedded-Engineer (all gender),ALTEN Germany,,,https://www.linkedin.com/jobs/view/4398216831 , ,li-4398216831,fulltime,,,,,,False,associate,Information Technology,,,IT Services and IT Consulting,https://de.linkedin.com/company/altengermany,,,,,,,,,,,
linkedin,ASIC Analog Design Engineer (m/f/d) - REF5386X,AUMOVIO,"Frankfurt, Hesse, Germany",,https://www.linkedin.com/jobs/view/4420499613 , ,li-4420499613,fulltime,,,,,,False,mid-senior level,Design,,,Automotive,https://de.linkedin.com/company/aumovio,,,,,,,,,,,
linkedin,ASIC Analog Design Engineer (m/f/d) - REF5386X,AUMOVIO,"Regensburg, Bavaria, Germany",,https://www.linkedin.com/jobs/view/4420499612 , ,li-4420499612,fulltime,,,,,,False,mid-senior level,Design,,,Automotive,https://de.linkedin.com/company/aumovio,,,,,,,,,,,
linkedin,Senior Typescript Developer (f/m/d),SIDESTREAM,,,https://www.linkedin.com/jobs/view/4417909573 , ,li-4417909573,fulltime,,,,,,True,mid-senior level,Information Technology,,,IT Services and IT Consulting,https://de.linkedin.com/company/sidestreamtech,,,,,,,,,,,
linkedin,Wirtschaftsinformatiker als Anwendungsentwickler (m/w/d),dsb IT-Services GmbH,"Neckarsulm, Baden-Württemberg, Germany",,https://www.linkedin.com/jobs/view/4417917805 , ,li-4417917805,fulltime,,,,,,False,mid-senior level,Information Technology,,,Information Technology & Services,https://de.linkedin.com/company/dsb-it-services-gmbh,,,,,,,,,,,
