site,title,company,location,date_posted,job_url,job_url_direct,id,job_type,salary_source,interval,min_amount,max_amount,currency,is_remote,job_level,job_function,listing_type,emails,company_industry,company_url,company_url_direct,company_addresses,company_num_employees,company_revenue,company_description,skills,experience_range,company_rating,company_reviews_count,vacancy_count,work_from_home_type
linkedin,Experienced AMS Design Verification Engineer (m/f/d),Apple,"Munich, Bavaria, Germany",,https://www.linkedin.com/jobs/view/4414165462 , ,li-4414165462,fulltime,,,,,,False,mid-senior level,Engineering and Information Technology,,,Computers and Electronics Manufacturing,https://www.linkedin.com/company/apple,,,,,,,,,,,
linkedin,Cellular SoC Frontend STA Engineer (m/f/d),Apple,"Munich, Bavaria, Germany",,https://www.linkedin.com/jobs/view/4414166478 , ,li-4414166478,fulltime,,,,,,False,mid-senior level,Engineering and Information Technology,,,Computers and Electronics Manufacturing,https://www.linkedin.com/company/apple,,,,,,,,,,,
linkedin,CAD Logic Equivalence Checking (LEQ) Engineer - m/f/d,Apple,"Munich, Bavaria, Germany",,https://www.linkedin.com/jobs/view/4414170144 , ,li-4414170144,fulltime,,,,,,False,mid-senior level,Engineering and Information Technology,,,Computers and Electronics Manufacturing,https://www.linkedin.com/company/apple,,,,,,,,,,,
linkedin,Lead Application Engineer,Cadence,"Feldkirchen, Bavaria, Germany",,https://www.linkedin.com/jobs/view/4414494775 , ,li-4414494775,fulltime,,,,,,False,mid-senior level,Engineering and Information Technology,,,Software Development,https://www.linkedin.com/company/cadence,,,,,,,,,,,
linkedin,"SOC Physical Design Engineer (M, F, D)",Apple,"Munich, Bavaria, Germany",,https://www.linkedin.com/jobs/view/4414156798 , ,li-4414156798,fulltime,,,,,,False,mid-senior level,Engineering and Information Technology,,,Computers and Electronics Manufacturing,https://www.linkedin.com/company/apple,,,,,,,,,,,
linkedin,Digital Design Engineer Prime (FEC),Ciena,,,https://www.linkedin.com/jobs/view/4414194230 , ,li-4414194230,fulltime,,,,,,False,mid-senior level,Engineering and Information Technology,,,Telecommunications,https://www.linkedin.com/company/ciena,,,,,,,,,,,
linkedin,DSP ASIC Design Engineer - Optical Transmission Systems,Ciena,,,https://www.linkedin.com/jobs/view/4414499911 , ,li-4414499911,fulltime,,,,,,False,mid-senior level,Engineering and Information Technology,,,Telecommunications,https://www.linkedin.com/company/ciena,,,,,,,,,,,
linkedin,DSP ASIC Verification Engineer - Optical Transmission Systems,Ciena,,,https://www.linkedin.com/jobs/view/4414700934 , ,li-4414700934,fulltime,,,,,,False,mid-senior level,Quality Assurance,,,Telecommunications,https://www.linkedin.com/company/ciena,,,,,,,,,,,
linkedin,Software Developer for Application Development (f/m/d),Deutsche Börse Group,"Frankfurt, Hesse, Germany",,https://www.linkedin.com/jobs/view/4414195542 , ,li-4414195542,fulltime,,,,,,False,not applicable,Engineering and Information Technology,,,Financial Services,https://de.linkedin.com/company/deutscheboersegroup,,,,,,,,,,,
linkedin,Radio Frequency Antenna Developer M.F.D.,Ericsson,"Rosenheim, Bavaria, Germany",,https://www.linkedin.com/jobs/view/4404451543 , ,li-4404451543,fulltime,,,,,,False,not applicable,Other,,,Telecommunications,https://se.linkedin.com/company/ericsson,,,,,,,,,,,
linkedin,Schnittstellen Entwickler/in,Nexus AG,"Berlin, Berlin, Germany",,https://www.linkedin.com/jobs/view/4411181045 , ,li-4411181045,fulltime,,,,,,False,mid-senior level,Information Technology,,,Professional Services,https://de.linkedin.com/company/nexus-ag,,,,,,,,,,,
