site,title,company,location,date_posted,job_url,job_url_direct,id,job_type,salary_source,interval,min_amount,max_amount,currency,is_remote,job_level,job_function,listing_type,emails,company_industry,company_url,company_url_direct,company_addresses,company_num_employees,company_revenue,company_description,skills,experience_range,company_rating,company_reviews_count,vacancy_count,work_from_home_type
linkedin,ASIC Digital Design Expert (f/m/div),Bosch,"Dresden, Saxony, Germany",2026-04-16,https://www.linkedin.com/jobs/view/4401871664 , ,li-4401871664,fulltime,,,,,,False,associate,Information Technology,,,Semiconductors,https://de.linkedin.com/company/bosch,,,,,,,,,,,
linkedin,(Senior) Go Developer - Plattform Engineering (m/w/d),Schwarz Digits,"Stadt Heilbronn, Baden-Württemberg, Germany",2026-04-16,https://www.linkedin.com/jobs/view/4402116283 , ,li-4402116283,fulltime,,,,,,False,mid-senior level,Engineering and Information Technology,,,IT Services and IT Consulting,https://de.linkedin.com/company/schwarz-digits,,,,,,,,,,,
linkedin,Entwickler/in Elektronik FPGA Design (w/m/d),Spectrum Instrumentation,"Großhansdorf, Schleswig-Holstein, Germany",2026-04-16,https://www.linkedin.com/jobs/view/4392895187 , ,li-4392895187,fulltime,,,,,,False,entry level,Engineering,,,Administrative and Support Services,https://de.linkedin.com/company/spectrum-instrumentation,,,,,,,,,,,
linkedin,Platform Developer,Haystack,,2026-04-16,https://www.linkedin.com/jobs/view/4402143507 , ,li-4402143507,fulltime,,,,,,False,mid-senior level,Information Technology,,,"Technology, Information and Internet",https://uk.linkedin.com/company/wearehaystack,,,,,,,,,,,
linkedin,FPGA Engineer (m/w/d) Industrial Production Technology (Semiconductors),Amoria Bond,"Freiburg, Baden-Württemberg, Germany",2026-04-16,https://www.linkedin.com/jobs/view/4402953048 , ,li-4402953048,fulltime,,,,,,False,not applicable,Engineering,,,Renewable Energy Semiconductor Manufacturing,https://uk.linkedin.com/company/amoria-bond,,,,,,,,,,,
linkedin,Field-Programmable Gate Arrays Engineer,Vivid Resourcing,"Munich, Bavaria, Germany",2026-04-16,https://www.linkedin.com/jobs/view/4402913865 , ,li-4402913865,contract,,,,,,False,mid-senior level,Engineering,,,Engineering Services,https://uk.linkedin.com/company/vivid-resourcing-ltd,,,,,,,,,,,
linkedin,Developer Documentation Writer (all genders),Text Control,"Bremen, Bremen, Germany",2026-04-16,https://www.linkedin.com/jobs/view/4402976332 , ,li-4402976332,fulltime,,,,,,False,entry level,"Marketing, Public Relations, and Writing/Editing",,,Software Development,https://www.linkedin.com/company/tx-text-control,,,,,,,,,,,
linkedin,Developer (ERP) IFS Applications / IFS Cloud™ (w/m/d),DMC Datenverarbeitungs- und Management Consulting GmbH,"Kiel, Schleswig-Holstein, Germany",2026-04-16,https://www.linkedin.com/jobs/view/4402984239 , ,li-4402984239,fulltime,,,,,,False,entry level,Engineering and Information Technology,,,IT Services and IT Consulting,https://de.linkedin.com/company/dmc-datenverarbeitungs-und-management-consulting-gmbh,,,,,,,,,,,
linkedin,Senior POS Developer - Ireland based,Expleo Group,"Frankfurt am Main, Hesse, Germany",2026-04-16,https://www.linkedin.com/jobs/view/4370540495 , ,li-4370540495,contract,,,,,,False,mid-senior level,Engineering and Information Technology,,,IT Services and IT Consulting,https://fr.linkedin.com/company/expleo-group,,,,,,,,,,,
linkedin,Senior Applications Engineer – Material Information Management (m/f/d),Synopsys Inc,"Otterfing, Bavaria, Germany",2026-04-16,https://www.linkedin.com/jobs/view/4402141649 , ,li-4402141649,fulltime,,,,,,False,mid-senior level,"Design, Consulting, and Engineering",,,"Semiconductor Manufacturing, Software Development, and Computer Hardware Manufacturing",https://www.linkedin.com/company/synopsys,,,,,,,,,,,
linkedin,Director Analog Design (f/m/d),Renesas Electronics,"Munich, Bavaria, Germany",2026-04-16,https://www.linkedin.com/jobs/view/4402957828 , ,li-4402957828,fulltime,,,,,,False,director,Information Technology,,,Semiconductor Manufacturing,https://jp.linkedin.com/company/renesas,,,,,,,,,,,
linkedin,Senior Rust Developer,Workato,"Munich, Bavaria, Germany",2026-04-15,https://www.linkedin.com/jobs/view/4402648437 , ,li-4402648437,fulltime,,,,,,True,mid-senior level,Engineering and Information Technology,,,Software Development,https://www.linkedin.com/company/workato,,,,,,,,,,,
linkedin,Application Developer (f/d/m),Worldline,"Aachen, North Rhine-Westphalia, Germany",2026-04-15,https://www.linkedin.com/jobs/view/4389707398 , ,li-4389707398,fulltime,,,,,,False,mid-senior level,Engineering and Information Technology,,,Financial Services,https://fr.linkedin.com/company/worldlineglobal,,,,,,,,,,,
linkedin,Mobile App Developer (m/f/d),Axess Intelligence,"Cologne, North Rhine-Westphalia, Germany",2026-04-15,https://www.linkedin.com/jobs/view/4402273716 , ,li-4402273716,fulltime,,,,,,False,entry level,Engineering and Information Technology,,careers@axessintelligence.com,Business Intelligence Platforms,https://de.linkedin.com/company/axess-intelligence,,,,,,,,,,,
linkedin,Computer Applications Developer,Peraton,"Wiesbaden, Hesse, Germany",2026-04-15,https://www.linkedin.com/jobs/view/4401437341 , ,li-4401437341,fulltime,,,,,,False,not applicable,Information Technology,,,Civil Engineering,https://www.linkedin.com/company/peraton,,,,,,,,,,,
linkedin,Entwickler:in Steuersysteme,yes4match,"Oldenburg, Lower Saxony, Germany",2026-04-15,https://www.linkedin.com/jobs/view/4399507616 , ,li-4399507616,fulltime,,,,,,True,associate,Information Technology,,,Staffing and Recruiting and Nanotechnology Research,https://www.linkedin.com/company/yes4match,,,,,,,,,,,
linkedin,Computer Application and Engineering (SIEM) Developer,Peraton,"Wiesbaden, Hesse, Germany",2026-04-15,https://www.linkedin.com/jobs/view/4401427505 , ,li-4401427505,fulltime,,,,,,False,not applicable,Information Technology,,,Civil Engineering,https://www.linkedin.com/company/peraton,,,,,,,,,,,
linkedin,Camunda Senior Developer/ Integrator (all genders),BNP Paribas,"Munich, Bavaria, Germany",2026-04-15,https://www.linkedin.com/jobs/view/4402251454 , ,li-4402251454,fulltime,,,,,,False,mid-senior level,Engineering and Information Technology,,,Banking,https://fr.linkedin.com/company/bnp-paribas,,,,,,,,,,,
linkedin,Senior Rust Developer,Workato,"Frankfurt, Hesse, Germany",2026-04-15,https://www.linkedin.com/jobs/view/4402631627 , ,li-4402631627,fulltime,,,,,,True,mid-senior level,Engineering and Information Technology,,,Software Development,https://www.linkedin.com/company/workato,,,,,,,,,,,
linkedin,Senior Rust Developer,Workato,"Berlin, Berlin, Germany",2026-04-15,https://www.linkedin.com/jobs/view/4402641561 , ,li-4402641561,fulltime,,,,,,True,mid-senior level,Engineering and Information Technology,,,Software Development,https://www.linkedin.com/company/workato,,,,,,,,,,,
linkedin,Director of Engineering,European Tech Recruit,,2026-04-15,https://www.linkedin.com/jobs/view/4402508264 , ,li-4402508264,fulltime,,,,,,False,director,Engineering and Management,,,Semiconductor Manufacturing and Telecommunications,https://uk.linkedin.com/company/european-tech-recruit,,,,,,,,,,,
linkedin,Director Analog Design (f/m/d),Renesas Electronics,"Bingen, Rhineland-Palatinate, Germany",2026-04-15,https://www.linkedin.com/jobs/view/4364361378 , ,li-4364361378,fulltime,,,,,,True,director,Manufacturing,,,Semiconductors,https://jp.linkedin.com/company/renesas,,,,,,,,,,,
linkedin,Director Analog Design (f/m/d),Renesas Electronics,"Dresden, Saxony, Germany",2026-04-15,https://www.linkedin.com/jobs/view/4364091623 , ,li-4364091623,fulltime,,,,,,True,director,Manufacturing,,,Semiconductors,https://jp.linkedin.com/company/renesas,,,,,,,,,,,
linkedin,Director of Analog Design,European Tech Recruit,"Munich, Bavaria, Germany",2026-04-15,https://www.linkedin.com/jobs/view/4402269322 , ,li-4402269322,fulltime,,,,,,False,director,"Engineering, Information Technology, and Management",,,"Semiconductor Manufacturing, Computer Hardware Manufacturing, and Software Development",https://uk.linkedin.com/company/european-tech-recruit,,,,,,,,,,,
linkedin,EMC Engineer (f/m/d),NXP Semiconductors,"Munich, Bavaria, Germany",2026-04-15,https://www.linkedin.com/jobs/view/4402531935 , ,li-4402531935,fulltime,,,,,,False,mid-senior level,Engineering and Information Technology,,,"Semiconductor Manufacturing, Computers and Electronics Manufacturing, and Software Development",https://nl.linkedin.com/company/nxp-semiconductors,,,,,,,,,,,
linkedin,Account Representative,Ansys,"Munich, Bavaria, Germany",2026-04-15,https://www.linkedin.com/jobs/view/4401435251 , ,li-4401435251,fulltime,,,,,,False,associate,Sales and Business Development,,,Software Development,https://www.linkedin.com/company/ansys-inc,,,,,,,,,,,
linkedin,"Design Verification Engineer, Automotive Robotics",Tenstorrent,"Munich, Bavaria, Germany",2026-04-15,https://www.linkedin.com/jobs/view/4377766427 , ,li-4377766427,fulltime,,,,,,True,mid-senior level,Engineering and Information Technology,,,Computer Hardware Manufacturing,https://ca.linkedin.com/company/tenstorrent-inc.,,,,,,,,,,,
linkedin,ASIC Verification Engineer (f/m/div.),Bosch Sensortec GmbH,,2026-04-14,https://www.linkedin.com/jobs/view/4399778039 , ,li-4399778039,fulltime,,,,,,False,associate,"Engineering, Information Technology, and Science",,,"Semiconductor Manufacturing, Computers and Electronics Manufacturing, and Appliances, Electrical, and Electronics Manufacturing",https://de.linkedin.com/company/bosch-sensortec,,,,,,,,,,,
linkedin,Electronics Developer (m/f/d) with VHDL skills,Emerson,"Baden-Württemberg, Germany",2026-04-14,https://www.linkedin.com/jobs/view/4402006248 , ,li-4402006248,fulltime,,,,,,False,entry level,Engineering and Information Technology,,idisability.administrator@emerson.com,Automation Machinery Manufacturing,https://www.linkedin.com/company/emerson,,,,,,,,,,,
linkedin,ASIC Analog Design Expert (f/m/div),Bosch Sensortec GmbH,,2026-04-14,https://www.linkedin.com/jobs/view/4399781097 , ,li-4399781097,fulltime,,,,,,False,associate,Engineering and Information Technology,,,Computers and Electronics Manufacturing,https://de.linkedin.com/company/bosch-sensortec,,,,,,,,,,,
linkedin,Senior Backend Entwickler (C# .NET) (m/w/d),Instaffo,"Bremen, Bremen, Germany",2026-04-14,https://www.linkedin.com/jobs/view/4335155770 , ,li-4335155770,fulltime,,,,,,False,mid-senior level,Information Technology and Engineering,,,IT Services and IT Consulting,https://de.linkedin.com/company/instaffo-gmbh,,,,,,,,,,,
linkedin,Display - Entwickler / Designer (m/w/d),Brohl Wellpappe GmbH & Co.KG,"Niederzier, North Rhine-Westphalia, Germany",2026-04-14,https://www.linkedin.com/jobs/view/4399760407 , ,li-4399760407,fulltime,,,,,,False,entry level,Engineering and Information Technology,,,Packaging & Containers,https://de.linkedin.com/company/www-wellpappe-de,,,,,,,,,,,
linkedin,FPGA- & Embedded-Engineer (all gender),ALTEN Germany,,2026-04-14,https://www.linkedin.com/jobs/view/4398216831 , ,li-4398216831,fulltime,,,,,,False,associate,Information Technology,,,IT Services and IT Consulting,https://de.linkedin.com/company/altengermany,,,,,,,,,,,
linkedin,Senior FPGA Design Engineer (Power Electronics),Keysight Technologies,"Bochum, North Rhine-Westphalia, Germany",2026-04-14,https://www.linkedin.com/jobs/view/4399759927 , ,li-4399759927,fulltime,,,,,,False,not applicable,Engineering and Information Technology,,,"Appliances, Electrical, and Electronics Manufacturing",https://www.linkedin.com/company/keysight-technologies,,,,,,,,,,,
linkedin,"Power Electronics Engineer for Computing Systems (Datacenter, Telecom, ASICs, xPU, HPCs)",European Tech Recruit,"Nuremberg, Bavaria, Germany",2026-04-14,https://www.linkedin.com/jobs/view/4401710609 , ,li-4401710609,fulltime,,,,,,False,mid-senior level,"Engineering, Design, and Information Technology",,,"Telecommunications, Computers and Electronics Manufacturing, and Computer Hardware Manufacturing",https://uk.linkedin.com/company/european-tech-recruit,,,,,,,,,,,
linkedin,Senior Physical Design Engineer (m/f/d) – ASIC / SoC,MegaPart GmbH,,2026-04-14,https://www.linkedin.com/jobs/view/4399760750 , ,li-4399760750,fulltime,,,,,,False,associate,Engineering,,,Motor Vehicle Manufacturing,https://de.linkedin.com/company/megapart-gmbh,,,,,,,,,,,
linkedin,Hardware / FPGA Developer (m/f/d) for Analog and Digital Electronics - Semiconductor Development Division,PNDetector,"Munich, Bavaria, Germany",2026-04-14,https://www.linkedin.com/jobs/view/4401739415 , ,li-4401739415,fulltime,,,,,,False,entry level,Engineering,,-pnd@pndetector.de,Semiconductor Manufacturing,https://de.linkedin.com/company/pndetector,,,,,,,,,,,
linkedin,Application Development C++ (all gender),ALTEN Germany,,2026-04-14,https://www.linkedin.com/jobs/view/4352791827 , ,li-4352791827,fulltime,,,,,,False,associate,Information Technology,,,IT Services and IT Consulting,https://de.linkedin.com/company/altengermany,,,,,,,,,,,
linkedin,Unreal Developer (m/w/d),NSYNK,"Frankfurt, Hesse, Germany",2026-04-14,https://www.linkedin.com/jobs/view/4399747022 , ,li-4399747022,fulltime,,,,,,False,entry level,Engineering and Information Technology,,jobs@nsynk.de,Design Services,https://de.linkedin.com/company/nsynk,,,,,,,,,,,
linkedin,Senior Microservice Developer (all genders),PŸUR | Tele Columbus,,2026-04-13,https://www.linkedin.com/jobs/view/4384460483 , ,li-4384460483,fulltime,,,,,,True,associate,Engineering and Information Technology,,,Telecommunications,https://de.linkedin.com/company/telecolumbus,,,,,,,,,,,
linkedin,RF/Analog/Mixed Signal Engineer,Apple,"Munich, Bavaria, Germany",2026-04-13,https://www.linkedin.com/jobs/view/4399664110 , ,li-4399664110,fulltime,,,,,,False,entry level,Engineering and Information Technology,,,Computers and Electronics Manufacturing,https://www.linkedin.com/company/apple,,,,,,,,,,,
linkedin,Principal ASIC Verification Engineer,Synopsys Inc,"Munich, Bavaria, Germany",2026-04-13,https://www.linkedin.com/jobs/view/4369771442 , ,li-4369771442,fulltime,,,,,,False,mid-senior level,"Design, Consulting, and Engineering",,,"Semiconductor Manufacturing, Software Development, and Computer Hardware Manufacturing",https://www.linkedin.com/company/synopsys,,,,,,,,,,,
linkedin,"Principal Engineer, ASIC Digital Design",Synopsys Inc,"Munich, Bavaria, Germany",2026-04-13,https://www.linkedin.com/jobs/view/4370173213 , ,li-4370173213,fulltime,,,,,,False,mid-senior level,"Design, Consulting, and Engineering",,,"Semiconductor Manufacturing, Software Development, and Computer Hardware Manufacturing",https://www.linkedin.com/company/synopsys,,,,,,,,,,,
linkedin,Senior Field-Programmable Gate Arrays (FPGA) Engineer (m/f/x),DSI Aerospace GmbH,"Brunswick, Lower Saxony, Germany",2026-04-13,https://www.linkedin.com/jobs/view/4386320124 , ,li-4386320124,fulltime,,,,,,False,associate,Engineering and Information Technology,,,Defense and Space Manufacturing,https://de.linkedin.com/company/dsi-aerospace,,,,,,,,,,,
linkedin,Senior Digital ASIC Design Engineer (m/f/d),Advantest,"Böblingen, Baden-Württemberg, Germany",2026-04-13,https://www.linkedin.com/jobs/view/4401518911 , ,li-4401518911,fulltime,,,,,,False,mid-senior level,Engineering and Information Technology,,,Semiconductor Manufacturing,https://jp.linkedin.com/company/advantest,,,,,,,,,,,
linkedin,ASIC Analog Design Expert (f/m/div),Bosch,"Dresden, Saxony, Germany",2026-04-13,https://www.linkedin.com/jobs/view/4399178233 , ,li-4399178233,fulltime,,,,,,False,associate,Information Technology,,,Semiconductors,https://de.linkedin.com/company/bosch,,,,,,,,,,,
linkedin,Azure DevOps Specialist (m/f/d),KLA,,2026-04-12,https://www.linkedin.com/jobs/view/4348551513 , ,li-4348551513,fulltime,,,,,,True,entry level,Management and Manufacturing,,talent.acquisition@kla.com,Semiconductor Manufacturing,https://www.linkedin.com/company/klacorp,,,,,,,,,,,
linkedin,Implementations Entwickler:innen (m/w/d),Epic AI GmbH,"Flensburg, Schleswig-Holstein, Germany",2026-04-12,https://www.linkedin.com/jobs/view/4399367672 , ,li-4399367672,fulltime,,,,,,True,associate,Information Technology,,,Software Development,https://de.linkedin.com/company/epic-ai-gmbh,,,,,,,,,,,
linkedin,Staff Engineer Functional Verification & Methodology (f/m/div),Infineon Technologies,"Munich, Bavaria, Germany",2026-04-11,https://www.linkedin.com/jobs/view/4369737807 , ,li-4369737807,fulltime,,,,,,False,mid-senior level,Engineering and Information Technology,,,"Semiconductor Manufacturing, Appliances, Electrical, and Electronics Manufacturing, and Computer Hardware Manufacturing",https://de.linkedin.com/company/infineon-technologies,,,,,,,,,,,
linkedin,"ASIC Digital Design, Principal Engineer",Synopsys Inc,"Munich, Bavaria, Germany",2026-04-11,https://www.linkedin.com/jobs/view/4388510623 , ,li-4388510623,fulltime,,,,,,False,mid-senior level,"Design, Consulting, and Engineering",,,"Semiconductor Manufacturing, Software Development, and Computer Hardware Manufacturing",https://www.linkedin.com/company/synopsys,,,,,,,,,,,
linkedin,Elektronik Entwickler Defence (m/w/d),ep group,"Bremen, Bremen, Germany",2026-04-11,https://www.linkedin.com/jobs/view/4400661298 , ,li-4400661298,fulltime,,,,,,False,mid-senior level,Engineering and Information Technology,,,Alternative Dispute Resolution and Alternative Medicine,https://de.linkedin.com/company/ep-group-gmbh,,,,,,,,,,,
linkedin,Senior Embedded AI Developer (f/m/x),BMW Group,"Munich, Bavaria, Germany",,https://www.linkedin.com/jobs/view/4391064359 , ,li-4391064359,internship,,,,,,False,mid-senior level,Engineering and Information Technology,,,Motor Vehicle Manufacturing,https://de.linkedin.com/company/bmw-group,,,,,,,,,,,
linkedin,Senior Optics Engineer (m/f/d),Corning Incorporated,"Berlin, Berlin, Germany",,https://www.linkedin.com/jobs/view/4400469682 , ,li-4400469682,fulltime,,,,,,False,mid-senior level,"Research, Analyst, and Information Technology",,accommodations@corning.com,"Glass, Ceramics and Concrete Manufacturing",https://www.linkedin.com/company/corning-incorporated,,,,,,,,,,,
linkedin,ASIC Analog Layout Engineer (m/f/d) - REF5390S,AUMOVIO,"Frankfurt, Hesse, Germany",,https://www.linkedin.com/jobs/view/4403405139 , ,li-4403405139,fulltime,,,,,,False,mid-senior level,Design,,,Automotive,https://de.linkedin.com/company/aumovio,,,,,,,,,,,
linkedin,(Senior) ASIC Analog Design Engineer (m/f/d) - REF5389A,AUMOVIO,"Frankfurt, Hesse, Germany",,https://www.linkedin.com/jobs/view/4403412058 , ,li-4403412058,fulltime,,,,,,False,mid-senior level,Design,,,Automotive,https://de.linkedin.com/company/aumovio,,,,,,,,,,,
linkedin,Precision Senior Analog IC Design Engineer,IC Resources,"Berlin, Berlin, Germany",,https://www.linkedin.com/jobs/view/4403131584 , ,li-4403131584,fulltime,,,,,,False,mid-senior level,Engineering and Information Technology,,,Staffing and Recruiting,https://uk.linkedin.com/company/icresources,,,,,,,,,,,
linkedin,Supplier Quality Engineer (m/f/d) - semiconductor industry,Applied Materials Europe,"Heimstetten, Bavaria, Germany",,https://www.linkedin.com/jobs/view/4400836923 , ,li-4400836923,fulltime,,,,,,False,not applicable,Quality Assurance,,,"Appliances, Electrical, and Electronics Manufacturing, Nanotechnology Research, and Semiconductor Manufacturing",https://nl.linkedin.com/company/applied-materials-europe,,,,,,,,,,,
linkedin,IC Digital Design Technical Lead,Michael Page,"Munich, Bavaria, Germany",,https://www.linkedin.com/jobs/view/4400802127 , ,li-4400802127,fulltime,,,,,,False,mid-senior level,Manufacturing and Engineering,,,Staffing and Recruiting,https://uk.linkedin.com/company/michael-page,,,,,,,,,,,
linkedin,ASIC Analog Design Engineer (m/f/d) - REF5386X,AUMOVIO,"Frankfurt, Hesse, Germany",,https://www.linkedin.com/jobs/view/4403190970 , ,li-4403190970,fulltime,,,,,,False,mid-senior level,Design,,,Automotive,https://de.linkedin.com/company/aumovio,,,,,,,,,,,
linkedin,Entwickler Systemverkabelung (all gender),ALTEN Germany,"Bremen, Bremen, Germany",,https://www.linkedin.com/jobs/view/4350282045 , ,li-4350282045,fulltime,,,,,,False,associate,Engineering,,,Engineering Services,https://de.linkedin.com/company/altengermany,,,,,,,,,,,
linkedin,Developer / Development Expert in Contact and Spring Technology,HARTING Technology Group,"Espelkamp, North Rhine-Westphalia, Germany",,https://www.linkedin.com/jobs/view/4390786943 , ,li-4390786943,fulltime,,,,,,False,mid-senior level,Engineering and Information Technology,,,Automation Machinery Manufacturing,https://de.linkedin.com/company/harting,,,,,,,,,,,
linkedin,Application Developer / Data Analyst,General Dynamics Information Technology,"Sembach, Rhineland-Palatinate, Germany",,https://www.linkedin.com/jobs/view/4371818968 , ,li-4371818968,fulltime,,,,,,False,mid-senior level,Engineering and Information Technology,,,IT Services and IT Consulting,https://www.linkedin.com/company/gdit,,,,,,,,,,,
linkedin,Senior Odoo Developer (all genders),Sunday Natural,"Berlin, Berlin, Germany",,https://www.linkedin.com/jobs/view/4359186929 , ,li-4359186929,fulltime,,,,,,False,mid-senior level,Engineering and Information Technology,,,"Health, Wellness & Fitness",https://www.linkedin.com/company/sunday-natural-products-gmbh,,,,,,,,,,,
linkedin,Senior Developer: Safe Vehicle Identification (m/f/d),Copernicus Autonomous Control Systems,"Brandenburg on the Havel, Brandenburg, Germany",,https://www.linkedin.com/jobs/view/4402714663 , ,li-4402714663,fulltime,,,,,,True,mid-senior level,Information Technology,,,Software Development,https://de.linkedin.com/company/copernicusauto,,,,,,,,,,,
