site,title,company,location,date_posted,job_url,job_url_direct,id,job_type,salary_source,interval,min_amount,max_amount,currency,is_remote,job_level,job_function,listing_type,emails,company_industry,company_url,company_url_direct,company_addresses,company_num_employees,company_revenue,company_description,skills,experience_range,company_rating,company_reviews_count,vacancy_count,work_from_home_type
linkedin,Digital Design Lead,TSMC,"Munich, Bavaria, Germany",2026-06-01,https://www.linkedin.com/jobs/view/4151812493 , ,li-4151812493,fulltime,,,,,,False,mid-senior level,Design and Engineering,,,Semiconductor Manufacturing,https://tw.linkedin.com/company/tsmc,,,,,,,,,,,
linkedin,Senior Software Developer - ILT (Inverse Lithography) - EDA,Siemens EDA (Siemens Digital Industries Software),"Munich, Bavaria, Germany",2026-06-01,https://www.linkedin.com/jobs/view/4423220172 , ,li-4423220172,fulltime,,,,,,False,mid-senior level,Research,,,Software Development,https://www.linkedin.com/company/siemens-eda,,,,,,,,,,,
linkedin,Digital Design Engineer,TSMC,"Munich, Bavaria, Germany",2026-06-01,https://www.linkedin.com/jobs/view/4148830579 , ,li-4148830579,fulltime,,,,,,False,mid-senior level,Engineering,,,Semiconductor Manufacturing,https://tw.linkedin.com/company/tsmc,,,,,,,,,,,
linkedin,Entwickler (Cloud / Full-Stack) Digital Health / Oncology (mwd),iuvando Health,"Mannheim, Baden-Württemberg, Germany",2026-06-01,https://www.linkedin.com/jobs/view/4418775171 , ,li-4418775171,fulltime,,,,,,True,associate,Information Technology,,,Hospitals and Health Care,https://de.linkedin.com/company/iuvando,,,,,,,,,,,
linkedin,Embedded Developer,SBG Associates,"Immenstaad am Bodensee, Baden-Württemberg, Germany",2026-06-01,https://www.linkedin.com/jobs/view/4406067421 , ,li-4406067421,fulltime,,,,,,False,mid-senior level,Information Technology,,,Software Development,https://uk.linkedin.com/company/sbg-associates,,,,,,,,,,,
linkedin,NPI - Product Technical Expert (m/f/d) - for semiconductor industry,Applied Materials Europe,"Heimstetten, Bavaria, Germany",2026-06-01,https://www.linkedin.com/jobs/view/4406086670 , ,li-4406086670,fulltime,,,,,,False,not applicable,Sales and Business Development,,,"Appliances, Electrical, and Electronics Manufacturing, Nanotechnology Research, and Semiconductor Manufacturing",https://nl.linkedin.com/company/applied-materials-europe,,,,,,,,,,,
linkedin,Senior Staff Engineer Analog Verification Methodology (f/m/div),Infineon Technologies,"Munich, Bavaria, Germany",2026-06-01,https://www.linkedin.com/jobs/view/4421826523 , ,li-4421826523,fulltime,,,,,,False,mid-senior level,Engineering and Information Technology,,,"Semiconductor Manufacturing, Appliances, Electrical, and Electronics Manufacturing, and Computer Hardware Manufacturing",https://de.linkedin.com/company/infineon-technologies,,,,,,,,,,,
linkedin,Senior Embedded AI Developer (f/m/x) - Jobbird.com,Jobster,"Munich, Bavaria, Germany",2026-06-01,https://www.linkedin.com/jobs/view/4422847360 , ,li-4422847360,fulltime,,,,,,False,mid-senior level,Engineering and Information Technology,,,Software Development,https://nl.linkedin.com/company/jobster-com,,,,,,,,,,,
linkedin,PLD/FPGA developer for aviation software (m/f/d),K-tronik GmbH,"Lindenberg im Allgäu, Bavaria, Germany",2026-06-01,https://www.linkedin.com/jobs/view/4418772965 , ,li-4418772965,fulltime,,,,,,False,associate,Engineering,,,IT Services and IT Consulting,https://de.linkedin.com/company/k-tronik-gmbh,,,,,,,,,,,
linkedin,Technical Account Manager - Siemens EDA - f/m/d,Siemens EDA (Siemens Digital Industries Software),"Munich, Bavaria, Germany",2026-05-31,https://www.linkedin.com/jobs/view/4390945788 , ,li-4390945788,fulltime,,,,,,False,mid-senior level,Sales,,,Software Development,https://www.linkedin.com/company/siemens-eda,,,,,,,,,,,
linkedin,PLD/ FPGA-Entwickler Aerospace (m/w/d),Liebherr Aerospace and Transportation,"Lindenberg im Allgäu, Bavaria, Germany",2026-05-31,https://www.linkedin.com/jobs/view/4390954796 , ,li-4390954796,fulltime,,,,,,False,entry level,Engineering and Information Technology,,,Industrial Machinery Manufacturing,https://fr.linkedin.com/company/liebherr-aerospace-and-transportation,,,,,,,,,,,
linkedin,Hardwareentwickler Avioniksysteme (m/w/d),SII Germany,"Hamburg, Hamburg, Germany",2026-05-31,https://www.linkedin.com/jobs/view/4421643187 , ,li-4421643187,fulltime,,,,,,False,entry level,Engineering and Information Technology,,,IT Services and IT Consulting,https://de.linkedin.com/company/sii-germany,,,,,,,,,,,
linkedin,Principal System Engineer (f/m/d),Renesas Electronics,"Munich, Bavaria, Germany",2026-05-30,https://www.linkedin.com/jobs/view/4412127133 , ,li-4412127133,fulltime,,,,,,True,mid-senior level,Manufacturing,,,Semiconductors,https://jp.linkedin.com/company/renesas,,,,,,,,,,,
linkedin,Application Engineer - Calibre Semi Manufacturing (OPC/RET) - EDA,Siemens EDA (Siemens Digital Industries Software),"Dresden, Saxony, Germany",2026-05-30,https://www.linkedin.com/jobs/view/4411961055 , ,li-4411961055,fulltime,,,,,,False,mid-senior level,Sales,,,Software Development,https://www.linkedin.com/company/siemens-eda,,,,,,,,,,,
linkedin,Senior Hardware Digital Engineer (m/f/d),Emerson,"Dresden, Saxony, Germany",2026-05-30,https://www.linkedin.com/jobs/view/4403128731 , ,li-4403128731,fulltime,,,,,,False,mid-senior level,Engineering and Information Technology,,idisability.administrator@emerson.com,Automation Machinery Manufacturing,https://www.linkedin.com/company/emerson,,,,,,,,,,,
linkedin,Entwickler (w/m/d) für Prüfmittel mit Schwerpunkt Prüfsoftwarearchitektur,TRUMPF,"Schramberg, Baden-Württemberg, Germany",2026-05-30,https://www.linkedin.com/jobs/view/4371393409 , ,li-4371393409,fulltime,,,,,,False,entry level,Engineering and Information Technology,,lena.riexinger@trumpf.com,Machinery Manufacturing,https://www.linkedin.com/company/trumpf-se-co-kg,,,,,,,,,,,
linkedin,ServiceNow-Entwickler (m/w/d),Dirk Rossmann GmbH,"Burgwedel, Lower Saxony, Germany",2026-05-30,https://www.linkedin.com/jobs/view/4390830984 , ,li-4390830984,fulltime,,,,,,False,entry level,Engineering and Information Technology,,,Retail,https://de.linkedin.com/company/dirk-rossmann-gmbh,,,,,,,,,,,
linkedin,ASIC Project Manager,IC Resources,"Baden-Württemberg, Germany",2026-05-29,https://www.linkedin.com/jobs/view/4422048000 , ,li-4422048000,fulltime,,,,,,False,mid-senior level,Project Management and Information Technology,,,Staffing and Recruiting,https://uk.linkedin.com/company/icresources,,,,,,,,,,,
linkedin,"Early Career — DFT Engineer (M, F, D)",Apple,"Munich, Bavaria, Germany",2026-05-29,https://www.linkedin.com/jobs/view/4421047596 , ,li-4421047596,fulltime,,,,,,False,entry level,Engineering and Information Technology,,,Computers and Electronics Manufacturing,https://www.linkedin.com/company/apple,,,,,,,,,,,
linkedin,R&D Software & Hardware Engineer (m/f/d),Advantest,"Böblingen, Baden-Württemberg, Germany",2026-05-29,https://www.linkedin.com/jobs/view/4421257302 , ,li-4421257302,fulltime,,,,,,False,entry level,Engineering and Information Technology,,,Semiconductor Manufacturing,https://jp.linkedin.com/company/advantest,,,,,,,,,,,
linkedin,FPGA- & Embedded-Engineer (all gender),ALTEN Germany,,2026-05-29,https://www.linkedin.com/jobs/view/4398216831 , ,li-4398216831,fulltime,,,,,,False,associate,Information Technology,,,IT Services and IT Consulting,https://de.linkedin.com/company/altengermany,,,,,,,,,,,
linkedin,Senior POS Developer - Ireland based,Expleo Group,"Frankfurt am Main, Hesse, Germany",2026-05-29,https://www.linkedin.com/jobs/view/4370540495 , ,li-4370540495,contract,,,,,,False,mid-senior level,Engineering and Information Technology,,,IT Services and IT Consulting,https://fr.linkedin.com/company/expleo-group,,,,,,,,,,,
linkedin,Senior Developer Backend (w/m/x),opta data,"Essen, North Rhine-Westphalia, Germany",2026-05-29,https://www.linkedin.com/jobs/view/4411882689 , ,li-4411882689,fulltime,,,,,,False,mid-senior level,Engineering and Information Technology,,,IT Services and IT Consulting,https://de.linkedin.com/company/optadata,,,,,,,,,,,
linkedin,DWH Entwickler (m/w/d),Fiber Experts Deutschland GmbH,"Düsseldorf, North Rhine-Westphalia, Germany",2026-05-29,https://www.linkedin.com/jobs/view/4420962017 , ,li-4420962017,fulltime,,,,,,False,associate,Information Technology,,,Construction,https://de.linkedin.com/company/fiber-experts-deutschland-gmbh,,,,,,,,,,,
linkedin,Tableau Dashboard Entwickler (all gender),ALTEN Germany,"Weeze, North Rhine-Westphalia, Germany",2026-05-29,https://www.linkedin.com/jobs/view/4387276326 , ,li-4387276326,fulltime,,,,,,False,associate,Information Technology and Engineering,,,Defense and Space Manufacturing,https://de.linkedin.com/company/altengermany,,,,,,,,,,,
linkedin,Senior System Engineer – Commissioning & Global Product Support (m/f/d),Applied Materials Europe,"Darmstadt, Hesse, Germany",2026-05-29,https://www.linkedin.com/jobs/view/4409613098 , ,li-4409613098,fulltime,,,,,,False,not applicable,Information Technology,,,"Appliances, Electrical, and Electronics Manufacturing, Nanotechnology Research, and Semiconductor Manufacturing",https://nl.linkedin.com/company/applied-materials-europe,,,,,,,,,,,
linkedin,EMC Engineer (f/m/d),NXP Semiconductors,"Munich, Bavaria, Germany",2026-05-29,https://www.linkedin.com/jobs/view/4402531935 , ,li-4402531935,fulltime,,,,,,False,mid-senior level,Engineering and Information Technology,,,"Semiconductor Manufacturing, Computers and Electronics Manufacturing, and Software Development",https://nl.linkedin.com/company/nxp-semiconductors,,,,,,,,,,,
linkedin,Techniker*in Photonische Module und Packaging,Fraunhofer Heinrich Hertz Institute HHI,"Berlin, Berlin, Germany",2026-05-29,https://www.linkedin.com/jobs/view/4416313281 , ,li-4416313281,fulltime,,,,,,False,entry level,"Design, Art/Creative, and Information Technology",,,Research Services,https://de.linkedin.com/company/fraunhofer-hhi,,,,,,,,,,,
linkedin,Principal Digital Design Engineer (m/f/d),Micron Technology,"Munich, Bavaria, Germany",2026-05-29,https://www.linkedin.com/jobs/view/4410844306 , ,li-4410844306,fulltime,,,,,,False,mid-senior level,Other,,"_EMEA@micron.com, _TA@micron.com","Computer Hardware Manufacturing, Appliances, Electrical, and Electronics Manufacturing, and Semiconductor Manufacturing",https://www.linkedin.com/company/micron-technology,,,,,,,,,,,
linkedin,Mixed Signal Design Engineer (m/f/d),Micron Technology,"Munich, Bavaria, Germany",2026-05-29,https://www.linkedin.com/jobs/view/4410839324 , ,li-4410839324,fulltime,,,,,,False,entry level,Other,,"_EMEA@micron.com, _TA@micron.com","Computer Hardware Manufacturing, Appliances, Electrical, and Electronics Manufacturing, and Semiconductor Manufacturing",https://www.linkedin.com/company/micron-technology,,,,,,,,,,,
linkedin,"DFT Engineer (M, F, D)",Apple,"Munich, Bavaria, Germany",2026-05-29,https://www.linkedin.com/jobs/view/4421048546 , ,li-4421048546,fulltime,,,,,,False,mid-senior level,Engineering and Information Technology,,,Computers and Electronics Manufacturing,https://www.linkedin.com/company/apple,,,,,,,,,,,
linkedin,ASIC Analog Design Engineer (m/f/d) - REF5386X,AUMOVIO,"Frankfurt, Hesse, Germany",2026-05-28,https://www.linkedin.com/jobs/view/4420499613 , ,li-4420499613,fulltime,,,,,,False,mid-senior level,Design,,,Automotive,https://de.linkedin.com/company/aumovio,,,,,,,,,,,
linkedin,Hardware / FPGA Developer (m/f/d) for Analog and Digital Electronics - Semiconductor Development Division,PNDetector,"Munich, Bavaria, Germany",2026-05-28,https://www.linkedin.com/jobs/view/4420299486 , ,li-4420299486,fulltime,,,,,,False,entry level,Engineering,,-pnd@pndetector.de,Semiconductor Manufacturing,https://de.linkedin.com/company/pndetector,,,,,,,,,,,
linkedin,(Senior) ASIC Test Engineer (m/f/d) - REF6604C,AUMOVIO,"Regensburg, Bavaria, Germany",2026-05-28,https://www.linkedin.com/jobs/view/4420434616 , ,li-4420434616,fulltime,,,,,,False,associate,Engineering,,,Motor Vehicle Manufacturing,https://de.linkedin.com/company/aumovio,,,,,,,,,,,
linkedin,(Senior) ASIC Test Engineer (m/f/d) - REF6604C,AUMOVIO,"Frankfurt am Main, Hesse, Germany",2026-05-28,https://www.linkedin.com/jobs/view/4420431682 , ,li-4420431682,fulltime,,,,,,False,associate,Engineering,,,Motor Vehicle Manufacturing,https://de.linkedin.com/company/aumovio,,,,,,,,,,,
linkedin,Elektronikingenieur (m/w/d),PNDetector,"Munich, Bavaria, Germany",2026-05-28,https://www.linkedin.com/jobs/view/4420418027 , ,li-4420418027,fulltime,,,,,,False,entry level,Engineering,,-pnd@pndetector.de,Semiconductor Manufacturing,https://de.linkedin.com/company/pndetector,,,,,,,,,,,
linkedin,ASIC Analog Design Engineer (m/f/d) - REF5386X,AUMOVIO,"Regensburg, Bavaria, Germany",2026-05-28,https://www.linkedin.com/jobs/view/4420499612 , ,li-4420499612,fulltime,,,,,,False,mid-senior level,Design,,,Automotive,https://de.linkedin.com/company/aumovio,,,,,,,,,,,
linkedin,Senior Electronic Hardware Engineer,NewSpace Technical,"Berlin, Germany",2026-05-28,https://www.linkedin.com/jobs/view/4419023405 , ,li-4419023405,fulltime,,,,,,False,mid-senior level,Engineering,,angela.olmo@newspacetechnical.com,Defense and Space Manufacturing and Space Research and Technology,https://uk.linkedin.com/company/newspacetechnical,,,,,,,,,,,
linkedin,Electronic Design Engineer,Skyeton,"Gilching, Bavaria, Germany",2026-05-28,https://www.linkedin.com/jobs/view/4417645066 , ,li-4417645066,fulltime,,,,,,False,mid-senior level,"Engineering, Information Technology, and Other",,,Aviation and Aerospace Component Manufacturing,https://ua.linkedin.com/company/skyeton,,,,,,,,,,,
linkedin,Scientist for FPGA-based RF signal processing and control,DESY,"Hamburg, Germany",2026-05-28,https://www.linkedin.com/jobs/view/4420299050 , ,li-4420299050,fulltime,,,,,,True,associate,Science,,burak.dursun@desy.de,Research Services,https://de.linkedin.com/company/desy,,,,,,,,,,,
linkedin,Electronics Developer (m/f/d) with VHDL skills,Emerson,"Baden-Württemberg, Germany",2026-05-28,https://www.linkedin.com/jobs/view/4402006248 , ,li-4402006248,fulltime,,,,,,False,entry level,Engineering and Information Technology,,idisability.administrator@emerson.com,Automation Machinery Manufacturing,https://www.linkedin.com/company/emerson,,,,,,,,,,,
linkedin,Software (Technical) Support Engineer (f/m/d),Applied Materials Europe,"Dresden, Saxony, Germany",2026-05-28,https://www.linkedin.com/jobs/view/4417676018 , ,li-4417676018,fulltime,,,,,,False,not applicable,Information Technology,,,"Appliances, Electrical, and Electronics Manufacturing, Nanotechnology Research, and Semiconductor Manufacturing",https://nl.linkedin.com/company/applied-materials-europe,,,,,,,,,,,
linkedin,Senior R&D Mechanical Engineer (m/w/d) - semiconductor industry,Applied Materials Europe,"Heimstetten, Bavaria, Germany",2026-05-28,https://www.linkedin.com/jobs/view/4406003325 , ,li-4406003325,fulltime,,,,,,False,not applicable,Engineering and Information Technology,,,"Appliances, Electrical, and Electronics Manufacturing, Nanotechnology Research, and Semiconductor Manufacturing",https://nl.linkedin.com/company/applied-materials-europe,,,,,,,,,,,
linkedin,SOC Architect - Chiplet,Tenstorrent,"Munich, Bavaria, Germany",2026-05-28,https://www.linkedin.com/jobs/view/4377756862 , ,li-4377756862,fulltime,,,,,,True,mid-senior level,Information Technology,,,Computer Hardware Manufacturing,https://ca.linkedin.com/company/tenstorrent-inc.,,,,,,,,,,,
linkedin,Field Application Engineer,Lattice Semiconductor,,2026-05-27,https://www.linkedin.com/jobs/view/4409762142 , ,li-4409762142,fulltime,,,,,,False,mid-senior level,Sales and Business Development,,,Semiconductor Manufacturing,https://www.linkedin.com/company/lattice-semiconductor,,,,,,,,,,,
linkedin,Senior Field-Programmable Gate Arrays (FPGA) Engineer (m/f/x),DSI Aerospace GmbH,"Brunswick, Lower Saxony, Germany",2026-05-27,https://www.linkedin.com/jobs/view/4419585589 , ,li-4419585589,fulltime,,,,,,False,associate,Engineering and Information Technology,,,Defense and Space Manufacturing,https://de.linkedin.com/company/dsi-aerospace,,,,,,,,,,,
linkedin,Senior Field-Programmable Gate Arrays (FPGA) Engineer (m/f/x),DSI Aerospace GmbH,"Bremen, Bremen, Germany",2026-05-27,https://www.linkedin.com/jobs/view/4419581713 , ,li-4419581713,fulltime,,,,,,False,associate,Engineering and Information Technology,,,Defense and Space Manufacturing,https://de.linkedin.com/company/dsi-aerospace,,,,,,,,,,,
linkedin,Business Development Specialist – mit Deutschkenntnissen (m/w/d),Blue Projects,,2026-05-27,https://www.linkedin.com/jobs/view/4419855823 , ,li-4419855823,fulltime,,,,,,False,associate,Sales and Business Development,,,Engineering Services and Construction,https://ro.linkedin.com/company/blue-projects-company,,,,,,,,,,,
linkedin,Digital Engineer for Integrated Circuits (Graduate) (f/m/d),NXP Semiconductors,"Munich, Bavaria, Germany",2026-05-27,https://www.linkedin.com/jobs/view/4419887070 , ,li-4419887070,fulltime,,,,,,False,entry level,Engineering and Information Technology,,,"Semiconductor Manufacturing, Computers and Electronics Manufacturing, and Software Development",https://nl.linkedin.com/company/nxp-semiconductors,,,,,,,,,,,
linkedin,Lead Developer (m/w/d),Mischok GmbH,"Augsburg, Bavaria, Germany",2026-05-27,https://www.linkedin.com/jobs/view/4416894024 , ,li-4416894024,fulltime,,,,,,False,associate,Information Technology,,,IT Services and IT Consulting,https://de.linkedin.com/company/mischok,,,,,,,,,,,
linkedin,Shopware Entwickler Fullstack (m/w/d),Aurivian GmbH,"Karlsruhe, Baden-Württemberg, Germany",2026-05-27,https://www.linkedin.com/jobs/view/4416887438 , ,li-4416887438,fulltime,,,,,,False,associate,Other,,,Software Development,https://de.linkedin.com/company/aurivian,,,,,,,,,,,
linkedin,Senior POS Developer - Ireland based,Expleo Group,"Berlin, Berlin, Germany",2026-05-27,https://www.linkedin.com/jobs/view/4370550221 , ,li-4370550221,contract,,,,,,False,mid-senior level,Engineering and Information Technology,,,IT Services and IT Consulting,https://fr.linkedin.com/company/expleo-group,,,,,,,,,,,
linkedin,CAD Physical Design Engineer (m/f/d),Apple,"Munich, Bavaria, Germany",,https://www.linkedin.com/jobs/view/4423932196 , ,li-4423932196,fulltime,,,,,,False,mid-senior level,Engineering and Information Technology,,,Computers and Electronics Manufacturing,https://www.linkedin.com/company/apple,,,,,,,,,,,
linkedin,Senior Digital Design Engineer (f/m/div),Infineon Technologies,"Munich, Bavaria, Germany",,https://www.linkedin.com/jobs/view/4404304316 , ,li-4404304316,fulltime,,,,,,False,mid-senior level,Engineering and Information Technology,,,"Semiconductor Manufacturing, Appliances, Electrical, and Electronics Manufacturing, and Computer Hardware Manufacturing",https://de.linkedin.com/company/infineon-technologies,,,,,,,,,,,
linkedin,FPGA Engineer – Quantum Computing (f/m/d),eleQtron,"Hamburg, Hamburg, Germany",,https://www.linkedin.com/jobs/view/4422393115 , ,li-4422393115,fulltime,,,,,,False,mid-senior level,Information Technology,,,IT Services and IT Consulting,https://de.linkedin.com/company/eleqtron-qc,,,,,,,,,,,
linkedin,FPGA Engineer – Quantum Computing (f/m/d),eleQtron,"Siegen, North Rhine-Westphalia, Germany",,https://www.linkedin.com/jobs/view/4422387132 , ,li-4422387132,fulltime,,,,,,False,mid-senior level,Information Technology,,,IT Services and IT Consulting,https://de.linkedin.com/company/eleqtron-qc,,,,,,,,,,,
linkedin,FPGA Engineer,The Exploration Company,"Munich, Bavaria, Germany",,https://www.linkedin.com/jobs/view/4423916293 , ,li-4423916293,fulltime,,,,,,False,entry level,Engineering and Information Technology,,,Aviation and Aerospace Component Manufacturing,https://de.linkedin.com/company/exploration-company,,,,,,,,,,,
linkedin,FPGA Design Engineer (m/w/d),AES Technology GmbH,"Göttingen, Lower Saxony, Germany",,https://www.linkedin.com/jobs/view/4423883825 , ,li-4423883825,fulltime,,,,,,True,associate,"Design, Information Technology, and Product Management",,,Defense and Space Manufacturing,https://de.linkedin.com/company/aes-technology-gmbh,,,,,,,,,,,
linkedin,Embedded Firmware Developer (FPGA/SoC),Technology & Strategy,"Berlin, Germany",,https://www.linkedin.com/jobs/view/4422340182 , ,li-4422340182,fulltime,,,,,,False,associate,Engineering,,,"Technology, Information and Media",https://fr.linkedin.com/company/technology-&-strategy-t&s-,,,,,,,,,,,
linkedin,SSenior Electronics Design Engineer - FPGA Design (m/f/d),OHB SE,,,https://www.linkedin.com/jobs/view/4419277474 , ,li-4419277474,fulltime,,,,,,False,mid-senior level,Engineering,,,Aviation and Aerospace Component Manufacturing and Defense and Space Manufacturing,https://de.linkedin.com/company/ohb-se,,,,,,,,,,,
linkedin,Senior Electronics Design Engineer – FPGA Design (m/f/d),OHB SE,"Munich, Bavaria, Germany",,https://www.linkedin.com/jobs/view/4422396059 , ,li-4422396059,fulltime,,,,,,False,mid-senior level,Engineering,,,Aviation and Aerospace Component Manufacturing,https://de.linkedin.com/company/ohb-se,,,,,,,,,,,
linkedin,Integration Engineer,Haystack,"Bavaria, Germany",,https://www.linkedin.com/jobs/view/4423897850 , ,li-4423897850,fulltime,,,,,,False,mid-senior level,Information Technology,,,"Technology, Information and Internet",https://uk.linkedin.com/company/wearehaystack,,,,,,,,,,,
linkedin,Avaloq Developer - Parameterization Specialist Payment Operations 100%,Vontobel,"Frankfurt am Main, Hesse, Germany",,https://www.linkedin.com/jobs/view/4419299737 , ,li-4419299737,fulltime,,,,,,False,not applicable,Engineering and Information Technology,,,Financial Services and Banking,https://ch.linkedin.com/company/vontobel,,,,,,,,,,,
linkedin,Entwickler Verbindungselemente (m/w/d),SFS Group,"Mörfelden-Walldorf, Hesse, Germany",,https://www.linkedin.com/jobs/view/4423894861 , ,li-4423894861,fulltime,,,,,,False,mid-senior level,Engineering and Information Technology,,,Fabricated Metal Products,https://ch.linkedin.com/company/sfs-group,,,,,,,,,,,
linkedin,ATC Application Design Engineer (f/m/d),Alstom,"Hamburg, Hamburg, Germany",,https://www.linkedin.com/jobs/view/4419239649 , ,li-4419239649,fulltime,,,,,,False,entry level,Engineering,,,Truck Transportation and Railroad Equipment Manufacturing,https://fr.linkedin.com/company/alstom,,,,,,,,,,,
