site,title,company,location,date_posted,job_url,job_url_direct,id,job_type,salary_source,interval,min_amount,max_amount,currency,is_remote,job_level,job_function,listing_type,emails,company_industry,company_url,company_url_direct,company_addresses,company_num_employees,company_revenue,company_description,skills,experience_range,company_rating,company_reviews_count,vacancy_count,work_from_home_type
linkedin,Technical Account Manager - Siemens EDA - f/m/d,Siemens EDA (Siemens Digital Industries Software),"Munich, Bavaria, Germany",2026-05-31,https://www.linkedin.com/jobs/view/4390945788 , ,li-4390945788,fulltime,,,,,,False,mid-senior level,Sales,,,Software Development,https://www.linkedin.com/company/siemens-eda,,,,,,,,,,,
linkedin,Application Architect - SAP HANA Development (m/w/d),IBM,"Cologne, North Rhine-Westphalia, Germany",2026-05-31,https://www.linkedin.com/jobs/view/4392758082 , ,li-4392758082,fulltime,,,,,,False,mid-senior level,Engineering and Information Technology,,,IT Services and IT Consulting,https://www.linkedin.com/company/ibm,,,,,,,,,,,
linkedin,Application Architect - SAP HANA Development (m/w/d),IBM,"Frankfurt, Hesse, Germany",2026-05-31,https://www.linkedin.com/jobs/view/4392745607 , ,li-4392745607,fulltime,,,,,,False,mid-senior level,Engineering and Information Technology,,,IT Services and IT Consulting,https://www.linkedin.com/company/ibm,,,,,,,,,,,
linkedin,PLD/ FPGA-Entwickler Aerospace (m/w/d),Liebherr Aerospace and Transportation,"Lindenberg im Allgäu, Bavaria, Germany",2026-05-31,https://www.linkedin.com/jobs/view/4390954796 , ,li-4390954796,fulltime,,,,,,False,entry level,Engineering and Information Technology,,,Industrial Machinery Manufacturing,https://fr.linkedin.com/company/liebherr-aerospace-and-transportation,,,,,,,,,,,
linkedin,Senior Backend Entwickler (C# .NET) (m/w/d),Instaffo,"Bremen, Bremen, Germany",2026-05-30,https://www.linkedin.com/jobs/view/4335155770 , ,li-4335155770,fulltime,,,,,,False,mid-senior level,Information Technology and Engineering,,,IT Services and IT Consulting,https://de.linkedin.com/company/instaffo-gmbh,,,,,,,,,,,
linkedin,Senior Embedded AI Developer (f/m/x),BMW Group,"Munich, Bavaria, Germany",2026-05-30,https://www.linkedin.com/jobs/view/4391064359 , ,li-4391064359,fulltime,,,,,,False,mid-senior level,Engineering and Information Technology,,,Motor Vehicle Manufacturing,https://de.linkedin.com/company/bmw-group,,,,,,,,,,,
linkedin,Senior Hardware Digital Engineer (m/f/d),Emerson,"Dresden, Saxony, Germany",2026-05-30,https://www.linkedin.com/jobs/view/4403128731 , ,li-4403128731,fulltime,,,,,,False,mid-senior level,Engineering and Information Technology,,idisability.administrator@emerson.com,Automation Machinery Manufacturing,https://www.linkedin.com/company/emerson,,,,,,,,,,,
linkedin,Senior Odoo Developer (all genders),Sunday Natural,"Berlin, Berlin, Germany",2026-05-30,https://www.linkedin.com/jobs/view/4359186929 , ,li-4359186929,fulltime,,,,,,False,mid-senior level,Engineering and Information Technology,,,"Health, Wellness & Fitness",https://www.linkedin.com/company/sunday-natural-products-gmbh,,,,,,,,,,,
linkedin,Solutions Architect - NVIDIA Cloud Partners,NVIDIA,"Würselen, North Rhine-Westphalia, Germany",2026-05-30,https://www.linkedin.com/jobs/view/4411900244 , ,li-4411900244,fulltime,,,,,,False,mid-senior level,Sales,,,Computer Hardware Manufacturing,https://www.linkedin.com/company/nvidia,,,,,,,,,,,
linkedin,Solutions Architect - NVIDIA Cloud Partners,NVIDIA,"Berlin, Berlin, Germany",2026-05-30,https://www.linkedin.com/jobs/view/4411905090 , ,li-4411905090,fulltime,,,,,,False,mid-senior level,Sales,,,Computer Hardware Manufacturing,https://www.linkedin.com/company/nvidia,,,,,,,,,,,
linkedin,Principal System Engineer (f/m/d),Renesas Electronics,"Munich, Bavaria, Germany",2026-05-30,https://www.linkedin.com/jobs/view/4412127133 , ,li-4412127133,fulltime,,,,,,True,mid-senior level,Manufacturing,,,Semiconductors,https://jp.linkedin.com/company/renesas,,,,,,,,,,,
linkedin,Senior Staff Engineer Automation & Digitalization for IP Development (f/m/div),Infineon Technologies,"Munich, Bavaria, Germany",2026-05-30,https://www.linkedin.com/jobs/view/4379866078 , ,li-4379866078,fulltime,,,,,,False,mid-senior level,Other,,,"Semiconductor Manufacturing, Appliances, Electrical, and Electronics Manufacturing, and Computer Hardware Manufacturing",https://de.linkedin.com/company/infineon-technologies,,,,,,,,,,,
linkedin,Staff Engineer Component Verification (f/m/div),Infineon Technologies,"Dresden, Saxony, Germany",2026-05-30,https://www.linkedin.com/jobs/view/4403452087 , ,li-4403452087,fulltime,,,,,,False,entry level,Engineering and Information Technology,,,"Semiconductor Manufacturing, Appliances, Electrical, and Electronics Manufacturing, and Computer Hardware Manufacturing",https://de.linkedin.com/company/infineon-technologies,,,,,,,,,,,
linkedin,Senior POS Developer - Ireland based,Expleo Group,"Augsburg, Bavaria, Germany",2026-05-29,https://www.linkedin.com/jobs/view/4370536740 , ,li-4370536740,contract,,,,,,False,mid-senior level,Engineering and Information Technology,,,IT Services and IT Consulting,https://fr.linkedin.com/company/expleo-group,,,,,,,,,,,
linkedin,Tableau Dashboard Entwickler (all gender),ALTEN Germany,"Weeze, North Rhine-Westphalia, Germany",2026-05-29,https://www.linkedin.com/jobs/view/4387276326 , ,li-4387276326,fulltime,,,,,,False,associate,Information Technology and Engineering,,,Defense and Space Manufacturing,https://de.linkedin.com/company/altengermany,,,,,,,,,,,
linkedin,Senior POS Developer - Ireland based,Expleo Group,"Cologne, North Rhine-Westphalia, Germany",2026-05-29,https://www.linkedin.com/jobs/view/4370538524 , ,li-4370538524,contract,,,,,,False,mid-senior level,Engineering and Information Technology,,,IT Services and IT Consulting,https://fr.linkedin.com/company/expleo-group,,,,,,,,,,,
linkedin,SAP Development Lead Public Sector (m/f/d),T-Systems International,"Munich, Bavaria, Germany",2026-05-29,https://www.linkedin.com/jobs/view/4420981566 , ,li-4420981566,fulltime,,,,,,False,mid-senior level,Information Technology,,,Telecommunications,https://de.linkedin.com/company/t-systems,,,,,,,,,,,
linkedin,Principal Digital Design Engineer (m/f/d),Micron Technology,"Munich, Bavaria, Germany",2026-05-29,https://www.linkedin.com/jobs/view/4410844306 , ,li-4410844306,fulltime,,,,,,False,mid-senior level,Other,,"_EMEA@micron.com, _TA@micron.com","Computer Hardware Manufacturing, Appliances, Electrical, and Electronics Manufacturing, and Semiconductor Manufacturing",https://www.linkedin.com/company/micron-technology,,,,,,,,,,,
linkedin,Director Analog Design (f/m/d),Renesas Electronics,"Dresden, Saxony, Germany",2026-05-29,https://www.linkedin.com/jobs/view/4364091623 , ,li-4364091623,fulltime,,,,,,True,director,Manufacturing,,,Semiconductors,https://jp.linkedin.com/company/renesas,,,,,,,,,,,
linkedin,Mixed Signal Design Engineer (m/f/d),Micron Technology,"Munich, Bavaria, Germany",2026-05-29,https://www.linkedin.com/jobs/view/4410839324 , ,li-4410839324,fulltime,,,,,,False,entry level,Other,,"_EMEA@micron.com, _TA@micron.com","Computer Hardware Manufacturing, Appliances, Electrical, and Electronics Manufacturing, and Semiconductor Manufacturing",https://www.linkedin.com/company/micron-technology,,,,,,,,,,,
linkedin,Principal Engineer Power Device CAD  (f/m/div),Infineon Technologies,"Munich, Bavaria, Germany",2026-05-29,https://www.linkedin.com/jobs/view/4390887852 , ,li-4390887852,fulltime,,,,,,False,mid-senior level,Engineering and Information Technology,,,"Semiconductor Manufacturing, Appliances, Electrical, and Electronics Manufacturing, and Computer Hardware Manufacturing",https://de.linkedin.com/company/infineon-technologies,,,,,,,,,,,
linkedin,Partner Solutions Architect – DACH and CEE Region,NVIDIA,"Berlin, Berlin, Germany",2026-05-29,https://www.linkedin.com/jobs/view/4402314652 , ,li-4402314652,fulltime,,,,,,False,mid-senior level,Sales,,,Computer Hardware Manufacturing,https://www.linkedin.com/company/nvidia,,,,,,,,,,,
linkedin,Senior System Engineer – Commissioning & Global Product Support (m/f/d),Applied Materials Europe,"Darmstadt, Hesse, Germany",2026-05-29,https://www.linkedin.com/jobs/view/4409613098 , ,li-4409613098,fulltime,,,,,,False,not applicable,Information Technology,,,"Appliances, Electrical, and Electronics Manufacturing, Nanotechnology Research, and Semiconductor Manufacturing",https://nl.linkedin.com/company/applied-materials-europe,,,,,,,,,,,
linkedin,"Early Career — DFT Engineer (M, F, D)",Apple,"Munich, Bavaria, Germany",2026-05-29,https://www.linkedin.com/jobs/view/4421047596 , ,li-4421047596,fulltime,,,,,,False,entry level,Engineering and Information Technology,,,Computers and Electronics Manufacturing,https://www.linkedin.com/company/apple,,,,,,,,,,,
linkedin,Techniker*in Photonische Module und Packaging,Fraunhofer Heinrich Hertz Institute HHI,"Berlin, Berlin, Germany",2026-05-29,https://www.linkedin.com/jobs/view/4416313281 , ,li-4416313281,fulltime,,,,,,False,entry level,"Design, Art/Creative, and Information Technology",,,Research Services,https://de.linkedin.com/company/fraunhofer-hhi,,,,,,,,,,,
linkedin,Mixed-Signal IC Designer – Neuromorphic Computing (all genders),Fraunhofer IIS,"Heilbronn, Baden-Württemberg, Germany",2026-05-29,https://www.linkedin.com/jobs/view/4420919841 , ,li-4420919841,fulltime,,,,,,False,entry level,Engineering and Information Technology,,,Research Services,https://de.linkedin.com/company/fraunhofer-iis,,,,,,,,,,,
linkedin,Test Engineer,NXP Semiconductors,"Hamburg, Hamburg, Germany",2026-05-29,https://www.linkedin.com/jobs/view/4411326660 , ,li-4411326660,fulltime,,,,,,False,mid-senior level,Engineering and Information Technology,,,"Semiconductor Manufacturing, Computers and Electronics Manufacturing, and Software Development",https://nl.linkedin.com/company/nxp-semiconductors,,,,,,,,,,,
linkedin,"DFT Engineer (M, F, D)",Apple,"Munich, Bavaria, Germany",2026-05-29,https://www.linkedin.com/jobs/view/4421048546 , ,li-4421048546,fulltime,,,,,,False,mid-senior level,Engineering and Information Technology,,,Computers and Electronics Manufacturing,https://www.linkedin.com/company/apple,,,,,,,,,,,
linkedin,EMC Engineer (f/m/d),NXP Semiconductors,"Munich, Bavaria, Germany",2026-05-29,https://www.linkedin.com/jobs/view/4402531935 , ,li-4402531935,fulltime,,,,,,False,mid-senior level,Engineering and Information Technology,,,"Semiconductor Manufacturing, Computers and Electronics Manufacturing, and Software Development",https://nl.linkedin.com/company/nxp-semiconductors,,,,,,,,,,,
linkedin,SAP Business One Anwendungsentwickler (all genders),Instaffo,"Berlin, Berlin, Germany",2026-05-28,https://www.linkedin.com/jobs/view/4369756427 , ,li-4369756427,fulltime,,,,,,False,mid-senior level,Information Technology and Engineering,,,IT Services and IT Consulting,https://de.linkedin.com/company/instaffo-gmbh,,,,,,,,,,,
linkedin,Scientist for FPGA-based RF signal processing and control,DESY,"Hamburg, Germany",2026-05-28,https://www.linkedin.com/jobs/view/4420299050 , ,li-4420299050,fulltime,,,,,,True,associate,Science,,burak.dursun@desy.de,Research Services,https://de.linkedin.com/company/desy,,,,,,,,,,,
linkedin,Elektronikingenieur (m/w/d),PNDetector,"Munich, Bavaria, Germany",2026-05-28,https://www.linkedin.com/jobs/view/4420418027 , ,li-4420418027,fulltime,,,,,,False,entry level,Engineering,,-pnd@pndetector.de,Semiconductor Manufacturing,https://de.linkedin.com/company/pndetector,,,,,,,,,,,
linkedin,Mobile App Developer*in (m/w/d),Flender,"Voerde, North Rhine-Westphalia, Germany",2026-05-28,https://www.linkedin.com/jobs/view/4419007417 , ,li-4419007417,fulltime,,,,,,False,associate,Information Technology,,,Machinery Manufacturing,https://de.linkedin.com/company/flenderdrives,,,,,,,,,,,
linkedin,API Ecosystem & Developer Experience Lead (m/w/d),Wolters Kluwer,"Ludwigsburg, Baden-Württemberg, Germany",2026-05-28,https://www.linkedin.com/jobs/view/4419313220 , ,li-4419313220,fulltime,,,,,,False,mid-senior level,Information Technology,,,Software Development,https://nl.linkedin.com/company/wolters-kluwer,,,,,,,,,,,
linkedin,CNC Machine Post Processor Developer,Sandvik,"Ettlingen, Baden-Württemberg, Germany",2026-05-28,https://www.linkedin.com/jobs/view/4375540702 , ,li-4375540702,fulltime,,,,,,True,associate,Other,,,Mining,https://se.linkedin.com/company/sandvik,,,,,,,,,,,
linkedin,ASIC Analog Design Engineer (m/f/d) - REF5386X,AUMOVIO,"Regensburg, Bavaria, Germany",2026-05-28,https://www.linkedin.com/jobs/view/4420499612 , ,li-4420499612,fulltime,,,,,,False,mid-senior level,Design,,,Automotive,https://de.linkedin.com/company/aumovio,,,,,,,,,,,
linkedin,Electronics Developer (m/f/d) with VHDL skills,Emerson,"Baden-Württemberg, Germany",2026-05-28,https://www.linkedin.com/jobs/view/4402006248 , ,li-4402006248,fulltime,,,,,,False,entry level,Engineering and Information Technology,,idisability.administrator@emerson.com,Automation Machinery Manufacturing,https://www.linkedin.com/company/emerson,,,,,,,,,,,
linkedin,Software (Technical) Support Engineer (f/m/d),Applied Materials Europe,"Dresden, Saxony, Germany",2026-05-28,https://www.linkedin.com/jobs/view/4417676018 , ,li-4417676018,fulltime,,,,,,False,not applicable,Information Technology,,,"Appliances, Electrical, and Electronics Manufacturing, Nanotechnology Research, and Semiconductor Manufacturing",https://nl.linkedin.com/company/applied-materials-europe,,,,,,,,,,,
linkedin,Hardware / FPGA Developer (m/f/d) for Analog and Digital Electronics - Semiconductor Development Division,PNDetector,"Munich, Bavaria, Germany",2026-05-28,https://www.linkedin.com/jobs/view/4420299486 , ,li-4420299486,fulltime,,,,,,False,entry level,Engineering,,-pnd@pndetector.de,Semiconductor Manufacturing,https://de.linkedin.com/company/pndetector,,,,,,,,,,,
linkedin,Director Analog Design (f/m/d),Renesas Electronics,"Bingen, Rhineland-Palatinate, Germany",2026-05-28,https://www.linkedin.com/jobs/view/4364361378 , ,li-4364361378,fulltime,,,,,,True,director,Manufacturing,,,Semiconductors,https://jp.linkedin.com/company/renesas,,,,,,,,,,,
linkedin,Engineer Transfer/New Products (m/w/d),Vishay Siliconix Itzehoe GmbH,"Itzehoe, Schleswig-Holstein, Germany",2026-05-28,https://www.linkedin.com/jobs/view/4417677481 , ,li-4417677481,fulltime,,,,,,True,entry level,Engineering and Information Technology,,,Semiconductor Manufacturing,https://de.linkedin.com/company/vishay-siliconix-itzehoe-gmbh,,,,,,,,,,,
linkedin,ASIC Analog Design Engineer (m/f/d) - REF5386X,AUMOVIO,"Frankfurt, Hesse, Germany",2026-05-28,https://www.linkedin.com/jobs/view/4420499613 , ,li-4420499613,fulltime,,,,,,False,mid-senior level,Design,,,Automotive,https://de.linkedin.com/company/aumovio,,,,,,,,,,,
linkedin,Junior Mixed‑Signal Memory Circuit Designer,GlobalFoundries,"Dresden, Saxony, Germany",2026-05-27,https://www.linkedin.com/jobs/view/4415908884 , ,li-4415908884,fulltime,,,,,,False,entry level,Engineering and Information Technology,,,Semiconductor Manufacturing,https://www.linkedin.com/company/globalfoundries,,,,,,,,,,,
linkedin,Anwendungsentwickler Kennzahlendienste,Finanz Informatik,"Münster, North Rhine-Westphalia, Germany",2026-05-27,https://www.linkedin.com/jobs/view/4409907471 , ,li-4409907471,fulltime,,,,,,False,associate,"Project Management, Information Technology, and Product Management",,,"IT Services and IT Consulting, Banking, and Financial Services",https://de.linkedin.com/company/finanz-informatik,,,,,,,,,,,
linkedin,Anwendungsentwickler Kennzahlendienste,Finanz Informatik,"Hannover, Lower Saxony, Germany",2026-05-27,https://www.linkedin.com/jobs/view/4409903580 , ,li-4409903580,fulltime,,,,,,False,associate,"Project Management, Information Technology, and Product Management",,,"IT Services and IT Consulting, Banking, and Financial Services",https://de.linkedin.com/company/finanz-informatik,,,,,,,,,,,
linkedin,Senior POS Developer - Ireland based,Expleo Group,"Berlin, Berlin, Germany",2026-05-27,https://www.linkedin.com/jobs/view/4370550221 , ,li-4370550221,contract,,,,,,False,mid-senior level,Engineering and Information Technology,,,IT Services and IT Consulting,https://fr.linkedin.com/company/expleo-group,,,,,,,,,,,
linkedin,Anwendungsentwickler (w/m/d),Lüddemann Investments GmbH,"Verl, North Rhine-Westphalia, Germany",2026-05-27,https://www.linkedin.com/jobs/view/4417200746 , ,li-4417200746,fulltime,,,,,,False,entry level,Engineering and Information Technology,,,Professional Training and Coaching,https://de.linkedin.com/company/l-ddemann-investments-gmbh,,,,,,,,,,,
linkedin,Anwendungsentwickler (m/w/d),Reiser Simulation and Training GmbH,"Berg, Bavaria, Germany",2026-05-27,https://www.linkedin.com/jobs/view/4417224003 , ,li-4417224003,fulltime,,,,,,False,mid-senior level,Information Technology,,,Information Technology & Services,https://de.linkedin.com/company/reiser-simulation-and-training,,,,,,,,,,,
linkedin,PIM Developer (gn),TAKKT Group,"Stuttgart, Baden-Württemberg, Germany",2026-05-27,https://www.linkedin.com/jobs/view/4408847939 , ,li-4408847939,fulltime,,,,,,False,entry level,Engineering and Information Technology,,,Wholesale,https://de.linkedin.com/company/takkt-ag,,,,,,,,,,,
linkedin,Developer Experience Engineer,Black Forest Labs,"Freiburg, Baden-Württemberg, Germany",2026-05-27,https://www.linkedin.com/jobs/view/4419961460 , ,li-4419961460,fulltime,,,,,,True,mid-senior level,Engineering and Information Technology,,,Software Development,https://de.linkedin.com/company/bflai,,,,,,,,,,,
linkedin,Shopify Entwickler/in (100% Remote),BlickSolutions GmbH - Shopify Plus Partner,,2026-05-27,https://www.linkedin.com/jobs/view/4416878856 , ,li-4416878856,fulltime,,,,,,True,associate,Information Technology,,,IT Services and IT Consulting,https://de.linkedin.com/company/blicksolutions,,,,,,,,,,,
linkedin,Function Developer – Parking,Applied Intuition,"Stuttgart, Baden-Württemberg, Germany",2026-05-27,https://www.linkedin.com/jobs/view/4401413976 , ,li-4401413976,fulltime,,,,,,True,mid-senior level,Engineering and Information Technology,,,Software Development,https://www.linkedin.com/company/applied-intuition-inc,,,,,,,,,,,
linkedin,INTERIM Tableau Entwickler - sozialversicherungspflichtig,Michael Page,"Frankfurt am Main, Hesse, Germany",2026-05-27,https://www.linkedin.com/jobs/view/4419884356 , ,li-4419884356,fulltime,,,,,,True,mid-senior level,Information Technology and Engineering,,,Staffing and Recruiting,https://uk.linkedin.com/company/michael-page,,,,,,,,,,,
linkedin,Staff Engineer AMS Implementation (f/m/div),Infineon Technologies,"Munich, Bavaria, Germany",2026-05-27,https://www.linkedin.com/jobs/view/4419873329 , ,li-4419873329,fulltime,,,,,,False,mid-senior level,Information Technology,,,"Semiconductor Manufacturing, Appliances, Electrical, and Electronics Manufacturing, and Computer Hardware Manufacturing",https://de.linkedin.com/company/infineon-technologies,,,,,,,,,,,
linkedin,Business Development Specialist – mit Deutschkenntnissen (m/w/d),Blue Projects,,2026-05-27,https://www.linkedin.com/jobs/view/4419855823 , ,li-4419855823,fulltime,,,,,,False,associate,Sales and Business Development,,,Engineering Services and Construction,https://ro.linkedin.com/company/blue-projects-company,,,,,,,,,,,
linkedin,Principal Hardware Digital Engineer (m/f/d),Emerson,"Dresden, Saxony, Germany",2026-05-27,https://www.linkedin.com/jobs/view/4378844339 , ,li-4378844339,fulltime,,,,,,False,mid-senior level,Engineering and Information Technology,,idisability.administrator@emerson.com,Automation Machinery Manufacturing,https://www.linkedin.com/company/emerson,,,,,,,,,,,
linkedin,Senior HPC and AI Networking Performance Research and Analysis Engineer,NVIDIA,"Berlin, Berlin, Germany",2026-05-27,https://www.linkedin.com/jobs/view/4395472516 , ,li-4395472516,fulltime,,,,,,False,mid-senior level,Engineering,,,Computer Hardware Manufacturing,https://www.linkedin.com/company/nvidia,,,,,,,,,,,
linkedin,Senior Field-Programmable Gate Arrays (FPGA) Engineer (m/f/x),DSI Aerospace GmbH,"Bremen, Bremen, Germany",2026-05-27,https://www.linkedin.com/jobs/view/4419581713 , ,li-4419581713,fulltime,,,,,,False,associate,Engineering and Information Technology,,,Defense and Space Manufacturing,https://de.linkedin.com/company/dsi-aerospace,,,,,,,,,,,
linkedin,Senior Field-Programmable Gate Arrays (FPGA) Engineer (m/f/x),DSI Aerospace GmbH,"Brunswick, Lower Saxony, Germany",2026-05-27,https://www.linkedin.com/jobs/view/4419585589 , ,li-4419585589,fulltime,,,,,,False,associate,Engineering and Information Technology,,,Defense and Space Manufacturing,https://de.linkedin.com/company/dsi-aerospace,,,,,,,,,,,
linkedin,Digital Engineer for Integrated Circuits (Graduate) (f/m/d),NXP Semiconductors,"Munich, Bavaria, Germany",2026-05-27,https://www.linkedin.com/jobs/view/4419887070 , ,li-4419887070,fulltime,,,,,,False,entry level,Engineering and Information Technology,,,"Semiconductor Manufacturing, Computers and Electronics Manufacturing, and Software Development",https://nl.linkedin.com/company/nxp-semiconductors,,,,,,,,,,,
linkedin,FPGA Engineer (m/w/d) Industrial Production Technology (Semiconductors),Amoria Bond,"Freiburg, Baden-Württemberg, Germany",2026-05-26,https://www.linkedin.com/jobs/view/4419453484 , ,li-4419453484,fulltime,,,,,,False,not applicable,Engineering,,,Renewable Energy Semiconductor Manufacturing,https://uk.linkedin.com/company/amoria-bond,,,,,,,,,,,
linkedin,Director of Analog Design,European Tech Recruit,"Munich, Bavaria, Germany",2026-05-26,https://www.linkedin.com/jobs/view/4419453299 , ,li-4419453299,fulltime,,,,,,False,director,"Engineering, Information Technology, and Management",,,"Semiconductor Manufacturing, Computer Hardware Manufacturing, and Software Development",https://uk.linkedin.com/company/european-tech-recruit,,,,,,,,,,,
linkedin,FPGA Development / System Integration Engineer (f/m/d),Universal Quantum,"Hamburg, Hamburg, Germany",2026-05-26,https://www.linkedin.com/jobs/view/4419412061 , ,li-4419412061,fulltime,,,,,,False,associate,Engineering,,,IT Services and IT Consulting,https://uk.linkedin.com/company/universal-quantum,,,,,,,,,,,
linkedin,Principal ASIC Verification Engineer,Synopsys Inc,"Munich, Bavaria, Germany",2026-05-26,https://www.linkedin.com/jobs/view/4369771442 , ,li-4369771442,fulltime,,,,,,False,mid-senior level,"Design, Consulting, and Engineering",,,"Semiconductor Manufacturing, Software Development, and Computer Hardware Manufacturing",https://www.linkedin.com/company/synopsys,,,,,,,,,,,
linkedin,Lagerist (m/f/d) - für die Halbleiterindustrie,Applied Materials Europe,"Heimstetten, Bavaria, Germany",2026-05-26,https://www.linkedin.com/jobs/view/4408429789 , ,li-4408429789,fulltime,,,,,,False,not applicable,Management and Manufacturing,,,"Appliances, Electrical, and Electronics Manufacturing, Nanotechnology Research, and Semiconductor Manufacturing",https://nl.linkedin.com/company/applied-materials-europe,,,,,,,,,,,
linkedin,DSP ASIC Design Engineer - Optical Transmission Systems,Ciena,,2026-05-25,https://www.linkedin.com/jobs/view/4414499911 , ,li-4414499911,fulltime,,,,,,False,mid-senior level,Engineering and Information Technology,,,Telecommunications,https://www.linkedin.com/company/ciena,,,,,,,,,,,
linkedin,DSP ASIC Verification Engineer - Optical Transmission Systems,Ciena,,2026-05-25,https://www.linkedin.com/jobs/view/4414700934 , ,li-4414700934,fulltime,,,,,,False,mid-senior level,Quality Assurance,,,Telecommunications,https://www.linkedin.com/company/ciena,,,,,,,,,,,
linkedin,Custom Memory Design Engineer,TSMC,"Munich, Bavaria, Germany",,https://www.linkedin.com/jobs/view/4148834255 , ,li-4148834255,fulltime,,,,,,False,mid-senior level,Engineering,,,Semiconductor Manufacturing,https://tw.linkedin.com/company/tsmc,,,,,,,,,,,
linkedin,Digital Design Lead,TSMC,"Munich, Bavaria, Germany",,https://www.linkedin.com/jobs/view/4151812493 , ,li-4151812493,fulltime,,,,,,False,mid-senior level,Design and Engineering,,,Semiconductor Manufacturing,https://tw.linkedin.com/company/tsmc,,,,,,,,,,,
linkedin,NPI - Product Technical Expert (m/f/d) - for semiconductor industry,Applied Materials Europe,"Heimstetten, Bavaria, Germany",,https://www.linkedin.com/jobs/view/4406086670 , ,li-4406086670,fulltime,,,,,,False,not applicable,Sales and Business Development,,,"Appliances, Electrical, and Electronics Manufacturing, Nanotechnology Research, and Semiconductor Manufacturing",https://nl.linkedin.com/company/applied-materials-europe,,,,,,,,,,,
linkedin,Senior Software Developer - ILT (Inverse Lithography) - EDA,Siemens EDA (Siemens Digital Industries Software),"Munich, Bavaria, Germany",,https://www.linkedin.com/jobs/view/4423220172 , ,li-4423220172,fulltime,,,,,,False,mid-senior level,Research,,,Software Development,https://www.linkedin.com/company/siemens-eda,,,,,,,,,,,
linkedin,Senior Staff Engineer Analog Verification Methodology (f/m/div),Infineon Technologies,"Munich, Bavaria, Germany",,https://www.linkedin.com/jobs/view/4421826523 , ,li-4421826523,fulltime,,,,,,False,mid-senior level,Engineering and Information Technology,,,"Semiconductor Manufacturing, Appliances, Electrical, and Electronics Manufacturing, and Computer Hardware Manufacturing",https://de.linkedin.com/company/infineon-technologies,,,,,,,,,,,
linkedin,Head of Design Services & Compliance Verification Engineer (d/f/m),Airbus,"Munich, Bavaria, Germany",,https://www.linkedin.com/jobs/view/4418778649 , ,li-4418778649,fulltime,,,,,,False,mid-senior level,Engineering and Information Technology,,emsom@airbus.com,Aviation and Aerospace Component Manufacturing,https://fr.linkedin.com/company/airbusgroup,,,,,,,,,,,
