site,title,company,location,date_posted,job_url,job_url_direct,id,job_type,salary_source,interval,min_amount,max_amount,currency,is_remote,job_level,job_function,listing_type,emails,company_industry,company_url,company_url_direct,company_addresses,company_num_employees,company_revenue,company_description,skills,experience_range,company_rating,company_reviews_count,vacancy_count,work_from_home_type
linkedin,Cable Project Engineer / Projektingenieur Kabel (m/w/d),Jacobs,"Bremervörde, Lower Saxony, Germany",,https://www.linkedin.com/jobs/view/4369674503 , ,li-4369674503,fulltime,,,,,,True,not applicable,Engineering and Information Technology,,,Business Consulting and Services,https://www.linkedin.com/company/jacobs,,,,,,,,,,,
linkedin,Ingenieur / Techniker (w/m/d) Objektüberwachung HLSK,Drees & Sommer,"Dortmund, North Rhine-Westphalia, Germany",,https://www.linkedin.com/jobs/view/4415292053 , ,li-4415292053,fulltime,,,,,,False,entry level,Engineering and Project Management,,,Real Estate,https://de.linkedin.com/company/drees-&-sommer,,,,,,,,,,,
linkedin,Technische Systemplaner(in)/ Zeichner(in) für die Technische Gebäudeausrüstung (EDV= Trimble- Plancal Nova),M&S Beratende Ingenieure GmbH,"Henstedt, Schleswig-Holstein, Germany",,https://www.linkedin.com/jobs/view/4407194598 , ,li-4407194598,fulltime,,,,,,False,associate,Design and Information Technology,,,Engineering Services,https://www.linkedin.com/company/m&s-beratende-ingenieure-gmbh,,,,,,,,,,,
linkedin,Systems Engineer (m/f/d),AutoScout24,"Munich, Bavaria, Germany",,https://www.linkedin.com/jobs/view/4408699260 , ,li-4408699260,fulltime,,,,,,False,mid-senior level,Information Technology,,,Software Development,https://de.linkedin.com/company/autoscout24,,,,,,,,,,,
linkedin,System Engineer (m/f/d),SPRIND - Bundesagentur für Sprunginnovationen,,,https://www.linkedin.com/jobs/view/4419189598 , ,li-4419189598,fulltime,,,,,,True,mid-senior level,Information Technology,,,"Think Tanks and Technology, Information and Media",https://de.linkedin.com/company/sprind,,,,,,,,,,,
linkedin,Systems Concept Engineer (m/f/d),TE Connectivity,"Bensheim, Hesse, Germany",,https://www.linkedin.com/jobs/view/4419467231 , ,li-4419467231,fulltime,,,,,,False,associate,Engineering and Information Technology,,,"Appliances, Electrical, and Electronics Manufacturing",https://ie.linkedin.com/company/te-connectivity,,,,,,,,,,,
linkedin,Aerospace Systems Engineer– Germany | Airbus Projects,Orbital Critical Systems (Grupo CAF),"Hamburg, Hamburg, Germany",,https://www.linkedin.com/jobs/view/4418250641 , ,li-4418250641,other,,,,,,False,entry level,Information Technology,,,Airlines and Aviation,https://es.linkedin.com/company/orbital-aerospace,,,,,,,,,,,
linkedin,System Engineer,Andersen Lab,"Stuttgart, Baden-Württemberg, Germany",,https://www.linkedin.com/jobs/view/4416815124 , ,li-4416815124,fulltime,,,,,,False,associate,Information Technology,,,IT Services and IT Consulting,https://pl.linkedin.com/company/andersen-softwaredev,,,,,,,,,,,
linkedin,Security Systems Field Engineer (m/w/d) – Gigafactory Berlin-Brandenburg,Tesla,"Grünheide, Brandenburg, Germany",,https://www.linkedin.com/jobs/view/4419116401 , ,li-4419116401,fulltime,,,,,,False,entry level,Engineering and Information Technology,,,"Motor Vehicle Manufacturing, Renewable Energy Semiconductor Manufacturing, and Utilities",https://www.linkedin.com/company/tesla-motors,,,,,,,,,,,
linkedin,OT-Systemingenieur Prozessleitsystem (PLS) chemische Industrie (m/w/d),Orion S.A.,"Cologne, North Rhine-Westphalia, Germany",,https://www.linkedin.com/jobs/view/4418243369 , ,li-4418243369,fulltime,,,,,,False,associate,Engineering,,christoph.schulz@orioncarbons.com,Chemical Manufacturing,https://www.linkedin.com/company/orion-engineered-carbons-llc-nafta,,,,,,,,,,,
linkedin,XR Systems Engineer (m/w/d) mit Kenntnissen in Monado/OpenXR,Randstad Deutschland,"Dresden, Saxony, Germany",,https://www.linkedin.com/jobs/view/4416413138 , ,li-4416413138,fulltime,,,,,,True,mid-senior level,Information Technology,,,Human Resources Services,https://de.linkedin.com/company/randstad-deutschland,,,,,,,,,,,
linkedin,CAD-Konstrukteur:in für HLS (m/w/d),INNIUS,"Bautzen, Saxony, Germany",,https://www.linkedin.com/jobs/view/4419162144 , ,li-4419162144,fulltime,,,,,,False,entry level,"Design, Art/Creative, and Information Technology",,,Architecture and Planning,https://de.linkedin.com/company/innius-gmbh,,,,,,,,,,,
linkedin,Systemplaner / CAD-Konstrukteur (m/w/d),Ebert Ingenieure GmbH,"Leipzig, Saxony, Germany",,https://www.linkedin.com/jobs/view/4415242929 , ,li-4415242929,parttime,,,,,,False,mid-senior level,Design,,,Architecture and Planning,https://de.linkedin.com/company/ebert-ingenieure-gmbh,,,,,,,,,,,
linkedin,Structure Design Engineer - Berlin (all genders),Reflex Aerospace,"Berlin, Berlin, Germany",,https://www.linkedin.com/jobs/view/4415269269 , ,li-4415269269,fulltime,,,,,,False,associate,Engineering,,,Aviation and Aerospace Component Manufacturing,https://de.linkedin.com/company/reflex-aerospace,,,,,,,,,,,
linkedin,Hardware Entwickler Leistungselektronik,Amoria Bond,"Esslingen, Baden-Württemberg, Germany",,https://www.linkedin.com/jobs/view/4419155056 , ,li-4419155056,fulltime,,,,,,False,mid-senior level,Science,,,Electric Lighting Equipment Manufacturing,https://uk.linkedin.com/company/amoria-bond,,,,,,,,,,,
linkedin,Design Engineer II,JBT Marel,"Glinde, Schleswig-Holstein, Germany",,https://www.linkedin.com/jobs/view/4416839103 , ,li-4416839103,fulltime,,,,,,False,entry level,Engineering and Information Technology,,maarten.krepel@marel.com,Machinery Manufacturing,https://www.linkedin.com/company/jbtmarel,,,,,,,,,,,
linkedin,Design Quality Engineer II,Johnson & Johnson MedTech,"Aachen, North Rhine-Westphalia, Germany",,https://www.linkedin.com/jobs/view/4415296232 , ,li-4415296232,fulltime,,,,,,False,not applicable,Quality Assurance,,,Hospitals and Health Care,https://www.linkedin.com/company/johnson-&-johnson-medtech,,,,,,,,,,,
