site,title,company,location,date_posted,job_url,job_url_direct,id,job_type,salary_source,interval,min_amount,max_amount,currency,is_remote,job_level,job_function,listing_type,emails,company_industry,company_url,company_url_direct,company_addresses,company_num_employees,company_revenue,company_description,skills,experience_range,company_rating,company_reviews_count,vacancy_count,work_from_home_type
linkedin,Service Engineer （IMM）,YIZUMI Germany,"Munich, Bavaria, Germany",2026-05-25,https://www.linkedin.com/jobs/view/4418914617 , ,li-4418914617,fulltime,,,,,,False,mid-senior level,Manufacturing,,,Plastics Manufacturing and Plastics and Rubber Product Manufacturing,https://de.linkedin.com/company/yizumi-germany-de,,,,,,,,,,,
linkedin,Systems Engineer,Spektrum,"Wiesbaden, Hesse, Germany",2026-05-25,https://www.linkedin.com/jobs/view/4417898713 , ,li-4417898713,fulltime,,,,,,True,mid-senior level,Information Technology,,,Staffing and Recruiting,https://es.linkedin.com/company/spektrumgrp,,,,,,,,,,,
linkedin,Technischer Systemplaner(in) (w/m/d) Technischer Zeichner(in) (w/m/d) in der Anlagen- und Rohrleitungsplanung,M Consult GmbH,"Eching, Bavaria, Germany",2026-05-25,https://www.linkedin.com/jobs/view/4414898732 , ,li-4414898732,fulltime,,,,,,False,entry level,Engineering,,,Administrative and Support Services,https://www.linkedin.com/company/m-consult-gmbh,,,,,,,,,,,
linkedin,Bauingenieur:in als Projektingenieur:in Fahrbahn und Tiefbau,Deutsche Bahn,"Berlin, Berlin, Germany",2026-05-25,https://www.linkedin.com/jobs/view/4341288539 , ,li-4341288539,fulltime,,,,,,False,entry level,Engineering and Information Technology,,,Truck Transportation,https://de.linkedin.com/company/deutschebahn,,,,,,,,,,,
linkedin,(Senior) System Engineer / Teamlead Cybersecurity (m/w/d) || netgo tax,netgo,,2026-05-25,https://www.linkedin.com/jobs/view/4252002971 , ,li-4252002971,fulltime,,,,,,False,mid-senior level,Information Technology,,jobs@netgo.de,IT Services and IT Consulting,https://de.linkedin.com/company/netgo-grp,,,,,,,,,,,
linkedin,Network Engineer - L2,N Consulting Global,"Frankfurt, Hesse, Germany",2026-05-25,https://www.linkedin.com/jobs/view/4418928920 , ,li-4418928920,contract,,,,,,False,mid-senior level,Information Technology,,,"Information Services, Technology, Information and Media, and IT Services and IT Consulting",https://uk.linkedin.com/company/n-cons,,,,,,,,,,,
linkedin,Antenna System Engineer,Ericsson,"Radeberg, Saxony, Germany",2026-05-25,https://www.linkedin.com/jobs/view/4417874754 , ,li-4417874754,fulltime,,,,,,False,not applicable,Other,,,Telecommunications,https://se.linkedin.com/company/ericsson,,,,,,,,,,,
linkedin,Antenna System Engineer,Ericsson,"Allmersbach im Tal, Baden-Württemberg, Germany",2026-05-25,https://www.linkedin.com/jobs/view/4417860811 , ,li-4417860811,fulltime,,,,,,False,not applicable,Other,,,Telecommunications,https://se.linkedin.com/company/ericsson,,,,,,,,,,,
linkedin,Antenna System Engineer,Ericsson,"Backnang, Baden-Württemberg, Germany",2026-05-25,https://www.linkedin.com/jobs/view/4417874758 , ,li-4417874758,fulltime,,,,,,False,not applicable,Other,,,Telecommunications,https://se.linkedin.com/company/ericsson,,,,,,,,,,,
linkedin,"Electronic Systems Architecture & Integration Engineer (m/w/d) Berlin, Germany",Tesla,"Berlin, Berlin, Germany",2026-05-25,https://www.linkedin.com/jobs/view/4418900650 , ,li-4418900650,fulltime,,,,,,False,entry level,Quality Assurance,,,"Motor Vehicle Manufacturing, Renewable Energy Semiconductor Manufacturing, and Utilities",https://www.linkedin.com/company/tesla-motors,,,,,,,,,,,
linkedin,Tragwerksplaner (m/w/d),DSD NOELL GmbH,"Würzburg, Bavaria, Germany",2026-05-25,https://www.linkedin.com/jobs/view/4418954266 , ,li-4418954266,fulltime,,,,,,False,mid-senior level,Engineering,,,Machinery Manufacturing,https://de.linkedin.com/company/dsd-noell-gmbh,,,,,,,,,,,
linkedin,"(Senior) Cell Test Engineer, Powertrain Engineering Europe (m/w/d)",Tesla,"Berlin, Berlin, Germany",2026-05-25,https://www.linkedin.com/jobs/view/4418698624 , ,li-4418698624,fulltime,,,,,,False,mid-senior level,Engineering and Information Technology,,,"Motor Vehicle Manufacturing, Renewable Energy Semiconductor Manufacturing, and Utilities",https://www.linkedin.com/company/tesla-motors,,,,,,,,,,,
linkedin,(Sr.) ENGINEER FOR STEERING ENGINEERING DESIGN (M/F/D),Hyundai Motor Europe Technical Center GmbH,"Rüsselsheim, Hesse, Germany",2026-05-25,https://www.linkedin.com/jobs/view/4268303819 , ,li-4268303819,fulltime,,,,,,False,mid-senior level,Engineering and Information Technology,,,Motor Vehicle Manufacturing,https://de.linkedin.com/company/hyundaimotoreuropetechnicalcentergmbh,,,,,,,,,,,
linkedin,Senior Payload Navigation System Engineer,Vertongen Consultancy,"Bremen, Bremen, Germany",2026-05-24,https://www.linkedin.com/jobs/view/4414871015 , ,li-4414871015,fulltime,,,,,,False,mid-senior level,Information Technology,,,Professional Training and Coaching,https://www.linkedin.com/company/vertongen-consultancy,,,,,,,,,,,
linkedin,"(Associate) Automation Control Engineer, Electrical Panel Design - Manufacturing Test Engineering (m/w/d)",Tesla,"Berlin, Berlin, Germany",2026-05-24,https://www.linkedin.com/jobs/view/4418646220 , ,li-4418646220,fulltime,,,,,,False,entry level,Engineering and Information Technology,,,"Motor Vehicle Manufacturing, Renewable Energy Semiconductor Manufacturing, and Utilities",https://www.linkedin.com/company/tesla-motors,,,,,,,,,,,
linkedin,Associate Vehicle Control Engineer (m/w/d) - Gigafactory Berlin-Brandenburg,Tesla,"Grünheide, Brandenburg, Germany",2026-05-24,https://www.linkedin.com/jobs/view/4418658188 , ,li-4418658188,fulltime,,,,,,False,entry level,Engineering and Information Technology,,,"Motor Vehicle Manufacturing, Renewable Energy Semiconductor Manufacturing, and Utilities",https://www.linkedin.com/company/tesla-motors,,,,,,,,,,,
linkedin,Expert Design Engineering (w/m/d),JENOPTIK,"Wedel, Schleswig-Holstein, Germany",2026-05-24,https://www.linkedin.com/jobs/view/4414852180 , ,li-4414852180,fulltime,,,,,,False,mid-senior level,Engineering and Information Technology,,,Motor Vehicle Manufacturing,https://de.linkedin.com/company/jenoptik,,,,,,,,,,,
linkedin,Projektleiter Elektrotechnik (m/w/d) Vollzeit oder Teilzeit,EGS-plan GmbH,"Stuttgart, Baden-Württemberg, Germany",2026-05-24,https://www.linkedin.com/jobs/view/4414853307 , ,li-4414853307,fulltime,,,,,,False,entry level,Engineering,,,Administrative and Support Services,https://de.linkedin.com/company/egs-plan-gmbh,,,,,,,,,,,
linkedin,Senior Engineer Optical Coating - Augmented Reality (m/w/d)*,SCHOTT,"Mainz, Rhineland-Palatinate, Germany",2026-05-24,https://www.linkedin.com/jobs/view/4417581480 , ,li-4417581480,fulltime,,,,,,False,mid-senior level,Engineering and Information Technology,,,"Glass, Ceramics and Concrete Manufacturing",https://de.linkedin.com/company/schott,,,,,,,,,,,
linkedin,Projektleiter Elektrotechnik (m/w/d),UNDKRAUSS,"Berlin, Berlin, Germany",2026-05-24,https://www.linkedin.com/jobs/view/4414821813 , ,li-4414821813,fulltime,,,,,,False,mid-senior level,Manufacturing,,karriere@undkrauss.com,Construction,https://de.linkedin.com/company/undkrauss,,,,,,,,,,,
linkedin,Technischer Systemplaner / Konstrukteur (m/w/d),Frontplan FACADUS GmbH,"Potsdam, Brandenburg, Germany",2026-05-24,https://www.linkedin.com/jobs/view/4414861124 , ,li-4414861124,fulltime,,,,,,False,mid-senior level,Engineering,,,Construction,https://de.linkedin.com/company/frontplan-facadus-gmbh,,,,,,,,,,,
linkedin,Projektingenieur (m/w/d) für ELEKTROTECHNIK,SANCONA GmbH,"Leipzig, Saxony, Germany",2026-05-24,https://www.linkedin.com/jobs/view/4414873082 , ,li-4414873082,fulltime,,,,,,False,mid-senior level,Engineering,,,Administrative and Support Services,https://www.linkedin.com/company/sancona,,,,,,,,,,,
linkedin,Senior Engineer (m/f/d) Powertrain Design - High Performance Motorsport,TOYOTA RACING,"Cologne, North Rhine-Westphalia, Germany",2026-05-24,https://www.linkedin.com/jobs/view/4388515797 , ,li-4388515797,fulltime,,,,,,False,mid-senior level,Engineering and Information Technology,,,Motor Vehicle Manufacturing,https://de.linkedin.com/company/toyota-racing,,,,,,,,,,,
linkedin,Mechanical Engineer for Power Electronics (m/f/d),Alpitronic,"Nuremberg, Bavaria, Germany",2026-05-24,https://www.linkedin.com/jobs/view/4385744274 , ,li-4385744274,fulltime,,,,,,False,associate,Engineering and Information Technology,,,"Appliances, Electrical, and Electronics Manufacturing",https://it.linkedin.com/company/alpitronic-srl,,,,,,,,,,,
linkedin,SCOM Engineer / Monitoring Specialist (m/w/d) – Microsoft System Center,CGI,"Cologne, North Rhine-Westphalia, Germany",2026-05-24,https://www.linkedin.com/jobs/view/4335146070 , ,li-4335146070,fulltime,,,,,,False,entry level,Information Technology,,,IT Services and IT Consulting,https://ca.linkedin.com/company/cgi,,,,,,,,,,,
linkedin,Senior System Engineer (m/f/d),T-Systems International,"Bonn, North Rhine-Westphalia, Germany",2026-05-23,https://www.linkedin.com/jobs/view/4409027132 , ,li-4409027132,parttime,,,,,,False,mid-senior level,Information Technology,,lidia.kocsis@telekom.com,Telecommunications,https://de.linkedin.com/company/t-systems,,,,,,,,,,,
linkedin,"Ingenieur/ Konstrukteur Maschinen- und Schiffbau, all genders",nexadus GmbH,"Bremen, Bremen, Germany",2026-05-23,https://www.linkedin.com/jobs/view/4400563353 , ,li-4400563353,fulltime,,,,,,False,entry level,Engineering and Information Technology,,a.aloe@nexadus.de,Engineering Services,https://de.linkedin.com/company/nexadus,,,,,,,,,,,
linkedin,Business Intelligence & Systems Design Engineer (m/f/d),Alpitronic,"Nuremberg, Bavaria, Germany",2026-05-23,https://www.linkedin.com/jobs/view/4385734895 , ,li-4385734895,fulltime,,,,,,False,associate,Engineering and Information Technology,,,"Appliances, Electrical, and Electronics Manufacturing",https://it.linkedin.com/company/alpitronic-srl,,,,,,,,,,,
linkedin,Systemingenieur Netzwerk Firewall-Konfiguration (m/w/d),e.discom Telekommunikation GmbH,"Fürstenwalde, Brandenburg, Germany",2026-05-23,https://www.linkedin.com/jobs/view/4418636003 , ,li-4418636003,fulltime,,,,,,False,mid-senior level,Information Technology,,,Telecommunications,https://de.linkedin.com/company/e-discom-telekommunikation-gmbh,,,,,,,,,,,
linkedin,"Entwicklungsingenieur Mechanik, all genders",SALT AND PEPPER Group,"Hamburg, Hamburg, Germany",2026-05-23,https://www.linkedin.com/jobs/view/3983900522 , ,li-3983900522,fulltime,,,,,,False,entry level,Engineering and Information Technology,,,Engineering Services,https://de.linkedin.com/company/salt-and-pepper,,,,,,,,,,,
linkedin,"(Associate) Mechanical Design Engineer, Battery Module, Battery Engineering (m/w/d)",Tesla,"Berlin, Berlin, Germany",2026-05-23,https://www.linkedin.com/jobs/view/4418450676 , ,li-4418450676,fulltime,,,,,,False,entry level,Engineering and Information Technology,,,"Motor Vehicle Manufacturing, Renewable Energy Semiconductor Manufacturing, and Utilities",https://www.linkedin.com/company/tesla-motors,,,,,,,,,,,
linkedin,"Mechanical Design Engineer (m/w/d), Body Structures (BIW) - Berlin, Germany",Tesla,"Berlin, Berlin, Germany",2026-05-23,https://www.linkedin.com/jobs/view/4418452659 , ,li-4418452659,fulltime,,,,,,False,entry level,Engineering and Information Technology,,,"Motor Vehicle Manufacturing, Renewable Energy Semiconductor Manufacturing, and Utilities",https://www.linkedin.com/company/tesla-motors,,,,,,,,,,,
linkedin,"European Graduate Development Program, Tesla Engineering Germany (Fall 2026) (m/w/d)",Tesla,"Berlin, Berlin, Germany",2026-05-23,https://www.linkedin.com/jobs/view/4418467051 , ,li-4418467051,fulltime,,,,,,False,entry level,Education and Training,,,"Motor Vehicle Manufacturing, Renewable Energy Semiconductor Manufacturing, and Utilities",https://www.linkedin.com/company/tesla-motors,,,,,,,,,,,
linkedin,Technischer Konstrukteur (m/w/d),Grunwald GmbH,"Wangen im Allgäu, Baden-Württemberg, Germany",2026-05-23,https://www.linkedin.com/jobs/view/4418495388 , ,li-4418495388,fulltime,,,,,,False,entry level,Product Management,,,Machinery Manufacturing,https://de.linkedin.com/company/grunwald-wangen,,,,,,,,,,,
linkedin,(Maschinenbau-) Ingenieur für Großwärmepumpen (m/w/d),HAMBURG WASSER,"Hamburg, Hamburg, Germany",2026-05-23,https://www.linkedin.com/jobs/view/4366738642 , ,li-4366738642,fulltime,,,,,,False,mid-senior level,Engineering and Information Technology,,,Environmental Services,https://de.linkedin.com/company/hamburgwasser,,,,,,,,,,,
linkedin,Projektingenieur*in Brandschutzplanung,IBC Ingenieurbau-Consult GmbH,"Hamburg, Hamburg, Germany",2026-05-23,https://www.linkedin.com/jobs/view/4418492569 , ,li-4418492569,fulltime,,,,,,False,entry level,Engineering,,,Construction,https://de.linkedin.com/company/ibc-ingenieurbau-consult-gmbh,,,,,,,,,,,
linkedin,Prozessentwickler - CAD / CAM / CNC (m/w/d),Workwise,"Gronau, North Rhine-Westphalia, Germany",2026-05-23,https://www.linkedin.com/jobs/view/4418632688 , ,li-4418632688,fulltime,,,,,,False,entry level,Management and Manufacturing,,,"Architecture and Planning, Civil Engineering, and Construction",https://de.linkedin.com/company/workwise-gmbh,,,,,,,,,,,
linkedin,Experienced Galley & Galley Insert Design Engineer (m/f/d),Boeing,"Hamburg, Hamburg, Germany",2026-05-23,https://www.linkedin.com/jobs/view/4407272311 , ,li-4407272311,fulltime,,,,,,False,not applicable,Engineering and Information Technology,,,"Airlines and Aviation, Aviation and Aerospace Component Manufacturing, and Defense and Space Manufacturing",https://www.linkedin.com/company/boeing,,,,,,,,,,,
linkedin,Projektabwickler im Vertriebsinnendienst - Bereich Elektro- / Energietechnik (m/w/d),GRITEC GmbH,"Schkeuditz, Saxony, Germany",2026-05-23,https://www.linkedin.com/jobs/view/4418491677 , ,li-4418491677,fulltime,,,,,,False,entry level,Sales,,karriere@gritec.com,Utility System Construction,https://de.linkedin.com/company/gritecgmbh,,,,,,,,,,,
linkedin,Senior System Engineer (GCA) (m/w/d),T-Systems International,"Dresden, Saxony, Germany",2026-05-23,https://www.linkedin.com/jobs/view/4409013838 , ,li-4409013838,parttime,,,,,,False,mid-senior level,Information Technology,,lidia.kocsis@telekom.com,Telecommunications,https://de.linkedin.com/company/t-systems,,,,,,,,,,,
linkedin,Systemingenieur Netzwerk Firewall-Konfiguration (m/w/d),e.discom Telekommunikation GmbH,"Falkensee, Brandenburg, Germany",2026-05-23,https://www.linkedin.com/jobs/view/4418624014 , ,li-4418624014,fulltime,,,,,,False,mid-senior level,Information Technology,,,Telecommunications,https://de.linkedin.com/company/e-discom-telekommunikation-gmbh,,,,,,,,,,,
linkedin,PhD Algorithmic Design and Development for Automotive Engineering Processes (f/m/x),BMW Group,"Munich, Bavaria, Germany",2026-05-23,https://www.linkedin.com/jobs/view/4340035232 , ,li-4340035232,fulltime,,,,,,False,internship,Management and Manufacturing,,,Motor Vehicle Manufacturing,https://de.linkedin.com/company/bmw-group,,,,,,,,,,,
linkedin,CAMO Support A400M Engineer (all gender),ALTEN Germany,"Wunstorf, Lower Saxony, Germany",2026-05-22,https://www.linkedin.com/jobs/view/4414355372 , ,li-4414355372,fulltime,,,,,,False,associate,Engineering,,,Engineering Services,https://de.linkedin.com/company/altengermany,,,,,,,,,,,
linkedin,Systems Engineer Radarerfassungssysteme (m/w/d),Rohde & Schwarz,"Kiel, Schleswig-Holstein, Germany",2026-05-22,https://www.linkedin.com/jobs/view/4416194391 , ,li-4416194391,fulltime,,,,,,False,not applicable,Information Technology,,,Telecommunications,https://de.linkedin.com/company/rohde-schwarz,,,,,,,,,,,
linkedin,Senior Engineer – Surface Treatment & Production Systems (all gender),ALTEN,"Augsburg, Bavaria, Germany",2026-05-22,https://www.linkedin.com/jobs/view/4414074977 , ,li-4414074977,fulltime,,,,,,False,associate,"Production, Distribution, and Engineering",,,Software Development and IT Services and IT Consulting,https://fr.linkedin.com/company/alten,,,,,,,,,,,
linkedin,Systemingenieur (all gender),ALTEN Germany,"Wedel, Schleswig-Holstein, Germany",2026-05-22,https://www.linkedin.com/jobs/view/4363981838 , ,li-4363981838,fulltime,,,,,,False,associate,Engineering,,,Engineering Services,https://de.linkedin.com/company/altengermany,,,,,,,,,,,
linkedin,Senior Engineer – Surface Treatment & Production Systems (all gender),ALTEN Germany,"Augsburg, Bavaria, Germany",2026-05-22,https://www.linkedin.com/jobs/view/4417124252 , ,li-4417124252,fulltime,,,,,,False,associate,Engineering,,,IT Services and IT Consulting,https://de.linkedin.com/company/altengermany,,,,,,,,,,,
linkedin,Vehicle Attribute Management Engineer,Chery Europe GmbH,"Raunheim, Hesse, Germany",2026-05-22,https://www.linkedin.com/jobs/view/4418122204 , ,li-4418122204,fulltime,,,,,,False,associate,Engineering,,,Motor Vehicle Manufacturing,https://de.linkedin.com/company/chery-europe-gmbh,,,,,,,,,,,
linkedin,(Senior) Engineer – Vehicle Dynamics & Chassis,Chery Europe GmbH,"Raunheim, Hesse, Germany",2026-05-22,https://www.linkedin.com/jobs/view/4418109543 , ,li-4418109543,fulltime,,,,,,False,associate,Engineering,,,Motor Vehicle Manufacturing,https://de.linkedin.com/company/chery-europe-gmbh,,,,,,,,,,,
linkedin,Vehicle Dynamics and Controls Engineer (Commercial Vehicles) – MATLAB/Simulink,Teoresi Group,"Ulm, Baden-Württemberg, Germany",2026-05-22,https://www.linkedin.com/jobs/view/4414099854 , ,li-4414099854,fulltime,,,,,,True,entry level,Consulting,,,Engineering Services,https://it.linkedin.com/company/teoresigroup,,,,,,,,,,,
linkedin,Vehicle Dynamics und Controls Engineer (Nutzfahrzeuge) – MATLAB/Simulink,Teoresi Group,"Ulm, Baden-Württemberg, Germany",2026-05-22,https://www.linkedin.com/jobs/view/4414310641 , ,li-4414310641,fulltime,,,,,,True,entry level,Consulting,,,Engineering Services,https://it.linkedin.com/company/teoresigroup,,,,,,,,,,,
linkedin,System Engineer – Linux (f/m/d),"GMX, WEB.DE & mail.com","Munich, Bavaria, Germany",2026-05-22,https://www.linkedin.com/jobs/view/4414302200 , ,li-4414302200,fulltime,,,,,,False,associate,Information Technology,,,"Technology, Information and Internet",https://de.linkedin.com/company/1-1-mail-media-applications-se,,,,,,,,,,,
linkedin,(Senior) Engineer – Vehicle Drive Quality & Performance,Chery Europe GmbH,"Raunheim, Hesse, Germany",2026-05-22,https://www.linkedin.com/jobs/view/4418100988 , ,li-4418100988,fulltime,,,,,,False,associate,Human Resources,,,Motor Vehicle Manufacturing,https://de.linkedin.com/company/chery-europe-gmbh,,,,,,,,,,,
linkedin,Senior professional Vehicle Homologation & Regulation Engineer,Chery Europe GmbH,"Raunheim, Hesse, Germany",2026-05-22,https://www.linkedin.com/jobs/view/4418115437 , ,li-4418115437,fulltime,,,,,,False,mid-senior level,Engineering and Public Relations,,,"Appliances, Electrical, and Electronics Manufacturing",https://de.linkedin.com/company/chery-europe-gmbh,,,,,,,,,,,
linkedin,Ingenieur Netzanschlussplanung (all gender) 700,ALTEN Germany,"Regen, Bavaria, Germany",2026-05-22,https://www.linkedin.com/jobs/view/4414087803 , ,li-4414087803,fulltime,,,,,,False,entry level,Engineering,,,Machinery Manufacturing and Aviation and Aerospace Component Manufacturing,https://de.linkedin.com/company/altengermany,,,,,,,,,,,
linkedin,Ingenieur Netzanschlussplanung (all gender) 700,ALTEN Germany,"Taufkirchen, Bavaria, Germany",2026-05-22,https://www.linkedin.com/jobs/view/4414086851 , ,li-4414086851,fulltime,,,,,,False,entry level,Engineering,,,Machinery Manufacturing and Aviation and Aerospace Component Manufacturing,https://de.linkedin.com/company/altengermany,,,,,,,,,,,
linkedin,ADAS System Engineer,Chery Europe GmbH,"Raunheim, Hesse, Germany",2026-05-22,https://www.linkedin.com/jobs/view/4418119390 , ,li-4418119390,fulltime,,,,,,False,entry level,"Analyst, Research, and Science",,,Motor Vehicle Manufacturing,https://de.linkedin.com/company/chery-europe-gmbh,,,,,,,,,,,
linkedin,System Engineer – Linux (f/m/d),"GMX, WEB.DE & mail.com","Karlsruhe, Baden-Württemberg, Germany",2026-05-22,https://www.linkedin.com/jobs/view/4414304172 , ,li-4414304172,fulltime,,,,,,False,associate,Information Technology,,,"Technology, Information and Internet",https://de.linkedin.com/company/1-1-mail-media-applications-se,,,,,,,,,,,
linkedin,"CAD-Konstrukteur (m/w/d), Technischer Systemplaner (m/w/d) für elektronische Systeme",ROM Technik,"Düsseldorf, North Rhine-Westphalia, Germany",2026-05-22,https://www.linkedin.com/jobs/view/4414363019 , ,li-4414363019,fulltime,,,,,,False,mid-senior level,Design,,,Construction,https://de.linkedin.com/company/romtechnik,,,,,,,,,,,
linkedin,System & Network Engineer (all genders),adesso SE,"Munich, Bavaria, Germany",2026-05-22,https://www.linkedin.com/jobs/view/4416785265 , ,li-4416785265,fulltime,,,,,,False,mid-senior level,Information Technology,,,IT Services and IT Consulting,https://de.linkedin.com/company/adesso-se,,,,,,,,,,,
linkedin,Antenna Design Engineer / RF Integration Specialist (all gender) 100,ALTEN Germany,"Berlin, Germany",2026-05-22,https://www.linkedin.com/jobs/view/4414300008 , ,li-4414300008,fulltime,,,,,,False,entry level,Engineering,,,Machinery Manufacturing and Aviation and Aerospace Component Manufacturing,https://de.linkedin.com/company/altengermany,,,,,,,,,,,
linkedin,Design / Certification Engineer DOA (m/w/d),SII Germany,"Hamburg, Hamburg, Germany",2026-05-22,https://www.linkedin.com/jobs/view/4409085692 , ,li-4409085692,fulltime,,,,,,False,mid-senior level,Management and Manufacturing,,,IT Services and IT Consulting,https://de.linkedin.com/company/sii-germany,,,,,,,,,,,
linkedin,Meister (m/w/d) für Münster,Scania Deutschland,"Münster, North Rhine-Westphalia, Germany",2026-05-22,https://www.linkedin.com/jobs/view/4387826204 , ,li-4387826204,fulltime,,,,,,False,entry level,Other,,,Motor Vehicle Manufacturing,https://www.linkedin.com/company/scania-deutschland,,,,,,,,,,,
linkedin,Mechanik Przemysłowy / Industriemechaniker – Produkcja Wodoru (Niemcy) – K/M,Mega Partners Joanna Piwowarczyk,"Dresden, Saxony, Germany",2026-05-22,https://www.linkedin.com/jobs/view/4418161271 , ,li-4418161271,fulltime,,,,,,False,associate,Management and Manufacturing,,marta@megapartners.pl,Temporary Help Services,https://www.linkedin.com/company/mega-partners-joanna-piwowarczyk,,,,,,,,,,,
linkedin,Projektingenieur für die Planung Gebäudeautomation (w/m/d),Pinck Ingenieure Consulting GmbH & Co. KG,"Hamburg, Hamburg, Germany",2026-05-22,https://www.linkedin.com/jobs/view/4414308901 , ,li-4414308901,fulltime,,,,,,False,associate,Engineering,,,Industrial Machinery Manufacturing,https://www.linkedin.com/company/pinck-ingenieure-consulting,,,,,,,,,,,
linkedin,Projektingenieur:in Projektsteuerung (w/m/d),Deutsche Bahn,"Berlin, Berlin, Germany",2026-05-22,https://www.linkedin.com/jobs/view/4414073108 , ,li-4414073108,fulltime,,,,,,False,mid-senior level,Engineering and Information Technology,,,Truck Transportation,https://de.linkedin.com/company/deutschebahn,,,,,,,,,,,
linkedin,Versuchsingenieur (m/w/d) Motor- und Systemerprobung,Rolls-Royce Power Systems,"Friedrichshafen, Baden-Württemberg, Germany",2026-05-22,https://www.linkedin.com/jobs/view/4418120188 , ,li-4418120188,fulltime,,,,,,False,mid-senior level,Engineering and Information Technology,,careers@ps.rolls,Machinery Manufacturing,https://de.linkedin.com/company/rolls-royce-power-systems,,,,,,,,,,,
linkedin,Konstrukteur im Bereich Automotive Data Connector (m/w/d),Rosenberger Group,"Fridolfing, Bavaria, Germany",2026-05-22,https://www.linkedin.com/jobs/view/4418084115 , ,li-4418084115,fulltime,,,,,,False,entry level,Engineering and Design,,,"Appliances, Electrical, and Electronics Manufacturing, Motor Vehicle Manufacturing, and Telecommunications",https://de.linkedin.com/company/rosenberger-group,,,,,,,,,,,
linkedin,DevOps/ System Engineer (w/d/m),Diamant Software GmbH,"Bielefeld, North Rhine-Westphalia, Germany",2026-05-22,https://www.linkedin.com/jobs/view/4418103197 , ,li-4418103197,fulltime,,,,,,True,mid-senior level,Information Technology,,,Software Development,https://de.linkedin.com/company/diamant-software-gmbh,,,,,,,,,,,
linkedin,Module Design Engineer (m/w/d),SII Germany,"Schwäbisch Hall, Baden-Württemberg, Germany",2026-05-22,https://www.linkedin.com/jobs/view/4409089535 , ,li-4409089535,fulltime,,,,,,False,mid-senior level,Engineering and Information Technology,,,IT Services and IT Consulting,https://de.linkedin.com/company/sii-germany,,,,,,,,,,,
linkedin,GENESIS - (Sr.) STUDIO ENGINEER (M/F/D),Hyundai Motor Europe Technical Center GmbH,"Beilngries, Bavaria, Germany",2026-05-22,https://www.linkedin.com/jobs/view/4414352969 , ,li-4414352969,fulltime,,,,,,False,mid-senior level,"Design, Art/Creative, and Information Technology",,,Motor Vehicle Manufacturing,https://de.linkedin.com/company/hyundaimotoreuropetechnicalcentergmbh,,,,,,,,,,,
linkedin,Konstrukteur (m/w/d) Sondermaschinenbau - Konzeptentwicklung,XENON Automation,"Dresden, Saxony, Germany",2026-05-22,https://www.linkedin.com/jobs/view/4418112531 , ,li-4418112531,fulltime,,,,,,False,associate,Engineering and Sales,,,Automation Machinery Manufacturing,https://de.linkedin.com/company/xenon-automation,,,,,,,,,,,
linkedin,Anwendungsingenieur*in 3D-Druck,justairtech,"Munich, Bavaria, Germany",2026-05-22,https://www.linkedin.com/jobs/view/4414303793 , ,li-4414303793,fulltime,,,,,,False,entry level,Engineering and Information Technology,,info@justairtech.de,Machinery Manufacturing,https://de.linkedin.com/company/justairtech,,,,,,,,,,,
linkedin,Produktentwickler/-in (m/w/x) Elektromechanik,Gira,"Radevormwald, North Rhine-Westphalia, Germany",2026-05-22,https://www.linkedin.com/jobs/view/4416797914 , ,li-4416797914,fulltime,,,,,,False,entry level,Engineering,,,Semiconductor Manufacturing,https://de.linkedin.com/company/gira-giersiepen-gmbh-&-co-kg,,,,,,,,,,,
