site,title,company,location,date_posted,job_url,job_url_direct,id,job_type,salary_source,interval,min_amount,max_amount,currency,is_remote,job_level,job_function,listing_type,emails,company_industry,company_url,company_url_direct,company_addresses,company_num_employees,company_revenue,company_description,skills,experience_range,company_rating,company_reviews_count,vacancy_count,work_from_home_type
linkedin,"Mechanical Design Engineer (m/w/d) – Battery Structures, Berlin, Germany",Tesla,"Berlin, Berlin, Germany",2026-05-11,https://www.linkedin.com/jobs/view/4413104609 , ,li-4413104609,fulltime,,,,,,False,entry level,Engineering and Information Technology,,,"Motor Vehicle Manufacturing, Renewable Energy Semiconductor Manufacturing, and Utilities",https://www.linkedin.com/company/tesla-motors,,,,,,,,,,,
linkedin,Systemingenieur:in,amaxo GmbH,,2026-05-11,https://www.linkedin.com/jobs/view/4412671603 , ,li-4412671603,fulltime,,,,,,False,associate,Information Technology,,,IT System Operations and Maintenance,https://de.linkedin.com/company/amaxo-gmbh,,,,,,,,,,,
linkedin,CAD Konstrukteur:in im Anlagenbau (m/w/d),BORSIG GmbH,"Gladbeck, North Rhine-Westphalia, Germany",2026-05-11,https://www.linkedin.com/jobs/view/4412916878 , ,li-4412916878,fulltime,,,,,,False,mid-senior level,"Design, Art/Creative, and Information Technology",,,Oil and Gas,https://de.linkedin.com/company/borsig-gmbh,,,,,,,,,,,
linkedin,Mechanical Engineer,Sereact,"Stuttgart, Baden-Württemberg, Germany",2026-05-11,https://www.linkedin.com/jobs/view/4412740542 , ,li-4412740542,fulltime,,,,,,False,entry level,Engineering and Information Technology,,,Software Development,https://de.linkedin.com/company/sereact,,,,,,,,,,,
linkedin,Senior Vehicle AI Context Engineer - Semantics & Memory (f/m/x) - Jobbird.com,Jobster,"Munich, Bavaria, Germany",2026-05-11,https://www.linkedin.com/jobs/view/4413027136 , ,li-4413027136,fulltime,,,,,,False,mid-senior level,Engineering and Information Technology,,,Software Development,https://nl.linkedin.com/company/jobster-com,,,,,,,,,,,
linkedin,Senior Navigation Payload Systems Engineer,Mindroiu Serban-Alexandru PFA,"Bremen, Bremen, Germany",2026-05-11,https://www.linkedin.com/jobs/view/4412671733 , ,li-4412671733,fulltime,,,,,,False,mid-senior level,Information Technology,,,Business Consulting and Services,https://ro.linkedin.com/company/alexandru-mindroiu-pfa,,,,,,,,,,,
linkedin,System Engineer,AVILUS,"Munich, Bavaria, Germany",2026-05-11,https://www.linkedin.com/jobs/view/4412915305 , ,li-4412915305,fulltime,,,,,,False,associate,Engineering,,,Aviation and Aerospace Component Manufacturing,https://de.linkedin.com/company/avilus,,,,,,,,,,,
linkedin,System Engineer,Oxygen Digital,"Düsseldorf, North Rhine-Westphalia, Germany",2026-05-11,https://www.linkedin.com/jobs/view/4413088911 , ,li-4413088911,fulltime,,,,,,False,mid-senior level,Engineering and Research,,,Robotics Engineering,https://uk.linkedin.com/company/oxygendigital,,,,,,,,,,,
linkedin,A400M Weapon Systems Engineer (d/f/m),Tintschl Unternehmensgruppe,"Manching, Bavaria, Germany",2026-05-11,https://www.linkedin.com/jobs/view/4412783067 , ,li-4412783067,fulltime,,,,,,False,associate,Engineering and Information Technology,,,Aviation and Aerospace Component Manufacturing and Defense and Space Manufacturing,https://de.linkedin.com/company/tintschlunternehmensgruppe,,,,,,,,,,,
linkedin,"CAD-Konstrukteur (m/w/d), Technischer Systemplaner (m/w/d) für elektronische Systeme",ROM Technik,"Düsseldorf, North Rhine-Westphalia, Germany",2026-05-11,https://www.linkedin.com/jobs/view/4413065753 , ,li-4413065753,fulltime,,,,,,False,mid-senior level,"Design, Art/Creative, and Information Technology",,,Construction,https://de.linkedin.com/company/romtechnik,,,,,,,,,,,
linkedin,Systems Engineer – Renewable Energy Systems (f/m/x),Enpal,"Berlin, Berlin, Germany",2026-05-11,https://www.linkedin.com/jobs/view/4413017750 , ,li-4413017750,fulltime,,,,,,False,mid-senior level,Information Technology,,,Energy Technology,https://de.linkedin.com/company/enpal,,,,,,,,,,,
linkedin,Connectivity Platform Engineer (Networking & Automation) (m/f/d),adidas,"Herzogenaurach, Bavaria, Germany",2026-05-11,https://www.linkedin.com/jobs/view/4401635744 , ,li-4401635744,fulltime,,,,,,False,not applicable,Engineering and Information Technology,,,"Manufacturing, Retail, and Sporting Goods Manufacturing",https://de.linkedin.com/company/adidas,,,,,,,,,,,
linkedin,M365 System Engineer – Schwerpunkt Teams und Collaboration (m/w/d),Ratiodata,"Karlsruhe, Baden-Württemberg, Germany",2026-05-11,https://www.linkedin.com/jobs/view/4344384744 , ,li-4344384744,fulltime,,,,,,False,mid-senior level,Information Technology,,,IT Services and IT Consulting,https://de.linkedin.com/company/ratiodata,,,,,,,,,,,
linkedin,Senior AI Systems Engineer (f/m/x) - Jobbird.com,Jobster,"Munich, Bavaria, Germany",2026-05-11,https://www.linkedin.com/jobs/view/4412693757 , ,li-4412693757,fulltime,,,,,,False,mid-senior level,Information Technology,,,Software Development,https://nl.linkedin.com/company/jobster-com,,,,,,,,,,,
linkedin,System Engineer Microsoft 365 Cloud (w/m/d),Bechtle,"Dresden, Saxony, Germany",2026-05-11,https://www.linkedin.com/jobs/view/4412724717 , ,li-4412724717,fulltime,,,,,,False,mid-senior level,Information Technology,,recruiting@bechtle.com,IT Services and IT Consulting,https://de.linkedin.com/company/bechtle,,,,,,,,,,,
linkedin,Electronics Systems Engineer,AEW Automotive Systems GmbH,"Neuss, North Rhine-Westphalia, Germany",2026-05-11,https://www.linkedin.com/jobs/view/4412706727 , ,li-4412706727,fulltime,,,,,,False,mid-senior level,Engineering,,,Motor Vehicle Manufacturing,https://de.linkedin.com/company/aew-automotive-systems-gmbh,,,,,,,,,,,
linkedin,"CAD-Konstrukteur (m/w/d), Technischer Systemplaner (m/w/d) für elektronische Systeme",ROM Technik,"Cologne, North Rhine-Westphalia, Germany",2026-05-11,https://www.linkedin.com/jobs/view/4413063926 , ,li-4413063926,fulltime,,,,,,False,mid-senior level,"Design, Art/Creative, and Information Technology",,,Construction,https://de.linkedin.com/company/romtechnik,,,,,,,,,,,
linkedin,"Design Engineer, EU",Ashby,"Berlin, Berlin, Germany",2026-05-11,https://www.linkedin.com/jobs/view/4403618587 , ,li-4403618587,internship,,,,,,False,entry level,Engineering and Information Technology,,,Software Development,https://www.linkedin.com/company/ashbyhq,,,,,,,,,,,
linkedin,Project Engineer,Verto People,"Frankfurt, Hesse, Germany",2026-05-11,https://www.linkedin.com/jobs/view/4413071443 , ,li-4413071443,fulltime,,,,,,False,associate,Engineering,,,Construction,https://uk.linkedin.com/company/vertopeople,,,,,,,,,,,
linkedin,Project Engineer,Linum Consult,"Hamburg, Germany",2026-05-11,https://www.linkedin.com/jobs/view/4412738881 , ,li-4412738881,fulltime,,,,,,False,associate,Engineering,,europe@linumconsult.com,Civil Engineering and Construction,https://uk.linkedin.com/company/linum-consult,,,,,,,,,,,
linkedin,Mechanical Engineer & Python Expert - Freelance AI Trainer,Mindrift,,2026-05-11,https://www.linkedin.com/jobs/view/4412923181 , ,li-4412923181,parttime,,,,,,False,entry level,Other,,,IT Services and IT Consulting,https://www.linkedin.com/company/mindrift-ai,,,,,,,,,,,
linkedin,Equipment Engineer (f/m/d),Excelitas Technologies Corp.,,2026-05-11,https://www.linkedin.com/jobs/view/4385948045 , ,li-4385948045,fulltime,,,,,,False,entry level,Management and Manufacturing,,,Manufacturing,https://www.linkedin.com/company/excelitas-technologies,,,,,,,,,,,
linkedin,FEM Berechnungsingenieur (m/w/d),VIRO Deutschland,"Osnabrück, Lower Saxony, Germany",2026-05-11,https://www.linkedin.com/jobs/view/4412756281 , ,li-4412756281,fulltime,,,,,,False,mid-senior level,Engineering and Information Technology,,,Mechanical Or Industrial Engineering,https://de.linkedin.com/company/viro-deutschland,,,,,,,,,,,
linkedin,Tool Developer Stamping / Werkzeugentwickler Stanztechnik (m/w/d),WAGO,"Neu Ulm, Bavaria, Germany",2026-05-11,https://www.linkedin.com/jobs/view/4412739318 , ,li-4412739318,fulltime,,,,,,False,entry level,Engineering and Information Technology,,jobs@wago.com,"Appliances, Electrical, and Electronics Manufacturing",https://de.linkedin.com/company/wago,,,,,,,,,,,
linkedin,HLK - Ingenieur (m/w/d),AIDA Cruises,,2026-05-11,https://www.linkedin.com/jobs/view/4413023328 , ,li-4413023328,fulltime,,,,,,False,associate,Engineering and Quality Assurance,,,Travel Arrangements,https://de.linkedin.com/company/aida-cruises,,,,,,,,,,,
linkedin,"Projektingenieur Elektrik/ Elektronik, all genders",SALT AND PEPPER Group,"Augsburg, Bavaria, Germany",2026-05-11,https://www.linkedin.com/jobs/view/4301191066 , ,li-4301191066,fulltime,,,,,,False,entry level,Engineering and Information Technology,,,Engineering Services,https://de.linkedin.com/company/salt-and-pepper,,,,,,,,,,,
linkedin,Statiker Stahlbauingenieur / Bauingenieur (Dipl.-Ing. / Master / Bachelor) (m/w/d),Galler Lager- und Regaltechnik GmbH,"Kulmbach, Bavaria, Germany",2026-05-11,https://www.linkedin.com/jobs/view/4402438817 , ,li-4402438817,fulltime,,,,,,False,mid-senior level,Engineering and Information Technology,,,Warehousing and Storage,https://de.linkedin.com/company/galler-lager,,,,,,,,,,,
linkedin,Magnetic Design Engineer,Dexter Magnetic Technologies,"Korntal-Münchingen, Baden-Württemberg, Germany",2026-05-11,https://www.linkedin.com/jobs/view/4374154986 , ,li-4374154986,fulltime,,,,,,False,associate,Engineering,,,"Medical Equipment Manufacturing, Semiconductor Manufacturing, and Aviation and Aerospace Component Manufacturing",https://www.linkedin.com/company/dexter-magnetic-technologies,,,,,,,,,,,
linkedin,Airbus - A400M Structure Design Engineer (d/m/w) - befr. bis Ende 04/28,Randstad Deutschland,"Bremen, Bremen, Germany",2026-05-11,https://www.linkedin.com/jobs/view/4413026436 , ,li-4413026436,fulltime,,,,,,False,mid-senior level,Engineering and Information Technology,,,Human Resources Services,https://de.linkedin.com/company/randstad-deutschland,,,,,,,,,,,
linkedin,Mitarbeiter Technik (m/w/d) Konstruktion / Projektierung,kdw HR GmbH & Co. KG,"Norderstedt, Schleswig-Holstein, Germany",2026-05-11,https://www.linkedin.com/jobs/view/4412783806 , ,li-4412783806,fulltime,,,,,,False,entry level,Project Management,,,Automation Machinery Manufacturing and Machinery Manufacturing,https://de.linkedin.com/company/kdw-hr,,,,,,,,,,,
linkedin,Product Design Engineer – Plastics (Exterior) (w/m/d),MINTH GROUP,"Unterschleißheim, Bavaria, Germany",2026-05-10,https://www.linkedin.com/jobs/view/4412543582 , ,li-4412543582,fulltime,,,,,,False,mid-senior level,Engineering and Information Technology,,,Motor Vehicle Manufacturing,https://tw.linkedin.com/company/minth-group-ltd.,,,,,,,,,,,
linkedin,"Systems Engineer/DevOps Eng, ESC Managed Operations",Amazon Web Services (AWS),"Berlin, Germany",2026-05-10,https://www.linkedin.com/jobs/view/4365508247 , ,li-4365508247,fulltime,,,,,,False,not applicable,"Quality Assurance, Information Technology, and Engineering",,,IT Services and IT Consulting,https://www.linkedin.com/company/amazon-web-services,,,,,,,,,,,
linkedin,Module Design Engineer (m/w/d),Bertrandt Group,"Schwäbisch Hall, Baden-Württemberg, Germany",2026-05-09,https://www.linkedin.com/jobs/view/4410496605 , ,li-4410496605,fulltime,,,,,,False,mid-senior level,Engineering and Information Technology,,,Engineering Services,https://de.linkedin.com/company/bertrandt-ag,,,,,,,,,,,
linkedin,Senior Equipment Engineer,JD.COM,"Oberhausen, North Rhine-Westphalia, Germany",2026-05-09,https://www.linkedin.com/jobs/view/4411922448 , ,li-4411922448,fulltime,,,,,,False,mid-senior level,Engineering,,,"Transportation, Logistics, Supply Chain and Storage",https://cn.linkedin.com/company/jd.com,,,,,,,,,,,
linkedin,Mechanical Engineer,Mercor,"Berlin, Berlin, Germany",2026-05-09,https://www.linkedin.com/jobs/view/4412417858 , ,li-4412417858,parttime,,,,,,True,not applicable,Engineering and Information Technology,,support@mercor.com,Software Development,https://www.linkedin.com/company/mercor-ai,,,,,,,,,,,
linkedin,Mechanical Design Engineer | Upto $40/hr,Mercor,,2026-05-09,https://www.linkedin.com/jobs/view/4411948219 , ,li-4411948219,parttime,,,,,,True,not applicable,Engineering,,support@mercor.com,Software Development,https://www.linkedin.com/company/mercor-ai,,,,,,,,,,,
linkedin,Konzeptionär/Projektingenieur (w/m/d) Fördermaschinen,Innomotics,"Essen, North Rhine-Westphalia, Germany",2026-05-09,https://www.linkedin.com/jobs/view/4073019965 , ,li-4073019965,fulltime,,,,,,False,mid-senior level,Engineering and Information Technology,,,Machinery Manufacturing,https://de.linkedin.com/company/innomotics,,,,,,,,,,,
linkedin,Navigation System Engineer (d/m/w),Airbus Defence and Space,"Manching, Bavaria, Germany",2026-05-09,https://www.linkedin.com/jobs/view/4412440676 , ,li-4412440676,parttime,,,,,,False,mid-senior level,Information Technology,,emsom@airbus.com,Defense and Space Manufacturing,https://www.linkedin.com/company/airbus-defence-and-space,,,,,,,,,,,
linkedin,Projektingenieur Kabeltiefbau und Netzausbau (w/m/d),Arcadis,"Halle, Saxony-Anhalt, Germany",2026-05-09,https://www.linkedin.com/jobs/view/4364120924 , ,li-4364120924,fulltime,,,,,,False,not applicable,Other,,,Professional Services,https://nl.linkedin.com/company/arcadis,,,,,,,,,,,
linkedin,Bauingenieur / Projektingenieur Ingenieurbau (w/m/d),Hamburger Hochbahn AG,"Hamburg, Hamburg, Germany",2026-05-09,https://www.linkedin.com/jobs/view/4391136222 , ,li-4391136222,fulltime,,,,,,False,mid-senior level,Engineering and Information Technology,,,Urban Transit Services,https://de.linkedin.com/company/hamburger-hochbahn-ag,,,,,,,,,,,
linkedin,Projektingenieur:in Baugrunderkundung,Deutsche Bahn,"Coblenz, Rhineland-Palatinate, Germany",2026-05-09,https://www.linkedin.com/jobs/view/4412434400 , ,li-4412434400,fulltime,,,,,,False,entry level,Engineering and Information Technology,,,Truck Transportation,https://de.linkedin.com/company/deutschebahn,,,,,,,,,,,
linkedin,Eine/n Projektingenieur/in (m/w/d),Stadtverwaltung Winnenden,"Winnenden, Baden-Württemberg, Germany",2026-05-09,https://www.linkedin.com/jobs/view/4400838938 , ,li-4400838938,fulltime,,,,,,False,entry level,Engineering and Information Technology,,,Government Administration,https://de.linkedin.com/company/stadtverwaltung-winnenden,,,,,,,,,,,
linkedin,Entwicklungsingenieur Automotive (m/w/d),Bertrandt Group,"Munich, Bavaria, Germany",2026-05-09,https://www.linkedin.com/jobs/view/4398237570 , ,li-4398237570,fulltime,,,,,,False,entry level,Engineering and Information Technology,,,Engineering Services,https://de.linkedin.com/company/bertrandt-ag,,,,,,,,,,,
linkedin,System Engineer (m/w/d) im Bereich Verkehrstechnik,Katarina Biermann Spot On You Consulting,"Berlin, Germany",2026-05-08,https://www.linkedin.com/jobs/view/4411339837 , ,li-4411339837,fulltime,,,,,,False,associate,Information Technology,,,IT System Custom Software Development,https://de.linkedin.com/company/katarina-biermann-spot-on-you-consulting,,,,,,,,,,,
linkedin,Systemingenieur (m/w/d),ROTZLER GROUP,"Steinen, Baden-Württemberg, Germany",2026-05-08,https://www.linkedin.com/jobs/view/4411360604 , ,li-4411360604,fulltime,,,,,,False,entry level,Information Technology,,,Industrial Machinery Manufacturing,https://de.linkedin.com/company/rotzler-group,,,,,,,,,,,
linkedin,Mechanical Engineer - AI Systems,Mercor,,2026-05-08,https://www.linkedin.com/jobs/view/4411308998 , ,li-4411308998,parttime,,,,,,True,not applicable,Engineering,,support@mercor.com,Software Development,https://www.linkedin.com/company/mercor-ai,,,,,,,,,,,
linkedin,Senior System Engineer / Project Manager (m/w/d),ROTZLER GROUP,"Steinen, Baden-Württemberg, Germany",2026-05-08,https://www.linkedin.com/jobs/view/4411353923 , ,li-4411353923,fulltime,,,,,,False,mid-senior level,Information Technology,,,Industrial Machinery Manufacturing,https://de.linkedin.com/company/rotzler-group,,,,,,,,,,,
linkedin,"(Senior) Cell Test Engineer, Powertrain Engineering Europe (m/w/d)",Tesla,"Berlin, Berlin, Germany",2026-05-08,https://www.linkedin.com/jobs/view/4411842830 , ,li-4411842830,fulltime,,,,,,False,mid-senior level,Engineering and Information Technology,,,"Motor Vehicle Manufacturing, Renewable Energy Semiconductor Manufacturing, and Utilities",https://www.linkedin.com/company/tesla-motors,,,,,,,,,,,
linkedin,Netzplaner (m/w/d),Nowega GmbH,"Münster, North Rhine-Westphalia, Germany",2026-05-08,https://www.linkedin.com/jobs/view/4411850896 , ,li-4411850896,fulltime,,,,,,True,mid-senior level,Engineering,,personal@nowega.de,Utilities,https://de.linkedin.com/company/nowega-gmbh,,,,,,,,,,,
linkedin,"(Senior) Cell Abuse Test Engineer, Powertrain Engineering Europe (m/w/d)",Tesla,"Berlin, Berlin, Germany",2026-05-08,https://www.linkedin.com/jobs/view/4411833982 , ,li-4411833982,fulltime,,,,,,False,mid-senior level,Engineering and Information Technology,,,"Motor Vehicle Manufacturing, Renewable Energy Semiconductor Manufacturing, and Utilities",https://www.linkedin.com/company/tesla-motors,,,,,,,,,,,
linkedin,Avionik-Supportingenieur (all gender) 500,ALTEN Germany,,2026-05-08,https://www.linkedin.com/jobs/view/4345906128 , ,li-4345906128,fulltime,,,,,,False,entry level,Engineering,,,Aviation and Aerospace Component Manufacturing,https://de.linkedin.com/company/altengermany,,,,,,,,,,,
linkedin,Systemingenieur (m/w/d) Mikrofluidik / Mikromechanik,HOERBIGER,"Altenstadt, Bavaria, Germany",2026-05-08,https://www.linkedin.com/jobs/view/4411085145 , ,li-4411085145,fulltime,,,,,,False,not applicable,Information Technology,,,"Motor Vehicle Manufacturing, Industrial Machinery Manufacturing, and Oil and Gas",https://ch.linkedin.com/company/hoerbiger,,,,,,,,,,,
linkedin,System Engineer (m/w/d),Ascom UMS,"Frankfurt, Hesse, Germany",2026-05-08,https://www.linkedin.com/jobs/view/4412172898 , ,li-4412172898,fulltime,,,,,,False,entry level,Information Technology,,,IT Services and IT Consulting,https://it.linkedin.com/company/ums---united-medical-software,,,,,,,,,,,
linkedin,Head of Engineering – Systems & AI-native SDLC,Comparus GmbH,"Hamburg, Germany",2026-05-08,https://www.linkedin.com/jobs/view/4412183466 , ,li-4412183466,fulltime,,,,,,True,mid-senior level,"Information Technology, Product Management, and Strategy/Planning",,,"Business Consulting and Services, Software Development, and IT Services and IT Consulting",https://de.linkedin.com/company/comparus-gmbh,,,,,,,,,,,
linkedin,Mechanical Engineer - AI Systems,Mercor,"Berlin, Berlin, Germany",2026-05-08,https://www.linkedin.com/jobs/view/4410891193 , ,li-4410891193,parttime,,,,,,True,not applicable,Engineering and Information Technology,,support@mercor.com,Software Development,https://www.linkedin.com/company/mercor-ai,,,,,,,,,,,
linkedin,System Engineer Subsea Telecom,Prysmian,"Nordenham, Lower Saxony, Germany",2026-05-08,https://www.linkedin.com/jobs/view/4403435713 , ,li-4403435713,fulltime,,,,,,False,mid-senior level,Information Technology,,,Manufacturing,https://it.linkedin.com/company/prysmian,,,,,,,,,,,
linkedin,Systemingenieur Multidomain Directional Communications Development (all gender),ALTEN Germany,"Berlin, Berlin, Germany",2026-05-08,https://www.linkedin.com/jobs/view/4348260497 , ,li-4348260497,fulltime,,,,,,False,associate,Information Technology,,,IT Services and IT Consulting,https://de.linkedin.com/company/altengermany,,,,,,,,,,,
linkedin,System Architect / Embedded & FPGA Engineer (all gender) 100,ALTEN Germany,"Berlin, Germany",2026-05-08,https://www.linkedin.com/jobs/view/4411387352 , ,li-4411387352,fulltime,,,,,,False,associate,"Engineering, Information Technology, and Production",,,"Research Services, IT System Custom Software Development, and Medical Equipment Manufacturing",https://de.linkedin.com/company/altengermany,,,,,,,,,,,
linkedin,System Engineer M365 (m/w/d),Michael Page,"Hamburg, Hamburg, Germany",2026-05-08,https://www.linkedin.com/jobs/view/4412107792 , ,li-4412107792,fulltime,,,,,,False,mid-senior level,Information Technology and Engineering,,,Staffing and Recruiting,https://uk.linkedin.com/company/michael-page,,,,,,,,,,,
linkedin,Maschinenbauingenieur (m/w/d) mit Schwerpunkt Projektleitung,Schluchseewerk AG,"Laufenburg (Baden), Baden-Württemberg, Germany",2026-05-08,https://www.linkedin.com/jobs/view/4324800872 , ,li-4324800872,fulltime,,,,,,False,associate,Project Management and Information Technology,,,Utilities,https://www.linkedin.com/company/schluchseewerk-ag,,,,,,,,,,,
linkedin,Design Engineer (m/w/d),SOGECLAIR,"Bremen, Bremen, Germany",2026-05-08,https://www.linkedin.com/jobs/view/4411398509 , ,li-4411398509,fulltime,,,,,,False,mid-senior level,Engineering,,,Non-profit Organizations and Primary and Secondary Education,https://fr.linkedin.com/company/groupesogeclair,,,,,,,,,,,
linkedin,Mechanical Engineer & Python Expert - Freelance AI Trainer,Mindrift,"Hamburg, Hamburg, Germany",2026-05-08,https://www.linkedin.com/jobs/view/4411883350 , ,li-4411883350,parttime,,,,,,False,entry level,Other,,,IT Services and IT Consulting,https://www.linkedin.com/company/mindrift-ai,,,,,,,,,,,
linkedin,Inżynier projektu,Pekabex,"Frankfurt, Hesse, Germany",2026-05-08,https://www.linkedin.com/jobs/view/4411390527 , ,li-4411390527,fulltime,,,,,,False,entry level,"Engineering, Design, and Project Management",,,Construction,https://pl.linkedin.com/company/pekabex-bet-s-a-,,,,,,,,,,,
linkedin,Validierungsingenieur Thermomanagement Fahrzeugkühlung (all gender) 200,ALTEN Germany,"Munich, Bavaria, Germany",2026-05-08,https://www.linkedin.com/jobs/view/4399943501 , ,li-4399943501,fulltime,,,,,,False,entry level,Information Technology and Engineering,,,Motor Vehicle Manufacturing and Software Development,https://de.linkedin.com/company/altengermany,,,,,,,,,,,
linkedin,Konstrukteur (alle Geschlechter),WaldrichSiegen,"Siegen, North Rhine-Westphalia, Germany",2026-05-08,https://www.linkedin.com/jobs/view/4409686545 , ,li-4409686545,fulltime,,,,,,False,entry level,Management and Manufacturing,,bewerbung@herkulesgroup.com,Machinery Manufacturing,https://de.linkedin.com/company/waldrichsiegen,,,,,,,,,,,
linkedin,Entwicklungsingenieur Thermal System (ICE & BEV) (all gender),ALTEN Germany,"Munich, Bavaria, Germany",2026-05-08,https://www.linkedin.com/jobs/view/4387275559 , ,li-4387275559,fulltime,,,,,,False,associate,Engineering,,,Motor Vehicle Manufacturing,https://de.linkedin.com/company/altengermany,,,,,,,,,,,
linkedin,Anlagenführer / Springer (m/w/d),KANN GmbH Baustoffwerke,"Bendorf, Rhineland-Palatinate, Germany",2026-05-08,https://www.linkedin.com/jobs/view/4411862313 , ,li-4411862313,fulltime,,,,,,False,mid-senior level,Other,,personal@kann.de,Wholesale Building Materials,https://de.linkedin.com/company/kann-gmbh-baustoffwerke,,,,,,,,,,,
linkedin,Expert (m/f/d) Templates Creo,Siemens Energy,"Dresden, Saxony, Germany",2026-05-08,https://www.linkedin.com/jobs/view/4411723688 , ,li-4411723688,fulltime,,,,,,True,associate,Research,,,"Appliances, Electrical, and Electronics Manufacturing",https://www.linkedin.com/company/siemens-energy,,,,,,,,,,,
linkedin,Konstrukteur:in Stahlhochbau (m/w/d),STRABAG,"Hosena, Brandenburg, Germany",2026-05-08,https://www.linkedin.com/jobs/view/4412192175 , ,li-4412192175,fulltime,,,,,,False,entry level,Management and Manufacturing,,,Construction,https://at.linkedin.com/company/strabag,,,,,,,,,,,
linkedin,Projektingenieur Kabeltiefbau und Netzausbau (w/m/d),Arcadis,"Dresden, Saxony, Germany",2026-05-08,https://www.linkedin.com/jobs/view/4363178935 , ,li-4363178935,fulltime,,,,,,False,not applicable,Other,,,Professional Services,https://nl.linkedin.com/company/arcadis,,,,,,,,,,,
linkedin,Projektingenieur Kabeltiefbau und Netzausbau (w/m/d),Arcadis,"Darmstadt, Hesse, Germany",2026-05-08,https://www.linkedin.com/jobs/view/4363188557 , ,li-4363188557,fulltime,,,,,,False,not applicable,Other,,,Professional Services,https://nl.linkedin.com/company/arcadis,,,,,,,,,,,
linkedin,Systemingenieur Entwicklung & Integration (all gender) 999,ALTEN Germany,"Bremen, Germany",2026-05-08,https://www.linkedin.com/jobs/view/4401928835 , ,li-4401928835,fulltime,,,,,,False,associate,"Engineering, Quality Assurance, and Information Technology",,,"Machinery Manufacturing, Human Resources Services, and IT Services and IT Consulting",https://de.linkedin.com/company/altengermany,,,,,,,,,,,
linkedin,Mechanical Engineer,Specialist Technical Services (STS Group),"Frankfurt, Hesse, Germany",2026-05-08,https://www.linkedin.com/jobs/view/4409686679 , ,li-4409686679,fulltime,,,,,,False,mid-senior level,Engineering,,,Construction,https://ie.linkedin.com/company/specialist-technical-engineering-services-sts-,,,,,,,,,,,
linkedin,ENGINE SPECIALIST - AUTOMOTIVE (GERMANY),Teoresi Group,,2026-05-08,https://www.linkedin.com/jobs/view/4403727076 , ,li-4403727076,fulltime,,,,,,False,mid-senior level,Consulting,,,Engineering Services,https://it.linkedin.com/company/teoresigroup,,,,,,,,,,,
linkedin,Konstrukteur/Entwicklungsingenieur Nutzfahrzeugtechnik (all gender),ALTEN Germany,"Munich, Bavaria, Germany",2026-05-08,https://www.linkedin.com/jobs/view/4392681233 , ,li-4392681233,fulltime,,,,,,False,associate,Engineering,,,Motor Vehicle Manufacturing,https://de.linkedin.com/company/altengermany,,,,,,,,,,,
linkedin,Design Engineer / Strak-Koordinator (all gender) 200,ALTEN Germany,"Munich, Bavaria, Germany",2026-05-08,https://www.linkedin.com/jobs/view/4315928405 , ,li-4315928405,fulltime,,,,,,False,entry level,Engineering,,,Machinery Manufacturing,https://de.linkedin.com/company/altengermany,,,,,,,,,,,
linkedin,Mechanical Design Engineer,FormFactor Inc.,"Thiendorf, Saxony, Germany",2026-05-08,https://www.linkedin.com/jobs/view/4390954524 , ,li-4390954524,fulltime,,,,,,False,mid-senior level,Engineering and Information Technology,,,Semiconductor Manufacturing,https://www.linkedin.com/company/formfactor,,,,,,,,,,,
