site,title,company,location,date_posted,job_url,job_url_direct,id,job_type,salary_source,interval,min_amount,max_amount,currency,is_remote,job_level,job_function,listing_type,emails,company_industry,company_url,company_url_direct,company_addresses,company_num_employees,company_revenue,company_description,skills,experience_range,company_rating,company_reviews_count,vacancy_count,work_from_home_type
linkedin,Vice President (m/w/d) Project Engineering & Execution Data Center Business EMEA,Rolls-Royce Power Systems,"Friedrichshafen, Baden-Württemberg, Germany",,https://www.linkedin.com/jobs/view/4412992742 , ,li-4412992742,fulltime,,,,,,False,executive,Engineering and Information Technology,,careers@ps.rolls,Machinery Manufacturing,https://de.linkedin.com/company/rolls-royce-power-systems,,,,,,,,,,,
linkedin,Projektingenieur TGA Rechenzentren / Datacenter (m/w/d),ZWP Ingenieur-AG,"Bochum, North Rhine-Westphalia, Germany",,https://www.linkedin.com/jobs/view/4389678993 , ,li-4389678993,fulltime,,,,,,True,associate,Engineering and Information Technology,,,Construction,https://de.linkedin.com/company/zwp-ingenieur-ag,,,,,,,,,,,
linkedin,Experienced Cellular IP Design Engineer (m/f/d),Apple,"Munich, Bavaria, Germany",,https://www.linkedin.com/jobs/view/4413586644 , ,li-4413586644,fulltime,,,,,,False,mid-senior level,Engineering and Information Technology,,,Computers and Electronics Manufacturing,https://www.linkedin.com/company/apple,,,,,,,,,,,
linkedin,Software Engineer (Java) - Vehicle Diagnostics Platform (m/w/d),SEGULA Technologies,"Stuttgart, Baden-Württemberg, Germany",,https://www.linkedin.com/jobs/view/4410173335 , ,li-4410173335,fulltime,,,,,,False,mid-senior level,Information Technology,,,Automotive,https://fr.linkedin.com/company/segula-technologies,,,,,,,,,,,
linkedin,"AI Engineer – Build & Deploy AI Systems in Production - €90,000",Findr,,,https://www.linkedin.com/jobs/view/4413471380 , ,li-4413471380,fulltime,,,,,,False,mid-senior level,"Engineering, Information Technology, and Analyst",,,"Software Development, Data Infrastructure and Analytics, and IT System Data Services",https://de.linkedin.com/company/findr-tech,,,,,,,,,,,
linkedin,"AI Engineer – Build & Deploy AI Systems in Production - €95,000",Findr,"Munich, Bavaria, Germany",,https://www.linkedin.com/jobs/view/4413453631 , ,li-4413453631,fulltime,,,,,,False,mid-senior level,"Information Technology, Engineering, and Analyst",,,"Software Development, Data Infrastructure and Analytics, and IT System Data Services",https://de.linkedin.com/company/findr-tech,,,,,,,,,,,
linkedin,System Engineer – Core Infrastructure,Universal-Investment,,,https://www.linkedin.com/jobs/view/4404687792 , ,li-4404687792,fulltime,,,,,,True,mid-senior level,Information Technology,,,Financial Services,https://de.linkedin.com/company/universal-investment,,,,,,,,,,,
linkedin,Tech Lead Engineer (Network),Manning Global AG,"North Rhine-Westphalia, Germany",,https://www.linkedin.com/jobs/view/4413448255 , ,li-4413448255,fulltime,,,,,,True,mid-senior level,Engineering,,,IT Services and IT Consulting and IT System Data Services,https://de.linkedin.com/company/manning-global-gmbh,,,,,,,,,,,
linkedin,Systemingenieur Helicopters (m/w/d),Akkodis,"Donauwörth, Bavaria, Germany",,https://www.linkedin.com/jobs/view/4364635247 , ,li-4364635247,fulltime,,,,,,False,entry level,Engineering,,,Manufacturing,https://www.linkedin.com/company/akkodis,,,,,,,,,,,
linkedin,System Engineer Datacenter (m/w/d),CANCOM,"Frankfurt am Main, Hesse, Germany",,https://www.linkedin.com/jobs/view/4364194131 , ,li-4364194131,fulltime,,,,,,False,associate,Information Technology,,,IT Services and IT Consulting,https://de.linkedin.com/company/cancom,,,,,,,,,,,
linkedin,Fachberater SE-Center (m/w/d) in Neuenrade,Heinrich Schmidt Holding GmbH & Co. KG,"Siegen, North Rhine-Westphalia, Germany",,https://www.linkedin.com/jobs/view/4413494346 , ,li-4413494346,fulltime,,,,,,False,entry level,Information Technology,,,"Transportation, Logistics, Supply Chain and Storage",https://de.linkedin.com/company/heinrich-schmidt-holding,,,,,,,,,,,
linkedin,Network Engineer (m/w/d),SQUILD GmbH,"Saarbrücken, Saarland, Germany",,https://www.linkedin.com/jobs/view/4410156303 , ,li-4410156303,fulltime,,,,,,True,mid-senior level,Information Technology,,,IT Services and IT Consulting,https://de.linkedin.com/company/squild-gmbh,,,,,,,,,,,
linkedin,Systems Engineer,Applied Intuition,"Stuttgart, Baden-Württemberg, Germany",,https://www.linkedin.com/jobs/view/4330211316 , ,li-4330211316,fulltime,,,,,,True,mid-senior level,Information Technology,,,Software Development,https://www.linkedin.com/company/applied-intuition-inc,,,,,,,,,,,
linkedin,Design Engineer (d/f/m),Airbus,"Munich, Bavaria, Germany",,https://www.linkedin.com/jobs/view/4410128554 , ,li-4410128554,fulltime,,,,,,False,mid-senior level,Engineering and Information Technology,,emsom@airbus.com,Aviation and Aerospace Component Manufacturing,https://fr.linkedin.com/company/airbusgroup,,,,,,,,,,,
linkedin,E-CAD Konstrukteur (m/w/d),Rügenwalder Mühle Carl Müller GmbH & Co. KG,"Bad Zwischenahn, Lower Saxony, Germany",,https://www.linkedin.com/jobs/view/4413550769 , ,li-4413550769,fulltime,,,,,,False,mid-senior level,Engineering,,Recruiting@ruegenwalder.de,Food and Beverage Services,https://de.linkedin.com/company/r%C3%BCgenwalder-m%C3%BChle,,,,,,,,,,,
linkedin,Technischer Produktdesigner (w/m/d)  / Detailkonstrukteur (w/m/d),WITTENSTEIN group,"Igersheim, Baden-Württemberg, Germany",,https://www.linkedin.com/jobs/view/4407615709 , ,li-4407615709,fulltime,,,,,,False,associate,Research and Engineering,,,Automation Machinery Manufacturing,https://de.linkedin.com/company/wittenstein-group,,,,,,,,,,,
linkedin,"Mechanical Design Engineer (m/w/d, all levels) - Closures Engineering - Berlin, Germany",Tesla,"Berlin, Berlin, Germany",,https://www.linkedin.com/jobs/view/4413475512 , ,li-4413475512,fulltime,,,,,,False,entry level,Engineering and Information Technology,,,"Motor Vehicle Manufacturing, Renewable Energy Semiconductor Manufacturing, and Utilities",https://www.linkedin.com/company/tesla-motors,,,,,,,,,,,
linkedin,Ingenieur / Konstrukteur (m/w/d) in Münster,TK Elevator,"Münster, North Rhine-Westphalia, Germany",,https://www.linkedin.com/jobs/view/4412928577 , ,li-4412928577,fulltime,,,,,,False,entry level,Manufacturing,,johanna.vonwendt@tkelevator.com,"Machinery Manufacturing, Facilities Services, and Construction",https://de.linkedin.com/company/tke-global,,,,,,,,,,,
linkedin,HARDWARE PROJEKTLEITER/ENTWICKLER FÜR ZENTRALSTEUERGERÄTE (M/W/D),FORVIA HELLA,"Lippstadt, North Rhine-Westphalia, Germany",,https://www.linkedin.com/jobs/view/4410168113 , ,li-4410168113,fulltime,,,,,,False,mid-senior level,Engineering and Information Technology,,,Motor Vehicle Manufacturing,https://de.linkedin.com/company/forviahella,,,,,,,,,,,
linkedin,"Design Engineer 2 - Stuttgart, Germany","M.C. Dean, Inc.","Stuttgart, Baden-Württemberg, Germany",,https://www.linkedin.com/jobs/view/4413204614 , ,li-4413204614,fulltime,,,,,,False,not applicable,Engineering and Information Technology,,,Design Services,https://www.linkedin.com/company/m-c-dean-inc,,,,,,,,,,,
