site,title,company,location,date_posted,job_url,job_url_direct,id,job_type,salary_source,interval,min_amount,max_amount,currency,is_remote,job_level,job_function,listing_type,emails,company_industry,company_url,company_url_direct,company_addresses,company_num_employees,company_revenue,company_description,skills,experience_range,company_rating,company_reviews_count,vacancy_count,work_from_home_type
linkedin,Entwicklungsingenieur Fahrzeugtechnik & Systemintegration (all gender),ALTEN Germany,"Munich, Bavaria, Germany",2026-05-08,https://www.linkedin.com/jobs/view/4380291238 , ,li-4380291238,fulltime,,,,,,False,associate,Engineering,,,Motor Vehicle Manufacturing,https://de.linkedin.com/company/altengermany,,,,,,,,,,,
linkedin,Mechanical Engineer,Mercor,,2026-05-08,https://www.linkedin.com/jobs/view/4411317917 , ,li-4411317917,parttime,,,,,,True,not applicable,Engineering,,support@mercor.com,Software Development,https://www.linkedin.com/company/mercor-ai,,,,,,,,,,,
linkedin,Future Engineer (all gender) – Maschinenbau & Innovation,ALTEN Germany,"Munich, Bavaria, Germany",2026-05-08,https://www.linkedin.com/jobs/view/4410100355 , ,li-4410100355,fulltime,,,,,,False,associate,Engineering and Project Management,,,Motor Vehicle Manufacturing,https://de.linkedin.com/company/altengermany,,,,,,,,,,,
linkedin,Mechanical Design Engineer | Upto $100/hr,Mercor,,2026-05-08,https://www.linkedin.com/jobs/view/4411342188 , ,li-4411342188,parttime,,,,,,True,not applicable,Engineering,,support@mercor.com,Software Development,https://www.linkedin.com/company/mercor-ai,,,,,,,,,,,
linkedin,Mechanical Engineer - Fully Remote,Mercor,,2026-05-08,https://www.linkedin.com/jobs/view/4411342077 , ,li-4411342077,parttime,,,,,,True,not applicable,Engineering,,support@mercor.com,Software Development,https://www.linkedin.com/company/mercor-ai,,,,,,,,,,,
linkedin,Mechanical Engineer,Nova Ltd.,"Bad Urach, Baden-Württemberg, Germany",2026-05-08,https://www.linkedin.com/jobs/view/4410471930 , ,li-4410471930,fulltime,,,,,,True,mid-senior level,Engineering and Information Technology,,,Semiconductor Manufacturing,https://il.linkedin.com/company/nova-ltd.,,,,,,,,,,,
linkedin,Mechanical Engineer & Python Expert - Freelance AI Trainer,Mindrift,"Frankfurt am Main, Hesse, Germany",2026-05-08,https://www.linkedin.com/jobs/view/4411891106 , ,li-4411891106,parttime,,,,,,False,entry level,Other,,,IT Services and IT Consulting,https://www.linkedin.com/company/mindrift-ai,,,,,,,,,,,
linkedin,System Engineer – Aerospace (m/f/d),TXT GROUP,"Bayern, Bavaria, Germany",2026-05-07,https://www.linkedin.com/jobs/view/4410831128 , ,li-4410831128,fulltime,,,,,,False,entry level,Information Technology,,,IT Services and IT Consulting,https://it.linkedin.com/company/txtgroup,,,,,,,,,,,
linkedin,"Flight Deck & Systems Engineer (m/f/d) (Associate, Experienced, and Senior)",Boeing,"Neu-Isenburg, Hesse, Germany",2026-05-07,https://www.linkedin.com/jobs/view/4409251703 , ,li-4409251703,fulltime,,,,,,False,not applicable,Information Technology,,,"Airlines and Aviation, Aviation and Aerospace Component Manufacturing, and Defense and Space Manufacturing",https://www.linkedin.com/company/boeing,,,,,,,,,,,
linkedin,"CAD-Konstrukteur - HEIZUNG, LÜFTUNG, SANITÄR, KLIMA",SCHNEPF Planungsgruppe,"Baunatal, Hesse, Germany",2026-05-07,https://www.linkedin.com/jobs/view/4409204746 , ,li-4409204746,fulltime,,,,,,False,entry level,Engineering,,,Construction,https://de.linkedin.com/company/schnepf-planungsgruppe-energietechnik,,,,,,,,,,,
linkedin,Design Engineer / Konstruktion (all gender),Actana Consulting Services GmbH,"Munich, Bavaria, Germany",2026-05-07,https://www.linkedin.com/jobs/view/4409228754 , ,li-4409228754,fulltime,,,,,,False,mid-senior level,Engineering,,,Professional Services,https://de.linkedin.com/company/actana-gmbh,,,,,,,,,,,
linkedin,Powertrain System and Calibration Expert,Li Auto,"Munich, Bavaria, Germany",2026-05-07,https://www.linkedin.com/jobs/view/4379145065 , ,li-4379145065,fulltime,,,,,,False,mid-senior level,Engineering,,,Motor Vehicle Manufacturing and Motor Vehicle Parts Manufacturing,https://cn.linkedin.com/company/liauto,,,,,,,,,,,
linkedin,System Engineer Networking (w/m/d),Bechtle,"Münster, North Rhine-Westphalia, Germany",2026-05-07,https://www.linkedin.com/jobs/view/4411649852 , ,li-4411649852,fulltime,,,,,,False,entry level,Information Technology,,,IT Services and IT Consulting,https://de.linkedin.com/company/bechtle,,,,,,,,,,,
linkedin,M365 System Engineer – Schwerpunkt Teams und Collaboration (m/w/d),Ratiodata,"Hannover, Lower Saxony, Germany",2026-05-07,https://www.linkedin.com/jobs/view/4367215309 , ,li-4367215309,fulltime,,,,,,False,mid-senior level,Information Technology,,,IT Services and IT Consulting,https://de.linkedin.com/company/ratiodata,,,,,,,,,,,
linkedin,Systemingenieur Infotainment/Connectivity (m/w/d),prognum Automotive GmbH,"Stuttgart, Baden-Württemberg, Germany",2026-05-07,https://www.linkedin.com/jobs/view/4411451424 , ,li-4411451424,fulltime,,,,,,False,entry level,Information Technology,,,Engineering Services,https://de.linkedin.com/company/prognum-automotive,,,,,,,,,,,
linkedin,Systemingenieur (w/m/d),WITTENSTEIN group,"Igersheim, Baden-Württemberg, Germany",2026-05-07,https://www.linkedin.com/jobs/view/4258391767 , ,li-4258391767,fulltime,,,,,,False,associate,Research and Engineering,,,Automation Machinery Manufacturing,https://de.linkedin.com/company/wittenstein-group,,,,,,,,,,,
linkedin,Systemingenieur Fahrerassistenzsysteme / ADAS (m/w/d),prognum Automotive GmbH,"Stuttgart, Baden-Württemberg, Germany",2026-05-07,https://www.linkedin.com/jobs/view/4411441554 , ,li-4411441554,fulltime,,,,,,False,entry level,Information Technology,,,Engineering Services,https://de.linkedin.com/company/prognum-automotive,,,,,,,,,,,
linkedin,Systems & Landing Gear Engineer (m/w/d),XTENDED ENGINEERING GMBH,"Munich, Bavaria, Germany",2026-05-07,https://www.linkedin.com/jobs/view/4411605521 , ,li-4411605521,fulltime,,,,,,False,mid-senior level,Information Technology,,,Engineering Services,https://de.linkedin.com/company/xtendedengineering,,,,,,,,,,,
linkedin,Ground Systems Engineer,SR2 | Socially Responsible Recruitment | Certified B Corporation™,"Munich, Bavaria, Germany",2026-05-07,https://www.linkedin.com/jobs/view/4409611013 , ,li-4409611013,fulltime,,,,,,True,mid-senior level,Engineering,,,Defense and Space Manufacturing and Aviation and Aerospace Component Manufacturing,https://uk.linkedin.com/company/sr2-socially-responsible-recruitment,,,,,,,,,,,
linkedin,Systems Engineer,trivago,"Düsseldorf, North Rhine-Westphalia, Germany",2026-05-07,https://www.linkedin.com/jobs/view/4404273820 , ,li-4404273820,fulltime,,,,,,True,mid-senior level,Information Technology,,,"Technology, Information and Internet",https://de.linkedin.com/company/trivagonv,,,,,,,,,,,
linkedin,Mobile UI/Design Engineer,Kraken,,2026-05-07,https://www.linkedin.com/jobs/view/4402628283 , ,li-4402628283,fulltime,,,,,,True,entry level,Engineering and Information Technology,,,Financial Services,https://www.linkedin.com/company/krakenfx,,,,,,,,,,,
linkedin,Ingenieur (m/w/d) Produktentwicklung Befestigungslösungen Bauwesen,fischer group,"Waldachtal, Baden-Württemberg, Germany",2026-05-07,https://www.linkedin.com/jobs/view/4410821939 , ,li-4410821939,fulltime,,,,,,False,entry level,Engineering and Information Technology,,,Building Materials,https://de.linkedin.com/company/fischer-group-of-companies,,,,,,,,,,,
linkedin,Mechanical Design Engineer – Propulsion Battery System (all genders),VÆRIDION,"Munich, Bavaria, Germany",2026-05-07,https://www.linkedin.com/jobs/view/4410461487 , ,li-4410461487,fulltime,,,,,,True,associate,Engineering,,,Aviation and Aerospace Component Manufacturing,https://de.linkedin.com/company/vaeridion,,,,,,,,,,,
linkedin,Mechanical Engineer,TRX,"Karlsruhe, Baden-Württemberg, Germany",2026-05-07,https://www.linkedin.com/jobs/view/4411419963 , ,li-4411419963,fulltime,,,,,,False,not applicable,Engineering,,,"Electric Power Generation, Services for Renewable Energy, and Oil and Gas",https://uk.linkedin.com/company/trx-international,,,,,,,,,,,
linkedin,Mechanical Engineer (f/m/d),Omnisent,"Munich, Bavaria, Germany",2026-05-07,https://www.linkedin.com/jobs/view/4409635353 , ,li-4409635353,fulltime,,,,,,False,entry level,Engineering,,,IT Services and IT Consulting,https://de.linkedin.com/company/omnisent,,,,,,,,,,,
linkedin,Mechanical Engineer,TXT GROUP,"Bavaria, Germany",2026-05-07,https://www.linkedin.com/jobs/view/4410827224 , ,li-4410827224,fulltime,,,,,,False,entry level,Engineering and Information Technology,,,IT Services and IT Consulting,https://it.linkedin.com/company/txtgroup,,,,,,,,,,,
linkedin,Mixed Signal Design Engineer (m/f/d),Micron Technology,"Munich, Bavaria, Germany",2026-05-07,https://www.linkedin.com/jobs/view/4410839324 , ,li-4410839324,fulltime,,,,,,False,entry level,Other,,"_EMEA@micron.com, _TA@micron.com","Computer Hardware Manufacturing, Appliances, Electrical, and Electronics Manufacturing, and Semiconductor Manufacturing",https://www.linkedin.com/company/micron-technology,,,,,,,,,,,
linkedin,Projektingenieur / Projektleitung (m/w/d),WAGNER Group GmbH,"Langenhagen, Lower Saxony, Germany",2026-05-07,https://www.linkedin.com/jobs/view/4411456108 , ,li-4411456108,fulltime,,,,,,False,associate,Project Management,,,Fire Protection,https://de.linkedin.com/company/wagner-group-gmbh,,,,,,,,,,,
linkedin,"Systems Engineer, Staff Algorithm (m/f/d)",BorgWarner,"Darmstadt, Hesse, Germany",2026-05-06,https://www.linkedin.com/jobs/view/4409966000 , ,li-4409966000,fulltime,,,,,,False,not applicable,Information Technology,,,"Motor Vehicle Manufacturing, Industrial Machinery Manufacturing, and Truck Transportation",https://www.linkedin.com/company/borgwarner,,,,,,,,,,,
linkedin,"Supplier Quality Engineer (f/m/d) Gas Turbine Auxiliaries, Fluid Systems",Siemens Energy,"Erlangen, Bavaria, Germany",2026-05-06,https://www.linkedin.com/jobs/view/4409951434 , ,li-4409951434,fulltime,,,,,,True,associate,Supply Chain,,,"Appliances, Electrical, and Electronics Manufacturing",https://www.linkedin.com/company/siemens-energy,,,,,,,,,,,
linkedin,Systemingenieur Field Service (w/m/d),HENSOLDT,"Ulm, Baden-Württemberg, Germany",2026-05-06,https://www.linkedin.com/jobs/view/4409154406 , ,li-4409154406,fulltime,,,,,,False,entry level,Information Technology,,recruitment@hensoldt.net,Defense and Space Manufacturing,https://de.linkedin.com/company/hensoldt,,,,,,,,,,,
linkedin,"System Engineer, Staff Controls (m/f/d)",BorgWarner,"Darmstadt, Hesse, Germany",2026-05-06,https://www.linkedin.com/jobs/view/4409966001 , ,li-4409966001,fulltime,,,,,,False,not applicable,Information Technology,,,"Motor Vehicle Manufacturing, Industrial Machinery Manufacturing, and Truck Transportation",https://www.linkedin.com/company/borgwarner,,,,,,,,,,,
linkedin,Senior Projektingenieur:in als Spezialist für Bahnübergangssicherungsanlagen Digitale Schiene,Deutsche Bahn,"Munich, Bavaria, Germany",2026-05-06,https://www.linkedin.com/jobs/view/4389466023 , ,li-4389466023,fulltime,,,,,,False,mid-senior level,Engineering and Information Technology,,,Truck Transportation,https://de.linkedin.com/company/deutschebahn,,,,,,,,,,,
linkedin,Entwicklungsingenieur(Landmaschinen),Zoomlion,"Lower Saxony, Germany",2026-05-06,https://www.linkedin.com/jobs/view/4383462916 , ,li-4383462916,fulltime,,,,,,False,mid-senior level,Design,,,"Agriculture, Construction, Mining Machinery Manufacturing and Machinery Manufacturing",https://cn.linkedin.com/company/zoomlion,,,,,,,,,,,
linkedin,Bauingenieur:in als Projektingenieur:in S-Bahn Frankfurt-Friedberg,Deutsche Bahn,"Frankfurt am Main, Hesse, Germany",2026-05-06,https://www.linkedin.com/jobs/view/4380316226 , ,li-4380316226,fulltime,,,,,,False,mid-senior level,Engineering and Information Technology,,,Truck Transportation,https://de.linkedin.com/company/deutschebahn,,,,,,,,,,,
linkedin,CAD Konstrukteur/Technischer Systemplaner TGA (m/w/d),Builtech Group,"Leipzig, Saxony, Germany",2026-05-06,https://www.linkedin.com/jobs/view/4340841368 , ,li-4340841368,fulltime,,,,,,False,mid-senior level,"Design, Art/Creative, and Information Technology",,,Construction,https://de.linkedin.com/company/builtech-gruppe,,,,,,,,,,,
linkedin,Elektro CAD‑Konstrukteur (m/w/d),Builtech Group,"Petersberg, Hesse, Germany",2026-05-06,https://www.linkedin.com/jobs/view/4340871209 , ,li-4340871209,fulltime,,,,,,False,entry level,"Design, Art/Creative, and Information Technology",,,Construction,https://de.linkedin.com/company/builtech-gruppe,,,,,,,,,,,
linkedin,System Manager / Engineer (m/w/d),Westdeutsche Lotterie GmbH & Co. OHG (WestLotto),"Münster, North Rhine-Westphalia, Germany",2026-05-06,https://www.linkedin.com/jobs/view/4409921350 , ,li-4409921350,fulltime,,,,,,False,associate,Information Technology,,personal@westlotto.com,Gambling Facilities and Casinos,https://de.linkedin.com/company/westdeutsche-lotterie,,,,,,,,,,,
linkedin,(Senior) System Engineer (m/w/d),Instaffo,"Mainz, Rhineland-Palatinate, Germany",2026-05-06,https://www.linkedin.com/jobs/view/4402253118 , ,li-4402253118,parttime,,,,,,False,mid-senior level,Engineering and Information Technology,,,IT Services and IT Consulting,https://de.linkedin.com/company/instaffo-gmbh,,,,,,,,,,,
linkedin,Airframe Support Engineer (m/w/d),AIP SERVICES GmbH,"Hamburg, Hamburg, Germany",2026-05-06,https://www.linkedin.com/jobs/view/4409755638 , ,li-4409755638,fulltime,,,,,,False,entry level,Engineering,,,Retail,https://de.linkedin.com/company/metrica-services-gmbh,,,,,,,,,,,
linkedin,Systemingenieur Hochfrequenztechnik (all gender) 100,ALTEN Germany,"Berlin, Germany",2026-05-06,https://www.linkedin.com/jobs/view/4400808233 , ,li-4400808233,fulltime,,,,,,False,entry level,"Product Management, Information Technology, and Production",,,Computers and Electronics Manufacturing and Software Development,https://de.linkedin.com/company/altengermany,,,,,,,,,,,
linkedin,CAD Konstrukteur/Technischer Systemplaner TGA (m/w/d),Builtech Group,"Heilbronn, Baden-Württemberg, Germany",2026-05-06,https://www.linkedin.com/jobs/view/4340581679 , ,li-4340581679,fulltime,,,,,,False,mid-senior level,"Design, Art/Creative, and Information Technology",,,Construction,https://de.linkedin.com/company/builtech-gruppe,,,,,,,,,,,
linkedin,Technischer Produkt Designer / Kontstrukteur,Morgan Advanced Materials,"Remagen, Rhineland-Palatinate, Germany",2026-05-06,https://www.linkedin.com/jobs/view/4407793946 , ,li-4407793946,fulltime,,,,,,False,entry level,"Design, Art/Creative, and Information Technology",,Personal.remagen@morganplc.com,"Glass, Ceramics and Concrete Manufacturing",https://uk.linkedin.com/company/morgan-advanced-materials,,,,,,,,,,,
linkedin,Project Engineering Manager m/w/d,GE Vernova,"Dresden, Saxony, Germany",2026-05-06,https://www.linkedin.com/jobs/view/4402037786 , ,li-4402037786,fulltime,,,,,,False,mid-senior level,Engineering and Information Technology,,,Energy Technology,https://www.linkedin.com/company/gevernova,,,,,,,,,,,
linkedin,Mechanischer Planner (m/w/d),Cargill,"Malchin, Mecklenburg-West Pomerania, Germany",2026-05-06,https://www.linkedin.com/jobs/view/4400777421 , ,li-4400777421,fulltime,,,,,,False,mid-senior level,"Quality Assurance, Production, and Engineering",,,"Chemical Manufacturing, Food and Beverage Services, and Food and Beverage Manufacturing",https://www.linkedin.com/company/cargill,,,,,,,,,,,
linkedin,Projektingenieur Verfahrenstechnik Spritzguss (m/w/d),SMP Automotive Global,"Oldenburg, Lower Saxony, Germany",2026-05-06,https://www.linkedin.com/jobs/view/4411217292 , ,li-4411217292,fulltime,,,,,,False,mid-senior level,Engineering and Information Technology,,,Motor Vehicle Manufacturing,https://de.linkedin.com/company/samvardhana-motherson-peguform,,,,,,,,,,,
linkedin,Schmelzer ESU-Anlagen (w/m/d),GMH Gruppe,"Wiehl, North Rhine-Westphalia, Germany",2026-05-06,https://www.linkedin.com/jobs/view/4409944200 , ,li-4409944200,fulltime,,,,,,False,entry level,Other,,,Fabricated Metal Products,https://de.linkedin.com/company/gmh-gruppe,,,,,,,,,,,
linkedin,Konstrukteur Bautechnik (m/w/d),PHILIPPGRUPPE,"Aschaffenburg, Bavaria, Germany",2026-05-06,https://www.linkedin.com/jobs/view/4409910326 , ,li-4409910326,fulltime,,,,,,False,associate,Engineering and Production,,,Software Development,https://de.linkedin.com/company/philippgruppe,,,,,,,,,,,
linkedin,Maschinenbauingenieur (m/w/d),B&B Verpackungstechnik GmbH,"Hopsten, North Rhine-Westphalia, Germany",2026-05-06,https://www.linkedin.com/jobs/view/4411213405 , ,li-4411213405,fulltime,,,,,,False,mid-senior level,Engineering and Information Technology,,,Machinery Manufacturing,https://de.linkedin.com/company/b-und-b-verpackungstechnik-gmbh,,,,,,,,,,,
linkedin,Senior Design Engineer,Helsing,"Munich, Bavaria, Germany",2026-05-06,https://www.linkedin.com/jobs/view/4409913419 , ,li-4409913419,fulltime,,,,,,False,mid-senior level,Engineering and Information Technology,,,Software Development,https://de.linkedin.com/company/helsing,,,,,,,,,,,
linkedin,Junior Konstrukteur - Formen (m/w/d),WECK,"Bonn, North Rhine-Westphalia, Germany",2026-05-06,https://www.linkedin.com/jobs/view/4409774458 , ,li-4409774458,fulltime,,,,,,False,internship,Engineering,,,Retail,https://de.linkedin.com/company/weckglassandpackaginggmbh,,,,,,,,,,,
linkedin,Mower R&D Engineer,Zoomlion,"Lower Saxony, Germany",2026-05-06,https://www.linkedin.com/jobs/view/4409915384 , ,li-4409915384,fulltime,,,,,,False,mid-senior level,Design and Product Management,,,"Machinery Manufacturing and Agriculture, Construction, Mining Machinery Manufacturing",https://cn.linkedin.com/company/zoomlion,,,,,,,,,,,
linkedin,Baler R&D Engineer,Zoomlion,"Lower Saxony, Germany",2026-05-06,https://www.linkedin.com/jobs/view/4409909542 , ,li-4409909542,fulltime,,,,,,False,mid-senior level,Design and Product Management,,,"Machinery Manufacturing and Agriculture, Construction, Mining Machinery Manufacturing",https://cn.linkedin.com/company/zoomlion,,,,,,,,,,,
linkedin,Drill Seeder R&D Engineer,Zoomlion,"Lower Saxony, Germany",2026-05-06,https://www.linkedin.com/jobs/view/4409922234 , ,li-4409922234,fulltime,,,,,,False,mid-senior level,Design and Product Management,,,"Machinery Manufacturing and Agriculture, Construction, Mining Machinery Manufacturing",https://cn.linkedin.com/company/zoomlion,,,,,,,,,,,
linkedin,Senior Space System Engineer (m/f/d),CGI,"Darmstadt, Hesse, Germany",2026-05-06,https://www.linkedin.com/jobs/view/4389741795 , ,li-4389741795,fulltime,,,,,,False,entry level,Information Technology,,,IT Services and IT Consulting,https://ca.linkedin.com/company/cgi,,,,,,,,,,,
linkedin,"Bauingenieur:in, Verkehrsingenieur:in, Wirtschaftsingenieur:in als Projektingenieur:in Masterplan",Deutsche Bahn,"Frankfurt am Main, Hesse, Germany",2026-05-06,https://www.linkedin.com/jobs/view/4410953873 , ,li-4410953873,fulltime,,,,,,False,mid-senior level,Management and Manufacturing,,,Truck Transportation,https://de.linkedin.com/company/deutschebahn,,,,,,,,,,,
linkedin,(Senior) System Engineer (m/w/d) || netgo tax,netgo,"Würselen, North Rhine-Westphalia, Germany",2026-05-05,https://www.linkedin.com/jobs/view/4410723810 , ,li-4410723810,fulltime,,,,,,False,mid-senior level,Information Technology,,jobs@netgo.de,IT Services and IT Consulting,https://de.linkedin.com/company/netgo-grp,,,,,,,,,,,
linkedin,Mechanical Engineer,Hades Mining,"Munich, Bavaria, Germany",,https://www.linkedin.com/jobs/view/4413427204 , ,li-4413427204,fulltime,,,,,,False,mid-senior level,Engineering and Information Technology,,,Mining,https://de.linkedin.com/company/hades,,,,,,,,,,,
linkedin,Resident Engineer Powertrain,SEGULA Technologies,"Rüsselsheim, Hesse, Germany",,https://www.linkedin.com/jobs/view/4410161457 , ,li-4410161457,fulltime,,,,,,False,mid-senior level,Engineering,,,Automotive,https://fr.linkedin.com/company/segula-technologies,,,,,,,,,,,
linkedin,Design Engineer (d/f/m) (H/F) - AEROSTACK GMBH,AEROCONTACT,"Munich, Bavaria, Germany",,https://www.linkedin.com/jobs/view/4413444025 , ,li-4413444025,fulltime,,,,,,False,executive,Engineering and Information Technology,,emsom@airbus.com,Staffing and Recruiting,https://fr.linkedin.com/company/aerocontact,,,,,,,,,,,
linkedin,Maintenance Excellence Engineer (d/m/w) - Instandhaltungsstrategie,Sievert SE,,,https://www.linkedin.com/jobs/view/4413555357 , ,li-4413555357,fulltime,,,,,,False,mid-senior level,Engineering,,,Construction,https://de.linkedin.com/company/sievert-se,,,,,,,,,,,
linkedin,Ingenieur (m/w/d),VdS Schadenverhütung GmbH,"Cologne, North Rhine-Westphalia, Germany",,https://www.linkedin.com/jobs/view/4395059714 , ,li-4395059714,fulltime,,,,,,False,associate,"Engineering, Product Management, and Quality Assurance",,,"Public Safety, Fire Protection, and Engineering Services",https://de.linkedin.com/company/vds-schadenverhuetung-gmbh,,,,,,,,,,,
linkedin,Metal Forming Engineer (all genders),Blackwave GmbH,"Garching, Bavaria, Germany",,https://www.linkedin.com/jobs/view/4391479491 , ,li-4391479491,fulltime,,,,,,False,mid-senior level,Engineering and Information Technology,,,Aviation and Aerospace Component Manufacturing,https://de.linkedin.com/company/blackwave-gmbh,,,,,,,,,,,
linkedin,Ingenieur (m/w/d) Strukturmechanik / FEM Berechnung,Proway GmbH,"Ulm, Baden-Württemberg, Germany",,https://www.linkedin.com/jobs/view/4410188736 , ,li-4410188736,fulltime,,,,,,False,mid-senior level,Engineering and Information Technology,,bewerbung@proway.de,IT Services and IT Consulting,https://de.linkedin.com/company/proway-gmbh,,,,,,,,,,,
linkedin,Projektingenieur Wind & Site Immissionsschutz (m/w/d),ENERTRAG,"Berlin, Berlin, Germany",,https://www.linkedin.com/jobs/view/4401454829 , ,li-4401454829,fulltime,,,,,,False,mid-senior level,Engineering and Information Technology,,,Utilities,https://de.linkedin.com/company/enertrag,,,,,,,,,,,
linkedin,Ingenieur (m/w/d) Produktentwicklung Befestigungslösungen Bauwesen,fischerwerke GmbH & Co. KG,"Waldachtal, Baden-Württemberg, Germany",,https://www.linkedin.com/jobs/view/4413493325 , ,li-4413493325,fulltime,,,,,,False,entry level,Engineering and Information Technology,,,Machinery Manufacturing,https://www.linkedin.com/company/fischerwerke-gmbh-&-co.-kg,,,,,,,,,,,
linkedin,"Process/Design Engineer Amazon Logistics, Sr Design Engineering",Amazon,"Munich, Bavaria, Germany",,https://www.linkedin.com/jobs/view/4412994734 , ,li-4412994734,fulltime,,,,,,False,mid-senior level,"Project Management, Management, and Product Management",,,Software Development,https://www.linkedin.com/company/amazon,,,,,,,,,,,
linkedin,Entwicklungsingenieur (m/w/d) (Bereich Klebeband-Produkte),Coroplast Group,"Wuppertal, North Rhine-Westphalia, Germany",,https://www.linkedin.com/jobs/view/4383282258 , ,li-4383282258,fulltime,,,,,,False,associate,"Production, Manufacturing, and Other",,,"Motor Vehicle Manufacturing, Machinery Manufacturing, and Automation Machinery Manufacturing",https://de.linkedin.com/company/coroplast-group,,,,,,,,,,,
linkedin,Assistant Chief Engineer (d/w/m),Le Méridien Munich,,,https://www.linkedin.com/jobs/view/4402910864 , ,li-4402910864,fulltime,,,,,,False,mid-senior level,Customer Service,,,Hotels and Motels,https://de.linkedin.com/company/le-meridien-munich,,,,,,,,,,,
linkedin,"Design Engineer 3 - Stuttgart, Germany","M.C. Dean, Inc.","Stuttgart, Baden-Württemberg, Germany",,https://www.linkedin.com/jobs/view/4413209341 , ,li-4413209341,fulltime,,,,,,False,not applicable,Engineering and Information Technology,,,Design Services,https://www.linkedin.com/company/m-c-dean-inc,,,,,,,,,,,
linkedin,Maschinenbauingenieur als Projektmanager (m/w/d),SAT Anlagentechnik GmbH,"Dägeling, Schleswig-Holstein, Germany",,https://www.linkedin.com/jobs/view/4410167885 , ,li-4410167885,fulltime,,,,,,False,mid-senior level,Engineering,,,Industrial Machinery Manufacturing,https://de.linkedin.com/company/sat-sterling,,,,,,,,,,,
linkedin,Senior Commissioning Engineer,g2 Recruitment,"Hamburg, Germany",,https://www.linkedin.com/jobs/view/4413494342 , ,li-4413494342,fulltime,,,,,,False,mid-senior level,Engineering,,,Engineering Services and Engines and Power Transmission Equipment Manufacturing,https://de.linkedin.com/company/g2-recruitment-solutions,,,,,,,,,,,
linkedin,Project Engineering Manager for Service (f/m/d),Siemens Energy,"Berlin, Berlin, Germany",,https://www.linkedin.com/jobs/view/4413592704 , ,li-4413592704,fulltime,,,,,,True,associate,Sales,,,"Appliances, Electrical, and Electronics Manufacturing",https://www.linkedin.com/company/siemens-energy,,,,,,,,,,,
linkedin,Terminal Engineer (m/w/d) / LNG Terminal Wilhelmshaven,Gasfin,"Wilhelmshaven, Lower Saxony, Germany",,https://www.linkedin.com/jobs/view/4410185199 , ,li-4410185199,fulltime,,,,,,False,mid-senior level,Engineering,,,"Oil, Gas, and Mining",https://de.linkedin.com/company/gasfin-development,,,,,,,,,,,
linkedin,Lead Engineer (m/w/d),Randstad Deutschland,"Leverkusen, North Rhine-Westphalia, Germany",,https://www.linkedin.com/jobs/view/4413439859 , ,li-4413439859,fulltime,,,,,,False,mid-senior level,Engineering and Information Technology,,,Human Resources Services,https://de.linkedin.com/company/randstad-deutschland,,,,,,,,,,,
linkedin,Projektingenieur im Bereich Technik (m/w/d),Sandoz in Deutschland,"Barleben, Saxony-Anhalt, Germany",,https://www.linkedin.com/jobs/view/4393504993 , ,li-4393504993,fulltime,,,,,,False,mid-senior level,Engineering and Information Technology,,,Pharmaceutical Manufacturing,https://de.linkedin.com/company/sandozde,,,,,,,,,,,
linkedin,Projektleiter Elektrotechnik Stark- und/oder Schwachstrom (w/m/d),ROM Technik,"Walldorf, Baden-Württemberg, Germany",,https://www.linkedin.com/jobs/view/4410170161 , ,li-4410170161,fulltime,,,,,,False,mid-senior level,Engineering and Information Technology,,,Construction,https://de.linkedin.com/company/romtechnik,,,,,,,,,,,
