site,title,company,location,date_posted,job_url,job_url_direct,id,job_type,salary_source,interval,min_amount,max_amount,currency,is_remote,job_level,job_function,listing_type,emails,company_industry,company_url,company_url_direct,company_addresses,company_num_employees,company_revenue,company_description,skills,experience_range,company_rating,company_reviews_count,vacancy_count,work_from_home_type
linkedin,Mechanical Design Engineer – Propulsion Battery System (all genders),VÆRIDION,"Munich, Bavaria, Germany",2026-05-22,https://www.linkedin.com/jobs/view/4410461487 , ,li-4410461487,fulltime,,,,,,True,associate,Engineering,,,Aviation and Aerospace Component Manufacturing,https://de.linkedin.com/company/vaeridion,,,,,,,,,,,
linkedin,Module Design Engineer - Composite (m/w/d),SII Germany,"Schwäbisch Hall, Baden-Württemberg, Germany",2026-05-22,https://www.linkedin.com/jobs/view/4409076879 , ,li-4409076879,fulltime,,,,,,False,entry level,Engineering and Information Technology,,,IT Services and IT Consulting,https://de.linkedin.com/company/sii-germany,,,,,,,,,,,
linkedin,Propulsion Design Engineer (m/f/d),Isar Aerospace,"Ottobrunn, Bavaria, Germany",2026-05-22,https://www.linkedin.com/jobs/view/4416758311 , ,li-4416758311,fulltime,,,,,,False,entry level,Engineering and Information Technology,,,Aviation and Aerospace Component Manufacturing,https://de.linkedin.com/company/isaraerospace,,,,,,,,,,,
linkedin,CAM Engineer / CAM-Programmierer (m/w/d),PolyTALENT JOBS,"Hamburg, Hamburg, Germany",2026-05-22,https://www.linkedin.com/jobs/view/4414300857 , ,li-4414300857,fulltime,,,,,,False,mid-senior level,Manufacturing,,,Staffing and Recruiting,https://de.linkedin.com/company/polytalent-jobs,,,,,,,,,,,
linkedin,Cost Engineer (Design-to-Cost / VAVE),AVATR Global Design Center,"Munich, Bavaria, Germany",2026-05-22,https://www.linkedin.com/jobs/view/4399262570 , ,li-4399262570,fulltime,,,,,,True,not applicable,Engineering,,,Construction,https://de.linkedin.com/company/avatrdesign,,,,,,,,,,,
linkedin,"CAD-Konstrukteur (m/w/d), Technischer Systemplaner (m/w/d) für elektronische Systeme",ROM Technik,"Cologne, North Rhine-Westphalia, Germany",2026-05-22,https://www.linkedin.com/jobs/view/4414351985 , ,li-4414351985,fulltime,,,,,,False,mid-senior level,Design,,,Construction,https://de.linkedin.com/company/romtechnik,,,,,,,,,,,
linkedin,Test Engineer Flight Control System - Flight Management System (all gender),ALTEN Germany,"Manching, Bavaria, Germany",2026-05-22,https://www.linkedin.com/jobs/view/4414093576 , ,li-4414093576,fulltime,,,,,,False,entry level,Engineering,,,Machinery Manufacturing and Aviation and Aerospace Component Manufacturing,https://de.linkedin.com/company/altengermany,,,,,,,,,,,
linkedin,Senior System Engineer - Citrix ADC (m/w/d),BWI GmbH,"Bonn, North Rhine-Westphalia, Germany",2026-05-22,https://www.linkedin.com/jobs/view/4418410988 , ,li-4418410988,fulltime,,,,,,False,mid-senior level,Information Technology,,,IT Services and IT Consulting,https://de.linkedin.com/company/bwi-gmbh,,,,,,,,,,,
linkedin,Versuchsingenieur (m/w/d) Motor- und Systemerprobung,Rolls-Royce,"Friedrichshafen, Baden-Württemberg, Germany",2026-05-22,https://www.linkedin.com/jobs/view/4417121386 , ,li-4417121386,fulltime,,,,,,False,mid-senior level,Engineering and Information Technology,,careers@ps.rolls,Industrial Machinery Manufacturing,https://uk.linkedin.com/company/rolls-royce,,,,,,,,,,,
linkedin,Bauzeichner / CAD-Konstrukteur (m/w/d) Verkehrsanlagenplanung Straße,ICL Ingenieur Consult GmbH,"Chemnitz, Saxony, Germany",2026-05-21,https://www.linkedin.com/jobs/view/4417734509 , ,li-4417734509,fulltime,,,,,,False,mid-senior level,Engineering,,,Engineering Services,https://de.linkedin.com/company/icl-ingenieur-consult-gmbh,,,,,,,,,,,
linkedin,Bauzeichner / CAD-Konstrukteur (m/w/d) konstruktiver Wasserbau,ICL Ingenieur Consult GmbH,"Chemnitz, Saxony, Germany",2026-05-21,https://www.linkedin.com/jobs/view/4417731672 , ,li-4417731672,fulltime,,,,,,False,mid-senior level,Engineering,,,Engineering Services,https://de.linkedin.com/company/icl-ingenieur-consult-gmbh,,,,,,,,,,,
linkedin,Bauzeichner / CAD-Konstrukteur (m/w/d) Siedlungswasserwirtschaft,ICL Ingenieur Consult GmbH,"Leipzig, Saxony, Germany",2026-05-21,https://www.linkedin.com/jobs/view/4417743348 , ,li-4417743348,fulltime,,,,,,False,mid-senior level,Engineering,,,Engineering Services,https://de.linkedin.com/company/icl-ingenieur-consult-gmbh,,,,,,,,,,,
linkedin,Ingenieur - Systems Engineering (m/w/d),XTENDED ENGINEERING GMBH,"Munich, Bavaria, Germany",2026-05-21,https://www.linkedin.com/jobs/view/4417723256 , ,li-4417723256,fulltime,,,,,,True,mid-senior level,Information Technology,,,Engineering Services,https://de.linkedin.com/company/xtendedengineering,,,,,,,,,,,
linkedin,System Engineer: Aerospace & Defense (Germany) -Airbus Projects,Orbital Critical Systems (Grupo CAF),"Immenstaad am Bodensee, Baden-Württemberg, Germany",2026-05-21,https://www.linkedin.com/jobs/view/4416387832 , ,li-4416387832,other,,,,,,False,not applicable,Information Technology,,,Airlines and Aviation,https://es.linkedin.com/company/orbital-aerospace,,,,,,,,,,,
linkedin,System Engineer: Aerospace & Defense (Germany) -Airbus Projects,Orbital Critical Systems (Grupo CAF),"Bremen, Bremen, Germany",2026-05-21,https://www.linkedin.com/jobs/view/4416397559 , ,li-4416397559,other,,,,,,False,not applicable,Information Technology,,,Airlines and Aviation,https://es.linkedin.com/company/orbital-aerospace,,,,,,,,,,,
linkedin,System Engineer: Aerospace & Defense (Germany) -Airbus Projects,Orbital Critical Systems (Grupo CAF),"Ulm, Baden-Württemberg, Germany",2026-05-21,https://www.linkedin.com/jobs/view/4416386916 , ,li-4416386916,other,,,,,,False,entry level,Information Technology,,,Airlines and Aviation,https://es.linkedin.com/company/orbital-aerospace,,,,,,,,,,,
linkedin,System Engineer: Aerospace & Defense (Germany) -Airbus Projects,Orbital Critical Systems (Grupo CAF),"Wunstorf, Lower Saxony, Germany",2026-05-21,https://www.linkedin.com/jobs/view/4416394687 , ,li-4416394687,other,,,,,,False,not applicable,Information Technology,,,Airlines and Aviation,https://es.linkedin.com/company/orbital-aerospace,,,,,,,,,,,
linkedin,System Engineer – Core Infrastructure,Universal-Investment,,2026-05-21,https://www.linkedin.com/jobs/view/4404687792 , ,li-4404687792,fulltime,,,,,,True,mid-senior level,Information Technology,,,Financial Services,https://de.linkedin.com/company/universal-investment,,,,,,,,,,,
linkedin,"AI Systems Engineer for Time Series Forecasting, Optimization, and LLM-based Coordination (m/f/d) - Early Stage Startup",adjusted flow,"Karlsruhe, Baden-Württemberg, Germany",2026-05-21,https://www.linkedin.com/jobs/view/4414041040 , ,li-4414041040,fulltime,,,,,,False,associate,Information Technology,,,Automation Machinery Manufacturing,https://www.linkedin.com/company/adjustedflow,,,,,,,,,,,
linkedin,Design Engineer,Field,,2026-05-21,https://www.linkedin.com/jobs/view/4417490713 , ,li-4417490713,fulltime,,,,,,False,entry level,Engineering and Information Technology,,,Renewable Energy Power Generation,https://uk.linkedin.com/company/field-energy,,,,,,,,,,,
linkedin,Ausbildung Industriemechaniker für Maschinen- und Anlagenbau (m/w/d),HARIBO Germany,"Willroth, Rhineland-Palatinate, Germany",2026-05-21,https://www.linkedin.com/jobs/view/4376586268 , ,li-4376586268,fulltime,,,,,,False,internship,Management and Manufacturing,,,Manufacturing,https://de.linkedin.com/company/haribo-gmbh-&-co-kg,,,,,,,,,,,
linkedin,Konstrukteur für den Fachbereich Lackieranlagen (m/w/d),SLF Oberflächentechnik GmbH,"Emsdetten, North Rhine-Westphalia, Germany",2026-05-21,https://www.linkedin.com/jobs/view/4417463533 , ,li-4417463533,fulltime,,,,,,False,entry level,Management and Manufacturing,,,Machinery Manufacturing,https://de.linkedin.com/company/slf-oberfl%C3%A4chentechnik-gmbh,,,,,,,,,,,
linkedin,Ingenieur Betriebsmittel Galvanik (m/w/d) Lufthansa Technik,AIP SERVICES GmbH,"Hamburg, Hamburg, Germany",2026-05-21,https://www.linkedin.com/jobs/view/4416387310 , ,li-4416387310,fulltime,,,,,,False,entry level,Engineering,,,Retail,https://de.linkedin.com/company/metrica-services-gmbh,,,,,,,,,,,
linkedin,Hardware-Entwickler (m/w/d),XTENDED ENGINEERING GMBH,"Überlingen, Baden-Württemberg, Germany",2026-05-21,https://www.linkedin.com/jobs/view/4417710593 , ,li-4417710593,fulltime,,,,,,False,entry level,Engineering and Information Technology,,,Engineering Services,https://de.linkedin.com/company/xtendedengineering,,,,,,,,,,,
linkedin,Projektingenieur*in '(m/w/d),TAUBERT und RUHE GmbH,,2026-05-21,https://www.linkedin.com/jobs/view/4417468816 , ,li-4417468816,fulltime,,,,,,False,entry level,,,klaus.focke@taubertundruhe.de,Architecture and Planning,https://de.linkedin.com/company/taubert-und-ruhe-gmbh,,,,,,,,,,,
linkedin,Entwicklungsingenieur (m/w/d) Gesamtfahrzeug  Konzeption Exterieur/Interieur,prognum Automotive GmbH,"Stuttgart, Baden-Württemberg, Germany",2026-05-21,https://www.linkedin.com/jobs/view/4418014223 , ,li-4418014223,fulltime,,,,,,False,entry level,Engineering and Information Technology,,,Engineering Services,https://de.linkedin.com/company/prognum-automotive,,,,,,,,,,,
linkedin,Projektingenieur (m/w/d) Verkehrsanlagenplanung Straße,ICL Ingenieur Consult GmbH,"Dresden, Saxony, Germany",2026-05-21,https://www.linkedin.com/jobs/view/4417742360 , ,li-4417742360,fulltime,,,,,,False,mid-senior level,Engineering,,,Engineering Services,https://de.linkedin.com/company/icl-ingenieur-consult-gmbh,,,,,,,,,,,
linkedin,"Projekt- / Entwicklungsingenieur HVAC / HKLS/ Klima / Versorgungstechnik, all genders",SALT AND PEPPER Group,"Hamburg, Hamburg, Germany",2026-05-21,https://www.linkedin.com/jobs/view/4407334591 , ,li-4407334591,fulltime,,,,,,False,entry level,Engineering and Information Technology,,,Engineering Services,https://de.linkedin.com/company/salt-and-pepper,,,,,,,,,,,
linkedin,Projektingenieur Planung Ingenieurbauwerke (m/w/d),Die Autobahn GmbH des Bundes,"Montabaur, Rhineland-Palatinate, Germany",2026-05-21,https://www.linkedin.com/jobs/view/4417737168 , ,li-4417737168,fulltime,,,,,,False,mid-senior level,"Engineering, Project Management, and Strategy/Planning",,,Construction,https://de.linkedin.com/company/die-autobahn,,,,,,,,,,,
linkedin,Projektingenieur (m/w/d) im technischen Einkauf schlüsselfertiger Hochbau,GOLDBECK,"Mannheim, Baden-Württemberg, Germany",2026-05-21,https://www.linkedin.com/jobs/view/4408401977 , ,li-4408401977,fulltime,,,,,,False,associate,Engineering,,,"Construction, Real Estate, and Architecture and Planning",https://de.linkedin.com/company/goldbeck,,,,,,,,,,,
linkedin,Senior Projektingenieur Elektrotechnik (m/w/d),persona service,"Cologne, North Rhine-Westphalia, Germany",2026-05-21,https://www.linkedin.com/jobs/view/4407336746 , ,li-4407336746,fulltime,,,,,,False,mid-senior level,Engineering and Information Technology,,chrisoula.spanidou@persona.de,Staffing and Recruiting,https://de.linkedin.com/company/persona-service,,,,,,,,,,,
linkedin,"Entwicklungsingenieur Mechanik, all genders",SALT AND PEPPER Group,"Ratingen, North Rhine-Westphalia, Germany",2026-05-21,https://www.linkedin.com/jobs/view/4416586141 , ,li-4416586141,fulltime,,,,,,False,entry level,Engineering and Information Technology,,,Engineering Services,https://de.linkedin.com/company/salt-and-pepper,,,,,,,,,,,
linkedin,PROJEKTLEITER (m/w/d) Fachbereich Elektrotechnik,Marti Group,"Pforzheim, Baden-Württemberg, Germany",2026-05-21,https://www.linkedin.com/jobs/view/4405127876 , ,li-4405127876,fulltime,,,,,,False,mid-senior level,Engineering and Information Technology,,,Construction,https://ch.linkedin.com/company/marti-holding-ag,,,,,,,,,,,
linkedin,Structural Design Staff Engineer-Fully Automatic Coffee Machine Products,Midea Group,"Stuttgart, Baden-Württemberg, Germany",2026-05-21,https://www.linkedin.com/jobs/view/4404492365 , ,li-4404492365,fulltime,,,,,,False,mid-senior level,"Engineering, Design, and Research",,,"Appliances, Electrical, and Electronics Manufacturing",https://cn.linkedin.com/company/mideagroup,,,,,,,,,,,
linkedin,Maschinenbauingenieur:in,jobvalley,,2026-05-21,https://www.linkedin.com/jobs/view/4417499861 , ,li-4417499861,fulltime,,,,,,False,associate,Research,,,Research Services and Aviation and Aerospace Component Manufacturing,https://de.linkedin.com/company/jobvalley,,,,,,,,,,,
linkedin,"Mechanical Design Engineer, Unmanned Systems",SE3 Labs,"Erding, Bavaria, Germany",2026-05-21,https://www.linkedin.com/jobs/view/4417788978 , ,li-4417788978,fulltime,,,,,,False,entry level,Engineering and Information Technology,,,Software Development,https://de.linkedin.com/company/se3-labs,,,,,,,,,,,
linkedin,"Mechanical Design Engineer, Dimensional (m/w/d) Berlin, Germany",Tesla,"Berlin, Berlin, Germany",2026-05-21,https://www.linkedin.com/jobs/view/4416572553 , ,li-4416572553,fulltime,,,,,,False,entry level,Engineering and Information Technology,,,"Motor Vehicle Manufacturing, Renewable Energy Semiconductor Manufacturing, and Utilities",https://www.linkedin.com/company/tesla-motors,,,,,,,,,,,
linkedin,"Mechanical Design Engineer, Unmanned Systems",SE3 Labs,"Munich, Bavaria, Germany",2026-05-21,https://www.linkedin.com/jobs/view/4417791892 , ,li-4417791892,fulltime,,,,,,False,entry level,Engineering and Information Technology,,,Software Development,https://de.linkedin.com/company/se3-labs,,,,,,,,,,,
linkedin,"Mechanical Design Engineer, Audio (m/w/d) Berlin, Germany",Tesla,"Berlin, Berlin, Germany",2026-05-21,https://www.linkedin.com/jobs/view/4416577484 , ,li-4416577484,fulltime,,,,,,False,entry level,Engineering and Information Technology,,,"Motor Vehicle Manufacturing, Renewable Energy Semiconductor Manufacturing, and Utilities",https://www.linkedin.com/company/tesla-motors,,,,,,,,,,,
linkedin,"Mechanical Design Engineer (m/w/d), Exterior Engineering - Berlin, Germany",Tesla,"Berlin, Berlin, Germany",2026-05-21,https://www.linkedin.com/jobs/view/4416581510 , ,li-4416581510,fulltime,,,,,,False,entry level,Engineering and Information Technology,,,"Motor Vehicle Manufacturing, Renewable Energy Semiconductor Manufacturing, and Utilities",https://www.linkedin.com/company/tesla-motors,,,,,,,,,,,
linkedin,"Mechanical Design Engineer (m/w/d), Chassis - Berlin, Germany",Tesla,"Berlin, Berlin, Germany",2026-05-21,https://www.linkedin.com/jobs/view/4416568560 , ,li-4416568560,fulltime,,,,,,False,entry level,Engineering and Information Technology,,,"Motor Vehicle Manufacturing, Renewable Energy Semiconductor Manufacturing, and Utilities",https://www.linkedin.com/company/tesla-motors,,,,,,,,,,,
linkedin,Auszubildender Industriemechaniker ab September 2027 (m/w/d),Liebherr Group,"Kirchdorf an der Iller, Baden-Württemberg, Germany",2026-05-20,https://www.linkedin.com/jobs/view/4416182944 , ,li-4416182944,fulltime,,,,,,False,internship,Management and Manufacturing,,bernd.sailer@liebherr.com,Industrial Machinery Manufacturing,https://de.linkedin.com/company/liebherr,,,,,,,,,,,
linkedin,Netzwerkingenieur (m/w/d) Cisco & OT,Bertrandt Group,"Berlin, Berlin, Germany",2026-05-20,https://www.linkedin.com/jobs/view/4416185188 , ,li-4416185188,fulltime,,,,,,False,mid-senior level,Information Technology,,,Engineering Services,https://de.linkedin.com/company/bertrandt-ag,,,,,,,,,,,
linkedin,Mitarbeiter Netzdesign m/w/d,TEAG Thüringer Energie AG,"Erfurt, Thuringia, Germany",2026-05-20,https://www.linkedin.com/jobs/view/4377203248 , ,li-4377203248,fulltime,,,,,,False,entry level,Other,,,Utilities,https://de.linkedin.com/company/teag,,,,,,,,,,,
linkedin,Network Engineer (m/w/d),Damovo,"Düsseldorf, North Rhine-Westphalia, Germany",2026-05-20,https://www.linkedin.com/jobs/view/4413392853 , ,li-4413392853,fulltime,,,,,,False,mid-senior level,Information Technology,,,IT Services and IT Consulting,https://de.linkedin.com/company/damovo,,,,,,,,,,,
linkedin,Projektingenieur HKLS (m/w/d) Nürnberg,ROCKSOLID Personalvermittlung GmbH,"Nuremberg, Bavaria, Germany",2026-05-20,https://www.linkedin.com/jobs/view/4413602633 , ,li-4413602633,fulltime,,,,,,False,mid-senior level,Engineering and Information Technology,,,Staffing and Recruiting,https://de.linkedin.com/company/rocksolid-personalvermittlung,,,,,,,,,,,
linkedin,Network Engineer,Hamilton Barnes 🌳,,2026-05-20,https://www.linkedin.com/jobs/view/4401920940 , ,li-4401920940,fulltime,,,,,,True,mid-senior level,Information Technology,,,Computer and Network Security and IT Services and IT Consulting,https://uk.linkedin.com/company/hamilton-barnes,,,,,,,,,,,
linkedin,Systemingenieur (m/w/d) für Beyond-Line-of-Sight-Kommunikation (260348) - Überlingen,Diehl Defence,"Überlingen, Baden-Württemberg, Germany",2026-05-20,https://www.linkedin.com/jobs/view/4415962107 , ,li-4415962107,fulltime,,,,,,False,mid-senior level,Information Technology,,,"Appliances, Electrical, and Electronics Manufacturing",https://de.linkedin.com/company/diehl-defence,,,,,,,,,,,
linkedin,Mechanical Engineer (Actuator & Motor Design),Stealth Physical AI,"Munich, Bavaria, Germany",2026-05-20,https://www.linkedin.com/jobs/view/4417075095 , ,li-4417075095,fulltime,,,,,,False,mid-senior level,Engineering,,,Robotics Engineering,https://de.linkedin.com/company/stealth-physical-ai,,,,,,,,,,,
linkedin,Konstrukteur (all gender),ALTEN Germany,"Frankfurt, Hesse, Germany",2026-05-20,https://www.linkedin.com/jobs/view/4416128900 , ,li-4416128900,fulltime,,,,,,False,associate,Engineering,,,Engineering Services,https://de.linkedin.com/company/altengermany,,,,,,,,,,,
linkedin,Mechanical Engineer,SME Careers,,2026-05-20,https://www.linkedin.com/jobs/view/4417370815 , ,li-4417370815,contract,,,,,,True,mid-senior level,"Engineering, Research, and Writing/Editing",,,"Technology, Information and Internet",https://www.linkedin.com/company/sme-careers,,,,,,,,,,,
linkedin,Mechanical Design Engineer,Dexter Magnetic Technologies,"Korntal-Münchingen, Baden-Württemberg, Germany",2026-05-20,https://www.linkedin.com/jobs/view/4374153995 , ,li-4374153995,fulltime,,,,,,False,associate,Engineering and Information Technology,,,"Medical Equipment Manufacturing, Semiconductor Manufacturing, and Aviation and Aerospace Component Manufacturing",https://www.linkedin.com/company/dexter-magnetic-technologies,,,,,,,,,,,
linkedin,Product Engineer (m/w/d),Eissmann Group Automotive,"Bad Urach, Baden-Württemberg, Germany",2026-05-20,https://www.linkedin.com/jobs/view/4405154262 , ,li-4405154262,fulltime,,,,,,False,mid-senior level,Engineering and Information Technology,,jobs@eissmann.com,Motor Vehicle Manufacturing,https://de.linkedin.com/company/eissmann-group-automotive,,,,,,,,,,,
linkedin,Ingenieure (m/w/d) CAD-Konstruktion,Oehmichen & Bürgers Industrieplanung GmbH,"Düsseldorf, North Rhine-Westphalia, Germany",2026-05-20,https://www.linkedin.com/jobs/view/4417064607 , ,li-4417064607,fulltime,,,,,,False,entry level,"Design, Art/Creative, and Information Technology",,,Engineering Services,https://de.linkedin.com/company/oub,,,,,,,,,,,
linkedin,Design Engineer ( Weld Engineer Product Development) – Gusskomponenten/ Schweißkomponenten (m/w/d),Boll & Kirch Filterbau GmbH / BOLLFILTER,"Kerpen, North Rhine-Westphalia, Germany",2026-05-20,https://www.linkedin.com/jobs/view/4417310082 , ,li-4417310082,fulltime,,,,,,False,mid-senior level,Engineering and Information Technology,,,Machinery Manufacturing,https://de.linkedin.com/company/boll-kirch-filterbau-gmbh,,,,,,,,,,,
linkedin,Betriebsingenieur (m/w/d),Merz Aesthetics,"Dessau, Saxony-Anhalt, Germany",2026-05-20,https://www.linkedin.com/jobs/view/4411365590 , ,li-4411365590,fulltime,,,,,,False,mid-senior level,Engineering and Information Technology,,,Pharmaceutical Manufacturing,https://www.linkedin.com/company/merz-aesthetics-inc.,,,,,,,,,,,
linkedin,Systemingenieur für Elektromagnetische-Felder (m/w/d),ACONEXT,"Kassel, Hesse, Germany",2026-05-19,https://www.linkedin.com/jobs/view/4415939478 , ,li-4415939478,fulltime,,,,,,False,mid-senior level,Information Technology,,,Engineering Services,https://de.linkedin.com/company/aconext-holding-gmbh,,,,,,,,,,,
linkedin,(Senior) Industriemechaniker (m/w/d),Tesla Automation GmbH,"Prüm, Rhineland-Palatinate, Germany",2026-05-19,https://www.linkedin.com/jobs/view/4415937690 , ,li-4415937690,fulltime,,,,,,False,mid-senior level,Management and Manufacturing,,,"Motor Vehicle Manufacturing, Renewable Energy Semiconductor Manufacturing, and Utilities",https://de.linkedin.com/company/tesla-automation-gmbh,,,,,,,,,,,
linkedin,"Mechanical Design Engineer (m/w/d) - Cabin Engineering, Interior Lighting & Switches, Berlin, Germany",Tesla,"Berlin, Berlin, Germany",,https://www.linkedin.com/jobs/view/4419131204 , ,li-4419131204,fulltime,,,,,,False,entry level,Engineering and Information Technology,,,"Motor Vehicle Manufacturing, Renewable Energy Semiconductor Manufacturing, and Utilities",https://www.linkedin.com/company/tesla-motors,,,,,,,,,,,
linkedin,Werkzeugkonstrukteur CFK / Faserverbundtechnik (m/w/d),Roding Automobile GmbH,"Roding, Bavaria, Germany",,https://www.linkedin.com/jobs/view/4301464590 , ,li-4301464590,fulltime,,,,,,False,mid-senior level,,,,Motor Vehicle Manufacturing,https://de.linkedin.com/company/roding-mobility-gmbh,,,,,,,,,,,
linkedin,Konstrukteur elkt. & mech.,GRTclean Europe,"Memmingerberg, Bavaria, Germany",,https://www.linkedin.com/jobs/view/4416800710 , ,li-4416800710,fulltime,,,,,,False,entry level,Management and Manufacturing,,,Machinery Manufacturing,https://de.linkedin.com/company/grtclean-europe,,,,,,,,,,,
linkedin,Statiker:in,Walter-Fach-Kraft GmbH & Co. KG,"Neuhof, Hesse, Germany",,https://www.linkedin.com/jobs/view/4392393533 , ,li-4392393533,fulltime,,,,,,False,associate,Engineering,,,Construction and Engineering Services,https://de.linkedin.com/company/walter-fach-kraft-gmbh-&-co.-kg,,,,,,,,,,,
linkedin,Projektingenieur:in Kälte-/ Versorgungstechnik,HYDE Executives GmbH,"Halle, Saxony-Anhalt, Germany",,https://www.linkedin.com/jobs/view/4408746854 , ,li-4408746854,fulltime,,,,,,False,associate,Project Management and Engineering,,,Manufacturing,https://de.linkedin.com/company/hyde-executives-gmbh,,,,,,,,,,,
linkedin,CAM-Programmierer mit Hands-On (m/w/d),PolyTALENT JOBS,"Lathen, Lower Saxony, Germany",,https://www.linkedin.com/jobs/view/4415294377 , ,li-4415294377,fulltime,,,,,,False,associate,Manufacturing,,,Staffing and Recruiting,https://de.linkedin.com/company/polytalent-jobs,,,,,,,,,,,
linkedin,Entwicklungsingenieur (m/w/d),KNDS Deutschland,"Munich, Bavaria, Germany",,https://www.linkedin.com/jobs/view/4415291278 , ,li-4415291278,fulltime,,,,,,False,entry level,Engineering and Information Technology,,,Defense and Space Manufacturing,https://de.linkedin.com/company/knds-deutschland,,,,,,,,,,,
linkedin,Konstrukteur Produktentwicklung (m/w/d) am Standort Gründau,VOSS Automotive,"Wipperfürth, North Rhine-Westphalia, Germany",,https://www.linkedin.com/jobs/view/4415299171 , ,li-4415299171,fulltime,,,,,,False,entry level,Product Management and Marketing,,,Automotive,https://de.linkedin.com/company/voss-automotive-gmbh,,,,,,,,,,,
linkedin,Konstrukteur Jigs & Tools (m/w/d),ORANGE Engineering GmbH & Co. KG,"Bremen, Bremen, Germany",,https://www.linkedin.com/jobs/view/4415285997 , ,li-4415285997,fulltime,,,,,,False,entry level,Management and Manufacturing,,,Machinery Manufacturing,https://de.linkedin.com/company/orange-engineering-gmbh,,,,,,,,,,,
linkedin,CAD-Konstrukteur HLS (m/w/d) in Berlin,INNIUS,"Berlin, Berlin, Germany",,https://www.linkedin.com/jobs/view/4419163177 , ,li-4419163177,fulltime,,,,,,False,entry level,"Design, Art/Creative, and Information Technology",,,Architecture and Planning,https://de.linkedin.com/company/innius-gmbh,,,,,,,,,,,
linkedin,Projektingenieur Americas (m/w/d),Rovema GmbH,,,https://www.linkedin.com/jobs/view/4398219284 , ,li-4398219284,fulltime,,,,,,False,associate,Engineering and Sales,,,Machinery Manufacturing,https://de.linkedin.com/company/rovemagmbh,,,,,,,,,,,
linkedin,Initiativ (m/w/d),Liebherr Group,"Ettlingen, Baden-Württemberg, Germany",,https://www.linkedin.com/jobs/view/4289003602 , ,li-4289003602,fulltime,,,,,,False,entry level,Other,,,Industrial Machinery Manufacturing,https://de.linkedin.com/company/liebherr,,,,,,,,,,,
linkedin,Projektleiter (m/w/d) Elektrotechnik – Energieanlagen / Umspannwerke,EQOS,"Halberstadt, Saxony-Anhalt, Germany",,https://www.linkedin.com/jobs/view/4413030686 , ,li-4413030686,fulltime,,,,,,False,associate,Project Management,,,Telecommunications and Services for Renewable Energy,https://de.linkedin.com/company/eqos-gruppe,,,,,,,,,,,
linkedin,Betriebsingenieur (m/w/d),KST-Motorenversuch GmbH & Co. KG,"Bad Dürkheim, Rhineland-Palatinate, Germany",,https://www.linkedin.com/jobs/view/4419113780 , ,li-4419113780,fulltime,,,,,,False,entry level,Engineering and Information Technology,,,Automotive,https://de.linkedin.com/company/kst-motorenversuch-gmbh-co-kg,,,,,,,,,,,
linkedin,"Metallbautechniker (m/w/d) - Göttingen (Göttingen, DE, 37079)",Implenia,"Göttingen, Lower Saxony, Germany",,https://www.linkedin.com/jobs/view/4418268417 , ,li-4418268417,fulltime,,,,,,False,entry level,Other,,roza.soeylemez@implenia.com,Construction,https://ch.linkedin.com/company/implenia,,,,,,,,,,,
linkedin,Mechanical Engineer — Physics Tutor — No Experience Required,Nachhilfeunterricht,,,https://www.linkedin.com/jobs/view/4418273396 , ,li-4418273396,fulltime,,,,,,True,entry level,Engineering and Information Technology,,,Education Administration Programs,https://www.linkedin.com/company/nachhilfeunterricht,,,,,,,,,,,
linkedin,"Spezialist:in als Projektingenieur:in Anlagenübergabe
 
neu",DB Projekt Stuttgart-Ulm GmbH,"Stuttgart, Baden-Württemberg, Germany",,https://www.linkedin.com/jobs/view/4419414934 , ,li-4419414934,fulltime,,,,,,False,mid-senior level,Engineering and Information Technology,,,Rail Transportation,https://de.linkedin.com/company/db-projekt-stuttgart-ulm-gmbh,,,,,,,,,,,
