site,title,company,location,date_posted,job_url,job_url_direct,id,job_type,salary_source,interval,min_amount,max_amount,currency,is_remote,job_level,job_function,listing_type,emails,company_industry,company_url,company_url_direct,company_addresses,company_num_employees,company_revenue,company_description,skills,experience_range,company_rating,company_reviews_count,vacancy_count,work_from_home_type
linkedin,Internship: Machine Learning (m/f/x),osapiens,"Munich, Bavaria, Germany",2026-06-29,https://www.linkedin.com/jobs/view/4434709361 , ,li-4434709361,fulltime,,,,,,True,internship,Education and Training,,,Software Development,https://de.linkedin.com/company/osapiens,,,,,,,,,,,
linkedin,Internship: AI-based Test & Measurement Workflows,Emerson,"Dresden, Saxony, Germany",2026-06-29,https://www.linkedin.com/jobs/view/4434448896 , ,li-4434448896,fulltime,,,,,,False,internship,Other,,idisability.administrator@emerson.com,Automation Machinery Manufacturing,https://www.linkedin.com/company/emerson,,,,,,,,,,,
linkedin,Intern/Working Student (m/f/d) in Market Intelligence,Clarios,"Hannover, Lower Saxony, Germany",2026-06-29,https://www.linkedin.com/jobs/view/4434452341 , ,li-4434452341,volunteer,,,,,,False,internship,Education and Training,,"-Ausbildung@clarios.com, Special.Accommodations@Clarios.com",Motor Vehicle Parts Manufacturing,https://www.linkedin.com/company/clarios,,,,,,,,,,,
linkedin,Working Student Engineering Data Analytics & Classification (m/f/d),BSH Home Appliances Group,"Munich, Bavaria, Germany",2026-06-28,https://www.linkedin.com/jobs/view/4433622616 , ,li-4433622616,parttime,,,,,,False,internship,Education and Training,,,Manufacturing,https://de.linkedin.com/company/bsh-home-appliances-group,,,,,,,,,,,
linkedin,Data Engineering Working Student (m/f/d) - Gigafactory Berlin-Brandenburg,Tesla,"Grünheide, Brandenburg, Germany",2026-06-25,https://www.linkedin.com/jobs/view/4433359588 , ,li-4433359588,internship,,,,,,False,internship,Engineering and Information Technology,,,"Motor Vehicle Manufacturing, Renewable Energy Semiconductor Manufacturing, and Utilities",https://www.linkedin.com/company/tesla-motors,,,,,,,,,,,
linkedin,Pflichtpraktikum in der KI-basierten Führungskräfteentwicklung,Bosch,"Gerlingen, Baden-Württemberg, Germany",2026-06-25,https://www.linkedin.com/jobs/view/4432611571 , ,li-4432611571,fulltime,,,,,,False,internship,Human Resources,,,Automotive,https://de.linkedin.com/company/bosch,,,,,,,,,,,
linkedin,Working Student – Battery Science and Data (f/m/d),Munich Electrification,"Munich, Bavaria, Germany",,https://www.linkedin.com/jobs/view/4422276369 , ,li-4422276369,fulltime,,,,,,False,internship,Information Technology,,,"Appliances, Electrical, and Electronics Manufacturing",https://de.linkedin.com/company/munichelectrification,,,,,,,,,,,
linkedin,Intern Private Debt (f/m/d),Allianz Global Investors,"Munich, Bavaria, Germany",,https://www.linkedin.com/jobs/view/4429561970 , ,li-4429561970,fulltime,,,,,,False,internship,"Other, Information Technology, and Management",,recruiting@allianzgi.com,Financial Services and Insurance,https://www.linkedin.com/company/allianz-global-investors,,,,,,,,,,,
linkedin,Werkstudent Digital Health Apps (d/w/m),Ottobock,"Berlin, Berlin, Germany",,https://www.linkedin.com/jobs/view/4434709060 , ,li-4434709060,temporary,,,,,,False,internship,Health Care Provider,,,Medical Equipment Manufacturing,https://de.linkedin.com/company/ottobock,,,,,,,,,,,
