site,title,company,location,date_posted,job_url,job_url_direct,id,job_type,salary_source,interval,min_amount,max_amount,currency,is_remote,job_level,job_function,listing_type,emails,company_industry,company_url,company_url_direct,company_addresses,company_num_employees,company_revenue,company_description,skills,experience_range,company_rating,company_reviews_count,vacancy_count,work_from_home_type
linkedin,"Senior Projektleiter SF-Hochbau (m/w/d) München/Augsburg (München, DE, 80687)",Implenia,"Munich, Bavaria, Germany",2026-04-12,https://www.linkedin.com/jobs/view/4243676265 , ,li-4243676265,fulltime,,,,,,False,mid-senior level,Information Technology,,morten.schmalz@implenia.com,Construction,https://ch.linkedin.com/company/implenia,,,,,,,,,,,
linkedin,Regional Director,Blue Fox,"Hesse, Germany",2026-04-12,https://www.linkedin.com/jobs/view/4400978995 , ,li-4400978995,fulltime,,,,,,False,director,Project Management,,,Construction,https://uk.linkedin.com/company/blue-fox-consult,,,,,,,,,,,
linkedin,Senior Engineering Manager - Query Execution Platform,Snowflake,"Berlin, Berlin, Germany",2026-04-12,https://www.linkedin.com/jobs/view/4225190936 , ,li-4225190936,fulltime,,,,,,False,mid-senior level,Engineering and Information Technology,,,Software Development,https://www.linkedin.com/company/snowflake-computing,,,,,,,,,,,
linkedin,Senior Startup & Innovation Manager (f/m/d),RootCamp - A SpinLab Company,"Hannover, Lower Saxony, Germany",2026-04-12,https://www.linkedin.com/jobs/view/4399371222 , ,li-4399371222,fulltime,,,,,,False,mid-senior level,Consulting,,,Professional Services,https://de.linkedin.com/company/rootcamphannover,,,,,,,,,,,
linkedin,Senior Product Manager (m/f/d),FORMEL SKIN,"Berlin, Berlin, Germany",2026-04-12,https://www.linkedin.com/jobs/view/4398783941 , ,li-4398783941,fulltime,,,,,,True,mid-senior level,Information Technology,,,Hospitals and Health Care,https://de.linkedin.com/company/formelskin,,,,,,,,,,,
linkedin,Product Manager - Print / Produktmanager – Druck (m/f/d),BW Converting,"Neuwied, Rhineland-Palatinate, Germany",2026-04-12,https://www.linkedin.com/jobs/view/4378766365 , ,li-4378766365,fulltime,,,,,,False,mid-senior level,Product Management and Marketing,,,Machinery Manufacturing,https://www.linkedin.com/company/bw-converting,,,,,,,,,,,
linkedin,Product Manager Aftermarket,Eaton,"Karlsruhe, Baden-Württemberg, Germany",2026-04-12,https://www.linkedin.com/jobs/view/4386158974 , ,li-4386158974,fulltime,,,,,,False,mid-senior level,Other,,,"Appliances, Electrical, and Electronics Manufacturing",https://ie.linkedin.com/company/eaton,,,,,,,,,,,
linkedin,Junior Projektmanager (m/w/d),adEvents cross media AG,"Regensburg, Bavaria, Germany",2026-04-12,https://www.linkedin.com/jobs/view/4399373375 , ,li-4399373375,fulltime,,,,,,False,entry level,Administrative,,,Administrative and Support Services,https://de.linkedin.com/company/adevents-cross-media-gmbh,,,,,,,,,,,
linkedin,Senior Project Manager - Data Centre (Frankfurt),Experts Group International,"Frankfurt, Hesse, Germany",2026-04-12,https://www.linkedin.com/jobs/view/4247919474 , ,li-4247919474,fulltime,,,,,,False,director,Project Management and Information Technology,,,Staffing and Recruiting,https://uk.linkedin.com/company/expertsgroupinternational,,,,,,,,,,,
linkedin,Senior Project Manager,JBAndrews,,2026-04-12,https://www.linkedin.com/jobs/view/4399360929 , ,li-4399360929,fulltime,,,,,,True,mid-senior level,"Project Management, Engineering, and Consulting",,,Automation Machinery Manufacturing and Warehousing and Storage,https://uk.linkedin.com/company/jbandrews,,,,,,,,,,,
linkedin,Product Operations Manager,GLS/NXT,"Berlin, Berlin, Germany",2026-04-12,https://www.linkedin.com/jobs/view/4399366968 , ,li-4399366968,fulltime,,,,,,True,director,Engineering,,,Software Development,https://de.linkedin.com/company/gls-nxt,,,,,,,,,,,
linkedin,Product Manager – TeamViewer ONE (all genders),TeamViewer,,2026-04-11,https://www.linkedin.com/jobs/view/4388202071 , ,li-4388202071,fulltime,,,,,,True,mid-senior level,Product Management and Marketing,,,Software Development,https://de.linkedin.com/company/teamviewer,,,,,,,,,,,
linkedin,Electric Component Global Application Segment Leader,LyondellBasell,"Kerpen, North Rhine-Westphalia, Germany",2026-04-11,https://www.linkedin.com/jobs/view/4369528900 , ,li-4369528900,fulltime,,,,,,True,director,Information Technology,,,Chemical Manufacturing,https://www.linkedin.com/company/lyondell-basell,,,,,,,,,,,
linkedin,Project Manager,Cognite,"Hamburg, Hamburg, Germany",2026-04-11,https://www.linkedin.com/jobs/view/4345956792 , ,li-4345956792,fulltime,,,,,,False,mid-senior level,Project Management and Information Technology,,,"Construction, Software Development, and IT Services and IT Consulting",https://www.linkedin.com/company/cognitedata,,,,,,,,,,,
linkedin,Senior Project Manager,IPS-Integrated Project Services,"Frankfurt, Hesse, Germany",2026-04-11,https://www.linkedin.com/jobs/view/4335564500 , ,li-4335564500,fulltime,,,,,,False,not applicable,Project Management and Information Technology,,,Pharmaceutical Manufacturing,https://www.linkedin.com/company/ips,,,,,,,,,,,
linkedin,Technischer Projektleiter im Engineering (w/m/d),GE Vernova,"Dresden, Saxony, Germany",2026-04-11,https://www.linkedin.com/jobs/view/4348335273 , ,li-4348335273,fulltime,,,,,,False,mid-senior level,Project Management and Information Technology,,,Electric Power Generation,https://www.linkedin.com/company/gevernova,,,,,,,,,,,
linkedin,"Consultant, Operations - Procurement",Boston Consulting Group (BCG),"Berlin, Berlin, Germany",2026-04-11,https://www.linkedin.com/jobs/view/4321279727 , ,li-4321279727,fulltime,,,,,,False,mid-senior level,Purchasing and Supply Chain,,,Business Consulting and Services,https://www.linkedin.com/company/boston-consulting-group,,,,,,,,,,,
linkedin,"Consultant, Operations - Procurement",Boston Consulting Group (BCG),"Munich, Bavaria, Germany",2026-04-11,https://www.linkedin.com/jobs/view/4321089899 , ,li-4321089899,fulltime,,,,,,False,mid-senior level,Purchasing and Supply Chain,,,Business Consulting and Services,https://www.linkedin.com/company/boston-consulting-group,,,,,,,,,,,
linkedin,Project Operations Manager,Mercury,"Munich, Bavaria, Germany",2026-04-11,https://www.linkedin.com/jobs/view/4368726900 , ,li-4368726900,fulltime,,,,,,False,mid-senior level,Management and Manufacturing,,,Construction,https://ie.linkedin.com/company/mercury-engineering,,,,,,,,,,,
linkedin,Senior Project Lead Strategy Consulting (m/f/d),BASF,"Düsseldorf, North Rhine-Westphalia, Germany",2026-04-11,https://www.linkedin.com/jobs/view/4387068974 , ,li-4387068974,fulltime,,,,,,True,not applicable,Information Technology,,jennifer.weiz@basf.com,Chemical Manufacturing and Plastics Manufacturing,https://de.linkedin.com/company/basf,,,,,,,,,,,
linkedin,Fashion Designer (m/f/d),CYBEX,"Bayreuth, Bavaria, Germany",2026-04-11,https://www.linkedin.com/jobs/view/4357627391 , ,li-4357627391,fulltime,,,,,,False,mid-senior level,"Design, Art/Creative, and Information Technology",,,Manufacturing,https://de.linkedin.com/company/cybex-gmbh,,,,,,,,,,,
linkedin,Business Consultant - R&D (Remote),Veeva Systems,"Berlin, Germany",2026-04-11,https://www.linkedin.com/jobs/view/4377295820 , ,li-4377295820,fulltime,,,,,,True,entry level,Consulting,,_accommodations@veeva.com,"Software Development, IT Services and IT Consulting, and Pharmaceutical Manufacturing",https://www.linkedin.com/company/veeva-systems,,,,,,,,,,,
linkedin,(Senior) Manager (all genders) Energy,Porsche Consulting,"Berlin, Berlin, Germany",2026-04-11,https://www.linkedin.com/jobs/view/4378348305 , ,li-4378348305,fulltime,,,,,,False,mid-senior level,Management and Manufacturing,,,Business Consulting and Services,https://de.linkedin.com/company/porsche-consulting-,,,,,,,,,,,
linkedin,(Senior) Manager (all genders) Life Sciences,Porsche Consulting,"Hamburg, Hamburg, Germany",2026-04-11,https://www.linkedin.com/jobs/view/4378347396 , ,li-4378347396,fulltime,,,,,,True,mid-senior level,Other,,,Business Consulting and Services,https://de.linkedin.com/company/porsche-consulting-,,,,,,,,,,,
linkedin,Produktmanager Wasserstoff / Product Manager Hydrogen,RCT GH Hydrogen,"Constance, Baden-Württemberg, Germany",2026-04-11,https://www.linkedin.com/jobs/view/4399339305 , ,li-4399339305,fulltime,,,,,,False,mid-senior level,Sales,,,Renewable Energy Semiconductor Manufacturing,https://de.linkedin.com/company/rct-hydrogen-gmbh,,,,,,,,,,,
linkedin,Senior Projektmanager (m/w/d),Digitas Germany,"Munich, Bavaria, Germany",2026-04-11,https://www.linkedin.com/jobs/view/4377245810 , ,li-4377245810,fulltime,,,,,,False,not applicable,Project Management and Information Technology,,,Advertising Services,https://www.linkedin.com/company/digitasgermany,,,,,,,,,,,
linkedin,Senior Projektmanager (m/w/d),CompuGroup Medical SE & Co. KGaA,"Munich, Bavaria, Germany",2026-04-11,https://www.linkedin.com/jobs/view/4202024407 , ,li-4202024407,fulltime,,,,,,True,mid-senior level,Project Management and Information Technology,,,IT Services and IT Consulting,https://de.linkedin.com/company/compugroup-medical-ag,,,,,,,,,,,
linkedin,Technical Program Manager,Koddi,"Düsseldorf, North Rhine-Westphalia, Germany",2026-04-11,https://www.linkedin.com/jobs/view/4316986350 , ,li-4316986350,fulltime,,,,,,False,mid-senior level,Project Management and Information Technology,,,"Technology, Information and Internet",https://www.linkedin.com/company/koddi,,,,,,,,,,,
linkedin,"Ingenieur im Projektmanagement, all genders",SALT AND PEPPER Group,"Hamburg, Hamburg, Germany",2026-04-11,https://www.linkedin.com/jobs/view/4206849370 , ,li-4206849370,fulltime,,,,,,False,entry level,Engineering and Information Technology,,,Engineering Services,https://de.linkedin.com/company/salt-and-pepper,,,,,,,,,,,
linkedin,Project Operations Manager,Mercury,"Frankfurt, Hesse, Germany",2026-04-11,https://www.linkedin.com/jobs/view/4369557095 , ,li-4369557095,fulltime,,,,,,False,mid-senior level,Management and Manufacturing,,,Construction,https://ie.linkedin.com/company/mercury-engineering,,,,,,,,,,,
linkedin,Project Manager & Planning (m/f/d),Alpitronic,"Nuremberg, Bavaria, Germany",2026-04-11,https://www.linkedin.com/jobs/view/4385741399 , ,li-4385741399,fulltime,,,,,,False,associate,Project Management and Information Technology,,,"Appliances, Electrical, and Electronics Manufacturing",https://it.linkedin.com/company/alpitronic-srl,,,,,,,,,,,
linkedin,Senior Projekt Manager,SQLI,"Dortmund, North Rhine-Westphalia, Germany",2026-04-11,https://www.linkedin.com/jobs/view/4378795036 , ,li-4378795036,fulltime,,,,,,True,mid-senior level,Information Technology,,aphillips@sqli.com,Software Development and IT Services and IT Consulting,https://fr.linkedin.com/company/sqli,,,,,,,,,,,
linkedin,Associate Principal oder Senior Project Manager in der Volkswagen Group Consulting (w/m/d),Volkswagen Group,"Wolfsburg, Lower Saxony, Germany",2026-04-11,https://www.linkedin.com/jobs/view/3903400804 , ,li-3903400804,parttime,,,,,,False,mid-senior level,Project Management and Information Technology,,,Motor Vehicle Manufacturing,https://de.linkedin.com/company/volkswagen-group,,,,,,,,,,,
linkedin,Project Director,PM Group,"Frankfurt, Hesse, Germany",2026-04-11,https://www.linkedin.com/jobs/view/4388513812 , ,li-4388513812,fulltime,,,,,,False,not applicable,"Project Management, Design, and Engineering",,,"Design Services, Construction, and Business Consulting and Services",https://ie.linkedin.com/company/pm-group_165501,,,,,,,,,,,
linkedin,Digital Marketing Consultant - Project Lead (all genders),adesso SE,"Augsburg, Bavaria, Germany",2026-04-11,https://www.linkedin.com/jobs/view/4298383788 , ,li-4298383788,fulltime,,,,,,False,mid-senior level,Marketing and Sales,,,IT Services and IT Consulting,https://de.linkedin.com/company/adesso-se,,,,,,,,,,,
linkedin,Digital Marketing Consultant - Project Lead (all genders),adesso SE,"Hannover, Lower Saxony, Germany",2026-04-11,https://www.linkedin.com/jobs/view/4298387504 , ,li-4298387504,fulltime,,,,,,False,mid-senior level,Marketing and Sales,,,IT Services and IT Consulting,https://de.linkedin.com/company/adesso-se,,,,,,,,,,,
linkedin,Digital Marketing Consultant - Project Lead (all genders),adesso SE,"Walldorf, Baden-Württemberg, Germany",2026-04-11,https://www.linkedin.com/jobs/view/4298388444 , ,li-4298388444,fulltime,,,,,,False,mid-senior level,Marketing and Sales,,,IT Services and IT Consulting,https://de.linkedin.com/company/adesso-se,,,,,,,,,,,
linkedin,Principal Business Consultant - R&D - Regulatory (Remote),Veeva Systems,,2026-04-11,https://www.linkedin.com/jobs/view/4377600630 , ,li-4377600630,fulltime,,,,,,True,mid-senior level,Consulting,,_accommodations@veeva.com,"Software Development, IT Services and IT Consulting, and Pharmaceutical Manufacturing",https://www.linkedin.com/company/veeva-systems,,,,,,,,,,,
linkedin,Product Manager Hardware (w/m/d),Globetrotter Ausrüstung,"Hamburg, Hamburg, Germany",2026-04-11,https://www.linkedin.com/jobs/view/4398703335 , ,li-4398703335,fulltime,,,,,,False,entry level,Product Management and Marketing,,,Retail,https://de.linkedin.com/company/globetrotter-ausr%C3%BCstung,,,,,,,,,,,
linkedin,"Lead Technical Product Manager, Americas (all genders)",Distribusion Technologies,"Berlin, Germany",2026-04-11,https://www.linkedin.com/jobs/view/4369504008 , ,li-4369504008,fulltime,,,,,,False,not applicable,Information Technology,,talent@distribusion.com,IT Services and IT Consulting,https://de.linkedin.com/company/distribusion,,,,,,,,,,,
linkedin,(Senior) Product Manager – BISON App (gn),Boerse Stuttgart Digital,"Stuttgart, Baden-Württemberg, Germany",2026-04-11,https://www.linkedin.com/jobs/view/4390949615 , ,li-4390949615,fulltime,,,,,,False,mid-senior level,Product Management and Project Management,,,Securities and Commodity Exchanges,https://de.linkedin.com/company/boerse-stuttgart-digital,,,,,,,,,,,
linkedin,Senior AI Product Manager,Nelly Solutions,"Berlin, Berlin, Germany",2026-04-11,https://www.linkedin.com/jobs/view/4357648010 , ,li-4357648010,fulltime,,,,,,False,mid-senior level,Product Management and Marketing,,,"Technology, Information and Internet",https://de.linkedin.com/company/nelly-solutions,,,,,,,,,,,
linkedin,Project Manager (m/f/d) in our Space Division,CGI,"Bochum, North Rhine-Westphalia, Germany",2026-04-11,https://www.linkedin.com/jobs/view/4335235516 , ,li-4335235516,fulltime,,,,,,False,entry level,Project Management,,,IT Services and IT Consulting,https://ca.linkedin.com/company/cgi,,,,,,,,,,,
linkedin,"Principal Product Manager, Document Domain",PandaDoc,,2026-04-11,https://www.linkedin.com/jobs/view/4379017037 , ,li-4379017037,fulltime,,,,,,True,mid-senior level,Product Management and Marketing,,,Software Development,https://www.linkedin.com/company/pandadoc,,,,,,,,,,,
linkedin,Product Manager (focus on Data) (m/f/d),Redcare Pharmacy,"Cologne, North Rhine-Westphalia, Germany",2026-04-10,https://www.linkedin.com/jobs/view/4398148871 , ,li-4398148871,fulltime,,,,,,True,mid-senior level,Information Technology,,,Pharmaceutical Manufacturing,https://nl.linkedin.com/company/redcare-pharmacy-com,,,,,,,,,,,
linkedin,TGA Projektmanager (m/w/d) Versorgungs- oder Elektrotechnik,Firmengruppe Max Bögl,"Frankfurt am Main, Hesse, Germany",2026-04-10,https://www.linkedin.com/jobs/view/4336663658 , ,li-4336663658,fulltime,,,,,,False,associate,Project Management and Information Technology,,,Construction,https://de.linkedin.com/company/firmengruppe-max-b%C3%B6gl,,,,,,,,,,,
linkedin,(SENIOR) PROJECT MANAGER (M/W/D) IM BEREICH EVENT,follow red GmbH,"Stuttgart, Baden-Württemberg, Germany",2026-04-10,https://www.linkedin.com/jobs/view/4399041839 , ,li-4399041839,fulltime,,,,,,False,mid-senior level,Other,,,Professional Services,https://de.linkedin.com/company/followred-gmbh,,,,,,,,,,,
linkedin,"Team Lead, Platform Services",OWKIN,,2026-04-10,https://www.linkedin.com/jobs/view/4398172719 , ,li-4398172719,fulltime,,,,,,True,mid-senior level,Other,,hiring@owkin.com,"Technology, Information and Internet",https://www.linkedin.com/company/owkin,,,,,,,,,,,
linkedin,Senior Project manager,VIRTUS Data Centres,"Berlin, Berlin, Germany",2026-04-10,https://www.linkedin.com/jobs/view/4362721253 , ,li-4362721253,fulltime,,,,,,False,mid-senior level,Project Management and Information Technology,,,IT Services and IT Consulting,https://uk.linkedin.com/company/virtus-data-centres,,,,,,,,,,,
linkedin,Project Manager,Envision Energy,"Hamburg, Hamburg, Germany",2026-04-10,https://www.linkedin.com/jobs/view/4398166382 , ,li-4398166382,fulltime,,,,,,False,associate,Project Management,,,Renewable Energy Equipment Manufacturing,https://cn.linkedin.com/company/envision-energy,,,,,,,,,,,
linkedin,Project & Supply Chain Manager,Stirling Dynamics,"Hamburg, Hamburg, Germany",2026-04-10,https://www.linkedin.com/jobs/view/4385476527 , ,li-4385476527,fulltime,,,,,,False,mid-senior level,Management and Manufacturing,,,Aviation and Aerospace Component Manufacturing,https://uk.linkedin.com/company/stirling-dynamics,,,,,,,,,,,
linkedin,Technical Program Management Officer (PMO) (f/m/d),Siemens Energy,"Erlangen, Bavaria, Germany",2026-04-10,https://www.linkedin.com/jobs/view/4398144908 , ,li-4398144908,fulltime,,,,,,True,associate,Project Management,,,"Appliances, Electrical, and Electronics Manufacturing",https://www.linkedin.com/company/siemens-energy,,,,,,,,,,,
linkedin,"Creative Strategist, EMEA",HexClad Cookware,,2026-04-10,https://www.linkedin.com/jobs/view/4400639758 , ,li-4400639758,fulltime,,,,,,False,associate,"Marketing, Strategy/Planning, and Writing/Editing",,,"Manufacturing, Consumer Services, and Marketing Services",https://www.linkedin.com/company/hexclad-cookware,,,,,,,,,,,
linkedin,Product Manager - Global Product specialist (m/f/d),ABB,"Heidelberg, Baden-Württemberg, Germany",2026-04-10,https://www.linkedin.com/jobs/view/4400651154 , ,li-4400651154,fulltime,,,,,,False,not applicable,Sales,,,"Appliances, Electrical, and Electronics Manufacturing",https://ch.linkedin.com/company/abb,,,,,,,,,,,
linkedin,Product Project Manager,Jobgether,,,https://www.linkedin.com/jobs/view/4402368395 , ,li-4402368395,fulltime,,,,,,True,mid-senior level,Project Management and Information Technology,,,Internet Marketplace Platforms,https://be.linkedin.com/company/jobgether,,,,,,,,,,,
linkedin,Project Manager,Dexian Europe,"Berlin, Germany",,https://www.linkedin.com/jobs/view/4402361602 , ,li-4402361602,contract,,,,,,False,mid-senior level,Project Management,,,IT Services and IT Consulting,https://hu.linkedin.com/company/dexian-europe,,,,,,,,,,,
linkedin,Junior Program Manager / Junior Projektmanager Automotiv (all gender),ALTEN Germany,"Munich, Bavaria, Germany",,https://www.linkedin.com/jobs/view/4400833451 , ,li-4400833451,fulltime,,,,,,False,entry level,Project Management,,,Motor Vehicle Manufacturing,https://de.linkedin.com/company/altengermany,,,,,,,,,,,
linkedin,Project Coordinator,Korn Ferry,,,https://www.linkedin.com/jobs/view/4384286814 , ,li-4384286814,fulltime,,,,,,False,entry level,Other,,,Business Consulting and Services,https://www.linkedin.com/company/kornferry,,,,,,,,,,,
linkedin,Project Manager (m/f/d),Schotstek GmbH,"Mannheim, Baden-Württemberg, Germany",,https://www.linkedin.com/jobs/view/4400826173 , ,li-4400826173,fulltime,,,,,,False,associate,Engineering,,,Motor Vehicle Manufacturing,https://de.linkedin.com/company/schotstek-gmbh,,,,,,,,,,,
linkedin,Software Project Manager / Technical Project Lead (all gender) 100,ALTEN Germany,"Munich, Bavaria, Germany",,https://www.linkedin.com/jobs/view/4400830264 , ,li-4400830264,fulltime,,,,,,False,entry level,Engineering,,,Aviation and Aerospace Component Manufacturing,https://de.linkedin.com/company/altengermany,,,,,,,,,,,
linkedin,Construction Project Manager,g2 Recruitment,"Frankfurt, Hesse, Germany",,https://www.linkedin.com/jobs/view/4402981304 , ,li-4402981304,contract,,,,,,False,mid-senior level,Engineering,,Oscar.Dines@g2recruitment.com,Construction,https://de.linkedin.com/company/g2-recruitment-solutions,,,,,,,,,,,
linkedin,(Senior) Project Manager (m/f/d),Stryker,"Freiburg, Baden-Württemberg, Germany",,https://www.linkedin.com/jobs/view/4393009549 , ,li-4393009549,fulltime,,,,,,False,associate,Project Management and Information Technology,,,"Appliances, Electrical, and Electronics Manufacturing, Industrial Machinery Manufacturing, and Medical Equipment Manufacturing",https://www.linkedin.com/company/stryker,,,,,,,,,,,
linkedin,Project Quality Manager,SSA Recruitment Germany,"Hanau am Main, Hesse, Germany",,https://www.linkedin.com/jobs/view/4403192836 , ,li-4403192836,fulltime,,,,,,False,mid-senior level,"Quality Assurance, Engineering, and Project Management",,marcel@ssaltd.com,Construction,https://de.linkedin.com/company/ssa-recruitment-germany,,,,,,,,,,,
linkedin,(Senior) Project Manager - Premium Clients (m/w/d),Everphone,"Berlin, Berlin, Germany",,https://www.linkedin.com/jobs/view/4400839278 , ,li-4400839278,fulltime,,,,,,False,mid-senior level,Sales,,,Software Development,https://de.linkedin.com/company/everphone-gmbh,,,,,,,,,,,
linkedin,SAFe Transformation Manager (all gender),ALTEN Germany,"Berlin, Berlin, Germany",,https://www.linkedin.com/jobs/view/4395055383 , ,li-4395055383,fulltime,,,,,,False,associate,Information Technology,,,IT Services and IT Consulting,https://de.linkedin.com/company/altengermany,,,,,,,,,,,
linkedin,(Senior) Project Mananger Packaging Technology (w/md),Tchibo,"Hamburg, Hamburg, Germany",,https://www.linkedin.com/jobs/view/4380367255 , ,li-4380367255,fulltime,,,,,,False,mid-senior level,Project Management and Information Technology,,,Retail,https://de.linkedin.com/company/tchibo,,,,,,,,,,,
linkedin,Projektmanager/-in Strukturwandel (m/w/d),Stadtverwaltung Borna,"Borna, Saxony, Germany",,https://www.linkedin.com/jobs/view/4400435910 , ,li-4400435910,fulltime,,,,,,False,mid-senior level,Project Management and Information Technology,,,Internet Publishing,https://de.linkedin.com/company/stadtverwaltung-borna,,,,,,,,,,,
linkedin,Technical Delivery Manager – Commerce Core (m/w/d),Shopware,,,https://www.linkedin.com/jobs/view/4337002826 , ,li-4337002826,fulltime,,,,,,True,mid-senior level,Project Management and Information Technology,,,Software Development,https://de.linkedin.com/company/shopware-ag,,,,,,,,,,,
linkedin,Technischer Projektmanager / Bau-/Projektcontroller (m/w/d) für einen Fachbereiche im: Brückenbau / Ingenieurbau / Tunnelbau / Tiefbau,Firmengruppe Max Bögl,"Frankfurt am Main, Hesse, Germany",,https://www.linkedin.com/jobs/view/4335391899 , ,li-4335391899,fulltime,,,,,,False,associate,Project Management and Engineering,,,Construction,https://de.linkedin.com/company/firmengruppe-max-b%C3%B6gl,,,,,,,,,,,
linkedin,Systems Engineer / Technical Project Manager (m/f/d),mamgo | Talente 🔗 Jobs,"Munich, Bavaria, Germany",,https://www.linkedin.com/jobs/view/4403177612 , ,li-4403177612,fulltime,,,,,,False,entry level,Project Management and Information Technology,,,"Technology, Information and Internet",https://de.linkedin.com/company/mamgo-io,,,,,,,,,,,
linkedin,"(Senior) Manager, Digital Strategy & Delivery (m/f/d)",Clariant,"Munich, Bavaria, Germany",,https://www.linkedin.com/jobs/view/4403117260 , ,li-4403117260,fulltime,,,,,,False,mid-senior level,Marketing and Sales,,,Chemical Manufacturing,https://ch.linkedin.com/company/clariant,,,,,,,,,,,
linkedin,Senior Projektmanager - Rechenzentren (w/m/d),Arcadis,"Stuttgart, Baden-Württemberg, Germany",,https://www.linkedin.com/jobs/view/4364130791 , ,li-4364130791,fulltime,,,,,,False,mid-senior level,Other,,,Professional Services,https://nl.linkedin.com/company/arcadis,,,,,,,,,,,
linkedin,Technischer Projektleiter (m/w/d) Elektromobilität,RhönEnergie Gruppe,"Fulda, Hesse, Germany",,https://www.linkedin.com/jobs/view/4402703291 , ,li-4402703291,fulltime,,,,,,False,entry level,Project Management and Information Technology,,,Utilities,https://de.linkedin.com/company/rhoenenergie-fulda,,,,,,,,,,,
linkedin,Senior Projektmanager - Rechenzentren (w/m/d),Arcadis,"Leipzig, Saxony, Germany",,https://www.linkedin.com/jobs/view/4363236749 , ,li-4363236749,fulltime,,,,,,False,mid-senior level,Other,,,Professional Services,https://nl.linkedin.com/company/arcadis,,,,,,,,,,,
linkedin,Technischer Projektmanager Netzanbindung (m/w/d) Erneuerbare Energien,Firmengruppe Max Bögl,"Sengenthal, Bavaria, Germany",,https://www.linkedin.com/jobs/view/4340771333 , ,li-4340771333,fulltime,,,,,,False,associate,Administrative and Analyst,,,Construction,https://de.linkedin.com/company/firmengruppe-max-b%C3%B6gl,,,,,,,,,,,
linkedin,Technischer Projektleiter Marinesimulation (m/w/d),Rheinmetall,"Bremen, Bremen, Germany",,https://www.linkedin.com/jobs/view/4399967443 , ,li-4399967443,fulltime,,,,,,False,mid-senior level,Project Management and Information Technology,,,Defense and Space Manufacturing,https://de.linkedin.com/company/rheinmetall,,,,,,,,,,,
linkedin,IT-Security Projektmanager (d/m/w) - Technische Kundenbetreuung,genua gmbh,"Leipzig, Saxony, Germany",,https://www.linkedin.com/jobs/view/4403121132 , ,li-4403121132,fulltime,,,,,,False,entry level,Project Management and Information Technology,,,Computer and Network Security,https://de.linkedin.com/company/genua-gmbh,,,,,,,,,,,
linkedin,Senior Projektleiter (w/m/d) Energieanlagen (Wärme- & Kraftwerkstechnik),Headmatch GmbH & Co. KG,"Leipzig, Saxony, Germany",,https://www.linkedin.com/jobs/view/4387391179 , ,li-4387391179,fulltime,,,,,,False,associate,Project Management,,,"Electric Power Transmission, Control, and Distribution and Energy Technology",https://de.linkedin.com/company/headmatch,,,,,,,,,,,
