site,title,company,location,date_posted,job_url,job_url_direct,id,job_type,salary_source,interval,min_amount,max_amount,currency,is_remote,job_level,job_function,listing_type,emails,company_industry,company_url,company_url_direct,company_addresses,company_num_employees,company_revenue,company_description,skills,experience_range,company_rating,company_reviews_count,vacancy_count,work_from_home_type
linkedin,Group/Senior Product Manager - AdTech,Delivery Hero,"Berlin, Berlin, Germany",2026-05-21,https://www.linkedin.com/jobs/view/4416572233 , ,li-4416572233,fulltime,,,,,,False,mid-senior level,Marketing and Product Management,,inclusion@deliveryhero.com,Software Development and IT Services and IT Consulting,https://de.linkedin.com/company/delivery-hero-se,,,,,,,,,,,
linkedin,Product Manager - Lending,N26,"Berlin, Berlin, Germany",2026-05-21,https://www.linkedin.com/jobs/view/4408568830 , ,li-4408568830,fulltime,,,,,,True,mid-senior level,Product Management and Marketing,,,Financial Services,https://de.linkedin.com/company/n26,,,,,,,,,,,
linkedin,Senior Product Owner,Excelra,"Darmstadt, Hesse, Germany",2026-05-21,https://www.linkedin.com/jobs/view/4414018769 , ,li-4414018769,contract,,,,,,False,mid-senior level,Product Management,,,Biotechnology Research and Pharmaceutical Manufacturing,https://www.linkedin.com/company/excelra,,,,,,,,,,,
linkedin,"Senior Technical Product Manager, Swap",1inch,"Stuttgart, Baden-Württemberg, Germany",2026-05-21,https://www.linkedin.com/jobs/view/4416518532 , ,li-4416518532,fulltime,,,,,,True,not applicable,Product Management and Marketing,,,"Transportation, Logistics, Supply Chain and Storage",https://www.linkedin.com/company/1inchcom,,,,,,,,,,,
linkedin,(Senior) Product Manager (all genders),BABOR BEAUTY GROUP,"Aachen, North Rhine-Westphalia, Germany",2026-05-21,https://www.linkedin.com/jobs/view/4398609986 , ,li-4398609986,fulltime,,,,,,False,mid-senior level,Product Management and Marketing,,,"Personal Care Product Manufacturing, Advertising Services, and Wellness and Fitness Services",https://de.linkedin.com/company/babor-beauty-group,,,,,,,,,,,
linkedin,Senior Technical Product Manager (m/w/d) – Teilzeit,Ehsani Corporation GmbH,"Düsseldorf, North Rhine-Westphalia, Germany",2026-05-21,https://www.linkedin.com/jobs/view/4417743036 , ,li-4417743036,fulltime,,,,,,False,mid-senior level,Product Management and Marketing,,mr.ehsani@gmx.de,IT Services and IT Consulting,https://de.linkedin.com/company/ehsani-corporation,,,,,,,,,,,
linkedin,Global Cost of Energy Program Manager (m/f/d),Nordex Group,"Hamburg, Germany",2026-05-21,https://www.linkedin.com/jobs/view/4382141300 , ,li-4382141300,parttime,,,,,,False,mid-senior level,Project Management and Information Technology,,,Renewable Energy Equipment Manufacturing,https://de.linkedin.com/company/nordex,,,,,,,,,,,
linkedin,"Senior Product Manager, Connectivity",GetYourGuide,"Berlin, Berlin, Germany",2026-05-21,https://www.linkedin.com/jobs/view/4417489167 , ,li-4417489167,fulltime,,,,,,False,mid-senior level,Design and Product Management,,jobs@getyourguide.com,"Technology, Information and Internet and Travel Arrangements",https://de.linkedin.com/company/getyourguide-ag,,,,,,,,,,,
linkedin,Strategy & Operations Project Manager (f/m/d),GEA Group,"Düsseldorf, North Rhine-Westphalia, Germany",2026-05-21,https://www.linkedin.com/jobs/view/4417735143 , ,li-4417735143,fulltime,,,,,,False,not applicable,Project Management and Information Technology,,,"Industrial Machinery Manufacturing, Machinery Manufacturing, and Food and Beverage Manufacturing",https://de.linkedin.com/company/geagroup,,,,,,,,,,,
linkedin,Senior Projektmanager:in,HAT.tec,,2026-05-21,https://www.linkedin.com/jobs/view/4414019215 , ,li-4414019215,fulltime,,,,,,True,associate,Project Management,,,Defense and Space Manufacturing and Software Development,https://de.linkedin.com/company/hattec,,,,,,,,,,,
linkedin,Projektmanager Supply Chain (m | w | d),Miltenyi Biotec,"Bergisch Gladbach, North Rhine-Westphalia, Germany",2026-05-21,https://www.linkedin.com/jobs/view/4405999461 , ,li-4405999461,fulltime,,,,,,False,associate,Supply Chain,,,Biotechnology,https://de.linkedin.com/company/miltenyi-biotec,,,,,,,,,,,
linkedin,Lab Operations Manager,Precision For Medicine,"Berlin, Berlin, Germany",2026-05-21,https://www.linkedin.com/jobs/view/4416513180 , ,li-4416513180,fulltime,,,,,,False,mid-senior level,Management and Manufacturing,,QuestionForHR@precisionmedicinegrp.com,"Technology, Information and Internet",https://www.linkedin.com/company/precision-for-medicine,,,,,,,,,,,
linkedin,Creator & Publisher Manager - Content Operation - Berlin,TikTok,"Berlin, Berlin, Germany",2026-05-21,https://www.linkedin.com/jobs/view/4416524160 , ,li-4416524160,fulltime,,,,,,False,mid-senior level,"Marketing, Public Relations, and Writing/Editing",,,"Technology, Information and Internet, Entertainment, and Technology, Information and Media",https://www.linkedin.com/company/tiktok,,,,,,,,,,,
linkedin,Scheduling Manager,Mane Contract Services,"Hamburg, Germany",2026-05-21,https://www.linkedin.com/jobs/view/4414002958 , ,li-4414002958,fulltime,,,,,,False,mid-senior level,Strategy/Planning and Project Management,,s.krueger@mane.co.uk,"Oil and Gas, Services for Renewable Energy, and Utilities",https://uk.linkedin.com/company/mane-contract-services,,,,,,,,,,,
linkedin,Project Coordinator,Korn Ferry,,2026-05-21,https://www.linkedin.com/jobs/view/4416588754 , ,li-4416588754,fulltime,,,,,,False,entry level,Other,,,Business Consulting and Services,https://www.linkedin.com/company/kornferry,,,,,,,,,,,
linkedin,Procurement Analyst,Jobgether,,2026-05-21,https://www.linkedin.com/jobs/view/4416504742 , ,li-4416504742,fulltime,,,,,,True,associate,Purchasing and Supply Chain,,,Internet Marketplace Platforms,https://be.linkedin.com/company/jobgether,,,,,,,,,,,
linkedin,Program Manager,WorkGenius Group,"Munich, Bavaria, Germany",2026-05-21,https://www.linkedin.com/jobs/view/4413674721 , ,li-4413674721,fulltime,,,,,,False,mid-senior level,Project Management,,,"Transportation, Logistics, Supply Chain and Storage",https://www.linkedin.com/company/workgenius-group,,,,,,,,,,,
linkedin,"R&D NPI Sr. Engineering Manager (m/f/d), Project Management",nVent,"Straubenhardt, Baden-Württemberg, Germany",2026-05-21,https://www.linkedin.com/jobs/view/4417744890 , ,li-4417744890,fulltime,,,,,,False,mid-senior level,Project Management and Information Technology,,,"Appliances, Electrical, and Electronics Manufacturing and Industrial Machinery Manufacturing",https://www.linkedin.com/company/nvent,,,,,,,,,,,
linkedin,Project Manager II (Germany),Indero (formerly Innovaderm),,2026-05-21,https://www.linkedin.com/jobs/view/4408582840 , ,li-4408582840,fulltime,,,,,,False,not applicable,Project Management and Information Technology,,,Research Services,https://ca.linkedin.com/company/inderocro,,,,,,,,,,,
linkedin,Program Manager (f/m/d),Siemens Energy,"Erlangen, Bavaria, Germany",2026-05-21,https://www.linkedin.com/jobs/view/4416519451 , ,li-4416519451,fulltime,,,,,,True,mid-senior level,Accounting/Auditing,,,"Appliances, Electrical, and Electronics Manufacturing",https://www.linkedin.com/company/siemens-energy,,,,,,,,,,,
linkedin,Contract Manager,EUROGATE Group,"Wilhelmshaven, Lower Saxony, Germany",2026-05-21,https://www.linkedin.com/jobs/view/4416505686 , ,li-4416505686,fulltime,,,,,,False,mid-senior level,Project Management,,,Freight and Package Transportation,https://de.linkedin.com/company/eurogate-gmbh-&-co-kgaa-kg,,,,,,,,,,,
linkedin,Project Manager/Site Lead,Sev1Tech LLC,,2026-05-21,https://www.linkedin.com/jobs/view/4340156289 , ,li-4340156289,fulltime,,,,,,False,mid-senior level,Project Management and Information Technology,,careers@entarian.com,IT Services and IT Consulting,https://www.linkedin.com/company/sev1tech,,,,,,,,,,,
linkedin,Director Program Management Office - Electrical Sector EMEA,Eaton,,2026-05-21,https://www.linkedin.com/jobs/view/4414021204 , ,li-4414021204,fulltime,,,,,,False,director,Other,,,"Appliances, Electrical, and Electronics Manufacturing",https://ie.linkedin.com/company/eaton,,,,,,,,,,,
linkedin,Project Manager - CMS (Mgr Project Management 2) - 26950,"Mission Technologies, a division of HII","Miesenbach, Rhineland-Palatinate, Germany",2026-05-21,https://www.linkedin.com/jobs/view/4368022628 , ,li-4368022628,fulltime,,,,,,False,mid-senior level,Project Management and Information Technology,,,Defense and Space Manufacturing,https://www.linkedin.com/company/mission-technologies-a-division-of-hii,,,,,,,,,,,
linkedin,Projektmanager-Assistenz - Vollzeit (German Speaking),Firmenkunden-Kompetenzcenter Freiburg,"Freiburg, Baden-Württemberg, Germany",2026-05-21,https://www.linkedin.com/jobs/view/4417485705 , ,li-4417485705,fulltime,,,,,,False,mid-senior level,Finance,,,Financial Services,https://de.linkedin.com/company/swisslife-select-freiburg,,,,,,,,,,,
linkedin,Projektleitung Holzingenieurwesen (m/w/d),PIRMIN JUNG,"Remagen, Rhineland-Palatinate, Germany",2026-05-21,https://www.linkedin.com/jobs/view/4413665922 , ,li-4413665922,fulltime,,,,,,False,mid-senior level,Engineering,,,Wholesale Building Materials,https://ch.linkedin.com/company/pirminjung,,,,,,,,,,,
linkedin,Rollout Manager - payment solutions (m/w/d),TSG Deutschland GmbH & Co. KG,"Munich, Bavaria, Germany",2026-05-21,https://www.linkedin.com/jobs/view/4414015019 , ,li-4414015019,fulltime,,,,,,True,mid-senior level,Project Management,,,IT Services and IT Consulting,https://de.linkedin.com/company/tsg-deutschland,,,,,,,,,,,
linkedin,Senior Enterprise Systems Analyst,Circle K,"Berlin, Berlin, Germany",2026-05-21,https://www.linkedin.com/jobs/view/4395495134 , ,li-4395495134,fulltime,,,,,,False,mid-senior level,Information Technology,,,Retail,https://ca.linkedin.com/company/circle-k,,,,,,,,,,,
linkedin,Senior Project Manager SAP S/4HANA (m/w/d),Sycor,,2026-05-21,https://www.linkedin.com/jobs/view/4248435074 , ,li-4248435074,fulltime,,,,,,False,mid-senior level,Project Management and Information Technology,,,IT Services and IT Consulting,https://de.linkedin.com/company/sycor,,,,,,,,,,,
linkedin,Senior Operations Project Manager (m/w/d) in Hamburg oder Berlin,Digitas Germany,"Hamburg, Hamburg, Germany",2026-05-21,https://www.linkedin.com/jobs/view/4376083451 , ,li-4376083451,fulltime,,,,,,True,not applicable,Project Management and Information Technology,,,Advertising Services,https://www.linkedin.com/company/digitasgermany,,,,,,,,,,,
linkedin,Junior Global Project Manager (m/f/d) Supply Chain,Harvey Nash,"Böblingen, Baden-Württemberg, Germany",2026-05-21,https://www.linkedin.com/jobs/view/4416394982 , ,li-4416394982,fulltime,,,,,,False,associate,Project Management,,aspasia.joannidou@nashdirect.de,Semiconductor Manufacturing,https://uk.linkedin.com/company/harvey-nash,,,,,,,,,,,
linkedin,Assistenz des Vice President Operations,Wöhner GmbH & Co.KG  - Elektrotechnische Systeme,"Rödental, Bavaria, Germany",2026-05-21,https://www.linkedin.com/jobs/view/4417708304 , ,li-4417708304,fulltime,,,,,,False,associate,Project Management and Administrative,,,"Appliances, Electrical, and Electronics Manufacturing",https://de.linkedin.com/company/woehner,,,,,,,,,,,
linkedin,Global Project Manager (m/f/d)- IT Transformation,Harvey Nash,"Böblingen, Baden-Württemberg, Germany",2026-05-21,https://www.linkedin.com/jobs/view/4416510063 , ,li-4416510063,fulltime,,,,,,False,associate,Project Management,,aspasia.joannidou@nashdirect.de,Semiconductor Manufacturing,https://uk.linkedin.com/company/harvey-nash,,,,,,,,,,,
linkedin,Data Analyst,Moody's Corporation,"Berlin, Berlin, Germany",2026-05-21,https://www.linkedin.com/jobs/view/4418009876 , ,li-4418009876,fulltime,,,,,,True,entry level,Information Technology,,,Financial Services,https://www.linkedin.com/company/moodys-corporation,,,,,,,,,,,
linkedin,Project Manager,Cognite,"Cologne, North Rhine-Westphalia, Germany",2026-05-21,https://www.linkedin.com/jobs/view/4346064667 , ,li-4346064667,fulltime,,,,,,False,mid-senior level,Project Management and Information Technology,,,"Construction, Software Development, and IT Services and IT Consulting",https://www.linkedin.com/company/cognitedata,,,,,,,,,,,
linkedin,Project Manager (m/w/d),shyftplan,"Berlin, Berlin, Germany",2026-05-21,https://www.linkedin.com/jobs/view/4414010245 , ,li-4414010245,fulltime,,,,,,False,associate,Project Management and Information Technology,,,Software Development,https://de.linkedin.com/company/shyftplan,,,,,,,,,,,
linkedin,Project Manager,AKQA,"Berlin, Berlin, Germany",2026-05-21,https://www.linkedin.com/jobs/view/4387251811 , ,li-4387251811,fulltime,,,,,,False,mid-senior level,"Project Management, Advertising, and Design",,,Design Services,https://www.linkedin.com/company/akqa,,,,,,,,,,,
linkedin,Operations and Technical Project Manager (m/f/x) @ Carl Zeiss Extended Reality (XRX),ZEISS Group,"Aalen, Baden-Württemberg, Germany",2026-05-21,https://www.linkedin.com/jobs/view/4417735259 , ,li-4417735259,fulltime,,,,,,False,mid-senior level,"Management, Strategy/Planning, and Other",,,"Manufacturing and Appliances, Electrical, and Electronics Manufacturing",https://de.linkedin.com/company/zeiss,,,,,,,,,,,
linkedin,Project Manager,Mace,"Frankfurt, Hesse, Germany",2026-05-21,https://www.linkedin.com/jobs/view/4417496428 , ,li-4417496428,fulltime,,,,,,False,not applicable,Project Management and Information Technology,,,"Construction, Civil Engineering, and Architecture and Planning",https://uk.linkedin.com/company/mace-group,,,,,,,,,,,
linkedin,Business Systems Consultant – CRM (PD/CS)/GCC - Service,Sungrow Europe,,2026-05-21,https://www.linkedin.com/jobs/view/4416362746 , ,li-4416362746,fulltime,,,,,,False,entry level,Consulting and Project Management,,,Renewable Energy Equipment Manufacturing and Manufacturing,https://de.linkedin.com/company/sungroweurope,,,,,,,,,,,
linkedin,Global Logistic Project Lead (m/f/d),RIMOWA,"Cologne, North Rhine-Westphalia, Germany",2026-05-21,https://www.linkedin.com/jobs/view/4417763656 , ,li-4417763656,fulltime,,,,,,False,director,Management and Manufacturing,,,Retail Luxury Goods and Jewelry,https://de.linkedin.com/company/rimowa,,,,,,,,,,,
linkedin,Projektleiter*in Ingenieurbau,Stadt Mönchengladbach,"Mönchengladbach, North Rhine-Westphalia, Germany",2026-05-21,https://www.linkedin.com/jobs/view/4417775347 , ,li-4417775347,fulltime,,,,,,False,mid-senior level,"Design, Art/Creative, and Information Technology",,,Government Administration,https://de.linkedin.com/company/stadt-moenchengladbach,,,,,,,,,,,
linkedin,CSA Project Manager,Elusav Recruitment,"Frankfurt, Hesse, Germany",2026-05-20,https://www.linkedin.com/jobs/view/4416167344 , ,li-4416167344,fulltime,,,,,,False,mid-senior level,Engineering and Project Management,,Ttorres@elusav.com,Construction and Engineering Services,https://ie.linkedin.com/company/elusav-recruitment,,,,,,,,,,,
linkedin,CMC Project Manager - SME - Development,Vector Talent,,2026-05-20,https://www.linkedin.com/jobs/view/4417330200 , ,li-4417330200,fulltime,,,,,,True,mid-senior level,Project Management,,,Research Services and Pharmaceutical Manufacturing,https://uk.linkedin.com/company/yourpartnerintalent,,,,,,,,,,,
linkedin,(Senior) Manager Ivalua (f/m/d),MHP – A Porsche Company,"Wolfsburg, Lower Saxony, Germany",2026-05-20,https://www.linkedin.com/jobs/view/4387427183 , ,li-4387427183,fulltime,,,,,,False,mid-senior level,Other,,,Business Consulting and Services,https://de.linkedin.com/company/mhp-a-porsche-company,,,,,,,,,,,
linkedin,Projektleitung für Elektrotechnik (m/w/d),Johannes Merz GmbH,"Spires, Rhineland-Palatinate, Germany",2026-05-20,https://www.linkedin.com/jobs/view/4413631516 , ,li-4413631516,fulltime,,,,,,False,associate,Engineering,,,IT Services and IT Consulting,https://www.linkedin.com/company/johannes-merz-gmbh,,,,,,,,,,,
linkedin,(Senior) Technical Project Manager (m/f/d) - Data Centres,Turner & Townsend,"Frankfurt am Main, Hesse, Germany",2026-05-20,https://www.linkedin.com/jobs/view/4395956905 , ,li-4395956905,fulltime,,,,,,False,mid-senior level,"Project Management, Consulting, and Engineering",,,"Construction, Civil Engineering, and Business Consulting and Services",https://uk.linkedin.com/company/turner-&-townsend,,,,,,,,,,,
linkedin,Projektmanager (m/w/d) Web - B2B SaaS Agentur · Remote · Deutschland,YOYABA Technologies,,2026-05-20,https://www.linkedin.com/jobs/view/4413399340 , ,li-4413399340,fulltime,,,,,,True,associate,Project Management,,,IT Services and IT Consulting,https://de.linkedin.com/company/yoyaba-tech,,,,,,,,,,,
linkedin,Senior Project Manager (m/f/d),Exyte,"Dresden, Saxony, Germany",2026-05-20,https://www.linkedin.com/jobs/view/4394790617 , ,li-4394790617,fulltime,,,,,,False,mid-senior level,Project Management and Information Technology,,-k@exentec.net,Civil Engineering,https://de.linkedin.com/company/exyte-group,,,,,,,,,,,
linkedin,Senior Project Manager (m/f/d),Discovery Life Sciences,"Kassel, Hesse, Germany",2026-05-20,https://www.linkedin.com/jobs/view/4417053908 , ,li-4417053908,fulltime,,,,,,False,mid-senior level,Project Management,,,Biotechnology Research,https://www.linkedin.com/company/discoverylifesciences,,,,,,,,,,,
linkedin,Project Director Large Scale Projects (f/m/d),Quest One,"Augsburg, Bavaria, Germany",2026-05-20,https://www.linkedin.com/jobs/view/4395442867 , ,li-4395442867,fulltime,,,,,,False,director,Business Development and Sales,,,Renewable Energy Equipment Manufacturing,https://de.linkedin.com/company/questone1,,,,,,,,,,,
linkedin,Project Director,Mercury,"Frankfurt, Hesse, Germany",2026-05-20,https://www.linkedin.com/jobs/view/4328353962 , ,li-4328353962,fulltime,,,,,,False,director,Management and Manufacturing,,,Construction,https://ie.linkedin.com/company/mercury-engineering,,,,,,,,,,,
linkedin,Manager/Senior Manager Transaction Advisory Services (m/w/d),RSM Ebner Stolz,"Munich, Bavaria, Germany",2026-05-20,https://www.linkedin.com/jobs/view/4360792192 , ,li-4360792192,fulltime,,,,,,False,mid-senior level,Finance and Sales,,,Professional Services,https://de.linkedin.com/company/rsm-ebner-stolz,,,,,,,,,,,
linkedin,Team Lead Mobile (m/f/d),Westwing,"Munich, Bavaria, Germany",2026-05-20,https://www.linkedin.com/jobs/view/4413447317 , ,li-4413447317,fulltime,,,,,,False,mid-senior level,Other,,,Retail,https://de.linkedin.com/company/westwing-home-&-living,,,,,,,,,,,
linkedin,Project Manager - Civils,Falcon Green,"Frankfurt, Hesse, Germany",2026-05-20,https://www.linkedin.com/jobs/view/4417055877 , ,li-4417055877,fulltime,,,,,,False,mid-senior level,Engineering,,,Construction,https://uk.linkedin.com/company/falcon-green-personnel,,,,,,,,,,,
linkedin,Project Manager,Mercury,"Frankfurt, Hesse, Germany",2026-05-20,https://www.linkedin.com/jobs/view/4351829591 , ,li-4351829591,fulltime,,,,,,False,mid-senior level,Project Management and Information Technology,,,Construction,https://ie.linkedin.com/company/mercury-engineering,,,,,,,,,,,
linkedin,Software Project Manager (all genders),Smart Steel Technologies,"Berlin, Berlin, Germany",2026-05-20,https://www.linkedin.com/jobs/view/4416150980 , ,li-4416150980,fulltime,,,,,,False,entry level,Information Technology,,,Software Development,https://de.linkedin.com/company/smart-steel-technologies,,,,,,,,,,,
linkedin,Project Manager - Italian-speaking (m/w/d),Peter Park,,2026-05-20,https://www.linkedin.com/jobs/view/4417310101 , ,li-4417310101,fulltime,,,,,,True,associate,Information Technology and Project Management,,,Information Technology & Services,https://de.linkedin.com/company/peterpark,,,,,,,,,,,
linkedin,Project Manager (PM),Datamatics Technologies,"Frankfurt, Hesse, Germany",2026-05-20,https://www.linkedin.com/jobs/view/4417087213 , ,li-4417087213,fulltime,,,,,,False,mid-senior level,"Sales, General Business, and Education",,,"Wireless Services, Telecommunications, and Communications Equipment Manufacturing",https://uk.linkedin.com/company/datamatics-technologies,,,,,,,,,,,
linkedin,Produktmanager Stationäre Energiespeicher (m/w/d) - EMEA,Michael Page,"Wetteraukreis, Hesse, Germany",2026-05-20,https://www.linkedin.com/jobs/view/4417377893 , ,li-4417377893,fulltime,,,,,,False,mid-senior level,Manufacturing and Engineering,,,Staffing and Recruiting,https://uk.linkedin.com/company/michael-page,,,,,,,,,,,
linkedin,Senior Product Design Manager,Pennylane,,2026-05-20,https://www.linkedin.com/jobs/view/4417072960 , ,li-4417072960,contract,,,,,,True,mid-senior level,"Design, Art/Creative, and Information Technology",,,Accounting,https://fr.linkedin.com/company/pennylaneaccounting,,,,,,,,,,,
linkedin,Product Manager - Trading Software,Volue,"Munich, Bavaria, Germany",2026-05-20,https://www.linkedin.com/jobs/view/4413387790 , ,li-4413387790,fulltime,,,,,,False,mid-senior level,Product Management,,,Energy Technology and Services for Renewable Energy,https://no.linkedin.com/company/volue,,,,,,,,,,,
linkedin,IT Product Manager / Product Owner (aGw*),Lindner Group,"Arnstorf, Bavaria, Germany",2026-05-20,https://www.linkedin.com/jobs/view/4413377957 , ,li-4413377957,fulltime,,,,,,False,mid-senior level,Product Management and Marketing,,,Construction,https://de.linkedin.com/company/lindner-group,,,,,,,,,,,
linkedin,Senior Technical Product Manager,Kpler,,2026-05-20,https://www.linkedin.com/jobs/view/4405521980 , ,li-4405521980,fulltime,,,,,,False,mid-senior level,Product Management and Marketing,,,"Technology, Information and Media",https://be.linkedin.com/company/kpler,,,,,,,,,,,
linkedin,Product Owner,Jobgether,,2026-05-20,https://www.linkedin.com/jobs/view/4416112745 , ,li-4416112745,fulltime,,,,,,True,mid-senior level,Product Management and Marketing,,,Internet Marketplace Platforms,https://be.linkedin.com/company/jobgether,,,,,,,,,,,
linkedin,"Product Manager - (Fintech, Payments)",Delivery Hero,"Berlin, Berlin, Germany",2026-05-20,https://www.linkedin.com/jobs/view/4406956559 , ,li-4406956559,fulltime,,,,,,False,mid-senior level,Marketing and Product Management,,inclusion@deliveryhero.com,Software Development and IT Services and IT Consulting,https://de.linkedin.com/company/delivery-hero-se,,,,,,,,,,,
linkedin,Senior Project Manager (m/w/d),RENK Group,,2026-05-20,https://www.linkedin.com/jobs/view/4410630840 , ,li-4410630840,fulltime,,,,,,False,mid-senior level,Project Management and Information Technology,,,Machinery Manufacturing,https://de.linkedin.com/company/renkgroup,,,,,,,,,,,
linkedin,Projektkoordinator (m/w/d),KANZAN Spezialpapiere GmbH,"Düren, North Rhine-Westphalia, Germany",2026-05-20,https://www.linkedin.com/jobs/view/4417003794 , ,li-4417003794,fulltime,,,,,,False,mid-senior level,Engineering,,personal@kanzan.de,Paper and Forest Product Manufacturing,https://de.linkedin.com/company/kanzan-spezialpapiere-gmbh,,,,,,,,,,,
linkedin,Technical Projectmanager (m/w/d) 100% Remote,Cloudrizon GmbH | IT-Consulting,"Ulm, Baden-Württemberg, Germany",2026-05-20,https://www.linkedin.com/jobs/view/4416317664 , ,li-4416317664,fulltime,,,,,,True,not applicable,Project Management and Information Technology,,,IT Services and IT Consulting,https://de.linkedin.com/company/cloudrizon,,,,,,,,,,,
linkedin,Junior Account Manager / Junior Sales Consultant (m/w/d),KRONGAARD,"Düsseldorf, North Rhine-Westphalia, Germany",2026-05-20,https://www.linkedin.com/jobs/view/4416114697 , ,li-4416114697,fulltime,,,,,,False,entry level,Sales and Consulting,,,Staffing and Recruiting and Human Resources Services,https://de.linkedin.com/company/krongaard,,,,,,,,,,,
linkedin,Senior Logistics Coordinator | Upto $70/hr Part-time,Mercor,"Berlin, Berlin, Germany",2026-05-20,https://www.linkedin.com/jobs/view/4415999637 , ,li-4415999637,parttime,description,hourly,55.0,70.0,USD,True,not applicable,Management and Manufacturing,,support@mercor.com,Software Development,https://www.linkedin.com/company/mercor-ai,,,,,,,,,,,
linkedin,Junior Product Manger (Buying - Private Label),OUTFITTERY,"Berlin, Germany",2026-05-20,https://www.linkedin.com/jobs/view/4417316383 , ,li-4417316383,fulltime,,,,,,True,associate,Product Management,,,Retail Apparel and Fashion,https://de.linkedin.com/company/outfittery,,,,,,,,,,,
linkedin,Accounts Receivable Manager / Team Lead (m/f/d),Excelitas Technologies Corp.,"Feldkirchen, Bavaria, Germany",2026-05-20,https://www.linkedin.com/jobs/view/4416301012 , ,li-4416301012,fulltime,,,,,,False,mid-senior level,Accounting/Auditing and Finance,,,Manufacturing,https://www.linkedin.com/company/excelitas-technologies,,,,,,,,,,,
linkedin,Product Management Team Lead (m/w) – Finance Software,RIB Software,"Stuttgart, Baden-Württemberg, Germany",2026-05-20,https://www.linkedin.com/jobs/view/4417302631 , ,li-4417302631,fulltime,,,,,,True,mid-senior level,Engineering and Information Technology,,,Software Development,https://de.linkedin.com/company/rib-software,,,,,,,,,,,
linkedin,SAP S/4HANA Rollout Project Manager (m/w/d),Bertrandt Group,"Munich, Bavaria, Germany",2026-05-20,https://www.linkedin.com/jobs/view/4416314824 , ,li-4416314824,fulltime,,,,,,False,mid-senior level,Project Management and Information Technology,,,Engineering Services,https://de.linkedin.com/company/bertrandt-ag,,,,,,,,,,,
linkedin,DE Legal Office Manager (Paralegal / Project Management),Amazon,"Munich, Bavaria, Germany",2026-05-20,https://www.linkedin.com/jobs/view/4417364021 , ,li-4417364021,fulltime,,,,,,False,mid-senior level,Legal and Information Technology,,,Software Development,https://www.linkedin.com/company/amazon,,,,,,,,,,,
linkedin,Software Project Manager (m/w/d) IVI,Valeo,"Garching, Bavaria, Germany",2026-05-20,https://www.linkedin.com/jobs/view/4417080755 , ,li-4417080755,fulltime,,,,,,False,mid-senior level,Project Management and Information Technology,,Alessa.Knapp@valeo.com,Motor Vehicle Parts Manufacturing,https://fr.linkedin.com/company/valeo,,,,,,,,,,,
