site,title,company,location,date_posted,job_url,job_url_direct,id,job_type,salary_source,interval,min_amount,max_amount,currency,is_remote,job_level,job_function,listing_type,emails,company_industry,company_url,company_url_direct,company_addresses,company_num_employees,company_revenue,company_description,skills,experience_range,company_rating,company_reviews_count,vacancy_count,work_from_home_type
linkedin,Senior Commercial Project Manager (f/m/d),Siemens,"Brunswick, Lower Saxony, Germany",2026-06-18,https://www.linkedin.com/jobs/view/4409719464 , ,li-4409719464,fulltime,,,,,,True,mid-senior level,Finance,,,Automation Machinery Manufacturing,https://de.linkedin.com/company/siemens,,,,,,,,,,,
linkedin,业务发展总监,"CGL Consulting Co., Ltd","Berlin, Germany",2026-06-18,https://www.linkedin.com/jobs/view/4428771854 , ,li-4428771854,fulltime,,,,,,False,executive,"Sales, Marketing, and Business Development",,,"Motor Vehicle Manufacturing, Manufacturing, and Retail Motor Vehicles",https://cn.linkedin.com/company/wearecgl,,,,,,,,,,,
linkedin,Software Project Manager (M/W/D)*,TGW Logistics,"Teunz, Bavaria, Germany",2026-06-18,https://www.linkedin.com/jobs/view/4427847170 , ,li-4427847170,fulltime,,,,,,False,mid-senior level,Project Management and Information Technology,,,Automation Machinery Manufacturing,https://at.linkedin.com/company/tgw-group,,,,,,,,,,,
linkedin,Teamassistent / Office Manager (m/w/d) in Teilzeit (20 Stunden / Woche),Ludwig Hammer GmbH,"Frankfurt am Main, Hesse, Germany",2026-06-18,https://www.linkedin.com/jobs/view/4430748935 , ,li-4430748935,fulltime,,,,,,False,entry level,Administrative,,,Construction,https://de.linkedin.com/company/ludwig-hammer-gmbh,,,,,,,,,,,
linkedin,New Product Introduction and Industrialization Engineer,Tintschl Unternehmensgruppe,"Hamburg, Germany",2026-06-18,https://www.linkedin.com/jobs/view/4430428654 , ,li-4430428654,fulltime,,,,,,False,associate,"Analyst, Business Development, and Project Management",,,"Electric Power Transmission, Control, and Distribution",https://de.linkedin.com/company/tintschlunternehmensgruppe,,,,,,,,,,,
linkedin,Project Manager FDA & Regulatory Affairs (m/w/d),SymBio.,,2026-06-18,https://www.linkedin.com/jobs/view/4429014624 , ,li-4429014624,fulltime,,,,,,False,associate,"Health Care Provider, Research, and Engineering",,c.laufer@symbiorecruitment.de,Medical Equipment Manufacturing,https://de.linkedin.com/company/symbio-recruitment-gmbh,,,,,,,,,,,
linkedin,Project Management Graduate,Colt Technology Services,"Frankfurt, Hesse, Germany",2026-06-18,https://www.linkedin.com/jobs/view/4429329592 , ,li-4429329592,fulltime,,,,,,False,entry level,Project Management and Management,,,Telecommunications,https://uk.linkedin.com/company/colt-technology-services,,,,,,,,,,,
linkedin,Business Development Manager,Temu,,2026-06-18,https://www.linkedin.com/jobs/view/4429026187 , ,li-4429026187,fulltime,,,,,,False,mid-senior level,Business Development and Sales,,,"Technology, Information and Internet and Retail",https://www.linkedin.com/company/temuapp,,,,,,,,,,,
linkedin,Technischer Projektleiter / Solution Architect (m/w/d) ABAP / SAP EWM,Dematic,"Augsburg, Bavaria, Germany",2026-06-18,https://www.linkedin.com/jobs/view/4386665981 , ,li-4386665981,fulltime,,,,,,False,mid-senior level,Project Management and Information Technology,,,"Transportation, Logistics, Supply Chain and Storage",https://www.linkedin.com/company/dematic,,,,,,,,,,,
linkedin,Technischer Projektleiter Video- & Lichttechnik,LAV-Event GmbH,"Berlin, Berlin, Germany",2026-06-18,https://www.linkedin.com/jobs/view/4427847746 , ,li-4427847746,fulltime,,,,,,False,associate,Other,,,Events Services,https://de.linkedin.com/company/lav-event,,,,,,,,,,,
linkedin,Senior Manager Strategic Projects (m/w/x),ZEISS Group,"Jena, Thuringia, Germany",2026-06-18,https://www.linkedin.com/jobs/view/4430195923 , ,li-4430195923,fulltime,,,,,,False,mid-senior level,"Strategy/Planning, Manufacturing, and Project Management",,,Manufacturing and Strategic Management Services,https://de.linkedin.com/company/zeiss,,,,,,,,,,,
linkedin,Senior SAP Project Manager (m/f/d) - Tieto Tech Consulting,Tieto,"Berlin, Berlin, Germany",2026-06-18,https://www.linkedin.com/jobs/view/4430457768 , ,li-4430457768,fulltime,,,,,,False,mid-senior level,Information Technology,,careers.austria@tieto.com,"Technology, Information and Internet",https://www.linkedin.com/company/tieto,,,,,,,,,,,
linkedin,Senior Project Manager (m/w/d),Instaffo,"Metzingen, Baden-Württemberg, Germany",2026-06-18,https://www.linkedin.com/jobs/view/4430425595 , ,li-4430425595,fulltime,,,,,,False,mid-senior level,Project Management and Management,,,Staffing and Recruiting,https://de.linkedin.com/company/instaffo-gmbh,,,,,,,,,,,
linkedin,Project Technology Transfer Manager (PrTTM) (m/f/d) 1,Alstom,"Siegen, North Rhine-Westphalia, Germany",2026-06-18,https://www.linkedin.com/jobs/view/4427820717 , ,li-4427820717,fulltime,,,,,,False,mid-senior level,"Research, Analyst, and Information Technology",,,Truck Transportation and Railroad Equipment Manufacturing,https://fr.linkedin.com/company/alstom,,,,,,,,,,,
linkedin,Project Technical Leader - Battery (M/F),TotalEnergies,,2026-06-18,https://www.linkedin.com/jobs/view/4411649632 , ,li-4411649632,fulltime,,,,,,True,mid-senior level,Project Management and Information Technology,,,Oil and Gas,https://fr.linkedin.com/company/totalenergies,,,,,,,,,,,
linkedin,Senior IT Portfolio Manager (*),Stolzberger GmbH,,2026-06-18,https://www.linkedin.com/jobs/view/4430427844 , ,li-4430427844,fulltime,,,,,,False,associate,Information Technology,,,IT Services and IT Consulting,https://de.linkedin.com/company/stolzberger-gmbh,,,,,,,,,,,
linkedin,Junior Project Manager (M/W/D),American Express Global Business Travel,,2026-06-18,https://www.linkedin.com/jobs/view/4430178795 , ,li-4430178795,fulltime,,,,,,False,not applicable,Project Management and Information Technology,,,"Events Services, Hospitality, and Travel Arrangements",https://www.linkedin.com/company/american-express-global-business-travel,,,,,,,,,,,
linkedin,Project Manager,Guldberg GmbH,"Bremen, Germany",2026-06-18,https://www.linkedin.com/jobs/view/4430433191 , ,li-4430433191,fulltime,,,,,,False,mid-senior level,Project Management and Information Technology,,,Defense and Space Manufacturing,https://de.linkedin.com/company/guldberggmbh,,,,,,,,,,,
linkedin,Operational Project Manager Billigheim (m/w/d),ELA Container,"Billigheim, Baden-Württemberg, Germany",2026-06-18,https://www.linkedin.com/jobs/view/4427862100 , ,li-4427862100,fulltime,,,,,,False,mid-senior level,Project Management and Information Technology,,,Building Construction,https://de.linkedin.com/company/ela-container,,,,,,,,,,,
linkedin,Project Manager (m/f/d),Exyte,"Dresden, Saxony, Germany",2026-06-18,https://www.linkedin.com/jobs/view/4370255281 , ,li-4370255281,fulltime,,,,,,False,mid-senior level,Project Management and Information Technology,,-k@exentec.net,Civil Engineering,https://de.linkedin.com/company/exyte-group,,,,,,,,,,,
linkedin,Senior Project Manager (m/f/d),Configit,"Langenfeld, North Rhine-Westphalia, Germany",2026-06-18,https://www.linkedin.com/jobs/view/4430485966 , ,li-4430485966,fulltime,,,,,,False,mid-senior level,Project Management and Information Technology,,,Software Development,https://dk.linkedin.com/company/configit,,,,,,,,,,,
linkedin,IT Coordinator,Met T&S,"Hamburg, Germany",2026-06-18,https://www.linkedin.com/jobs/view/4429018512 , ,li-4429018512,fulltime,,,,,,True,mid-senior level,Engineering,,,Oil and Gas,https://uk.linkedin.com/company/met-t-s,,,,,,,,,,,
linkedin,Projektsteuerung (m/w/d) Infrastruktur,MATCHDAY,"Berlin, Germany",2026-06-18,https://www.linkedin.com/jobs/view/4430417945 , ,li-4430417945,fulltime,,,,,,False,associate,Project Management,,,Strategic Management Services,https://vn.linkedin.com/company/matchdaygroup,,,,,,,,,,,
linkedin,Projektmanager / Projektleiter (m/w/d),Blickle & Scherer Kommunikationstechnik GmbH & Co. KG,"Karlsruhe, Baden-Württemberg, Germany",2026-06-18,https://www.linkedin.com/jobs/view/4430449456 , ,li-4430449456,fulltime,,,,,,False,entry level,Engineering,,,Telecommunications,https://de.linkedin.com/company/bsk-world,,,,,,,,,,,
linkedin,Projektmanager:in Camps & Reisen (all genders),ALBA BERLIN Basketballteam,"Berlin, Berlin, Germany",2026-06-18,https://www.linkedin.com/jobs/view/4427828572 , ,li-4427828572,fulltime,,,,,,False,associate,Other,,,Spectator Sports,https://de.linkedin.com/company/albaberlin,,,,,,,,,,,
linkedin,Senior Service Delivery Manager,emnify,"Berlin, Germany",2026-06-18,https://www.linkedin.com/jobs/view/4427836954 , ,li-4427836954,fulltime,,,,,,False,mid-senior level,Project Management,,,"Telecommunications and Technology, Information and Media",https://de.linkedin.com/company/emnify,,,,,,,,,,,
linkedin,Projektmanager / Projektleiter (m/w/d),Jacob Cement Baustoffe,"Flensburg, Schleswig-Holstein, Germany",2026-06-18,https://www.linkedin.com/jobs/view/4430404999 , ,li-4430404999,fulltime,,,,,,False,mid-senior level,Project Management and Information Technology,,,Wholesale Building Materials,https://de.linkedin.com/company/jacob-cement,,,,,,,,,,,
linkedin,Projektmanager Teilzeit (m/w/d),VIRO Deutschland,"Dresden, Saxony, Germany",2026-06-18,https://www.linkedin.com/jobs/view/4401326542 , ,li-4401326542,fulltime,,,,,,False,mid-senior level,Project Management and Information Technology,,,Mechanical Or Industrial Engineering,https://de.linkedin.com/company/viro-deutschland,,,,,,,,,,,
linkedin,Projektleitung Qualität (m/w/d) - IT und Businessprozesse,Rolls-Royce,"Friedrichshafen, Baden-Württemberg, Germany",2026-06-18,https://www.linkedin.com/jobs/view/4428001533 , ,li-4428001533,fulltime,,,,,,False,director,Quality Assurance,,careers@ps.rolls,Industrial Machinery Manufacturing,https://uk.linkedin.com/company/rolls-royce,,,,,,,,,,,
linkedin,Senior Manager - Real Time Delivery Manager EMEA,Ticketmaster,"Berlin, Berlin, Germany",2026-06-18,https://www.linkedin.com/jobs/view/4427857377 , ,li-4427857377,fulltime,,,,,,False,mid-senior level,Project Management and Information Technology,,,Entertainment Providers,https://www.linkedin.com/company/ticketmaster,,,,,,,,,,,
linkedin,Projektmanager Softwareprojekte (m/w/d),MANN & SCHRÖDER COSMETICS,"Siegelsbach, Baden-Württemberg, Germany",2026-06-18,https://www.linkedin.com/jobs/view/4427844388 , ,li-4427844388,fulltime,,,,,,False,mid-senior level,Project Management and Information Technology,,,Personal Care Product Manufacturing,https://de.linkedin.com/company/mann-&-schr%C3%B6der-gmbh,,,,,,,,,,,
linkedin,(Senior) PMO Manager Real Estate (w/m/d),RSG Group GmbH,"Berlin, Germany",2026-06-18,https://www.linkedin.com/jobs/view/4427325790 , ,li-4427325790,fulltime,,,,,,False,mid-senior level,Project Management and Information Technology,,,Wellness and Fitness Services,https://de.linkedin.com/company/rsg-group,,,,,,,,,,,
linkedin,Projektmanager DX (m/w/d),RYZE Digital,"Mainz, Rhineland-Palatinate, Germany",2026-06-18,https://www.linkedin.com/jobs/view/4429020943 , ,li-4429020943,fulltime,,,,,,False,associate,Project Management,,,Business Consulting and Services,https://de.linkedin.com/company/ryzedigital,,,,,,,,,,,
linkedin,Projektmanager Kontraktlogistik (m/w/d),TST Gruppe,"Hamburg, Hamburg, Germany",2026-06-18,https://www.linkedin.com/jobs/view/4430487564 , ,li-4430487564,fulltime,,,,,,False,entry level,Project Management and Information Technology,,,"Transportation, Logistics, Supply Chain and Storage",https://de.linkedin.com/company/tst-gruppe,,,,,,,,,,,
linkedin,Senior Projektleiter (m/w/d) Schlüsselfertigbau,LIST Gruppe,"Bielefeld, North Rhine-Westphalia, Germany",2026-06-18,https://www.linkedin.com/jobs/view/4325562754 , ,li-4325562754,fulltime,,,,,,False,associate,Engineering and Project Management,,,"Construction, Real Estate, and Architecture and Planning",https://de.linkedin.com/company/list-gruppe,,,,,,,,,,,
linkedin,(Senior) Operations Manager (m/f/d),Buying Labs,"Hamburg, Hamburg, Germany",2026-06-18,https://www.linkedin.com/jobs/view/4427830339 , ,li-4427830339,fulltime,,,,,,False,associate,Project Management,,,Retail Luxury Goods and Jewelry,https://de.linkedin.com/company/buying-labs,,,,,,,,,,,
linkedin,"Marketing Manager, Brand Experience",Spotify,"Berlin, Berlin, Germany",2026-06-18,https://www.linkedin.com/jobs/view/4410946786 , ,li-4410946786,temporary,,,,,,True,mid-senior level,Marketing and Sales,,,Musicians,https://se.linkedin.com/company/spotify,,,,,,,,,,,
linkedin,Project Manager,Green Life Science,"Rhineland-Palatinate, Germany",2026-06-18,https://www.linkedin.com/jobs/view/4430427911 , ,li-4430427911,fulltime,,,,,,False,mid-senior level,Project Management,,,Medical Equipment Manufacturing,https://uk.linkedin.com/company/greenlifescience-recruitment,,,,,,,,,,,
linkedin,Senior B2B e-Commerce Manager (m/w/d),L'Oréal,"Düsseldorf, North Rhine-Westphalia, Germany",2026-06-17,https://www.linkedin.com/jobs/view/4413530764 , ,li-4413530764,fulltime,,,,,,False,not applicable,Sales and Business Development,,,Manufacturing and Personal Care Product Manufacturing,https://fr.linkedin.com/company/lor%C3%A9al,,,,,,,,,,,
linkedin,Process Management Associate,A.P. Moller - Maersk,"Hamburg, Hamburg, Germany",2026-06-17,https://www.linkedin.com/jobs/view/4419158615 , ,li-4419158615,fulltime,,,,,,False,not applicable,Management and Manufacturing,,accommodationrequests@maersk.com,"Transportation, Logistics, Supply Chain and Storage",https://dk.linkedin.com/company/maersk-group,,,,,,,,,,,
linkedin,Director Project-Management,division one,"Hamburg, Germany",2026-06-17,https://www.linkedin.com/jobs/view/4427354974 , ,li-4427354974,fulltime,,,,,,False,director,Project Management,,,Energy Technology and Aviation and Aerospace Component Manufacturing,https://de.linkedin.com/company/division-one,,,,,,,,,,,
linkedin,Trainee im kaufmännischen Projektmanagement (m/w/d),"NTT DATA, Inc.","Bad Homburg, Hesse, Germany",2026-06-17,https://www.linkedin.com/jobs/view/4428708322 , ,li-4428708322,fulltime,,,,,,False,entry level,"Information Technology, Customer Service, and Project Management",,,"IT Services and IT Consulting, IT System Custom Software Development, and Computer and Network Security",https://jp.linkedin.com/company/ntt-data-inc,,,,,,,,,,,
linkedin,Founder's Associate,UniWearables,"Berlin, Berlin, Germany",2026-06-17,https://www.linkedin.com/jobs/view/4429992250 , ,li-4429992250,fulltime,,,,,,False,executive,Business Development and Sales,,contact@uniwearables.com,Medical Equipment Manufacturing,https://de.linkedin.com/company/uniwearables,,,,,,,,,,,
linkedin,"Staff Program Manager - Linkoping, Sweden",Qualcomm,"Munich, Bavaria, Germany",2026-06-17,https://www.linkedin.com/jobs/view/4325797135 , ,li-4325797135,fulltime,,,,,,False,not applicable,Other,,-accomodations@qualcomm.com,Semiconductor Manufacturing,https://www.linkedin.com/company/qualcomm,,,,,,,,,,,
linkedin,Clinical Operations Lead (Clinical Trial Manager),Alimentiv,"Hamburg, Hamburg, Germany",2026-06-17,https://www.linkedin.com/jobs/view/4427418207 , ,li-4427418207,fulltime,,,,,,False,not applicable,"Research, Analyst, and Information Technology",,recruitment@alimentiv.com,Pharmaceutical Manufacturing,https://ca.linkedin.com/company/alimentiv,,,,,,,,,,,
linkedin,Consultant Project Management & Digital Transformation (all genders),Wavestone,,2026-06-17,https://www.linkedin.com/jobs/view/4427351556 , ,li-4427351556,parttime,,,,,,False,mid-senior level,Project Management,,,Business Consulting and Services,https://fr.linkedin.com/company/wavestone,,,,,,,,,,,
linkedin,Strategy Associate (f/m/d),think-cell Software,"Berlin, Germany",2026-06-17,https://www.linkedin.com/jobs/view/4400711511 , ,li-4400711511,fulltime,,,,,,True,entry level,Business Development and Sales,,,Software Development,https://de.linkedin.com/company/think-cell,,,,,,,,,,,
linkedin,"Sr Director, Professional Svcs",NetApp,"Munich, Bavaria, Germany",2026-06-17,https://www.linkedin.com/jobs/view/4427309391 , ,li-4427309391,fulltime,,,,,,False,director,Other,,,Software Development,https://www.linkedin.com/company/netapp,,,,,,,,,,,
linkedin,Global Workplace Project Manager (m/f/x),JetBrains,"Munich, Bavaria, Germany",2026-06-17,https://www.linkedin.com/jobs/view/4427373525 , ,li-4427373525,fulltime,,,,,,True,entry level,Project Management and Information Technology,,,Software Development,https://nl.linkedin.com/company/jetbrains,,,,,,,,,,,
linkedin,Senior Consultant (m/w/d) SAP,IT-P Information Technology-Partner GmbH,,2026-06-17,https://www.linkedin.com/jobs/view/4204846616 , ,li-4204846616,fulltime,,,,,,False,mid-senior level,Information Technology,,,IT Services and IT Consulting,https://de.linkedin.com/company/itpgmbh,,,,,,,,,,,
linkedin,"Enterprise Security Trust Program Manager, Customer Trust",Snowflake,"Berlin, Berlin, Germany",2026-06-17,https://www.linkedin.com/jobs/view/4410724846 , ,li-4410724846,fulltime,,,,,,False,mid-senior level,Project Management and Information Technology,,,Software Development,https://www.linkedin.com/company/snowflake-computing,,,,,,,,,,,
linkedin,Projektleiter Elektrotechnik (m/w/d),ENGIE Deutschland,"Cologne, North Rhine-Westphalia, Germany",2026-06-17,https://www.linkedin.com/jobs/view/4429773613 , ,li-4429773613,fulltime,,,,,,False,mid-senior level,Engineering and Information Technology,,irem.sonbahar@external.engie.com,Utilities,https://de.linkedin.com/company/engie-deutschland,,,,,,,,,,,
linkedin,Projektmanager Bauwesen (m/w/d),HEIM-Gruppe,"Ulm, Baden-Württemberg, Germany",2026-06-17,https://www.linkedin.com/jobs/view/4430147646 , ,li-4430147646,fulltime,,,,,,False,mid-senior level,Engineering,,,Construction,https://de.linkedin.com/company/heim-holding-gmbh-co-kg,,,,,,,,,,,
linkedin,ProjektleiterIn Landschaftsarchitektur,+grün GmbH Landschaftsarchitektur,"Düsseldorf, North Rhine-Westphalia, Germany",2026-06-17,https://www.linkedin.com/jobs/view/4429977033 , ,li-4429977033,fulltime,,,,,,False,mid-senior level,"Design, Art/Creative, and Information Technology",,,Architecture and Planning,https://de.linkedin.com/company/-gr%C3%BCn-gmbh-landschaftsarchitektur,,,,,,,,,,,
linkedin,Support as Project Manager as Temp (f/m/d),Renesas Electronics,"Dresden, Saxony, Germany",2026-06-17,https://www.linkedin.com/jobs/view/4363645559 , ,li-4363645559,fulltime,,,,,,True,mid-senior level,Production,,,Semiconductors,https://jp.linkedin.com/company/renesas,,,,,,,,,,,
linkedin,Projektleitung (m/w/d) Automatisierung im Hochdurchsatzlabor (2151),MVZ Labor Dr. Limbach & Kollegen eGbR,"Heidelberg, Baden-Württemberg, Germany",2026-06-17,https://www.linkedin.com/jobs/view/4427324606 , ,li-4427324606,fulltime,,,,,,False,mid-senior level,Other,,,Hospitals and Health Care,https://de.linkedin.com/company/mvz-labor-dr-limbach-und-kollegen,,,,,,,,,,,
linkedin,Team Lead Project Management (m/w/d),Natuvion,"Berlin, Berlin, Germany",2026-06-17,https://www.linkedin.com/jobs/view/4414315075 , ,li-4414315075,fulltime,,,,,,True,mid-senior level,Project Management and Information Technology,,,IT Services and IT Consulting,https://de.linkedin.com/company/natuvion,,,,,,,,,,,
linkedin,CPM,IQVIA,"Frankfurt, Hesse, Germany",2026-06-17,https://www.linkedin.com/jobs/view/4428481620 , ,li-4428481620,fulltime,,,,,,False,mid-senior level,Other,,,Hospitals and Health Care,https://www.linkedin.com/company/iqvia,,,,,,,,,,,
linkedin,Project Manager,The Resolute Group Ltd,,2026-06-17,https://www.linkedin.com/jobs/view/4429798620 , ,li-4429798620,fulltime,,,,,,False,mid-senior level,"Engineering, Design, and Consulting",,,Construction and Building Construction,https://uk.linkedin.com/company/resolute-grp,,,,,,,,,,,
linkedin,Project Manager (SAP),IgniteSAP,,2026-06-17,https://www.linkedin.com/jobs/view/4410577224 , ,li-4410577224,fulltime,,,,,,False,mid-senior level,Project Management and Information Technology,,,IT Services and IT Consulting,https://de.linkedin.com/company/ignitesap,,,,,,,,,,,
linkedin,Senior Project Manager,TrioTech Recruitment,"Bavaria, Germany",2026-06-17,https://www.linkedin.com/jobs/view/4429981265 , ,li-4429981265,fulltime,,,,,,False,mid-senior level,Project Management,,,Services for Renewable Energy,https://de.linkedin.com/company/triotech-recruitment-ltd,,,,,,,,,,,
linkedin,(Senior) Project Manager (m/w/d) Venues & Real Estate Development,CTS EVENTIM AG & Co. KGaA,"Bremen, Bremen, Germany",2026-06-17,https://www.linkedin.com/jobs/view/4400834632 , ,li-4400834632,fulltime,,,,,,False,associate,Project Management and Information Technology,,,Events Services,https://de.linkedin.com/company/cts-eventim-ag,,,,,,,,,,,
linkedin,Product / Project Design Manager,LBH Consultancy,"Berlin, Germany",2026-06-17,https://www.linkedin.com/jobs/view/4427331631 , ,li-4427331631,fulltime,,,,,,False,mid-senior level,Project Management,,,Real Estate and Architecture and Planning,https://uk.linkedin.com/company/lbh-consultancy,,,,,,,,,,,
linkedin,Data Center Project Development Manager,Delska,"Munich, Bavaria, Germany",2026-06-17,https://www.linkedin.com/jobs/view/4427357677 , ,li-4427357677,fulltime,,,,,,False,entry level,Project Management and Information Technology,,,Information Technology & Services,https://lv.linkedin.com/company/delska,,,,,,,,,,,
linkedin,Project Planner,Mercury,"Frankfurt, Hesse, Germany",2026-06-17,https://www.linkedin.com/jobs/view/4299038694 , ,li-4299038694,fulltime,,,,,,False,mid-senior level,Project Management and Information Technology,,,Construction,https://ie.linkedin.com/company/mercury-engineering,,,,,,,,,,,
linkedin,Bauprojektmanager (m/w/d) Großprojekte,BBBank eG,"Karlsruhe, Baden-Württemberg, Germany",2026-06-17,https://www.linkedin.com/jobs/view/4429929042 , ,li-4429929042,fulltime,,,,,,False,associate,Project Management,,,Banking and Financial Services,https://www.linkedin.com/company/bbbank-eg,,,,,,,,,,,
linkedin,Architectural Project Manager - Healthcare,LBH Consultancy,"Munich, Bavaria, Germany",2026-06-17,https://www.linkedin.com/jobs/view/4427320480 , ,li-4427320480,fulltime,,,,,,False,mid-senior level,Project Management,,,Architecture and Planning and Civil Engineering,https://uk.linkedin.com/company/lbh-consultancy,,,,,,,,,,,
linkedin,(Senior) Project Manager (m/f/d) Venues & Real Estate Development,CTS EVENTIM AG & Co. KGaA,"Bremen, Bremen, Germany",2026-06-17,https://www.linkedin.com/jobs/view/4401639547 , ,li-4401639547,fulltime,,,,,,False,associate,Project Management and Information Technology,,,Events Services,https://de.linkedin.com/company/cts-eventim-ag,,,,,,,,,,,
linkedin,Senior Programme Manager,Vodafone,"Dresden, Saxony, Germany",2026-06-17,https://www.linkedin.com/jobs/view/4427370049 , ,li-4427370049,fulltime,,,,,,False,not applicable,Other,,,"Information Services, IT Services and IT Consulting, and Telecommunications",https://uk.linkedin.com/company/vodafone,,,,,,,,,,,
linkedin,Projektmanager/Project Coordinator (m/w/d),Regio Kliniken GmbH,"Elmshorn, Schleswig-Holstein, Germany",2026-06-17,https://www.linkedin.com/jobs/view/4426875857 , ,li-4426875857,fulltime,,,,,,False,entry level,Project Management and Information Technology,,,Hospitals and Health Care,https://de.linkedin.com/company/regio-kliniken-gmbh,,,,,,,,,,,
linkedin,Projektkoordinator Auftragsabwicklung (m/w/d),MAURER SE,"Lünen, North Rhine-Westphalia, Germany",2026-06-17,https://www.linkedin.com/jobs/view/4419275246 , ,li-4419275246,fulltime,,,,,,False,not applicable,Other,,,Construction,https://de.linkedin.com/company/maurer-se,,,,,,,,,,,
linkedin,Projektkoordinator (m/w/d) Risikomanagement,Rheinmetall,"Hamburg, Hamburg, Germany",2026-06-17,https://www.linkedin.com/jobs/view/4427328011 , ,li-4427328011,fulltime,,,,,,False,mid-senior level,Other,,,Defense and Space Manufacturing,https://de.linkedin.com/company/rheinmetall,,,,,,,,,,,
linkedin,"Projektmanagerin / Projektmanager (m/w/d) für IT-Fachanwendungen, Referat IT-Entwicklung und Betrieb",GKV-Spitzenverband,"Berlin, Berlin, Germany",2026-06-17,https://www.linkedin.com/jobs/view/4429966488 , ,li-4429966488,fulltime,,,,,,False,associate,Information Technology,,,Public Health,https://de.linkedin.com/company/gkv-spitzenverband,,,,,,,,,,,
linkedin,Senior Project Manager Brands & Partnerships (m/w/d),PIERCE,"Berlin, Germany",2026-06-17,https://www.linkedin.com/jobs/view/4429510598 , ,li-4429510598,fulltime,,,,,,False,mid-senior level,Project Management and Information Technology,,,Advertising Services,https://de.linkedin.com/company/pierce-culture,,,,,,,,,,,
linkedin,Produktmanager:in Engineering – Berlin,Stadler,"Berlin, Berlin, Germany",2026-06-17,https://www.linkedin.com/jobs/view/4424077117 , ,li-4424077117,fulltime,,,,,,False,mid-senior level,Product Management and Marketing,,,Railroad Equipment Manufacturing,https://ch.linkedin.com/company/stadler-rail,,,,,,,,,,,
linkedin,Senior Project Manager,Intersnack Group,"Düsseldorf, North Rhine-Westphalia, Germany",2026-06-17,https://www.linkedin.com/jobs/view/4401730102 , ,li-4401730102,fulltime,,,,,,False,mid-senior level,Project Management and Information Technology,,,Food and Beverage Manufacturing,https://de.linkedin.com/company/intersnack-group,,,,,,,,,,,
linkedin,Product Sales Manager,Advantech Europe,,2026-06-17,https://www.linkedin.com/jobs/view/4428484947 , ,li-4428484947,fulltime,,,,,,False,mid-senior level,Sales and Product Management,,,Computer Hardware Manufacturing,https://nl.linkedin.com/company/advantech-europe,,,,,,,,,,,
linkedin,Land Development Metro Lead,Microsoft,"Frankfurt, Hesse, Germany",2026-06-17,https://www.linkedin.com/jobs/view/4429919546 , ,li-4429919546,fulltime,,,,,,False,not applicable,Information Technology,,,Software Development,https://www.linkedin.com/company/microsoft,,,,,,,,,,,
