site,title,company,location,date_posted,job_url,job_url_direct,id,job_type,salary_source,interval,min_amount,max_amount,currency,is_remote,job_level,job_function,listing_type,emails,company_industry,company_url,company_url_direct,company_addresses,company_num_employees,company_revenue,company_description,skills,experience_range,company_rating,company_reviews_count,vacancy_count,work_from_home_type
linkedin,Strategic Project & Client Operations Manager,Growably,"Cologne, North Rhine-Westphalia, Germany",2026-05-22,https://www.linkedin.com/jobs/view/4418155584 , ,li-4418155584,fulltime,,,,,,True,mid-senior level,Management and Manufacturing,,,Advertising Services,https://de.linkedin.com/company/growably,,,,,,,,,,,
linkedin,Document Controller,Winthrop Technologies,"Frankfurt am Main, Hesse, Germany",2026-05-22,https://www.linkedin.com/jobs/view/4321855136 , ,li-4321855136,fulltime,,,,,,False,mid-senior level,Administrative,,,Non-profit Organizations and Primary and Secondary Education,https://ie.linkedin.com/company/winthrop-technologies,,,,,,,,,,,
linkedin,Chief of Staff,Jobgether,,2026-05-22,https://www.linkedin.com/jobs/view/4417116759 , ,li-4417116759,fulltime,,,,,,True,mid-senior level,Administrative,,,Internet Marketplace Platforms,https://be.linkedin.com/company/jobgether,,,,,,,,,,,
linkedin,Enterprise Project Manager (f/m/d),Allianz Global Investors,"Munich, Bavaria, Germany",2026-05-22,https://www.linkedin.com/jobs/view/4418178559 , ,li-4418178559,fulltime,,,,,,False,mid-senior level,Project Management and Information Technology,,recruiting@allianzgi.com,Financial Services and Insurance,https://www.linkedin.com/company/allianz-global-investors,,,,,,,,,,,
linkedin,Enterprise Project Manager (f/m/d),Allianz Global Investors,"Frankfurt, Hesse, Germany",2026-05-22,https://www.linkedin.com/jobs/view/4418188439 , ,li-4418188439,fulltime,,,,,,False,mid-senior level,Project Management and Information Technology,,recruiting@allianzgi.com,Financial Services and Insurance,https://www.linkedin.com/company/allianz-global-investors,,,,,,,,,,,
linkedin,Senior Project Manager - Data Centre (Düsseldorf),Experts Group International,"Düsseldorf, North Rhine-Westphalia, Germany",2026-05-22,https://www.linkedin.com/jobs/view/4264720574 , ,li-4264720574,fulltime,,,,,,False,director,Project Management and Information Technology,,,Staffing and Recruiting,https://uk.linkedin.com/company/expertsgroupinternational,,,,,,,,,,,
linkedin,Technical Lead/Project Lead (m/f/x),Coherent Corp.,"Berlin, Berlin, Germany",2026-05-22,https://www.linkedin.com/jobs/view/4361121826 , ,li-4361121826,fulltime,,,,,,False,mid-senior level,Information Technology,,,Semiconductor Manufacturing,https://www.linkedin.com/company/coherent-corp,,,,,,,,,,,
linkedin,Liquidity Manager - Vice President,Nomura,"Frankfurt, Hesse, Germany",2026-05-22,https://www.linkedin.com/jobs/view/4417141671 , ,li-4417141671,fulltime,,,,,,False,mid-senior level,Finance,,,"Banking, Financial Services, and Investment Management",https://jp.linkedin.com/company/nomura,,,,,,,,,,,
linkedin,Senior CRA - Phase I oncology trials - Hamburg/Berlin region,Syneos Health,"Munich, Bavaria, Germany",2026-05-22,https://www.linkedin.com/jobs/view/4418111654 , ,li-4418111654,fulltime,,,,,,True,mid-senior level,"Research, Analyst, and Information Technology",,,Biotechnology Research,https://www.linkedin.com/company/syneos-health,,,,,,,,,,,
linkedin,Fire Protection Construction Manager,Mercury,"Dresden, Saxony, Germany",2026-05-22,https://www.linkedin.com/jobs/view/4407697188 , ,li-4407697188,fulltime,,,,,,False,mid-senior level,Management and Manufacturing,,,Construction,https://ie.linkedin.com/company/mercury-engineering,,,,,,,,,,,
linkedin,Fully Remote Project Manager Agentic Ai,PST.AG,,2026-05-22,https://www.linkedin.com/jobs/view/4418151441 , ,li-4418151441,fulltime,,,,,,True,mid-senior level,Project Management and Information Technology,,,Software Development,https://de.linkedin.com/company/pst-ag,,,,,,,,,,,
linkedin,Senior Project Manager - Data Centre (Berlin),Experts Group International,"Berlin, Berlin, Germany",2026-05-22,https://www.linkedin.com/jobs/view/4247918514 , ,li-4247918514,fulltime,,,,,,False,mid-senior level,Project Management and Information Technology,,,Staffing and Recruiting,https://uk.linkedin.com/company/expertsgroupinternational,,,,,,,,,,,
linkedin,Line Manager - Product Design,Ericsson,"Kaiserslautern, Rhineland-Palatinate, Germany",2026-05-22,https://www.linkedin.com/jobs/view/4417184026 , ,li-4417184026,fulltime,,,,,,False,not applicable,Other,,,Telecommunications,https://se.linkedin.com/company/ericsson,,,,,,,,,,,
linkedin,Line Manager - Product Design,Ericsson,"Regensburg, Bavaria, Germany",2026-05-22,https://www.linkedin.com/jobs/view/4417166277 , ,li-4417166277,fulltime,,,,,,False,not applicable,Other,,,Telecommunications,https://se.linkedin.com/company/ericsson,,,,,,,,,,,
linkedin,Project Manager,Cognite,"Stuttgart, Baden-Württemberg, Germany",2026-05-22,https://www.linkedin.com/jobs/view/4346110063 , ,li-4346110063,fulltime,,,,,,False,mid-senior level,Project Management and Information Technology,,,"Construction, Software Development, and IT Services and IT Consulting",https://www.linkedin.com/company/cognitedata,,,,,,,,,,,
linkedin,EY-Parthenon Manager Strategy - Life Science (w/m/d),EY-Parthenon,"Hamburg, Hamburg, Germany",2026-05-22,https://www.linkedin.com/jobs/view/4385073751 , ,li-4385073751,fulltime,,,,,,False,mid-senior level,Business Development and Sales,,,Business Consulting and Services,https://uk.linkedin.com/company/ey-parthenon,,,,,,,,,,,
linkedin,Excavator Sales Manager,SANY Europe GmbH,,2026-05-22,https://www.linkedin.com/jobs/view/4404729727 , ,li-4404729727,fulltime,,,,,,False,mid-senior level,Sales,,,Machinery Manufacturing,https://de.linkedin.com/company/sany-europe-gmbh,,,,,,,,,,,
linkedin,(Senior) Manager - Capital Markets (f/m/d),EY,"Berlin, Berlin, Germany",2026-05-22,https://www.linkedin.com/jobs/view/4385084325 , ,li-4385084325,fulltime,,,,,,False,mid-senior level,Finance and Sales,,,Professional Services,https://uk.linkedin.com/company/ernstandyoung,,,,,,,,,,,
linkedin,Projektmanager (m/w/d),EWS Elektrizitätswerke Schönau eG,"Wembach, Baden-Württemberg, Germany",2026-05-22,https://www.linkedin.com/jobs/view/4418428845 , ,li-4418428845,fulltime,,,,,,False,entry level,Project Management and Information Technology,,,Renewable Energy Power Generation,https://de.linkedin.com/company/ews-elektrizit%C3%A4tswerke-sch%C3%B6nau-eg,,,,,,,,,,,
linkedin,Project Controls Engineer,IPS-Integrated Project Services,"Frankfurt, Hesse, Germany",2026-05-22,https://www.linkedin.com/jobs/view/4361361778 , ,li-4361361778,fulltime,,,,,,True,not applicable,Management and Manufacturing,,,Pharmaceutical Manufacturing,https://www.linkedin.com/company/ips,,,,,,,,,,,
linkedin,Project Site  Manager - electrical/data centres (m/w/d),Eaton,"Hamburg, Hamburg, Germany",2026-05-22,https://www.linkedin.com/jobs/view/4385019518 , ,li-4385019518,fulltime,,,,,,False,mid-senior level,Other,,,"Appliances, Electrical, and Electronics Manufacturing",https://ie.linkedin.com/company/eaton,,,,,,,,,,,
linkedin,Projektmanager (m/w/d),SLA Software Logistik Artland GmbH,"Quakenbrück, Lower Saxony, Germany",2026-05-22,https://www.linkedin.com/jobs/view/4418160290 , ,li-4418160290,fulltime,,,,,,False,mid-senior level,Project Management and Information Technology,,,Software Development,https://de.linkedin.com/company/sla-software-logistik-artland-gmbh,,,,,,,,,,,
linkedin,Project Sustainability Manager (m/f/d),NKT,"Cologne, North Rhine-Westphalia, Germany",2026-05-22,https://www.linkedin.com/jobs/view/4417198442 , ,li-4417198442,fulltime,,,,,,False,associate,Other,,kevin.strack@nkt.com,"Appliances, Electrical, and Electronics Manufacturing, Oil and Gas, and Renewable Energy Semiconductor Manufacturing",https://dk.linkedin.com/company/nkt-cables,,,,,,,,,,,
linkedin,Projektmanager Installation & Inbetriebnahme – Railway (all gender),ALTEN Germany,"Berlin, Berlin, Germany",2026-05-22,https://www.linkedin.com/jobs/view/4417122186 , ,li-4417122186,fulltime,,,,,,False,associate,Engineering,,,IT Services and IT Consulting,https://de.linkedin.com/company/altengermany,,,,,,,,,,,
linkedin,Director Program Governance & Planning (m/f/d),DHL Express,"Bonn, North Rhine-Westphalia, Germany",2026-05-22,https://www.linkedin.com/jobs/view/4418411640 , ,li-4418411640,fulltime,,,,,,False,mid-senior level,Administrative,,,"Transportation, Logistics, Supply Chain and Storage",https://de.linkedin.com/company/dhlexpress,,,,,,,,,,,
linkedin,Projektmanager Installation & Inbetriebnahme – Railway (all gender),ALTEN,"Berlin, Berlin, Germany",2026-05-22,https://www.linkedin.com/jobs/view/4414086682 , ,li-4414086682,fulltime,,,,,,False,associate,"Production, Distribution, and Engineering",,,Software Development and IT Services and IT Consulting,https://fr.linkedin.com/company/alten,,,,,,,,,,,
linkedin,Project Manager FTTH Rollout NE3 (m/w/d),metrofibre,"Düsseldorf, North Rhine-Westphalia, Germany",2026-05-22,https://www.linkedin.com/jobs/view/4414080463 , ,li-4414080463,fulltime,,,,,,False,entry level,Project Management,,,Telecommunications,https://de.linkedin.com/company/metrofibre,,,,,,,,,,,
linkedin,Project & Client Growth Manager,eduBITES,"Berlin, Berlin, Germany",2026-05-22,https://www.linkedin.com/jobs/view/4414316594 , ,li-4414316594,fulltime,,,,,,False,associate,Project Management,,,Computer and Network Security,https://de.linkedin.com/company/edubites,,,,,,,,,,,
linkedin,Projektmanager :in Tooling Design (all gender),ALTEN Germany,"Augsburg, Bavaria, Germany",2026-05-22,https://www.linkedin.com/jobs/view/4417135192 , ,li-4417135192,fulltime,,,,,,False,associate,Project Management,,,Aviation and Aerospace Component Manufacturing,https://de.linkedin.com/company/altengermany,,,,,,,,,,,
linkedin,Project Manager - Pipeline,Tsebo Solutions Group,,2026-05-22,https://www.linkedin.com/jobs/view/4417117502 , ,li-4417117502,fulltime,,,,,,True,mid-senior level,Project Management and Information Technology,,,Facilities Services,https://za.linkedin.com/company/tsebo-solutions-group,,,,,,,,,,,
linkedin,Transition Manager - Germany,Infosys,"Frankfurt, Hesse, Germany",2026-05-22,https://www.linkedin.com/jobs/view/4380295570 , ,li-4380295570,fulltime,,,,,,False,mid-senior level,Business Development,,,IT Services and IT Consulting,https://in.linkedin.com/company/infosys,,,,,,,,,,,
linkedin,Program Manager – Operations Change – Associate (all genders),JPMorganChase,"Berlin, Berlin, Germany",2026-05-22,https://www.linkedin.com/jobs/view/4414054978 , ,li-4414054978,fulltime,,,,,,False,not applicable,Project Management and Information Technology,,,Financial Services,https://www.linkedin.com/company/jpmorganchase,,,,,,,,,,,
linkedin,Line Manager - Product Design,Ericsson,"Bonn, North Rhine-Westphalia, Germany",2026-05-22,https://www.linkedin.com/jobs/view/4417176139 , ,li-4417176139,fulltime,,,,,,False,not applicable,Other,,,Telecommunications,https://se.linkedin.com/company/ericsson,,,,,,,,,,,
linkedin,Product Marketing Manager (all genders),JPMorganChase,"Berlin, Berlin, Germany",2026-05-22,https://www.linkedin.com/jobs/view/4414050955 , ,li-4414050955,fulltime,,,,,,False,not applicable,Marketing and Sales,,,Financial Services,https://www.linkedin.com/company/jpmorganchase,,,,,,,,,,,
linkedin,Senior Project Manager EMEA M/F/D,Planon,,2026-05-22,https://www.linkedin.com/jobs/view/4418147852 , ,li-4418147852,fulltime,,,,,,False,mid-senior level,Project Management and Information Technology,,,"IT Services and IT Consulting, Software Development, and Information Services",https://nl.linkedin.com/company/planon,,,,,,,,,,,
linkedin,Product Manager - AI Healthcare,Jobgether,,2026-05-22,https://www.linkedin.com/jobs/view/4414059894 , ,li-4414059894,fulltime,,,,,,True,mid-senior level,Product Management and Marketing,,,Internet Marketplace Platforms,https://be.linkedin.com/company/jobgether,,,,,,,,,,,
linkedin,Technical Product Manager - Messaging,Retarus,"Munich, Bavaria, Germany",2026-05-22,https://www.linkedin.com/jobs/view/4418072976 , ,li-4418072976,fulltime,,,,,,False,director,Product Management and Strategy/Planning,,Felix.Gansmeier@retarus.de,IT Services and IT Consulting,https://de.linkedin.com/company/retarus,,,,,,,,,,,
linkedin,Product Growth Manager – Wertgutachten (m/w/d),Instaffo,"Cologne, North Rhine-Westphalia, Germany",2026-05-22,https://www.linkedin.com/jobs/view/4409133474 , ,li-4409133474,fulltime,,,,,,False,mid-senior level,Product Management and Management,,,IT Services and IT Consulting,https://de.linkedin.com/company/instaffo-gmbh,,,,,,,,,,,
linkedin,Senior Supplier Quality Manager (gn),Grafton Recruitment,"Hamburg, Germany",2026-05-22,https://www.linkedin.com/jobs/view/4381768272 , ,li-4381768272,fulltime,,,,,,False,associate,Quality Assurance,,,Medical Equipment Manufacturing,https://it.linkedin.com/company/grafton-recruitment,,,,,,,,,,,
linkedin,"Senior Product Manager (Remote, Stuttgart, DE)",Parking Network B.V.,"Stuttgart, Baden-Württemberg, Germany",2026-05-22,https://www.linkedin.com/jobs/view/4418137851 , ,li-4418137851,fulltime,,,,,,True,mid-senior level,Product Management and Marketing,,,Advertising Services,https://nl.linkedin.com/company/parking-network,,,,,,,,,,,
linkedin,Technical OEM Manager (all genders),gridX,"Aachen, North Rhine-Westphalia, Germany",2026-05-22,https://www.linkedin.com/jobs/view/4409006230 , ,li-4409006230,fulltime,,,,,,True,entry level,Engineering and Information Technology,,,"Technology, Information and Internet",https://de.linkedin.com/company/gridx,,,,,,,,,,,
linkedin,Sr. Product Manager - Satellite Data Systems (m/w/d),Rheinmetall,"Munich, Bavaria, Germany",2026-05-22,https://www.linkedin.com/jobs/view/4414305746 , ,li-4414305746,fulltime,,,,,,False,mid-senior level,Product Management and Marketing,,,Defense and Space Manufacturing,https://de.linkedin.com/company/rheinmetall,,,,,,,,,,,
linkedin,Lead System Product Manager (d/f/m),Personio,"Munich, Bavaria, Germany",2026-05-22,https://www.linkedin.com/jobs/view/4406491956 , ,li-4406491956,fulltime,,,,,,True,mid-senior level,Product Management and Marketing,,,Software Development,https://de.linkedin.com/company/personio,,,,,,,,,,,
linkedin,Line Manager - Product Design,Ericsson,"Radeberg, Saxony, Germany",2026-05-22,https://www.linkedin.com/jobs/view/4417179134 , ,li-4417179134,fulltime,,,,,,False,not applicable,Other,,,Telecommunications,https://se.linkedin.com/company/ericsson,,,,,,,,,,,
linkedin,Line Manager - Product Design,Ericsson,"Stuttgart, Baden-Württemberg, Germany",2026-05-22,https://www.linkedin.com/jobs/view/4417176141 , ,li-4417176141,fulltime,,,,,,False,not applicable,Other,,,Telecommunications,https://se.linkedin.com/company/ericsson,,,,,,,,,,,
linkedin,SAP Agentic Product Owner,ADVICE Consulting,"Hamburg, Hamburg, Germany",2026-05-22,https://www.linkedin.com/jobs/view/4418103580 , ,li-4418103580,fulltime,,,,,,False,associate,Product Management and Information Technology,,,"Oil and Coal Product Manufacturing, Chemical Raw Materials Manufacturing, and Transportation, Logistics, Supply Chain and Storage",https://de.linkedin.com/company/advice-consulting-gmbh-co-kg,,,,,,,,,,,
linkedin,Product Manager (Services),autarc (YC S24),"Berlin, Berlin, Germany",2026-05-22,https://www.linkedin.com/jobs/view/4414310691 , ,li-4414310691,fulltime,,,,,,False,associate,Marketing and Product Management,,,Software Development,https://de.linkedin.com/company/autarc-energy,,,,,,,,,,,
linkedin,Project Manager,IPS-Integrated Project Services,"Frankfurt, Hesse, Germany",2026-05-22,https://www.linkedin.com/jobs/view/4377861311 , ,li-4377861311,fulltime,,,,,,False,not applicable,Project Management and Information Technology,,,Pharmaceutical Manufacturing,https://www.linkedin.com/company/ips,,,,,,,,,,,
linkedin,Project Manager,Cognite,"Düsseldorf, North Rhine-Westphalia, Germany",2026-05-22,https://www.linkedin.com/jobs/view/4345908395 , ,li-4345908395,fulltime,,,,,,False,mid-senior level,Project Management and Information Technology,,,"Construction, Software Development, and IT Services and IT Consulting",https://www.linkedin.com/company/cognitedata,,,,,,,,,,,
linkedin,Junior Project Manager Engineering (m/w/d),RIMOWA,"Cologne, North Rhine-Westphalia, Germany",2026-05-22,https://www.linkedin.com/jobs/view/4409021562 , ,li-4409021562,fulltime,,,,,,False,entry level,Project Management and Information Technology,,,Retail Luxury Goods and Jewelry,https://de.linkedin.com/company/rimowa,,,,,,,,,,,
linkedin,Project Manager,Fever,"Berlin, Berlin, Germany",2026-05-22,https://www.linkedin.com/jobs/view/4385461622 , ,li-4385461622,fulltime,,,,,,True,mid-senior level,Project Management and Information Technology,,,Software Development,https://www.linkedin.com/company/fever-up,,,,,,,,,,,
linkedin,Project Manager,Haystack,,2026-05-22,https://www.linkedin.com/jobs/view/4417122955 , ,li-4417122955,fulltime,,,,,,False,mid-senior level,Project Management,,,"Technology, Information and Internet",https://uk.linkedin.com/company/wearehaystack,,,,,,,,,,,
linkedin,Delivery Manager,Allego,"Berlin, Berlin, Germany",2026-05-22,https://www.linkedin.com/jobs/view/4414362341 , ,li-4414362341,fulltime,,,,,,False,mid-senior level,Management and Manufacturing,,,Services for Renewable Energy,https://nl.linkedin.com/company/allego,,,,,,,,,,,
linkedin,Project Manager (all genders),TeamViewer,"Stuttgart, Baden-Württemberg, Germany",2026-05-22,https://www.linkedin.com/jobs/view/4409002865 , ,li-4409002865,fulltime,,,,,,False,mid-senior level,Project Management and Information Technology,,,Software Development,https://de.linkedin.com/company/teamviewer,,,,,,,,,,,
linkedin,Senior Project Lead,g2 Recruitment,"Hamburg, Germany",2026-05-22,https://www.linkedin.com/jobs/view/4418121927 , ,li-4418121927,contract,,,,,,False,mid-senior level,"Project Management, Engineering, and Quality Assurance",,,"Services for Renewable Energy, Construction, and Engineering Services",https://de.linkedin.com/company/g2-recruitment-solutions,,,,,,,,,,,
linkedin,Product Manager (f/m/d) Specialties,Jungbunzlauer,"Ladenburg, Baden-Württemberg, Germany",2026-05-21,https://www.linkedin.com/jobs/view/4417740585 , ,li-4417740585,fulltime,,,,,,False,mid-senior level,Product Management and Marketing,,,Biotechnology,https://ch.linkedin.com/company/jungbunzlauer,,,,,,,,,,,
linkedin,Senior Consultant / Manager (w/m/d) Pricing & Commercial Excellence – auch in Teilzeit (80 %) möglich,Horváth,"Hamburg, Hamburg, Germany",2026-05-21,https://www.linkedin.com/jobs/view/4414026957 , ,li-4414026957,fulltime,,,,,,True,mid-senior level,Management and Consulting,,,Business Consulting and Services,https://de.linkedin.com/company/horvathpartners,,,,,,,,,,,
linkedin,Junior Account Manager Platform Partnerships (m/f/d),Adsquare,"Berlin, Germany",2026-05-21,https://www.linkedin.com/jobs/view/4413665514 , ,li-4413665514,fulltime,,,,,,True,associate,Advertising and Accounting/Auditing,,,Software Development and Advertising Services,https://de.linkedin.com/company/adsquare-gmbh,,,,,,,,,,,
linkedin,Manager / Senior Manager Transaction Advisory Services (m/w/d),RSM Ebner Stolz,"Frankfurt am Main, Hesse, Germany",2026-05-21,https://www.linkedin.com/jobs/view/4360762939 , ,li-4360762939,fulltime,,,,,,False,mid-senior level,Finance and Sales,,,Professional Services,https://de.linkedin.com/company/rsm-ebner-stolz,,,,,,,,,,,
linkedin,NPI - Product Technical Expert (m/f/d) - for semiconductor industry,Applied Materials Europe,"Heimstetten, Bavaria, Germany",2026-05-21,https://www.linkedin.com/jobs/view/4406086670 , ,li-4406086670,fulltime,,,,,,False,not applicable,Sales and Business Development,,,"Appliances, Electrical, and Electronics Manufacturing, Nanotechnology Research, and Semiconductor Manufacturing",https://nl.linkedin.com/company/applied-materials-europe,,,,,,,,,,,
linkedin,Product Manager – Underground CAS Portfolio,Hexagon Mining,"Aachen, North Rhine-Westphalia, Germany",2026-05-21,https://www.linkedin.com/jobs/view/4417772168 , ,li-4417772168,fulltime,,,,,,True,mid-senior level,Product Management and Marketing,,,Information Technology & Services,https://www.linkedin.com/company/hexagon-mining,,,,,,,,,,,
linkedin,Product Manager - Energy Management (all genders),reev,"Munich, Bavaria, Germany",2026-05-21,https://www.linkedin.com/jobs/view/4416547468 , ,li-4416547468,fulltime,,,,,,False,associate,Product Management,,,Software Development and Energy Technology,https://de.linkedin.com/company/reevmobility,,,,,,,,,,,
linkedin,Principal Product Manager - iGaming & Gambling Ecosystem,Paysafe,"Berlin, Berlin, Germany",2026-05-21,https://www.linkedin.com/jobs/view/4395990546 , ,li-4395990546,fulltime,,,,,,True,not applicable,"Business Development, Information Technology, and Product Management",,,"Technology, Information and Internet, IT Services and IT Consulting, and Financial Services",https://uk.linkedin.com/company/paysafe,,,,,,,,,,,
linkedin,SAP QM Consultant,iTrust Partnering,,2026-05-21,https://www.linkedin.com/jobs/view/4413679243 , ,li-4413679243,contract,,,,,,False,mid-senior level,Information Technology,,,IT Services and IT Consulting,https://de.linkedin.com/company/itrust-partnering,,,,,,,,,,,
linkedin,Technical Product Manager- Analytics,LivePerson,"Berlin, Berlin, Germany",2026-05-21,https://www.linkedin.com/jobs/view/4398659080 , ,li-4398659080,fulltime,,,,,,True,mid-senior level,Product Management and Marketing,,-lp@liveperson.com,Software Development,https://www.linkedin.com/company/liveperson,,,,,,,,,,,
linkedin,Product Manager - Data Governance & Analytics Engineering,N26,"Berlin, Berlin, Germany",2026-05-21,https://www.linkedin.com/jobs/view/4408562928 , ,li-4408562928,fulltime,,,,,,True,mid-senior level,Product Management and Marketing,,,Financial Services,https://de.linkedin.com/company/n26,,,,,,,,,,,
linkedin,Logistic Lead in Regional Support Germany,Vattenfall,"Hamburg, Hamburg, Germany",2026-05-21,https://www.linkedin.com/jobs/view/4416518359 , ,li-4416518359,fulltime,,,,,,False,mid-senior level,Other,,"florian.gerres@vattenfall.de, .domschke@vattenfall.de",Utilities,https://se.linkedin.com/company/vattenfall,,,,,,,,,,,
linkedin,Senior Process Manager Customer Service - Polish market (all genders),BESTSECRET Group,"Munich, Bavaria, Germany",2026-05-21,https://www.linkedin.com/jobs/view/4374105166 , ,li-4374105166,fulltime,,,,,,False,mid-senior level,Other,,,Retail Apparel and Fashion,https://de.linkedin.com/company/bestsecret,,,,,,,,,,,
linkedin,Production Planner (m/f/d),ARX Robotics,"Munich, Bavaria, Germany",2026-05-21,https://www.linkedin.com/jobs/view/4406068007 , ,li-4406068007,fulltime,,,,,,False,mid-senior level,Management and Manufacturing,,,Defense and Space Manufacturing,https://de.linkedin.com/company/arx-robotics,,,,,,,,,,,
linkedin,Head of Customer Solutions – Digital Platform for Operational Excellence SaaS & Pharma Manufacturing (all genders),eschbach,"Bad Säckingen, Baden-Württemberg, Germany",2026-05-21,https://www.linkedin.com/jobs/view/4414004281 , ,li-4414004281,fulltime,,,,,,False,director,Marketing and Sales,,career@eschbach.com,Software Development,https://de.linkedin.com/company/eschbachit-gmbh,,,,,,,,,,,
linkedin,Senior Projekt Manager (w/m/d) Transition & Transformation (Shared Service),Siemens,"Munich, Bavaria, Germany",2026-05-21,https://www.linkedin.com/jobs/view/4416590686 , ,li-4416590686,fulltime,,,,,,False,mid-senior level,Project Management,,,Automation Machinery Manufacturing,https://de.linkedin.com/company/siemens,,,,,,,,,,,
linkedin,Senior Technical Project Manager (m/w/d),DIS AG,"Mannheim, Baden-Württemberg, Germany",2026-05-21,https://www.linkedin.com/jobs/view/4408793246 , ,li-4408793246,fulltime,,,,,,False,mid-senior level,Project Management and Information Technology,,,Utilities,https://de.linkedin.com/company/dis-ag,,,,,,,,,,,
linkedin,Technical Project Manager,Cambridge Aerospace,"Munich, Bavaria, Germany",2026-05-21,https://www.linkedin.com/jobs/view/4417481787 , ,li-4417481787,fulltime,,,,,,False,mid-senior level,"Project Management, Engineering, and Product Management",,,Defense and Space Manufacturing and Aviation and Aerospace Component Manufacturing,https://www.linkedin.com/company/cambridgeaerospace,,,,,,,,,,,
linkedin,Senior Operations Project Manager (m/w/d) in Hamburg oder Berlin,Digitas Germany,"Berlin, Berlin, Germany",2026-05-21,https://www.linkedin.com/jobs/view/4376082519 , ,li-4376082519,fulltime,,,,,,True,not applicable,Project Management and Information Technology,,,Advertising Services,https://www.linkedin.com/company/digitasgermany,,,,,,,,,,,
linkedin,Software Project Manager (m/f/d) - heart.ai,Abbott,"Munich, Bavaria, Germany",2026-05-21,https://www.linkedin.com/jobs/view/4414275908 , ,li-4414275908,fulltime,,,,,,False,mid-senior level,Research,,,Hospitals and Health Care,https://www.linkedin.com/company/abbott-,,,,,,,,,,,
linkedin,Project Manager (Consulting),Adobe,"Munich, Bavaria, Germany",2026-05-21,https://www.linkedin.com/jobs/view/4407031099 , ,li-4407031099,fulltime,,,,,,False,mid-senior level,Project Management and Information Technology,,accommodations@adobe.com,Software Development,https://www.linkedin.com/company/adobe,,,,,,,,,,,
linkedin,Product Manager | Core (m/f/d),Superchat,"Berlin, Berlin, Germany",2026-05-21,https://www.linkedin.com/jobs/view/4414009671 , ,li-4414009671,fulltime,,,,,,False,mid-senior level,Product Management,,,IT Services and IT Consulting,https://de.linkedin.com/company/superchatcom,,,,,,,,,,,
linkedin,Product Manager | Integrations (m/f/d),Superchat,"Berlin, Berlin, Germany",2026-05-21,https://www.linkedin.com/jobs/view/4417760802 , ,li-4417760802,fulltime,,,,,,False,mid-senior level,Product Management and Marketing,,,Software Development,https://de.linkedin.com/company/superchatcom,,,,,,,,,,,
