site,title,company,location,date_posted,job_url,job_url_direct,id,job_type,salary_source,interval,min_amount,max_amount,currency,is_remote,job_level,job_function,listing_type,emails,company_industry,company_url,company_url_direct,company_addresses,company_num_employees,company_revenue,company_description,skills,experience_range,company_rating,company_reviews_count,vacancy_count,work_from_home_type
linkedin,Project Director – Infrastructure Delivery,THRYVE,,2026-05-11,https://www.linkedin.com/jobs/view/4412761055 , ,li-4412761055,fulltime,,,,,,False,director,"Consulting, Strategy/Planning, and Quality Assurance",,,"Construction, Engines and Power Transmission Equipment Manufacturing, and Energy Technology",https://de.linkedin.com/company/thryvetalent,,,,,,,,,,,
linkedin,Senior Manager / Team Lead (m/f/d) Process Excellence - limited to 12 months,Hapag-Lloyd AG,"Hamburg, Hamburg, Germany",2026-05-11,https://www.linkedin.com/jobs/view/4412791628 , ,li-4412791628,fulltime,,,,,,True,mid-senior level,Project Management,,,"Transportation, Logistics, Supply Chain and Storage",https://de.linkedin.com/company/hapag-lloyd-ag,,,,,,,,,,,
linkedin,HR Project Manager (m/w/d) (befristet auf 12 Monate in Teilzeit),Hermes Germany GmbH,"Hamburg, Hamburg, Germany",2026-05-11,https://www.linkedin.com/jobs/view/4392460224 , ,li-4392460224,fulltime,,,,,,False,mid-senior level,Project Management and Information Technology,,,"Transportation, Logistics, Supply Chain and Storage",https://de.linkedin.com/company/hermes-germany-gmbh,,,,,,,,,,,
linkedin,"Senior Product Manager (Consumer Discovery, Agentic)",Delivery Hero,"Berlin, Berlin, Germany",2026-05-11,https://www.linkedin.com/jobs/view/4412905810 , ,li-4412905810,fulltime,,,,,,False,mid-senior level,Marketing and Product Management,,inclusion@deliveryhero.com,Software Development and IT Services and IT Consulting,https://de.linkedin.com/company/delivery-hero-se,,,,,,,,,,,
linkedin,Manager M&A – Corporate Development,Albert Cliff Limited,"Dortmund, North Rhine-Westphalia, Germany",2026-05-11,https://www.linkedin.com/jobs/view/4413083520 , ,li-4413083520,fulltime,,,,,,False,associate,Finance and Business Development,,,"Investment Banking, Venture Capital and Private Equity Principals, and Strategic Management Services",https://uk.linkedin.com/company/albert-cliff-limited,,,,,,,,,,,
linkedin,"Innovative Project Planner (Data Centres/Buildings/High-tech/Infrastructure) - Poland, Hungary, Romania, Czech Republic (Hybrid)",Laminar Projects,,2026-05-11,https://www.linkedin.com/jobs/view/4412768874 , ,li-4412768874,fulltime,,,,,,False,mid-senior level,Project Management and Information Technology,,,Construction,https://uk.linkedin.com/company/laminarprojects,,,,,,,,,,,
linkedin,Engineering Team Lead,Trust In SODA,"Berlin, Germany",2026-05-11,https://www.linkedin.com/jobs/view/4412669231 , ,li-4412669231,fulltime,,,,,,False,mid-senior level,Engineering,,,Internet Marketplace Platforms,https://uk.linkedin.com/company/trust-in-soda,,,,,,,,,,,
linkedin,Sr Technical Project Manager (m/f/d),The Walt Disney Company,"Papenburg, Lower Saxony, Germany",2026-05-11,https://www.linkedin.com/jobs/view/4412635881 , ,li-4412635881,fulltime,,,,,,False,mid-senior level,Project Management and Information Technology,,,Entertainment Providers,https://www.linkedin.com/company/the-walt-disney-company,,,,,,,,,,,
linkedin,B2B Senior Product Manager,Jobgether,,2026-05-11,https://www.linkedin.com/jobs/view/4412744062 , ,li-4412744062,fulltime,,,,,,True,mid-senior level,Product Management and Marketing,,,Internet Marketplace Platforms,https://be.linkedin.com/company/jobgether,,,,,,,,,,,
linkedin,Product Manager – US B2C Experience (m/f/d),Raisin,"Berlin, Berlin, Germany",2026-05-11,https://www.linkedin.com/jobs/view/4349654235 , ,li-4349654235,fulltime,,,,,,False,entry level,Product Management and Marketing,,,Financial Services,https://de.linkedin.com/company/join-raisin,,,,,,,,,,,
linkedin,Senior Product Manager (m/w/d),L'Oréal,"Düsseldorf, North Rhine-Westphalia, Germany",2026-05-11,https://www.linkedin.com/jobs/view/4407336853 , ,li-4407336853,fulltime,,,,,,False,not applicable,"Advertising, Marketing, and Other",,,Manufacturing and Personal Care Product Manufacturing,https://fr.linkedin.com/company/lor%C3%A9al,,,,,,,,,,,
linkedin,Talent Acquisition Consultant (m/w/d),NAXCON GROUP,"Bremen, Bremen, Germany",2026-05-11,https://www.linkedin.com/jobs/view/4412955952 , ,li-4412955952,fulltime,,,,,,False,mid-senior level,Human Resources,,,IT Services and IT Consulting,https://de.linkedin.com/company/naxcon,,,,,,,,,,,
linkedin,Senior Product Manager (f/m/d),NDI Europe GmbH,"Radolfzell, Baden-Württemberg, Germany",2026-05-11,https://www.linkedin.com/jobs/view/4413031763 , ,li-4413031763,fulltime,,,,,,False,mid-senior level,Product Management and Marketing,,,Medical Equipment Manufacturing,https://de.linkedin.com/company/ndi-europe-gmbh,,,,,,,,,,,
linkedin,Senior Product Manager,CoachHub - The digital coaching platform,,2026-05-11,https://www.linkedin.com/jobs/view/4413101678 , ,li-4413101678,fulltime,,,,,,True,mid-senior level,Product Management and Marketing,,,Professional Training and Coaching,https://de.linkedin.com/company/coachhub,,,,,,,,,,,
linkedin,Senior Product Manager,Littelfuse,"Frankfurt, Hesse, Germany",2026-05-11,https://www.linkedin.com/jobs/view/4355481263 , ,li-4355481263,fulltime,,,,,,False,mid-senior level,Product Management and Marketing,,,"Appliances, Electrical, and Electronics Manufacturing and Semiconductor Manufacturing",https://www.linkedin.com/company/littelfuse,,,,,,,,,,,
linkedin,Product Manager - Renewable Energy Platform (AI-Native) (m/w/d),Otark GmbH,,2026-05-11,https://www.linkedin.com/jobs/view/4412762352 , ,li-4412762352,fulltime,,,,,,True,mid-senior level,Product Management,,,Utilities,https://de.linkedin.com/company/otark,,,,,,,,,,,
linkedin,Produktmanager:in,BSI,"Munich, Bavaria, Germany",2026-05-11,https://www.linkedin.com/jobs/view/4412733717 , ,li-4412733717,fulltime,,,,,,False,associate,Strategy/Planning and Product Management,,,"IT System Custom Software Development, Software Development, and Insurance",https://ch.linkedin.com/company/bsi-software,,,,,,,,,,,
linkedin,Senior Produktmanager/in (remote) für Spiele und Kinderprodukte in schnell wachsendem Startup,Rabano (Papaya Art GmbH),,2026-05-11,https://www.linkedin.com/jobs/view/4412919158 , ,li-4412919158,fulltime,,,,,,True,mid-senior level,Product Management and Marketing,,,Retail Art Dealers,https://www.linkedin.com/company/papaya-art,,,,,,,,,,,
linkedin,Senior Product Manager (Kineto),JetBrains,"Munich, Bavaria, Germany",2026-05-11,https://www.linkedin.com/jobs/view/4413097280 , ,li-4413097280,fulltime,,,,,,False,mid-senior level,Product Management and Marketing,,,Software Development,https://nl.linkedin.com/company/jetbrains,,,,,,,,,,,
linkedin,Solution Owner Modern Workplace - Smart Collaboration (w/m/d),Bechtle,"Bonn, North Rhine-Westphalia, Germany",2026-05-11,https://www.linkedin.com/jobs/view/4413048937 , ,li-4413048937,fulltime,,,,,,False,mid-senior level,Sales and Business Development,,linda.stier@bechtle.com,IT Services and IT Consulting,https://de.linkedin.com/company/bechtle,,,,,,,,,,,
linkedin,SAP Produktmanager / Product Owner (w/m/d),Capitalheads a Kienbaum Company,"Bochum, North Rhine-Westphalia, Germany",2026-05-11,https://www.linkedin.com/jobs/view/4413031978 , ,li-4413031978,fulltime,,,,,,False,associate,Information Technology,,nk@capitalheads.de,"Electric Power Generation, Electric Power Transmission, Control, and Distribution, and Technology, Information and Media",https://de.linkedin.com/company/capitalheads-gmbh,,,,,,,,,,,
linkedin,Projekt- und Teamassistenz (m/w/d),Sonnentaler Photovoltaik,"Hildesheim, Lower Saxony, Germany",2026-05-11,https://www.linkedin.com/jobs/view/4412716308 , ,li-4412716308,fulltime,,,,,,False,entry level,Administrative,,,Utilities,https://de.linkedin.com/company/sonnentaler,,,,,,,,,,,
linkedin,ISSB Technical Staff - Project Lead | Industry,IFRS Foundation,"Frankfurt, Hesse, Germany",2026-05-11,https://www.linkedin.com/jobs/view/4360966661 , ,li-4360966661,fulltime,,,,,,False,mid-senior level,Accounting/Auditing and Other,,,"Financial Services, Capital Markets, and Accounting",https://uk.linkedin.com/company/ifrs-foundation,,,,,,,,,,,
linkedin,Team Lead E-Commerce Kijimea,Kijimea (SYNformulas GmbH),"Munich, Bavaria, Germany",2026-05-11,https://www.linkedin.com/jobs/view/4398206783 , ,li-4398206783,fulltime,,,,,,False,associate,Marketing,,,Biotechnology Research,https://de.linkedin.com/company/synformulas,,,,,,,,,,,
linkedin,Logistics Project Coordinator | Upto $70/hr Part-time,Mercor,"Berlin, Berlin, Germany",2026-05-11,https://www.linkedin.com/jobs/view/4412709040 , ,li-4412709040,parttime,description,hourly,55.0,70.0,USD,True,not applicable,Project Management and Information Technology,,support@mercor.com,Software Development,https://www.linkedin.com/company/mercor-ai,,,,,,,,,,,
linkedin,NPI Program Manager,Keysight Technologies,"Böblingen, Baden-Württemberg, Germany",2026-05-11,https://www.linkedin.com/jobs/view/4413056164 , ,li-4413056164,fulltime,,,,,,False,mid-senior level,Project Management,,,"Appliances, Electrical, and Electronics Manufacturing",https://www.linkedin.com/company/keysight-technologies,,,,,,,,,,,
linkedin,Change Manager/Project Manager Logistics - Bielefeld - Jobbird.com,Jobster,"Bielefeld, North Rhine-Westphalia, Germany",2026-05-11,https://www.linkedin.com/jobs/view/4412692841 , ,li-4412692841,fulltime,,,,,,False,mid-senior level,Project Management and Information Technology,,,Software Development,https://nl.linkedin.com/company/jobster-com,,,,,,,,,,,
linkedin,Project Director / Senior Projektleiter (w/m/d) EPCM Industry – Life Science und Pharma-Industrie,Drees & Sommer,"Cologne, North Rhine-Westphalia, Germany",2026-05-11,https://www.linkedin.com/jobs/view/4412901434 , ,li-4412901434,fulltime,,,,,,False,mid-senior level,Project Management,,,Real Estate,https://de.linkedin.com/company/drees-&-sommer,,,,,,,,,,,
linkedin,Project Director / Senior Projektleiter (w/m/d) EPCM Industry – Life Science und Pharma-Industrie,Drees & Sommer,"Munich, Bavaria, Germany",2026-05-11,https://www.linkedin.com/jobs/view/4412908149 , ,li-4412908149,fulltime,,,,,,False,mid-senior level,Project Management,,,Real Estate,https://de.linkedin.com/company/drees-&-sommer,,,,,,,,,,,
linkedin,Project Director / Senior Projektleiter (w/m/d) EPCM Industry – Life Science und Pharma-Industrie,Drees & Sommer,"Dresden, Saxony, Germany",2026-05-11,https://www.linkedin.com/jobs/view/4412794708 , ,li-4412794708,fulltime,,,,,,False,mid-senior level,Project Management,,,Real Estate,https://de.linkedin.com/company/drees-&-sommer,,,,,,,,,,,
linkedin,Project Director / Senior Projektleiter (w/m/d) EPCM Industry – Life Science und Pharma-Industrie,Drees & Sommer,"Berlin, Berlin, Germany",2026-05-11,https://www.linkedin.com/jobs/view/4412787969 , ,li-4412787969,fulltime,,,,,,False,mid-senior level,Project Management,,,Real Estate,https://de.linkedin.com/company/drees-&-sommer,,,,,,,,,,,
linkedin,"Project Leader or Principal, Operations - Service and Corporate Operations",Boston Consulting Group (BCG),"Munich, Bavaria, Germany",2026-05-11,https://www.linkedin.com/jobs/view/4323648621 , ,li-4323648621,fulltime,,,,,,False,mid-senior level,Project Management and Information Technology,,,Business Consulting and Services,https://www.linkedin.com/company/boston-consulting-group,,,,,,,,,,,
linkedin,Senior Project Manager (w/m/d),Capgemini,"Frankfurt am Main, Hesse, Germany",2026-05-11,https://www.linkedin.com/jobs/view/4387283270 , ,li-4387283270,fulltime,,,,,,False,mid-senior level,Project Management and Information Technology,,career.de@capgemini.com,IT Services and IT Consulting,https://fr.linkedin.com/company/capgemini,,,,,,,,,,,
linkedin,Technical Project Manager (m/w/d),elbkapitäne,"Hamburg, Germany",2026-05-11,https://www.linkedin.com/jobs/view/4412935558 , ,li-4412935558,fulltime,,,,,,False,associate,Project Management,,,"Technology, Information and Internet",https://de.linkedin.com/company/elbkapitaene,,,,,,,,,,,
linkedin,Senior Project Manager (f/m/d),eleQtron,"Siegen, North Rhine-Westphalia, Germany",2026-05-11,https://www.linkedin.com/jobs/view/4388337449 , ,li-4388337449,fulltime,,,,,,False,not applicable,Project Management and Information Technology,,,Business Consulting and Services,https://de.linkedin.com/company/eleqtron-qc,,,,,,,,,,,
linkedin,Senior Events & Projects Manager (f/m/d),Mytheresa,"Munich, Bavaria, Germany",2026-05-11,https://www.linkedin.com/jobs/view/4412938779 , ,li-4412938779,fulltime,,,,,,False,mid-senior level,Project Management and Information Technology,,,Retail Luxury Goods and Jewelry,https://de.linkedin.com/company/mytheresa-com,,,,,,,,,,,
linkedin,"Project Leader or Principal, Operations - Service and Corporate Operations",Boston Consulting Group (BCG),"Frankfurt, Hesse, Germany",2026-05-11,https://www.linkedin.com/jobs/view/4323518891 , ,li-4323518891,fulltime,,,,,,False,mid-senior level,Project Management and Information Technology,,,Business Consulting and Services,https://www.linkedin.com/company/boston-consulting-group,,,,,,,,,,,
linkedin,Solution and Project Quality Manager EMEA,Dematic,"Heusenstamm, Hesse, Germany",2026-05-11,https://www.linkedin.com/jobs/view/4412759370 , ,li-4412759370,fulltime,,,,,,False,director,Quality Assurance,,,"Transportation, Logistics, Supply Chain and Storage",https://www.linkedin.com/company/dematic,,,,,,,,,,,
linkedin,Projektmanager/Projektleiter für Life Science EPCM-Projekte (m/w/d),CRB,"Stuttgart, Baden-Württemberg, Germany",2026-05-11,https://www.linkedin.com/jobs/view/4413051323 , ,li-4413051323,fulltime,,,,,,False,mid-senior level,Engineering,,,Architecture and Planning,https://www.linkedin.com/company/crbgrp,,,,,,,,,,,
linkedin,Commissioning Manager,JAM,,2026-05-11,https://www.linkedin.com/jobs/view/4412743197 , ,li-4412743197,contract,,,,,,False,associate,"Management, Project Management, and Consulting",,,"Staffing and Recruiting, Construction, and Building Construction",https://uk.linkedin.com/company/jam-recruitment,,,,,,,,,,,
linkedin,Senior FP&A Manager (m/f/d),DataGuard,"Berlin, Germany",2026-05-11,https://www.linkedin.com/jobs/view/4401073776 , ,li-4401073776,fulltime,,,,,,False,associate,Finance,,,IT Services and IT Consulting,https://de.linkedin.com/company/dataguard1,,,,,,,,,,,
linkedin,Senior Consultant / Project Manager Marketing & Media Procurement (f/m/d),Inverto | A BCG Company,"Munich, Bavaria, Germany",2026-05-11,https://www.linkedin.com/jobs/view/4312123872 , ,li-4312123872,fulltime,,,,,,False,mid-senior level,Project Management and Information Technology,,,Business Consulting and Services,https://de.linkedin.com/company/inverto-gmbh,,,,,,,,,,,
linkedin,Senior Operations Program Manager,THRYVE,,2026-05-11,https://www.linkedin.com/jobs/view/4412738942 , ,li-4412738942,fulltime,,,,,,False,director,"Consulting, Strategy/Planning, and Quality Assurance",,,"Construction, Engines and Power Transmission Equipment Manufacturing, and Energy Technology",https://de.linkedin.com/company/thryvetalent,,,,,,,,,,,
linkedin,Senior Service Delivery Manager Global Real Estate Projects (d/m/w),Deutsche Bank,"Frankfurt, Hesse, Germany",2026-05-11,https://www.linkedin.com/jobs/view/4385581832 , ,li-4385581832,fulltime,,,,,,False,not applicable,Project Management and Information Technology,,,Financial Services,https://de.linkedin.com/company/deutsche-bank,,,,,,,,,,,
linkedin,Technical Project Manager QVAC,Jobgether,,2026-05-11,https://www.linkedin.com/jobs/view/4412770015 , ,li-4412770015,fulltime,,,,,,True,mid-senior level,Project Management and Information Technology,,,Internet Marketplace Platforms,https://be.linkedin.com/company/jobgether,,,,,,,,,,,
linkedin,Project Manager,Airswift,"Munich, Bavaria, Germany",2026-05-11,https://www.linkedin.com/jobs/view/4412760900 , ,li-4412760900,contract,,,,,,False,mid-senior level,Project Management,,,Construction,https://www.linkedin.com/company/airswift,,,,,,,,,,,
linkedin,Enterprise Project Manager,Jobgether,,2026-05-11,https://www.linkedin.com/jobs/view/4412700523 , ,li-4412700523,fulltime,,,,,,True,mid-senior level,Project Management and Information Technology,,,Internet Marketplace Platforms,https://be.linkedin.com/company/jobgether,,,,,,,,,,,
linkedin,Project Management Office (PMO) Manager (f/m/d) - Europe & Africa Region,Siemens Energy,"Erlangen, Bavaria, Germany",2026-05-11,https://www.linkedin.com/jobs/view/4413085995 , ,li-4413085995,fulltime,,,,,,True,associate,Project Management,,,"Appliances, Electrical, and Electronics Manufacturing",https://www.linkedin.com/company/siemens-energy,,,,,,,,,,,
linkedin,Project Program Director,THRYVE,,2026-05-11,https://www.linkedin.com/jobs/view/4412741885 , ,li-4412741885,fulltime,,,,,,False,director,"Consulting, Strategy/Planning, and Quality Assurance",,,"Construction, Engines and Power Transmission Equipment Manufacturing, and Energy Technology",https://de.linkedin.com/company/thryvetalent,,,,,,,,,,,
linkedin,Senior Project Manager SAP (m/w/d),Atos,,2026-05-11,https://www.linkedin.com/jobs/view/4352300938 , ,li-4352300938,fulltime,,,,,,False,not applicable,Project Management and Information Technology,,,Computer and Network Security and IT Services and IT Consulting,https://fr.linkedin.com/company/atos,,,,,,,,,,,
linkedin,(Senior) Manager - SAP S/4HANA Product Cycle Management with PLM Cloud (m/w/d) in Hamburg,Deloitte,"Hamburg, Hamburg, Germany",2026-05-10,https://www.linkedin.com/jobs/view/4349834091 , ,li-4349834091,fulltime,,,,,,True,mid-senior level,Consulting and Information Technology,,career@deloitte.de,Business Consulting and Services,https://www.linkedin.com/company/deloitte,,,,,,,,,,,
linkedin,Senior Manager Global Go-To-Market Operations (18 months limited),PUMA Group,"Herzogenaurach, Bavaria, Germany",2026-05-10,https://www.linkedin.com/jobs/view/4372757925 , ,li-4372757925,fulltime,,,,,,False,mid-senior level,Sales and Business Development,,,"Sporting Goods Manufacturing, Retail, and Retail Apparel and Fashion",https://de.linkedin.com/company/puma,,,,,,,,,,,
linkedin,Product Manager (m/w/d),A11,"Berlin, Berlin, Germany",2026-05-10,https://www.linkedin.com/jobs/view/4377491863 , ,li-4377491863,fulltime,,,,,,False,associate,Product Management and Consulting,,,Business Consulting and Services,https://de.linkedin.com/company/a11-global,,,,,,,,,,,
linkedin,"Senior Product Manager, KAYAK4Business",KAYAK,"Berlin, Berlin, Germany",2026-05-10,https://www.linkedin.com/jobs/view/4382323110 , ,li-4382323110,fulltime,,,,,,False,mid-senior level,Product Management and Marketing,,,"Technology, Information and Internet",https://www.linkedin.com/company/kayak,,,,,,,,,,,
linkedin,Mechanical Construction Manager,Winthrop Technologies,"Frankfurt am Main, Hesse, Germany",2026-05-10,https://www.linkedin.com/jobs/view/4391711145 , ,li-4391711145,fulltime,,,,,,False,mid-senior level,Engineering,,,Non-profit Organizations and Primary and Secondary Education,https://ie.linkedin.com/company/winthrop-technologies,,,,,,,,,,,
linkedin,Project Engineering Manager,The Green Recruitment Company,,2026-05-10,https://www.linkedin.com/jobs/view/4412391126 , ,li-4412391126,fulltime,,,,,,True,mid-senior level,Engineering and Project Management,,,Services for Renewable Energy,https://uk.linkedin.com/company/the-green-recruitment-company,,,,,,,,,,,
linkedin,Senior Projektleitung Hochbau (all genders),apoprojekt,,2026-05-10,https://www.linkedin.com/jobs/view/4403965084 , ,li-4403965084,fulltime,,,,,,False,mid-senior level,Project Management and Information Technology,,-janin.zott@apoprojekt.de,Construction,https://de.linkedin.com/company/apoprojekt,,,,,,,,,,,
linkedin,(SENIOR) PROJECT MANAGER (M/W/D) IM BEREICH EVENT,follow red GmbH,"Stuttgart, Baden-Württemberg, Germany",2026-05-10,https://www.linkedin.com/jobs/view/4412570501 , ,li-4412570501,fulltime,,,,,,False,mid-senior level,Other,,,Professional Services,https://de.linkedin.com/company/followred-gmbh,,,,,,,,,,,
linkedin,Project Manager (m/f/d),Discovery Life Sciences,"Kassel, Hesse, Germany",2026-05-10,https://www.linkedin.com/jobs/view/4403840092 , ,li-4403840092,fulltime,,,,,,False,mid-senior level,Project Management and Information Technology,,,Biotechnology Research,https://www.linkedin.com/company/discoverylifesciences,,,,,,,,,,,
linkedin,Deals & Promotions Program Manager,Wolt,"Berlin, Berlin, Germany",2026-05-10,https://www.linkedin.com/jobs/view/4412377346 , ,li-4412377346,fulltime,,,,,,False,entry level,Project Management and Information Technology,,,Software Development,https://fi.linkedin.com/company/wolt-oy,,,,,,,,,,,
linkedin,Digital Campaign and Project Manager,Jobgether,,2026-05-10,https://www.linkedin.com/jobs/view/4412138076 , ,li-4412138076,fulltime,,,,,,True,mid-senior level,Project Management and Information Technology,,,Internet Marketplace Platforms,https://be.linkedin.com/company/jobgether,,,,,,,,,,,
linkedin,Project Lead Strategy Consulting (m/f/d),BASF,"Düsseldorf, North Rhine-Westphalia, Germany",2026-05-10,https://www.linkedin.com/jobs/view/4387083217 , ,li-4387083217,fulltime,,,,,,True,not applicable,"Consulting, Information Technology, and Sales",,jennifer.weiz@basf.com,Chemical Manufacturing and Plastics Manufacturing,https://de.linkedin.com/company/basf,,,,,,,,,,,
linkedin,Projektmanager/ Projektleiter im Bereich Retail Banking (m/w/d),Senacor Technologies,,2026-05-10,https://www.linkedin.com/jobs/view/4006016298 , ,li-4006016298,fulltime,,,,,,False,mid-senior level,Project Management and Information Technology,,-resources@senacor.com,IT Services and IT Consulting,https://de.linkedin.com/company/senacor-technologies,,,,,,,,,,,
linkedin,Projektmanager Support (m/w/d),Progroup AG,"Landau in der Pfalz, Rhineland-Palatinate, Germany",2026-05-10,https://www.linkedin.com/jobs/view/4393459344 , ,li-4393459344,fulltime,,,,,,False,mid-senior level,Project Management and Information Technology,,,Paper and Forest Product Manufacturing,https://de.linkedin.com/company/progroup-ag,,,,,,,,,,,
linkedin,Consulting Project Manager,Visa,"Frankfurt, Hesse, Germany",2026-05-10,https://www.linkedin.com/jobs/view/4404864540 , ,li-4404864540,fulltime,,,,,,True,mid-senior level,Project Management and Information Technology,,,IT Services and IT Consulting,https://www.linkedin.com/company/visa,,,,,,,,,,,
linkedin,Real Estate Analyst (w/m/d),shift development,"Berlin, Germany",2026-05-10,https://www.linkedin.com/jobs/view/4407719662 , ,li-4407719662,fulltime,,,,,,False,entry level,Sales and Management,,raphael.wowra@shiftdevelopment.de,Real Estate,https://de.linkedin.com/company/shiftdevelopment,,,,,,,,,,,
linkedin,Junior Research Consultant - DACH (m/f/d),Appinio,"Hamburg, Hamburg, Germany",2026-05-09,https://www.linkedin.com/jobs/view/4408786437 , ,li-4408786437,fulltime,,,,,,True,entry level,Research,,,"Technology, Information and Internet, Market Research, and Software Development",https://de.linkedin.com/company/appinio,,,,,,,,,,,
linkedin,IT Project Manager (m/f/d),Lotus GmbH & Co. KG,"Haiger, Hesse, Germany",2026-05-09,https://www.linkedin.com/jobs/view/4411925579 , ,li-4411925579,fulltime,,,,,,True,executive,Information Technology,,,IT Services and IT Consulting,https://de.linkedin.com/company/lotus-gmbh-&-co.-kg,,,,,,,,,,,
linkedin,Senior Programme Manager (m/w/d),Yorizon Cloud,,2026-05-09,https://www.linkedin.com/jobs/view/4400899872 , ,li-4400899872,fulltime,,,,,,False,mid-senior level,Administrative,,,IT Services and IT Consulting,https://de.linkedin.com/company/yorizon-cloud,,,,,,,,,,,
linkedin,(Senior) Project Manager BESS (f/m/d),Arcadis,"Munich, Bavaria, Germany",2026-05-09,https://www.linkedin.com/jobs/view/4363198278 , ,li-4363198278,fulltime,,,,,,False,mid-senior level,Other,,,Professional Services,https://nl.linkedin.com/company/arcadis,,,,,,,,,,,
linkedin,Lean Production Engineer - Airbus,ALTEN Germany,"Bremen, Germany",2026-05-09,https://www.linkedin.com/jobs/view/4412300627 , ,li-4412300627,fulltime,,,,,,False,associate,"Engineering, Production, and Manufacturing",,,Engineering Services and Aviation and Aerospace Component Manufacturing,https://de.linkedin.com/company/altengermany,,,,,,,,,,,
linkedin,Expert IT Project Manager (m/f/d),HUGO BOSS,"Metzingen, Baden-Württemberg, Germany",2026-05-09,https://www.linkedin.com/jobs/view/4403460933 , ,li-4403460933,fulltime,,,,,,True,mid-senior level,Information Technology,,,Retail Apparel and Fashion,https://de.linkedin.com/company/hugo-boss,,,,,,,,,,,
linkedin,(Senior) Project Manager Strategic Development China (m/w/d)*,SCHOTT,"Mainz, Rhineland-Palatinate, Germany",2026-05-09,https://www.linkedin.com/jobs/view/4411984889 , ,li-4411984889,fulltime,,,,,,False,mid-senior level,Project Management and Information Technology,,,"Glass, Ceramics and Concrete Manufacturing",https://de.linkedin.com/company/schott,,,,,,,,,,,
linkedin,Electrical Project Manager,Mercury,"Frankfurt, Hesse, Germany",2026-05-09,https://www.linkedin.com/jobs/view/4326226553 , ,li-4326226553,fulltime,,,,,,False,mid-senior level,Project Management and Information Technology,,,Construction,https://ie.linkedin.com/company/mercury-engineering,,,,,,,,,,,
linkedin,ICT Project Supervisors - Structured Cabling,Mercury,"Lower Saxony, Germany",2026-05-09,https://www.linkedin.com/jobs/view/4326268194 , ,li-4326268194,fulltime,,,,,,False,mid-senior level,Management and Manufacturing,,,Construction,https://ie.linkedin.com/company/mercury-engineering,,,,,,,,,,,
linkedin,Senior Project Engineer / Project Manager (m/f/d),"Stem, Inc.","Berlin, Berlin, Germany",2026-05-09,https://www.linkedin.com/jobs/view/4411370208 , ,li-4411370208,fulltime,,,,,,True,mid-senior level,Project Management and Information Technology,,,Software Development,https://www.linkedin.com/company/stem-inc,,,,,,,,,,,
