site,title,company,location,date_posted,job_url,job_url_direct,id,job_type,salary_source,interval,min_amount,max_amount,currency,is_remote,job_level,job_function,listing_type,emails,company_industry,company_url,company_url_direct,company_addresses,company_num_employees,company_revenue,company_description,skills,experience_range,company_rating,company_reviews_count,vacancy_count,work_from_home_type
linkedin,Team Lead Accounting (w/m/d) - Frankfurt - International,Paul Newstone,"Frankfurt, Hesse, Germany",2026-06-09,https://www.linkedin.com/jobs/view/4426328954 , ,li-4426328954,fulltime,,,,,,False,mid-senior level,"Finance, Accounting/Auditing, and Management",,,"Business Consulting and Services, Law Practice, and Accounting",https://ch.linkedin.com/company/paul-newstone,,,,,,,,,,,
linkedin,Project Management Internship,Deutsche Telekom,"Leipzig, Saxony, Germany",2026-06-08,https://www.linkedin.com/jobs/view/4425639629 , ,li-4425639629,internship,,,,,,False,internship,Project Management and Information Technology,,,Telecommunications,https://de.linkedin.com/company/telekom,,,,,,,,,,,
linkedin,Commercial Project Manager (w/m/d) nationales und internationales Projektgeschäft,Siemens,"Coblenz, Rhineland-Palatinate, Germany",2026-06-08,https://www.linkedin.com/jobs/view/4425261919 , ,li-4425261919,fulltime,,,,,,False,mid-senior level,Finance,,,Automation Machinery Manufacturing,https://de.linkedin.com/company/siemens,,,,,,,,,,,
linkedin,Project Manager Internal Projects (all genders),STARFACE GmbH,"Karlsruhe, Baden-Württemberg, Germany",2026-06-05,https://www.linkedin.com/jobs/view/4402865929 , ,li-4402865929,fulltime,,,,,,False,mid-senior level,Project Management and Information Technology,,,Telecommunications,https://de.linkedin.com/company/starface-gmbh,,,,,,,,,,,
linkedin,Head of International Service,ITP (International Talent Partnership),"Bavaria, Germany",2026-06-05,https://www.linkedin.com/jobs/view/4421139355 , ,li-4421139355,fulltime,,,,,,False,director,"Sales, Customer Service, and Management",,,"HVAC and Refrigeration Equipment Manufacturing, Wholesale Hardware, Plumbing, Heating Equipment, and Energy Technology",https://uk.linkedin.com/company/itp-international-talent-partnership,,,,,,,,,,,
linkedin,Senior/Staff Product Manager - Internal AI (d/f/m),Personio,"Munich, Bavaria, Germany",2026-06-05,https://www.linkedin.com/jobs/view/4421183640 , ,li-4421183640,fulltime,,,,,,True,mid-senior level,Product Management and Marketing,,,Software Development,https://de.linkedin.com/company/personio,,,,,,,,,,,
linkedin,Working Student Project Management Office (m/f/d),IFCO SYSTEMS,"Munich, Bavaria, Germany",,https://www.linkedin.com/jobs/view/4426073331 , ,li-4426073331,parttime,,,,,,False,internship,Education and Training,,,"Transportation, Logistics, Supply Chain and Storage",https://de.linkedin.com/company/ifco-systems,,,,,,,,,,,
linkedin,Internship: Project Management Office / PMO Analyst (m/f/d),deltaVision - fluid control & aerospace,"Munich, Bavaria, Germany",,https://www.linkedin.com/jobs/view/4423147234 , ,li-4423147234,internship,,,,,,False,internship,Project Management,,,Aviation and Aerospace Component Manufacturing,https://de.linkedin.com/company/deltavision-fluid-control-aerospace,,,,,,,,,,,
