site,title,company,location,date_posted,job_url,job_url_direct,id,job_type,salary_source,interval,min_amount,max_amount,currency,is_remote,job_level,job_function,listing_type,emails,company_industry,company_url,company_url_direct,company_addresses,company_num_employees,company_revenue,company_description,skills,experience_range,company_rating,company_reviews_count,vacancy_count,work_from_home_type
linkedin,Program Manager - Executive Programs [Event Manager / Project Manager],ESMT Berlin,"Berlin, Germany",2026-05-20,https://www.linkedin.com/jobs/view/4417305547 , ,li-4417305547,fulltime,,,,,,True,associate,"Project Management, Management, and Administrative",,,Events Services and Education Administration Programs,https://de.linkedin.com/school/esmt/,,,,,,,,,,,
linkedin,Sales Development Representative (m/w/d),contagi,,2026-05-20,https://www.linkedin.com/jobs/view/4416173028 , ,li-4416173028,fulltime,,,,,,True,associate,Business Development and Sales,,,"Software Development, IT System Custom Software Development, and IT Services and IT Consulting",https://de.linkedin.com/company/contagi,,,,,,,,,,,
linkedin,Customer Care & Support Specialist (m/f/d) - EV Charging,Plenitude,"Hamburg, Germany",2026-05-20,https://www.linkedin.com/jobs/view/4393993198 , ,li-4393993198,fulltime,,,,,,True,entry level,Administrative and General Business,,,"Services for Renewable Energy, Electric Power Transmission, Control, and Distribution, and Energy Technology",https://www.linkedin.com/company/eni-plenitude,,,,,,,,,,,
linkedin,Kaufm. Projektkoordinator/-in (m/w/d),SÜD-HANSA GmbH & Co. KG,"Munich, Bavaria, Germany",2026-05-20,https://www.linkedin.com/jobs/view/4417084417 , ,li-4417084417,fulltime,,,,,,False,entry level,Administrative,,,Construction,https://de.linkedin.com/company/s%C3%BCd-hansa-gmbh-co-kg,,,,,,,,,,,
linkedin,Team Lead Customer Onboarding & Support (all genders),lawpilots,"Berlin, Berlin, Germany",2026-05-20,https://www.linkedin.com/jobs/view/4413394567 , ,li-4413394567,fulltime,,,,,,True,associate,Customer Service,,,Software Development,https://de.linkedin.com/company/lawpilots,,,,,,,,,,,
linkedin,Project Manager – IT Infrastructure & Platform Projects EA- 1328,NAXCON GROUP,"Bonn, North Rhine-Westphalia, Germany",2026-05-20,https://www.linkedin.com/jobs/view/4417396047 , ,li-4417396047,fulltime,,,,,,True,mid-senior level,Information Technology,,,IT Services and IT Consulting,https://de.linkedin.com/company/naxcon,,,,,,,,,,,
linkedin,IT Project Manager – Enterprise Data & Compliance,Interval Group,,2026-05-20,https://www.linkedin.com/jobs/view/4417354059 , ,li-4417354059,contract,,,,,,True,mid-senior level,Information Technology,,,IT Services and IT Consulting,https://ie.linkedin.com/company/interval-group,,,,,,,,,,,
linkedin,Senior Project Manager,OXBO,,2026-05-20,https://www.linkedin.com/jobs/view/4417066645 , ,li-4417066645,fulltime,,,,,,True,mid-senior level,Project Management and Engineering,,,Services for Renewable Energy and Construction,https://uk.linkedin.com/company/oxbo-ltd,,,,,,,,,,,
linkedin,Senior Project Manager - KI-Implementierung (m/w/d),Lucid Labs,"Berlin, Berlin, Germany",2026-05-20,https://www.linkedin.com/jobs/view/4417372070 , ,li-4417372070,fulltime,,,,,,True,mid-senior level,Project Management,,,Software Development,https://de.linkedin.com/company/lucidlabs-official,,,,,,,,,,,
linkedin,Senior Project Manager,Mercury,"Frankfurt, Hesse, Germany",2026-05-20,https://www.linkedin.com/jobs/view/4327929927 , ,li-4327929927,fulltime,,,,,,False,mid-senior level,Project Management and Information Technology,,,Construction,https://ie.linkedin.com/company/mercury-engineering,,,,,,,,,,,
linkedin,Technischer Projektmanager / Projektcontroller (m/w/d) Ingenieurbau / Brückenbau Köln / Hamburg,Firmengruppe Max Bögl,"Cologne, North Rhine-Westphalia, Germany",2026-05-20,https://www.linkedin.com/jobs/view/4417336946 , ,li-4417336946,fulltime,,,,,,False,associate,"Project Management, Analyst, and Engineering",,,Construction,https://de.linkedin.com/company/firmengruppe-max-b%C3%B6gl,,,,,,,,,,,
linkedin,Senior SAP-Projektleiter m/w/d,TEAG Thüringer Energie AG,"Erfurt, Thuringia, Germany",2026-05-20,https://www.linkedin.com/jobs/view/4375342575 , ,li-4375342575,fulltime,,,,,,False,mid-senior level,Project Management and Information Technology,,,Utilities,https://de.linkedin.com/company/teag,,,,,,,,,,,
linkedin,Head of Finance (m/f/d),EIT RawMaterials,"Berlin, Berlin, Germany",2026-05-20,https://www.linkedin.com/jobs/view/4416174632 , ,li-4416174632,fulltime,,,,,,False,director,Finance and Sales,,,Mining,https://de.linkedin.com/company/eit-raw-materials,,,,,,,,,,,
linkedin,"Referent - Wirtschaftsingenieur, Ingenieur Fachrichtung Elektrotechnik, Energietechnik, Energiewirtschaft o. ä. (m/w/d) Technik und Entwicklung - Energieversorger",Elektrizitätswerk Mittelbaden AG & Co. KG,"Offenburg, Baden-Württemberg, Germany",2026-05-20,https://www.linkedin.com/jobs/view/4417009773 , ,li-4417009773,fulltime,,,,,,False,mid-senior level,Other,,,Utilities,https://www.linkedin.com/company/elektrizit%C3%A3%C2%A4tswerk-mittelbaden-ag-&-co-kg,,,,,,,,,,,
linkedin,(Senior-) Projektleiter:in Zukunftsbahnhöfe und Hochleistungskorridore,Deutsche Bahn,"Karlsruhe, Baden-Württemberg, Germany",2026-05-20,https://www.linkedin.com/jobs/view/4386729104 , ,li-4386729104,fulltime,,,,,,False,mid-senior level,Information Technology,,,Truck Transportation,https://de.linkedin.com/company/deutschebahn,,,,,,,,,,,
linkedin,Senior Manager - Strategic Project Management,N26,"Berlin, Berlin, Germany",2026-05-20,https://www.linkedin.com/jobs/view/4417331853 , ,li-4417331853,fulltime,,,,,,True,mid-senior level,Project Management and Information Technology,,,Financial Services,https://de.linkedin.com/company/n26,,,,,,,,,,,
linkedin,Senior Projekt Marketing Manager (m/w/d),HKCM,,2026-05-19,https://www.linkedin.com/jobs/view/4415767617 , ,li-4415767617,fulltime,,,,,,False,associate,Marketing,,,Marketing Services,https://de.linkedin.com/company/hkcm,,,,,,,,,,,
linkedin,Technischer Projektleiter Video- & Lichttechnik,LAV-Event GmbH,"Berlin, Berlin, Germany",2026-05-19,https://www.linkedin.com/jobs/view/4413359207 , ,li-4413359207,fulltime,,,,,,False,associate,Other,,,Events Services,https://de.linkedin.com/company/lav-event,,,,,,,,,,,
linkedin,Project Manager Fulfillment-Services (all genders),ABOUT YOU,"Hamburg, Hamburg, Germany",2026-05-19,https://www.linkedin.com/jobs/view/4407605343 , ,li-4407605343,fulltime,,,,,,False,mid-senior level,Project Management,,,"Technology, Information and Internet",https://de.linkedin.com/company/about-you,,,,,,,,,,,
linkedin,Senior Geotechniker & Projektleiter Geotechnik (m/w/d),GTU Mobility GmbH & Co. KG,"Hamburg, Hamburg, Germany",2026-05-19,https://www.linkedin.com/jobs/view/4416674044 , ,li-4416674044,fulltime,,,,,,False,mid-senior level,Engineering and Information Technology,,,Construction,https://de.linkedin.com/company/gtu-mobility-gmbh-&-co.-kg,,,,,,,,,,,
linkedin,Produktmanager / Product Owner,couch:now,"Mannheim, Baden-Württemberg, Germany",2026-05-19,https://www.linkedin.com/jobs/view/3679727832 , ,li-3679727832,fulltime,,,,,,True,director,,,andreas@harmonymy.life,Mental Health Care,https://de.linkedin.com/company/healthandharmonyhub,,,,,,,,,,,
linkedin,Senior Business Transformation Manager (m/w/d),EDEKA ZENTRALE Stiftung & Co. KG,"Hamburg, Hamburg, Germany",2026-05-19,https://www.linkedin.com/jobs/view/4416480736 , ,li-4416480736,fulltime,,,,,,False,associate,Other,,,Retail,https://de.linkedin.com/company/edeka-zentrale-stiftung,,,,,,,,,,,
linkedin,Senior Product Manager (Japanese native speaking - Bangkok Based),Agoda,"Berlin, Berlin, Germany",2026-05-19,https://www.linkedin.com/jobs/view/4341518609 , ,li-4341518609,fulltime,,,,,,False,mid-senior level,Product Management and Marketing,,,"Technology, Information and Internet",https://sg.linkedin.com/company/agoda,,,,,,,,,,,
linkedin,Senior (Agile) Project Manager / Product Owner (m/w/d),CGI,"Eschborn, Hesse, Germany",2026-05-19,https://www.linkedin.com/jobs/view/4339200615 , ,li-4339200615,fulltime,,,,,,False,entry level,Project Management and Information Technology,,,IT Services and IT Consulting,https://ca.linkedin.com/company/cgi,,,,,,,,,,,
linkedin,Global Product Manager (m/f/d) HyCon Control System,Voith Hydro,"Heidenheim, Baden-Württemberg, Germany",2026-05-19,https://www.linkedin.com/jobs/view/4413423327 , ,li-4413423327,fulltime,,,,,,True,mid-senior level,Product Management and Marketing,,,Machinery Manufacturing,https://de.linkedin.com/company/voith-hydro,,,,,,,,,,,
linkedin,Product Manager - Finance Expert,Moss,"Berlin, Berlin, Germany",2026-05-19,https://www.linkedin.com/jobs/view/4407440227 , ,li-4407440227,fulltime,,,,,,True,mid-senior level,Product Management and Marketing,,,Financial Services,https://de.linkedin.com/company/moss-finance,,,,,,,,,,,
linkedin,Senior Product Manager (Bangkok-based),Agoda,"Stuttgart, Baden-Württemberg, Germany",2026-05-19,https://www.linkedin.com/jobs/view/4299774275 , ,li-4299774275,fulltime,,,,,,False,mid-senior level,Product Management and Marketing,,,"Technology, Information and Internet",https://sg.linkedin.com/company/agoda,,,,,,,,,,,
linkedin,Manager / Senior Manager Unternehmensbewertung / Valuation mit Partnerperspektive,INTENTURE GROUP,"Düsseldorf, North Rhine-Westphalia, Germany",2026-05-19,https://www.linkedin.com/jobs/view/4416603648 , ,li-4416603648,fulltime,,,,,,False,mid-senior level,Consulting,,,Business Consulting and Services,https://de.linkedin.com/company/intenture-group,,,,,,,,,,,
linkedin,Technical Product Manager,orient path_,"Berlin, Germany",2026-05-19,https://www.linkedin.com/jobs/view/4415903840 , ,li-4415903840,fulltime,,,,,,True,mid-senior level,Product Management,,,IT Services and IT Consulting,https://sg.linkedin.com/company/orientpath,,,,,,,,,,,
linkedin,Technical Project Lead (f/m/x) - Chief Security Office,Deutsche Bank,"Berlin, Berlin, Germany",2026-05-19,https://www.linkedin.com/jobs/view/4407450870 , ,li-4407450870,fulltime,,,,,,False,not applicable,Project Management and Information Technology,,,Financial Services,https://de.linkedin.com/company/deutsche-bank,,,,,,,,,,,
linkedin,"Product Manager, Partnerships (m/f/d)",Awin Global,"Berlin, Berlin, Germany",2026-05-19,https://www.linkedin.com/jobs/view/4405521154 , ,li-4405521154,fulltime,,,,,,True,mid-senior level,Product Management and Marketing,,,Advertising Services,https://de.linkedin.com/company/awin-global,,,,,,,,,,,
linkedin,"Product Manager - (Consumer Discovery, Agentic)",Delivery Hero,"Berlin, Berlin, Germany",2026-05-19,https://www.linkedin.com/jobs/view/4415904973 , ,li-4415904973,fulltime,,,,,,False,mid-senior level,Marketing and Product Management,,inclusion@deliveryhero.com,Software Development and IT Services and IT Consulting,https://de.linkedin.com/company/delivery-hero-se,,,,,,,,,,,
linkedin,"Product Manager (f/m/d) - Berlin, Germany",Hygraph,"Berlin, Berlin, Germany",2026-05-19,https://www.linkedin.com/jobs/view/4415908080 , ,li-4415908080,fulltime,,,,,,True,mid-senior level,Information Technology,,,IT Services and IT Consulting,https://de.linkedin.com/company/hygraph,,,,,,,,,,,
linkedin,"Germany - Manager, Non-Interventional Study Operations",Advanced Clinical,"Frankfurt, Hesse, Germany",2026-05-19,https://www.linkedin.com/jobs/view/4407492116 , ,li-4407492116,contract,,,,,,False,entry level,Management and Manufacturing,,accommodationrequest@advancedgroup.com,Biotechnology Research,https://www.linkedin.com/company/advanced-clinical,,,,,,,,,,,
linkedin,PMO Manager (all genders),DigitalService,"Berlin, Germany",2026-05-19,https://www.linkedin.com/jobs/view/4415791295 , ,li-4415791295,fulltime,,,,,,False,entry level,Project Management and Administrative,,sophie.barth@digitalservice.bund.de,Government Administration and Software Development,https://de.linkedin.com/company/digitalservicebund,,,,,,,,,,,
linkedin,Projektleiter Brand-/Wasserschadensanierung,Rautenberg Associates,"Karlsruhe, Baden-Württemberg, Germany",2026-05-19,https://www.linkedin.com/jobs/view/4416641172 , ,li-4416641172,fulltime,,,,,,False,associate,"Project Management, Engineering, and Sales",,,"Construction, Facilities Services, and Insurance",https://de.linkedin.com/company/rautenberg-associates,,,,,,,,,,,
linkedin,Gruppenleiter (w/m/d) Vertrieb,EDG Holding GmbH,"Dortmund, North Rhine-Westphalia, Germany",2026-05-19,https://www.linkedin.com/jobs/view/4413329808 , ,li-4413329808,fulltime,,,,,,False,director,Sales and Business Development,,,Environmental Services,https://de.linkedin.com/company/edgfamilie,,,,,,,,,,,
linkedin,Senior Project Manager Finanzen / Accounting (m/w/d),Biofrontera Group,"Leverkusen, North Rhine-Westphalia, Germany",2026-05-19,https://www.linkedin.com/jobs/view/4412899175 , ,li-4412899175,fulltime,,,,,,False,mid-senior level,Accounting/Auditing and Finance,,,Biotechnology Research,https://de.linkedin.com/company/biofrontera-ag,,,,,,,,,,,
linkedin,Senior IT Project Manager (m/w/d),Skaylink,"Cologne, North Rhine-Westphalia, Germany",2026-05-19,https://www.linkedin.com/jobs/view/4416640491 , ,li-4416640491,fulltime,,,,,,False,mid-senior level,Project Management and Information Technology,,,IT Services and IT Consulting,https://de.linkedin.com/company/skaylink,,,,,,,,,,,
linkedin,Technical Project Lead,Dexter Magnetic Technologies,"Korntal-Münchingen, Baden-Württemberg, Germany",2026-05-19,https://www.linkedin.com/jobs/view/4374158900 , ,li-4374158900,fulltime,,,,,,False,associate,Engineering,,,"Medical Equipment Manufacturing, Semiconductor Manufacturing, and Aviation and Aerospace Component Manufacturing",https://www.linkedin.com/company/dexter-magnetic-technologies,,,,,,,,,,,
linkedin,Senior Operational Project Manager (f/m/d),Thales,"Ditzingen, Baden-Württemberg, Germany",2026-05-19,https://www.linkedin.com/jobs/view/4416649415 , ,li-4416649415,fulltime,,,,,,False,not applicable,Project Management and Information Technology,,,Aviation and Aerospace Component Manufacturing and Defense and Space Manufacturing,https://fr.linkedin.com/company/thales,,,,,,,,,,,
linkedin,AI DevOps Team Lead – Azure (m/f/d),Simon-Kucher,"Cologne, North Rhine-Westphalia, Germany",2026-05-19,https://www.linkedin.com/jobs/view/4413314855 , ,li-4413314855,fulltime,,,,,,True,mid-senior level,Management and Manufacturing,,,Business Consulting and Services,https://de.linkedin.com/company/simon-kucher,,,,,,,,,,,
linkedin,Project Engineering Manager (f/m/d) – HVDC Portfolio,Siemens Energy,"Erlangen, Bavaria, Germany",2026-05-19,https://www.linkedin.com/jobs/view/4328200007 , ,li-4328200007,fulltime,,,,,,True,associate,Engineering,,,"Appliances, Electrical, and Electronics Manufacturing",https://www.linkedin.com/company/siemens-energy,,,,,,,,,,,
linkedin,Quality Manager,Mercury,"Frankfurt, Hesse, Germany",2026-05-19,https://www.linkedin.com/jobs/view/4385270183 , ,li-4385270183,fulltime,,,,,,False,mid-senior level,Quality Assurance,,,Construction,https://ie.linkedin.com/company/mercury-engineering,,,,,,,,,,,
linkedin,Senior Scientist Specialized Nutrition/ Powder Blends (m/f/d),ADM,"Heidelberg, Baden-Württemberg, Germany",2026-05-19,https://www.linkedin.com/jobs/view/4413322148 , ,li-4413322148,fulltime,,,,,,False,not applicable,"Research, Analyst, and Information Technology",,,Food and Beverage Manufacturing,https://www.linkedin.com/company/adm,,,,,,,,,,,
linkedin,Grid Connection Manager (m/f/d) in Renewable Energies,Encavis,,2026-05-19,https://www.linkedin.com/jobs/view/4397026627 , ,li-4397026627,fulltime,,,,,,False,mid-senior level,Sales and Business Development,,,Renewable Energy Power Generation,https://de.linkedin.com/company/encavis,,,,,,,,,,,
linkedin,Senior Software Release & Quality Manager (F/M/D),Siemens,"Ludwigshafen, Baden-Württemberg, Germany",2026-05-19,https://www.linkedin.com/jobs/view/4415741464 , ,li-4415741464,fulltime,,,,,,False,mid-senior level,Research,,,Automation Machinery Manufacturing,https://de.linkedin.com/company/siemens,,,,,,,,,,,
linkedin,"Analyst/Senior Analyst/Associate Manager, Corporate Strategy (Bangkok Based)",Agoda,"Berlin, Berlin, Germany",2026-05-19,https://www.linkedin.com/jobs/view/4299777215 , ,li-4299777215,fulltime,,,,,,False,mid-senior level,Business Development and Sales,,,"Technology, Information and Internet",https://sg.linkedin.com/company/agoda,,,,,,,,,,,
linkedin,Senior IT Project Manager (m/w/d),Skaylink,"Hamburg, Hamburg, Germany",2026-05-19,https://www.linkedin.com/jobs/view/4416629484 , ,li-4416629484,fulltime,,,,,,False,mid-senior level,Project Management and Information Technology,,,IT Services and IT Consulting,https://de.linkedin.com/company/skaylink,,,,,,,,,,,
linkedin,Junior Performance Marketing Manager (m/w/d),ZweiDigital,"Frankfurt, Hesse, Germany",2026-05-19,https://www.linkedin.com/jobs/view/4415783408 , ,li-4415783408,fulltime,,,,,,False,entry level,Marketing,,,Advertising Services,https://de.linkedin.com/company/zweidigital,,,,,,,,,,,
linkedin,Senior IT Project Manager (m/w/d),Skaylink,"Regensburg, Bavaria, Germany",2026-05-19,https://www.linkedin.com/jobs/view/4416648467 , ,li-4416648467,fulltime,,,,,,False,mid-senior level,Project Management and Information Technology,,,IT Services and IT Consulting,https://de.linkedin.com/company/skaylink,,,,,,,,,,,
linkedin,Senior Software Release & Quality Manager (F/M/D),Siemens,"Cologne, North Rhine-Westphalia, Germany",2026-05-19,https://www.linkedin.com/jobs/view/4415749410 , ,li-4415749410,fulltime,,,,,,False,mid-senior level,Research,,,Automation Machinery Manufacturing,https://de.linkedin.com/company/siemens,,,,,,,,,,,
linkedin,Senior Software Release & Quality Manager (F/M/D),Siemens,"Stuttgart, Baden-Württemberg, Germany",2026-05-19,https://www.linkedin.com/jobs/view/4415756244 , ,li-4415756244,fulltime,,,,,,False,mid-senior level,Research,,,Automation Machinery Manufacturing,https://de.linkedin.com/company/siemens,,,,,,,,,,,
linkedin,Project Manager / Content Manager,Jobgether,,2026-05-19,https://www.linkedin.com/jobs/view/4415765182 , ,li-4415765182,fulltime,,,,,,True,mid-senior level,"Marketing, Public Relations, and Writing/Editing",,,Internet Marketplace Platforms,https://be.linkedin.com/company/jobgether,,,,,,,,,,,
linkedin,Projektadministrator für Luftfahrt-Programme (m/w/d) - Befristet für 3 Jahre,Liebherr Aerospace and Transportation,"Lindenberg im Allgäu, Bavaria, Germany",2026-05-19,https://www.linkedin.com/jobs/view/4415790170 , ,li-4415790170,fulltime,,,,,,False,entry level,Project Management and Information Technology,,,Industrial Machinery Manufacturing,https://fr.linkedin.com/company/liebherr-aerospace-and-transportation,,,,,,,,,,,
linkedin,Junior Bid & Proposal Manager (m/w/d),Grob Aircraft SE,"Tussenhausen, Bavaria, Germany",2026-05-19,https://www.linkedin.com/jobs/view/4399295774 , ,li-4399295774,fulltime,,,,,,False,entry level,Other,,,Aviation and Aerospace Component Manufacturing,https://de.linkedin.com/company/grobaircraft,,,,,,,,,,,
linkedin,Projektmanager:in E-Commerce Agentur (m/w/d) in Vollzeit,we-site GmbH - Shopify Agentur,"Hamburg, Hamburg, Germany",2026-05-19,https://www.linkedin.com/jobs/view/4412891335 , ,li-4412891335,fulltime,,,,,,False,director,Project Management,,,IT Services and IT Consulting,https://de.linkedin.com/company/we-site-shopify-agentur,,,,,,,,,,,
linkedin,Senior Technical Project Manager (m/w/d) Messe/Event - Befristet für 12 Monate,Uniplan,"Frankfurt, Hesse, Germany",2026-05-19,https://www.linkedin.com/jobs/view/4416659117 , ,li-4416659117,fulltime,,,,,,False,mid-senior level,Project Management and Information Technology,,,Events Services,https://de.linkedin.com/company/uniplan,,,,,,,,,,,
linkedin,Senior IT Project Manager (m/w/d),Skaylink,"Leipzig, Saxony, Germany",2026-05-19,https://www.linkedin.com/jobs/view/4416645527 , ,li-4416645527,fulltime,,,,,,False,mid-senior level,Project Management and Information Technology,,,IT Services and IT Consulting,https://de.linkedin.com/company/skaylink,,,,,,,,,,,
linkedin,Senior IT Project Manager (m/w/d),Skaylink,"Munich, Bavaria, Germany",2026-05-19,https://www.linkedin.com/jobs/view/4416638506 , ,li-4416638506,fulltime,,,,,,False,mid-senior level,Project Management and Information Technology,,,IT Services and IT Consulting,https://de.linkedin.com/company/skaylink,,,,,,,,,,,
linkedin,Projektmanager / Produktentwickler (w/m/d),Viamedi Healthcare GmbH,"Halle, North Rhine-Westphalia, Germany",2026-05-19,https://www.linkedin.com/jobs/view/4416635183 , ,li-4416635183,fulltime,,,,,,True,entry level,Project Management and Information Technology,,hr@viamedi.de,Wellness and Fitness Services,https://www.linkedin.com/company/viamedi-healthcare-gmbh,,,,,,,,,,,
linkedin,Projektentwickler:in,VGS Unternehmensberatung GmbH,,2026-05-19,https://www.linkedin.com/jobs/view/4415788804 , ,li-4415788804,fulltime,,,,,,False,associate,"Engineering, Project Management, and Business Development",,,Services for Renewable Energy and Architecture and Planning,https://www.linkedin.com/company/vgs-unternehmensberatung-gmbh,,,,,,,,,,,
linkedin,"Program Manager, Fulfillment Center Launch & Retrofits, Startup - Global Engineering Services",Amazon,"Berlin, Germany",2026-05-19,https://www.linkedin.com/jobs/view/4416659191 , ,li-4416659191,fulltime,,,,,,False,mid-senior level,"Project Management, Management, and Product Management",,,Software Development,https://www.linkedin.com/company/amazon,,,,,,,,,,,
linkedin,Digital Content & Project Manager (all genders),valantic DXA,"Munich, Bavaria, Germany",2026-05-19,https://www.linkedin.com/jobs/view/4413306219 , ,li-4413306219,fulltime,,,,,,True,associate,Project Management and Information Technology,,,Software Development,https://de.linkedin.com/company/valantic-dxa,,,,,,,,,,,
linkedin,Projektmanagement Office (PMO) / Projektmanager (m/w/d),GIG Gesellschaft für integrierte Gesundheitsversorgung,"Bochum, North Rhine-Westphalia, Germany",2026-05-19,https://www.linkedin.com/jobs/view/4413325062 , ,li-4413325062,fulltime,,,,,,False,executive,Other,,,Government Administration,https://de.linkedin.com/company/gig-gesellschaft-f%C3%BCr-integriertegesundheitsversorgung,,,,,,,,,,,
linkedin,Operational Excellence Manager (m/w/d)*,SCHOTT,"Mainz, Rhineland-Palatinate, Germany",2026-05-19,https://www.linkedin.com/jobs/view/4415792855 , ,li-4415792855,fulltime,,,,,,False,mid-senior level,Management and Manufacturing,,,"Glass, Ceramics and Concrete Manufacturing",https://de.linkedin.com/company/schott,,,,,,,,,,,
linkedin,"Project Supply Manager (d/f/m) Earth Observation, Science and Exploration Programs",Airbus Defence and Space,"Immenstaad am Bodensee, Baden-Württemberg, Germany",2026-05-19,https://www.linkedin.com/jobs/view/4412850259 , ,li-4412850259,parttime,,,,,,False,mid-senior level,Management and Manufacturing,,emsom@airbus.com,Defense and Space Manufacturing,https://www.linkedin.com/company/airbus-defence-and-space,,,,,,,,,,,
linkedin,Program Manager.,US Army Corps of Engineers,"Kaiserslautern, Rhineland-Palatinate, Germany",2026-05-19,https://www.linkedin.com/jobs/view/4416648444 , ,li-4416648444,fulltime,,,,,,False,mid-senior level,Project Management and Information Technology,,,Government Administration and Strategic Management Services,https://www.linkedin.com/company/us-army-corps-of-engineers,,,,,,,,,,,
linkedin,Senior IT Project Manager (m/f/d),Amundi,"Aachen, North Rhine-Westphalia, Germany",2026-05-19,https://www.linkedin.com/jobs/view/4416650339 , ,li-4416650339,fulltime,,,,,,False,associate,Information Technology and Project Management,,,Financial Services and Software Development,https://fr.linkedin.com/company/amundi-,,,,,,,,,,,
linkedin,"Senior Manager HR Controlling, Reporting & Rewards",PUMA Group,"Herzogenaurach, Bavaria, Germany",2026-05-19,https://www.linkedin.com/jobs/view/4416928268 , ,li-4416928268,fulltime,,,,,,False,mid-senior level,Human Resources and Training,,,"Retail, Human Resources Services, and Retail Apparel and Fashion",https://de.linkedin.com/company/puma,,,,,,,,,,,
linkedin,Product Manager - Sustainability (all genders),HRS Group,"Berlin, Berlin, Germany",2026-05-18,https://www.linkedin.com/jobs/view/4416274456 , ,li-4416274456,fulltime,,,,,,False,mid-senior level,Product Management and Marketing,,,"IT Services and IT Consulting, Software Development, and Technology, Information and Internet",https://de.linkedin.com/company/hrsgroup-,,,,,,,,,,,
linkedin,Program Analyst,Systems Planning & Analysis,"Ramstein-Miesenbach, Rhineland-Palatinate, Germany",2026-05-18,https://www.linkedin.com/jobs/view/4416275663 , ,li-4416275663,fulltime,,,,,,False,entry level,Business Development and Sales,,,"Defense and Space Manufacturing, Aviation and Aerospace Component Manufacturing, and Armed Forces",https://www.linkedin.com/company/systems-planning-and-analysis-inc,,,,,,,,,,,
linkedin,Project Manager – Semiconductor Fab Operations,IC Resources,"Baden-Württemberg, Germany",2026-05-18,https://www.linkedin.com/jobs/view/4416294516 , ,li-4416294516,fulltime,,,,,,False,entry level,Project Management and Information Technology,,,Staffing and Recruiting,https://uk.linkedin.com/company/icresources,,,,,,,,,,,
linkedin,Terminplaner/in - Arbeitsvorbereiter/in Projektplanung,Implan GmbH,"Karlsruhe, Baden-Württemberg, Germany",2026-05-18,https://www.linkedin.com/jobs/view/4412845278 , ,li-4412845278,fulltime,,,,,,False,entry level,Engineering,,,Professional Services,https://de.linkedin.com/company/implan-gmbh,,,,,,,,,,,
linkedin,Project Manager (f/m/d) with focus on SAP and Data Analytics,Siemens Energy,"Berlin, Berlin, Germany",2026-05-18,https://www.linkedin.com/jobs/view/4415688791 , ,li-4415688791,fulltime,,,,,,True,associate,Supply Chain,,,"Appliances, Electrical, and Electronics Manufacturing",https://www.linkedin.com/company/siemens-energy,,,,,,,,,,,
