site,title,company,location,date_posted,job_url,job_url_direct,id,job_type,salary_source,interval,min_amount,max_amount,currency,is_remote,job_level,job_function,listing_type,emails,company_industry,company_url,company_url_direct,company_addresses,company_num_employees,company_revenue,company_description,skills,experience_range,company_rating,company_reviews_count,vacancy_count,work_from_home_type
linkedin,Working Student Global Project Management Office (m/f/d),IFCO SYSTEMS,"Munich, Bavaria, Germany",2026-06-26,https://www.linkedin.com/jobs/view/4414640877 , ,li-4414640877,parttime,,,,,,False,internship,Education and Training,,,"Transportation, Logistics, Supply Chain and Storage",https://de.linkedin.com/company/ifco-systems,,,,,,,,,,,
linkedin,Internship – TechHub Innovation Supply Chain (all genders welcome),AUDI AG,"Neckarsulm, Baden-Württemberg, Germany",2026-06-25,https://www.linkedin.com/jobs/view/4430237264 , ,li-4430237264,fulltime,,,,,,False,internship,Management and Manufacturing,,,Motor Vehicle Manufacturing,https://de.linkedin.com/company/audi-ag,,,,,,,,,,,
linkedin,Praktikum im Bereich Product Strategy Zero Emission Vehicles / eMobility Mercedes-Benz Trucks ab Oktober 2026,Daimler Truck AG,"Leinfelden-Echterdingen, Baden-Württemberg, Germany",2026-06-25,https://www.linkedin.com/jobs/view/4432645918 , ,li-4432645918,fulltime,,,,,,False,internship,Education and Training,,"-truck@daimlertruck.com, -service@hr.daimlertruck.com",Motor Vehicle Manufacturing,https://de.linkedin.com/company/daimlertruckag,,,,,,,,,,,
linkedin,Internship Logistics (m/f/d),CarOnSale,"Berlin, Germany",2026-06-24,https://www.linkedin.com/jobs/view/4429884412 , ,li-4429884412,fulltime,,,,,,False,internship,Management and Manufacturing,,,"Technology, Information and Internet",https://de.linkedin.com/company/caronsale,,,,,,,,,,,
linkedin,Praktikum Category Management Active (m/w/d),Tchibo,"Hamburg, Hamburg, Germany",2026-06-24,https://www.linkedin.com/jobs/view/4423364005 , ,li-4423364005,fulltime,,,,,,False,internship,Marketing and Sales,,,Retail,https://de.linkedin.com/company/tchibo,,,,,,,,,,,
linkedin,International Project Manager (m/w/d),Hoffmann Group,"Munich, Bavaria, Germany",,https://www.linkedin.com/jobs/view/4434783914 , ,li-4434783914,fulltime,,,,,,False,mid-senior level,Project Management and Information Technology,,,Wholesale,https://de.linkedin.com/company/hoffmann-group,,,,,,,,,,,
linkedin,Working Student Engineering (m/f/d),West Pharmaceutical Services,"Stolberg, North Rhine-Westphalia, Germany",,https://www.linkedin.com/jobs/view/4393564880 , ,li-4393564880,fulltime,,,,,,False,associate,Engineering,,,"Medical Equipment Manufacturing, Packaging and Containers Manufacturing, and Pharmaceutical Manufacturing",https://www.linkedin.com/company/west-pharmaceutical-services,,,,,,,,,,,
