site,title,company,location,date_posted,job_url,job_url_direct,id,job_type,salary_source,interval,min_amount,max_amount,currency,is_remote,job_level,job_function,listing_type,emails,company_industry,company_url,company_url_direct,company_addresses,company_num_employees,company_revenue,company_description,skills,experience_range,company_rating,company_reviews_count,vacancy_count,work_from_home_type
linkedin,Project Manager (m/f/d),Exyte,"Stuttgart, Baden-Württemberg, Germany",2026-05-24,https://www.linkedin.com/jobs/view/4377939017 , ,li-4377939017,fulltime,,,,,,False,mid-senior level,Project Management and Information Technology,,lisamarie.kussmaul@exyte.net,Civil Engineering,https://de.linkedin.com/company/exyte-group,,,,,,,,,,,
linkedin,"Principal Product Manager, Document Domain",PandaDoc,,2026-05-24,https://www.linkedin.com/jobs/view/4379017037 , ,li-4379017037,fulltime,,,,,,True,director,Product Management and Marketing,,,Software Development,https://www.linkedin.com/company/pandadoc,,,,,,,,,,,
linkedin,Senior Account Manager (m/w/d),QAVION GROUP,,2026-05-24,https://www.linkedin.com/jobs/view/4414862382 , ,li-4414862382,fulltime,,,,,,True,associate,Human Resources,,,Professional Services,https://www.linkedin.com/company/qavion-group,,,,,,,,,,,
linkedin,Product Management Teamlead ORBIS Medical Controlling,Dedalus,"Bonn, North Rhine-Westphalia, Germany",2026-05-24,https://www.linkedin.com/jobs/view/4386184105 , ,li-4386184105,fulltime,,,,,,False,mid-senior level,Engineering and Information Technology,,,IT Services and IT Consulting,https://it.linkedin.com/company/dedalus-group,,,,,,,,,,,
linkedin,IT Project Lead – Workplace & Infrastructure Transformation (all gender),ALTEN Germany,"Munich, Bavaria, Germany",2026-05-24,https://www.linkedin.com/jobs/view/4414842967 , ,li-4414842967,fulltime,,,,,,False,entry level,Engineering,,,Machinery Manufacturing and Aviation and Aerospace Component Manufacturing,https://de.linkedin.com/company/altengermany,,,,,,,,,,,
linkedin,Senior Project Manager,IPS-Integrated Project Services,"Frankfurt, Hesse, Germany",2026-05-24,https://www.linkedin.com/jobs/view/4335564500 , ,li-4335564500,fulltime,,,,,,False,not applicable,Project Management and Information Technology,,,Pharmaceutical Manufacturing,https://www.linkedin.com/company/ips,,,,,,,,,,,
linkedin,Senior Projekt Manager,SQLI,"Dortmund, North Rhine-Westphalia, Germany",2026-05-24,https://www.linkedin.com/jobs/view/4378795036 , ,li-4378795036,fulltime,,,,,,True,mid-senior level,Information Technology,,aphillips@sqli.com,Software Development and IT Services and IT Consulting,https://fr.linkedin.com/company/sqli,,,,,,,,,,,
linkedin,Senior Project Manager (BESS) (m/w/d),encosa energy,"Munich, Bavaria, Germany",2026-05-24,https://www.linkedin.com/jobs/view/4414854061 , ,li-4414854061,fulltime,,,,,,False,mid-senior level,Engineering,,,Renewable Energy Semiconductor Manufacturing,https://de.linkedin.com/company/encosa-energy,,,,,,,,,,,
linkedin,Senior Projektmanager (m/w/d),CompuGroup Medical SE & Co. KGaA,"Munich, Bavaria, Germany",2026-05-24,https://www.linkedin.com/jobs/view/4202024407 , ,li-4202024407,fulltime,,,,,,True,mid-senior level,Project Management and Information Technology,,,IT Services and IT Consulting,https://de.linkedin.com/company/compugroup-medical,,,,,,,,,,,
linkedin,Product Manager – TeamViewer ONE (all genders),TeamViewer,,2026-05-24,https://www.linkedin.com/jobs/view/4388202071 , ,li-4388202071,fulltime,,,,,,True,mid-senior level,Product Management and Marketing,,,Software Development,https://de.linkedin.com/company/teamviewer,,,,,,,,,,,
linkedin,IT Strategy & Transformation Manager (all gender),ALTEN Germany,"Munich, Bavaria, Germany",2026-05-24,https://www.linkedin.com/jobs/view/4414856037 , ,li-4414856037,fulltime,,,,,,False,entry level,Engineering,,,Machinery Manufacturing and Aviation and Aerospace Component Manufacturing,https://de.linkedin.com/company/altengermany,,,,,,,,,,,
linkedin,Product Manager - Quest Platform,Xsolla,"Berlin, Berlin, Germany",2026-05-24,https://www.linkedin.com/jobs/view/4359872115 , ,li-4359872115,fulltime,,,,,,False,mid-senior level,Product Management and Marketing,,,Computer Games,https://www.linkedin.com/company/xsolla,,,,,,,,,,,
linkedin,Project Manager & Planning (m/f/d),Alpitronic,"Nuremberg, Bavaria, Germany",2026-05-24,https://www.linkedin.com/jobs/view/4385741399 , ,li-4385741399,fulltime,,,,,,False,associate,Project Management and Information Technology,,,"Appliances, Electrical, and Electronics Manufacturing",https://it.linkedin.com/company/alpitronic-srl,,,,,,,,,,,
linkedin,Project Engineer,Westinghouse Electric Company,"Mannheim, Baden-Württemberg, Germany",2026-05-24,https://www.linkedin.com/jobs/view/4316467224 , ,li-4316467224,fulltime,,,,,,False,entry level,Engineering and Information Technology,,,Utilities,https://www.linkedin.com/company/westinghouse-electric-company,,,,,,,,,,,
linkedin,Project Manager (m/f/d) in our Space Division,CGI,"Darmstadt, Hesse, Germany",2026-05-24,https://www.linkedin.com/jobs/view/4335195707 , ,li-4335195707,fulltime,,,,,,False,entry level,Project Management,,,IT Services and IT Consulting,https://ca.linkedin.com/company/cgi,,,,,,,,,,,
linkedin,(Senior) Manager (all genders) Life Sciences,Porsche Consulting,"Berlin, Berlin, Germany",2026-05-24,https://www.linkedin.com/jobs/view/4378356055 , ,li-4378356055,fulltime,,,,,,True,mid-senior level,Other,,,Business Consulting and Services,https://de.linkedin.com/company/porsche-consulting-,,,,,,,,,,,
linkedin,Senior IT-Projektleiter und Teamleiter (m/w/d),ITSC GmbH,"Lower Saxony, Germany",2026-05-24,https://www.linkedin.com/jobs/view/4418642474 , ,li-4418642474,fulltime,,,,,,False,executive,Information Technology,,jobs@itsc.de,IT Services and IT Consulting,https://de.linkedin.com/company/itsc-gmbh,,,,,,,,,,,
linkedin,SAP Program/Project Manager (m/w/d),DXC Technology,"Düsseldorf, North Rhine-Westphalia, Germany",2026-05-24,https://www.linkedin.com/jobs/view/4368252723 , ,li-4368252723,fulltime,,,,,,False,mid-senior level,Project Management and Information Technology,,,IT Services and IT Consulting,https://www.linkedin.com/company/dxctechnology,,,,,,,,,,,
linkedin,(Senior) Product Marketing Manager,Clera,"Munich, Bavaria, Germany",2026-05-24,https://www.linkedin.com/jobs/view/4418688082 , ,li-4418688082,fulltime,,,,,,False,mid-senior level,Marketing and Sales,,,"Technology, Information and Internet",https://www.linkedin.com/company/getclera,,,,,,,,,,,
linkedin,Senior Product Manager - Developer Platform,Snowflake,"Berlin, Berlin, Germany",2026-05-24,https://www.linkedin.com/jobs/view/4360601179 , ,li-4360601179,fulltime,,,,,,False,mid-senior level,Product Management and Marketing,,,Software Development,https://www.linkedin.com/company/snowflake-computing,,,,,,,,,,,
linkedin,Senior - IT - Project Manager,CHEFS CULINAR,"Weeze, North Rhine-Westphalia, Germany",2026-05-24,https://www.linkedin.com/jobs/view/4417844053 , ,li-4417844053,fulltime,,,,,,False,mid-senior level,Information Technology,,,Wholesale,https://de.linkedin.com/company/chefsculinar,,,,,,,,,,,
linkedin,Communications & Events Associate (m/f/d),Flatiron Health,,2026-05-23,https://www.linkedin.com/jobs/view/4409417081 , ,li-4409417081,fulltime,,,,,,False,associate,Management and Manufacturing,,,Biotechnology Research,https://www.linkedin.com/company/flatiron-health,,,,,,,,,,,
linkedin,Product Manager,eBay,,2026-05-23,https://www.linkedin.com/jobs/view/4398697962 , ,li-4398697962,fulltime,,,,,,False,mid-senior level,Product Management and Marketing,,talent@ebay.com,"Technology, Information and Internet",https://www.linkedin.com/company/ebay,,,,,,,,,,,
linkedin,Product Manager (f/m/d),AMETEK,"Hadamar, Hesse, Germany",2026-05-23,https://www.linkedin.com/jobs/view/4387410721 , ,li-4387410721,fulltime,,,,,,False,mid-senior level,Product Management and Marketing,,,Manufacturing,https://www.linkedin.com/company/ametek,,,,,,,,,,,
linkedin,Product Manager (m/f/d) – Customer App Team,SIXT,"Munich, Bavaria, Germany",2026-05-23,https://www.linkedin.com/jobs/view/4378666155 , ,li-4378666155,fulltime,,,,,,False,mid-senior level,Product Management and Marketing,,,Travel Arrangements,https://de.linkedin.com/company/sixt,,,,,,,,,,,
linkedin,Project Site  Manager - electrical/data centres (m/w/d),Eaton,"Stuttgart, Baden-Württemberg, Germany",2026-05-23,https://www.linkedin.com/jobs/view/4385012725 , ,li-4385012725,fulltime,,,,,,False,mid-senior level,Other,,,"Appliances, Electrical, and Electronics Manufacturing",https://ie.linkedin.com/company/eaton,,,,,,,,,,,
linkedin,Project Director (m/f/d),Exyte,"Stuttgart, Baden-Württemberg, Germany",2026-05-23,https://www.linkedin.com/jobs/view/4361071458 , ,li-4361071458,fulltime,,,,,,False,director,Management and Manufacturing,,,Civil Engineering,https://de.linkedin.com/company/exyte-group,,,,,,,,,,,
linkedin,ASIC Project Manager,IC Resources,"Baden-Württemberg, Germany",2026-05-23,https://www.linkedin.com/jobs/view/4358542063 , ,li-4358542063,fulltime,,,,,,False,mid-senior level,"Project Management, Design, and Management",,,Semiconductor Manufacturing,https://uk.linkedin.com/company/icresources,,,,,,,,,,,
linkedin,Program Manager,JetBrains,"Berlin, Berlin, Germany",2026-05-23,https://www.linkedin.com/jobs/view/4398818986 , ,li-4398818986,fulltime,,,,,,True,mid-senior level,Project Management and Information Technology,,,Software Development,https://nl.linkedin.com/company/jetbrains,,,,,,,,,,,
linkedin,Project & Supply Chain Manager,Stirling Dynamics,"Hamburg, Hamburg, Germany",2026-05-23,https://www.linkedin.com/jobs/view/4385476527 , ,li-4385476527,fulltime,,,,,,False,mid-senior level,Management and Manufacturing,,,Aviation and Aerospace Component Manufacturing,https://uk.linkedin.com/company/stirling-dynamics,,,,,,,,,,,
linkedin,TGA Projektmanager (m/w/d) Versorgungs- oder Elektrotechnik,Firmengruppe Max Bögl,"Frankfurt am Main, Hesse, Germany",2026-05-23,https://www.linkedin.com/jobs/view/4336663658 , ,li-4336663658,fulltime,,,,,,False,associate,Project Management and Information Technology,,,Construction,https://de.linkedin.com/company/firmengruppe-max-b%C3%B6gl,,,,,,,,,,,
linkedin,Logistics Advanced Analytics Leader (d/f/m),Airbus Aircraft,"Hamburg, Hamburg, Germany",2026-05-23,https://www.linkedin.com/jobs/view/4414360754 , ,li-4414360754,parttime,,,,,,False,mid-senior level,Management and Manufacturing,,emsom@airbus.com,Aviation and Aerospace Component Manufacturing,https://fr.linkedin.com/company/airbus,,,,,,,,,,,
linkedin,"Specialist, Project Manager",Pearson,,2026-05-23,https://www.linkedin.com/jobs/view/4417531678 , ,li-4417531678,fulltime,,,,,,True,not applicable,Project Management and Information Technology,,TalentExperienceGlobalTeam@grp.pearson.com,Education Administration Programs and E-Learning Providers,https://uk.linkedin.com/company/pearson,,,,,,,,,,,
linkedin,Project Manager,Cognite,"Frankfurt, Hesse, Germany",2026-05-23,https://www.linkedin.com/jobs/view/4345956786 , ,li-4345956786,fulltime,,,,,,False,mid-senior level,Project Management and Information Technology,,,"Construction, Software Development, and IT Services and IT Consulting",https://www.linkedin.com/company/cognitedata,,,,,,,,,,,
linkedin,Project Manager,Cognite,"Hamburg, Hamburg, Germany",2026-05-23,https://www.linkedin.com/jobs/view/4345956792 , ,li-4345956792,fulltime,,,,,,False,mid-senior level,Project Management and Information Technology,,,"Construction, Software Development, and IT Services and IT Consulting",https://www.linkedin.com/company/cognitedata,,,,,,,,,,,
linkedin,"Associate Manager - Asset Integration, Planning & Compliance (m/f/d) - Gigafactory Berlin-Brandenburg",Tesla,"Grünheide, Brandenburg, Germany",2026-05-23,https://www.linkedin.com/jobs/view/4418461484 , ,li-4418461484,fulltime,,,,,,False,mid-senior level,Project Management and Information Technology,,,"Motor Vehicle Manufacturing, Renewable Energy Semiconductor Manufacturing, and Utilities",https://www.linkedin.com/company/tesla-motors,,,,,,,,,,,
linkedin,"EVP, Global Head of Quality",Evotec,"Hamburg, Hamburg, Germany",2026-05-22,https://www.linkedin.com/jobs/view/4416756266 , ,li-4416756266,fulltime,,,,,,False,executive,Quality Assurance,,,Biotechnology Research,https://de.linkedin.com/company/evotec,,,,,,,,,,,
linkedin,Project Manager,Jobgether,,2026-05-22,https://www.linkedin.com/jobs/view/4417153668 , ,li-4417153668,fulltime,,,,,,True,mid-senior level,Project Management and Information Technology,,,Internet Marketplace Platforms,https://be.linkedin.com/company/jobgether,,,,,,,,,,,
linkedin,Junior Project Coordinator Tech Infrastructure,PUMA Group,"Herzogenaurach, Bavaria, Germany",2026-05-22,https://www.linkedin.com/jobs/view/4418190679 , ,li-4418190679,fulltime,,,,,,False,entry level,Other,,,Retail,https://de.linkedin.com/company/puma,,,,,,,,,,,
linkedin,Fair Pay / Pay Equity Associate - Europe,Mercer,"Berlin, Berlin, Germany",2026-05-22,https://www.linkedin.com/jobs/view/4418427719 , ,li-4418427719,fulltime,,,,,,True,not applicable,Finance and Sales,,,Insurance and Business Consulting and Services,https://www.linkedin.com/company/mercer,,,,,,,,,,,
linkedin,Fair Pay / Pay Equity Associate - Europe,Mercer,"Frankfurt, Hesse, Germany",2026-05-22,https://www.linkedin.com/jobs/view/4418441286 , ,li-4418441286,fulltime,,,,,,True,not applicable,Finance and Sales,,,Insurance and Business Consulting and Services,https://www.linkedin.com/company/mercer,,,,,,,,,,,
linkedin,R&D Senior Engineer – Dielectrics and Alternative Insulating Fluids (f/m/d),Hitachi Energy,"Bad Honnef am Rhein, North Rhine-Westphalia, Germany",2026-05-22,https://www.linkedin.com/jobs/view/4412560457 , ,li-4412560457,fulltime,,,,,,False,mid-senior level,Engineering and Information Technology,,,"Appliances, Electrical, and Electronics Manufacturing and IT Services and IT Consulting",https://ch.linkedin.com/company/hitachienergy,,,,,,,,,,,
linkedin,Project Leader,Forward Strategy,"Berlin, Berlin, Germany",2026-05-22,https://www.linkedin.com/jobs/view/4414367374 , ,li-4414367374,fulltime,,,,,,False,mid-senior level,Management,,,Professional Services,https://de.linkedin.com/company/forward-strategy-consulting,,,,,,,,,,,
linkedin,IT Project Leader- Pharmaceutical or Life sciences,Intuition IT – Intuitive Technology Recruitment,"Mainz, Rhineland-Palatinate, Germany",2026-05-22,https://www.linkedin.com/jobs/view/4417124666 , ,li-4417124666,contract,,,,,,False,mid-senior level,Information Technology,,,Staffing and Recruiting,https://uk.linkedin.com/company/intuition-it-intuitive-technology-recruitment,,,,,,,,,,,
linkedin,(Senior) Projektleiter Luftverteidigung (m/w/d),IABG,"Coblenz, Rhineland-Palatinate, Germany",2026-05-22,https://www.linkedin.com/jobs/view/4288263131 , ,li-4288263131,fulltime,,,,,,False,mid-senior level,Information Technology,,,"IT Services and IT Consulting, Defense and Space Manufacturing, and Motor Vehicle Manufacturing",https://de.linkedin.com/company/iabg,,,,,,,,,,,
linkedin,TGA Projektleitung (HKLS oder ELT) (m/w/d),SRCon GmbH,"Düsseldorf, North Rhine-Westphalia, Germany",2026-05-22,https://www.linkedin.com/jobs/view/4414094870 , ,li-4414094870,fulltime,,,,,,False,mid-senior level,Engineering,,,Staffing and Recruiting,https://de.linkedin.com/company/srcongmbh,,,,,,,,,,,
linkedin,Senior / Lead HVDC Electrical Engineer - Technical Specialist / Project Leader,Arup,"Berlin, Berlin, Germany",2026-05-22,https://www.linkedin.com/jobs/view/4408763839 , ,li-4408763839,fulltime,,,,,,False,mid-senior level,"Design, Consulting, and Engineering",,,"Renewable Energy Semiconductor Manufacturing, Appliances, Electrical, and Electronics Manufacturing, and Architecture and Planning",https://uk.linkedin.com/company/arup,,,,,,,,,,,
linkedin,Project Director / Senior Projektleiter (w/m/d) EPCM Industry ‒ Großprojekte der Prozessindustrie und Kraftwerkstechnik,Drees & Sommer,"Stuttgart, Baden-Württemberg, Germany",2026-05-22,https://www.linkedin.com/jobs/view/4402863865 , ,li-4402863865,fulltime,,,,,,False,mid-senior level,Project Management,,,Real Estate,https://de.linkedin.com/company/drees-&-sommer,,,,,,,,,,,
linkedin,Principal Threat Intelligence Consultant (m/w/d),NVISO Security,"Frankfurt, Hesse, Germany",2026-05-22,https://www.linkedin.com/jobs/view/4414351256 , ,li-4414351256,fulltime,,,,,,False,associate,Information Technology,,,IT Services and IT Consulting,https://be.linkedin.com/company/nviso-cyber,,,,,,,,,,,
linkedin,Senior / Lead HVDC Electrical Engineer - Technical Specialist / Project Leader,Arup,"Frankfurt am Main, Hesse, Germany",2026-05-22,https://www.linkedin.com/jobs/view/4408776305 , ,li-4408776305,fulltime,,,,,,False,mid-senior level,"Design, Consulting, and Engineering",,,"Renewable Energy Semiconductor Manufacturing, Appliances, Electrical, and Electronics Manufacturing, and Architecture and Planning",https://uk.linkedin.com/company/arup,,,,,,,,,,,
linkedin,High-Level Adviser on Energy (TL),NTU International A/S,"Berlin, Germany",2026-05-22,https://www.linkedin.com/jobs/view/4418154277 , ,li-4418154277,contract,,,,,,False,director,"Consulting, Management, and Other",,recruitment@ntu.eu,International Affairs and Services for Renewable Energy,https://dk.linkedin.com/company/ntu-international,,,,,,,,,,,
linkedin,Technischer Projektmanager,Refresco,"Calvörde, Saxony-Anhalt, Germany",2026-05-22,https://www.linkedin.com/jobs/view/4376765464 , ,li-4376765464,fulltime,,,,,,False,mid-senior level,Project Management and Information Technology,,bewerbung@refresco.com,Food and Beverage Services,https://nl.linkedin.com/company/refresco,,,,,,,,,,,
linkedin,Senior Project Manager (MCF/ Data Centres),Haskoning,"Frankfurt am Main, Hesse, Germany",2026-05-22,https://www.linkedin.com/jobs/view/4360731876 , ,li-4360731876,fulltime,,,,,,False,mid-senior level,"Design, Consulting, and Engineering",,christian.de.visser@haskoning.com,"Civil Engineering, Renewable Energy Semiconductor Manufacturing, and Construction",https://nl.linkedin.com/company/haskoning,,,,,,,,,,,
linkedin,(Senior) Project Manager Operational Excellence Services (f/m/x),ZEISS Group,"Oberkochen, Baden-Württemberg, Germany",2026-05-22,https://www.linkedin.com/jobs/view/4418109492 , ,li-4418109492,fulltime,,,,,,False,mid-senior level,"Project Management, Strategy/Planning, and Other",,,"Manufacturing and Appliances, Electrical, and Electronics Manufacturing",https://de.linkedin.com/company/zeiss,,,,,,,,,,,
linkedin,Team Leader Customer Project Manager (m/f/d),Giesecke+Devrient,"Munich, Bavaria, Germany",2026-05-22,https://www.linkedin.com/jobs/view/4417169703 , ,li-4417169703,fulltime,,,,,,True,mid-senior level,Project Management and Information Technology,,,IT Services and IT Consulting,https://de.linkedin.com/company/giesecke-devrient,,,,,,,,,,,
linkedin,Project Manager - Construction,Darwin Recruitment,"Hamburg, Hamburg, Germany",2026-05-22,https://www.linkedin.com/jobs/view/4417145018 , ,li-4417145018,fulltime,,,,,,False,not applicable,Engineering,,,Building Construction,https://uk.linkedin.com/company/darwin-recruitment-3,,,,,,,,,,,
linkedin,Senior Project Manager (m/f/d),Klarkode,"Hamburg, Hamburg, Germany",2026-05-22,https://www.linkedin.com/jobs/view/4414084858 , ,li-4414084858,fulltime,,,,,,True,mid-senior level,Information Technology,,,IT Services and IT Consulting,https://de.linkedin.com/company/klarkode,,,,,,,,,,,
linkedin,Technical Project Manager Software Solutions (all gender) – Agile Projekte & Hightech-Produkte 100,ALTEN Germany,"Kiel, Schleswig-Holstein, Germany",2026-05-22,https://www.linkedin.com/jobs/view/4414305547 , ,li-4414305547,fulltime,,,,,,False,entry level,Engineering,,,Machinery Manufacturing and Aviation and Aerospace Component Manufacturing,https://de.linkedin.com/company/altengermany,,,,,,,,,,,
linkedin,Technischer Projektleiter Maritime Simulationssysteme (m/w/d),Rheinmetall,"Bremen, Bremen, Germany",2026-05-22,https://www.linkedin.com/jobs/view/4411505999 , ,li-4411505999,fulltime,,,,,,False,mid-senior level,Project Management and Information Technology,,,Defense and Space Manufacturing,https://de.linkedin.com/company/rheinmetall,,,,,,,,,,,
linkedin,Software Development Project Lead,Berlin Bytes,"Berlin, Germany",2026-05-22,https://www.linkedin.com/jobs/view/4414096038 , ,li-4414096038,fulltime,,,,,,False,director,"Product Management, Project Management, and Consulting",,,"Software Development, IT Services and IT Consulting, and Design Services",https://de.linkedin.com/company/berlin-bytes,,,,,,,,,,,
linkedin,CSA Project Manager,Mercury,"Frankfurt, Hesse, Germany",2026-05-22,https://www.linkedin.com/jobs/view/4368249838 , ,li-4368249838,fulltime,,,,,,False,mid-senior level,Other,,,Construction,https://ie.linkedin.com/company/mercury-engineering,,,,,,,,,,,
linkedin,Product Manager Biotech & Pharma,Atlas Copco,"Leonberg, Bavaria, Germany",2026-05-22,https://www.linkedin.com/jobs/view/4368214148 , ,li-4368214148,fulltime,,,,,,True,not applicable,Product Management and Marketing,,,Machinery Manufacturing,https://se.linkedin.com/company/atlas-copco,,,,,,,,,,,
linkedin,Site Project Manager for Construction Sites worldwide (f/m/d),Siemens Energy,"Frankfurt, Hesse, Germany",2026-05-22,https://www.linkedin.com/jobs/view/4417197807 , ,li-4417197807,fulltime,,,,,,True,associate,Project Management,,,"Appliances, Electrical, and Electronics Manufacturing",https://www.linkedin.com/company/siemens-energy,,,,,,,,,,,
linkedin,Project Site  Manager - electrical/data centres (m/w/d),Eaton,"Hannover, Lower Saxony, Germany",2026-05-22,https://www.linkedin.com/jobs/view/4385014678 , ,li-4385014678,fulltime,,,,,,False,mid-senior level,Other,,,"Appliances, Electrical, and Electronics Manufacturing",https://ie.linkedin.com/company/eaton,,,,,,,,,,,
linkedin,Project Site  Manager - electrical/data centres (m/w/d),Eaton,"Bremen, Bremen, Germany",2026-05-22,https://www.linkedin.com/jobs/view/4385017579 , ,li-4385017579,fulltime,,,,,,False,mid-senior level,Other,,,"Appliances, Electrical, and Electronics Manufacturing",https://ie.linkedin.com/company/eaton,,,,,,,,,,,
linkedin,Team Lead Group-Accounting (all genders),Contabo,"Cologne, North Rhine-Westphalia, Germany",2026-05-22,https://www.linkedin.com/jobs/view/4387701621 , ,li-4387701621,fulltime,,,,,,True,mid-senior level,Accounting/Auditing and Finance,,maximilian.kasemir@contabo.de,Software Development,https://de.linkedin.com/company/contabo-gmbh,,,,,,,,,,,
linkedin,(Senior) Manager Procurement Excellence and Digitalization (m/w/d),IONITY,"Munich, Bavaria, Germany",2026-05-22,https://www.linkedin.com/jobs/view/4410473463 , ,li-4410473463,fulltime,,,,,,False,mid-senior level,Project Management,,,Software Development,https://de.linkedin.com/company/ionity,,,,,,,,,,,
linkedin,Team Lead Presales (m/w/d),think about IT GmbH,"Bochum, North Rhine-Westphalia, Germany",2026-05-22,https://www.linkedin.com/jobs/view/4414300034 , ,li-4414300034,fulltime,,,,,,False,mid-senior level,Sales,,,IT Services and IT Consulting,https://de.linkedin.com/company/think-about-it-gmbh,,,,,,,,,,,
linkedin,Dokumentenmanager Projektabwicklung (all gender),ALTEN Germany,"Erlangen, Bavaria, Germany",2026-05-22,https://www.linkedin.com/jobs/view/4395662099 , ,li-4395662099,fulltime,,,,,,False,associate,Engineering,,,Engineering Services,https://de.linkedin.com/company/altengermany,,,,,,,,,,,
linkedin,"Partner, Infrastructures & Energy (F/M)",Mews Partners,,2026-05-22,https://www.linkedin.com/jobs/view/4418109836 , ,li-4418109836,fulltime,,,,,,False,director,Consulting,,,Business Consulting and Services,https://fr.linkedin.com/company/mews-partners,,,,,,,,,,,
linkedin,"Environment, Health and Safety Manager",g2 Recruitment,"Frankfurt, Hesse, Germany",2026-05-22,https://www.linkedin.com/jobs/view/4418146513 , ,li-4418146513,contract,,,,,,False,mid-senior level,Engineering,,,Construction,https://de.linkedin.com/company/g2-recruitment-solutions,,,,,,,,,,,
linkedin,Consultant (w/m/d) BI & Analytics (all levels),Horváth,"Stuttgart, Baden-Württemberg, Germany",2026-05-22,https://www.linkedin.com/jobs/view/3580585619 , ,li-3580585619,fulltime,,,,,,True,not applicable,Management and Consulting,,,Business Consulting and Services,https://de.linkedin.com/company/horvathpartners,,,,,,,,,,,
linkedin,Founders Associate (all genders),PartsCloud • AI-powered spare parts planning,"Stuttgart, Baden-Württemberg, Germany",2026-05-22,https://www.linkedin.com/jobs/view/4414345773 , ,li-4414345773,fulltime,,,,,,True,associate,Analyst and Management,,,Software Development,https://de.linkedin.com/company/partscloud-gmbh,,,,,,,,,,,
linkedin,Senior Manager Strategic Projects Chief People Office (all genders) part-/full-time,Merck Group,"Darmstadt, Hesse, Germany",2026-05-22,https://www.linkedin.com/jobs/view/4418194594 , ,li-4418194594,fulltime,,,,,,False,mid-senior level,Other,,,Pharmaceutical Manufacturing,https://de.linkedin.com/company/merck-group,,,,,,,,,,,
linkedin,Principal Threat Intelligence Consultant (m/w/d),NVISO Security,"Munich, Bavaria, Germany",2026-05-22,https://www.linkedin.com/jobs/view/4414350294 , ,li-4414350294,fulltime,,,,,,False,associate,Information Technology,,,IT Services and IT Consulting,https://be.linkedin.com/company/nviso-cyber,,,,,,,,,,,
linkedin,Founders Associate (m/f/x),Lumaly,"Berlin, Berlin, Germany",2026-05-22,https://www.linkedin.com/jobs/view/4414092353 , ,li-4414092353,fulltime,,,,,,False,entry level,Management,,,IT Services and IT Consulting,https://de.linkedin.com/company/lumaly,,,,,,,,,,,
linkedin,Project Manager (Straßenbaumeister),Manning Global AG,"Frankfurt, Hesse, Germany",2026-05-22,https://www.linkedin.com/jobs/view/4418147070 , ,li-4418147070,fulltime,,,,,,False,mid-senior level,Project Management,,,IT Services and IT Consulting and Telecommunications,https://de.linkedin.com/company/manning-global-gmbh,,,,,,,,,,,
