site,title,company,location,date_posted,job_url,job_url_direct,id,job_type,salary_source,interval,min_amount,max_amount,currency,is_remote,job_level,job_function,listing_type,emails,company_industry,company_url,company_url_direct,company_addresses,company_num_employees,company_revenue,company_description,skills,experience_range,company_rating,company_reviews_count,vacancy_count,work_from_home_type
linkedin,Product Manager B2B SaaS (m/f/d),MAKE WORK FLOW,"Hamburg, Germany",2026-05-07,https://www.linkedin.com/jobs/view/4409240750 , ,li-4409240750,fulltime,,,,,,True,mid-senior level,Product Management and Marketing,,markus.bosse@makeworkflow.de,IT System Operations and Maintenance,https://de.linkedin.com/company/makeworkflow,,,,,,,,,,,
linkedin,Product Manager,SANY Crane,"Baden-Württemberg, Germany",2026-05-07,https://www.linkedin.com/jobs/view/4411419252 , ,li-4411419252,fulltime,,,,,,False,mid-senior level,Engineering and Manufacturing,,,Machinery Manufacturing,https://cn.linkedin.com/company/sany-crane,,,,,,,,,,,
linkedin,Product Manager,Jobgether,,2026-05-07,https://www.linkedin.com/jobs/view/4410447968 , ,li-4410447968,fulltime,,,,,,True,mid-senior level,Product Management and Marketing,,,Internet Marketplace Platforms,https://be.linkedin.com/company/jobgether,,,,,,,,,,,
linkedin,Site Manufacturing Project Leader (m/w/d),OPmobility,"Sterbfritz, Hesse, Germany",2026-05-07,https://www.linkedin.com/jobs/view/4409600218 , ,li-4409600218,fulltime,,,,,,False,not applicable,"Research, Design, and Engineering",,,Motor Vehicle Manufacturing and Plastics Manufacturing,https://www.linkedin.com/company/opmobility,,,,,,,,,,,
linkedin,Expert PMS-Consultant (m/w/d),KELLERGROUP,"Hamburg, Germany",2026-05-07,https://www.linkedin.com/jobs/view/4409257201 , ,li-4409257201,fulltime,,,,,,False,mid-senior level,Project Management and Information Technology,,bewerbung@kellergroup.de,"Transportation, Logistics, Supply Chain and Storage",https://de.linkedin.com/company/kellergroup-logistik,,,,,,,,,,,
linkedin,Central Operations Specialist,World,"Munich, Bavaria, Germany",2026-05-07,https://www.linkedin.com/jobs/view/4411679031 , ,li-4411679031,fulltime,,,,,,False,mid-senior level,Management and Manufacturing,,,"Technology, Information and Internet",https://www.linkedin.com/company/worldofficial,,,,,,,,,,,
linkedin,Senior Project Manager Digital Marketing (m/w/d),Think11,,2026-05-07,https://www.linkedin.com/jobs/view/4409234944 , ,li-4409234944,fulltime,,,,,,True,associate,Marketing,,,Advertising Services,https://de.linkedin.com/company/think11,,,,,,,,,,,
linkedin,Project Manager Digital Strategy (m/f/d),Knauf Digital,"Munich, Bavaria, Germany",2026-05-07,https://www.linkedin.com/jobs/view/4401869594 , ,li-4401869594,fulltime,,,,,,True,associate,Project Management and Information Technology,,,"IT Services and IT Consulting, Software Development, and Wholesale Building Materials",https://de.linkedin.com/company/knauf-digital,,,,,,,,,,,
linkedin,(Senior) Digital Project Manager (m/w/d),schoene neue kinder GmbH,"Munich, Bavaria, Germany",2026-05-07,https://www.linkedin.com/jobs/view/4410479096 , ,li-4410479096,fulltime,,,,,,False,mid-senior level,Project Management and Information Technology,,,Software Development,https://de.linkedin.com/company/schoene-neue-kinder,,,,,,,,,,,
linkedin,Project Director (m/f/d) - Data Centres,Turner & Townsend,"Frankfurt am Main, Hesse, Germany",2026-05-07,https://www.linkedin.com/jobs/view/4401863479 , ,li-4401863479,fulltime,,,,,,False,director,Consulting,,,"Construction, Civil Engineering, and Business Consulting and Services",https://uk.linkedin.com/company/turner-&-townsend,,,,,,,,,,,
linkedin,Program & Project Manager – Aerospace/Defence,TXT GROUP,"Hamburg, Hamburg, Germany",2026-05-07,https://www.linkedin.com/jobs/view/4410827223 , ,li-4410827223,fulltime,,,,,,False,entry level,Project Management and Information Technology,,,IT Services and IT Consulting,https://it.linkedin.com/company/txtgroup,,,,,,,,,,,
linkedin,Architectural Project Manager,LBH Consultancy,"Berlin, Germany",2026-05-07,https://www.linkedin.com/jobs/view/4400197413 , ,li-4400197413,fulltime,,,,,,False,mid-senior level,Project Management,,,Architecture and Planning and Civil Engineering,https://uk.linkedin.com/company/lbh-consultancy,,,,,,,,,,,
linkedin,Program Coordinator,ACN International Aid to the Church in Need,"Königstein im Taunus, Hesse, Germany",2026-05-07,https://www.linkedin.com/jobs/view/4409271078 , ,li-4409271078,fulltime,,,,,,False,mid-senior level,Other,,,Non-profit Organizations,https://de.linkedin.com/company/acn-international-aid-to-the-church-in-need,,,,,,,,,,,
linkedin,(Junior/Senior) Projekt Manager Logistik (w/m/d) Lager & Aufbereitung,Bw Bekleidungsmanagement GmbH,"Cologne, North Rhine-Westphalia, Germany",2026-05-07,https://www.linkedin.com/jobs/view/4368993125 , ,li-4368993125,fulltime,,,,,,True,mid-senior level,Project Management and Information Technology,,-zentrallogistik@bwbm.de,"Transportation, Logistics, Supply Chain and Storage",https://de.linkedin.com/company/bw-bekleidungsmanagement,,,,,,,,,,,
linkedin,Junior IT Projektmanager (w/m/d),Bechtle,"Düsseldorf, North Rhine-Westphalia, Germany",2026-05-07,https://www.linkedin.com/jobs/view/4411650892 , ,li-4411650892,fulltime,,,,,,False,entry level,Project Management and Information Technology,,,IT Services and IT Consulting,https://de.linkedin.com/company/bechtle,,,,,,,,,,,
linkedin,Partner Marketing Manager,Jobgether,,2026-05-07,https://www.linkedin.com/jobs/view/4410459240 , ,li-4410459240,fulltime,,,,,,True,mid-senior level,Marketing and Sales,,,Internet Marketplace Platforms,https://be.linkedin.com/company/jobgether,,,,,,,,,,,
linkedin,Salesforce Project Manager (m/f/d),Nagarro,,2026-05-07,https://www.linkedin.com/jobs/view/4379616941 , ,li-4379616941,fulltime,,,,,,False,mid-senior level,Engineering,,,IT Services and IT Consulting,https://de.linkedin.com/company/nagarro,,,,,,,,,,,
linkedin,Supply Chain Manager (m/w/d),MBG International Premium Brands GmbH,"Paderborn, North Rhine-Westphalia, Germany",2026-05-07,https://www.linkedin.com/jobs/view/4409286552 , ,li-4409286552,fulltime,,,,,,False,associate,Administrative,,,Wholesale Import and Export,https://de.linkedin.com/company/mbg-international-premium-brands-gmbh,,,,,,,,,,,
linkedin,Customer Success (m/f/d),Boardwise,,2026-05-07,https://www.linkedin.com/jobs/view/4409242443 , ,li-4409242443,fulltime,,,,,,True,associate,Customer Service,,Jasper.Schiffer@boardwise.io,"Technology, Information and Media",https://de.linkedin.com/company/boardwise1,,,,,,,,,,,
linkedin,Project Manager,Actalent,"Berlin, Germany",2026-05-07,https://www.linkedin.com/jobs/view/4411642440 , ,li-4411642440,fulltime,,,,,,False,associate,Engineering,,,"Engineering Services, Construction, and Building Construction",https://www.linkedin.com/company/actalentservices,,,,,,,,,,,
linkedin,Project Manager,"CloudHQ, LLC","Frankfurt, Hesse, Germany",2026-05-07,https://www.linkedin.com/jobs/view/4410812063 , ,li-4410812063,fulltime,,,,,,False,mid-senior level,Project Management,,,Construction,https://www.linkedin.com/company/cloudhq-llc,,,,,,,,,,,
linkedin,DE Social Media Manager,eBay,,2026-05-07,https://www.linkedin.com/jobs/view/4402610292 , ,li-4402610292,fulltime,,,,,,False,mid-senior level,Marketing and Sales,,talent@ebay.com,"Technology, Information and Internet",https://www.linkedin.com/company/ebay,,,,,,,,,,,
linkedin,Project Manager / Product Owner (m/w/d),Funkwerk AG,"Kölleda, Thuringia, Germany",2026-05-07,https://www.linkedin.com/jobs/view/4409633358 , ,li-4409633358,fulltime,,,,,,False,entry level,Project Management and Information Technology,,,Holding Companies,https://de.linkedin.com/company/funkwerk-ag,,,,,,,,,,,
linkedin,Projektmanager:in (m/w/d),CARECOS Kosmetik GmbH,"Kehl, Baden-Württemberg, Germany",2026-05-07,https://www.linkedin.com/jobs/view/4409284427 , ,li-4409284427,fulltime,,,,,,False,associate,Project Management,,,Personal Care Product Manufacturing,https://de.linkedin.com/company/carecos-kosmetik-gmbh,,,,,,,,,,,
linkedin,Senior Project Scheduler (m/f/d) - Offshore Energy sector,Turner & Townsend,"Hamburg, Hamburg, Germany",2026-05-07,https://www.linkedin.com/jobs/view/4401870365 , ,li-4401870365,fulltime,,,,,,False,mid-senior level,Project Management,,,"Construction, Civil Engineering, and Business Consulting and Services",https://uk.linkedin.com/company/turner-&-townsend,,,,,,,,,,,
linkedin,Projektmanager (m/w/d) - Elektrotechnik,TLD Planungsgruppe GmbH,"Taufkirchen, Bavaria, Germany",2026-05-07,https://www.linkedin.com/jobs/view/4409232686 , ,li-4409232686,fulltime,,,,,,False,director,Engineering,,,Architecture and Planning,https://de.linkedin.com/company/tld-planungsgruppe-gmbh,,,,,,,,,,,
linkedin,Project Technical Leader - Battery (M/F),TotalEnergies,,2026-05-07,https://www.linkedin.com/jobs/view/4411649632 , ,li-4411649632,fulltime,,,,,,True,mid-senior level,Project Management and Information Technology,,,Oil and Gas,https://fr.linkedin.com/company/totalenergies,,,,,,,,,,,
linkedin,Project Manager (f/m/d) – physical security for a global logistics and tech company,Adecco,"Berlin, Germany",2026-05-07,https://www.linkedin.com/jobs/view/4410804276 , ,li-4410804276,fulltime,,,,,,False,associate,Project Management,,tatewik.ispirjan@adecco.de,"Engineering Services, Transportation, Logistics, Supply Chain and Storage, and Technology, Information and Media",https://ch.linkedin.com/company/adecco,,,,,,,,,,,
linkedin,Senior Product Owner (100% Remote Germany),Matomo,"Stuttgart, Baden-Württemberg, Germany",2026-05-06,https://www.linkedin.com/jobs/view/4411282662 , ,li-4411282662,fulltime,,,,,,True,not applicable,Product Management and Marketing,,,"Technology, Information and Internet",https://nz.linkedin.com/company/matomo,,,,,,,,,,,
linkedin,Senior Product Owner (100% Remote Germany),Matomo,"Frankfurt, Hesse, Germany",2026-05-06,https://www.linkedin.com/jobs/view/4411295005 , ,li-4411295005,fulltime,,,,,,True,not applicable,Product Management and Marketing,,,"Technology, Information and Internet",https://nz.linkedin.com/company/matomo,,,,,,,,,,,
linkedin,Product Manager,BYD EUROPE,"Frankfurt, Hesse, Germany",2026-05-06,https://www.linkedin.com/jobs/view/4409970807 , ,li-4409970807,fulltime,,,,,,False,mid-senior level,Product Management and Marketing,,,Motor Vehicle Manufacturing,https://nl.linkedin.com/company/bydeurope,,,,,,,,,,,
linkedin,Technical Product Manager (f/m/x) ＿Metrify,Enpal,"Berlin, Berlin, Germany",2026-05-06,https://www.linkedin.com/jobs/view/4411220647 , ,li-4411220647,fulltime,,,,,,False,mid-senior level,Product Management and Marketing,,,Energy Technology,https://de.linkedin.com/company/enpal,,,,,,,,,,,
linkedin,Productmanager Satellitencommunication (m/w/d),ND SATCOM,"Immenstaad am Bodensee, Baden-Württemberg, Germany",2026-05-06,https://www.linkedin.com/jobs/view/4411215306 , ,li-4411215306,fulltime,,,,,,False,entry level,Product Management and Marketing,,,Telecommunications,https://de.linkedin.com/company/nd-satcom,,,,,,,,,,,
linkedin,Senior Projektleiter (m/w/d) Lüftungs- & Kältetechnik – Industrie & Gewerbe,Ludwig Hammer GmbH,"Hamburg, Hamburg, Germany",2026-05-06,https://www.linkedin.com/jobs/view/4411259925 , ,li-4411259925,fulltime,,,,,,False,mid-senior level,Information Technology,,,Construction,https://de.linkedin.com/company/ludwig-hammer-gmbh,,,,,,,,,,,
linkedin,Senior Project Manager (m/w/d),DEPT®,"Hamburg, Hamburg, Germany",2026-05-06,https://www.linkedin.com/jobs/view/4402297938 , ,li-4402297938,fulltime,,,,,,False,mid-senior level,Project Management and Information Technology,,,Advertising Services,https://nl.linkedin.com/company/deptagency,,,,,,,,,,,
linkedin,Senior Project Manager (m/w/d),DEPT®,"Berlin, Berlin, Germany",2026-05-06,https://www.linkedin.com/jobs/view/4402510397 , ,li-4402510397,fulltime,,,,,,False,mid-senior level,Project Management and Information Technology,,,Advertising Services,https://nl.linkedin.com/company/deptagency,,,,,,,,,,,
linkedin,Program Manager - Global Manufacturing Footprint Optimization,ABB,"Frankfurt, Hesse, Germany",2026-05-06,https://www.linkedin.com/jobs/view/4409960821 , ,li-4409960821,fulltime,,,,,,False,director,Project Management and Information Technology,,,Automation Machinery Manufacturing,https://ch.linkedin.com/company/abb,,,,,,,,,,,
linkedin,Project / Operations Manager (m/w/d) / Brand Experience & OOH,Ultra OOH GmbH,"Berlin, Germany",2026-05-06,https://www.linkedin.com/jobs/view/4409212131 , ,li-4409212131,fulltime,,,,,,False,mid-senior level,Management and Manufacturing,,,Advertising Services,https://de.linkedin.com/company/ultraooh,,,,,,,,,,,
linkedin,Project Manager for PLM and IoT System Solutions,CONTACT Software,"Berlin, Berlin, Germany",2026-05-06,https://www.linkedin.com/jobs/view/4360575820 , ,li-4360575820,fulltime,,,,,,False,mid-senior level,Project Management and Information Technology,,,Software Development,https://de.linkedin.com/company/contact-software,,,,,,,,,,,
linkedin,Technical Product Lead,Kombo,,2026-05-06,https://www.linkedin.com/jobs/view/4411239671 , ,li-4411239671,fulltime,,,,,,False,mid-senior level,Other,,,Software Development,https://www.linkedin.com/company/kombo-api,,,,,,,,,,,
linkedin,Marketing Project Manager,Jobgether,,,https://www.linkedin.com/jobs/view/4414125268 , ,li-4414125268,fulltime,,,,,,True,mid-senior level,Project Management and Information Technology,,,Internet Marketplace Platforms,https://be.linkedin.com/company/jobgether,,,,,,,,,,,
linkedin,Project Manager,Airswift,"Espelkamp, North Rhine-Westphalia, Germany",,https://www.linkedin.com/jobs/view/4414217040 , ,li-4414217040,contract,,,,,,True,mid-senior level,Business Development,,,Staffing and Recruiting,https://www.linkedin.com/company/airswift,,,,,,,,,,,
linkedin,Senior Project Coordinator,Jobgether,,,https://www.linkedin.com/jobs/view/4413846777 , ,li-4413846777,fulltime,,,,,,True,entry level,Project Management and Information Technology,,,Internet Marketplace Platforms,https://be.linkedin.com/company/jobgether,,,,,,,,,,,
linkedin,Project Manager,Us3 Consulting,,,https://www.linkedin.com/jobs/view/4413965843 , ,li-4413965843,contract,,,,,,True,associate,Information Technology,,divya@us3consulting.nl,Information Technology & Services and Financial Services,https://nl.linkedin.com/company/us3-consulting,,,,,,,,,,,
linkedin,Program Manager / Projektmanager Automotiv (all gender),ALTEN Germany,"Munich, Bavaria, Germany",,https://www.linkedin.com/jobs/view/4400833451 , ,li-4400833451,fulltime,,,,,,False,entry level,Project Management,,,Motor Vehicle Manufacturing,https://de.linkedin.com/company/altengermany,,,,,,,,,,,
linkedin,Project Manager,Mammoet,"Leuna, Saxony-Anhalt, Germany",,https://www.linkedin.com/jobs/view/4413706909 , ,li-4413706909,fulltime,,,,,,False,associate,Project Management and Information Technology,,bewerbung@mammoet.com,Engineering Services,https://nl.linkedin.com/company/mammoet,,,,,,,,,,,
linkedin,Healthcare Project Manager (w/m/d),myoncare,"Munich, Bavaria, Germany",,https://www.linkedin.com/jobs/view/4410397967 , ,li-4410397967,fulltime,,,,,,False,mid-senior level,Other,,,Software Development,https://de.linkedin.com/company/myoncare-gmbh,,,,,,,,,,,
linkedin,Technical Project Manager (Heat Pumps & PV/BESS),enshift AG,"Düsseldorf, North Rhine-Westphalia, Germany",,https://www.linkedin.com/jobs/view/4414126361 , ,li-4414126361,fulltime,,,,,,False,director,Project Management,,,Real Estate,https://ch.linkedin.com/company/enshift-ag,,,,,,,,,,,
linkedin,Projektmanager M&A (m/w/d),VentureLink,"Frankfurt am Main, Hesse, Germany",,https://www.linkedin.com/jobs/view/4413942714 , ,li-4413942714,fulltime,,,,,,False,associate,Consulting,,,Investment Management and Investment Banking,https://de.linkedin.com/company/venturelink-partners,,,,,,,,,,,
linkedin,Technical Product Delivery Manager (m/w/d),SOTEC,"Ostelsheim, Baden-Württemberg, Germany",,https://www.linkedin.com/jobs/view/4410386476 , ,li-4410386476,fulltime,,,,,,False,mid-senior level,Project Management and Information Technology,,job@sotec.eu,IT Services and IT Consulting,https://de.linkedin.com/company/sotec-gmbhucokg,,,,,,,,,,,
linkedin,Supplier Quality Data Project Manager (m/w/d),Diehl Defence,"Überlingen, Baden-Württemberg, Germany",,https://www.linkedin.com/jobs/view/4413564804 , ,li-4413564804,fulltime,,,,,,False,mid-senior level,Project Management and Information Technology,,,"Appliances, Electrical, and Electronics Manufacturing",https://de.linkedin.com/company/diehl-defence,,,,,,,,,,,
linkedin,Project Manager (m/f/d),AECOM,"Essen, North Rhine-Westphalia, Germany",,https://www.linkedin.com/jobs/view/4412958518 , ,li-4412958518,fulltime,,,,,,False,entry level,Project Management and Information Technology,,,"Architecture and Planning, Civil Engineering, and Construction",https://www.linkedin.com/company/aecom,,,,,,,,,,,
linkedin,Projektmanagement Assistenz (w/m/d),SIDESTREAM,"Cologne, North Rhine-Westphalia, Germany",,https://www.linkedin.com/jobs/view/4410625234 , ,li-4410625234,fulltime,,,,,,True,entry level,Administrative,,,IT Services and IT Consulting,https://de.linkedin.com/company/sidestreamtech,,,,,,,,,,,
linkedin,Project Engineering Manager for Service (f/m/d),Siemens Energy,"Erlangen, Bavaria, Germany",,https://www.linkedin.com/jobs/view/4413804221 , ,li-4413804221,fulltime,,,,,,True,associate,Sales,,,"Appliances, Electrical, and Electronics Manufacturing",https://www.linkedin.com/company/siemens-energy,,,,,,,,,,,
linkedin,Project Engineering Manager for Service (f/m/d),Siemens Energy,"Berlin, Berlin, Germany",,https://www.linkedin.com/jobs/view/4413592704 , ,li-4413592704,fulltime,,,,,,True,associate,Sales,,,"Appliances, Electrical, and Electronics Manufacturing",https://www.linkedin.com/company/siemens-energy,,,,,,,,,,,
linkedin,Projektmanager Objektmanagement HLSK (W/M/D),Stadt Pforzheim,"Pforzheim, Baden-Württemberg, Germany",,https://www.linkedin.com/jobs/view/4413496423 , ,li-4413496423,fulltime,,,,,,False,mid-senior level,Sales and Management,,,Government Administration,https://de.linkedin.com/company/stadt-pforzheim,,,,,,,,,,,
linkedin,Projektmanager Order Implementation (f/m/d),Siemens Energy,"Erfurt, Thuringia, Germany",,https://www.linkedin.com/jobs/view/4413589887 , ,li-4413589887,fulltime,,,,,,True,associate,Customer Service,,,"Appliances, Electrical, and Electronics Manufacturing",https://www.linkedin.com/company/siemens-energy,,,,,,,,,,,
linkedin,(Senior) Sustainability Project Manager - Regulated Markets,Meo Carbon Solutions,"Cologne, North Rhine-Westphalia, Germany",,https://www.linkedin.com/jobs/view/4413925549 , ,li-4413925549,fulltime,,,,,,True,associate,Project Management and Consulting,,,Business Consulting and Services and Environmental Services,https://de.linkedin.com/company/meo-consulting-team,,,,,,,,,,,
linkedin,Operational Excellence Manager (m/w/d)*,SCHOTT,"Mainz, Rhineland-Palatinate, Germany",,https://www.linkedin.com/jobs/view/4413841768 , ,li-4413841768,fulltime,,,,,,False,mid-senior level,Management and Manufacturing,,,"Glass, Ceramics and Concrete Manufacturing",https://de.linkedin.com/company/schott,,,,,,,,,,,
linkedin,Projektleitung (m/w/d) Baugenehmigung & Bauaufsicht als Elternzeitvertretung,catchHR Jobs,"Hemer, North Rhine-Westphalia, Germany",,https://www.linkedin.com/jobs/view/4413883714 , ,li-4413883714,parttime,,,,,,False,mid-senior level,Project Management,,,Government Administration,https://www.linkedin.com/showcase/catch-hr-jobs/,,,,,,,,,,,
linkedin,Projektmanager (m/w/d) Eventorganisation,Mewa,"Wiesbaden, Hesse, Germany",,https://www.linkedin.com/jobs/view/4410330772 , ,li-4410330772,fulltime,,,,,,False,associate,Project Management,,,Textile Manufacturing,https://de.linkedin.com/company/mewa-textil-management,,,,,,,,,,,
linkedin,Senior Project Manager,LBH Consultancy,"Berlin, Germany",,https://www.linkedin.com/jobs/view/4401966489 , ,li-4401966489,fulltime,,,,,,False,mid-senior level,Project Management,,,"Construction, Building Construction, and Architecture and Planning",https://uk.linkedin.com/company/lbh-consultancy,,,,,,,,,,,
linkedin,Technical Project Manager,WHITEvoid,"Berlin, Berlin, Germany",,https://www.linkedin.com/jobs/view/4410602859 , ,li-4410602859,fulltime,,,,,,False,director,Other,,,Performing Arts,https://de.linkedin.com/company/whitevoid,,,,,,,,,,,
linkedin,Senior Project Manager (f/m/d),Thinkproject,"Berlin, Germany",,https://www.linkedin.com/jobs/view/4381751013 , ,li-4381751013,fulltime,,,,,,False,mid-senior level,Project Management and Information Technology,,,Software Development,https://de.linkedin.com/company/thinkproject-group,,,,,,,,,,,
linkedin,Senior Consultant- Cloud Transformation Manager ( m/w/d)- Deutschlandweit,Infosys Consulting,"Frankfurt am Main, Hesse, Germany",,https://www.linkedin.com/jobs/view/4413980437 , ,li-4413980437,fulltime,,,,,,False,not applicable,Business Development and Sales,,,Business Consulting and Services,https://in.linkedin.com/company/infosysconsulting,,,,,,,,,,,
linkedin,Senior IT-Projektleitung,BUTTING Group,"Wittingen, Lower Saxony, Germany",,https://www.linkedin.com/jobs/view/4267163859 , ,li-4267163859,fulltime,,,,,,False,director,Project Management and Information Technology,,,Fabricated Metal Products,https://de.linkedin.com/company/butting-group,,,,,,,,,,,
linkedin,Key Account Manager (m/f/x) Tommy Hilfiger & Calvin Klein Menswear,Tommy Hilfiger,"Düsseldorf, North Rhine-Westphalia, Germany",,https://www.linkedin.com/jobs/view/4414232243 , ,li-4414232243,fulltime,,,,,,False,mid-senior level,Sales and Business Development,,,Retail Apparel and Fashion,https://nl.linkedin.com/company/tommy-hilfiger,,,,,,,,,,,
linkedin,(Senior) Projektleiter / Lead Construction Manager (w/m/d) EPCM Industry – Semiconductor Fabrication Plant,Drees & Sommer,"Stuttgart, Baden-Württemberg, Germany",,https://www.linkedin.com/jobs/view/4410613639 , ,li-4410613639,fulltime,,,,,,False,associate,Engineering and Project Management,,,Real Estate,https://de.linkedin.com/company/drees-&-sommer,,,,,,,,,,,
linkedin,Manager Financial Institutions (all genders) - BCG Platinion,BCG Platinion,"Düsseldorf, North Rhine-Westphalia, Germany",,https://www.linkedin.com/jobs/view/4156637181 , ,li-4156637181,fulltime,,,,,,False,mid-senior level,Finance and Sales,,,Business Consulting and Services,https://de.linkedin.com/company/bcg-platinion,,,,,,,,,,,
linkedin,Senior Projektleiter (w/m/d) Installation von Umrichterstationen,Siemens,"Erlangen, Bavaria, Germany",,https://www.linkedin.com/jobs/view/4413563738 , ,li-4413563738,fulltime,,,,,,False,mid-senior level,Engineering,,,Automation Machinery Manufacturing,https://de.linkedin.com/company/siemens,,,,,,,,,,,
linkedin,Senior Projektleiter (w/m/d) Installation von Umrichterstationen,Siemens,"Berlin, Berlin, Germany",,https://www.linkedin.com/jobs/view/4413561863 , ,li-4413561863,fulltime,,,,,,False,mid-senior level,Engineering,,,Automation Machinery Manufacturing,https://de.linkedin.com/company/siemens,,,,,,,,,,,
linkedin,Manager Financial Institutions (all genders) - BCG Platinion,BCG Platinion,"Hamburg, Hamburg, Germany",,https://www.linkedin.com/jobs/view/4156637182 , ,li-4156637182,fulltime,,,,,,False,mid-senior level,Finance and Sales,,,Business Consulting and Services,https://de.linkedin.com/company/bcg-platinion,,,,,,,,,,,
linkedin,"Project Leader or Principal, Operations - Service and Corporate Operations",Boston Consulting Group (BCG),"Berlin, Berlin, Germany",,https://www.linkedin.com/jobs/view/4323638571 , ,li-4323638571,fulltime,,,,,,False,mid-senior level,Project Management and Information Technology,,,Business Consulting and Services,https://www.linkedin.com/company/boston-consulting-group,,,,,,,,,,,
linkedin,"Project Leader or Principal, Operations - Service and Corporate Operations",Boston Consulting Group (BCG),"Hamburg, Hamburg, Germany",,https://www.linkedin.com/jobs/view/4323548745 , ,li-4323548745,fulltime,,,,,,False,mid-senior level,Project Management and Information Technology,,,Business Consulting and Services,https://www.linkedin.com/company/boston-consulting-group,,,,,,,,,,,
linkedin,"Project Leader or Principal, Operations - Service and Corporate Operations",Boston Consulting Group (BCG),"Düsseldorf, North Rhine-Westphalia, Germany",,https://www.linkedin.com/jobs/view/4323568685 , ,li-4323568685,fulltime,,,,,,False,mid-senior level,Project Management and Information Technology,,,Business Consulting and Services,https://www.linkedin.com/company/boston-consulting-group,,,,,,,,,,,
linkedin,"Project Leader or Principal, Operations - Service and Corporate Operations",Boston Consulting Group (BCG),"Cologne, North Rhine-Westphalia, Germany",,https://www.linkedin.com/jobs/view/4323588783 , ,li-4323588783,fulltime,,,,,,False,mid-senior level,Project Management and Information Technology,,,Business Consulting and Services,https://www.linkedin.com/company/boston-consulting-group,,,,,,,,,,,
linkedin,Project management officer (PMO) H/F,ALTEN,"Munich, Bavaria, Germany",,https://www.linkedin.com/jobs/view/4410374163 , ,li-4410374163,fulltime,,,,,,False,mid-senior level,"Production, Distribution, and Engineering",,,Software Development and IT Services and IT Consulting,https://fr.linkedin.com/company/alten,,,,,,,,,,,
linkedin,Content Creation Specialist,Jobgether,,,https://www.linkedin.com/jobs/view/4410360166 , ,li-4410360166,fulltime,,,,,,True,entry level,"Marketing, Public Relations, and Writing/Editing",,,Internet Marketplace Platforms,https://be.linkedin.com/company/jobgether,,,,,,,,,,,
linkedin,Chief of Staff,ERC System,"Munich, Bavaria, Germany",,https://www.linkedin.com/jobs/view/4410388276 , ,li-4410388276,fulltime,,,,,,False,mid-senior level,Administrative,,,Aviation & Aerospace,https://de.linkedin.com/company/erc-system,,,,,,,,,,,
