site,title,company,location,date_posted,job_url,job_url_direct,id,job_type,salary_source,interval,min_amount,max_amount,currency,is_remote,job_level,job_function,listing_type,emails,company_industry,company_url,company_url_direct,company_addresses,company_num_employees,company_revenue,company_description,skills,experience_range,company_rating,company_reviews_count,vacancy_count,work_from_home_type
linkedin,(Senior) Project Manager in Procurement / Supply Chain Management (f/m/d),Inverto | A BCG Company,"Berlin, Berlin, Germany",2026-06-21,https://www.linkedin.com/jobs/view/4376545767 , ,li-4376545767,fulltime,,,,,,False,mid-senior level,"Consulting, Purchasing, and Supply Chain",,,"Business Consulting and Services and Transportation, Logistics, Supply Chain and Storage",https://de.linkedin.com/company/inverto-gmbh,,,,,,,,,,,
linkedin,Senior Digital Project Manager (m/w/d),trurnit GmbH,"Leipzig, Saxony, Germany",2026-06-21,https://www.linkedin.com/jobs/view/4431353973 , ,li-4431353973,parttime,,,,,,False,mid-senior level,Administrative,,bewerbung@trurnit.de,Media Production,https://de.linkedin.com/company/trurnit-gruppe-gmbh,,,,,,,,,,,
linkedin,Senior Project Manager (m/f/d),Klarkode,"Hamburg, Hamburg, Germany",2026-06-21,https://www.linkedin.com/jobs/view/4428590103 , ,li-4428590103,fulltime,,,,,,True,mid-senior level,Information Technology,,,IT Services and IT Consulting,https://de.linkedin.com/company/klarkode,,,,,,,,,,,
linkedin,Projektmanager Service (m/w/d),Keil Anlagenbau GmbH & Co. KG,"Bohmte, Lower Saxony, Germany",2026-06-21,https://www.linkedin.com/jobs/view/4430325083 , ,li-4430325083,fulltime,,,,,,False,mid-senior level,Project Management and Information Technology,,,Machinery Manufacturing,https://de.linkedin.com/company/keil-anlagenbau,,,,,,,,,,,
linkedin,Planungskoordinator / Projektleiter (w/m/d),Arcadis,"Stuttgart, Baden-Württemberg, Germany",2026-06-21,https://www.linkedin.com/jobs/view/4418337253 , ,li-4418337253,fulltime,,,,,,False,not applicable,Other,,,Professional Services,https://nl.linkedin.com/company/arcadis,,,,,,,,,,,
linkedin,"Project Manager (m/w/d) Material Handling, Drying and Special Systems",Simar GmbH,"Oberderdingen, Baden-Württemberg, Germany",2026-06-21,https://www.linkedin.com/jobs/view/4428586291 , ,li-4428586291,fulltime,,,,,,False,mid-senior level,Engineering,,,Industrial Machinery Manufacturing,https://de.linkedin.com/company/simar-gmbh,,,,,,,,,,,
linkedin,Projektmanager (m/w/d) im Anlagenbau,Keil Anlagenbau GmbH & Co. KG,"Bohmte, Lower Saxony, Germany",2026-06-21,https://www.linkedin.com/jobs/view/4430326059 , ,li-4430326059,fulltime,,,,,,False,mid-senior level,Project Management and Information Technology,,,Machinery Manufacturing,https://de.linkedin.com/company/keil-anlagenbau,,,,,,,,,,,
linkedin,Projektleiter    Heizung & Sanitär,ELECTRA M&E Deutschland GmbH,"Neuried, Bavaria, Germany",2026-06-21,https://www.linkedin.com/jobs/view/4430334000 , ,li-4430334000,fulltime,,,,,,False,mid-senior level,Project Management,,,Strategic Management Services,https://de.linkedin.com/company/electra-m-e-deutschland-gmbh,,,,,,,,,,,
linkedin,Distribution Transformer Design Manager,L&T Technology Services,"Munich, Bavaria, Germany",2026-06-21,https://www.linkedin.com/jobs/view/4430339294 , ,li-4430339294,fulltime,,,,,,False,mid-senior level,Engineering,,,Engineering Services,https://in.linkedin.com/company/l&t-technology-services-limited,,,,,,,,,,,
linkedin,Projektmanager TGA / MEP (KG 400 – Elektro & HLSK) – Bauherrenseite (m/w/d) - Remote (DE),Ruby Group,,2026-06-21,https://www.linkedin.com/jobs/view/4400193995 , ,li-4400193995,fulltime,,,,,,True,mid-senior level,Engineering and Information Technology,,,Hospitality,https://de.linkedin.com/company/therubygroup,,,,,,,,,,,
linkedin,Project Manager (Germany),Indero (formerly Innovaderm),,2026-06-21,https://www.linkedin.com/jobs/view/4412198959 , ,li-4412198959,fulltime,,,,,,False,not applicable,Project Management and Information Technology,,,Research Services,https://ca.linkedin.com/company/inderocro,,,,,,,,,,,
linkedin,Senior Digital Project Manager (m/w/d),trurnit GmbH,"Frankfurt, Hesse, Germany",2026-06-21,https://www.linkedin.com/jobs/view/4431375030 , ,li-4431375030,parttime,,,,,,False,mid-senior level,Administrative,,bewerbung@trurnit.de,Media Production,https://de.linkedin.com/company/trurnit-gruppe-gmbh,,,,,,,,,,,
linkedin,"Manager / Senior Manager Inhouse Consulting - Commercial Strategy (all genders, full-time/part-time)",Merck Group,"Darmstadt, Hesse, Germany",2026-06-21,https://www.linkedin.com/jobs/view/4403495085 , ,li-4403495085,fulltime,,,,,,True,mid-senior level,Business Development and Sales,,,Pharmaceutical Manufacturing,https://de.linkedin.com/company/merck-group,,,,,,,,,,,
linkedin,(Senior) Product Manager (m/f/d),HELM AG,"Hamburg, Hamburg, Germany",2026-06-21,https://www.linkedin.com/jobs/view/4390716176 , ,li-4390716176,fulltime,,,,,,False,mid-senior level,Product Management and Marketing,,,Chemical Manufacturing,https://de.linkedin.com/company/helmag,,,,,,,,,,,
linkedin,(Senior) Project Manager Energy in Procurement / Supply Chain Management (f/m/d),Inverto | A BCG Company,,2026-06-21,https://www.linkedin.com/jobs/view/4142651625 , ,li-4142651625,fulltime,,,,,,False,mid-senior level,Purchasing and Supply Chain,,,Business Consulting and Services,https://de.linkedin.com/company/inverto-gmbh,,,,,,,,,,,
linkedin,Team Lead Product Management (f/m/d),ZEAL Network SE,"Hamburg, Hamburg, Germany",2026-06-21,https://www.linkedin.com/jobs/view/4411747197 , ,li-4411747197,fulltime,,,,,,False,mid-senior level,Engineering and Information Technology,,,Software Development,https://de.linkedin.com/company/zealnetwork,,,,,,,,,,,
linkedin,IT Product Group Owner (d/f/m) HR Solutions,Schaeffler,"Regensburg, Bavaria, Germany",2026-06-21,https://www.linkedin.com/jobs/view/4381990048 , ,li-4381990048,fulltime,,,,,,False,director,Product Management and Marketing,,,Manufacturing,https://de.linkedin.com/company/schaeffler,,,,,,,,,,,
linkedin,Product Manager Digital Solutions / Phishing (m/w/d),Deutsche Apotheker- und Ärztebank - apoBank,"Düsseldorf, North Rhine-Westphalia, Germany",2026-06-20,https://www.linkedin.com/jobs/view/4431166093 , ,li-4431166093,fulltime,,,,,,False,associate,Information Technology,,,Banking,https://de.linkedin.com/company/apobank,,,,,,,,,,,
linkedin,Practice Director (m/f/d) - SAP Supply Chain Planning,Westernacher Consulting,"Würzburg, Bavaria, Germany",2026-06-20,https://www.linkedin.com/jobs/view/4411335926 , ,li-4411335926,fulltime,,,,,,False,director,Information Technology,,,Business Consulting and Services,https://de.linkedin.com/company/westernacherconsulting,,,,,,,,,,,
linkedin,(Senior) Consultant / Projektleiter Network Solutions (m/w/d),IABG,"Ottobrunn, Bavaria, Germany",2026-06-20,https://www.linkedin.com/jobs/view/4131749975 , ,li-4131749975,fulltime,,,,,,False,mid-senior level,"Consulting, Information Technology, and Sales",,,"IT Services and IT Consulting, Defense and Space Manufacturing, and Motor Vehicle Manufacturing",https://de.linkedin.com/company/iabg,,,,,,,,,,,
linkedin,Senior Projektleiter:in Bau,Deutsche Bahn,"Hamburg, Hamburg, Germany",2026-06-20,https://www.linkedin.com/jobs/view/4412441082 , ,li-4412441082,fulltime,,,,,,False,mid-senior level,Information Technology,,,Truck Transportation,https://de.linkedin.com/company/deutschebahn,,,,,,,,,,,
linkedin,Global SAP Application Expert O2C - Sales & TPM,Hero,"Bad Schwartau, Schleswig-Holstein, Germany",2026-06-20,https://www.linkedin.com/jobs/view/4390394218 , ,li-4390394218,fulltime,,,,,,False,mid-senior level,Engineering and Information Technology,,,Food and Beverage Manufacturing,https://ch.linkedin.com/company/hero-group,,,,,,,,,,,
linkedin,IT Project Excellence & ERP Transformation Manager (all genders),tonies®,"Berlin, Berlin, Germany",2026-06-20,https://www.linkedin.com/jobs/view/4422017529 , ,li-4422017529,fulltime,,,,,,False,mid-senior level,Project Management and Information Technology,,,"Technology, Information and Media",https://de.linkedin.com/company/tonies-gmbh,,,,,,,,,,,
linkedin,Associate Manager Group Strategy (m/w/d),Knorr-Bremse AG,"Munich, Bavaria, Germany",2026-06-20,https://www.linkedin.com/jobs/view/4418303023 , ,li-4418303023,fulltime,,,,,,False,mid-senior level,Business Development and Sales,,,Motor Vehicle Manufacturing,https://de.linkedin.com/company/knorr-bremse,,,,,,,,,,,
linkedin,(Senior) R&D Project Expert (f/m/d) Automated and Autonomous Driving / Train Operation ATO,Siemens,"Berlin, Berlin, Germany",2026-06-20,https://www.linkedin.com/jobs/view/4410822176 , ,li-4410822176,fulltime,,,,,,True,mid-senior level,Engineering,,,Automation Machinery Manufacturing,https://de.linkedin.com/company/siemens,,,,,,,,,,,
linkedin,Restaurant Listing Team Lead,Wolt,"Berlin, Berlin, Germany",2026-06-20,https://www.linkedin.com/jobs/view/4422021334 , ,li-4422021334,fulltime,,,,,,False,mid-senior level,Management and Manufacturing,,,Software Development,https://fi.linkedin.com/company/wolt-oy,,,,,,,,,,,
linkedin,SAP Senior Project Manager - m/w/d,Infosys,"Frankfurt, Hesse, Germany",2026-06-20,https://www.linkedin.com/jobs/view/4375234685 , ,li-4375234685,fulltime,,,,,,False,mid-senior level,Project Management and Information Technology,,,IT Services and IT Consulting,https://in.linkedin.com/company/infosys,,,,,,,,,,,
linkedin,Senior Prozess-/ Projekt-Ingenieur Pharma Frankfurt (m/w/d),PPT Pharma Process Technology Group,"Frankfurt am Main, Hesse, Germany",2026-06-20,https://www.linkedin.com/jobs/view/4349553108 , ,li-4349553108,fulltime,,,,,,False,mid-senior level,Engineering and Information Technology,,,Pharmaceutical Manufacturing,https://de.linkedin.com/company/ppt-pharma-process-technology-gmbh,,,,,,,,,,,
linkedin,Projektleiter/in TGA (m/w/d),Hellmich + Partner Gruppe,"Siegen, North Rhine-Westphalia, Germany",2026-06-20,https://www.linkedin.com/jobs/view/4428537860 , ,li-4428537860,fulltime,,,,,,False,mid-senior level,Other,,,Construction,https://de.linkedin.com/company/hellmich-partner-gruppe,,,,,,,,,,,
linkedin,Product Manager,eBay,,2026-06-20,https://www.linkedin.com/jobs/view/4417946791 , ,li-4417946791,fulltime,,,,,,False,mid-senior level,Product Management and Marketing,,talent@ebay.com,"Technology, Information and Internet",https://www.linkedin.com/company/ebay,,,,,,,,,,,
linkedin,Team Lead for HVDC Control Engineering,Siemens Energy,"Erlangen, Bavaria, Germany",2026-06-20,https://www.linkedin.com/jobs/view/4402713934 , ,li-4402713934,fulltime,,,,,,True,mid-senior level,Engineering,,,"Appliances, Electrical, and Electronics Manufacturing",https://www.linkedin.com/company/siemens-energy,,,,,,,,,,,
linkedin,"Senior Manager CQA (all genders) – fulltime, permanent",AbbVie,"Ludwigshafen, Rhineland-Palatinate, Germany",2026-06-20,https://www.linkedin.com/jobs/view/4402366735 , ,li-4402366735,fulltime,,,,,,False,mid-senior level,Other,,TalentAcquisition.de@abbvie.com,Pharmaceutical Manufacturing and Biotechnology Research,https://www.linkedin.com/company/abbvie,,,,,,,,,,,
linkedin,Projektleiter (m/w/d) Anlagenbau,Bilfinger Region DACH,"Neukieritzsch, Saxony, Germany",2026-06-20,https://www.linkedin.com/jobs/view/4264627761 , ,li-4264627761,fulltime,,,,,,False,entry level,Engineering and Information Technology,,,Industrial Machinery Manufacturing,https://de.linkedin.com/company/bilfinger-region-dach,,,,,,,,,,,
linkedin,Senior Project Manager - KI-Implementierung (m/w/d),Lucid Labs,"Berlin, Berlin, Germany",2026-06-20,https://www.linkedin.com/jobs/view/4428569795 , ,li-4428569795,fulltime,,,,,,True,mid-senior level,Project Management,,,Software Development,https://de.linkedin.com/company/lucidlabs-official,,,,,,,,,,,
linkedin,Global Head of Underwriting Management (Aerospace & PRCB),AXA XL,"Cologne, North Rhine-Westphalia, Germany",2026-06-20,https://www.linkedin.com/jobs/view/4403107527 , ,li-4403107527,fulltime,,,,,,False,not applicable,Finance and Sales,,,Insurance,https://bm.linkedin.com/company/axaxl,,,,,,,,,,,
linkedin,Electrical Project Manager,Mercury,"Frankfurt, Hesse, Germany",2026-06-20,https://www.linkedin.com/jobs/view/4411782153 , ,li-4411782153,fulltime,,,,,,False,mid-senior level,Project Management and Information Technology,,,Construction,https://ie.linkedin.com/company/mercury-engineering,,,,,,,,,,,
linkedin,Project Manager,g2 Recruitment,,2026-06-20,https://www.linkedin.com/jobs/view/4431324077 , ,li-4431324077,contract,,,,,,False,mid-senior level,Project Management,,,Civil Engineering,https://de.linkedin.com/company/g2-recruitment-solutions,,,,,,,,,,,
linkedin,Project Director,Mercury,"Frankfurt, Hesse, Germany",2026-06-20,https://www.linkedin.com/jobs/view/4371353560 , ,li-4371353560,fulltime,,,,,,False,director,Management and Manufacturing,,,Construction,https://ie.linkedin.com/company/mercury-engineering,,,,,,,,,,,
linkedin,PMO Manager - Residential Flexibility Programme (f/m/d),E.ON,"Essen, North Rhine-Westphalia, Germany",2026-06-20,https://www.linkedin.com/jobs/view/4363216754 , ,li-4363216754,fulltime,,,,,,False,associate,Project Management,,beatrice.rapp@eon.com,Utilities,https://de.linkedin.com/company/e-on,,,,,,,,,,,
linkedin,Associate Medical Project Manager für Online-Fortbildungen,Novaheal GmbH,"Berlin, Berlin, Germany",2026-06-20,https://www.linkedin.com/jobs/view/4428547079 , ,li-4428547079,fulltime,,,,,,False,entry level,Education,,,E-Learning Providers,https://de.linkedin.com/company/novaheal,,,,,,,,,,,
linkedin,BIM Designer II,IPS-Integrated Project Services,"Frankfurt, Hesse, Germany",2026-06-19,https://www.linkedin.com/jobs/view/4405256078 , ,li-4405256078,fulltime,,,,,,False,not applicable,Other,,,Pharmaceutical Manufacturing,https://www.linkedin.com/company/ips,,,,,,,,,,,
linkedin,Manager IBM Planning Analytics (all genders),MHP – A Porsche Company,"Wolfsburg, Lower Saxony, Germany",2026-06-19,https://www.linkedin.com/jobs/view/4371003767 , ,li-4371003767,fulltime,,,,,,False,mid-senior level,Management and Manufacturing,,,Business Consulting and Services,https://de.linkedin.com/company/mhp-a-porsche-company,,,,,,,,,,,
linkedin,Spezialist:in Infrastrukturdaten und Projektleitung,Deutsche Bahn,"Dresden, Saxony, Germany",2026-06-19,https://www.linkedin.com/jobs/view/4367408216 , ,li-4367408216,fulltime,,,,,,False,entry level,Project Management and Information Technology,,,Truck Transportation,https://de.linkedin.com/company/deutschebahn,,,,,,,,,,,
linkedin,IT-Projektmanager (all gender),ALTEN Germany,"Munich, Bavaria, Germany",2026-06-19,https://www.linkedin.com/jobs/view/4410608352 , ,li-4410608352,fulltime,,,,,,False,associate,Project Management and Information Technology,,,Motor Vehicle Manufacturing,https://de.linkedin.com/company/altengermany,,,,,,,,,,,
linkedin,Site Manager (Baustellenkoordinator) Raum Berlin,AlphaConsult-Gruppe,"Berlin, Germany",2026-06-19,https://www.linkedin.com/jobs/view/4428241076 , ,li-4428241076,fulltime,,,,,,False,associate,Engineering,,,"Machinery Manufacturing, Engineering Services, and Construction",https://de.linkedin.com/company/alphaconsult-gruppe,,,,,,,,,,,
linkedin,Business Development Manager (m/f/d)*,SCHOTT,"Mainz, Rhineland-Palatinate, Germany",2026-06-19,https://www.linkedin.com/jobs/view/4429658638 , ,li-4429658638,fulltime,,,,,,False,mid-senior level,Business Development and Sales,,,"Glass, Ceramics and Concrete Manufacturing",https://de.linkedin.com/company/schott,,,,,,,,,,,
linkedin,Trainee (m/w/d) im Bereich Geschäftsentwicklung,BERBUS ALLIANCE,"Berlin, Berlin, Germany",2026-06-19,https://www.linkedin.com/jobs/view/4430946056 , ,li-4430946056,fulltime,,,,,,False,entry level,Business Development and Sales,,,Holding Companies,https://de.linkedin.com/company/berbus-alliance,,,,,,,,,,,
linkedin,People & Culture Manager (m/f/d) (Parental Leave),25hours Hotels,"Berlin, Berlin, Germany",2026-06-19,https://www.linkedin.com/jobs/view/4428253242 , ,li-4428253242,temporary,,,,,,False,entry level,Human Resources,,,Hospitality,https://de.linkedin.com/company/25hours-hotels,,,,,,,,,,,
linkedin,Practice Director (m/f/d) - SAP Supply Chain Planning,Westernacher Consulting,"Cologne, North Rhine-Westphalia, Germany",2026-06-19,https://www.linkedin.com/jobs/view/4411334986 , ,li-4411334986,fulltime,,,,,,False,director,Information Technology,,,Business Consulting and Services,https://de.linkedin.com/company/westernacherconsulting,,,,,,,,,,,
linkedin,Smartsheet Engineer,QCS Staffing,"Frankfurt am Main, Hesse, Germany",2026-06-19,https://www.linkedin.com/jobs/view/4428262109 , ,li-4428262109,fulltime,,,,,,False,mid-senior level,Engineering and Information Technology,,,Staffing and Recruiting,https://uk.linkedin.com/company/qcs-staffing,,,,,,,,,,,
linkedin,Hands-on Project Manager,TGS International Group,"Frankfurt, Hesse, Germany",2026-06-19,https://www.linkedin.com/jobs/view/4428250882 , ,li-4428250882,fulltime,,,,,,False,not applicable,Engineering,,,IT Services and IT Consulting and Construction,https://uk.linkedin.com/company/tgs-ig,,,,,,,,,,,
linkedin,Software Project Manager (m/f/d) Security & Software Solutions,Danfoss,"Hamburg, Hamburg, Germany",2026-06-19,https://www.linkedin.com/jobs/view/4430905689 , ,li-4430905689,fulltime,,,,,,False,mid-senior level,Project Management and Strategy/Planning,,,Industrial Machinery Manufacturing,https://dk.linkedin.com/company/danfoss,,,,,,,,,,,
linkedin,Technical Project Manager - N3XT Interceptor C‑UAS (m/f/d),Quantum Systems,,2026-06-19,https://www.linkedin.com/jobs/view/4430012837 , ,li-4430012837,fulltime,,,,,,False,not applicable,Engineering,,,Engineering Services,https://de.linkedin.com/company/quantum-systems-gmbh,,,,,,,,,,,
linkedin,"Junior Technischer Projektmanager Software, 100% Homeoffice (m/w/d)",dexter health,,2026-06-19,https://www.linkedin.com/jobs/view/4428258299 , ,li-4428258299,fulltime,,,,,,True,entry level,Information Technology,,,Hospitals and Health Care,https://de.linkedin.com/company/dexter-health,,,,,,,,,,,
linkedin,AI Delivery Lead,Abacus Medicine Group,"Berlin, Berlin, Germany",2026-06-19,https://www.linkedin.com/jobs/view/4409242081 , ,li-4409242081,fulltime,,,,,,False,mid-senior level,Management and Manufacturing,,,Pharmaceutical Manufacturing,https://dk.linkedin.com/company/abacus-medicine-group,,,,,,,,,,,
linkedin,Platform Projects Lead Delta4000 (m/f/d),Nordex Group,"Hamburg, Germany",2026-06-19,https://www.linkedin.com/jobs/view/4430983245 , ,li-4430983245,parttime,,,,,,False,mid-senior level,Project Management and Information Technology,,,Renewable Energy Equipment Manufacturing,https://de.linkedin.com/company/nordex,,,,,,,,,,,
linkedin,Platform Projects Lead Delta4000 (m/f/d),Nordex Group,"Rostock, Mecklenburg-West Pomerania, Germany",2026-06-19,https://www.linkedin.com/jobs/view/4430969995 , ,li-4430969995,parttime,,,,,,False,mid-senior level,Project Management and Information Technology,,,Renewable Energy Equipment Manufacturing,https://de.linkedin.com/company/nordex,,,,,,,,,,,
linkedin,Team Lead Presales (m/w/d),think about IT GmbH,"Bochum, North Rhine-Westphalia, Germany",2026-06-19,https://www.linkedin.com/jobs/view/4428223884 , ,li-4428223884,fulltime,,,,,,False,mid-senior level,Sales,,,IT Services and IT Consulting,https://de.linkedin.com/company/think-about-it-gmbh,,,,,,,,,,,
linkedin,Junior Scrum Master,Braun Management,"Berlin, Berlin, Germany",2026-06-19,https://www.linkedin.com/jobs/view/4429667391 , ,li-4429667391,fulltime,,,,,,True,entry level,Information Technology,,,IT Services and IT Consulting,https://www.linkedin.com/company/managementbraun,,,,,,,,,,,
linkedin,Team Lead Azure Delivery (w/m/d),PCG - Public Cloud Group,,2026-06-19,https://www.linkedin.com/jobs/view/4429681984 , ,li-4429681984,fulltime,,,,,,True,mid-senior level,Management and Manufacturing,,,IT Services and IT Consulting,https://de.linkedin.com/company/publiccloudgroup,,,,,,,,,,,
linkedin,Projektmanager:in Eisenbahninfrastruktur im Großprojekt Karlsruhe-Basel (w/m/d),Deutsche Bahn,"Freiburg, Baden-Württemberg, Germany",2026-06-19,https://www.linkedin.com/jobs/view/4371266021 , ,li-4371266021,fulltime,,,,,,False,mid-senior level,Project Management and Information Technology,,,Truck Transportation,https://de.linkedin.com/company/deutschebahn,,,,,,,,,,,
linkedin,Chief Operating Officer (COO) - F/H - KQN,SERMA Productivity Engineering GmbH,"Dresden, Saxony, Germany",2026-06-19,https://www.linkedin.com/jobs/view/4428238966 , ,li-4428238966,fulltime,,,,,,False,director,Engineering,,,Semiconductor Manufacturing,https://de.linkedin.com/company/productivity-engineering-gmbh,,,,,,,,,,,
linkedin,Project Manager,iiM GmbH,"Suhl, Thuringia, Germany",2026-06-19,https://www.linkedin.com/jobs/view/4428232356 , ,li-4428232356,fulltime,,,,,,False,associate,Project Management,,,Computer Hardware Manufacturing,https://de.linkedin.com/company/iim-ag,,,,,,,,,,,
linkedin,Projektleiter Operations (all gender),ALTEN Germany,"Kassel, Hesse, Germany",2026-06-19,https://www.linkedin.com/jobs/view/4382567371 , ,li-4382567371,fulltime,,,,,,False,associate,"Business Development, Engineering, and Project Management",,,Engineering Services,https://de.linkedin.com/company/altengermany,,,,,,,,,,,
linkedin,Maintenance Manager,Skills Alliance,"Duderstadt, Lower Saxony, Germany",2026-06-19,https://www.linkedin.com/jobs/view/4429673745 , ,li-4429673745,fulltime,,,,,,False,mid-senior level,Management and Manufacturing,,,Chemical Manufacturing and Repair and Maintenance,https://uk.linkedin.com/company/skills-alliance,,,,,,,,,,,
linkedin,Real Estate Manager - Sustainable Building Referent (d/f/m),Airbus Aircraft,"Hamburg, Hamburg, Germany",2026-06-19,https://www.linkedin.com/jobs/view/4417691425 , ,li-4417691425,parttime,,,,,,False,mid-senior level,Sales and Management,,emsom@airbus.com,Aviation and Aerospace Component Manufacturing,https://fr.linkedin.com/company/airbus,,,,,,,,,,,
linkedin,Global Procurement Director (m/f/d),KD Pharma Group,"Bexbach, Saarland, Germany",2026-06-19,https://www.linkedin.com/jobs/view/4428242426 , ,li-4428242426,fulltime,,,,,,False,mid-senior level,Management,,,Pharmaceutical Manufacturing,https://ch.linkedin.com/company/kd-pharma,,,,,,,,,,,
linkedin,Projektmanager (m/w/d) im Claimmanagement,Diehl Defence,"Nonnweiler, Saarland, Germany",2026-06-19,https://www.linkedin.com/jobs/view/4428743453 , ,li-4428743453,fulltime,,,,,,False,mid-senior level,Project Management and Information Technology,,,"Appliances, Electrical, and Electronics Manufacturing",https://de.linkedin.com/company/diehl-defence,,,,,,,,,,,
linkedin,Projektmanager Data Analytics (all gender),ALTEN Germany,"Munich, Bavaria, Germany",2026-06-19,https://www.linkedin.com/jobs/view/4408844931 , ,li-4408844931,fulltime,,,,,,False,associate,Information Technology and Project Management,,,Motor Vehicle Manufacturing and IT Services and IT Consulting,https://de.linkedin.com/company/altengermany,,,,,,,,,,,
linkedin,Junior B2B Growth Manager (m/f/d),Westwing,"Munich, Bavaria, Germany",2026-06-19,https://www.linkedin.com/jobs/view/4430965581 , ,li-4430965581,fulltime,,,,,,False,entry level,Marketing and Sales,,,Retail,https://de.linkedin.com/company/westwing-home-&-living,,,,,,,,,,,
linkedin,Consultant Projektmanagement - Tax (m/w/d),Deloitte,"Stuttgart, Baden-Württemberg, Germany",2026-06-19,https://www.linkedin.com/jobs/view/4419878222 , ,li-4419878222,fulltime,,,,,,True,entry level,"Legal, Strategy/Planning, and Consulting",,career@deloitte.de,Business Consulting and Services,https://www.linkedin.com/company/deloitte,,,,,,,,,,,
linkedin,Interdisciplinary.,US Army Corps of Engineers,"Wiesbaden, Hesse, Germany",2026-06-19,https://www.linkedin.com/jobs/view/4430929636 , ,li-4430929636,fulltime,,,,,,False,not applicable,Other,,,Government Administration and Strategic Management Services,https://www.linkedin.com/company/us-army-corps-of-engineers,,,,,,,,,,,
linkedin,Technischer Projektmanager (m/w/d) MIM,Schunk Group,"Thale, Saxony-Anhalt, Germany",2026-06-19,https://www.linkedin.com/jobs/view/4429652804 , ,li-4429652804,fulltime,,,,,,False,mid-senior level,Project Management and Information Technology,,,Industrial Machinery Manufacturing,https://de.linkedin.com/company/schunk-group,,,,,,,,,,,
linkedin,Operations Team Lead (m/f/d),J&T Express Germany GmbH,"Düsseldorf, North Rhine-Westphalia, Germany",2026-06-19,https://www.linkedin.com/jobs/view/4430913947 , ,li-4430913947,fulltime,,,,,,False,associate,Supply Chain,,,"Transportation, Logistics, Supply Chain and Storage",https://www.linkedin.com/company/j-t-express-germany-gmbh,,,,,,,,,,,
linkedin,Senior Project Manager - Oracle EBS,K&K Talents,,2026-06-19,https://www.linkedin.com/jobs/view/4430964036 , ,li-4430964036,fulltime,,,,,,False,mid-senior level,Information Technology,,,Information Services,https://de.linkedin.com/company/k-k-talents,,,,,,,,,,,
linkedin,Projektleiter Feuerfestbau (m/w/d),REMONDIS Gruppe,"Weisswasser, Saxony, Germany",2026-06-19,https://www.linkedin.com/jobs/view/4428254864 , ,li-4428254864,fulltime,,,,,,False,associate,Production and Other,,,Oil and Gas,https://de.linkedin.com/company/remondis-gruppe,,,,,,,,,,,
linkedin,TID Manager/technischer Innendienst (m/w/d),Denys,"Berlin, Berlin, Germany",2026-06-19,https://www.linkedin.com/jobs/view/4389908362 , ,li-4389908362,fulltime,,,,,,False,mid-senior level,Other,,,Construction,https://be.linkedin.com/company/nv-denys,,,,,,,,,,,
linkedin,Senior IT Project Manager - Data Center (m/w/d),Instaffo,"Bonn, North Rhine-Westphalia, Germany",2026-06-19,https://www.linkedin.com/jobs/view/4410991355 , ,li-4410991355,fulltime,,,,,,False,mid-senior level,Project Management and Management,,,Staffing and Recruiting,https://de.linkedin.com/company/instaffo-gmbh,,,,,,,,,,,
