site,title,company,location,date_posted,job_url,job_url_direct,id,job_type,salary_source,interval,min_amount,max_amount,currency,is_remote,job_level,job_function,listing_type,emails,company_industry,company_url,company_url_direct,company_addresses,company_num_employees,company_revenue,company_description,skills,experience_range,company_rating,company_reviews_count,vacancy_count,work_from_home_type
linkedin,Projektleitung für Elektrotechnik (m/w/d),Johannes Merz GmbH,"Spires, Rhineland-Palatinate, Germany",2026-06-19,https://www.linkedin.com/jobs/view/4428285586 , ,li-4428285586,fulltime,,,,,,False,associate,Engineering,,,IT Services and IT Consulting,https://www.linkedin.com/company/johannes-merz-gmbh,,,,,,,,,,,
linkedin,Team Lead Sales (m/w/d),doctari,"Berlin, Germany",2026-06-19,https://www.linkedin.com/jobs/view/4430920469 , ,li-4430920469,fulltime,,,,,,False,associate,"Sales, Human Resources, and Health Care Provider",,,"Staffing and Recruiting, Human Resources Services, and Hospitals and Health Care",https://de.linkedin.com/company/doctari,,,,,,,,,,,
linkedin,Sales & Project Manager e-Infrastruktur Europa mit Schwerpunkt Schweden (m/w/d) – deutschlandweit hybrid,Daimler Buses Solutions GmbH,"Mannheim, Baden-Württemberg, Germany",2026-06-19,https://www.linkedin.com/jobs/view/4428220645 , ,li-4428220645,fulltime,,,,,,False,associate,Project Management,,,Software Development,https://de.linkedin.com/company/daimler-buses-solutions,,,,,,,,,,,
linkedin,Projektleiter Business Transformation (m/w/d),ERGO,"Düsseldorf, North Rhine-Westphalia, Germany",2026-06-19,https://www.linkedin.com/jobs/view/4430979355 , ,li-4430979355,fulltime,,,,,,False,mid-senior level,"Design, Art/Creative, and Information Technology",,,Insurance,https://de.linkedin.com/company/ergo-group-ag,,,,,,,,,,,
linkedin,Principal Process Engineer,Sedgman,"Frankfurt am Main, Hesse, Germany",2026-06-19,https://www.linkedin.com/jobs/view/4401196332 , ,li-4401196332,fulltime,,,,,,False,mid-senior level,Management and Manufacturing,,,Mining,https://au.linkedin.com/company/sedgman,,,,,,,,,,,
linkedin,Project Procurement Manager (f/m/d),Baxter International Inc.,"Saalfeld, Thuringia, Germany",2026-06-19,https://www.linkedin.com/jobs/view/4428242633 , ,li-4428242633,fulltime,,,,,,False,mid-senior level,Purchasing and Supply Chain,,,"Medical Equipment Manufacturing, Pharmaceutical Manufacturing, and Hospitals and Health Care",https://www.linkedin.com/company/baxter-healthcare,,,,,,,,,,,
linkedin,Senior Project Manager (m/w/d),AERZEN worldwide,"Aerzen, Lower Saxony, Germany",2026-06-19,https://www.linkedin.com/jobs/view/4417669238 , ,li-4417669238,fulltime,,,,,,True,mid-senior level,Project Management and Information Technology,,madita.jacobi@aerzen.com,Machinery Manufacturing,https://de.linkedin.com/company/aerzen-worldwide,,,,,,,,,,,
linkedin,Head of AI Product (m/f/x),osapiens,"Mannheim, Baden-Württemberg, Germany",2026-06-19,https://www.linkedin.com/jobs/view/4429627332 , ,li-4429627332,fulltime,,,,,,False,director,Engineering and Information Technology,,,Software Development,https://de.linkedin.com/company/osapiens,,,,,,,,,,,
linkedin,Senior Solution Manager - Wallet Ecosystem (m/w/d),D-Trust,"Berlin, Berlin, Germany",2026-06-19,https://www.linkedin.com/jobs/view/4430970402 , ,li-4430970402,fulltime,,,,,,False,mid-senior level,Information Technology,,,IT Services and IT Consulting,https://www.linkedin.com/company/d-trust,,,,,,,,,,,
linkedin,Senior Consultant / Manager - Payments Consulting (m/w/d) in Hannover,Deloitte,"Hannover, Lower Saxony, Germany",2026-06-19,https://www.linkedin.com/jobs/view/4289772697 , ,li-4289772697,fulltime,,,,,,True,mid-senior level,Accounting/Auditing and Finance,,career@deloitte.de,Business Consulting and Services,https://www.linkedin.com/company/deloitte,,,,,,,,,,,
linkedin,Product Marketing Manager (m/w/d),StackFuel,"Berlin, Berlin, Germany",2026-06-19,https://www.linkedin.com/jobs/view/4430778753 , ,li-4430778753,fulltime,,,,,,False,mid-senior level,Marketing and Sales,,,Education,https://de.linkedin.com/school/stackfuel/,,,,,,,,,,,
linkedin,Projektmanager:in,Tintschl Unternehmensgruppe,"Bremen, Germany",2026-06-19,https://www.linkedin.com/jobs/view/4430942648 , ,li-4430942648,fulltime,,,,,,False,associate,Management,,,Staffing and Recruiting and IT Services and IT Consulting,https://de.linkedin.com/company/tintschlunternehmensgruppe,,,,,,,,,,,
linkedin,Projektmanager (m/w/d),SOMIC Packaging,"Amerang, Bavaria, Germany",2026-06-19,https://www.linkedin.com/jobs/view/4430940713 , ,li-4430940713,fulltime,,,,,,False,mid-senior level,Project Management and Information Technology,,karriere@somic.de,Machinery Manufacturing,https://de.linkedin.com/company/somicpackaging,,,,,,,,,,,
linkedin,Project Manager - Transformation (f/m/d),Siemens Energy,"Berlin, Berlin, Germany",2026-06-19,https://www.linkedin.com/jobs/view/4429690827 , ,li-4429690827,fulltime,,,,,,True,mid-senior level,Strategy/Planning,,,"Appliances, Electrical, and Electronics Manufacturing",https://www.linkedin.com/company/siemens-energy,,,,,,,,,,,
linkedin,Senior Program / Project Manager (m/f/d),Dassault Systèmes,"Stuttgart, Baden-Württemberg, Germany",2026-06-19,https://www.linkedin.com/jobs/view/4420921826 , ,li-4420921826,fulltime,,,,,,True,mid-senior level,"Consulting, Customer Service, and Engineering",,,"Software Development, IT Services and IT Consulting, and Research Services",https://fr.linkedin.com/company/dassaultsystemes,,,,,,,,,,,
linkedin,Technical Project Manager,CleanTech Talent,"Munich, Bavaria, Germany",2026-06-19,https://www.linkedin.com/jobs/view/4430927234 , ,li-4430927234,fulltime,,,,,,False,mid-senior level,"Project Management, Consulting, and Information Technology",,,"Space Research and Technology, Defense and Space Manufacturing, and Business Consulting and Services",https://uk.linkedin.com/company/cleantech-talent,,,,,,,,,,,
linkedin,"Project Procurement Manager (f/m/d),",Baxter International Inc.,"Saalfeld, Thuringia, Germany",2026-06-19,https://www.linkedin.com/jobs/view/4430963682 , ,li-4430963682,fulltime,,,,,,False,mid-senior level,Purchasing and Supply Chain,,,Medical Equipment Manufacturing,https://www.linkedin.com/company/baxter-healthcare,,,,,,,,,,,
linkedin,(Senior) Project Manager Strategic Development China (m/w/d)*,SCHOTT,"Mainz, Rhineland-Palatinate, Germany",2026-06-19,https://www.linkedin.com/jobs/view/4429654690 , ,li-4429654690,fulltime,,,,,,False,mid-senior level,Project Management and Information Technology,,,"Glass, Ceramics and Concrete Manufacturing",https://de.linkedin.com/company/schott,,,,,,,,,,,
linkedin,License Manager Siemens DI Products (f/m/d),Siemens Energy,"Berlin, Berlin, Germany",2026-06-19,https://www.linkedin.com/jobs/view/4419028627 , ,li-4419028627,fulltime,,,,,,True,mid-senior level,Information Technology,,,"Appliances, Electrical, and Electronics Manufacturing",https://www.linkedin.com/company/siemens-energy,,,,,,,,,,,
linkedin,Project Manager,IPS-Integrated Project Services,"Frankfurt, Hesse, Germany",2026-06-19,https://www.linkedin.com/jobs/view/4377861311 , ,li-4377861311,fulltime,,,,,,False,not applicable,Project Management and Information Technology,,,Pharmaceutical Manufacturing,https://www.linkedin.com/company/ips,,,,,,,,,,,
linkedin,Senior IT Project Manager (m/w/d),SPECTRUM AG,"Munich, Bavaria, Germany",2026-06-19,https://www.linkedin.com/jobs/view/4428221378 , ,li-4428221378,fulltime,,,,,,False,mid-senior level,Other,,,IT Services and IT Consulting,https://de.linkedin.com/company/spectrum-ag,,,,,,,,,,,
linkedin,Project Manager Digital Transformation (m/f/d),MISUMI Europa GmbH,"Frankfurt, Hesse, Germany",2026-06-19,https://www.linkedin.com/jobs/view/4429643790 , ,li-4429643790,fulltime,,,,,,True,mid-senior level,Project Management and Information Technology,,,Wholesale,https://de.linkedin.com/company/misumi-europa-gmbh,,,,,,,,,,,
linkedin,Commissioning Manager,Mercury,"Frankfurt, Hesse, Germany",2026-06-19,https://www.linkedin.com/jobs/view/4236233550 , ,li-4236233550,fulltime,,,,,,False,mid-senior level,Project Management and Information Technology,,,Construction,https://ie.linkedin.com/company/mercury-engineering,,,,,,,,,,,
linkedin,Program Manager (m/f/d) Platform Development (31304),RECARO Aircraft Seating,"Schwäbisch Hall, Baden-Württemberg, Germany",2026-06-19,https://www.linkedin.com/jobs/view/4403499644 , ,li-4403499644,fulltime,,,,,,False,mid-senior level,Engineering and Information Technology,,,Aviation and Aerospace Component Manufacturing,https://de.linkedin.com/company/recaro-aircraft-seating,,,,,,,,,,,
linkedin,"Delivery Manager (x,f,m)",DKB Code Factory GmbH,"Berlin, Germany",2026-06-19,https://www.linkedin.com/jobs/view/4428242649 , ,li-4428242649,fulltime,,,,,,False,mid-senior level,"Information Technology, Consulting, and Engineering",,,"Software Development, Banking, and Financial Services",https://de.linkedin.com/company/dkbcodefactory,,,,,,,,,,,
linkedin,Project Controller,Mace,"Frankfurt, Hesse, Germany",2026-06-19,https://www.linkedin.com/jobs/view/4411648482 , ,li-4411648482,fulltime,,,,,,False,not applicable,Accounting/Auditing and Finance,,,"Construction, Civil Engineering, and Architecture and Planning",https://uk.linkedin.com/company/mace-group,,,,,,,,,,,
linkedin,"Technical Program Manager III, Automotive",Mapbox,,2026-06-19,https://www.linkedin.com/jobs/view/4411273021 , ,li-4411273021,fulltime,,,,,,False,mid-senior level,Project Management and Information Technology,,,Software Development,https://www.linkedin.com/company/mapbox,,,,,,,,,,,
linkedin,Projektkoordinator Digitalisierung (m/w/d),SPITZKE SE,"Berlin, Berlin, Germany",2026-06-19,https://www.linkedin.com/jobs/view/4430116989 , ,li-4430116989,fulltime,,,,,,False,entry level,Other,,,Construction,https://de.linkedin.com/company/spitzke-se,,,,,,,,,,,
linkedin,Senior Transformation Manager (m/w/d),PIMCO Prime Real Estate,"Munich, Bavaria, Germany",2026-06-19,https://www.linkedin.com/jobs/view/4429583060 , ,li-4429583060,fulltime,,,,,,True,mid-senior level,Business Development and Sales,,,Financial Services and Insurance,https://de.linkedin.com/company/pimcoprimerealestate,,,,,,,,,,,
linkedin,Footwear Development Manager (m/f/d),BIRKENSTOCK,"Cologne, North Rhine-Westphalia, Germany",2026-06-19,https://www.linkedin.com/jobs/view/4420290271 , ,li-4420290271,fulltime,,,,,,False,mid-senior level,Other,,,Retail Apparel and Fashion,https://de.linkedin.com/company/birkenstock-deutschland,,,,,,,,,,,
linkedin,System Product Manager - AI Workflow Platform (w/m/d),Siemens Healthineers,"Forchheim, Bavaria, Germany",2026-06-19,https://www.linkedin.com/jobs/view/4428250628 , ,li-4428250628,fulltime,,,,,,False,mid-senior level,Product Management,,,"Medical Equipment Manufacturing, Hospitals and Health Care, and Biotechnology Research",https://de.linkedin.com/company/siemens-healthineers,,,,,,,,,,,
linkedin,Projektmanager (m/w/d) Schnittstellenprozesse Logistik,Dirk Rossmann GmbH,"Burgwedel, Lower Saxony, Germany",2026-06-19,https://www.linkedin.com/jobs/view/4390852062 , ,li-4390852062,fulltime,,,,,,False,entry level,Project Management and Information Technology,,,Retail,https://de.linkedin.com/company/dirk-rossmann-gmbh,,,,,,,,,,,
linkedin,Product Owner (m/w/d) Smart Factory Solutions,Lachmann & Rink GmbH,"Freudenberg, North Rhine-Westphalia, Germany",2026-06-19,https://www.linkedin.com/jobs/view/4430929318 , ,li-4430929318,fulltime,,,,,,False,director,Product Management and Marketing,,,Software Development,https://de.linkedin.com/company/lachmannrink,,,,,,,,,,,
linkedin,Snr Electrical Project Engineer,King & Moffatt Building Services,"Frankfurt am Main, Hesse, Germany",2026-06-19,https://www.linkedin.com/jobs/view/4429649838 , ,li-4429649838,fulltime,,,,,,False,mid-senior level,Engineering and Information Technology,,,Construction,https://ie.linkedin.com/company/king-and-moffatt-group,,,,,,,,,,,
linkedin,Senior Project Manager,IPS-Integrated Project Services,"Frankfurt, Hesse, Germany",2026-06-19,https://www.linkedin.com/jobs/view/4335564500 , ,li-4335564500,fulltime,,,,,,False,not applicable,Project Management and Information Technology,,,Pharmaceutical Manufacturing,https://www.linkedin.com/company/ips,,,,,,,,,,,
linkedin,Senior Functional Consultant / Solution Architect (m/f/d),mymediset,"Freiburg, Baden-Württemberg, Germany",2026-06-19,https://www.linkedin.com/jobs/view/4411633000 , ,li-4411633000,fulltime,,,,,,False,mid-senior level,Engineering and Information Technology,,,IT Services and IT Consulting,https://de.linkedin.com/company/mymediset,,,,,,,,,,,
linkedin,Project Manager (m/w/d) Business Process Outsourcing,encory,"Unterschleißheim, Bavaria, Germany",2026-06-19,https://www.linkedin.com/jobs/view/4430973859 , ,li-4430973859,fulltime,,,,,,False,mid-senior level,Project Management and Information Technology,,stefanie.greif@encory.com,Environmental Services,https://de.linkedin.com/company/encory,,,,,,,,,,,
linkedin,ProjektleiterIn Metallbau,Bruno Spohner Schlosserei und Metallbau GmbH,"Frankfurt, Hesse, Germany",2026-06-19,https://www.linkedin.com/jobs/view/4428253216 , ,li-4428253216,fulltime,,,,,,False,mid-senior level,"Design, Art/Creative, and Information Technology",,,Mining,https://www.linkedin.com/company/bruno-spohner-schlosserei-und-metallbau-gmbh,,,,,,,,,,,
linkedin,Project Manager [211009],Aquent,"Leipzig, Saxony, Germany",2026-06-19,https://www.linkedin.com/jobs/view/4430933834 , ,li-4430933834,temporary,,,,,,True,mid-senior level,Management and Other,,,Staffing and Recruiting,https://www.linkedin.com/company/aquent,,,,,,,,,,,
linkedin,Senior Project Manager Operational Excellence(m/w/d)*,SCHOTT,"Mainz, Rhineland-Palatinate, Germany",2026-06-19,https://www.linkedin.com/jobs/view/4429658639 , ,li-4429658639,fulltime,,,,,,False,mid-senior level,Management and Manufacturing,,,"Glass, Ceramics and Concrete Manufacturing",https://de.linkedin.com/company/schott,,,,,,,,,,,
linkedin,Project Manager,Infinity Quest,,2026-06-19,https://www.linkedin.com/jobs/view/4430967206 , ,li-4430967206,contract,,,,,,False,mid-senior level,Information Technology,,,IT Services and IT Consulting,https://uk.linkedin.com/company/infinityquest,,,,,,,,,,,
linkedin,Project Manager,g2 Recruitment,"Essen, North Rhine-Westphalia, Germany",2026-06-19,https://www.linkedin.com/jobs/view/4430971975 , ,li-4430971975,contract,,,,,,True,mid-senior level,"Project Management, Engineering, and Business Development",,-woolls@g2recruitment.com,"Services for Renewable Energy, Electric Power Generation, and Strategic Management Services",https://de.linkedin.com/company/g2-recruitment-solutions,,,,,,,,,,,
linkedin,Program Manager / Projektmanager Automotiv (all gender),ALTEN Germany,"Munich, Bavaria, Germany",2026-06-19,https://www.linkedin.com/jobs/view/4400833451 , ,li-4400833451,fulltime,,,,,,False,entry level,Project Management,,,Motor Vehicle Manufacturing,https://de.linkedin.com/company/altengermany,,,,,,,,,,,
linkedin,"Product Manager, Logistics (f/m/x)",AUTO1 Group,"Berlin, Berlin, Germany",2026-06-19,https://www.linkedin.com/jobs/view/4429646774 , ,li-4429646774,fulltime,,,,,,True,mid-senior level,Information Technology,,,Motor Vehicle Manufacturing,https://de.linkedin.com/company/auto1-group,,,,,,,,,,,
linkedin,"Group Product Manager - (Logistics, Payments and Incentives)",Delivery Hero,"Berlin, Berlin, Germany",2026-06-19,https://www.linkedin.com/jobs/view/4429674613 , ,li-4429674613,fulltime,,,,,,False,mid-senior level,Marketing and Product Management,,inclusion@deliveryhero.com,Software Development and IT Services and IT Consulting,https://de.linkedin.com/company/delivery-hero-se,,,,,,,,,,,
linkedin,"Product Manager, Search Ranking",eBay,,2026-06-19,https://www.linkedin.com/jobs/view/4417654361 , ,li-4417654361,fulltime,,,,,,False,mid-senior level,Product Management and Marketing,,talent@ebay.com,"Technology, Information and Internet",https://www.linkedin.com/company/ebay,,,,,,,,,,,
linkedin,Senior Technical Product Manager,Jobgether,,2026-06-19,https://www.linkedin.com/jobs/view/4429398676 , ,li-4429398676,fulltime,,,,,,True,mid-senior level,Product Management and Marketing,,,Internet Marketplace Platforms,https://be.linkedin.com/company/jobgether,,,,,,,,,,,
linkedin,Team Lead Product (all genders),Avelios Medical,"Munich, Bavaria, Germany",2026-06-19,https://www.linkedin.com/jobs/view/4401781879 , ,li-4401781879,fulltime,,,,,,False,mid-senior level,Engineering and Information Technology,,,Software Development,https://de.linkedin.com/company/avelios-medical,,,,,,,,,,,
linkedin,Staff Product Manager,Databricks,"Berlin, Berlin, Germany",2026-06-19,https://www.linkedin.com/jobs/view/4297745071 , ,li-4297745071,fulltime,,,,,,False,mid-senior level,Product Management,,,Software Development,https://www.linkedin.com/company/databricks,,,,,,,,,,,
linkedin,Staff Product Manager [Savings expertise],Qonto,"Berlin, Berlin, Germany",2026-06-19,https://www.linkedin.com/jobs/view/4420473758 , ,li-4420473758,fulltime,,,,,,False,mid-senior level,Product Management and Marketing,,support@qonto.com,Financial Services,https://fr.linkedin.com/company/qonto,,,,,,,,,,,
linkedin,Principal Product Manager – Digital & Energy Services (m/w/d),Energiekonzepte Deutschland GmbH,"Leipzig, Saxony, Germany",2026-06-19,https://www.linkedin.com/jobs/view/4417234226 , ,li-4417234226,fulltime,,,,,,False,mid-senior level,Product Management and Marketing,,,Renewable Energy Semiconductor Manufacturing,https://de.linkedin.com/company/energiekonzepte-deutschland,,,,,,,,,,,
linkedin,Senior Product Manager - AI Workflow Orchestration (f/m/d),Siemens Healthineers,"Forchheim, Bavaria, Germany",2026-06-19,https://www.linkedin.com/jobs/view/4428254567 , ,li-4428254567,parttime,,,,,,False,mid-senior level,Product Management,,,"Medical Equipment Manufacturing, Hospitals and Health Care, and Biotechnology Research",https://de.linkedin.com/company/siemens-healthineers,,,,,,,,,,,
linkedin,Senior Software Product Owner (f/m/d),Siemens Energy,"Erlangen, Bavaria, Germany",2026-06-19,https://www.linkedin.com/jobs/view/4429660175 , ,li-4429660175,fulltime,,,,,,True,mid-senior level,Product Management,,,"Appliances, Electrical, and Electronics Manufacturing",https://www.linkedin.com/company/siemens-energy,,,,,,,,,,,
linkedin,(Junior/Senior) Projekt Manager Logistik (w/m/d) Lager & Aufbereitung,Bw Bekleidungsmanagement GmbH,"Cologne, North Rhine-Westphalia, Germany",2026-06-19,https://www.linkedin.com/jobs/view/4368993125 , ,li-4368993125,fulltime,,,,,,True,mid-senior level,Project Management and Information Technology,,-zentrallogistik@bwbm.de,"Transportation, Logistics, Supply Chain and Storage",https://de.linkedin.com/company/bw-bekleidungsmanagement,,,,,,,,,,,
linkedin,M&A Manager - PMI Focus (m/f/d),Symrise AG,"Holzminden, Lower Saxony, Germany",2026-06-18,https://www.linkedin.com/jobs/view/4430408132 , ,li-4430408132,fulltime,,,,,,True,mid-senior level,Finance,,,Chemical Manufacturing,https://de.linkedin.com/company/symrise,,,,,,,,,,,
linkedin,Implementation Manager – Remote-First,EPI Company,"Berlin, Berlin, Germany",2026-06-18,https://www.linkedin.com/jobs/view/4429672847 , ,li-4429672847,other,,,,,,True,not applicable,Management and Manufacturing,,,Financial Services,https://be.linkedin.com/company/epicompany,,,,,,,,,,,
linkedin,Product Manager String Inverter (m/w/d),SMA Solar,,2026-06-18,https://www.linkedin.com/jobs/view/4408876232 , ,li-4408876232,fulltime,,,,,,False,mid-senior level,Product Management and Marketing,,,Renewable Energy Semiconductor Manufacturing,https://de.linkedin.com/company/sma-solar,,,,,,,,,,,
linkedin,"Senior UA Manager (Core, Meta)",Jobgether,,2026-06-18,https://www.linkedin.com/jobs/view/4430418027 , ,li-4430418027,fulltime,,,,,,True,mid-senior level,Other,,,Internet Marketplace Platforms,https://be.linkedin.com/company/jobgether,,,,,,,,,,,
linkedin,"Senior Manager, Product Management",Jobgether,,2026-06-18,https://www.linkedin.com/jobs/view/4429095743 , ,li-4429095743,fulltime,,,,,,True,mid-senior level,Product Management and Marketing,,,Internet Marketplace Platforms,https://be.linkedin.com/company/jobgether,,,,,,,,,,,
linkedin,Project Manager Mechanical & Electrical,Cumming Group UK & Europe,"Berlin, Germany",2026-06-18,https://www.linkedin.com/jobs/view/4415902059 , ,li-4415902059,fulltime,,,,,,False,mid-senior level,Engineering,,,Real Estate and Hospitality,https://uk.linkedin.com/company/cumming-group-europe,,,,,,,,,,,
linkedin,Senior Projektmanager/in (m/w/d),Jacobs,"Berlin, Berlin, Germany",2026-06-18,https://www.linkedin.com/jobs/view/4380938201 , ,li-4380938201,fulltime,,,,,,True,not applicable,Project Management and Information Technology,,,Business Consulting and Services,https://www.linkedin.com/company/jacobs,,,,,,,,,,,
linkedin,Projektleiter Elektrotechnik (m/w/d),R+S Group GmbH,"Radebeul, Saxony, Germany",2026-06-18,https://www.linkedin.com/jobs/view/4429035887 , ,li-4429035887,fulltime,,,,,,False,mid-senior level,Engineering and Information Technology,,,Construction,https://de.linkedin.com/company/rsgroupkarriere,,,,,,,,,,,
linkedin,Projektleiter m/w/d Schallschutz und Montage,VINCI Energies,"Munich, Bavaria, Germany",2026-06-18,https://www.linkedin.com/jobs/view/4430746622 , ,li-4430746622,fulltime,,,,,,False,entry level,"Design, Art/Creative, and Information Technology",,,Information Technology & Services,https://fr.linkedin.com/company/vinci-energies,,,,,,,,,,,
linkedin,Projektleiter / Anlagenprojektierer (m/w/d) Pharmazie- und Getränkeindustrie,Albert Handtmann Armaturenfabrik GmbH & Co. KG,"Biberach an der Riß, Baden-Württemberg, Germany",2026-06-18,https://www.linkedin.com/jobs/view/4429311653 , ,li-4429311653,fulltime,,,,,,False,mid-senior level,"Design, Art/Creative, and Information Technology",,,Industrial Machinery Manufacturing,https://de.linkedin.com/company/albert-handtmann-armaturenfabrik-gmbh-co-kg,,,,,,,,,,,
linkedin,Project Manager – Overhead Line Construction,JAM,"Mannheim, Baden-Württemberg, Germany",2026-06-18,https://www.linkedin.com/jobs/view/4430489402 , ,li-4430489402,fulltime,,,,,,True,mid-senior level,Engineering,,,Engineering Services,https://uk.linkedin.com/company/jam-recruitment,,,,,,,,,,,
linkedin,Product Manager (m/f/d),Baobab,"Berlin, Germany",2026-06-18,https://www.linkedin.com/jobs/view/4430704056 , ,li-4430704056,fulltime,,,,,,True,mid-senior level,Product Management,,,Insurance,https://de.linkedin.com/company/baobabinsurance,,,,,,,,,,,
linkedin,Product Manager | Integrations (m/f/d),Superchat,"Berlin, Berlin, Germany",2026-06-18,https://www.linkedin.com/jobs/view/4427830281 , ,li-4427830281,fulltime,,,,,,False,mid-senior level,Product Management,,,IT Services and IT Consulting,https://de.linkedin.com/company/superchatcom,,,,,,,,,,,
linkedin,Senior Product Manager,Forto,"Berlin, Berlin, Germany",2026-06-18,https://www.linkedin.com/jobs/view/4430454208 , ,li-4430454208,fulltime,,,,,,False,mid-senior level,Product Management and Marketing,,,"Transportation, Logistics, Supply Chain and Storage",https://de.linkedin.com/company/fortocompany,,,,,,,,,,,
linkedin,Product Release Manager,AGNTX,"Kiel, Schleswig-Holstein, Germany",2026-06-18,https://www.linkedin.com/jobs/view/4430424516 , ,li-4430424516,fulltime,,,,,,True,mid-senior level,Project Management and Information Technology,,,Staffing and Recruiting,https://uk.linkedin.com/company/agntx-recruitment,,,,,,,,,,,
linkedin,"Technical Program Manager, Cell Manufacturing (m/w/d) - Gigafactory Berlin-Brandenburg",Tesla,"Grünheide, Brandenburg, Germany",2026-06-18,https://www.linkedin.com/jobs/view/4430748714 , ,li-4430748714,fulltime,,,,,,False,mid-senior level,Project Management and Information Technology,,,"Motor Vehicle Manufacturing, Renewable Energy Semiconductor Manufacturing, and Utilities",https://www.linkedin.com/company/tesla-motors,,,,,,,,,,,
linkedin,Product Manager - Lignin Materials (m/f/d),UPM,"Leuna, Saxony-Anhalt, Germany",2026-06-18,https://www.linkedin.com/jobs/view/4430492556 , ,li-4430492556,fulltime,,,,,,False,not applicable,Product Management and Marketing,,"florian.diehl@upm.com, careers@upm.com","Biotechnology Research, Packaging and Containers Manufacturing, and Paper and Forest Product Manufacturing",https://fi.linkedin.com/company/upm-kymmene,,,,,,,,,,,
linkedin,(Senior) Technical Product Manager (m/f/d),Publicis Media Germany,"Frankfurt, Hesse, Germany",2026-06-18,https://www.linkedin.com/jobs/view/4429326420 , ,li-4429326420,fulltime,,,,,,False,not applicable,Product Management and Marketing,,,Marketing Services,https://de.linkedin.com/company/publicis-media-germany,,,,,,,,,,,
linkedin,"Product Owner Data, Analytics & AI - Tieto Indtech  (m/f/d)",Tieto,"Regensburg, Bavaria, Germany",2026-06-18,https://www.linkedin.com/jobs/view/4430479031 , ,li-4430479031,fulltime,,,,,,False,entry level,Product Management and Marketing,,,"Technology, Information and Internet",https://www.linkedin.com/company/tieto,,,,,,,,,,,
linkedin,Product Owner Data Quality,Boehringer Ingelheim,"Ingelheim am Rhein, Rhineland-Palatinate, Germany",2026-06-18,https://www.linkedin.com/jobs/view/4420412016 , ,li-4420412016,fulltime,,,,,,False,mid-senior level,Product Management and Marketing,,,Pharmaceutical Manufacturing,https://de.linkedin.com/company/boehringer-ingelheim,,,,,,,,,,,
linkedin,Data Product Manager - OpenData Middle East and North Africa (MENA),Veeva Systems,,2026-06-18,https://www.linkedin.com/jobs/view/4401877215 , ,li-4401877215,fulltime,,,,,,True,mid-senior level,Product Management,,_accommodations@veeva.com,"Software Development, IT Services and IT Consulting, and Pharmaceutical Manufacturing",https://www.linkedin.com/company/veeva-systems,,,,,,,,,,,
