site,title,company,location,date_posted,job_url,job_url_direct,id,job_type,salary_source,interval,min_amount,max_amount,currency,is_remote,job_level,job_function,listing_type,emails,company_industry,company_url,company_url_direct,company_addresses,company_num_employees,company_revenue,company_description,skills,experience_range,company_rating,company_reviews_count,vacancy_count,work_from_home_type
linkedin,Solution Manager w/m/d - Next Generation Data Center & Edge Technologies,Computacenter,"Düsseldorf, North Rhine-Westphalia, Germany",2026-04-15,https://www.linkedin.com/jobs/view/4402237702 , ,li-4402237702,fulltime,,,,,,False,associate,Management,,-DEBORRE@COMPUTACENTER.COM,Information Technology & Services,https://uk.linkedin.com/company/computacenter,,,,,,,,,,,
linkedin,Produktmanager (m/w/div) Constantia Aloform GmbH,Constantia Flexibles,"Werdohl, North Rhine-Westphalia, Germany",2026-04-15,https://www.linkedin.com/jobs/view/4402297202 , ,li-4402297202,fulltime,,,,,,False,entry level,Product Management and Marketing,,,Packaging and Containers Manufacturing,https://at.linkedin.com/company/constantia-flexibles,,,,,,,,,,,
linkedin,Senior Staff Product Designer (d/f/m),Personio,"Munich, Bavaria, Germany",2026-04-15,https://www.linkedin.com/jobs/view/4353985169 , ,li-4353985169,fulltime,,,,,,True,mid-senior level,"Design, Art/Creative, and Information Technology",,,Software Development,https://de.linkedin.com/company/personio,,,,,,,,,,,
linkedin,Packaging Development Manager (m/w/d),Hochland Deutschland GmbH,"Schongau, Bavaria, Germany",2026-04-15,https://www.linkedin.com/jobs/view/4386913049 , ,li-4386913049,fulltime,,,,,,False,mid-senior level,"Design, Art/Creative, and Information Technology",,,Food and Beverage Manufacturing,https://de.linkedin.com/company/hochlanddeutschlandgmbh,,,,,,,,,,,
linkedin,"Senior Manager,  IAM Security",Delivery Hero,"Berlin, Berlin, Germany",2026-04-15,https://www.linkedin.com/jobs/view/4379647102 , ,li-4379647102,fulltime,,,,,,False,mid-senior level,Information Technology,,inclusion@deliveryhero.cominclude,Software Development and IT Services and IT Consulting,https://de.linkedin.com/company/delivery-hero-se,,,,,,,,,,,
linkedin,Product Manager_in (w/m/d) Biogas,Next Kraftwerke,"Cologne, North Rhine-Westphalia, Germany",2026-04-15,https://www.linkedin.com/jobs/view/4399978827 , ,li-4399978827,fulltime,,,,,,False,mid-senior level,Product Management and Marketing,,,Services for Renewable Energy,https://de.linkedin.com/company/next-kraftwerke-gmbh,,,,,,,,,,,
linkedin,Account & Project Manager – Integrated Digital Campaigns (m/w/d),Reply,"Munich, Bavaria, Germany",2026-04-15,https://www.linkedin.com/jobs/view/4399945109 , ,li-4399945109,fulltime,,,,,,False,mid-senior level,Consulting,,,IT Services and IT Consulting,https://it.linkedin.com/company/reply,,,,,,,,,,,
linkedin,Product Owner (all genders) - Data Processing,MOIA,"Hamburg, Hamburg, Germany",2026-04-15,https://www.linkedin.com/jobs/view/4402534642 , ,li-4402534642,fulltime,,,,,,True,mid-senior level,Product Management and Marketing,,,Software Development,https://de.linkedin.com/company/moia_mobility,,,,,,,,,,,
linkedin,Mid-Level Project/Account Manager,OLIVER | The Brandtech Group,"Hamburg, Hamburg, Germany",2026-04-15,https://www.linkedin.com/jobs/view/4390125144 , ,li-4390125144,fulltime,,,,,,False,mid-senior level,Sales and Business Development,,,"Technology, Information and Internet",https://uk.linkedin.com/company/oliver-agency,,,,,,,,,,,
linkedin,Senior Product Manager eCommerce B2B (m/f/d),SIXT,"Munich, Bavaria, Germany",2026-04-15,https://www.linkedin.com/jobs/view/4370524278 , ,li-4370524278,fulltime,,,,,,False,mid-senior level,Sales and Business Development,,,Travel Arrangements,https://de.linkedin.com/company/sixt,,,,,,,,,,,
linkedin,"Group Product Manager - (Logistics,  Routing & Dispatch Optimization)",Delivery Hero,"Berlin, Berlin, Germany",2026-04-15,https://www.linkedin.com/jobs/view/4401423303 , ,li-4401423303,fulltime,,,,,,False,mid-senior level,Marketing and Product Management,,inclusion@deliveryhero.com,Software Development and IT Services and IT Consulting,https://de.linkedin.com/company/delivery-hero-se,,,,,,,,,,,
linkedin,Senior Project Manager,Aras Corporation,,2026-04-15,https://www.linkedin.com/jobs/view/4402235912 , ,li-4402235912,fulltime,,,,,,False,mid-senior level,Project Management and Product Management,,,Software Development,https://www.linkedin.com/company/aras-corporation,,,,,,,,,,,
linkedin,Salesforce Project Manager (m/f/d),Nagarro,,2026-04-15,https://www.linkedin.com/jobs/view/4379616941 , ,li-4379616941,fulltime,,,,,,False,mid-senior level,Engineering,,,IT Services and IT Consulting,https://de.linkedin.com/company/nagarro,,,,,,,,,,,
linkedin,Project Manager Mechanical & Electrical,Cumming Group UK & Europe,"Berlin, Germany",2026-04-15,https://www.linkedin.com/jobs/view/4387939070 , ,li-4387939070,fulltime,,,,,,False,mid-senior level,Engineering,,,Real Estate and Hospitality,https://uk.linkedin.com/company/cumming-group-europe,,,,,,,,,,,
linkedin,Project Manager – Global Partner Strategy (all genders),ABOUT YOU,"Hamburg, Hamburg, Germany",2026-04-15,https://www.linkedin.com/jobs/view/4401413354 , ,li-4401413354,fulltime,,,,,,False,mid-senior level,Business Development,,,"Technology, Information and Internet",https://de.linkedin.com/company/about-you,,,,,,,,,,,
linkedin,IT Project Manager (f/m/d) – Mergers & Acquisitions,Klüber Lubrication,"Munich, Bavaria, Germany",2026-04-15,https://www.linkedin.com/jobs/view/4402276543 , ,li-4402276543,fulltime,,,,,,False,mid-senior level,Information Technology,,,Motor Vehicle Manufacturing,https://de.linkedin.com/company/klueberlubrication,,,,,,,,,,,
linkedin,Projektmanager :in Tooling Design (all gender),ALTEN,"Augsburg, Bavaria, Germany",2026-04-15,https://www.linkedin.com/jobs/view/4399955094 , ,li-4399955094,fulltime,,,,,,False,associate,Marketing and Product Management,,,Software Development and IT Services and IT Consulting,https://fr.linkedin.com/company/alten,,,,,,,,,,,
linkedin,Senior Product Manager - Conversational Products,Infermedica,"Berlin, Berlin, Germany",2026-04-15,https://www.linkedin.com/jobs/view/4402548002 , ,li-4402548002,fulltime,,,,,,False,mid-senior level,Product Management and Marketing,,,Hospitals and Health Care,https://pl.linkedin.com/company/infermedica,,,,,,,,,,,
linkedin,Product Manager:in (m/w/d) in Vollzeit,calimoto GmbH,"Potsdam, Brandenburg, Germany",2026-04-15,https://www.linkedin.com/jobs/view/4402282041 , ,li-4402282041,fulltime,,,,,,False,associate,Marketing,,karriere@calimoto.com,IT Services and IT Consulting,https://de.linkedin.com/company/calimoto,,,,,,,,,,,
linkedin,Senior Product Manager (Bangkok-based),Agoda,"Berlin, Berlin, Germany",2026-04-15,https://www.linkedin.com/jobs/view/4299768405 , ,li-4299768405,fulltime,,,,,,False,mid-senior level,Product Management and Marketing,,,"Technology, Information and Internet",https://sg.linkedin.com/company/agoda,,,,,,,,,,,
linkedin,Senior Product Manager (Bangkok-based),Agoda,"Hamburg, Hamburg, Germany",2026-04-15,https://www.linkedin.com/jobs/view/4299758923 , ,li-4299758923,fulltime,,,,,,False,mid-senior level,Product Management and Marketing,,,"Technology, Information and Internet",https://sg.linkedin.com/company/agoda,,,,,,,,,,,
linkedin,Senior Consultant / Manager - Payments Consulting (m/w/d) in Stuttgart,Deloitte,"Stuttgart, Baden-Württemberg, Germany",2026-04-14,https://www.linkedin.com/jobs/view/4289772698 , ,li-4289772698,fulltime,,,,,,True,mid-senior level,Accounting/Auditing and Finance,,career@deloitte.de,Business Consulting and Services,https://www.linkedin.com/company/deloitte,,,,,,,,,,,
linkedin,Product Sustainability Specialist,Roche,"Mannheim, Baden-Württemberg, Germany",2026-04-14,https://www.linkedin.com/jobs/view/4401791538 , ,li-4401791538,fulltime,,,,,,False,associate,Administrative,,,"Pharmaceutical Manufacturing, Biotechnology Research, and Medical Equipment Manufacturing",https://ch.linkedin.com/company/roche,,,,,,,,,,,
linkedin,Product Sustainability Specialist,Roche,"Penzberg, Bavaria, Germany",2026-04-14,https://www.linkedin.com/jobs/view/4401788677 , ,li-4401788677,fulltime,,,,,,False,associate,Administrative,,,"Pharmaceutical Manufacturing, Biotechnology Research, and Medical Equipment Manufacturing",https://ch.linkedin.com/company/roche,,,,,,,,,,,
linkedin,"Product Design Lead, Checkout and Payments (Bangkok - Based, Relocation Provided)",Agoda,"Hamburg, Hamburg, Germany",2026-04-14,https://www.linkedin.com/jobs/view/4389463156 , ,li-4389463156,fulltime,,,,,,False,mid-senior level,"Design, Art/Creative, and Information Technology",,,"Technology, Information and Internet",https://sg.linkedin.com/company/agoda,,,,,,,,,,,
linkedin,"Product Design Lead, Checkout and Payments (Bangkok - Based, Relocation Provided)",Agoda,"Frankfurt, Hesse, Germany",2026-04-14,https://www.linkedin.com/jobs/view/4389451669 , ,li-4389451669,fulltime,,,,,,False,mid-senior level,"Design, Art/Creative, and Information Technology",,,"Technology, Information and Internet",https://sg.linkedin.com/company/agoda,,,,,,,,,,,
linkedin,Senior Sales Manager m/w/d Asset Finance für die Region Ostwestfalen / Lippe,Würth Leasing GmbH & Co. KG,"Ratingen, North Rhine-Westphalia, Germany",2026-04-14,https://www.linkedin.com/jobs/view/4401727189 , ,li-4401727189,fulltime,,,,,,False,mid-senior level,Sales and Business Development,,,Financial Services,https://de.linkedin.com/company/wuerthleasing,,,,,,,,,,,
linkedin,Team Lead AI Engineering (all genders),MHP – A Porsche Company,"Düsseldorf, North Rhine-Westphalia, Germany",2026-04-14,https://www.linkedin.com/jobs/view/4389258644 , ,li-4389258644,fulltime,,,,,,False,mid-senior level,Engineering and Information Technology,,,Business Consulting and Services,https://de.linkedin.com/company/mhp-a-porsche-company,,,,,,,,,,,
linkedin,Head of SMB DACH,PayPal,"Berlin, Berlin, Germany",2026-04-14,https://www.linkedin.com/jobs/view/4401779272 , ,li-4401779272,fulltime,,,,,,False,not applicable,Other,,paypalglobaltalentacquisition@paypal.com,Software Development,https://www.linkedin.com/company/paypal,,,,,,,,,,,
linkedin,Senior Manager - Asset Management Reporting (100% Remote),Tether.io,,2026-04-14,https://www.linkedin.com/jobs/view/4401584564 , ,li-4401584564,fulltime,,,,,,True,not applicable,Finance,,,Financial Services,https://www.linkedin.com/company/tether,,,,,,,,,,,
linkedin,Manager:in Marketing & Events,Kaiserstühler Winzer Ihringen eG,,2026-04-14,https://www.linkedin.com/jobs/view/4399719292 , ,li-4399719292,fulltime,,,,,,False,entry level,Marketing and Sales,,,Wineries,https://www.linkedin.com/company/kaiserst%C3%BChler-winzergenossenschaft-ihringen-eg,,,,,,,,,,,
linkedin,Digital Marketing Manager & Social Media (m/w/d) - Fokus auf datengestütztes Marketing,MOD education,"Stade, Lower Saxony, Germany",2026-04-14,https://www.linkedin.com/jobs/view/4401586666 , ,li-4401586666,fulltime,,,,,,False,entry level,Marketing,,,Advertising Services,https://de.linkedin.com/school/masters-of-digital-education/,,,,,,,,,,,
linkedin,Senior (Key-) Account Manager (m/w/d),SEGULA Technologies,"Cologne, North Rhine-Westphalia, Germany",2026-04-14,https://www.linkedin.com/jobs/view/4204942441 , ,li-4204942441,fulltime,,,,,,False,mid-senior level,Sales,,,Machinery Manufacturing,https://fr.linkedin.com/company/segula-technologies,,,,,,,,,,,
linkedin,(Senior) Account & Deposit Operations Manager (m/w/d),Creditplus Bank AG,"Stuttgart, Baden-Württemberg, Germany",2026-04-14,https://www.linkedin.com/jobs/view/4399743111 , ,li-4399743111,fulltime,,,,,,False,mid-senior level,Management and Manufacturing,,zehra.blume@creditplus.de,Banking,https://de.linkedin.com/company/creditplus-bank-ag,,,,,,,,,,,
linkedin,Senior 180° Consultant / Key Account Manager (m/w/d) - Life Science,Aristo Group,"Munich, Bavaria, Germany",2026-04-14,https://www.linkedin.com/jobs/view/4400712743 , ,li-4400712743,fulltime,,,,,,False,mid-senior level,Sales and Business Development,,,Staffing and Recruiting,https://de.linkedin.com/company/aristogroup,,,,,,,,,,,
linkedin,Global Product Manager – Dryer and Conditioning Products,AGI FERTILIZER SYSTEMS,"Frankfurt, Hesse, Germany",2026-04-14,https://www.linkedin.com/jobs/view/4401575837 , ,li-4401575837,internship,,,,,,False,mid-senior level,Product Management and Marketing,,,Mechanical Or Industrial Engineering,https://www.linkedin.com/showcase/agifertilizersystems/,,,,,,,,,,,
linkedin,Personal Assistant to Chief Executive Officer,Ming Yang Smart Energy,"Hamburg, Germany",2026-04-14,https://www.linkedin.com/jobs/view/4400725607 , ,li-4400725607,fulltime,,,,,,False,mid-senior level,Administrative,,,Renewable Energy Equipment Manufacturing,https://cn.linkedin.com/company/mingyangsmartenergy,,,,,,,,,,,
linkedin,"Product Manager, Search Ranking",eBay,,2026-04-14,https://www.linkedin.com/jobs/view/4399765237 , ,li-4399765237,fulltime,,,,,,False,mid-senior level,Product Management and Marketing,,talent@ebay.com,"Technology, Information and Internet",https://www.linkedin.com/company/ebay,,,,,,,,,,,
linkedin,Global Project Procurement Manager (w/m/d),Siemens Energy,"Erlangen, Bavaria, Germany",2026-04-14,https://www.linkedin.com/jobs/view/4400781752 , ,li-4400781752,fulltime,,,,,,True,associate,Supply Chain,,,"Appliances, Electrical, and Electronics Manufacturing",https://www.linkedin.com/company/siemens-energy,,,,,,,,,,,
linkedin,External Lecturer on a fee basis Agile Project and Risk Management f/m/d,SRH University,"Berlin, Berlin, Germany",2026-04-14,https://www.linkedin.com/jobs/view/4401750997 , ,li-4401750997,fulltime,,,,,,False,associate,Education and Training,,johanna.ruehle@srh.de,Individual and Family Services,https://de.linkedin.com/school/srh-university/,,,,,,,,,,,
linkedin,Senior Project Manager - Automotive Warranty and Services (f/m/x),AUTO1 Group,"Berlin, Berlin, Germany",2026-04-14,https://www.linkedin.com/jobs/view/4400763597 , ,li-4400763597,fulltime,,,,,,False,mid-senior level,Customer Service,,,Motor Vehicle Manufacturing,https://de.linkedin.com/company/auto1-group,,,,,,,,,,,
linkedin,Team Lead Train Driving Deutschland (m/w/d),BLS Cargo,,2026-04-14,https://www.linkedin.com/jobs/view/4394793573 , ,li-4394793573,fulltime,,,,,,False,associate,Manufacturing,,,"Transportation, Logistics, Supply Chain and Storage",https://www.linkedin.com/company/bls-cargo,,,,,,,,,,,
linkedin,Regulatory Compliance - Project Management,Roche,"Mannheim, Baden-Württemberg, Germany",2026-04-14,https://www.linkedin.com/jobs/view/4401791536 , ,li-4401791536,fulltime,,,,,,False,associate,Quality Assurance and Consulting,,,"Pharmaceutical Manufacturing, Biotechnology Research, and Medical Equipment Manufacturing",https://ch.linkedin.com/company/roche,,,,,,,,,,,
linkedin,Trainee (m/w/d) Bauingenieurwesen,KB,"Kempten, Bavaria, Germany",2026-04-14,https://www.linkedin.com/jobs/view/4399724614 , ,li-4399724614,fulltime,,,,,,False,entry level,Engineering,,,Industrial Machinery Manufacturing,https://de.linkedin.com/company/konstruktionsgruppe-bauen-ag,,,,,,,,,,,
linkedin,"Director, Technical Innovation, DE",The Coca-Cola Company,"Berlin, Berlin, Germany",2026-04-14,https://www.linkedin.com/jobs/view/4402057831 , ,li-4402057831,fulltime,,,,,,False,not applicable,Production,,,"Manufacturing, Food and Beverage Manufacturing, and Food and Beverage Services",https://www.linkedin.com/company/the-coca-cola-company,,,,,,,,,,,
linkedin,Senior Project Manager,Intersnack Group,"Düsseldorf, North Rhine-Westphalia, Germany",2026-04-14,https://www.linkedin.com/jobs/view/4401730102 , ,li-4401730102,fulltime,,,,,,False,mid-senior level,Project Management and Information Technology,,,Food and Beverage Manufacturing,https://de.linkedin.com/company/intersnack-group,,,,,,,,,,,
linkedin,"Product Manager, New Grad (2026) - Berlin",Databricks,"Berlin, Berlin, Germany",2026-04-14,https://www.linkedin.com/jobs/view/4297734975 , ,li-4297734975,fulltime,,,,,,False,entry level,Engineering,,,Software Development,https://www.linkedin.com/company/databricks,,,,,,,,,,,
linkedin,Teamleiter Product Management (m/w/d) Custom Products & Smart Cameras - Global,Allied Vision,"Ahrensburg, Schleswig-Holstein, Germany",2026-04-14,https://www.linkedin.com/jobs/view/4399745776 , ,li-4399745776,fulltime,,,,,,False,mid-senior level,"Product Management, Management, and Business Development",,,"Appliances, Electrical, and Electronics Manufacturing",https://de.linkedin.com/company/allied-vision-technologies,,,,,,,,,,,
linkedin,Commercial Manager,Adamantine Recruitment,"Frankfurt, Hesse, Germany",2026-04-14,https://www.linkedin.com/jobs/view/4400712660 , ,li-4400712660,fulltime,,,,,,False,mid-senior level,Engineering,,,Engineering Services and Construction,https://ie.linkedin.com/company/adamantine-recruitment,,,,,,,,,,,
linkedin,Payment Product Manager 🇫🇷 (Billing),Pennylane,"Munich, Bavaria, Germany",2026-04-14,https://www.linkedin.com/jobs/view/4389282426 , ,li-4389282426,fulltime,,,,,,True,entry level,Product Management and Marketing,,,Accounting,https://fr.linkedin.com/company/pennylaneaccounting,,,,,,,,,,,
linkedin,Produktmanager (m/w/d) Schwerpunkt Privatkunden,Volksbank im Münsterland eG,"Rheine, North Rhine-Westphalia, Germany",2026-04-14,https://www.linkedin.com/jobs/view/4401772382 , ,li-4401772382,fulltime,,,,,,False,mid-senior level,Product Management and Marketing,,"stephanie.wolters@vbml.de, michael.buecker@vbml.de",Banking,https://de.linkedin.com/company/vb-muensterland,,,,,,,,,,,
linkedin,Team Lead ServiceNow Consulting,EvolveTalent®,,2026-04-14,https://www.linkedin.com/jobs/view/4401767987 , ,li-4401767987,fulltime,,,,,,False,mid-senior level,Consulting and Information Technology,,,IT Services and IT Consulting and Business Consulting and Services,https://de.linkedin.com/company/evolvetalent1,,,,,,,,,,,
linkedin,PRADA Client Advisor (m/f/d),Prada Group,"Düsseldorf, North Rhine-Westphalia, Germany",2026-04-14,https://www.linkedin.com/jobs/view/4400780229 , ,li-4400780229,fulltime,,,,,,False,associate,"Consulting, Information Technology, and Sales",,,Retail Luxury Goods and Jewelry and Retail,https://it.linkedin.com/company/pradagroup,,,,,,,,,,,
linkedin,Medizincontroller (m/w/d),Die GFO,"Bonn, North Rhine-Westphalia, Germany",2026-04-14,https://www.linkedin.com/jobs/view/4399753060 , ,li-4399753060,fulltime,,,,,,False,mid-senior level,Health Care Provider,,,Health and Human Services,https://de.linkedin.com/company/gfo-verbund,,,,,,,,,,,
linkedin,Commercial Project Manager (f/m/d),Siemens,"Munich, Bavaria, Germany",2026-04-14,https://www.linkedin.com/jobs/view/4400772688 , ,li-4400772688,fulltime,,,,,,False,mid-senior level,Project Management,,,Automation Machinery Manufacturing,https://de.linkedin.com/company/siemens,,,,,,,,,,,
linkedin,Global Customer Success & Retention Manager (m/f/x),apryl (acq. by Progyny),"Berlin, Berlin, Germany",2026-04-14,https://www.linkedin.com/jobs/view/4399724939 , ,li-4399724939,fulltime,,,,,,True,associate,Sales,,,Individual and Family Services,https://de.linkedin.com/company/apryl,,,,,,,,,,,
linkedin,Produktmanager (m/w/d),Waldhausen GmbH & Co. KG,"Cologne, North Rhine-Westphalia, Germany",2026-04-14,https://www.linkedin.com/jobs/view/4401577021 , ,li-4401577021,fulltime,,,,,,False,entry level,Engineering,,personal@waldhausen.com,Wholesale,https://de.linkedin.com/company/waldhausen-gmbh-&-co-kg,,,,,,,,,,,
linkedin,Senior Manager - Global EHS Learning & Development,Veolia | Water Tech,"Celle, Lower Saxony, Germany",2026-04-14,https://www.linkedin.com/jobs/view/4399779190 , ,li-4399779190,fulltime,,,,,,True,not applicable,Other,,,Software Development and IT Services and IT Consulting,https://fr.linkedin.com/company/veolia-water-tech,,,,,,,,,,,
linkedin,Data Team Lead (incl. GenAI) (m/f/d),Smartbroker AG,"Berlin, Berlin, Germany",2026-04-14,https://www.linkedin.com/jobs/view/4399724381 , ,li-4399724381,fulltime,,,,,,False,mid-senior level,Information Technology,,,Banking,https://de.linkedin.com/company/wallstreet-online-capital,,,,,,,,,,,
linkedin,Senior Business Development Manager,Hays,"Raunheim, Hesse, Germany",2026-04-14,https://www.linkedin.com/jobs/view/4401720569 , ,li-4401720569,fulltime,,,,,,False,associate,"Sales, Business Development, and General Business",,,"Motor Vehicle Manufacturing, Alternative Fuel Vehicle Manufacturing, and Motor Vehicle Parts Manufacturing",https://uk.linkedin.com/company/hays,,,,,,,,,,,
linkedin,Regional Leagues Coordinator,BLAST,"Berlin, Berlin, Germany",2026-04-14,https://www.linkedin.com/jobs/view/4401730416 , ,li-4401730416,fulltime,,,,,,False,entry level,Other,,,IT Services and IT Consulting,https://dk.linkedin.com/company/blast-esports,,,,,,,,,,,
linkedin,Servicetechniker im Innendienst als Technischer Projektleiter - Industrietore (m/w/d),Unitor Torsysteme GmbH,"Westoverledingen, Lower Saxony, Germany",2026-04-14,https://www.linkedin.com/jobs/view/4401726992 , ,li-4401726992,fulltime,,,,,,False,entry level,Engineering,,andre.mueller@unitor.de,Industrial Machinery Manufacturing,https://de.linkedin.com/company/unitor-torsysteme-gmbh,,,,,,,,,,,
linkedin,Senior Project Manager - Europe,AVK-SEG,"Frankfurt am Main, Hesse, Germany",2026-04-14,https://www.linkedin.com/jobs/view/4399755148 , ,li-4399755148,fulltime,,,,,,False,mid-senior level,Other,,,IT Services and IT Consulting,https://uk.linkedin.com/company/avk-seg-uk-ltd,,,,,,,,,,,
linkedin,Senior Project Manager - Operations (m/w/d) | Beteiligungsgesellschaft mit Fokus auf Industrieunternehmen | Einsätze bei den Portfoliounternehmen vor Ort,CorpFin Search,,2026-04-14,https://www.linkedin.com/jobs/view/4402025412 , ,li-4402025412,fulltime,,,,,,False,associate,Project Management and Production,,,Industrial Machinery Manufacturing and Automation Machinery Manufacturing,https://de.linkedin.com/company/corpfin-search,,,,,,,,,,,
linkedin,Site Manager - Electrical/Energy Projects - Germany,EarthStream Global,"Bavaria, Germany",2026-04-14,https://www.linkedin.com/jobs/view/4400755326 , ,li-4400755326,contract,,,,,,False,mid-senior level,Engineering,,,"Electric Power Transmission, Control, and Distribution and Construction",https://uk.linkedin.com/company/earthstream-global,,,,,,,,,,,
linkedin,Project Procurement Manager,Clear.,"Wuppertal, North Rhine-Westphalia, Germany",2026-04-14,https://www.linkedin.com/jobs/view/4400716395 , ,li-4400716395,contract,,,,,,False,mid-senior level,Supply Chain and Project Management,,,Construction and Operations Consulting,https://uk.linkedin.com/company/clearengineeringrecruitment,,,,,,,,,,,
linkedin,Projektmanager M&E (m/w/d),Cumming Group,"Berlin, Berlin, Germany",2026-04-14,https://www.linkedin.com/jobs/view/4399779146 , ,li-4399779146,fulltime,,,,,,False,mid-senior level,Engineering,,,Architecture and Planning,https://www.linkedin.com/company/cumming-group,,,,,,,,,,,
linkedin,Senior Project Manager,Capstone Recruitment UK,"Berlin, Germany",2026-04-14,https://www.linkedin.com/jobs/view/4399749834 , ,li-4399749834,fulltime,,,,,,False,not applicable,Project Management,,,"Utilities, Construction, and Electric Power Transmission, Control, and Distribution",https://uk.linkedin.com/company/capstone-recruitment-uk,,,,,,,,,,,
linkedin,Project Manager - E-commerce,Jobgether,,2026-04-14,https://www.linkedin.com/jobs/view/4400720123 , ,li-4400720123,fulltime,,,,,,True,mid-senior level,Sales and Business Development,,,Internet Marketplace Platforms,https://be.linkedin.com/company/jobgether,,,,,,,,,,,
linkedin,Senior Project Manager,Coforge,"Frankfurt, Hesse, Germany",2026-04-14,https://www.linkedin.com/jobs/view/4400774958 , ,li-4400774958,fulltime,,,,,,True,mid-senior level,Project Management,,,"IT Services and IT Consulting, Banking, and Financial Services",https://in.linkedin.com/company/coforge-tech,,,,,,,,,,,
linkedin,Senior Project Manager (all genders) - Event,LIGANOVA HORIZON,"Berlin, Berlin, Germany",2026-04-14,https://www.linkedin.com/jobs/view/4399764397 , ,li-4399764397,fulltime,,,,,,False,not applicable,Marketing,,,Software Development,https://de.linkedin.com/company/liganovahorizon,,,,,,,,,,,
linkedin,Senior Project Manager (all genders) - Event- und Retail-Kampagnen,LIGANOVA,"Berlin, Berlin, Germany",2026-04-14,https://www.linkedin.com/jobs/view/4399773118 , ,li-4399773118,fulltime,,,,,,False,associate,Marketing,,,Advertising Services,https://de.linkedin.com/company/liganova-stuttgart,,,,,,,,,,,
linkedin,Senior Project Manager für die Steuerung technisch komplexer Entwicklungsprojekte (m/w/d),VINCORION,"Altenstadt, Bavaria, Germany",2026-04-14,https://www.linkedin.com/jobs/view/4401721473 , ,li-4401721473,fulltime,,,,,,False,associate,Engineering and Project Management,,,"Defense and Space Manufacturing, Machinery Manufacturing, and Computers and Electronics Manufacturing",https://de.linkedin.com/company/vincorion,,,,,,,,,,,
linkedin,Project Director,Mercury,"Lower Saxony, Germany",2026-04-14,https://www.linkedin.com/jobs/view/4251515117 , ,li-4251515117,fulltime,,,,,,False,director,"Management, Project Management, and Engineering",,,Construction and Engineering Services,https://ie.linkedin.com/company/mercury-engineering,,,,,,,,,,,
linkedin,Technical Project Manager (DACH),Connected Load Carrier,"Frankfurt, Hesse, Germany",2026-04-14,https://www.linkedin.com/jobs/view/4401777109 , ,li-4401777109,fulltime,,,,,,False,mid-senior level,Project Management and Information Technology,,,IT Services and IT Consulting,https://nl.linkedin.com/company/connected-load-carrier,,,,,,,,,,,
linkedin,"Data Center Site Selection TPM, EMEA Region-Frankfurt",Alibaba Cloud,"Frankfurt, Hesse, Germany",2026-04-14,https://www.linkedin.com/jobs/view/4353794638 , ,li-4353794638,fulltime,,,,,,False,mid-senior level,Project Management and Information Technology,,,IT System Custom Software Development,https://cn.linkedin.com/company/alibaba-cloud-computing-company,,,,,,,,,,,
