site,title,company,location,date_posted,job_url,job_url_direct,id,job_type,salary_source,interval,min_amount,max_amount,currency,is_remote,job_level,job_function,listing_type,emails,company_industry,company_url,company_url_direct,company_addresses,company_num_employees,company_revenue,company_description,skills,experience_range,company_rating,company_reviews_count,vacancy_count,work_from_home_type
linkedin,Project Manager,Tata Technologies,"Augsburg, Bavaria, Germany",2026-05-12,https://www.linkedin.com/jobs/view/4413453887 , ,li-4413453887,fulltime,,,,,,False,mid-senior level,Information Technology and Management,,,"Engineering Services, Aviation and Aerospace Component Manufacturing, and IT Services and IT Consulting",https://in.linkedin.com/company/tata-technologies,,,,,,,,,,,
linkedin,Supply Chain Team Lead (m/w/d) Staffshop / FAMILY&FRIENDS,L'Oréal,"Düsseldorf, North Rhine-Westphalia, Germany",2026-05-12,https://www.linkedin.com/jobs/view/4413596128 , ,li-4413596128,fulltime,,,,,,False,not applicable,"Public Relations, Strategy/Planning, and Other",,,Manufacturing and Personal Care Product Manufacturing,https://fr.linkedin.com/company/lor%C3%A9al,,,,,,,,,,,
linkedin,Senior Information Technology Project Manager,AGNTX,"Berlin, Germany",2026-05-12,https://www.linkedin.com/jobs/view/4410160419 , ,li-4410160419,fulltime,,,,,,False,mid-senior level,Project Management and Information Technology,,,Staffing and Recruiting,https://uk.linkedin.com/company/agntx-recruitment,,,,,,,,,,,
linkedin,AI Project Management Transformation Lead (f/m/d),Siemens Energy,"Berlin, Berlin, Germany",2026-05-12,https://www.linkedin.com/jobs/view/4413560055 , ,li-4413560055,fulltime,,,,,,True,associate,Research,,,"Appliances, Electrical, and Electronics Manufacturing",https://www.linkedin.com/company/siemens-energy,,,,,,,,,,,
linkedin,AI Project Management Transformation Lead (f/m/d),Siemens Energy,"Munich, Bavaria, Germany",2026-05-12,https://www.linkedin.com/jobs/view/4413559114 , ,li-4413559114,fulltime,,,,,,True,associate,Research,,,"Appliances, Electrical, and Electronics Manufacturing",https://www.linkedin.com/company/siemens-energy,,,,,,,,,,,
linkedin,AI Project Management Transformation Lead (f/m/d),Siemens Energy,"Nuremberg, Bavaria, Germany",2026-05-12,https://www.linkedin.com/jobs/view/4413539904 , ,li-4413539904,fulltime,,,,,,True,associate,Research,,,"Appliances, Electrical, and Electronics Manufacturing",https://www.linkedin.com/company/siemens-energy,,,,,,,,,,,
linkedin,CSA Project Manager - Data Centre Projects - Germany!,EarthStream Global,,2026-05-12,https://www.linkedin.com/jobs/view/4413571888 , ,li-4413571888,fulltime,,,,,,False,mid-senior level,Project Management,,,Construction,https://uk.linkedin.com/company/earthstream-global,,,,,,,,,,,
linkedin,(Senior) Project Manager:in (w/m/d),d.velop,"North Rhine-Westphalia, Germany",2026-05-12,https://www.linkedin.com/jobs/view/4410136384 , ,li-4410136384,fulltime,,,,,,False,associate,"Information Technology, Project Management, and Consulting",,,"IT Services and IT Consulting, Software Development, and IT System Custom Software Development",https://de.linkedin.com/company/d-velop,,,,,,,,,,,
linkedin,(Senior) Real Estate Project Manager Hospitality (all genders) in Berlin,HOMARIS,"Berlin, Berlin, Germany",2026-05-12,https://www.linkedin.com/jobs/view/4395024762 , ,li-4395024762,fulltime,,,,,,False,associate,Project Management and Information Technology,,karriere@homaris.de,Hospitality and Real Estate,https://de.linkedin.com/company/homaris,,,,,,,,,,,
linkedin,Digital Marketing Consultant - Project Lead (all genders),adesso SE,"Nuremberg, Bavaria, Germany",2026-05-12,https://www.linkedin.com/jobs/view/4298381919 , ,li-4298381919,fulltime,,,,,,False,mid-senior level,Marketing and Sales,,,IT Services and IT Consulting,https://de.linkedin.com/company/adesso-se,,,,,,,,,,,
linkedin,Senior Project Manager (m/f/d) - Data Centre Construction,Linesight,"Frankfurt am Main, Hesse, Germany",2026-05-12,https://www.linkedin.com/jobs/view/4413526685 , ,li-4413526685,fulltime,,,,,,False,mid-senior level,Consulting,,,Construction,https://ie.linkedin.com/company/linesight,,,,,,,,,,,
linkedin,Produktmanager Aktivgeschäft (m/w/d),Sparkasse Regensburg,"Regensburg, Bavaria, Germany",2026-05-12,https://www.linkedin.com/jobs/view/4404331801 , ,li-4404331801,fulltime,,,,,,False,mid-senior level,Sales,,,Financial Services,https://de.linkedin.com/company/sparkasse-regensburg,,,,,,,,,,,
linkedin,Digital Marketing Consultant - Project Lead (all genders),adesso SE,"Frankfurt, Hesse, Germany",2026-05-12,https://www.linkedin.com/jobs/view/4298399086 , ,li-4298399086,fulltime,,,,,,False,mid-senior level,Marketing and Sales,,,IT Services and IT Consulting,https://de.linkedin.com/company/adesso-se,,,,,,,,,,,
linkedin,Digital Marketing Consultant - Project Lead (all genders),adesso SE,"Saarbrücken, Saarland, Germany",2026-05-12,https://www.linkedin.com/jobs/view/4298600075 , ,li-4298600075,fulltime,,,,,,False,mid-senior level,Marketing and Sales,,,IT Services and IT Consulting,https://de.linkedin.com/company/adesso-se,,,,,,,,,,,
linkedin,Digital Marketing Consultant - Project Lead (all genders),adesso SE,"Essen, North Rhine-Westphalia, Germany",2026-05-12,https://www.linkedin.com/jobs/view/4298388445 , ,li-4298388445,fulltime,,,,,,False,mid-senior level,Marketing and Sales,,,IT Services and IT Consulting,https://de.linkedin.com/company/adesso-se,,,,,,,,,,,
linkedin,Site Manager,Crown,"Frankfurt am Main, Hesse, Germany",2026-05-12,https://www.linkedin.com/jobs/view/4413286766 , ,li-4413286766,fulltime,,,,,,False,mid-senior level,Other,,,IT Services and IT Consulting,https://ie.linkedin.com/company/crown-full-envelope-solutions,,,,,,,,,,,
linkedin,Product Manager - Data-Viz Startup - B2B SaaS,Vizzlo,,2026-05-12,https://www.linkedin.com/jobs/view/4410186643 , ,li-4410186643,fulltime,,,,,,True,entry level,Product Management,,,IT Services and IT Consulting,https://de.linkedin.com/company/vizzlo,,,,,,,,,,,
linkedin,Senior Product Manager,Consultport,"Berlin, Berlin, Germany",2026-05-12,https://www.linkedin.com/jobs/view/4410145084 , ,li-4410145084,fulltime,,,,,,False,mid-senior level,Product Management,,,Professional Services,https://de.linkedin.com/company/consultport,,,,,,,,,,,
linkedin,Produktmanager (m/w/d) Digitale Beratungsprozesse (1 1/2 Jahre befristet),ATLAS Vertriebsservice,"Frankfurt am Main, Hesse, Germany",2026-05-12,https://www.linkedin.com/jobs/view/4381724336 , ,li-4381724336,fulltime,,,,,,True,entry level,Product Management and Marketing,,,Financial Services,https://de.linkedin.com/company/atlas-vertriebsservice,,,,,,,,,,,
linkedin,Senior Product Manager - Celonis Labs,Celonis,"Munich, Bavaria, Germany",2026-05-12,https://www.linkedin.com/jobs/view/4384484016 , ,li-4384484016,fulltime,,,,,,True,not applicable,Product Management and Marketing,,,Software Development,https://www.linkedin.com/company/celonis,,,,,,,,,,,
linkedin,Software Technical Project Manager,turbalance,"Heidelberg, Baden-Württemberg, Germany",2026-05-12,https://www.linkedin.com/jobs/view/4413458621 , ,li-4413458621,fulltime,,,,,,True,mid-senior level,Project Management and Information Technology,,,Software Development,https://www.linkedin.com/company/turbalance,,,,,,,,,,,
linkedin,Senior Project Manager (m/f/d),DUDE CHEM,"Berlin, Berlin, Germany",2026-05-12,https://www.linkedin.com/jobs/view/4410170705 , ,li-4410170705,fulltime,,,,,,True,mid-senior level,Engineering,,,Pharmaceutical Manufacturing,https://de.linkedin.com/company/dudechem,,,,,,,,,,,
linkedin,Senior Project Manager – BESS (m/w/d),JD Ross Energy,"Berlin, Germany",2026-05-12,https://www.linkedin.com/jobs/view/4413531544 , ,li-4413531544,fulltime,,,,,,False,mid-senior level,Project Management,,antoinette.becker@jdrossenergy.com,Energy Technology and Services for Renewable Energy,https://uk.linkedin.com/company/jdr-energy,,,,,,,,,,,
linkedin,Senior Project Manager (m/w/d),sciencentric® AG,"Düsseldorf, North Rhine-Westphalia, Germany",2026-05-12,https://www.linkedin.com/jobs/view/4413486181 , ,li-4413486181,fulltime,,,,,,False,mid-senior level,Project Management and Information Technology,,,IT Services and IT Consulting,https://de.linkedin.com/company/sciencentric-ag,,,,,,,,,,,
linkedin,Project Management Director,Aristo Group,"Baden-Württemberg, Germany",2026-05-12,https://www.linkedin.com/jobs/view/4413575182 , ,li-4413575182,fulltime,,,,,,False,director,"Project Management, Supply Chain, and Health Care Provider",,,Pharmaceutical Manufacturing,https://de.linkedin.com/company/aristogroup,,,,,,,,,,,
linkedin,Junior Research Analyst - survey based (primary research),Nielsen,"Hamburg, Hamburg, Germany",2026-05-12,https://www.linkedin.com/jobs/view/4410186296 , ,li-4410186296,fulltime,,,,,,False,not applicable,Other,,,Broadcast Media Production and Distribution,https://www.linkedin.com/company/nielsen,,,,,,,,,,,
linkedin,Clinical Project Coordinator,Medpace,"Munich, Bavaria, Germany",2026-05-12,https://www.linkedin.com/jobs/view/4329866596 , ,li-4329866596,fulltime,,,,,,False,not applicable,Project Management and Information Technology,,,Pharmaceutical Manufacturing,https://www.linkedin.com/company/medpace,,,,,,,,,,,
linkedin,Supply Chain Expert Process Optimization (m/f/d),REPA,"Bergkirchen, Bavaria, Germany",2026-05-12,https://www.linkedin.com/jobs/view/4392654636 , ,li-4392654636,fulltime,,,,,,False,associate,Supply Chain,,bewerbung.de@repagroup.com,Wholesale,https://de.linkedin.com/company/repagroup,,,,,,,,,,,
linkedin,Terminplaner MS-Project,ERSG Ltd,"Heilbronn, Baden-Württemberg, Germany",2026-05-12,https://www.linkedin.com/jobs/view/4410137612 , ,li-4410137612,fulltime,,,,,,True,not applicable,Project Management,,,"Electric Power Transmission, Control, and Distribution",https://uk.linkedin.com/company/ersg-ltd,,,,,,,,,,,
linkedin,Clinical Operations Lead,Alimentiv,"Cologne, North Rhine-Westphalia, Germany",2026-05-12,https://www.linkedin.com/jobs/view/4407675203 , ,li-4407675203,fulltime,,,,,,False,not applicable,Management and Manufacturing,,recruitment@alimentiv.com,Pharmaceutical Manufacturing,https://ca.linkedin.com/company/alimentiv,,,,,,,,,,,
linkedin,Projektmanager,epias GmbH,,2026-05-12,https://www.linkedin.com/jobs/view/4410137322 , ,li-4410137322,fulltime,,,,,,False,entry level,Project Management and Information Technology,,,Software Development,https://de.linkedin.com/company/epias-gmbh,,,,,,,,,,,
linkedin,Projekt Manager (m/w/d) für Entwicklungsprojekte,Diehl Aviation,"Dresden, Saxony, Germany",2026-05-12,https://www.linkedin.com/jobs/view/4412104632 , ,li-4412104632,fulltime,,,,,,False,mid-senior level,Project Management and Information Technology,,,"Appliances, Electrical, and Electronics Manufacturing",https://de.linkedin.com/company/diehl-aviation,,,,,,,,,,,
linkedin,Head of Digital Growth,COREcruitment Ltd,"Hesse, Germany",2026-05-12,https://www.linkedin.com/jobs/view/4413455587 , ,li-4413455587,fulltime,,,,,,True,mid-senior level,Information Technology and Project Management,,,Hospitality and Restaurants,https://uk.linkedin.com/company/corecruitment-ltd,,,,,,,,,,,
linkedin,Account Representative,GoodWe,"Munich, Bavaria, Germany",2026-05-12,https://www.linkedin.com/jobs/view/4413531490 , ,li-4413531490,fulltime,,,,,,False,entry level,Marketing,,,Renewable Energy Semiconductor Manufacturing,https://cn.linkedin.com/company/goodwesolarengine1,,,,,,,,,,,
linkedin,Projektmanager Product Support After Sales (m/w/d),TKMS,"Kiel, Schleswig-Holstein, Germany",2026-05-12,https://www.linkedin.com/jobs/view/4410189172 , ,li-4410189172,fulltime,,,,,,False,entry level,Project Management,,,Utilities,https://de.linkedin.com/company/tkms,,,,,,,,,,,
linkedin,Senior Project Manager,Aras Corporation,,2026-05-12,https://www.linkedin.com/jobs/view/4413404936 , ,li-4413404936,fulltime,,,,,,False,mid-senior level,Project Management and Information Technology,,,Software Development,https://www.linkedin.com/company/aras-corporation,,,,,,,,,,,
linkedin,Technischer Projektmanager / Projektcontroller (m/w/d) Ingenieurbau / Brückenbau Frankfurt am Main / Hamburg,Firmengruppe Max Bögl,"Frankfurt am Main, Hesse, Germany",2026-05-12,https://www.linkedin.com/jobs/view/4345101739 , ,li-4345101739,fulltime,,,,,,False,associate,"Project Management, Analyst, and Engineering",,,Construction,https://de.linkedin.com/company/firmengruppe-max-b%C3%B6gl,,,,,,,,,,,
linkedin,Environment Health Safety Lead,Kenton Black,"Düsseldorf, North Rhine-Westphalia, Germany",2026-05-12,https://www.linkedin.com/jobs/view/4413290704 , ,li-4413290704,fulltime,,,,,,False,mid-senior level,Management and Quality Assurance,,,Construction,https://uk.linkedin.com/company/kenton-black-ltd,,,,,,,,,,,
linkedin,Mechanical Project Manager,Mercury,"Frankfurt, Hesse, Germany",2026-05-12,https://www.linkedin.com/jobs/view/4327114700 , ,li-4327114700,fulltime,,,,,,False,mid-senior level,Project Management and Information Technology,,,Construction,https://ie.linkedin.com/company/mercury-engineering,,,,,,,,,,,
linkedin,(Sr.) Project Manager (m/f/d),Nexperia,"Hamburg, Hamburg, Germany",2026-05-12,https://www.linkedin.com/jobs/view/4409214115 , ,li-4409214115,fulltime,,,,,,False,mid-senior level,Project Management and Information Technology,,,Semiconductor Manufacturing,https://nl.linkedin.com/company/nexperia,,,,,,,,,,,
linkedin,Senior Project Manager:in IT (w/m/d),Eppendorf,"Hamburg, Hamburg, Germany",2026-05-12,https://www.linkedin.com/jobs/view/4413538433 , ,li-4413538433,fulltime,,,,,,False,mid-senior level,Project Management and Information Technology,,,Biotechnology Research,https://de.linkedin.com/company/eppendorf,,,,,,,,,,,
linkedin,Senior Product & Client Manager (all genders),JAKALA,"Hamburg, Germany",2026-05-12,https://www.linkedin.com/jobs/view/4410155452 , ,li-4410155452,fulltime,,,,,,False,mid-senior level,Product Management and Sales,,,IT Services and IT Consulting,https://it.linkedin.com/company/jakala,,,,,,,,,,,
linkedin,Director Multi Project Management,SchuhEder Consulting GmbH,"Bavaria, Germany",2026-05-12,https://www.linkedin.com/jobs/view/4410173901 , ,li-4410173901,fulltime,,,,,,False,director,Project Management,,,"Appliances, Electrical, and Electronics Manufacturing, Computers and Electronics Manufacturing, and Services for Renewable Energy",https://de.linkedin.com/company/schuheder-consulting-gmbh,,,,,,,,,,,
linkedin,"Produkt Platform Manager (m/w/d) Marine & Stationary, Future Fuels",Rolls-Royce,"Friedrichshafen, Baden-Württemberg, Germany",2026-05-12,https://www.linkedin.com/jobs/view/4413198726 , ,li-4413198726,fulltime,,,,,,False,mid-senior level,Management and Manufacturing,,careers@ps.rolls,Industrial Machinery Manufacturing,https://uk.linkedin.com/company/rolls-royce,,,,,,,,,,,
linkedin,Project Manager Senior,Sherwin-Williams,"Wuppertal, North Rhine-Westphalia, Germany",2026-05-12,https://www.linkedin.com/jobs/view/4410161772 , ,li-4410161772,fulltime,,,,,,False,mid-senior level,Project Management and Information Technology,,,Chemical Manufacturing and Manufacturing,https://www.linkedin.com/company/sherwin-williams,,,,,,,,,,,
linkedin,Produktmanager (m/w/d) – Halbleiterindustrie,Aalberts advanced mechatronics,"Eiterfeld, Hesse, Germany",2026-05-12,https://www.linkedin.com/jobs/view/4391825066 , ,li-4391825066,fulltime,,,,,,False,mid-senior level,Production,,,Fabricated Metal Products,https://nl.linkedin.com/company/aalberts-advanced-mechatronics,,,,,,,,,,,
linkedin,Project Manager Cloud & Platform Engineering (m/w/d),VECTOR Informatik,"Regensburg, Bavaria, Germany",2026-05-12,https://www.linkedin.com/jobs/view/4413446355 , ,li-4413446355,fulltime,,,,,,False,mid-senior level,Project Management and Information Technology,,,Software Development,https://de.linkedin.com/company/vectorgrp,,,,,,,,,,,
linkedin,Projektleitung (all genders),adesso SE,"Berlin, Berlin, Germany",2026-05-12,https://www.linkedin.com/jobs/view/3925555607 , ,li-3925555607,fulltime,,,,,,False,director,Project Management and Information Technology,,,IT Services and IT Consulting,https://de.linkedin.com/company/adesso-se,,,,,,,,,,,
linkedin,Airbus - Cabin Upgrade Project Manager (d/m/w),Randstad Deutschland,"Hamburg, Hamburg, Germany",2026-05-12,https://www.linkedin.com/jobs/view/4413173713 , ,li-4413173713,fulltime,,,,,,False,mid-senior level,Project Management and Information Technology,,,Human Resources Services,https://de.linkedin.com/company/randstad-deutschland,,,,,,,,,,,
linkedin,Projektleiter:in,EXECURATER GmbH,"Rain, Bavaria, Germany",2026-05-12,https://www.linkedin.com/jobs/view/4413415151 , ,li-4413415151,fulltime,,,,,,False,associate,Engineering,,,Machinery Manufacturing,https://de.linkedin.com/company/execurater,,,,,,,,,,,
linkedin,"Ingenieur im Projektmanagement, all genders",SALT AND PEPPER Group,"Augsburg, Bavaria, Germany",2026-05-12,https://www.linkedin.com/jobs/view/4301184219 , ,li-4301184219,fulltime,,,,,,False,entry level,Engineering and Information Technology,,,Engineering Services,https://de.linkedin.com/company/salt-and-pepper,,,,,,,,,,,
linkedin,Project & Portfolio Manager Taste - Central Europe (fixed term - 2 years) (m/f/d),IFF,"Oberhausen, North Rhine-Westphalia, Germany",2026-05-12,https://www.linkedin.com/jobs/view/4413451277 , ,li-4413451277,fulltime,,,,,,False,entry level,Finance and Sales,,,Chemical Manufacturing,https://www.linkedin.com/company/iff,,,,,,,,,,,
linkedin,"Senior Project Leader, R&D (f/m/d),",Baxter International Inc.,"Munich, Bavaria, Germany",2026-05-12,https://www.linkedin.com/jobs/view/4404530421 , ,li-4404530421,fulltime,,,,,,False,mid-senior level,Project Management and Information Technology,,_lange@baxter.com,Medical Equipment Manufacturing,https://www.linkedin.com/company/baxter-healthcare,,,,,,,,,,,
linkedin,"Project Leader or Principal, Operations - Service and Corporate Operations",Boston Consulting Group (BCG),"Stuttgart, Baden-Württemberg, Germany",2026-05-12,https://www.linkedin.com/jobs/view/4323558727 , ,li-4323558727,fulltime,,,,,,False,mid-senior level,Project Management and Information Technology,,,Business Consulting and Services,https://www.linkedin.com/company/boston-consulting-group,,,,,,,,,,,
linkedin,Program Manager,MedTech Startup,"Heidelberg, Baden-Württemberg, Germany",2026-05-12,https://www.linkedin.com/jobs/view/4413468148 , ,li-4413468148,fulltime,,,,,,False,mid-senior level,"Project Management, Management, and Manufacturing",,,Medical Device,https://www.linkedin.com/company/medtech-startup,,,,,,,,,,,
linkedin,Lead Producer,Jobgether,,2026-05-12,https://www.linkedin.com/jobs/view/4413520026 , ,li-4413520026,fulltime,,,,,,True,mid-senior level,"Design, Art/Creative, and Information Technology",,,Internet Marketplace Platforms,https://be.linkedin.com/company/jobgether,,,,,,,,,,,
linkedin,Marketing Project Coordinator,Jobgether,,2026-05-12,https://www.linkedin.com/jobs/view/4413506539 , ,li-4413506539,fulltime,,,,,,True,entry level,Project Management and Information Technology,,,Internet Marketplace Platforms,https://be.linkedin.com/company/jobgether,,,,,,,,,,,
linkedin,Group Lead Product Development (m/w/d),HARTING Technology Group,"Espelkamp, North Rhine-Westphalia, Germany",2026-05-12,https://www.linkedin.com/jobs/view/4413187742 , ,li-4413187742,fulltime,,,,,,False,director,Other,,,Automation Machinery Manufacturing,https://de.linkedin.com/company/harting,,,,,,,,,,,
linkedin,Product Designer (all genders),GROPYUS,"Berlin, Germany",2026-05-12,https://www.linkedin.com/jobs/view/4413462128 , ,li-4413462128,fulltime,,,,,,True,mid-senior level,"Design, Art/Creative, and Information Technology",,,Construction,https://at.linkedin.com/company/gropyus,,,,,,,,,,,
linkedin,Project Manager,JD.COM,"Düsseldorf, North Rhine-Westphalia, Germany",2026-05-12,https://www.linkedin.com/jobs/view/4413461114 , ,li-4413461114,fulltime,,,,,,False,mid-senior level,Project Management and Information Technology,,,Software Development,https://cn.linkedin.com/company/jd.com,,,,,,,,,,,
linkedin,Project Manager - Remote Work,BairesDev,"Berlin, Germany",2026-05-12,https://www.linkedin.com/jobs/view/4413812017 , ,li-4413812017,fulltime,,,,,,True,mid-senior level,Information Technology,,,IT Services and IT Consulting,https://www.linkedin.com/company/bairesdev,,,,,,,,,,,
linkedin,Junior Project Manager,Haystack,,2026-05-12,https://www.linkedin.com/jobs/view/4413568010 , ,li-4413568010,fulltime,,,,,,False,entry level,Administrative,,,"Technology, Information and Internet",https://uk.linkedin.com/company/wearehaystack,,,,,,,,,,,
linkedin,"Project Manager, System",Konecranes,"Düsseldorf, North Rhine-Westphalia, Germany",2026-05-12,https://www.linkedin.com/jobs/view/4410139316 , ,li-4410139316,fulltime,,,,,,False,not applicable,Engineering,,,Machinery Manufacturing,https://fi.linkedin.com/company/konecranes,,,,,,,,,,,
linkedin,Creative Projectmanager*in (m/w/d),TRGGR GmbH | Brand & Activation,"Hamburg, Hamburg, Germany",2026-05-12,https://www.linkedin.com/jobs/view/4413576342 , ,li-4413576342,fulltime,,,,,,False,mid-senior level,Management,,,Advertising Services,https://de.linkedin.com/company/trggr-brand-activation,,,,,,,,,,,
linkedin,Program Manager,Vaupell,"Hamburg, Germany",2026-05-11,https://www.linkedin.com/jobs/view/4412718442 , ,li-4412718442,fulltime,,,,,,False,entry level,Project Management and Information Technology,,,Aviation and Aerospace Component Manufacturing,https://www.linkedin.com/company/vaupell,,,,,,,,,,,
linkedin,Project Manager (m/w/d),shyftplan,"Berlin, Berlin, Germany",2026-05-11,https://www.linkedin.com/jobs/view/4412649918 , ,li-4412649918,fulltime,,,,,,False,associate,Project Management and Information Technology,,,Software Development,https://de.linkedin.com/company/shyftplan,,,,,,,,,,,
linkedin,E-Commerce-Manager:in,Advantage Consultores,,2026-05-11,https://www.linkedin.com/jobs/view/4413030721 , ,li-4413030721,fulltime,,,,,,False,mid-senior level,Marketing and Sales,,,"Veterinary Services, Pharmaceutical Manufacturing, and Animal Feed Manufacturing",https://es.linkedin.com/company/advantage-consultores,,,,,,,,,,,
linkedin,Senior Partner Manager (f/m/x),lemon.markets,"Berlin, Berlin, Germany",2026-05-11,https://www.linkedin.com/jobs/view/4390359751 , ,li-4390359751,fulltime,,,,,,True,mid-senior level,"Business Development, Project Management, and Strategy/Planning",,talent@lemon.markets.com,Financial Services,https://de.linkedin.com/company/lemon-markets,,,,,,,,,,,
linkedin,(Senior) Manager - SAP S/4HANA Product Cycle Management with PLM Cloud (m/w/d),Deloitte,"Düsseldorf, North Rhine-Westphalia, Germany",2026-05-11,https://www.linkedin.com/jobs/view/4349881765 , ,li-4349881765,fulltime,,,,,,True,mid-senior level,Consulting and Information Technology,,career@deloitte.de,Business Consulting and Services,https://www.linkedin.com/company/deloitte,,,,,,,,,,,
linkedin,Senior Produktmanager:in für hochkomplexe Finanzdienstleistungen im Gewerblichen Geschäft,Die Sparkasse Bremen AG,"Bremen, Bremen, Germany",2026-05-11,https://www.linkedin.com/jobs/view/4412757832 , ,li-4412757832,fulltime,,,,,,False,mid-senior level,"Sales, Finance, and Other",,,Financial Services,https://de.linkedin.com/company/die-sparkasse-bremen-ag,,,,,,,,,,,
linkedin,Produktverantwortliche:r für KI‑Plattform (m/w/d),Stiftung Kirchliches Rechenzentrum Südwestdeutschland,"Eggenstein, Baden-Württemberg, Germany",2026-05-11,https://www.linkedin.com/jobs/view/4413129295 , ,li-4413129295,fulltime,,,,,,False,mid-senior level,Other,,,IT Services and IT Consulting,https://www.linkedin.com/company/stiftung-kirchliches-rechenzentrum-s%C3%BCdwestdeutschland,,,,,,,,,,,
linkedin,Growth Manager,Jobgether,,2026-05-11,https://www.linkedin.com/jobs/view/4412593803 , ,li-4412593803,fulltime,,,,,,True,mid-senior level,Marketing and Sales,,,Internet Marketplace Platforms,https://be.linkedin.com/company/jobgether,,,,,,,,,,,
linkedin,Director Time Management (m/f/d),adidas,"Herzogenaurach, Bavaria, Germany",2026-05-11,https://www.linkedin.com/jobs/view/4412994118 , ,li-4412994118,fulltime,,,,,,False,not applicable,Other,,,"Manufacturing, Retail, and Sporting Goods Manufacturing",https://de.linkedin.com/company/adidas,,,,,,,,,,,
linkedin,IT-Projektmanager/in (m/w/d),Schwer Fittings,"Denkingen, Baden-Württemberg, Germany",2026-05-11,https://www.linkedin.com/jobs/view/4412928370 , ,li-4412928370,fulltime,,,,,,False,entry level,Project Management and Information Technology,,,Industrial Machinery Manufacturing,https://de.linkedin.com/company/schwer-fittings-gmbh,,,,,,,,,,,
linkedin,Customer Success Manager (m/w/d),shyftplan,"Berlin, Berlin, Germany",2026-05-11,https://www.linkedin.com/jobs/view/4412651880 , ,li-4412651880,fulltime,,,,,,False,associate,Project Management and Information Technology,,,Software Development,https://de.linkedin.com/company/shyftplan,,,,,,,,,,,
linkedin,Construction Manager,Mercury,"Frankfurt, Hesse, Germany",2026-05-11,https://www.linkedin.com/jobs/view/4403305129 , ,li-4403305129,fulltime,,,,,,False,mid-senior level,Management and Manufacturing,,,Construction,https://ie.linkedin.com/company/mercury-engineering,,,,,,,,,,,
linkedin,Senior Product Manager - Engagement (all genders),JustPlay,"Berlin, Berlin, Germany",2026-05-11,https://www.linkedin.com/jobs/view/4412900039 , ,li-4412900039,fulltime,,,,,,False,mid-senior level,Product Management and Marketing,,,Entertainment Providers,https://de.linkedin.com/company/justplay-gmbh,,,,,,,,,,,
linkedin,Product Manager,Spectrum IT Recruitment,"Berlin, Germany",2026-05-11,https://www.linkedin.com/jobs/view/4412687244 , ,li-4412687244,fulltime,,,,,,False,mid-senior level,Product Management,,,IT Services and IT Consulting and IT System Custom Software Development,https://uk.linkedin.com/company/spectrum-it-recruitment,,,,,,,,,,,
