site,title,company,location,date_posted,job_url,job_url_direct,id,job_type,salary_source,interval,min_amount,max_amount,currency,is_remote,job_level,job_function,listing_type,emails,company_industry,company_url,company_url_direct,company_addresses,company_num_employees,company_revenue,company_description,skills,experience_range,company_rating,company_reviews_count,vacancy_count,work_from_home_type
linkedin,Technischer Projektleiter Maschinen,Rügenwalder Mühle Carl Müller GmbH & Co. KG,"Goldenstedt, Lower Saxony, Germany",2026-04-14,https://www.linkedin.com/jobs/view/4402010107 , ,li-4402010107,fulltime,,,,,,False,mid-senior level,Project Management and Information Technology,,,Food and Beverage Manufacturing,https://de.linkedin.com/company/r%C3%BCgenwalder-m%C3%BChle,,,,,,,,,,,
linkedin,Project Manager (m/f/d) - Fulltime/ Freelance,TAMSCHICK MEDIA+SPACE,"Berlin, Berlin, Germany",2026-04-14,https://www.linkedin.com/jobs/view/4399751532 , ,li-4399751532,contract,,,,,,False,director,Management,,,"Technology, Information and Media",https://de.linkedin.com/company/tamschick-media-space,,,,,,,,,,,
linkedin,Projektmanager M&A (m/w/d),VentureLink,"Frankfurt, Hesse, Germany",2026-04-14,https://www.linkedin.com/jobs/view/4401711419 , ,li-4401711419,fulltime,,,,,,False,entry level,Consulting,,,Investment Banking and Insurance,https://de.linkedin.com/company/venturelink-partners,,,,,,,,,,,
linkedin,Project Manager (m/w/d) Logistik,Diehl Aviation,"Laupheim, Baden-Württemberg, Germany",2026-04-14,https://www.linkedin.com/jobs/view/4398146010 , ,li-4398146010,fulltime,,,,,,False,mid-senior level,Project Management and Information Technology,,,"Appliances, Electrical, and Electronics Manufacturing",https://de.linkedin.com/company/diehl-aviation,,,,,,,,,,,
linkedin,Projektleiter (m/w/d) Planung Schienenverkehrsanlagen,KB,"Stuttgart, Baden-Württemberg, Germany",2026-04-14,https://www.linkedin.com/jobs/view/4399728596 , ,li-4399728596,fulltime,,,,,,False,mid-senior level,Engineering,,,Industrial Machinery Manufacturing,https://de.linkedin.com/company/konstruktionsgruppe-bauen-ag,,,,,,,,,,,
linkedin,(Senior) Customer Success Manager/ Project Manager (m/w/d),Aufinity Group | bezahl.de,"Cologne, North Rhine-Westphalia, Germany",2026-04-14,https://www.linkedin.com/jobs/view/4379970894 , ,li-4379970894,fulltime,,,,,,True,mid-senior level,Other,,,Financial Services,https://de.linkedin.com/company/aufinitygroup,,,,,,,,,,,
linkedin,Projektkoordinator (m/w/d),Soennecken eG,"Overath, North Rhine-Westphalia, Germany",2026-04-14,https://www.linkedin.com/jobs/view/4402068762 , ,li-4402068762,fulltime,,,,,,False,mid-senior level,Product Management,,,Wholesale,https://de.linkedin.com/company/soennecken-eg,,,,,,,,,,,
linkedin,Projektleitung Elektrotechnik (m/w/d),FREYLER Unternehmensgruppe,"Kenzingen, Baden-Württemberg, Germany",2026-04-14,https://www.linkedin.com/jobs/view/4402015278 , ,li-4402015278,fulltime,,,,,,False,mid-senior level,Project Management and Information Technology,,,Internet Publishing,https://de.linkedin.com/company/freyler-unternehmensgruppe,,,,,,,,,,,
linkedin,Projektleiter (m/w/d) Planung Schienenverkehrsanlagen,KB,"Frankfurt, Hesse, Germany",2026-04-14,https://www.linkedin.com/jobs/view/4399730610 , ,li-4399730610,fulltime,,,,,,False,mid-senior level,Engineering,,,Industrial Machinery Manufacturing,https://de.linkedin.com/company/konstruktionsgruppe-bauen-ag,,,,,,,,,,,
linkedin,Projektleiter (m/w/d) Planung Schienenverkehrsanlagen,KB,"Munich, Bavaria, Germany",2026-04-14,https://www.linkedin.com/jobs/view/4399737531 , ,li-4399737531,fulltime,,,,,,False,mid-senior level,Engineering,,,Industrial Machinery Manufacturing,https://de.linkedin.com/company/konstruktionsgruppe-bauen-ag,,,,,,,,,,,
linkedin,Projektleiter (m/w/d) Planung Schienenverkehrsanlagen,KB,"Neuses, Bavaria, Germany",2026-04-14,https://www.linkedin.com/jobs/view/4399732592 , ,li-4399732592,fulltime,,,,,,False,mid-senior level,Engineering,,,Industrial Machinery Manufacturing,https://de.linkedin.com/company/konstruktionsgruppe-bauen-ag,,,,,,,,,,,
linkedin,Projektleiter (m/w/d) Planung Schienenverkehrsanlagen,KB,"Kempten, Bavaria, Germany",2026-04-14,https://www.linkedin.com/jobs/view/4399727584 , ,li-4399727584,fulltime,,,,,,False,mid-senior level,Engineering,,,Industrial Machinery Manufacturing,https://de.linkedin.com/company/konstruktionsgruppe-bauen-ag,,,,,,,,,,,
linkedin,Project Manager (f/m/d) for EU project,MAX BORN INSTITUTE for Nonlinear Optics and Short Pulse Spectroscopy,"Berlin, Berlin, Germany",2026-04-14,https://www.linkedin.com/jobs/view/4401714887 , ,li-4401714887,internship,,,,,,False,mid-senior level,Project Management and Information Technology,,,Research Services,https://de.linkedin.com/company/max-born-institute-berlin,,,,,,,,,,,
linkedin,Senior Project Manager End-to-End Governance (m/w/d),Unsere Grüne Glasfaser,,2026-04-14,https://www.linkedin.com/jobs/view/4400759318 , ,li-4400759318,fulltime,,,,,,True,mid-senior level,Project Management,,recruiting@ugg.tech,Telecommunications,https://de.linkedin.com/company/unsere-gr-ne-glasfaser,,,,,,,,,,,
linkedin,Project Manager (m/f/d) Technology & Strategy,Deutsche Telekom,"Bonn, North Rhine-Westphalia, Germany",2026-04-14,https://www.linkedin.com/jobs/view/4389486564 , ,li-4389486564,parttime,,,,,,False,mid-senior level,Project Management and Information Technology,,,Telecommunications,https://de.linkedin.com/company/telekom,,,,,,,,,,,
linkedin,"B2B Marketing Manager Assistant, DACH Region - 24 month Apprenticeship (Young Professionals Program)",Logitech,"Munich, Bavaria, Germany",2026-04-14,https://www.linkedin.com/jobs/view/4401732001 , ,li-4401732001,parttime,,,,,,True,internship,Administrative,,,Computers and Electronics Manufacturing,https://www.linkedin.com/company/logitech,,,,,,,,,,,
linkedin,Commercial Project Manager (f/m/d),Siemens,"Berlin, Berlin, Germany",2026-04-14,https://www.linkedin.com/jobs/view/4400793357 , ,li-4400793357,fulltime,,,,,,False,mid-senior level,Project Management,,,Automation Machinery Manufacturing,https://de.linkedin.com/company/siemens,,,,,,,,,,,
linkedin,Regulatory Compliance - Project Management,Roche,"Penzberg, Bavaria, Germany",2026-04-14,https://www.linkedin.com/jobs/view/4401790694 , ,li-4401790694,fulltime,,,,,,False,associate,Quality Assurance and Consulting,,,"Pharmaceutical Manufacturing, Biotechnology Research, and Medical Equipment Manufacturing",https://ch.linkedin.com/company/roche,,,,,,,,,,,
linkedin,Projektleiter Arbeitsvorbereitung & Projektmanagement (m/w/d),E & F Metall- und Rohrleitungsbau GmbH,"Föhren, Rhineland-Palatinate, Germany",2026-04-14,https://www.linkedin.com/jobs/view/4399756119 , ,li-4399756119,fulltime,,,,,,False,mid-senior level,"Design, Art/Creative, and Information Technology",,,Fabricated Metal Products,https://de.linkedin.com/company/e-f-metall-und-rohrleitungsbau-gmbh,,,,,,,,,,,
linkedin,Servicetechniker im Innendienst als Technischer Projektleiter - Industrietore (m/w/d),Unitor Torsysteme GmbH,"Rorichmoor, Lower Saxony, Germany",2026-04-14,https://www.linkedin.com/jobs/view/4401726993 , ,li-4401726993,fulltime,,,,,,False,entry level,Engineering,,andre.mueller@unitor.de,Industrial Machinery Manufacturing,https://de.linkedin.com/company/unitor-torsysteme-gmbh,,,,,,,,,,,
linkedin,Senior Technical Project Manager - Core Infrastructure,Jobgether,,2026-04-14,https://www.linkedin.com/jobs/view/4400705523 , ,li-4400705523,fulltime,,,,,,True,mid-senior level,Project Management and Information Technology,,,Internet Marketplace Platforms,https://be.linkedin.com/company/jobgether,,,,,,,,,,,
linkedin,Technical Project Development Manager (m/w/d) e-fuels & PtX,INERATEC,"Frankfurt, Hesse, Germany",2026-04-14,https://www.linkedin.com/jobs/view/4385121570 , ,li-4385121570,fulltime,,,,,,False,mid-senior level,Project Management and Information Technology,,,Renewable Energy Semiconductor Manufacturing,https://de.linkedin.com/company/ineratec,,,,,,,,,,,
linkedin,"Microsoft Dynamics 365 Project Manager (Contract) – Germany, Munich",DevologyX,,2026-04-13,https://www.linkedin.com/jobs/view/4401078482 , ,li-4401078482,fulltime,,,,,,True,mid-senior level,Information Technology,,,Staffing and Recruiting,https://ee.linkedin.com/company/devologyx,,,,,,,,,,,
linkedin,Technical Project Manager,WHITEvoid,"Berlin, Germany",2026-04-13,https://www.linkedin.com/jobs/view/4401323271 , ,li-4401323271,fulltime,,,,,,False,mid-senior level,Project Management and Strategy/Planning,,jobs@whitevoid.com,"Events Services and Technology, Information and Media",https://de.linkedin.com/company/whitevoid,,,,,,,,,,,
linkedin,Clinical Research Coordinator,Parexel,"Berlin, Berlin, Germany",2026-04-13,https://www.linkedin.com/jobs/view/4399679039 , ,li-4399679039,fulltime,,,,,,False,mid-senior level,"Research, Analyst, and Information Technology",,,"Pharmaceutical Manufacturing, Biotechnology Research, and Hospitals and Health Care",https://www.linkedin.com/company/parexel,,,,,,,,,,,
linkedin,Backoffice (w/m/d),PERBILITY GmbH,"Bamberg, Bavaria, Germany",2026-04-13,https://www.linkedin.com/jobs/view/4399628564 , ,li-4399628564,fulltime,,,,,,False,mid-senior level,Administrative,,,Software Development,https://de.linkedin.com/company/perbility-gmbh,,,,,,,,,,,
linkedin,Junior Projektmanager (w/m/d) Hochbau,Drees & Sommer,"Cologne, North Rhine-Westphalia, Germany",2026-04-13,https://www.linkedin.com/jobs/view/4399548088 , ,li-4399548088,fulltime,,,,,,False,associate,Engineering and Project Management,,,Real Estate,https://de.linkedin.com/company/drees-&-sommer,,,,,,,,,,,
linkedin,SAP RISE Project Manager,DSR Global,"Baden-Württemberg, Germany",2026-04-13,https://www.linkedin.com/jobs/view/4399514715 , ,li-4399514715,contract,,,,,,True,mid-senior level,Information Technology and Project Management,,,Pharmaceutical Manufacturing and IT Services and IT Consulting,https://uk.linkedin.com/company/dsr-global,,,,,,,,,,,
linkedin,ProjektmanagerIn (m/w/d)*,SCHOTT,"Jena, Thuringia, Germany",2026-04-13,https://www.linkedin.com/jobs/view/4399144700 , ,li-4399144700,fulltime,,,,,,False,entry level,Consulting and Strategy/Planning,,,"Glass, Ceramics and Concrete Manufacturing",https://de.linkedin.com/company/schott,,,,,,,,,,,
linkedin,Projektkoordination Umsetzung Digitalstrategie,Engagement Global gGmbH,"Bonn, North Rhine-Westphalia, Germany",2026-04-13,https://www.linkedin.com/jobs/view/4401078435 , ,li-4401078435,fulltime,,,,,,False,mid-senior level,Project Management and Information Technology,,,Internet Publishing,https://de.linkedin.com/company/engagement-global,,,,,,,,,,,
linkedin,V.I.E. Project Contract Manager (m/f),Alstom,,2026-04-13,https://www.linkedin.com/jobs/view/4397027649 , ,li-4397027649,contract,,,,,,False,entry level,Legal,,,Truck Transportation and Railroad Equipment Manufacturing,https://fr.linkedin.com/company/alstom,,,,,,,,,,,
linkedin,"Ingenieur im Projektmanagement, all genders",SALT AND PEPPER Group,"Bremen, Bremen, Germany",2026-04-13,https://www.linkedin.com/jobs/view/4206850312 , ,li-4206850312,fulltime,,,,,,False,entry level,Engineering and Information Technology,,,Engineering Services,https://de.linkedin.com/company/salt-and-pepper,,,,,,,,,,,
linkedin,Agency Operations Manager,WEBNIQUE GmbH,,2026-04-13,https://www.linkedin.com/jobs/view/4398892906 , ,li-4398892906,fulltime,,,,,,False,mid-senior level,Management and Manufacturing,,,Advertising Services,https://de.linkedin.com/company/webnique,,,,,,,,,,,
linkedin,Project Lead / Project Manager (m/f/d) – Fixed-term (24 months) via temporary employment,Rohde & Schwarz,"Kiel, Schleswig-Holstein, Germany",2026-04-13,https://www.linkedin.com/jobs/view/4399131040 , ,li-4399131040,fulltime,,,,,,False,not applicable,Project Management and Information Technology,,,Telecommunications,https://de.linkedin.com/company/rohde-schwarz,,,,,,,,,,,
linkedin,Junior Project Manager Visual Merchandising (m/f/d) (Part-time),HUGO BOSS,"Metzingen, Baden-Württemberg, Germany",2026-04-13,https://www.linkedin.com/jobs/view/4401326025 , ,li-4401326025,parttime,,,,,,True,entry level,Marketing and Sales,,,Retail Apparel and Fashion,https://de.linkedin.com/company/hugo-boss,,,,,,,,,,,
linkedin,Operations Manager Project Logistics (m/w/d),M.G. International Group,"Siegen, North Rhine-Westphalia, Germany",2026-04-13,https://www.linkedin.com/jobs/view/4399506910 , ,li-4399506910,fulltime,,,,,,False,associate,Purchasing,,,Administrative and Support Services,https://de.linkedin.com/company/mgint,,,,,,,,,,,
linkedin,Program Manager (all genders),envelio,"Cologne, North Rhine-Westphalia, Germany",2026-04-13,https://www.linkedin.com/jobs/view/4399547588 , ,li-4399547588,fulltime,,,,,,True,mid-senior level,Customer Service,,,Software Development,https://de.linkedin.com/company/envelio,,,,,,,,,,,
linkedin,Technical Project Manager – Defence Communication Systems (all gender),ALTEN Germany,"Hannover, Lower Saxony, Germany",2026-04-13,https://www.linkedin.com/jobs/view/4399529642 , ,li-4399529642,fulltime,,,,,,False,associate,"Project Management, Engineering, and Information Technology",,,"IT Services and IT Consulting, Engineering Services, and Defense and Space Manufacturing",https://de.linkedin.com/company/altengermany,,,,,,,,,,,
linkedin,"Principal, Process Excellence & Global Implementation",Delivery Hero,"Berlin, Berlin, Germany",2026-04-13,https://www.linkedin.com/jobs/view/4399153748 , ,li-4399153748,fulltime,,,,,,False,mid-senior level,Strategy/Planning,,inclusion@deliveryhero.com,Software Development and IT Services and IT Consulting,https://de.linkedin.com/company/delivery-hero-se,,,,,,,,,,,
linkedin,Project Lead / Project Manager – Software Development (all gender),ALTEN Germany,"Kiel, Schleswig-Holstein, Germany",2026-04-13,https://www.linkedin.com/jobs/view/4399538036 , ,li-4399538036,fulltime,,,,,,False,associate,Information Technology and Project Management,,,IT Services and IT Consulting and Engineering Services,https://de.linkedin.com/company/altengermany,,,,,,,,,,,
linkedin,Senior Project Manager Digital (m/w/d),elbkapitäne,"Hamburg, Germany",2026-04-13,https://www.linkedin.com/jobs/view/4401302107 , ,li-4401302107,fulltime,,,,,,False,associate,Project Management and Information Technology,,,"Technology, Information and Internet",https://de.linkedin.com/company/elbkapitaene,,,,,,,,,,,
linkedin,Junior Project Manager (all genders),LIGANOVA,"Stuttgart, Baden-Württemberg, Germany",2026-04-13,https://www.linkedin.com/jobs/view/4399537109 , ,li-4399537109,fulltime,,,,,,False,entry level,Marketing,,,Advertising Services,https://de.linkedin.com/company/liganova-stuttgart,,,,,,,,,,,
linkedin,Junior Project Manager (all genders),LIGANOVA HORIZON,"Stuttgart, Baden-Württemberg, Germany",2026-04-13,https://www.linkedin.com/jobs/view/4399516977 , ,li-4399516977,fulltime,,,,,,False,entry level,Marketing,,,Software Development,https://de.linkedin.com/company/liganovahorizon,,,,,,,,,,,
linkedin,Projektmanager/in Schaltanlagenbau,Sécheron SA,"Frankfurt, Hesse, Germany",2026-04-13,https://www.linkedin.com/jobs/view/4399189530 , ,li-4399189530,fulltime,,,,,,False,entry level,Project Management,,,IT Services and IT Consulting,https://ch.linkedin.com/company/secheron-sa,,,,,,,,,,,
linkedin,Senior Project Manager,Darwin Recruitment,"Berlin, Berlin, Germany",2026-04-13,https://www.linkedin.com/jobs/view/4399145641 , ,li-4399145641,fulltime,,,,,,False,mid-senior level,Project Management,,,Services for Renewable Energy,https://uk.linkedin.com/company/darwin-recruitment-3,,,,,,,,,,,
linkedin,Junior Project Manager R&D / PMO - Defence (all gender),ALTEN Germany,"Berlin, Germany",2026-04-13,https://www.linkedin.com/jobs/view/4399544020 , ,li-4399544020,fulltime,,,,,,False,entry level,Project Management and Engineering,,,IT Services and IT Consulting and Engineering Services,https://de.linkedin.com/company/altengermany,,,,,,,,,,,
linkedin,Project Director - Industrial Buildings,Linum Consult,"Hesse, Germany",2026-04-13,https://www.linkedin.com/jobs/view/4401098983 , ,li-4401098983,fulltime,,,,,,False,director,Engineering and Project Management,,europe@linumconsult.com,Building Construction and Construction,https://uk.linkedin.com/company/linum-consult,,,,,,,,,,,
linkedin,Project Manager / Content Manager,Jobgether,,2026-04-13,https://www.linkedin.com/jobs/view/4399638761 , ,li-4399638761,fulltime,,,,,,True,mid-senior level,Project Management and Information Technology,,,Internet Marketplace Platforms,https://be.linkedin.com/company/jobgether,,,,,,,,,,,
linkedin,Senior SAP Project Training Coordinator with German,Fusion Consulting,"Düsseldorf, North Rhine-Westphalia, Germany",2026-04-13,https://www.linkedin.com/jobs/view/4389022443 , ,li-4389022443,fulltime,,,,,,False,mid-senior level,Consulting,,,Pharmaceutical Manufacturing,https://ch.linkedin.com/company/fusionconsultingag,,,,,,,,,,,
linkedin,Technischer Planer / Projektkoordinator Klimatechnik (m/w/d),Eneto GmbH,,2026-04-13,https://www.linkedin.com/jobs/view/4399557319 , ,li-4399557319,fulltime,,,,,,True,entry level,Engineering,,,Manufacturing,https://de.linkedin.com/company/eneto-gmbh,,,,,,,,,,,
linkedin,Head of Marketing (m/w/d),Bridgemaker,"Stuttgart, Baden-Württemberg, Germany",2026-04-13,https://www.linkedin.com/jobs/view/4399545102 , ,li-4399545102,fulltime,,,,,,False,associate,Marketing,,,Professional Services,https://de.linkedin.com/company/bridgemaker-gmbh,,,,,,,,,,,
linkedin,Senior Project Manager,EvoFutures,"Stuttgart, Baden-Württemberg, Germany",2026-04-13,https://www.linkedin.com/jobs/view/4401052287 , ,li-4401052287,fulltime,,,,,,False,mid-senior level,"Project Management, Engineering, and Consulting",,,"Real Estate, Architecture and Planning, and Construction",https://uk.linkedin.com/company/evofutures,,,,,,,,,,,
linkedin,Digital Marketing Manager/Performance-Spezialist (m/w/d),Martin Meier AG,"Eichstätt, Bavaria, Germany",2026-04-13,https://www.linkedin.com/jobs/view/4399561062 , ,li-4399561062,fulltime,,,,,,False,mid-senior level,Marketing and Sales,,,Construction,https://de.linkedin.com/company/martin-meier-eichstaett,,,,,,,,,,,
linkedin,Team Lead,EvoFutures,"Berlin, Germany",2026-04-13,https://www.linkedin.com/jobs/view/4401045476 , ,li-4401045476,fulltime,,,,,,False,mid-senior level,"Engineering, Design, and Management",,,"Hospitals and Health Care, Architecture and Planning, and Construction",https://uk.linkedin.com/company/evofutures,,,,,,,,,,,
linkedin,Technical Project Manager,WHITEvoid,"Berlin, Berlin, Germany",2026-04-13,https://www.linkedin.com/jobs/view/4399546880 , ,li-4399546880,fulltime,,,,,,False,director,Other,,,Performing Arts,https://de.linkedin.com/company/whitevoid,,,,,,,,,,,
linkedin,Senior Project Leader Equipment Technology,Teradyne,"Regensburg, Bavaria, Germany",2026-04-13,https://www.linkedin.com/jobs/view/4377724355 , ,li-4377724355,fulltime,,,,,,False,mid-senior level,Engineering,,,Semiconductor Manufacturing,https://www.linkedin.com/company/teradyne,,,,,,,,,,,
linkedin,Technischer Projektmanager (m/w/d) im Bereich Schokoladenherstellung,Ludwig Schokolade GmbH & Co. KG,"Saarlouis, Saarland, Germany",2026-04-13,https://www.linkedin.com/jobs/view/4399138720 , ,li-4399138720,fulltime,,,,,,False,mid-senior level,Project Management and Information Technology,,,Sugar and Confectionery Product Manufacturing,https://www.linkedin.com/company/ludwig-schokolade-gmbh-&-co-kg,,,,,,,,,,,
linkedin,Technischer Projektmanager/Leiter Technik (m/w/d),ADM,"Nauen, Brandenburg, Germany",2026-04-13,https://www.linkedin.com/jobs/view/4389056845 , ,li-4389056845,fulltime,,,,,,False,not applicable,Project Management and Information Technology,,,Food and Beverage Manufacturing,https://www.linkedin.com/company/adm,,,,,,,,,,,
linkedin,Technischer Projektmanager Software (m/w/d),Rheinmetall,"Bremen, Bremen, Germany",2026-04-13,https://www.linkedin.com/jobs/view/4399557567 , ,li-4399557567,fulltime,,,,,,False,mid-senior level,Project Management and Information Technology,,,Defense and Space Manufacturing,https://de.linkedin.com/company/rheinmetall,,,,,,,,,,,
linkedin,Senior Projektmanager (gn),Falling Walls Foundation,"Berlin, Berlin, Germany",2026-04-13,https://www.linkedin.com/jobs/view/4399397812 , ,li-4399397812,fulltime,,,,,,False,mid-senior level,Project Management,,,Software Development,https://de.linkedin.com/company/falling-walls-foundation,,,,,,,,,,,
linkedin,Product Management Evangelist (all genders) - Bretten,SEEBURGER,"Bretten, Baden-Württemberg, Germany",2026-04-13,https://www.linkedin.com/jobs/view/4399533486 , ,li-4399533486,fulltime,,,,,,True,mid-senior level,"General Business, Management, and Business Development",,recruiting@seeburger.com,Software Development,https://de.linkedin.com/company/seeburger,,,,,,,,,,,
linkedin,(Senior) Salesforce Product Manager (f/m/x),Enpal,"Berlin, Berlin, Germany",2026-04-13,https://www.linkedin.com/jobs/view/4401346306 , ,li-4401346306,fulltime,,,,,,False,mid-senior level,Product Management and Marketing,,,Energy Technology,https://de.linkedin.com/company/enpal,,,,,,,,,,,
linkedin,Product Manager (m/w/d),SLV GmbH,"Übach-Palenberg, North Rhine-Westphalia, Germany",2026-04-13,https://www.linkedin.com/jobs/view/4401358197 , ,li-4401358197,fulltime,,,,,,False,mid-senior level,Product Management and Marketing,,,Internet Publishing,https://de.linkedin.com/company/slv-elektronik-gmbh,,,,,,,,,,,
linkedin,Product Manager - KYC/KYB,Qonto,"Berlin, Berlin, Germany",2026-04-13,https://www.linkedin.com/jobs/view/4401342877 , ,li-4401342877,fulltime,,,,,,False,mid-senior level,Product Management and Marketing,,support@qonto.com,Financial Services,https://fr.linkedin.com/company/qonto,,,,,,,,,,,
linkedin,Technischer Projektleiter für optische Systeme (m/w/d),Rheinmetall,"Ismaning, Bavaria, Germany",2026-04-13,https://www.linkedin.com/jobs/view/4399558540 , ,li-4399558540,fulltime,,,,,,False,mid-senior level,Project Management and Information Technology,,,Defense and Space Manufacturing,https://de.linkedin.com/company/rheinmetall,,,,,,,,,,,
linkedin,Product Manager VERTANICAL - Fokus Produktlaunch,VERTANICAL,"Munich, Bavaria, Germany",2026-04-13,https://www.linkedin.com/jobs/view/4373139276 , ,li-4373139276,fulltime,,,,,,False,associate,Product Management and Marketing,,,Biotechnology Research and Pharmaceutical Manufacturing,https://de.linkedin.com/company/vertanical-gmbh,,,,,,,,,,,
linkedin,Senior Customer Success Manager,Nintex,,2026-04-13,https://www.linkedin.com/jobs/view/4401098542 , ,li-4401098542,fulltime,,,,,,True,mid-senior level,Other,,,Software Development,https://www.linkedin.com/company/nintex,,,,,,,,,,,
linkedin,Team Lead Project Management (m/w/x),Doctorflix,"Berlin, Berlin, Germany",2026-04-13,https://www.linkedin.com/jobs/view/4399507437 , ,li-4399507437,fulltime,,,,,,False,mid-senior level,Project Management,,,Software Development,https://de.linkedin.com/company/doctorflix,,,,,,,,,,,
linkedin,Project Manager (m/w/d),shyftplan,"Berlin, Germany",2026-04-13,https://www.linkedin.com/jobs/view/4374295464 , ,li-4374295464,fulltime,,,,,,False,mid-senior level,Consulting,,,IT Services and IT Consulting and Business Consulting and Services,https://de.linkedin.com/company/shyftplan,,,,,,,,,,,
linkedin,Team Lead SAP Financials (m/w/d) (Ref:P7ENG),RSight®,,2026-04-13,https://www.linkedin.com/jobs/view/4381471040 , ,li-4381471040,fulltime,,,,,,False,mid-senior level,Finance,,,Professional Services,https://fr.linkedin.com/company/rsight,,,,,,,,,,,
linkedin,Distribution & Automation Engineering - Project Manager,Cencora,"Berlin, Berlin, Germany",2026-04-13,https://www.linkedin.com/jobs/view/4392653639 , ,li-4392653639,fulltime,,,,,,False,mid-senior level,Project Management and Information Technology,,hrsc@cencora.com,Hospitals and Health Care,https://www.linkedin.com/company/cencoraglobal,,,,,,,,,,,
linkedin,"Project Director / Senior Projektleiter (w/m/d) EPCM Industry – Semiconductors, Life Science und Data Center Hyperscaler-Projekte",Drees & Sommer,"Dresden, Saxony, Germany",2026-04-13,https://www.linkedin.com/jobs/view/4399548098 , ,li-4399548098,fulltime,,,,,,False,mid-senior level,Project Management,,,Real Estate,https://de.linkedin.com/company/drees-&-sommer,,,,,,,,,,,
linkedin,"Team Lead, Engineering",Deel,,2026-04-13,https://www.linkedin.com/jobs/view/4399696212 , ,li-4399696212,fulltime,,,,,,True,mid-senior level,Engineering and Information Technology,,recruiting@deel.com,Human Resources Services,https://www.linkedin.com/company/deel,,,,,,,,,,,
linkedin,Senior Manager Project Finance,Blue Elephant Energy GmbH,"Hamburg, Germany",2026-04-13,https://www.linkedin.com/jobs/view/4399510640 , ,li-4399510640,fulltime,,,,,,False,associate,Finance,,,Renewable Energy Semiconductor Manufacturing,https://de.linkedin.com/company/blue-elephant-energy,,,,,,,,,,,
linkedin,Customer Project Manager (w/m/d) PCBA,TRUMPF,"Freiburg, Baden-Württemberg, Germany",2026-04-13,https://www.linkedin.com/jobs/view/4399677116 , ,li-4399677116,fulltime,,,,,,False,entry level,Project Management and Information Technology,,david.brodkorb.external@trumpf.com,Machinery Manufacturing,https://www.linkedin.com/company/trumpf-se-co-kg,,,,,,,,,,,
linkedin,Manager Regulatory Affairs - Submission Lead*,Immatics,,2026-04-13,https://www.linkedin.com/jobs/view/4401304996 , ,li-4401304996,temporary,,,,,,True,associate,Other,,,Biotechnology Research,https://de.linkedin.com/company/immatics,,,,,,,,,,,
linkedin,"Professional Services Manager, DACH",Axon,"Frankfurt, Hesse, Germany",2026-04-12,https://www.linkedin.com/jobs/view/4308417066 , ,li-4308417066,fulltime,,,,,,True,mid-senior level,Project Management and Information Technology,,"axongreenhousesupport@axon.com, recruitingops@axon.com, recruitingops@axon.com",Software Development,https://www.linkedin.com/company/axon-protect-life,,,,,,,,,,,
