site,title,company,location,date_posted,job_url,job_url_direct,id,job_type,salary_source,interval,min_amount,max_amount,currency,is_remote,job_level,job_function,listing_type,emails,company_industry,company_url,company_url_direct,company_addresses,company_num_employees,company_revenue,company_description,skills,experience_range,company_rating,company_reviews_count,vacancy_count,work_from_home_type
linkedin,Wissenschaftliche Mitarbeiter (m/w/d) alle Fachbereiche,Oppenhoff,"Cologne, North Rhine-Westphalia, Germany",2026-04-22,https://www.linkedin.com/jobs/view/4405208037 , ,li-4405208037,internship,,,,,,False,internship,Legal,,,Law Practice,https://de.linkedin.com/company/oppenhoff,,,,,,,,,,,
linkedin,"Staff Data Analyst, Marketing Analytics",GetYourGuide,"Berlin, Berlin, Germany",2026-04-22,https://www.linkedin.com/jobs/view/4383364447 , ,li-4383364447,fulltime,,,,,,False,associate,Information Technology and Engineering,,jobs@getyourguide.com,"Technology, Information and Internet and Travel Arrangements",https://de.linkedin.com/company/getyourguide-ag,,,,,,,,,,,
linkedin,Wissenschaftliche/r Mitarbeiter/in (m/w/d)  - Institut für Pädagogische Psychologie,Universität Rostock,"Rostock, Mecklenburg-West Pomerania, Germany",2026-04-22,https://www.linkedin.com/jobs/view/4404944381 , ,li-4404944381,fulltime,,,,,,False,entry level,"Research, Analyst, and Information Technology",,,Internet Publishing,https://de.linkedin.com/school/university-of-rostock/,,,,,,,,,,,
linkedin,Wissenschaftliche*r Mitarbeiter*in mit der Option zur Erstellung einer Doktorarbeit (m/w/d),Leibniz Association,,2026-04-22,https://www.linkedin.com/jobs/view/4405254824 , ,li-4405254824,fulltime,,,,,,False,entry level,"Research, Analyst, and Information Technology",,,Research,https://de.linkedin.com/company/leibniz-gemeinschaft,,,,,,,,,,,
linkedin,Casual Academic Talent Pool - Business - ISTM,UNSW,"Frankfurt, Hesse, Germany",2026-04-22,https://www.linkedin.com/jobs/view/4396161665 , ,li-4396161665,temporary,,,,,,False,entry level,Education and Training,,,Higher Education and Research Services,https://au.linkedin.com/school/unsw/,,,,,,,,,,,
linkedin,Casual Academic Talent Pool - Business - ISTM,UNSW,"Berlin, Berlin, Germany",2026-04-22,https://www.linkedin.com/jobs/view/4396173149 , ,li-4396173149,temporary,,,,,,False,entry level,Education and Training,,,Higher Education and Research Services,https://au.linkedin.com/school/unsw/,,,,,,,,,,,
linkedin,Praktikanten (m/w/d) und wissenschaftliche Hilfskräfte (m/w/d) im Bereich Smart Grid / Smarte Quartiere und Photovoltaik,Zentrum für Sonnenenergie- und Wasserstoff-Forschung Baden-Württemberg (ZSW),"Stuttgart, Baden-Württemberg, Germany",2026-04-22,https://www.linkedin.com/jobs/view/4404263851 , ,li-4404263851,fulltime,,,,,,False,internship,Other,,,Research Services,https://de.linkedin.com/company/zsw-bw,,,,,,,,,,,
linkedin,Trainee,GoAcademy! Sprachschule - International House Düsseldorf,"Düsseldorf, North Rhine-Westphalia, Germany",2026-04-22,https://www.linkedin.com/jobs/view/4402452005 , ,li-4402452005,fulltime,,,,,,False,internship,Consulting,,,Education Administration Programs,https://www.linkedin.com/company/goacademy-gmbh,,,,,,,,,,,
linkedin,Wissenschaftliche/r Mitarbeiter/in (1. StEx) - 1550€ / Wochenarbeitstag,Takjas,"Berlin, Berlin, Germany",2026-04-22,https://www.linkedin.com/jobs/view/4402467093 , ,li-4402467093,fulltime,,,,,,True,entry level,Information Technology,,,Legal Services,https://de.linkedin.com/company/takjas-rechtsanwaltsgesellschaft-mbh,,,,,,,,,,,
linkedin,"wissenschaftliche*n Mitarbeiter*in (m/w/d) im Projekt ""Escape the fake""",Ostfalia - University of Applied Sciences,"Salzgitter, Lower Saxony, Germany",2026-04-22,https://www.linkedin.com/jobs/view/4404934757 , ,li-4404934757,fulltime,,,,,,False,entry level,"Research, Analyst, and Information Technology",,,Internet Publishing,https://de.linkedin.com/school/ostfalia---university-of-applied-sciences/,,,,,,,,,,,
linkedin,Consultant (German Speaking),Visa,"Frankfurt, Hesse, Germany",2026-04-22,https://www.linkedin.com/jobs/view/4390159552 , ,li-4390159552,fulltime,,,,,,True,associate,"Consulting, Information Technology, and Sales",,,IT Services and IT Consulting,https://www.linkedin.com/company/visa,,,,,,,,,,,
linkedin,Analyst Prozesse & Daten (m/w/d),Westnetz,"Dortmund, North Rhine-Westphalia, Germany",2026-04-22,https://www.linkedin.com/jobs/view/4402428258 , ,li-4402428258,fulltime,,,,,,False,entry level,Information Technology,,tanja.flasspoehler@westnetz.de,Utilities,https://de.linkedin.com/company/westnetz,,,,,,,,,,,
linkedin,Postdoctoral Researcher – AI-based Multi-Omics in Computational Biomedicine (m/f/d),Universitätsklinikum Erlangen,"Erlangen, Bavaria, Germany",2026-04-22,https://www.linkedin.com/jobs/view/4404250347 , ,li-4404250347,fulltime,,,,,,False,internship,"Research, Analyst, and Information Technology",,,Hospitals and Health Care,https://de.linkedin.com/company/universitatsklinikumerlangen,,,,,,,,,,,
linkedin,Study Nurse / Studienassistent (m/w/d),Segeberger Kliniken Gruppe,"Bad Segeberg, Schleswig-Holstein, Germany",2026-04-22,https://www.linkedin.com/jobs/view/4404945047 , ,li-4404945047,fulltime,,,,,,False,entry level,Health Care Provider,,,Hospitals and Health Care,https://de.linkedin.com/company/segeberger-kliniken-gruppe,,,,,,,,,,,
linkedin,"Senior Data Scientist - (Query Intelligence, Global Discovery)",Delivery Hero,"Berlin, Berlin, Germany",2026-04-22,https://www.linkedin.com/jobs/view/4397230235 , ,li-4397230235,fulltime,,,,,,False,mid-senior level,Information Technology,,inclusion@deliveryhero.com,Software Development and IT Services and IT Consulting,https://de.linkedin.com/company/delivery-hero-se,,,,,,,,,,,
linkedin,Wissenschaftliche Mitarbeit (m/w/d) M&A,Gleiss Lutz,"Berlin, Berlin, Germany",2026-04-22,https://www.linkedin.com/jobs/view/4404965771 , ,li-4404965771,fulltime,,,,,,False,entry level,"Research, Analyst, and Information Technology",,katrin.woidacki@gleisslutz.com,Law Practice,https://de.linkedin.com/company/gleiss-lutz,,,,,,,,,,,
linkedin,wissenschaftliche*n Mitarbeiter*in (m/w/d) für mikrobiologisches Wassermonitoring,Ostfalia - University of Applied Sciences,"Suderburg, Lower Saxony, Germany",2026-04-22,https://www.linkedin.com/jobs/view/4404939621 , ,li-4404939621,fulltime,,,,,,False,entry level,"Research, Analyst, and Information Technology",,,Internet Publishing,https://de.linkedin.com/school/ostfalia---university-of-applied-sciences/,,,,,,,,,,,
linkedin,Wissenschaftliche/r Mitarbeiter/in (m/w/d) - Soziologie / Familiendemographie,Universität Rostock,"Rostock, Mecklenburg-West Pomerania, Germany",2026-04-21,https://www.linkedin.com/jobs/view/4404838542 , ,li-4404838542,fulltime,,,,,,False,entry level,"Research, Analyst, and Information Technology",,,Internet Publishing,https://de.linkedin.com/school/university-of-rostock/,,,,,,,,,,,
linkedin,Referendare und wissenschaftliche Mitarbeiter (m/w/d) Corporate / M&A,Bird & Bird Germany,"Frankfurt, Hesse, Germany",2026-04-21,https://www.linkedin.com/jobs/view/4404889241 , ,li-4404889241,internship,,,,,,False,internship,Legal,,,Law Practice,https://de.linkedin.com/showcase/bird-bird-germany/,,,,,,,,,,,
linkedin,Wissenschaftliche*n Mitarbeiter*in (m/w/d) in der Analytischen Chemie,Ruhr University Bochum,"Bochum, North Rhine-Westphalia, Germany",2026-04-21,https://www.linkedin.com/jobs/view/4404826738 , ,li-4404826738,fulltime,,,,,,False,entry level,"Research, Analyst, and Information Technology",,wpr@rub.de,Internet Publishing,https://de.linkedin.com/school/ruhrunibochum/,,,,,,,,,,,
linkedin,PhD Chemistry (m/f/d),Forschungszentrum Jülich,"Jülich, North Rhine-Westphalia, Germany",2026-04-21,https://www.linkedin.com/jobs/view/4404862884 , ,li-4404862884,fulltime,,,,,,False,associate,Science,,,Chemical Manufacturing,https://de.linkedin.com/company/forschungszentrum-julich,,,,,,,,,,,
linkedin,Wissenschaftliche Mitarbeiter (m/w/d) im Bereich IT-Recht,"SZA Schilling, Zutt & Anschütz","Mannheim, Baden-Württemberg, Germany",2026-04-21,https://www.linkedin.com/jobs/view/4404525890 , ,li-4404525890,internship,,,,,,False,internship,Legal,,,Law Practice,https://de.linkedin.com/company/sza-schilling-zutt-&-anschuetz,,,,,,,,,,,
linkedin,Postdoctoral Researcher,Bentham Science,"Bavaria, Germany",2026-04-21,https://www.linkedin.com/jobs/view/4401918988 , ,li-4401918988,volunteer,,,,,,True,mid-senior level,Research,,,Research Services,https://ae.linkedin.com/company/benthamscience,,,,,,,,,,,
linkedin,Wissenschaftliche Mitarbeiter (m/w/d),"SZA Schilling, Zutt & Anschütz","Mannheim, Baden-Württemberg, Germany",2026-04-21,https://www.linkedin.com/jobs/view/4404550289 , ,li-4404550289,internship,,,,,,False,internship,Legal,,,Law Practice,https://de.linkedin.com/company/sza-schilling-zutt-&-anschuetz,,,,,,,,,,,
linkedin,Wissenschaftliche Mitarbeiter (m/w/d),"SZA Schilling, Zutt & Anschütz","Munich, Bavaria, Germany",2026-04-21,https://www.linkedin.com/jobs/view/4404524952 , ,li-4404524952,internship,,,,,,False,internship,Legal,,,Law Practice,https://de.linkedin.com/company/sza-schilling-zutt-&-anschuetz,,,,,,,,,,,
linkedin,Wissenschaftliche*r Mitarbeiter*in (m/w/d) im BMFTR geförderten Projekt GreeGlueDemo,Hochschule Kaiserslautern,"Pirmasens, Rhineland-Palatinate, Germany",2026-04-21,https://www.linkedin.com/jobs/view/4404885472 , ,li-4404885472,fulltime,,,,,,False,entry level,"Research, Analyst, and Information Technology",,,Internet Publishing,https://de.linkedin.com/school/hochschule-kaiserslautern/,,,,,,,,,,,
linkedin,"Research Assistant/Doctoral Student (f/m/d) - Chair of Entrepreneurship, Innovation and Technological Transformation",WHU Entrepreneurship Roundtable,"Vallendar, Rhineland-Palatinate, Germany",2026-04-21,https://www.linkedin.com/jobs/view/4404584863 , ,li-4404584863,internship,,,,,,False,internship,"Research, Analyst, and Information Technology",,dries.faems@whu.edu,Education Administration Programs,https://de.linkedin.com/company/whu-entrepreneurship-roundtable,,,,,,,,,,,
linkedin,"Scientific researcher (Doctoral Candidate, m/f/d)",Land Niedersachsen,,2026-04-21,https://www.linkedin.com/jobs/view/4403995368 , ,li-4403995368,fulltime,,,,,,False,internship,"Research, Analyst, and Information Technology",,,Government Administration,https://de.linkedin.com/company/arbeitgeber-niedersachsen,,,,,,,,,,,
linkedin,Wissenschaftliche/-r Mitarbeit/-er (m/w/d),Land Niedersachsen,"Münden, Lower Saxony, Germany",2026-04-21,https://www.linkedin.com/jobs/view/4401419435 , ,li-4401419435,fulltime,,,,,,False,mid-senior level,"Research, Analyst, and Information Technology",,,Government Administration,https://de.linkedin.com/company/arbeitgeber-niedersachsen,,,,,,,,,,,
linkedin,"Data Analyst, Growth",Kraken,,2026-04-21,https://www.linkedin.com/jobs/view/4392110674 , ,li-4392110674,fulltime,,,,,,True,mid-senior level,Information Technology,,,Financial Services,https://www.linkedin.com/company/krakenfx,,,,,,,,,,,
linkedin,Senior Research Analyst,Mastercard,"Frankfurt, Hesse, Germany",2026-04-21,https://www.linkedin.com/jobs/view/4401960722 , ,li-4401960722,fulltime,,,,,,False,mid-senior level,"Research, Analyst, and Information Technology",,,"Financial Services, IT Services and IT Consulting, and Technology, Information and Internet",https://www.linkedin.com/company/mastercard,,,,,,,,,,,
linkedin,Assistant Producer I,EA SPORTS,"Cologne, North Rhine-Westphalia, Germany",2026-04-21,https://www.linkedin.com/jobs/view/4401949465 , ,li-4401949465,temporary,,,,,,False,entry level,"Design, Art/Creative, and Information Technology",,,Computer Games,https://ca.linkedin.com/company/easports,,,,,,,,,,,
linkedin,Wissenschaftliche / r Mitarbeiter / -in (w / m/d) Baurecht in Teilzeit,RWP Rechtsanwälte,"Düsseldorf, North Rhine-Westphalia, Germany",2026-04-21,https://www.linkedin.com/jobs/view/4401953827 , ,li-4401953827,parttime,,,,,,False,entry level,"Research, Analyst, and Information Technology",,,Law Practice,https://de.linkedin.com/company/rwp-rechtsanw%C3%A4lte,,,,,,,,,,,
linkedin,Wiss. Mitarbeiter*in (Praedoc) (m/w/d) mit 65%-Teilzeitbeschäftigung befristet bis zu 4 Jahre Entgeltgruppe 13 TV-L FU Kennung: Physical Chemistry / Diffusion in MOF films,Freie Universität Berlin,"Berlin, Germany",2026-04-21,https://www.linkedin.com/jobs/view/4401917297 , ,li-4401917297,temporary,,,,,,False,not applicable,"Research, Analyst, and Information Technology",,,Research Services,https://de.linkedin.com/school/freie-universitat-berlin/,,,,,,,,,,,
linkedin,Wissenschaftliche/r Mitarbeiter/in (m/w/d) - Theoretische Elektrotechnik,Universität Rostock,"Rostock, Mecklenburg-West Pomerania, Germany",2026-04-21,https://www.linkedin.com/jobs/view/4404844446 , ,li-4404844446,fulltime,,,,,,False,not applicable,"Research, Analyst, and Information Technology",,,Internet Publishing,https://de.linkedin.com/school/university-of-rostock/,,,,,,,,,,,
linkedin,"Wissenschaftliche/-n Mitarbeiter/-in (Doktorand/-in, m/w/d)",Land Niedersachsen,,2026-04-21,https://www.linkedin.com/jobs/view/4403986629 , ,li-4403986629,fulltime,,,,,,False,entry level,"Research, Analyst, and Information Technology",,,Government Administration,https://de.linkedin.com/company/arbeitgeber-niedersachsen,,,,,,,,,,,
linkedin,Senior AI Researcher - Pre-training Data,Aleph Alpha,"Heidelberg, Baden-Württemberg, Germany",2026-04-21,https://www.linkedin.com/jobs/view/4404853223 , ,li-4404853223,fulltime,,,,,,False,mid-senior level,Engineering and Information Technology,,,"Technology, Information and Internet",https://de.linkedin.com/company/aleph-alpha,,,,,,,,,,,
linkedin,Rehasport Übungsleiter oder Gymnastiklehrer in Orthopädie (m/w/d),Healthengineers,"Cologne, North Rhine-Westphalia, Germany",2026-04-21,https://www.linkedin.com/jobs/view/4401696599 , ,li-4401696599,fulltime,,,,,,False,entry level,Art/Creative,,,Government Administration,https://de.linkedin.com/company/healthengineers,,,,,,,,,,,
linkedin,Wissenschaftliche Mitarbeit Öffentliches Recht Lehrstuhl (m/w/d),FAU Erlangen-Nürnberg,"Erlangen, Bavaria, Germany",2026-04-21,https://www.linkedin.com/jobs/view/4404806308 , ,li-4404806308,fulltime,,,,,,False,entry level,"Research, Analyst, and Information Technology",,,Research Services,https://de.linkedin.com/school/fau-erlangen-n%C3%BCrnberg/,,,,,,,,,,,
linkedin,Business Intelligence & AI Specialist (m/w/d),KENFO - Fonds zur Finanzierung der kerntechnischen Entsorgung,"Berlin, Berlin, Germany",2026-04-21,https://www.linkedin.com/jobs/view/4404505917 , ,li-4404505917,parttime,,,,,,False,mid-senior level,Information Technology,,jobspersonio@kenfo.de,Investment Management,https://de.linkedin.com/company/kenfo-fonds-zur-finanzierung-der-kerntechnischen-entsorgung,,,,,,,,,,,
linkedin,Wissenschaftliche*r Mitarbeiter*in (Doktorand*in),Marburg University,"Marburg an der Lahn, Hesse, Germany",2026-04-20,https://www.linkedin.com/jobs/view/4404082200 , ,li-4404082200,fulltime,,,,,,False,internship,"Research, Analyst, and Information Technology",,raphael.reher@pharmazie.uni,Internet Publishing,https://de.linkedin.com/school/philipps-universit-t-marburg/,,,,,,,,,,,
linkedin,"Wissenschaftliche/r Mitarbeiter/in (m/w/d) - Künstliche Intelligenz, Bauinformatik",Universität Rostock,"Rostock, Mecklenburg-West Pomerania, Germany",2026-04-20,https://www.linkedin.com/jobs/view/4404353714 , ,li-4404353714,fulltime,,,,,,False,entry level,"Research, Analyst, and Information Technology",,,Internet Publishing,https://de.linkedin.com/school/university-of-rostock/,,,,,,,,,,,
linkedin,Biology Researcher (Masters/PhDs),Alignerr,,2026-04-20,https://www.linkedin.com/jobs/view/4404037229 , ,li-4404037229,contract,,,,,,True,mid-senior level,"Research, Analyst, and Information Technology",,,"Technology, Information and Internet",https://www.linkedin.com/company/alignerr,,,,,,,,,,,
linkedin,Referendariat (Rechtsanwalts-/Wahlstation)/Wissenschaftliche Mitarbeit Corporate Crime,YPOG,"Cologne, North Rhine-Westphalia, Germany",2026-04-20,https://www.linkedin.com/jobs/view/4404337771 , ,li-4404337771,internship,,,,,,False,internship,Legal,,karriere@ypog.law,Law Practice,https://de.linkedin.com/company/ypog,,,,,,,,,,,
linkedin,"Research Assistant (m/f/d) Electrical Engineering, Professorship for Experimental Physics and Material Science",Helmut-Schmidt-Universität/Universität der Bundeswehr Hamburg,"Hamburg, Hamburg, Germany",2026-04-20,https://www.linkedin.com/jobs/view/4401676902 , ,li-4401676902,parttime,,,,,,False,entry level,"Research, Analyst, and Information Technology",,,Higher Education,https://de.linkedin.com/school/helmut-schmidt-universit%C3%A4t---universit%C3%A4t-der-bundeswehr-hamburg/,,,,,,,,,,,
linkedin,Wissenschaftliche/r Mitarbeiter/in am Lehrstuhl für Öffentliches Recht und Rechtsphilosophie (m/w/d),Department Artificial Intelligence in Biomedical Engineering - AIBE@FAU,"Erlangen, Bavaria, Germany",2026-04-20,https://www.linkedin.com/jobs/view/4403662909 , ,li-4403662909,parttime,,,,,,False,entry level,"Research, Analyst, and Information Technology",,-sekretariat@fau.de,Research Services,https://de.linkedin.com/company/aibe-fau,,,,,,,,,,,
linkedin,Biobank – Pre Clinical Research Assistant (m/w/d),QIMA,"Münster, North Rhine-Westphalia, Germany",2026-04-20,https://www.linkedin.com/jobs/view/4404321886 , ,li-4404321886,fulltime,,,,,,False,associate,Other,,,Biotechnology,https://hk.linkedin.com/company/qima,,,,,,,,,,,
linkedin,Wiss. Mitarbeiter*in (Praedoc) (m/w/d) mit 65%-Teilzeitbeschäftigung befristet bis zu 4 Jahre Entgeltgruppe 13 TV-L FU Kennung: Physical Chemistry / Diffusion in MOF films,Freie Universität Berlin,"Berlin, Berlin, Germany",2026-04-20,https://www.linkedin.com/jobs/view/4401282949 , ,li-4401282949,fulltime,,,,,,False,mid-senior level,"Research, Analyst, and Information Technology",,,Research Services,https://de.linkedin.com/school/freie-universitat-berlin/,,,,,,,,,,,
linkedin,Wissenschaftliche/r Mitarbeiter/in am Lehrstuhl für Öffentliches Recht und Rechtsphilosophie (m/w/d),FAU Erlangen-Nürnberg,"Erlangen, Bavaria, Germany",2026-04-20,https://www.linkedin.com/jobs/view/4403669105 , ,li-4403669105,fulltime,,,,,,False,entry level,"Research, Analyst, and Information Technology",,-sekretariat@fau.de,Research Services,https://de.linkedin.com/school/fau-erlangen-n%C3%BCrnberg/,,,,,,,,,,,
linkedin,Chemistry Researcher (Masters/PhDs),Alignerr,,2026-04-20,https://www.linkedin.com/jobs/view/4404049042 , ,li-4404049042,contract,description,hourly,75.0,90.0,USD,True,entry level,"Research, Analyst, and Information Technology",,,"Technology, Information and Internet",https://www.linkedin.com/company/alignerr,,,,,,,,,,,
linkedin,Founding Data Scientist,Almedia,"Berlin, Germany",2026-04-20,https://www.linkedin.com/jobs/view/4404352613 , ,li-4404352613,fulltime,,,,,,False,mid-senior level,Engineering and Information Technology,,,Advertising Services,https://de.linkedin.com/company/almediaco,,,,,,,,,,,
linkedin,Data Scientist (m/w/d) im Reportingbereich,Körber,"Markt Schwaben, Bavaria, Germany",2026-04-20,https://www.linkedin.com/jobs/view/4404058344 , ,li-4404058344,fulltime,,,,,,True,mid-senior level,Engineering and Information Technology,,jobs@koerber.com,Pharmaceutical Manufacturing,https://de.linkedin.com/company/k%C3%B6rber,,,,,,,,,,,
linkedin,Data Scientist / Biostatistician (all genders) - AF-B-STEP,Universitätsklinikum Hamburg Eppendorf,"Hamburg, Hamburg, Germany",2026-04-20,https://www.linkedin.com/jobs/view/4401292256 , ,li-4401292256,fulltime,,,,,,True,entry level,Engineering and Information Technology,,j.obergassel@uke.de,Hospitals and Health Care,https://de.linkedin.com/company/universit-tsklinikum-hamburg-eppendorf,,,,,,,,,,,
linkedin,Wiss. Mitarbeiter*in / Rechtsreferendar*in im Legal Tech bei Passengers friend,Passengers friend,,2026-04-20,https://www.linkedin.com/jobs/view/4401668457 , ,li-4401668457,contract,,,,,,False,entry level,Legal,,,IT Services and IT Consulting,https://de.linkedin.com/company/passengers-friend,,,,,,,,,,,
linkedin,Lecturer Engineering Automation Technology (m/f/d),IU International University of Applied Sciences,"Bad Honnef am Rhein, North Rhine-Westphalia, Germany",2026-04-19,https://www.linkedin.com/jobs/view/4326863574 , ,li-4326863574,parttime,,,,,,False,associate,Education and Science,,,Higher Education,https://de.linkedin.com/school/iu-hochschule/,,,,,,,,,,,
linkedin,"Senior Director, Analyst – Data & Analytics and AI Transformation in Procurement",Gartner,"Berlin, Berlin, Germany",2026-04-19,https://www.linkedin.com/jobs/view/4391622230 , ,li-4391622230,fulltime,,,,,,False,not applicable,Business Development and Sales,,ApplicantAccommodations@gartner.com,"IT Services and IT Consulting, Information Services, and Research Services",https://www.linkedin.com/company/gartner,,,,,,,,,,,
linkedin,Wissenschaftliche*r Mitarbeiter*in (Praedoc) (m/w/d),BECK Stellenmarkt,"Berlin, Berlin, Germany",2026-04-18,https://www.linkedin.com/jobs/view/4403040739 , ,li-4403040739,parttime,,,,,,False,entry level,Legal,,,Legal Services,https://www.linkedin.com/showcase/beck-stellenmarkt/,,,,,,,,,,,
linkedin,Research & Teaching Assistant (Econometrics and Data Science Prof. Jan Prüser) f/m/d | Part-Time (50%),EBS Universität für Wirtschaft und Recht,"Oestrich-Winkel, Hesse, Germany",2026-04-18,https://www.linkedin.com/jobs/view/4391743323 , ,li-4391743323,fulltime,,,,,,False,entry level,"Research, Analyst, and Information Technology",,"mehdi.hosseinkouchack@ebs.edu, kira.schaumburg@ebs.edu",Individual and Family Services,https://de.linkedin.com/school/ebs-universit%C3%A4t-f%C3%BCr-wirtschaft-und-recht/,,,,,,,,,,,
linkedin,AI Trainer - Freelance Data Annotator,Toloka Annotators,"Stuttgart, Baden-Württemberg, Germany",2026-04-18,https://www.linkedin.com/jobs/view/4403819941 , ,li-4403819941,parttime,,,,,,True,entry level,Other,,,IT Services and IT Consulting,https://www.linkedin.com/company/toloka-annotators,,,,,,,,,,,
linkedin,AI Trainer - Freelance Data Annotator,Toloka Annotators,"Frankfurt am Main, Hesse, Germany",2026-04-18,https://www.linkedin.com/jobs/view/4403839130 , ,li-4403839130,parttime,,,,,,True,entry level,Other,,,IT Services and IT Consulting,https://www.linkedin.com/company/toloka-annotators,,,,,,,,,,,
linkedin,Wissenschaftliche Mitarbeiter (m/w/d) – Nachhaltigkeit & ESG,Ashurst,"Frankfurt, Hesse, Germany",2026-04-17,https://www.linkedin.com/jobs/view/4317302836 , ,li-4317302836,fulltime,,,,,,False,not applicable,"Research, Analyst, and Information Technology",,,Legal Services,https://uk.linkedin.com/company/ashurst,,,,,,,,,,,
linkedin,Wissenschaftliche Hilfskraft im Bereich Organizational Transformation (all genders),Fraunhofer IRB,"Stuttgart, Baden-Württemberg, Germany",2026-04-17,https://www.linkedin.com/jobs/view/4402363193 , ,li-4402363193,fulltime,,,,,,False,entry level,"Research, Analyst, and Information Technology",,melissa.koehler@irb.fraunhofer.de,Research Services,https://www.linkedin.com/company/fraunhofer-irb,,,,,,,,,,,
linkedin,"Wissenschaftliche:r Mitarbeiter:in am Lehrstuhl für Bürgerliches Recht, Arbeitsrecht, Gesellschaftsrecht und Rechtsvergleichung § 28 Abs. 1 HmbHG",University of Hamburg,"Hamburg, Hamburg, Germany",2026-04-17,https://www.linkedin.com/jobs/view/4403418655 , ,li-4403418655,parttime,,,,,,False,entry level,"Research, Analyst, and Information Technology",,,Research Services,https://de.linkedin.com/school/unihamburg/,,,,,,,,,,,
linkedin,Research Assistant (m/f/d) - Ecophysiology of Marine Invertebrates,Universität Rostock,"Rostock, Mecklenburg-West Pomerania, Germany",2026-04-17,https://www.linkedin.com/jobs/view/4403429693 , ,li-4403429693,fulltime,,,,,,False,entry level,"Research, Analyst, and Information Technology",,,Internet Publishing,https://de.linkedin.com/school/university-of-rostock/,,,,,,,,,,,
linkedin,Research associate for Robotics (f/m/x),Technical University of Applied Sciences Würzburg-Schweinfurt (THWS),"Kitzingen, Bavaria, Germany",2026-04-17,https://www.linkedin.com/jobs/view/4403192770 , ,li-4403192770,parttime,,,,,,False,entry level,"Research, Analyst, and Information Technology",,,Internet Publishing,https://de.linkedin.com/school/thws/,,,,,,,,,,,
linkedin,Study Participants - Fully Remote (Dortmund),Prolific,"Dortmund, North Rhine-Westphalia, Germany",2026-04-17,https://www.linkedin.com/jobs/view/4403541780 , ,li-4403541780,temporary,,,,,,True,entry level,Education and Training,,,Software Development,https://uk.linkedin.com/company/prolific-com,,,,,,,,,,,
linkedin,Study Participants - Fully Remote (Hamburg),Prolific,"Hamburg, Hamburg, Germany",2026-04-17,https://www.linkedin.com/jobs/view/4403544722 , ,li-4403544722,temporary,,,,,,True,entry level,Education and Training,,,Software Development,https://uk.linkedin.com/company/prolific-com,,,,,,,,,,,
linkedin,Study Participants - Fully Remote (Leipzig),Prolific,"Leipzig, Saxony, Germany",2026-04-17,https://www.linkedin.com/jobs/view/4403550640 , ,li-4403550640,temporary,,,,,,True,entry level,Education and Training,,,Software Development,https://uk.linkedin.com/company/prolific-com,,,,,,,,,,,
linkedin,Study Participants - Fully Remote (Hannover),Prolific,"Dortmund, North Rhine-Westphalia, Germany",2026-04-17,https://www.linkedin.com/jobs/view/4403544724 , ,li-4403544724,temporary,,,,,,True,entry level,Education and Training,,,Software Development,https://uk.linkedin.com/company/prolific-com,,,,,,,,,,,
linkedin,Study Participants - Fully Remote (Dresden),Prolific,"Dresden, Saxony, Germany",2026-04-17,https://www.linkedin.com/jobs/view/4403547586 , ,li-4403547586,temporary,,,,,,True,entry level,Education and Training,,,Software Development,https://uk.linkedin.com/company/prolific-com,,,,,,,,,,,
