site,title,company,location,date_posted,job_url,job_url_direct,id,job_type,salary_source,interval,min_amount,max_amount,currency,is_remote,job_level,job_function,listing_type,emails,company_industry,company_url,company_url_direct,company_addresses,company_num_employees,company_revenue,company_description,skills,experience_range,company_rating,company_reviews_count,vacancy_count,work_from_home_type
linkedin,Physics Researcher - Fully Remote | Upto $140/hr,Mercor,,2026-06-29,https://www.linkedin.com/jobs/view/4434426407 , ,li-4434426407,parttime,description,hourly,80.0,140.0,USD,True,not applicable,Research,,support@mercor.com,Software Development,https://www.linkedin.com/company/mercor-ai,,,,,,,,,,,
linkedin,Stud. Beschäftigte*r (w/m/d) 41 MoStd. befristet auf 2 Jahre Kennung: Stud HK,Freie Universität Berlin,"Berlin, Berlin, Germany",2026-06-29,https://www.linkedin.com/jobs/view/4431513088 , ,li-4431513088,fulltime,,,,,,False,internship,Other,,,Research Services,https://de.linkedin.com/school/freie-universitat-berlin/,,,,,,,,,,,
linkedin,Wissenschaftliche/r Mitarbeiter/in (m/w/d),Übergabe,"Hausen, Bavaria, Germany",2026-06-29,https://www.linkedin.com/jobs/view/4434136236 , ,li-4434136236,parttime,,,,,,False,mid-senior level,"Research, Analyst, and Information Technology",,,Media Production,https://de.linkedin.com/company/%C3%BCbergabe,,,,,,,,,,,
linkedin,"Research Scientist, Center for Affective and Autonomic Neuroscience (CAAN)",Max Planck Institute for Human Development,"Berlin, Germany",2026-06-29,https://www.linkedin.com/jobs/view/4431089166 , ,li-4431089166,fulltime,,,,,,True,mid-senior level,,,,Research Services,https://de.linkedin.com/school/max-planck-institute-for-human-development/,,,,,,,,,,,
linkedin,"Measurement Partner, Global Monetization Product and Technology, EUI",TikTok,"Berlin, Berlin, Germany",2026-06-29,https://www.linkedin.com/jobs/view/4434122258 , ,li-4434122258,fulltime,,,,,,False,mid-senior level,Sales and Business Development,,,Entertainment Providers,https://www.linkedin.com/company/tiktok,,,,,,,,,,,
linkedin,Postdoctoral Fellow (m/f/d),Max Planck Institute for Human Development,"Berlin, Germany",2026-06-29,https://www.linkedin.com/jobs/view/4434483738 , ,li-4434483738,fulltime,,,,,,True,associate,Research,,,Research Services,https://de.linkedin.com/school/max-planck-institute-for-human-development/,,,,,,,,,,,
linkedin,"Wissenschaftliche*n Mitarbeiter*in (w/m/d) am Lehrstuhl für BWL, insbesondere Wirtschaftsprüfung",FernUniversität in Hagen,"Hagen, North Rhine-Westphalia, Germany",2026-06-29,https://www.linkedin.com/jobs/view/4422930367 , ,li-4422930367,fulltime,,,,,,False,entry level,"Research, Analyst, and Information Technology",,,Higher Education,https://de.linkedin.com/school/fernunihagen/,,,,,,,,,,,
linkedin,Stud. Beschäftigte*r (w/m/d) 41 MoStd. befristet bis 29.02.2028 für die Dauer des Projekts Kennung: SHK-SUDA-CLOUD_B,Freie Universität Berlin,"Berlin, Berlin, Germany",2026-06-29,https://www.linkedin.com/jobs/view/4431520048 , ,li-4431520048,fulltime,,,,,,False,internship,Management and Manufacturing,,,Research Services,https://de.linkedin.com/school/freie-universitat-berlin/,,,,,,,,,,,
linkedin,Wiss. Mitarbeiter*in (Praedoc) (w/m/d) mit 50%-Teilzeitbeschäftigung befristet bis zu 4 Jahre Entgeltgruppe 13 TV-L FU Kennung: 18/26/09930002,Freie Universität Berlin,"Berlin, Berlin, Germany",2026-06-29,https://www.linkedin.com/jobs/view/4431508195 , ,li-4431508195,fulltime,,,,,,False,entry level,"Research, Analyst, and Information Technology",,,Research Services,https://de.linkedin.com/school/freie-universitat-berlin/,,,,,,,,,,,
linkedin,Med. Dokumentar*in,Klinikum Stuttgart,"Stuttgart, Baden-Württemberg, Germany",2026-06-29,https://www.linkedin.com/jobs/view/4434496367 , ,li-4434496367,fulltime,,,,,,False,entry level,Administrative,,,Medical Practices,https://de.linkedin.com/company/klinikum-stuttgart,,,,,,,,,,,
linkedin,E-commerce Data Analyst,Alignerr,,2026-06-29,https://www.linkedin.com/jobs/view/4434421195 , ,li-4434421195,contract,,,,,,True,entry level,Information Technology,,,"Technology, Information and Internet",https://www.linkedin.com/company/alignerr,,,,,,,,,,,
linkedin,"Wissenschaftliche*n Mitarbeiter*in (m/w/d) für den Transregio-Sonderforschungsbereich „Historical and Transcultural Narratology“ (TRR 427), Teilprojekt A02",Ruhr University Bochum,"Bochum, North Rhine-Westphalia, Germany",2026-06-29,https://www.linkedin.com/jobs/view/4434477703 , ,li-4434477703,fulltime,,,,,,False,entry level,"Research, Analyst, and Information Technology",,wpr@rub.de,Internet Publishing,https://de.linkedin.com/school/ruhrunibochum/,,,,,,,,,,,
linkedin,Wissenschaftliche*n Mitarbeiter*in (m/w/d) mit Master-Abschluss (TV-L E 13),Ruhr University Bochum,"Bochum, North Rhine-Westphalia, Germany",2026-06-29,https://www.linkedin.com/jobs/view/4434483562 , ,li-4434483562,fulltime,,,,,,False,entry level,"Research, Analyst, and Information Technology",,wpr@rub.de,Internet Publishing,https://de.linkedin.com/school/ruhrunibochum/,,,,,,,,,,,
linkedin,Wiss. Mitarbeiter*in (w/m/d) Vollzeitbeschäftigung befristet bis 31.03.2029 (Projektende) Entgeltgruppe 13 TV-L FU Kennung: Postdoc WiMi EXREAN,Freie Universität Berlin,"Berlin, Berlin, Germany",2026-06-29,https://www.linkedin.com/jobs/view/4431521011 , ,li-4431521011,fulltime,,,,,,False,mid-senior level,"Research, Analyst, and Information Technology",,,Research Services,https://de.linkedin.com/school/freie-universitat-berlin/,,,,,,,,,,,
linkedin,Research Associate – Technologiescouting & Data Intelligence (w/m/d),FH Münster,"Münster, North Rhine-Westphalia, Germany",2026-06-29,https://www.linkedin.com/jobs/view/4434429798 , ,li-4434429798,fulltime,,,,,,False,entry level,"Research, Analyst, and Information Technology",,,Higher Education,https://de.linkedin.com/school/fhmuenster/,,,,,,,,,,,
linkedin,ifo Postdoctoral Researcher / Economist (f/m/d) for the ifo Center for the Economics of Education,ifo Institute – Leibniz Institute for Economic Research,,2026-06-29,https://www.linkedin.com/jobs/view/4434123298 , ,li-4434123298,temporary,,,,,,False,associate,Education and Research,,"recruiting@ifo.de, recruiting@ifo.de, -office@ifo.de",Research Services,https://de.linkedin.com/company/ifo-institute-for-economic-research,,,,,,,,,,,
linkedin,"Wissenschaftlerin / Wissenschaftler (m/w/d) Maschinenbau, Physik, Mathematik, Informatik, Ingenieurwissenschaften (26-106-5B)","Physikalisch-Technische Bundesanstalt, PTB","Brunswick, Lower Saxony, Germany",2026-06-28,https://www.linkedin.com/jobs/view/4431044514 , ,li-4431044514,fulltime,,,,,,False,mid-senior level,Research,,-rube@ptb.de,Government Administration,https://de.linkedin.com/company/physikalisch-technische-bundesanstalt,,,,,,,,,,,
linkedin,"Wissenschaftlerin / Wissenschaftler (m/w/d) Elektrotechnik, Physik (26-98-6B)","Physikalisch-Technische Bundesanstalt, PTB","Brunswick, Lower Saxony, Germany",2026-06-28,https://www.linkedin.com/jobs/view/4431052383 , ,li-4431052383,fulltime,,,,,,False,mid-senior level,Research,,bjoern.pullner@ptb.de,Government Administration,https://de.linkedin.com/company/physikalisch-technische-bundesanstalt,,,,,,,,,,,
linkedin,Applied AI Researcher - World Reconstruction and Generation,NVIDIA,"Hamburg, Hamburg, Germany",2026-06-27,https://www.linkedin.com/jobs/view/4424639363 , ,li-4424639363,fulltime,,,,,,False,mid-senior level,Engineering and Information Technology,,,Computer Hardware Manufacturing,https://www.linkedin.com/company/nvidia,,,,,,,,,,,
linkedin,Wissenschaftliche*r Mitarbeiter*in (Schwerpunkt Lehre Anatomie & Histologie für Human- und Zahnmedizin),Universitätsmedizin Greifswald,"Greifswald, Mecklenburg-West Pomerania, Germany",2026-06-27,https://www.linkedin.com/jobs/view/4433436733 , ,li-4433436733,fulltime,,,,,,False,mid-senior level,"Research, Analyst, and Information Technology",,,Hospitals and Health Care,https://de.linkedin.com/company/umgreifswald,,,,,,,,,,,
linkedin,Battery Material Engineer (all genders),CMBLU Energy,"Alzenau in Unterfranken, Bavaria, Germany",2026-06-27,https://www.linkedin.com/jobs/view/4402871770 , ,li-4402871770,fulltime,,,,,,True,mid-senior level,Management and Manufacturing,,,Utilities,https://de.linkedin.com/company/cmblu-energy-ag,,,,,,,,,,,
linkedin,Wissenschaftliche*r Mitarbeiter*in am Institut Metall- und Verbundbau,Hamburg University of Technology,"Hamburg, Hamburg, Germany",2026-06-26,https://www.linkedin.com/jobs/view/4433842968 , ,li-4433842968,fulltime,,,,,,False,mid-senior level,"Research, Analyst, and Information Technology",,marcus.rutner@tuhh.de,Internet Publishing,https://de.linkedin.com/school/technische-universit%C3%A4t-hamburg/,,,,,,,,,,,
linkedin,Wissenschaftliche*r Mitarbeiter*in (Doktorand*in oder Postdoktorand*in),Marburg University,"Marburg an der Lahn, Hesse, Germany",2026-06-26,https://www.linkedin.com/jobs/view/4433847530 , ,li-4433847530,fulltime,,,,,,False,not applicable,"Research, Analyst, and Information Technology",,carola.westermeier@staff.uni,Internet Publishing,https://de.linkedin.com/school/philipps-universit-t-marburg/,,,,,,,,,,,
linkedin,Wissenschaftliche Mitarbeiter (m/w/d) in Teilzeit,Thoraxklinik am Universitätsklinikum Heidelberg,"Heidelberg, Baden-Württemberg, Germany",2026-06-26,https://www.linkedin.com/jobs/view/4433809443 , ,li-4433809443,parttime,,,,,,False,associate,Health Care Provider,,,Hospitals and Health Care,https://www.linkedin.com/company/thoraxklinik-am-universit%C3%A4tsklinikum-heidelberg,,,,,,,,,,,
linkedin,Wissenschaftliche Hilfskräfte (WHB) (m/w/d) mit Bachelor-Abschluss für Vorlesung Informatik 3 - Theoretische Informatik,Ruhr University Bochum,"Bochum, North Rhine-Westphalia, Germany",2026-06-26,https://www.linkedin.com/jobs/view/4433850405 , ,li-4433850405,fulltime,,,,,,False,entry level,"Research, Analyst, and Information Technology",,"wpr@rub.de, julian.loss@rub.de",Internet Publishing,https://de.linkedin.com/school/ruhrunibochum/,,,,,,,,,,,
linkedin,Postdoctoral Researcher (f/m/d) - Signaling Dynamics,Max-Planck-Institut für Chemische Physik fester Stoffe,"Jena, Thuringia, Germany",2026-06-26,https://www.linkedin.com/jobs/view/4433853371 , ,li-4433853371,fulltime,,,,,,False,internship,"Research, Analyst, and Information Technology",,,Internet Publishing,https://www.linkedin.com/company/max-planck-institut-f%C3%BCr-chemische-physik-fester-stoffe,,,,,,,,,,,
linkedin,Global Graduate Program 2026 - Simulation engineer,Goldwind,"Frankfurt am Main, Hesse, Germany",2026-06-26,https://www.linkedin.com/jobs/view/4424180703 , ,li-4424180703,fulltime,,,,,,False,internship,Engineering and Information Technology,,,Renewable Energy Equipment Manufacturing,https://cn.linkedin.com/company/goldwind,,,,,,,,,,,
linkedin,Research Scientist (sleep physiology) (m/f/d) | Center for Affective and Autonomic Neuroscience,Max Planck Society,"Berlin, Berlin, Germany",2026-06-26,https://www.linkedin.com/jobs/view/4430633055 , ,li-4430633055,fulltime,,,,,,True,mid-senior level,Other,,,Civic and Social Organizations,https://de.linkedin.com/school/max-planck-society/,,,,,,,,,,,
linkedin,Wissenschaftliche*n Mitarbeiter*in (Doktorand*in),Marburg University,"Marburg an der Lahn, Hesse, Germany",2026-06-26,https://www.linkedin.com/jobs/view/4433862064 , ,li-4433862064,fulltime,,,,,,False,internship,"Research, Analyst, and Information Technology",,,Internet Publishing,https://de.linkedin.com/school/philipps-universit-t-marburg/,,,,,,,,,,,
linkedin,Research Associate (m/f/d) at the Institute of Algorithms and Complexity,Hamburg University of Technology,"Hamburg, Hamburg, Germany",2026-06-26,https://www.linkedin.com/jobs/view/4433865011 , ,li-4433865011,fulltime,,,,,,False,entry level,"Research, Analyst, and Information Technology",,algo@tuhh.de,Internet Publishing,https://de.linkedin.com/school/technische-universit%C3%A4t-hamburg/,,,,,,,,,,,
linkedin,Research Assistant - Computational Systems (f/m/x,German Aerospace Center (DLR),"Berlin, Berlin, Germany",2026-06-26,https://www.linkedin.com/jobs/view/4433860371 , ,li-4433860371,fulltime,,,,,,False,entry level,"Research, Analyst, and Information Technology",,,Research Services,https://de.linkedin.com/company/dlr,,,,,,,,,,,
linkedin,Research Assistant (Doctoral Researcher/PhD),Marburg University,"Marburg an der Lahn, Hesse, Germany",2026-06-26,https://www.linkedin.com/jobs/view/4433866009 , ,li-4433866009,fulltime,,,,,,False,mid-senior level,"Research, Analyst, and Information Technology",,,Internet Publishing,https://de.linkedin.com/school/philipps-universit-t-marburg/,,,,,,,,,,,
linkedin,Research Assistant (Postdoc),Marburg University,"Marburg an der Lahn, Hesse, Germany",2026-06-26,https://www.linkedin.com/jobs/view/4433860072 , ,li-4433860072,fulltime,,,,,,False,mid-senior level,"Research, Analyst, and Information Technology",,,Internet Publishing,https://de.linkedin.com/school/philipps-universit-t-marburg/,,,,,,,,,,,
linkedin,Biobank - Pre Clinical Research Assistant (m/w/d),QIMA,"Münster, North Rhine-Westphalia, Germany",2026-06-26,https://www.linkedin.com/jobs/view/4433895180 , ,li-4433895180,fulltime,,,,,,False,entry level,Research,,,Biotechnology,https://hk.linkedin.com/company/qima,,,,,,,,,,,
linkedin,Wissenschaftliche*n Mitarbeiter*in (Postdoktorand*in),Marburg University,"Marburg an der Lahn, Hesse, Germany",2026-06-26,https://www.linkedin.com/jobs/view/4433865012 , ,li-4433865012,fulltime,,,,,,False,entry level,"Research, Analyst, and Information Technology",,,Internet Publishing,https://de.linkedin.com/school/philipps-universit-t-marburg/,,,,,,,,,,,
linkedin,Wissenschaftliche*r Mitarbeiter*in (Doktorand*in),Marburg University,"Marburg an der Lahn, Hesse, Germany",2026-06-26,https://www.linkedin.com/jobs/view/4433853372 , ,li-4433853372,fulltime,,,,,,False,internship,"Research, Analyst, and Information Technology",,jens.puschke@jura.uni,Internet Publishing,https://de.linkedin.com/school/philipps-universit-t-marburg/,,,,,,,,,,,
linkedin,Research Assistant/Doctoral Student (f/m/d) - Chair of Corporate Finance,WHU Entrepreneurship Roundtable,"Vallendar, Rhineland-Palatinate, Germany",2026-06-26,https://www.linkedin.com/jobs/view/4433852577 , ,li-4433852577,fulltime,,,,,,False,internship,"Research, Analyst, and Information Technology",,"burcin.yurtoglu@whu.edu, katharina.sigtermans@whu.edu",Education Administration Programs,https://de.linkedin.com/company/whu-entrepreneurship-roundtable,,,,,,,,,,,
linkedin,Researcher in Biologically Informed Machine Learning and AI,Deutsches Forschungszentrum für Künstliche Intelligenz (DFKI),"Kaiserslautern, Rhineland-Palatinate, Germany",2026-06-26,https://www.linkedin.com/jobs/view/4433246425 , ,li-4433246425,fulltime,,,,,,False,entry level,Other,,,Research Services,https://de.linkedin.com/company/dfki,,,,,,,,,,,
linkedin,Studentische Hilfskraft - Schulungsorganisation in der Data Science Academy,Fraunhofer IAIS,"Sankt Augustin, North Rhine-Westphalia, Germany",2026-06-26,https://www.linkedin.com/jobs/view/4424200368 , ,li-4424200368,fulltime,,,,,,False,internship,Other,,karriere@iais.fraunhofer.de,Research Services,https://de.linkedin.com/company/fraunhofer-iais,,,,,,,,,,,
linkedin,Experte Complaints- & Quality Management Analytik (m/w/d),ERGO,"Düsseldorf, North Rhine-Westphalia, Germany",2026-06-26,https://www.linkedin.com/jobs/view/4431727464 , ,li-4431727464,fulltime,,,,,,False,mid-senior level,Quality Assurance,,,Insurance,https://de.linkedin.com/company/ergo-group-ag,,,,,,,,,,,
linkedin,Global Graduate Program 2026 - Assistant Wind Resource Engineer,Goldwind,"Frankfurt am Main, Hesse, Germany",2026-06-26,https://www.linkedin.com/jobs/view/4424168687 , ,li-4424168687,fulltime,,,,,,False,internship,Engineering and Information Technology,,,Renewable Energy Equipment Manufacturing,https://cn.linkedin.com/company/goldwind,,,,,,,,,,,
linkedin,Research Associate – Cellular Functional Assays and Organoids (m/f/d),WuXi AppTec,"Bavaria, Germany",2026-06-25,https://www.linkedin.com/jobs/view/4432687860 , ,li-4432687860,fulltime,,,,,,False,entry level,"Research, Analyst, and Information Technology",,,Pharmaceutical Manufacturing,https://cn.linkedin.com/company/wuxi-apptec,,,,,,,,,,,
linkedin,Jnr Chemist,Ucaneo,"Berlin, Berlin, Germany",2026-06-25,https://www.linkedin.com/jobs/view/4430227120 , ,li-4430227120,fulltime,,,,,,False,entry level,Science,,,Construction,https://de.linkedin.com/company/ucaneo,,,,,,,,,,,
linkedin,Artificial Intelligence Researcher,THRYVE,,2026-06-25,https://www.linkedin.com/jobs/view/4433317646 , ,li-4433317646,fulltime,,,,,,True,mid-senior level,"Project Management, Information Technology, and Consulting",,Khalifa@thryvetalent.com,"IT Services and IT Consulting, Software Development, and Financial Services",https://de.linkedin.com/company/thryvetalent,,,,,,,,,,,
linkedin,Wiss. Mitarbeiter*in (d/m/w) - 65 % Arbeitszeit,Technische Universität Berlin,"Berlin, Berlin, Germany",2026-06-25,https://www.linkedin.com/jobs/view/4433385090 , ,li-4433385090,fulltime,,,,,,False,entry level,"Research, Analyst, and Information Technology",,,Education Administration Programs,https://de.linkedin.com/school/tuberlin/,,,,,,,,,,,
linkedin,Strategic Content & Research Analyst:in (m/w/d),Media Force,"Berlin, Germany",2026-06-25,https://www.linkedin.com/jobs/view/4433081055 , ,li-4433081055,fulltime,,,,,,False,entry level,Management and Manufacturing,,,Social Networking/Social Media,https://de.linkedin.com/company/media-force-gmbh,,,,,,,,,,,
linkedin,"Wissenschaftliche/r Mitarbeiter/in (m/w/d) BWL, Innovations-, Technologie- und Gründungsmanagement",Justus Liebig University Giessen,"Giessen, Hesse, Germany",2026-06-25,https://www.linkedin.com/jobs/view/4432538150 , ,li-4432538150,parttime,,,,,,False,entry level,"Research, Analyst, and Information Technology",,,Higher Education,https://de.linkedin.com/school/jlugiessen/,,,,,,,,,,,
linkedin,Wissenschaftliche*r Mitarbeiter*in (w/m/d) an der Professur für Gesundheitskommunikation,Universität Erfurt,"Erfurt, Thuringia, Germany",2026-06-25,https://www.linkedin.com/jobs/view/4433312582 , ,li-4433312582,fulltime,,,,,,False,entry level,"Research, Analyst, and Information Technology",,lars.korn@bnitm.de,Internet Publishing,https://de.linkedin.com/school/university-of-erfurt/,,,,,,,,,,,
linkedin,Research Assistant im Bereich Banking & Finance (w/m/d),Gowling WLG,"Frankfurt, Hesse, Germany",2026-06-25,https://www.linkedin.com/jobs/view/4423009507 , ,li-4423009507,fulltime,,,,,,False,entry level,"Research, Analyst, and Information Technology",,katharina.ewert@de.gowlingwlg.com,Law Practice,https://www.linkedin.com/company/gowlingwlg,,,,,,,,,,,
linkedin,Doktorandin / Doktorand Datenanalyse Automatisiertes Fahren (w/m/d),Volkswagen Group,"Wolfsburg, Lower Saxony, Germany",2026-06-25,https://www.linkedin.com/jobs/view/4414185621 , ,li-4414185621,fulltime,,,,,,False,internship,Research,,,Motor Vehicle Manufacturing,https://de.linkedin.com/company/volkswagen-group,,,,,,,,,,,
linkedin,Data Scientist (m/w/d) LC/MS at Roche,Bertrandt Group,"Penzberg, Bavaria, Germany",2026-06-25,https://www.linkedin.com/jobs/view/4432902289 , ,li-4432902289,fulltime,,,,,,False,mid-senior level,Engineering and Information Technology,,,Engineering Services,https://de.linkedin.com/company/bertrandt-ag,,,,,,,,,,,
linkedin,"Wissenschaftliche:r Mitarbeiter:in (m/w/d), EG 13 TV-H,  am Fachgebiet Mittlere und neuere Kunstgeschichte  in der Kunsthochschule",University of Kassel,"Kassel, Hesse, Germany",2026-06-25,https://www.linkedin.com/jobs/view/4433077084 , ,li-4433077084,fulltime,,,,,,False,entry level,"Research, Analyst, and Information Technology",,,Internet Publishing,https://de.linkedin.com/school/uni-kassel/,,,,,,,,,,,
linkedin,Mitarbeiter Projektmanagement & Datenmonitoring / Data Analyst (m/w/d),Spectos GmbH,"Dresden, Saxony, Germany",2026-06-25,https://www.linkedin.com/jobs/view/4433066546 , ,li-4433066546,fulltime,,,,,,False,associate,Other,,,IT Services and IT Consulting,https://de.linkedin.com/company/spectos-gmbh,,,,,,,,,,,
linkedin,Scientific staff/PhD-student  for the Development of Bipolar Membranes - part time 80 % - (m/f/d),Hahn-Schickard,"Freiburg, Baden-Württemberg, Germany",2026-06-25,https://www.linkedin.com/jobs/view/4433046210 , ,li-4433046210,parttime,,,,,,False,entry level,Engineering,,,Research Services,https://de.linkedin.com/company/hahn-schickard,,,,,,,,,,,
linkedin,JSSC Lab Asst(690 ) Online Form 2022,Study Planet Ranchi,"Aug, Bavaria, Germany",2026-06-25,https://www.linkedin.com/jobs/view/4433325037 , ,li-4433325037,fulltime,,,,,,False,entry level,"Research, Analyst, and Information Technology",,,Education Administration Programs,https://in.linkedin.com/company/study-planet-ranchi,,,,,,,,,,,
linkedin,Research Associate - Biochemistry (m/f/d),WuXi AppTec,"Bavaria, Germany",2026-06-25,https://www.linkedin.com/jobs/view/4432689849 , ,li-4432689849,fulltime,,,,,,False,entry level,"Research, Analyst, and Information Technology",,,Pharmaceutical Manufacturing,https://cn.linkedin.com/company/wuxi-apptec,,,,,,,,,,,
linkedin,Scientific Project Specialist | Produktentwickler Nahrungsergänzungsmittel (m/w/d) hybrid,Lebenskraftpur GmbH,"Waghäusel, Baden-Württemberg, Germany",2026-06-25,https://www.linkedin.com/jobs/view/4430222448 , ,li-4430222448,fulltime,,,,,,False,mid-senior level,Science and Research,,,Biotechnology Research,https://de.linkedin.com/company/lebenskraftpur,,,,,,,,,,,
linkedin,wissenschaftliche*n Mitarbeiter*in (m/w/d) Maschinenbau/Computational Engineering,Ostfalia - University of Applied Sciences,"Wolfsburg, Lower Saxony, Germany",2026-06-24,https://www.linkedin.com/jobs/view/4432569923 , ,li-4432569923,fulltime,,,,,,False,entry level,"Research, Analyst, and Information Technology",,,Internet Publishing,https://de.linkedin.com/school/ostfalia---university-of-applied-sciences/,,,,,,,,,,,
linkedin,Wissenschaftliche*r Mitarbeiter*in (m/w/d) im Bereich Antimikrobielle Strategien,Hochschule Kaiserslautern,"Zweibrücken, Rhineland-Palatinate, Germany",2026-06-24,https://www.linkedin.com/jobs/view/4432856003 , ,li-4432856003,fulltime,,,,,,False,entry level,"Research, Analyst, and Information Technology",,,Internet Publishing,https://de.linkedin.com/school/hochschule-kaiserslautern/,,,,,,,,,,,
linkedin,"Physiker (m/w/d), Mathematiker (m/w/d) oder Ingenieur (m/w/d), vorzugsweise mit Promotion, für Algorithmen und Verfahren und deren Bewertung",Diehl Defence,"Überlingen, Baden-Württemberg, Germany",2026-06-24,https://www.linkedin.com/jobs/view/4430394459 , ,li-4430394459,fulltime,,,,,,False,mid-senior level,"Research, Analyst, and Information Technology",,,"Appliances, Electrical, and Electronics Manufacturing",https://de.linkedin.com/company/diehl-defence,,,,,,,,,,,
linkedin,"Developer R&D (m/w/d) - Specialty Ingredients, Trockensysteme, Formulierung & Trocknungstechnologien",DöhlerGroup,"Darmstadt, Hesse, Germany",2026-06-24,https://www.linkedin.com/jobs/view/4428921826 , ,li-4428921826,fulltime,,,,,,False,mid-senior level,"Research, Analyst, and Information Technology",,,Food and Beverage Manufacturing,https://de.linkedin.com/company/doehler,,,,,,,,,,,
linkedin,Wissenschaftliche*r Mitarbeiter*in (w/m/d) an der Professur für Allgemeine und Vergleichende Literaturwissenschaft,Universität Erfurt,"Erfurt, Thuringia, Germany",2026-06-24,https://www.linkedin.com/jobs/view/4432574822 , ,li-4432574822,fulltime,,,,,,False,entry level,"Research, Analyst, and Information Technology",,,Internet Publishing,https://de.linkedin.com/school/university-of-erfurt/,,,,,,,,,,,
linkedin,Wissenschaftliche*n Mitarbeiter*in (m/w/d) Forschungsbereich: Quantum Friction,Ruhr University Bochum,"Bochum, North Rhine-Westphalia, Germany",2026-06-24,https://www.linkedin.com/jobs/view/4432568932 , ,li-4432568932,fulltime,,,,,,False,entry level,"Research, Analyst, and Information Technology",,wpr@rub.de,Internet Publishing,https://de.linkedin.com/school/ruhrunibochum/,,,,,,,,,,,
linkedin,Wissenschaftliche*r Mitarbeiter*in (w/m/d) an der Professur für Geschichte der Materialitäten,Universität Erfurt,"Erfurt, Thuringia, Germany",2026-06-24,https://www.linkedin.com/jobs/view/4432579763 , ,li-4432579763,fulltime,,,,,,False,entry level,"Research, Analyst, and Information Technology",,,Internet Publishing,https://de.linkedin.com/school/university-of-erfurt/,,,,,,,,,,,
linkedin,Wissenschaftliche Mitarbeiterin / Wissenschaftlicher Mitarbeiter (w/m/d) – Regionaler sozioökonomischer Wandel,Deutsches Zentrum für Astrophysik gGmbH,"Görlitz, Saxony, Germany",2026-06-24,https://www.linkedin.com/jobs/view/4432530534 , ,li-4432530534,fulltime,,,,,,False,associate,Research,,,Research Services,https://de.linkedin.com/company/deutscheszentrumastrophysik,,,,,,,,,,,
linkedin,Technischer Assistent/Laborant (m/w/d) Prozesskontrolle,Richter BioLogics,"Bovenau, Schleswig-Holstein, Germany",2026-06-24,https://www.linkedin.com/jobs/view/4431871239 , ,li-4431871239,fulltime,,,,,,False,entry level,Production,,recruiting@richterbiologics.eu,Pharmaceutical Manufacturing,https://de.linkedin.com/company/richterbiologics,,,,,,,,,,,
linkedin,Data Science Team Leader,Just Eat Takeaway.com,"Berlin, Berlin, Germany",2026-06-24,https://www.linkedin.com/jobs/view/4417208617 , ,li-4417208617,fulltime,,,,,,False,not applicable,Information Technology,,,Software Development,https://nl.linkedin.com/company/just-eat-takeaway-com,,,,,,,,,,,
linkedin,"Exciting Postdoc/Research Assistant Opportunity in Deep Learning & Neuroimaging at the NAL Lab, University of Texas Health San Antonio",MICCAI Society,"Munich, Bavaria, Germany",2026-06-24,https://www.linkedin.com/jobs/view/4429831025 , ,li-4429831025,fulltime,,,,,,False,internship,"Research, Analyst, and Information Technology",,"habes@uthscsa.edu, habes@uthscsa.edu",Research,https://www.linkedin.com/company/miccai,,,,,,,,,,,
