site,title,company,location,date_posted,job_url,job_url_direct,id,job_type,salary_source,interval,min_amount,max_amount,currency,is_remote,job_level,job_function,listing_type,emails,company_industry,company_url,company_url_direct,company_addresses,company_num_employees,company_revenue,company_description,skills,experience_range,company_rating,company_reviews_count,vacancy_count,work_from_home_type
linkedin,Initativbewerbung Praktikum Data Science,ENERTRAG,"Berlin, Berlin, Germany",2026-06-10,https://www.linkedin.com/jobs/view/4426068954 , ,li-4426068954,internship,,,,,,False,internship,Information Technology,,,Renewable Energy Semiconductor Manufacturing,https://de.linkedin.com/company/enertrag,,,,,,,,,,,
linkedin,Werkstudent KI (m/w/d),Amprion GmbH,"Dortmund, North Rhine-Westphalia, Germany",2026-06-10,https://www.linkedin.com/jobs/view/4423159766 , ,li-4423159766,parttime,,,,,,False,internship,Administrative,,,Utilities,https://de.linkedin.com/company/amprion-gmbh,,,,,,,,,,,
linkedin,"Werkstudent im Bereich Data Engineering, Data Analytics und GenAI (m/w/d)",Allianz,"Unterföhring, Bavaria, Germany",2026-06-08,https://www.linkedin.com/jobs/view/4425484744 , ,li-4425484744,parttime,,,,,,False,internship,Administrative,,-operations@allianz.de,Financial Services and Insurance,https://de.linkedin.com/company/allianz,,,,,,,,,,,
linkedin,Internship Data science battery system,Volkswagen Group,,,https://www.linkedin.com/jobs/view/4394781741 , ,li-4394781741,fulltime,,,,,,False,internship,Information Technology,,,Motor Vehicle Manufacturing,https://de.linkedin.com/company/volkswagen-group,,,,,,,,,,,
linkedin,Intern Consultant Data Science and AI (m/f/d)*,Munich Re,"Munich, Bavaria, Germany",,https://www.linkedin.com/jobs/view/4369213399 , ,li-4369213399,fulltime,,,,,,True,internship,Information Technology,,,Insurance,https://de.linkedin.com/company/munich-re,,,,,,,,,,,
linkedin,Working Student Business Intelligence Finance (x|f|m),Sartorius,"Göttingen, Lower Saxony, Germany",,https://www.linkedin.com/jobs/view/4427952038 , ,li-4427952038,parttime,,,,,,True,internship,Education and Training,,,Biotechnology Research,https://de.linkedin.com/company/sartorius,,,,,,,,,,,
linkedin,Werkstudent Dokumentation und Datenmanagement,HBK - Hottinger Brüel & Kjær,"Göttingen, Lower Saxony, Germany",,https://www.linkedin.com/jobs/view/4359666359 , ,li-4359666359,parttime,,,,,,False,internship,Administrative,,,Industrial Machinery Manufacturing,https://uk.linkedin.com/company/hbkworld-test-and-measurement,,,,,,,,,,,
linkedin,Mandatory Bachelor/Master Thesis - Future Flight Operations Research m/f/d,Boeing,"Neu-Isenburg, Hesse, Germany",,https://www.linkedin.com/jobs/view/4414309066 , ,li-4414309066,fulltime,,,,,,False,not applicable,Education and Training,,,"Airlines and Aviation, Aviation and Aerospace Component Manufacturing, and Defense and Space Manufacturing",https://www.linkedin.com/company/boeing,,,,,,,,,,,
