site,title,company,location,date_posted,job_url,job_url_direct,id,job_type,salary_source,interval,min_amount,max_amount,currency,is_remote,job_level,job_function,listing_type,emails,company_industry,company_url,company_url_direct,company_addresses,company_num_employees,company_revenue,company_description,skills,experience_range,company_rating,company_reviews_count,vacancy_count,work_from_home_type
linkedin,Study Participants - Fully Remote (Essen),Prolific,"Essen, North Rhine-Westphalia, Germany",2026-04-17,https://www.linkedin.com/jobs/view/4403541759 , ,li-4403541759,temporary,,,,,,True,entry level,Education and Training,,,Software Development,https://uk.linkedin.com/company/prolific-com,,,,,,,,,,,
linkedin,Study Participants - Fully Remote (Nürnberg),Prolific,"Nuremberg, Bavaria, Germany",2026-04-17,https://www.linkedin.com/jobs/view/4403545710 , ,li-4403545710,temporary,,,,,,True,entry level,Education and Training,,,Software Development,https://uk.linkedin.com/company/prolific-com,,,,,,,,,,,
linkedin,Study Participants - Fully Remote (Cologne),Prolific,"Cologne, North Rhine-Westphalia, Germany",2026-04-17,https://www.linkedin.com/jobs/view/4403557447 , ,li-4403557447,temporary,,,,,,True,entry level,Education and Training,,,Software Development,https://uk.linkedin.com/company/prolific-com,,,,,,,,,,,
linkedin,Study Participants - Fully Remote (Stuttgart),Prolific,"Stuttgart, Baden-Württemberg, Germany",2026-04-17,https://www.linkedin.com/jobs/view/4403551620 , ,li-4403551620,temporary,,,,,,True,entry level,Education and Training,,,Software Development,https://uk.linkedin.com/company/prolific-com,,,,,,,,,,,
linkedin,Study Participants - Fully Remote (Berlin),Prolific,"Berlin, Germany",2026-04-17,https://www.linkedin.com/jobs/view/4403551612 , ,li-4403551612,temporary,,,,,,True,entry level,Education and Training,,,Software Development,https://uk.linkedin.com/company/prolific-com,,,,,,,,,,,
linkedin,Study Participants - Fully Remote (Düsseldorf),Prolific,"Düsseldorf, North Rhine-Westphalia, Germany",2026-04-17,https://www.linkedin.com/jobs/view/4403555537 , ,li-4403555537,temporary,,,,,,True,entry level,Education and Training,,,Software Development,https://uk.linkedin.com/company/prolific-com,,,,,,,,,,,
linkedin,Study Participants - Fully Remote (Frankfurt),Prolific,"Frankfurt, Hesse, Germany",2026-04-17,https://www.linkedin.com/jobs/view/4403556468 , ,li-4403556468,temporary,,,,,,True,entry level,Education and Training,,,Software Development,https://uk.linkedin.com/company/prolific-com,,,,,,,,,,,
linkedin,Study Participants - Fully Remote (Germany),Prolific,"Mannheim, Baden-Württemberg, Germany",2026-04-17,https://www.linkedin.com/jobs/view/4403542743 , ,li-4403542743,temporary,,,,,,True,entry level,Education and Training,,,Software Development,https://uk.linkedin.com/company/prolific-com,,,,,,,,,,,
linkedin,Wissenschaftliche/r Mitarbeiter/in (m/w/d) Professur Smart Systems Integration,Technische Universität Chemnitz,"Chemnitz, Saxony, Germany",2026-04-17,https://www.linkedin.com/jobs/view/4402720089 , ,li-4402720089,fulltime,,,,,,False,mid-senior level,"Research, Analyst, and Information Technology",,tina.kiessling@zfm.tu,Education Management,https://de.linkedin.com/school/technische-universitat-chemnitz/,,,,,,,,,,,
linkedin,Study Participants - Fully Remote (Bremen),Prolific,"Bremen, Bremen, Germany",2026-04-17,https://www.linkedin.com/jobs/view/4403542716 , ,li-4403542716,temporary,,,,,,True,entry level,Education and Training,,,Software Development,https://uk.linkedin.com/company/prolific-com,,,,,,,,,,,
linkedin,Wissenschaftliche/r Mitarbeiter/in (m/w/d) - Ökophysiologie der Marinen Wirbellosen,Universität Rostock,"Rostock, Mecklenburg-West Pomerania, Germany",2026-04-17,https://www.linkedin.com/jobs/view/4403421852 , ,li-4403421852,fulltime,,,,,,False,mid-senior level,"Research, Analyst, and Information Technology",,,Internet Publishing,https://de.linkedin.com/school/university-of-rostock/,,,,,,,,,,,
linkedin,Wissenschaftliche*r Mitarbeiter*in (w/m/d) im Lehrgebiet Neuere deutsche Literaturwissenschaft und Medienästhetik,FernUniversität in Hagen,"Hagen, North Rhine-Westphalia, Germany",2026-04-17,https://www.linkedin.com/jobs/view/4400871440 , ,li-4400871440,fulltime,,,,,,False,mid-senior level,"Research, Analyst, and Information Technology",,,Higher Education,https://de.linkedin.com/school/fernunihagen/,,,,,,,,,,,
linkedin,Wissenschaftliche:r Mitarbeiter:in  in der antiken Rechtsgeschichte,Friedrich Schiller University Jena,"Jena, Thuringia, Germany",2026-04-17,https://www.linkedin.com/jobs/view/4403501465 , ,li-4403501465,fulltime,,,,,,False,entry level,"Research, Analyst, and Information Technology",,,Internet Publishing,https://de.linkedin.com/school/friedrich-schiller-universit%C3%A4t-jena/,,,,,,,,,,,
linkedin,Data Scientist (Python & SQL) - Freelance AI Trainer,Mindrift,,2026-04-17,https://www.linkedin.com/jobs/view/4403189929 , ,li-4403189929,parttime,,,,,,False,mid-senior level,Other,,,IT Services and IT Consulting,https://www.linkedin.com/company/mindrift-ai,,,,,,,,,,,
linkedin,Data Scientist (Python & SQL) - Freelance AI Trainer,Mindrift,"Frankfurt am Main, Hesse, Germany",2026-04-17,https://www.linkedin.com/jobs/view/4403401177 , ,li-4403401177,parttime,,,,,,False,mid-senior level,Other,,,IT Services and IT Consulting,https://www.linkedin.com/company/mindrift-ai,,,,,,,,,,,
linkedin,Wissenschaftliche:r Mitarbeiter:in - Biomechanisches Enhancement und seine gesellschaftliche Einbettung (w/m/d),Forschungszentrum Jülich,"Jülich, North Rhine-Westphalia, Germany",2026-04-17,https://www.linkedin.com/jobs/view/4402366498 , ,li-4402366498,fulltime,,,,,,False,entry level,"Research, Analyst, and Information Technology",,,Research,https://de.linkedin.com/company/forschungszentrum-julich,,,,,,,,,,,
linkedin,(Junior) Datenanalyst (m/w/d) Betriebliche Altersversorgung,WTW,"Reutlingen, Baden-Württemberg, Germany",2026-04-17,https://www.linkedin.com/jobs/view/4390878665 , ,li-4390878665,fulltime,,,,,,False,entry level,Information Technology,,,Financial Services,https://uk.linkedin.com/company/wtwcorporate,,,,,,,,,,,
linkedin,"Associate Data Scientist (f,m,x)",IBM,"Munich, Bavaria, Germany",2026-04-17,https://www.linkedin.com/jobs/view/4400838414 , ,li-4400838414,fulltime,,,,,,False,entry level,Engineering and Information Technology,,,IT Services and IT Consulting,https://www.linkedin.com/company/ibm,,,,,,,,,,,
linkedin,Wirtschaftsinformatiker (m/w/d) für Controlling und Business Intelligence (BI),WeberHaus,"Rheinau, Baden-Württemberg, Germany",2026-04-17,https://www.linkedin.com/jobs/view/4395311046 , ,li-4395311046,fulltime,,,,,,False,associate,Information Technology,,,Building Construction,https://de.linkedin.com/company/weberhaus,,,,,,,,,,,
linkedin,AI and Data Integration & Modernization Analyst,Booz Allen Hamilton,"Stuttgart, Baden-Württemberg, Germany",2026-04-17,https://www.linkedin.com/jobs/view/4403533180 , ,li-4403533180,fulltime,,,,,,True,not applicable,Information Technology,,,Software Development,https://www.linkedin.com/company/booz-allen-hamilton,,,,,,,,,,,
linkedin,Child Care Infant Assistant Teacher,BrightPath Early Learning & Child Care,"Hamburg, Hamburg, Germany",2026-04-16,https://www.linkedin.com/jobs/view/4402186706 , ,li-4402186706,fulltime,,,,,,False,entry level,Education and Training,,,Individual and Family Services,https://ca.linkedin.com/company/brightpath-early-learning-inc,,,,,,,,,,,
linkedin,Akademische Mitarbeiterin / Akademischer Mitarbeiter (w/m/d),Karlsruhe Institute of Technology (KIT),"Karlsruhe, Baden-Württemberg, Germany",2026-04-16,https://www.linkedin.com/jobs/view/4403137712 , ,li-4403137712,fulltime,,,,,,False,mid-senior level,"Research, Analyst, and Information Technology",,,Higher Education,https://de.linkedin.com/school/kit/,,,,,,,,,,,
linkedin,Wissenschaftliche*r Mitarbeiter*in,Marburg University,"Marburg an der Lahn, Hesse, Germany",,https://www.linkedin.com/jobs/view/4405413380 , ,li-4405413380,fulltime,,,,,,False,mid-senior level,"Research, Analyst, and Information Technology",,,Internet Publishing,https://de.linkedin.com/school/philipps-universit-t-marburg/,,,,,,,,,,,
linkedin,Ph.D. Student / Junior Researcher in Agricultural and Resource Economics,Technische Universität München (Technical University of Munich),"Munich, Bavaria, Germany",,https://www.linkedin.com/jobs/view/4404488581 , ,li-4404488581,internship,,,,,,False,internship,Education and Training,,"jo.sauer@tum.de, maria.vrachioli@tum.de, fabian.frick@tum.de, fabian.frick@tum.de",Higher Education,https://de.linkedin.com/school/c446-deccan-m.ed-college-gulbarga/,,,,,,,,,,,
linkedin,Wissenschaftliche Mitarbeiter (m/w/d),Oppenhoff,"Munich, Bavaria, Germany",,https://www.linkedin.com/jobs/view/4405468463 , ,li-4405468463,internship,,,,,,False,internship,Legal,,,Law Practice,https://de.linkedin.com/company/oppenhoff,,,,,,,,,,,
linkedin,Doctoral Researcher in Organic Chemistry,Friedrich Schiller University Jena,"Jena, Thuringia, Germany",,https://www.linkedin.com/jobs/view/4405681105 , ,li-4405681105,fulltime,,,,,,False,entry level,"Research, Analyst, and Information Technology",,,Internet Publishing,https://de.linkedin.com/school/friedrich-schiller-universit%C3%A4t-jena/,,,,,,,,,,,
linkedin,Remote Biology Researcher (PhD),Turing,,,https://www.linkedin.com/jobs/view/4405432928 , ,li-4405432928,contract,,,,,,True,entry level,Information Technology,,,"Technology, Information and Media",https://www.linkedin.com/company/turingcom,,,,,,,,,,,
linkedin,Postdoctoral Researcher in advancing MINFLUX microscopy for microbial research,Friedrich Schiller University Jena,"Jena, Thuringia, Germany",,https://www.linkedin.com/jobs/view/4405676394 , ,li-4405676394,parttime,,,,,,False,internship,"Research, Analyst, and Information Technology",,,Internet Publishing,https://de.linkedin.com/school/friedrich-schiller-universit%C3%A4t-jena/,,,,,,,,,,,
linkedin,Wissenschaftliche*r Mitarbeiter*in (m/w/d),Stiftung Universität Hildesheim,"Hildesheim, Lower Saxony, Germany",,https://www.linkedin.com/jobs/view/4405666569 , ,li-4405666569,fulltime,,,,,,False,entry level,"Research, Analyst, and Information Technology",,,Internet Publishing,https://de.linkedin.com/school/stiftung-universitaet-hildesheim/,,,,,,,,,,,
linkedin,Übungsleiter Funktionstraining (w/m/d) für Wasser- und Trockengymnastik,Rheuma-Liga Berlin,"Berlin, Berlin, Germany",,https://www.linkedin.com/jobs/view/4402487961 , ,li-4402487961,contract,,,,,,False,entry level,Health Care Provider,,,Individual and Family Services,https://www.linkedin.com/company/rheuma-liga-berlin,,,,,,,,,,,
linkedin,Fresher Data Analyst,Joveo AI,,,https://www.linkedin.com/jobs/view/4405628698 , ,li-4405628698,fulltime,,,,,,True,not applicable,Engineering,,,Software Development,https://www.linkedin.com/company/joveo-ai,,,,,,,,,,,
linkedin,Assistenz in Schule (m/w/d),Martinsclub Bremen e.V.,"Bremen, Bremen, Germany",,https://www.linkedin.com/jobs/view/4404741088 , ,li-4404741088,fulltime,,,,,,False,entry level,Administrative,,,Civic and Social Organizations,https://de.linkedin.com/company/martinsclub-bremen,,,,,,,,,,,
linkedin,Principal Quantitative Scientist (m/f/d),Roche,"Penzberg, Bavaria, Germany",,https://www.linkedin.com/jobs/view/4383766325 , ,li-4383766325,fulltime,,,,,,False,associate,Information Technology,,,"Pharmaceutical Manufacturing, Biotechnology Research, and Medical Equipment Manufacturing",https://ch.linkedin.com/company/roche,,,,,,,,,,,
linkedin,Consulting Analyst,Visa,"Frankfurt, Hesse, Germany",,https://www.linkedin.com/jobs/view/4405651570 , ,li-4405651570,fulltime,,,,,,True,associate,Business Development and Sales,,,IT Services and IT Consulting,https://www.linkedin.com/company/visa,,,,,,,,,,,
linkedin,Data Analyst,NAXCON GROUP,"Weeze, North Rhine-Westphalia, Germany",,https://www.linkedin.com/jobs/view/4405615344 , ,li-4405615344,fulltime,,,,,,False,not applicable,Information Technology,,,Defense and Space Manufacturing,https://de.linkedin.com/company/naxcon,,,,,,,,,,,
linkedin,Data Analyst,Haystack,"Essen, North Rhine-Westphalia, Germany",,https://www.linkedin.com/jobs/view/4403217222 , ,li-4403217222,fulltime,,,,,,False,mid-senior level,Information Technology,,,"Technology, Information and Internet",https://uk.linkedin.com/company/wearehaystack,,,,,,,,,,,
linkedin,Senior Data Scientist,Adsquare,"Berlin, Germany",,https://www.linkedin.com/jobs/view/4402878255 , ,li-4402878255,fulltime,,,,,,True,mid-senior level,Advertising,,,Software Development and Advertising Services,https://de.linkedin.com/company/adsquare-gmbh,,,,,,,,,,,
linkedin,Duales Studium 2026: Bachelor of Science - Data Science & Künstliche Intelligenz Smart Operations,Ernst Klett Verlag,,,https://www.linkedin.com/jobs/view/4206017673 , ,li-4206017673,fulltime,,,,,,False,internship,"Research, Analyst, and Information Technology",,,Book and Periodical Publishing,https://de.linkedin.com/company/ernst-klett-verlag,,,,,,,,,,,
linkedin,Duales Studium Data Science und Künstliche Intelligenz B.Sc. 2026 (m/w/d),Viessmann Climate Solutions,"Allendorf, Hesse, Germany",,https://www.linkedin.com/jobs/view/4402865490 , ,li-4402865490,fulltime,,,,,,False,internship,Engineering and Information Technology,,,Industrial Machinery Manufacturing,https://de.linkedin.com/company/viessmannclimatesolutions,,,,,,,,,,,
linkedin,Wissenschaftliche/r Mitarbeiter/in,SimTech - Cluster of Excellence | University of Stuttgart,,,https://www.linkedin.com/jobs/view/4404769757 , ,li-4404769757,fulltime,,,,,,False,entry level,"Research, Analyst, and Information Technology",,"produktion@bwi.uni, produktion@bwi.uni",Research Services,https://de.linkedin.com/company/exzellenzcluster-simtech-university-stuttgart,,,,,,,,,,,
linkedin,Wissenschaftliche Mitarbeiter/ Rechtsreferendare Tax (m/w/d),Grant Thornton Germany,"Düsseldorf, North Rhine-Westphalia, Germany",,https://www.linkedin.com/jobs/view/4378361666 , ,li-4378361666,fulltime,,,,,,False,entry level,Consulting,,karriere@de.gt.com,Legal Services and Business Consulting and Services,https://de.linkedin.com/company/grant-thornton-germany,,,,,,,,,,,
linkedin,Wissenschaftliche/r Mitarbeiter/in,SFB 1313 | University of Stuttgart,,,https://www.linkedin.com/jobs/view/4403231936 , ,li-4403231936,fulltime,,,,,,False,entry level,"Research, Analyst, and Information Technology",,produktion@bwi.uni,Research,https://de.linkedin.com/company/sfb-1313,,,,,,,,,,,
linkedin,Wissenschaftliche:r Mitarbeiter:in / Postdoktorand:in,Friedrich Schiller University Jena,"Jena, Thuringia, Germany",,https://www.linkedin.com/jobs/view/4405681149 , ,li-4405681149,fulltime,,,,,,False,internship,"Research, Analyst, and Information Technology",,,Internet Publishing,https://de.linkedin.com/school/friedrich-schiller-universit%C3%A4t-jena/,,,,,,,,,,,
linkedin,Wissenschaftliche/-n Mitarbeiter/-in (Doktorand/-in / Postdoktorand/-in m/w/d),Land Niedersachsen,,,https://www.linkedin.com/jobs/view/4402140752 , ,li-4402140752,fulltime,,,,,,False,entry level,"Research, Analyst, and Information Technology",,,Government Administration,https://de.linkedin.com/company/arbeitgeber-niedersachsen,,,,,,,,,,,
linkedin,Wissenschaftliche Hilfskraft im Bereich Aufbereitung & Visualisierung von Projektinhalten,Fraunhofer IML,"Dortmund, North Rhine-Westphalia, Germany",,https://www.linkedin.com/jobs/view/4404791081 , ,li-4404791081,fulltime,,,,,,False,internship,"Research, Analyst, and Information Technology",,"malin.gerhardt@iml.fraunhofer.de, andrea.raida@iml.fraunhofer.de",Research Services,https://de.linkedin.com/company/fraunhofer-iml,,,,,,,,,,,
linkedin,PhD Researcher – Numerical Methods for Photonic High-Performance Computing,SimTech - Cluster of Excellence | University of Stuttgart,,,https://www.linkedin.com/jobs/view/4404791398 , ,li-4404791398,contract,,,,,,False,internship,"Research, Analyst, and Information Technology",,"gebert@hlrs.de, bewerbungen@hlrs.de, gebert@hlrs.de",Research Services,https://de.linkedin.com/company/exzellenzcluster-simtech-university-stuttgart,,,,,,,,,,,
linkedin,EIC Research Analyst,Cushman & Wakefield,"Berlin, Berlin, Germany",,https://www.linkedin.com/jobs/view/4405674165 , ,li-4405674165,fulltime,,,,,,False,entry level,"Research, Analyst, and Information Technology",,,Real Estate,https://www.linkedin.com/company/cushman-&-wakefield,,,,,,,,,,,
linkedin,Wissenschaftliche/r Mitarbeiter/in (w/m/d) - Fokus Entwicklungsmanagement,RWTH Aachen University,"Aachen, North Rhine-Westphalia, Germany",,https://www.linkedin.com/jobs/view/4405820132 , ,li-4405820132,fulltime,,,,,,False,entry level,"Research, Analyst, and Information Technology",,,Research Services,https://de.linkedin.com/school/rwth-aachen-university/,,,,,,,,,,,
linkedin,Wissenschaftliche*r Mitarbeiter*in: Additive Fertigung/ Gießereitechnik,Fraunhofer IGCV,"Munich, Bavaria, Germany",,https://www.linkedin.com/jobs/view/4404770427 , ,li-4404770427,fulltime,,,,,,False,entry level,"Research, Analyst, and Information Technology",,daniel.guenther@igcv.fraunhofer.de,Research Services,https://de.linkedin.com/company/fraunhofer-igcv,,,,,,,,,,,
linkedin,Audio Machine Learning Co-op,Bose Corporation,"Stuttgart, Baden-Württemberg, Germany",,https://www.linkedin.com/jobs/view/4363219555 , ,li-4363219555,fulltime,,,,,,False,internship,Engineering and Information Technology,,_accommodationrequest@bose.com,Computers and Electronics Manufacturing,https://www.linkedin.com/company/bose-corporation,,,,,,,,,,,
linkedin,Audio Machine Learning Co-op,Bose Corporation,,,https://www.linkedin.com/jobs/view/4363248986 , ,li-4363248986,fulltime,,,,,,False,internship,Engineering and Information Technology,,_accommodationrequest@bose.com,Computers and Electronics Manufacturing,https://www.linkedin.com/company/bose-corporation,,,,,,,,,,,
linkedin,Wissenschaftliche*r Mitarbeiter*in,BECK Stellenmarkt,"Göttingen, Lower Saxony, Germany",,https://www.linkedin.com/jobs/view/4405604914 , ,li-4405604914,parttime,,,,,,False,entry level,Legal,,anja.zellner@jura.uni,Legal Services,https://www.linkedin.com/showcase/beck-stellenmarkt/,,,,,,,,,,,
linkedin,Wissenschaftliche/r Mitarbeiter/in (w/m/d) – Systemidentifikation unbemannter Flugsyteme,RWTH Aachen University,"Aachen, North Rhine-Westphalia, Germany",,https://www.linkedin.com/jobs/view/4405820131 , ,li-4405820131,fulltime,,,,,,False,entry level,"Research, Analyst, and Information Technology",,,Research Services,https://de.linkedin.com/school/rwth-aachen-university/,,,,,,,,,,,
