site,title,company,location,date_posted,job_url,job_url_direct,id,job_type,salary_source,interval,min_amount,max_amount,currency,is_remote,job_level,job_function,listing_type,emails,company_industry,company_url,company_url_direct,company_addresses,company_num_employees,company_revenue,company_description,skills,experience_range,company_rating,company_reviews_count,vacancy_count,work_from_home_type
linkedin,Wissenschaftliche*n Mitarbeiter*in / PostDoc (m/w/d),Ruhr University Bochum,"Bochum, North Rhine-Westphalia, Germany",2026-06-08,https://www.linkedin.com/jobs/view/4425613315 , ,li-4425613315,fulltime,,,,,,False,entry level,"Research, Analyst, and Information Technology",,wpr@rub.de,Internet Publishing,https://de.linkedin.com/school/ruhrunibochum/,,,,,,,,,,,
linkedin,Wissenschaftliche*r Mitarbeiter*innen / Doktorand*innen / Post-Doktorand*innen (m/w/d) für den Lehrstuhl für Entrepreneurship und innovative Geschäftsmodelle (2x 100% TV-L E13),Ruhr University Bochum,"Bochum, North Rhine-Westphalia, Germany",2026-06-08,https://www.linkedin.com/jobs/view/4425606440 , ,li-4425606440,fulltime,,,,,,False,mid-senior level,"Research, Analyst, and Information Technology",,wpr@rub.de,Internet Publishing,https://de.linkedin.com/school/ruhrunibochum/,,,,,,,,,,,
linkedin,Free Tool for Job Seekers: AI Interview Research Assistant (Sales/BD Roles),Same,,2026-06-08,https://www.linkedin.com/jobs/view/4421596953 , ,li-4421596953,fulltime,,,,,,False,entry level,Science,,,IT Services and IT Consulting,https://de.linkedin.com/company/addsame,,,,,,,,,,,
linkedin,"Wissenschaftliche/r Mitarbeiter/in (m/w/d) Professur Analytik an Festkörperoberflächen, Professur Simulation naturwissenschaftlicher Prozesse",Technische Universität Chemnitz,"Chemnitz, Saxony, Germany",2026-06-08,https://www.linkedin.com/jobs/view/4425256138 , ,li-4425256138,fulltime,,,,,,False,mid-senior level,"Research, Analyst, and Information Technology",,compphys@physik.tu,Education Management,https://de.linkedin.com/school/technische-universitat-chemnitz/,,,,,,,,,,,
linkedin,Wiss. MitarbeiterIn Erhebungsbetrieb (MAS) - Arztpraxen und ambulante Zentren,Swiss Federal Statistical Office FSO,"Neuenburg, Baden-Württemberg, Germany",2026-06-08,https://www.linkedin.com/jobs/view/4425538379 , ,li-4425538379,fulltime,,,,,,False,mid-senior level,"Research, Analyst, and Information Technology",,,Government Administration,https://ch.linkedin.com/company/statdatach,,,,,,,,,,,
linkedin,Founding Product Designer & Researcher,Stackgini,"Berlin, Berlin, Germany",2026-06-08,https://www.linkedin.com/jobs/view/4421901638 , ,li-4421901638,fulltime,,,,,,False,associate,Art/Creative,,,IT Services and IT Consulting,https://de.linkedin.com/company/getstackgini,,,,,,,,,,,
linkedin,Tracking Spezialist Google Ads (w/m/x) gesucht!,Die SEA-Experten,"Berlin, Berlin, Germany",2026-06-08,https://www.linkedin.com/jobs/view/4421994100 , ,li-4421994100,fulltime,,,,,,False,associate,Marketing,,,Advertising Services,https://de.linkedin.com/company/sea-experten,,,,,,,,,,,
linkedin,PhD candidate (all genders) in medical physics research,Universitätsklinikum Hamburg Eppendorf,"Hamburg, Hamburg, Germany",2026-06-07,https://www.linkedin.com/jobs/view/4418709125 , ,li-4418709125,fulltime,,,,,,False,internship,"Research, Analyst, and Information Technology",,e.gargioni@uke.de,Hospitals and Health Care,https://de.linkedin.com/company/universit-tsklinikum-hamburg-eppendorf,,,,,,,,,,,
linkedin,Data Scientist (Marketing) (m/w/d),XXXLdigital – Part of XXXL Group,"Würzburg, Bavaria, Germany",2026-06-06,https://www.linkedin.com/jobs/view/4397573215 , ,li-4397573215,fulltime,,,,,,True,associate,"Other, Information Technology, and Engineering",,,IT Services and IT Consulting,https://at.linkedin.com/company/xxxldigital,,,,,,,,,,,
linkedin,Scientific Founder’s Associate (MD / PhD / comparable),Noah Labs,"Berlin, Berlin, Germany",2026-06-06,https://www.linkedin.com/jobs/view/4421564016 , ,li-4421564016,fulltime,,,,,,True,entry level,Science,,,Software Development,https://de.linkedin.com/company/noah-labs,,,,,,,,,,,
linkedin,"Doctoral Researcher in Electoral Behavior, Inequality, and Climate Change Policies",University of Konstanz,"Constance, Baden-Württemberg, Germany",2026-06-05,https://www.linkedin.com/jobs/view/4424784010 , ,li-4424784010,parttime,,,,,,False,internship,"Research, Analyst, and Information Technology",,,Internet Publishing,https://de.linkedin.com/school/university-of-konstanz/,,,,,,,,,,,
linkedin,"Wissenschaftliche*r Mitarbeiter*in (w/m/d) am Lehrstuhl für Bürgerliches Recht, Arbeitsrecht und Rechtsvergleichung",FernUniversität in Hagen,"Hagen, North Rhine-Westphalia, Germany",2026-06-05,https://www.linkedin.com/jobs/view/4421176824 , ,li-4421176824,fulltime,,,,,,False,entry level,"Research, Analyst, and Information Technology",,,Higher Education,https://de.linkedin.com/school/fernunihagen/,,,,,,,,,,,
linkedin,Applied ML Researcher - Fully Remote | Upto $90/hr,Mercor,"Berlin, Berlin, Germany",,https://www.linkedin.com/jobs/view/4426698860 , ,li-4426698860,parttime,,,,,,True,not applicable,Other,,support@mercor.com,Software Development,https://www.linkedin.com/company/mercor-ai,,,,,,,,,,,
linkedin,Wissenschaftliche/-r Mitarbeiter/-in (m/w/d/x) in Botanik (Pflanzentaxonomie/Pflanzenphysiologie),Leipzig University,"Leipzig, Saxony, Germany",,https://www.linkedin.com/jobs/view/4427609490 , ,li-4427609490,fulltime,,,,,,False,mid-senior level,"Research, Analyst, and Information Technology",,,Internet Publishing,https://de.linkedin.com/school/university-of-leipzig/,,,,,,,,,,,
linkedin,AI Researcher,Jobgether,,,https://www.linkedin.com/jobs/view/4426976432 , ,li-4426976432,fulltime,,,,,,True,mid-senior level,Engineering and Information Technology,,,Internet Marketplace Platforms,https://be.linkedin.com/company/jobgether,,,,,,,,,,,
linkedin,"Wissenschaftliche*r Mitarbeiter*in (m/w/d) (EG 13 TV-L) - Rechtswissenschaften - Teilzeit (65 %9), 3 Jahre",SimTech - Cluster of Excellence | University of Stuttgart,,,https://www.linkedin.com/jobs/view/4426970043 , ,li-4426970043,fulltime,,,,,,False,entry level,"Research, Analyst, and Information Technology",,marc.zeccola@ivr.uni.stuttgart.de,Research Services,https://de.linkedin.com/company/exzellenzcluster-simtech-university-stuttgart,,,,,,,,,,,
linkedin,Wissenschaftliche/r Mitarbeiter/in (m/w/d) - Neuere deutsche Literaturwissenschaft des 20. Jahrhunderts,Universität Rostock,"Rostock, Mecklenburg-West Pomerania, Germany",,https://www.linkedin.com/jobs/view/4427923888 , ,li-4427923888,fulltime,,,,,,False,entry level,"Research, Analyst, and Information Technology",,,Internet Publishing,https://de.linkedin.com/school/university-of-rostock/,,,,,,,,,,,
linkedin,Post-doctoral position on coastal sea level rise from novel satellite observations and machine learning,Technische Universität München (Technical University of Munich),"Munich, Bavaria, Germany",,https://www.linkedin.com/jobs/view/4426697175 , ,li-4426697175,fulltime,,,,,,True,internship,"Research, Analyst, and Information Technology",,"ai4eo@tum.de, ai4eo@tum.de",Higher Education,https://de.linkedin.com/school/c446-deccan-m.ed-college-gulbarga/,,,,,,,,,,,
linkedin,Data Collector,TSMG Holding,"Stuttgart, Baden-Württemberg, Germany",,https://www.linkedin.com/jobs/view/4427996815 , ,li-4427996815,internship,,,,,,False,not applicable,Accounting/Auditing and Finance,,,IT Services and IT Consulting,https://pl.linkedin.com/company/tsmg-holding,,,,,,,,,,,
linkedin,Referent Datenqualität m/w/d,TEN Thüringer Energienetze GmbH & CO. KG,"Erfurt, Thuringia, Germany",,https://www.linkedin.com/jobs/view/4385949136 , ,li-4385949136,fulltime,,,,,,False,associate,Business Development and Sales,,,Utilities,https://de.linkedin.com/company/ten-th%C3%BCringer-energienetze-gmbh,,,,,,,,,,,
linkedin,Fachkraft (m/w/d) Klassenassistenz Modellprojekt Seebergschule,Johanniter GmbH,"Viernheim, Hesse, Germany",,https://www.linkedin.com/jobs/view/4426935688 , ,li-4426935688,parttime,,,,,,False,entry level,Other,,,Hospitals and Health Care,https://de.linkedin.com/company/johanniter-gmbh,,,,,,,,,,,
linkedin,Data Analyst,Haystack,"Hesse, Germany",,https://www.linkedin.com/jobs/view/4424839900 , ,li-4424839900,fulltime,,,,,,False,mid-senior level,Information Technology,,,"Technology, Information and Internet",https://uk.linkedin.com/company/wearehaystack,,,,,,,,,,,
linkedin,Product Line Analyst,Amcor,"Neumünster, Schleswig-Holstein, Germany",,https://www.linkedin.com/jobs/view/4427545875 , ,li-4427545875,fulltime,,,,,,False,entry level,"Research, Analyst, and Information Technology",,,Packaging and Containers Manufacturing,https://ch.linkedin.com/company/amcor,,,,,,,,,,,
linkedin,Data Analyst,TestYantra software solutions,"Böblingen, Baden-Württemberg, Germany",,https://www.linkedin.com/jobs/view/4426936011 , ,li-4426936011,fulltime,,,,,,False,mid-senior level,Supply Chain and Other,,,IT Services and IT Consulting,https://www.linkedin.com/company/testyantra-software-solutions,,,,,,,,,,,
linkedin,Data Scientist - Public Sektor / Defense (m/w/d),IBM,"Magdeburg, Saxony-Anhalt, Germany",,https://www.linkedin.com/jobs/view/4414000616 , ,li-4414000616,fulltime,,,,,,False,mid-senior level,Engineering and Information Technology,,,IT Services and IT Consulting,https://www.linkedin.com/company/ibm,,,,,,,,,,,
linkedin,Data Analyst (all gender),ALTEN Germany,"Weeze, North Rhine-Westphalia, Germany",,https://www.linkedin.com/jobs/view/4387268593 , ,li-4387268593,fulltime,,,,,,False,associate,Engineering and Information Technology,,,Defense and Space Manufacturing,https://de.linkedin.com/company/altengermany,,,,,,,,,,,
linkedin,Wissenschaftliche/r Mitarbeiter/in am Lehrstuhl für Öffentliches Recht und Rechtsphilosophie (m/w/d),FAU Erlangen-Nürnberg,"Erlangen, Bavaria, Germany",,https://www.linkedin.com/jobs/view/4427987662 , ,li-4427987662,fulltime,,,,,,False,entry level,"Research, Analyst, and Information Technology",,,Research Services,https://de.linkedin.com/school/fau-erlangen-n%C3%BCrnberg/,,,,,,,,,,,
linkedin,Studentische/Wissenschaftliche Hilfskraft (m/w/d) im Projekt FIT@THGA,Technische Hochschule Georg Agricola,"Bochum, North Rhine-Westphalia, Germany",,https://www.linkedin.com/jobs/view/4427983192 , ,li-4427983192,fulltime,,,,,,False,entry level,"Research, Analyst, and Information Technology",,"International.office@thga.de, International.office@thga.de",Internet Publishing,https://www.linkedin.com/school/technische-hochschule-georg-agricola/,,,,,,,,,,,
linkedin,Akademischer Mitarbeiter (m/w/d) für Mathematik und Mathematikdidaktik mit Schwerpunkt Lehre,Pädagogische Hochschule Ludwigsburg,"Ludwigsburg, Baden-Württemberg, Germany",,https://www.linkedin.com/jobs/view/4427607471 , ,li-4427607471,fulltime,,,,,,False,entry level,"Research, Analyst, and Information Technology",,,Internet Publishing,https://de.linkedin.com/school/p%C3%A4dagogische-hochschule-ludwigsburg/,,,,,,,,,,,
linkedin,Wissenschaftliche:r Mitarbeiter:in oder/und Doktorand:in (d/m/w) für Digitale Zwillinge und Echtzeit-Simulationen von Energiesystemen im Projekt BISS,Bonn-Rhein-Sieg University of Applied Sciences,"Sankt Augustin, North Rhine-Westphalia, Germany",,https://www.linkedin.com/jobs/view/4415792643 , ,li-4415792643,fulltime,,,,,,False,entry level,"Research, Analyst, and Information Technology",,,Higher Education,https://de.linkedin.com/school/hochschule-bonn-rhein-sieg/,,,,,,,,,,,
linkedin,Wissenschaftliche:r Mitarbeiter:in - Postdoc (m/w/d),Universitätsklinikum Leipzig AöR,"Leipzig, Saxony, Germany",,https://www.linkedin.com/jobs/view/4426921681 , ,li-4426921681,fulltime,,,,,,False,internship,"Research, Analyst, and Information Technology",,nicole.modler@medizin.uni,Hospitals and Health Care,https://de.linkedin.com/company/universit%C3%A4tsklinikum-leipzig,,,,,,,,,,,
