site,title,company,location,date_posted,job_url,job_url_direct,id,job_type,salary_source,interval,min_amount,max_amount,currency,is_remote,job_level,job_function,listing_type,emails,company_industry,company_url,company_url_direct,company_addresses,company_num_employees,company_revenue,company_description,skills,experience_range,company_rating,company_reviews_count,vacancy_count,work_from_home_type
linkedin,Research Assistant Position (f/m/d) (Ref. 26/12),Forschungsverbund Berlin e.V.,"Berlin, Berlin, Germany",2026-06-15,https://www.linkedin.com/jobs/view/4425752914 , ,li-4425752914,fulltime,,,,,,False,mid-senior level,Research,,,Research Services,https://de.linkedin.com/company/forschungsverbund-berlin,,,,,,,,,,,
linkedin,Data Scientist / AI Consultant (m/w/d),IBM,"Munich, Bavaria, Germany",2026-06-15,https://www.linkedin.com/jobs/view/4426406296 , ,li-4426406296,fulltime,,,,,,False,mid-senior level,Engineering and Information Technology,,,IT Services and IT Consulting,https://www.linkedin.com/company/ibm,,,,,,,,,,,
linkedin,Wiss. Mitarbeiter*in (w/m/d) im Forschungsprojekt zur Evaluation des 9a SGB VIII (DM-753),Freie Universität Berlin,"Berlin, Berlin, Germany",2026-06-15,https://www.linkedin.com/jobs/view/4425760255 , ,li-4425760255,parttime,,,,,,False,entry level,"Research, Analyst, and Information Technology",,,Research Services,https://de.linkedin.com/school/freie-universitat-berlin/,,,,,,,,,,,
linkedin,Wissenschaftliche*n Mitarbeiter*in (m/w/d) am Lehrstuhl für Produktionssysteme (LPS) für das Themenfeld Geschäftsmodelle der Circular Economy,Ruhr University Bochum,"Bochum, North Rhine-Westphalia, Germany",2026-06-15,https://www.linkedin.com/jobs/view/4428844815 , ,li-4428844815,fulltime,,,,,,False,entry level,"Research, Analyst, and Information Technology",,wpr@rub.de,Internet Publishing,https://de.linkedin.com/school/ruhrunibochum/,,,,,,,,,,,
linkedin,Wiss. Mitarbeiter*in (Praedoc) (w/m/d) mit 50%-Teilzeitbeschäftigung befristet bis zu 3 Jahre Entgeltgruppe 14 TV-L FU Kennung: VM-Praedoc-WE02,Freie Universität Berlin,"Berlin, Berlin, Germany",2026-06-15,https://www.linkedin.com/jobs/view/4425753366 , ,li-4425753366,fulltime,,,,,,False,entry level,"Research, Analyst, and Information Technology",,physiologie@vetmed.fu,Research Services,https://de.linkedin.com/school/freie-universitat-berlin/,,,,,,,,,,,
linkedin,Researcher (f/m/d),Zuse Institute Berlin,"Berlin, Berlin, Germany",2026-06-15,https://www.linkedin.com/jobs/view/4425773176 , ,li-4425773176,contract,,,,,,False,associate,Science and Research,,spiegel@zib.de,Business Consulting and Services,https://de.linkedin.com/company/zuse-institute-berlin,,,,,,,,,,,
linkedin,Wissenschaftlicher Mitarbeiter mit akademischem Abschluss,GMBU,"Jena, Thuringia, Germany",2026-06-15,https://www.linkedin.com/jobs/view/4425759842 , ,li-4425759842,fulltime,,,,,,False,entry level,Science,,,Research Services,https://www.linkedin.com/company/gmbu,,,,,,,,,,,
linkedin,Grundsatzsachbearbeitung (w/m/d) für Datenschutz,Land Niedersachsen,"Hannover, Lower Saxony, Germany",2026-06-15,https://www.linkedin.com/jobs/view/4427702155 , ,li-4427702155,fulltime,,,,,,False,entry level,Other,,,Government Administration,https://de.linkedin.com/company/arbeitgeber-niedersachsen,,,,,,,,,,,
linkedin,(Senior) Consultant* – Analytics & Survey Development,Mercer,"Düsseldorf, North Rhine-Westphalia, Germany",2026-06-15,https://www.linkedin.com/jobs/view/4378789517 , ,li-4378789517,fulltime,,,,,,True,not applicable,Business Development and Sales,,sabine.rakoniewski@marsh.com,Insurance and Business Consulting and Services,https://www.linkedin.com/company/mercer,,,,,,,,,,,
linkedin,Chemielaboranten (m/w/d),Wasserburger Arzneimittelwerk GmbH,"Zwickau, Saxony, Germany",2026-06-15,https://www.linkedin.com/jobs/view/4425767868 , ,li-4425767868,fulltime,,,,,,False,entry level,Other,,,Pharmaceutical Manufacturing,https://www.linkedin.com/company/wasserburger-arzneimittelwerk-gmbh,,,,,,,,,,,
linkedin,Chemielaboranten (m/w/d),Recipharm,"Zwickau, Saxony, Germany",2026-06-15,https://www.linkedin.com/jobs/view/4427491974 , ,li-4427491974,fulltime,,,,,,False,entry level,Other,,,Pharmaceutical Manufacturing,https://se.linkedin.com/company/recipharm,,,,,,,,,,,
linkedin,"Senior Data Scientist, Retail Media (m/f/d)",Redcare Pharmacy,"Cologne, North Rhine-Westphalia, Germany",2026-06-15,https://www.linkedin.com/jobs/view/4425777274 , ,li-4425777274,fulltime,,,,,,True,mid-senior level,Analyst,,,Software Development and IT Services and IT Consulting,https://nl.linkedin.com/company/redcare-pharmacy-com,,,,,,,,,,,
linkedin,Senior Data Scientist with focus Biomarker research (f/m/d - part/full-time),Staburo GmbH,"Munich, Bavaria, Germany",2026-06-15,https://www.linkedin.com/jobs/view/4425788272 , ,li-4425788272,fulltime,,,,,,True,associate,Science,,application@staburo.de,Hospitals and Health Care,https://de.linkedin.com/company/staburo-gmbh,,,,,,,,,,,
linkedin,Wiss. Mitarbeiter*in (Praedoc) (w/m/d) mit 65%-Teilzeitbeschäftigung befristet auf 4 Jahre Entgeltgruppe 13 TV-L FU Kennung: FG/C3_Praedoc,Freie Universität Berlin,"Berlin, Berlin, Germany",2026-06-15,https://www.linkedin.com/jobs/view/4426404264 , ,li-4426404264,fulltime,,,,,,False,mid-senior level,"Research, Analyst, and Information Technology",,,Research Services,https://de.linkedin.com/school/freie-universitat-berlin/,,,,,,,,,,,
linkedin,Postdoc / Researcher / Projektleitung Wirtschaftswissenschaften Sozialwissenschaften (m/w/d),DRK Blutspendedienst Nord-Ost gemeinnützige GmbH,"Berlin, Berlin, Germany",2026-06-15,https://www.linkedin.com/jobs/view/4428827728 , ,li-4428827728,parttime,,,,,,False,mid-senior level,"Research, Analyst, and Information Technology",,,Hospitals and Health Care,https://de.linkedin.com/company/drk-blutspendedienst-nord-ost,,,,,,,,,,,
linkedin,Research assistant (Praedoc) (f/m/d) mit 65%-Teilzeitbeschäftigung limited to 4 years salary grade (Entgeltgruppe) 13 TV-L FU referencecode: FG/C3_Praedoc,Freie Universität Berlin,"Berlin, Berlin, Germany",2026-06-15,https://www.linkedin.com/jobs/view/4425796575 , ,li-4425796575,parttime,,,,,,False,internship,"Research, Analyst, and Information Technology",,politik@oei.fu,Research Services,https://de.linkedin.com/school/freie-universitat-berlin/,,,,,,,,,,,
linkedin,Wissenschaftlicher Mitarbeiter Statistik / Quantitative Methoden / Datenanalyse remote (m/w/d),Deutsches Promotionszentrum,"Bonn, North Rhine-Westphalia, Germany",2026-06-15,https://www.linkedin.com/jobs/view/4428847926 , ,li-4428847926,fulltime,,,,,,True,entry level,Consulting,,,Business Consulting and Services,https://www.linkedin.com/company/deutsches-promotionszentrum,,,,,,,,,,,
linkedin,Wiss. Mitarbeiter*in (Praedoc) (m/w/d) mit 75%-Teilzeitbeschäftigung befristet auf 4 Jahre Entgeltgruppe 13 TV-L FU Kennung: AllgMet-PraeDoc-ERC 03,Freie Universität Berlin,"Berlin, Berlin, Germany",2026-06-15,https://www.linkedin.com/jobs/view/4425745449 , ,li-4425745449,fulltime,,,,,,False,mid-senior level,"Research, Analyst, and Information Technology",,,Research Services,https://de.linkedin.com/school/freie-universitat-berlin/,,,,,,,,,,,
linkedin,Wissenschaftliche/r Mitarbeiter/in (m/w/d) - Anorganische Chemie,Universität Rostock,"Rostock, Mecklenburg-West Pomerania, Germany",2026-06-15,https://www.linkedin.com/jobs/view/4429114333 , ,li-4429114333,fulltime,,,,,,False,mid-senior level,"Research, Analyst, and Information Technology",,,Internet Publishing,https://de.linkedin.com/school/university-of-rostock/,,,,,,,,,,,
linkedin,Wissenschaftliche*n Mitarbeiter*in (m/w/d) (65%) (TV-L E13) im TP C04 »Normative Bildräume und virtueller sensus communis« (UP C04.2),Ruhr University Bochum,"Bochum, North Rhine-Westphalia, Germany",2026-06-15,https://www.linkedin.com/jobs/view/4428857240 , ,li-4428857240,fulltime,,,,,,False,entry level,"Research, Analyst, and Information Technology",,wpr@rub.de,Internet Publishing,https://de.linkedin.com/school/ruhrunibochum/,,,,,,,,,,,
linkedin,Wissenschaftliche*n Mitarbeiter*in (m/w/d),Ruhr University Bochum,"Bochum, North Rhine-Westphalia, Germany",2026-06-15,https://www.linkedin.com/jobs/view/4428844799 , ,li-4428844799,fulltime,,,,,,False,entry level,"Research, Analyst, and Information Technology",,wpr@rub.de,Internet Publishing,https://de.linkedin.com/school/ruhrunibochum/,,,,,,,,,,,
linkedin,Studentische:r Assistent:in,Friedrich Schiller University Jena,"Jena, Thuringia, Germany",2026-06-15,https://www.linkedin.com/jobs/view/4428839809 , ,li-4428839809,fulltime,,,,,,False,internship,Other,,,Internet Publishing,https://de.linkedin.com/school/friedrich-schiller-universit%C3%A4t-jena/,,,,,,,,,,,
linkedin,Photo data collector with a car,TSMG Holding,"Leipzig, Saxony, Germany",2026-06-15,https://www.linkedin.com/jobs/view/4428806420 , ,li-4428806420,fulltime,,,,,,False,not applicable,Accounting/Auditing and Finance,,,IT Services and IT Consulting,https://pl.linkedin.com/company/tsmg-holding,,,,,,,,,,,
linkedin,Staff Researcher - Market Research,PayPal,"Berlin, Berlin, Germany",2026-06-15,https://www.linkedin.com/jobs/view/4410008417 , ,li-4410008417,fulltime,,,,,,False,not applicable,Other,,paypalglobaltalentacquisition@paypal.com,Software Development,https://www.linkedin.com/company/paypal,,,,,,,,,,,
linkedin,"Junior-Berater*in und Datenanalyst*in im Sektorvorhaben ""Daten in der Entwicklungszusammenarbeit""",GIZ Viet Nam,"Bonn, North Rhine-Westphalia, Germany",2026-06-15,https://www.linkedin.com/jobs/view/4428832695 , ,li-4428832695,fulltime,,,,,,False,entry level,Other,,,International Trade and Development,https://vn.linkedin.com/company/gizvietnam,,,,,,,,,,,
linkedin,Labormitarbeiter (w/m/d) Präanalytik und Analytik,IDEXX,"Leipzig, Saxony, Germany",2026-06-14,https://www.linkedin.com/jobs/view/4409516215 , ,li-4409516215,fulltime,,,,,,False,not applicable,"Research, Analyst, and Information Technology",,karriere@idexx.com,"Biotechnology Research, IT Services and IT Consulting, and Veterinary Services",https://www.linkedin.com/company/idexx-laboratories,,,,,,,,,,,
linkedin,Wissenschaftliche/r Mitarbeiter/in (m/w/d) am Schöller-Stiftungslehrstuhl für Wirtschaftsinformatik,FAU Erlangen-Nürnberg,"Nuremberg, Bavaria, Germany",2026-06-13,https://www.linkedin.com/jobs/view/4428382001 , ,li-4428382001,fulltime,,,,,,False,entry level,"Research, Analyst, and Information Technology",,,Research Services,https://de.linkedin.com/school/fau-erlangen-n%C3%BCrnberg/,,,,,,,,,,,
linkedin,Wissenschaftliche/r Mitarbeiter/in Verfassungsrecht Öffentliches Recht (m/w/d),FAU Erlangen-Nürnberg,"Erlangen, Bavaria, Germany",2026-06-13,https://www.linkedin.com/jobs/view/4428358958 , ,li-4428358958,fulltime,,,,,,False,entry level,"Research, Analyst, and Information Technology",,,Research Services,https://de.linkedin.com/school/fau-erlangen-n%C3%BCrnberg/,,,,,,,,,,,
linkedin,"Wissenschaftliche*n Mitarbeiter*in (w/m/d) Lehrstuhl für Strafrecht, Strafprozessrecht",FernUniversität in Hagen,"Hagen, North Rhine-Westphalia, Germany",2026-06-12,https://www.linkedin.com/jobs/view/4427952556 , ,li-4427952556,fulltime,,,,,,False,entry level,"Research, Analyst, and Information Technology",,,Higher Education,https://de.linkedin.com/school/fernunihagen/,,,,,,,,,,,
linkedin,Research Associate (m/f/d) at the Institute of Software Security,Hamburg University of Technology,"Hamburg, Hamburg, Germany",2026-06-12,https://www.linkedin.com/jobs/view/4428140514 , ,li-4428140514,fulltime,,,,,,False,entry level,"Research, Analyst, and Information Technology",,-ferreyra@tuhh.de,Internet Publishing,https://de.linkedin.com/school/technische-universit%C3%A4t-hamburg/,,,,,,,,,,,
linkedin,Research Associate / Doctoral Candidate for Local Strain Characterization of Zirconium Claddings Using Ring Testing and Digital Image Correlation (f/m/d),Technische Universität München (Technical University of Munich),"Munich, Bavaria, Germany",2026-06-12,https://www.linkedin.com/jobs/view/4427239017 , ,li-4427239017,fulltime,,,,,,False,internship,"Research, Analyst, and Information Technology",,"hannes.panzer@tum.de, hannes.panzer@tum.de, hannes.panzer@tum.de",Higher Education,https://de.linkedin.com/school/c446-deccan-m.ed-college-gulbarga/,,,,,,,,,,,
linkedin,Wissenschaftliche*n Mitarbeiter*in (w/m/d) Lehrgebiet Soziologie II Soziologische Gegenwartsdiagnose,FernUniversität in Hagen,"Hagen, North Rhine-Westphalia, Germany",2026-06-12,https://www.linkedin.com/jobs/view/4418071558 , ,li-4418071558,parttime,,,,,,False,associate,"Research, Analyst, and Information Technology",,,Higher Education,https://de.linkedin.com/school/fernunihagen/,,,,,,,,,,,
linkedin,Applied Researcher,eBay,"Aachen, North Rhine-Westphalia, Germany",2026-06-12,https://www.linkedin.com/jobs/view/4414022207 , ,li-4414022207,fulltime,,,,,,False,mid-senior level,"Research, Analyst, and Information Technology",,talent@ebay.com,"Technology, Information and Internet",https://www.linkedin.com/company/ebay,,,,,,,,,,,
linkedin,Senior-Experte für Datenmodellierung (m/w/d) (Ref.Nr.: 47019),Wavestone,"Wiesbaden, Hesse, Germany",2026-06-12,https://www.linkedin.com/jobs/view/4424893257 , ,li-4424893257,contract,,,,,,True,associate,Consulting,,lejla.nametak@wavestone.eu,Business Consulting and Services,https://fr.linkedin.com/company/wavestone,,,,,,,,,,,
linkedin,Biomarker Data Scientist (all gender),Bayer,"Berlin, Berlin, Germany",2026-06-12,https://www.linkedin.com/jobs/view/4427992116 , ,li-4427992116,fulltime,,,,,,False,mid-senior level,Engineering and Information Technology,,,"Chemical Manufacturing, Pharmaceutical Manufacturing, and Biotechnology Research",https://de.linkedin.com/company/bayer,,,,,,,,,,,
linkedin,Wissenschaftliche/r Mitarbeiter/in am Lehrstuhl für Öffentliches Recht und Rechtsphilosophie (m/w/d),FAU Erlangen-Nürnberg,"Erlangen, Bavaria, Germany",2026-06-12,https://www.linkedin.com/jobs/view/4427987662 , ,li-4427987662,fulltime,,,,,,False,entry level,"Research, Analyst, and Information Technology",,,Research Services,https://de.linkedin.com/school/fau-erlangen-n%C3%BCrnberg/,,,,,,,,,,,
linkedin,"Doctoral Researcher (f/m/d), Scientific Staff Member (f/m/d)",Karlsruhe Institute of Technology (KIT),"Eggenstein-Leopoldshafen, Baden-Württemberg, Germany",2026-06-12,https://www.linkedin.com/jobs/view/4426949822 , ,li-4426949822,fulltime,,,,,,False,entry level,"Research, Analyst, and Information Technology",,"neil.mackinnon@kit.edu, baerbel.gaetcke@kit.edu",Higher Education,https://de.linkedin.com/school/kit/,,,,,,,,,,,
linkedin,Legal Research Assistant (all genders),Cardmarket.com,"Berlin, Berlin, Germany",2026-06-12,https://www.linkedin.com/jobs/view/4424865104 , ,li-4424865104,parttime,,,,,,False,internship,Legal,,,Software Development,https://de.linkedin.com/company/cardmarket-com,,,,,,,,,,,
linkedin,Applied ML Researcher - Fully Remote | Upto $90/hr,Mercor,"Berlin, Berlin, Germany",2026-06-12,https://www.linkedin.com/jobs/view/4426698860 , ,li-4426698860,parttime,,,,,,True,not applicable,Other,,support@mercor.com,Software Development,https://www.linkedin.com/company/mercor-ai,,,,,,,,,,,
linkedin,Research Associate (m/f/d),INOMICS,"Lunenburg, Lower Saxony, Germany",2026-06-11,https://www.linkedin.com/jobs/view/4427608269 , ,li-4427608269,fulltime,,,,,,False,internship,"Research, Analyst, and Information Technology",,mario.mechtel@leuphana.de,Staffing and Recruiting,https://de.linkedin.com/company/inomics,,,,,,,,,,,
linkedin,Wissenschaftliche/r Mitarbeiter/in am Lehrstuhl für Öffentliches Recht und Rechtsphilosophie (m/w/d),Department Artificial Intelligence in Biomedical Engineering - AIBE@FAU,"Erlangen, Bavaria, Germany",2026-06-11,https://www.linkedin.com/jobs/view/4426237518 , ,li-4426237518,temporary,,,,,,False,entry level,"Research, Analyst, and Information Technology",,,Research Services,https://de.linkedin.com/company/aibe-fau,,,,,,,,,,,
linkedin,Wissenschaftliche*r Mitarbeiter*in Medizinische Psychologie,Universitätsmedizin Greifswald,"Greifswald, Mecklenburg-West Pomerania, Germany",2026-06-11,https://www.linkedin.com/jobs/view/4426038190 , ,li-4426038190,fulltime,,,,,,False,entry level,"Research, Analyst, and Information Technology",,,Hospitals and Health Care,https://de.linkedin.com/company/umgreifswald,,,,,,,,,,,
linkedin,Wissenschaftliche:r Mitarbeiter:in oder/und Doktorand:in (d/m/w) für Digitale Zwillinge und Echtzeit-Simulationen von Energiesystemen im Projekt BISS,Bonn-Rhein-Sieg University of Applied Sciences,"Sankt Augustin, North Rhine-Westphalia, Germany",2026-06-11,https://www.linkedin.com/jobs/view/4415792643 , ,li-4415792643,fulltime,,,,,,False,entry level,"Research, Analyst, and Information Technology",,,Higher Education,https://de.linkedin.com/school/hochschule-bonn-rhein-sieg/,,,,,,,,,,,
linkedin,Praktikant (m/w/d) oder wissenschaftliche Hilfskraft (m/w/d) im PV-Testlabor mit 30h bis 80h im Monat,Zentrum für Sonnenenergie- und Wasserstoff-Forschung Baden-Württemberg (ZSW),"Stuttgart, Baden-Württemberg, Germany",2026-06-11,https://www.linkedin.com/jobs/view/4426204005 , ,li-4426204005,fulltime,,,,,,False,internship,Other,,,Research Services,https://de.linkedin.com/company/zsw-bw,,,,,,,,,,,
linkedin,"Doctoral Researcher (f/m/d), Scientific Staff Member (f/m/d) in the Field of nuclear magnetic resonance (NMR) spectroscopy: Smart miniaturized shimsets for NMR spectroscopy",Karlsruhe Institute of Technology (KIT),"Eggenstein-Leopoldshafen, Baden-Württemberg, Germany",2026-06-11,https://www.linkedin.com/jobs/view/4426603395 , ,li-4426603395,fulltime,,,,,,False,entry level,"Research, Analyst, and Information Technology",,"mazin.jouda@kit.edu, baerbel.gaetcke@kit.edu",Higher Education,https://de.linkedin.com/school/kit/,,,,,,,,,,,
linkedin,Wissenschaftlicher Mitarbeiter (m/w/d),RSM Ebner Stolz,"Hamburg, Hamburg, Germany",2026-06-11,https://www.linkedin.com/jobs/view/4361232142 , ,li-4361232142,fulltime,,,,,,False,entry level,"Research, Analyst, and Information Technology",,,Professional Services,https://de.linkedin.com/company/rsm-ebner-stolz,,,,,,,,,,,
linkedin,Data Scientist / Data Analyst / Bioinformatiker/-in (w/d/m),Land Niedersachsen,"Hannover, Lower Saxony, Germany",2026-06-11,https://www.linkedin.com/jobs/view/4426636098 , ,li-4426636098,fulltime,,,,,,False,entry level,Engineering and Information Technology,,,Government Administration,https://de.linkedin.com/company/arbeitgeber-niedersachsen,,,,,,,,,,,
linkedin,Wissenschaftliche*r Mitarbeiter*in (Doktorand*in),Marburg University,"Marburg an der Lahn, Hesse, Germany",2026-06-11,https://www.linkedin.com/jobs/view/4427542006 , ,li-4427542006,fulltime,,,,,,False,internship,"Research, Analyst, and Information Technology",,zhengli@staff.uni,Internet Publishing,https://de.linkedin.com/school/philipps-universit-t-marburg/,,,,,,,,,,,
linkedin,Researcher (m/f/d),Universitätsmedizin Greifswald,"Greifswald, Mecklenburg-West Pomerania, Germany",2026-06-11,https://www.linkedin.com/jobs/view/4426198891 , ,li-4426198891,contract,,,,,,False,entry level,"Research, Analyst, and Information Technology",,,Hospitals and Health Care,https://de.linkedin.com/company/umgreifswald,,,,,,,,,,,
linkedin,Wissenschaftliche*r Mitarbeiter*in (Postdoktorand*in),Marburg University,"Marburg an der Lahn, Hesse, Germany",2026-06-11,https://www.linkedin.com/jobs/view/4427610483 , ,li-4427610483,fulltime,,,,,,False,mid-senior level,"Research, Analyst, and Information Technology",,Gregor.witte@physik.uni,Internet Publishing,https://de.linkedin.com/school/philipps-universit-t-marburg/,,,,,,,,,,,
linkedin,Wissenschaftliche*r Mitarbeiter*in,Marburg University,"Marburg an der Lahn, Hesse, Germany",2026-06-11,https://www.linkedin.com/jobs/view/4427542011 , ,li-4427542011,fulltime,,,,,,False,mid-senior level,"Research, Analyst, and Information Technology",,oliverd@staff.uni,Internet Publishing,https://de.linkedin.com/school/philipps-universit-t-marburg/,,,,,,,,,,,
linkedin,Wissenschaftliche/-r Mitarbeiter/-in (m/w/d/x) in Botanik (Pflanzentaxonomie/Pflanzenphysiologie),Leipzig University,"Leipzig, Saxony, Germany",2026-06-11,https://www.linkedin.com/jobs/view/4427609490 , ,li-4427609490,fulltime,,,,,,False,mid-senior level,"Research, Analyst, and Information Technology",,,Internet Publishing,https://de.linkedin.com/school/university-of-leipzig/,,,,,,,,,,,
linkedin,Synthetic Biology: Chief Scientist/Researcher/R&D Engineer,MatriX Innovation GmbH,,2026-06-11,https://www.linkedin.com/jobs/view/4413281848 , ,li-4413281848,fulltime,,,,,,False,director,Research and Science,,recruitment.Matrix@petrochina.com.cn,"Research Services, Biotechnology Research, and Nanotechnology Research",https://www.linkedin.com/company/matrixinnovation,,,,,,,,,,,
linkedin,Wissenschaftliche/r Mitarbeiter/in (Doktorand/in) (m/w/d) mit Schwerpunkt „Nachhaltige Immobilien“,INOMICS,"Munich, Bavaria, Germany",2026-06-11,https://www.linkedin.com/jobs/view/4423179803 , ,li-4423179803,fulltime,,,,,,False,internship,"Research, Analyst, and Information Technology",,"b.zhu@tum.de, b.zhu@tum.de",Staffing and Recruiting,https://de.linkedin.com/company/inomics,,,,,,,,,,,
linkedin,Postdoctoral Researcher (m/f/d),Universität zu Lübeck,"Lübeck, Schleswig-Holstein, Germany",2026-06-11,https://www.linkedin.com/jobs/view/4427534460 , ,li-4427534460,fulltime,,,,,,False,internship,"Research, Analyst, and Information Technology",,,Internet Publishing,https://de.linkedin.com/school/uni-luebeck/,,,,,,,,,,,
linkedin,Versuchstechniker (m/w/d),Busch Vacuum Solutions,"Maulburg, Baden-Württemberg, Germany",2026-06-11,https://www.linkedin.com/jobs/view/4426272186 , ,li-4426272186,fulltime,,,,,,False,mid-senior level,"Research, Analyst, and Information Technology",,,Machinery Manufacturing,https://de.linkedin.com/company/busch-vacuum-solutions,,,,,,,,,,,
linkedin,Data Scientist / Data Analyst / Bioinformatiker (w/d/m),Medizinische Hochschule Hannover,"Hannover, Lower Saxony, Germany",2026-06-11,https://www.linkedin.com/jobs/view/4426606412 , ,li-4426606412,fulltime,,,,,,False,associate,Research,,,Research Services,https://de.linkedin.com/school/medizinische-hochschule-hannover/,,,,,,,,,,,
linkedin,"Web Analyst | Adobe Analytics, Adobe Launch | Mannheim",Xcede,"Mannheim, Baden-Württemberg, Germany",2026-06-11,https://www.linkedin.com/jobs/view/4426240304 , ,li-4426240304,fulltime,,,,,,True,mid-senior level,Consulting and Engineering,,,"Technology, Information and Media",https://uk.linkedin.com/company/xcede,,,,,,,,,,,
linkedin,Wissenschaftliche*r Mitarbeiter*in (m/w/d) - Mikrointegration von elektro-optischen Systemen für kompakte optische Atomuhren auf Basis thermischer Strontiumatome,Leibniz Association,"Berlin, Berlin, Germany",2026-06-10,https://www.linkedin.com/jobs/view/4427039122 , ,li-4427039122,fulltime,,,,,,False,entry level,"Research, Analyst, and Information Technology",,,Research,https://de.linkedin.com/company/leibniz-gemeinschaft,,,,,,,,,,,
linkedin,Wissenschaftliche*r Mitarbeiter*in - FwN (m/w/d),Stiftung Universität Hildesheim,"Hildesheim, Lower Saxony, Germany",2026-06-10,https://www.linkedin.com/jobs/view/4427005470 , ,li-4427005470,fulltime,,,,,,False,entry level,"Research, Analyst, and Information Technology",,,Internet Publishing,https://de.linkedin.com/school/stiftung-universitaet-hildesheim/,,,,,,,,,,,
linkedin,Wissenschaftliche*n Mitarbeiter*in (w/m/d) am Lehrstuhl für Bürgerliches Recht,FernUniversität in Hagen,"Hagen, North Rhine-Westphalia, Germany",2026-06-10,https://www.linkedin.com/jobs/view/4422924485 , ,li-4422924485,parttime,,,,,,False,entry level,Education,,,Higher Education,https://de.linkedin.com/school/fernunihagen/,,,,,,,,,,,
linkedin,Graduate Research Assistant (m/f/d) – Behavioral Genetics Unit,Max Planck Institute for Empirical Aesthetics,"Frankfurt, Hesse, Germany",2026-06-10,https://www.linkedin.com/jobs/view/4427010453 , ,li-4427010453,internship,,,,,,True,entry level,Health Care Provider,,,Internet Publishing,https://de.linkedin.com/school/mpiae/,,,,,,,,,,,
linkedin,"Wissenschaftliche:r Mitarbeiter:in (m/w/d), EG 13 TV-H, Institut für Urbane Entwicklungen – Fachgebiet Städtebau",University of Kassel,"Kassel, Hesse, Germany",2026-06-10,https://www.linkedin.com/jobs/view/4427082130 , ,li-4427082130,fulltime,,,,,,False,entry level,"Research, Analyst, and Information Technology",,,Internet Publishing,https://de.linkedin.com/school/uni-kassel/,,,,,,,,,,,
linkedin,"Wissenschaftliche:r Mitarbeiter:in (m/w/d), EG 13 TV-H, am Fachgebiet Geschichte der Frühen Neuzeit im Institut für Geschichte",University of Kassel,"Kassel, Hesse, Germany",2026-06-10,https://www.linkedin.com/jobs/view/4427013348 , ,li-4427013348,fulltime,,,,,,False,entry level,"Research, Analyst, and Information Technology",,,Internet Publishing,https://de.linkedin.com/school/uni-kassel/,,,,,,,,,,,
linkedin,Salesforce Business Analyst,InterEx Group,"Gummersbach, North Rhine-Westphalia, Germany",2026-06-10,https://www.linkedin.com/jobs/view/4426790083 , ,li-4426790083,contract,,,,,,True,mid-senior level,Information Technology,,,Engineering Services,https://uk.linkedin.com/company/interex-group,,,,,,,,,,,
linkedin,Mobility Analyst - McKinsey Center for Future Mobility,McKinsey & Company,"Munich, Bavaria, Germany",2026-06-10,https://www.linkedin.com/jobs/view/4416911650 , ,li-4416911650,fulltime,,,,,,False,entry level,"Analyst, Consulting, and Research",,,Motor Vehicle Manufacturing,https://www.linkedin.com/company/mckinsey,,,,,,,,,,,
linkedin,Manager Data Science (m/f/d),Simon-Kucher,"Cologne, North Rhine-Westphalia, Germany",2026-06-10,https://www.linkedin.com/jobs/view/4417049752 , ,li-4417049752,fulltime,,,,,,False,mid-senior level,Engineering and Information Technology,,,Business Consulting and Services,https://de.linkedin.com/company/simon-kucher,,,,,,,,,,,
