site,title,company,location,date_posted,job_url,job_url_direct,id,job_type,salary_source,interval,min_amount,max_amount,currency,is_remote,job_level,job_function,listing_type,emails,company_industry,company_url,company_url_direct,company_addresses,company_num_employees,company_revenue,company_description,skills,experience_range,company_rating,company_reviews_count,vacancy_count,work_from_home_type
linkedin,Working Student Fraud Data Engineering / Analytics (all genders),BESTSECRET Group,"Munich, Bavaria, Germany",2026-05-20,https://www.linkedin.com/jobs/view/4416134327 , ,li-4416134327,contract,,,,,,False,not applicable,Engineering and Information Technology,,,Retail Apparel and Fashion,https://de.linkedin.com/company/bestsecret,,,,,,,,,,,
linkedin,"Praktikum Redaktion - TA, TLZ & OTZ (m/w/d)",FUNKE,"Erfurt, Thuringia, Germany",2026-05-20,https://www.linkedin.com/jobs/view/3763327581 , ,li-3763327581,fulltime,,,,,,False,associate,Education and Training,,,"Book and Periodical Publishing and Technology, Information and Internet",https://de.linkedin.com/company/funkemediengruppe,,,,,,,,,,,
linkedin,Praktikant / Werkstudent Data Analytics - Innovation & Transformation (m/w/d) in München,Deloitte,"Munich, Bavaria, Germany",2026-05-20,https://www.linkedin.com/jobs/view/4376588523 , ,li-4376588523,fulltime,,,,,,False,internship,Analyst and Consulting,,career@deloitte.de,Business Consulting and Services,https://www.linkedin.com/company/deloitte,,,,,,,,,,,
linkedin,Internal Water Leakage Consultant,Enzo,"Heidelberg, Baden-Württemberg, Germany",2026-05-19,https://www.linkedin.com/jobs/view/4412873566 , ,li-4412873566,fulltime,,,,,,True,associate,Consulting,,,IT Services and IT Consulting,https://de.linkedin.com/company/heyenzo,,,,,,,,,,,
linkedin,Intern Multimodal Agentic AI for In-car Voice Assistant (f/m/x),BMW Group,"Munich, Bavaria, Germany",,https://www.linkedin.com/jobs/view/4385028329 , ,li-4385028329,internship,,,,,,False,internship,Administrative,,,Motor Vehicle Manufacturing,https://de.linkedin.com/company/bmw-group,,,,,,,,,,,
