site,title,company,location,date_posted,job_url,job_url_direct,id,job_type,salary_source,interval,min_amount,max_amount,currency,is_remote,job_level,job_function,listing_type,emails,company_industry,company_url,company_url_direct,company_addresses,company_num_employees,company_revenue,company_description,skills,experience_range,company_rating,company_reviews_count,vacancy_count,work_from_home_type
linkedin,Wissenschaftliche*r Mitarbeiter*in (Doktorand*in),Marburg University,"Marburg an der Lahn, Hesse, Germany",2026-06-11,https://www.linkedin.com/jobs/view/4427542006 , ,li-4427542006,fulltime,,,,,,False,internship,"Research, Analyst, and Information Technology",,zhengli@staff.uni,Internet Publishing,https://de.linkedin.com/school/philipps-universit-t-marburg/,,,,,,,,,,,
linkedin,Postdoctoral Researcher Video team,Johnson & Johnson Innovative Medicine,"Neuss, North Rhine-Westphalia, Germany",2026-06-11,https://www.linkedin.com/jobs/view/4417396482 , ,li-4417396482,fulltime,,,,,,True,not applicable,"Research, Analyst, and Information Technology",,,Pharmaceutical Manufacturing,https://www.linkedin.com/company/jnjinnovativemedicine,,,,,,,,,,,
linkedin,Praktikanten (m/w/d ) und wissenschaftliche Hilfskräfte (m/w/d ) in der Energie- und Verfahrenstechnik,Zentrum für Sonnenenergie- und Wasserstoff-Forschung Baden-Württemberg (ZSW),"Stuttgart, Baden-Württemberg, Germany",2026-06-11,https://www.linkedin.com/jobs/view/4426184933 , ,li-4426184933,fulltime,,,,,,False,internship,Other,,,Research Services,https://de.linkedin.com/company/zsw-bw,,,,,,,,,,,
linkedin,Wissenschaftliche*r Mitarbeiter*in Medizinische Psychologie,Universitätsmedizin Greifswald,"Greifswald, Mecklenburg-West Pomerania, Germany",2026-06-11,https://www.linkedin.com/jobs/view/4426038190 , ,li-4426038190,fulltime,,,,,,False,entry level,"Research, Analyst, and Information Technology",,,Hospitals and Health Care,https://de.linkedin.com/company/umgreifswald,,,,,,,,,,,
linkedin,AI Fact-Checking Assistant,JHC Consulting,"Berlin, Berlin, Germany",2026-06-11,https://www.linkedin.com/jobs/view/4426208516 , ,li-4426208516,fulltime,,,,,,True,entry level,Consulting,,,IT Services and IT Consulting,https://www.linkedin.com/company/jhc-consulting-services,,,,,,,,,,,
linkedin,Wissenschaftliche/r Mitarbeiter/in am Lehrstuhl für Öffentliches Recht und Rechtsphilosophie (m/w/d),Department Artificial Intelligence in Biomedical Engineering - AIBE@FAU,"Erlangen, Bavaria, Germany",2026-06-11,https://www.linkedin.com/jobs/view/4426237518 , ,li-4426237518,temporary,,,,,,False,entry level,"Research, Analyst, and Information Technology",,,Research Services,https://de.linkedin.com/company/aibe-fau,,,,,,,,,,,
linkedin,Wiss. Mitarbeiter*in mit Daueraufgaben (PostDoc) (d/m/w),Technische Universität Berlin,"Berlin, Berlin, Germany",2026-06-11,https://www.linkedin.com/jobs/view/4427172524 , ,li-4427172524,fulltime,,,,,,False,not applicable,"Research, Analyst, and Information Technology",,sekretariat@dms.tu,Education Administration Programs,https://de.linkedin.com/school/tuberlin/,,,,,,,,,,,
linkedin,Product Line Analyst,Amcor,"Kutenholz, Lower Saxony, Germany",2026-06-11,https://www.linkedin.com/jobs/view/4427561077 , ,li-4427561077,fulltime,,,,,,False,entry level,"Research, Analyst, and Information Technology",,,Packaging and Containers Manufacturing,https://ch.linkedin.com/company/amcor,,,,,,,,,,,
linkedin,Data Scientist (m/w/d),IBM,"Cologne, North Rhine-Westphalia, Germany",2026-06-11,https://www.linkedin.com/jobs/view/4414013283 , ,li-4414013283,fulltime,,,,,,False,mid-senior level,Engineering and Information Technology,,,IT Services and IT Consulting,https://www.linkedin.com/company/ibm,,,,,,,,,,,
linkedin,Data Scientist (m/w/d),IBM,"Munich, Bavaria, Germany",2026-06-11,https://www.linkedin.com/jobs/view/4414000650 , ,li-4414000650,fulltime,,,,,,False,mid-senior level,Engineering and Information Technology,,,IT Services and IT Consulting,https://www.linkedin.com/company/ibm,,,,,,,,,,,
linkedin,Wissenschaftliche/r Mitarbeiter/in (Doktorand/in) (m/w/d) mit Schwerpunkt „Nachhaltige Immobilien“,INOMICS,"Munich, Bavaria, Germany",2026-06-11,https://www.linkedin.com/jobs/view/4423179803 , ,li-4423179803,fulltime,,,,,,False,internship,"Research, Analyst, and Information Technology",,"b.zhu@tum.de, b.zhu@tum.de",Staffing and Recruiting,https://de.linkedin.com/company/inomics,,,,,,,,,,,
linkedin,Praktikant (m/w/d) oder wissenschaftliche Hilfskraft (m/w/d) im PV-Testlabor mit 30h bis 80h im Monat,Zentrum für Sonnenenergie- und Wasserstoff-Forschung Baden-Württemberg (ZSW),"Stuttgart, Baden-Württemberg, Germany",2026-06-11,https://www.linkedin.com/jobs/view/4426204005 , ,li-4426204005,fulltime,,,,,,False,internship,Other,,,Research Services,https://de.linkedin.com/company/zsw-bw,,,,,,,,,,,
linkedin,Wiss. Mitarbeiter*in (d/m/w),Technische Universität Berlin,"Berlin, Berlin, Germany",2026-06-11,https://www.linkedin.com/jobs/view/4427162806 , ,li-4427162806,fulltime,,,,,,True,entry level,"Research, Analyst, and Information Technology",,sekretariat@railways.tu,Education Administration Programs,https://de.linkedin.com/school/tuberlin/,,,,,,,,,,,
linkedin,Data Scientist,Forto,"Berlin, Berlin, Germany",2026-06-11,https://www.linkedin.com/jobs/view/4427507902 , ,li-4427507902,fulltime,,,,,,False,entry level,Engineering and Information Technology,,,"Transportation, Logistics, Supply Chain and Storage",https://de.linkedin.com/company/fortocompany,,,,,,,,,,,
linkedin,Wissenschaftliche*r Mitarbeiter*in,Marburg University,"Marburg an der Lahn, Hesse, Germany",2026-06-11,https://www.linkedin.com/jobs/view/4427542011 , ,li-4427542011,fulltime,,,,,,False,mid-senior level,"Research, Analyst, and Information Technology",,oliverd@staff.uni,Internet Publishing,https://de.linkedin.com/school/philipps-universit-t-marburg/,,,,,,,,,,,
linkedin,Synthetic Biology: Chief Scientist/Researcher/R&D Engineer,MatriX Innovation GmbH,,2026-06-11,https://www.linkedin.com/jobs/view/4413281848 , ,li-4413281848,fulltime,,,,,,False,director,Research and Science,,recruitment.Matrix@petrochina.com.cn,"Research Services, Biotechnology Research, and Nanotechnology Research",https://www.linkedin.com/company/matrixinnovation,,,,,,,,,,,
linkedin,Researcher (m/f/d),Universitätsmedizin Greifswald,"Greifswald, Mecklenburg-West Pomerania, Germany",2026-06-11,https://www.linkedin.com/jobs/view/4426198891 , ,li-4426198891,contract,,,,,,False,entry level,"Research, Analyst, and Information Technology",,,Hospitals and Health Care,https://de.linkedin.com/company/umgreifswald,,,,,,,,,,,
linkedin,Laboratory Scientist - Automation (Proteomics) (m/f/d),GSK,"Heidelberg, Baden-Württemberg, Germany",2026-06-11,https://www.linkedin.com/jobs/view/4423646218 , ,li-4423646218,fulltime,,,,,,False,entry level,"Research, Science, and Information Technology",,-Recruitment@gsk.com,Pharmaceutical Manufacturing,https://uk.linkedin.com/company/gsk,,,,,,,,,,,
linkedin,"Data Scientist - Digital Health (Remote EU, B2B contract)",Mira,"Berlin, Berlin, Germany",2026-06-11,https://www.linkedin.com/jobs/view/4427512359 , ,li-4427512359,fulltime,,,,,,True,mid-senior level,Analyst and Research,,,Wellness and Fitness Services and Hospitals and Health Care,https://www.linkedin.com/company/miracare,,,,,,,,,,,
linkedin,Manager Data Science (m/f/d),Simon-Kucher,"Munich, Bavaria, Germany",2026-06-10,https://www.linkedin.com/jobs/view/4417062587 , ,li-4417062587,fulltime,,,,,,False,mid-senior level,Engineering and Information Technology,,,Business Consulting and Services,https://de.linkedin.com/company/simon-kucher,,,,,,,,,,,
linkedin,Doctoral Researcher (m/f/x) in Political Science (65%) I ECR Project DEMOLAW,BECHER GmbH & Co. KG,"Friedrichshafen, Baden-Württemberg, Germany",2026-06-10,https://www.linkedin.com/jobs/view/4423115922 , ,li-4423115922,parttime,,,,,,False,entry level,"Research, Analyst, and Information Technology",,steffen.hurka@zu.de,Wholesale,https://de.linkedin.com/company/becher-holzhandlung,,,,,,,,,,,
linkedin,Cosmology Specialist - Fully Remote | Upto $100/hr,Mercor,,2026-06-10,https://www.linkedin.com/jobs/view/4426728227 , ,li-4426728227,parttime,description,hourly,70.0,100.0,USD,True,not applicable,Science,,support@mercor.com,Software Development,https://www.linkedin.com/company/mercor-ai,,,,,,,,,,,
linkedin,Wissenschaftliche*r Mitarbeiter*in (m/w/d) - Mikrointegration von elektro-optischen Systemen für kompakte optische Atomuhren auf Basis thermischer Strontiumatome,Leibniz Association,"Berlin, Berlin, Germany",2026-06-10,https://www.linkedin.com/jobs/view/4427039122 , ,li-4427039122,fulltime,,,,,,False,entry level,"Research, Analyst, and Information Technology",,,Research,https://de.linkedin.com/company/leibniz-gemeinschaft,,,,,,,,,,,
linkedin,Wissenschaftliche*n Mitarbeiter*in (w/m/d) im BMFTR-Forschungsprojekt,FernUniversität in Hagen,"Hagen, North Rhine-Westphalia, Germany",2026-06-10,https://www.linkedin.com/jobs/view/4417774801 , ,li-4417774801,parttime,,,,,,False,associate,Research and Education,,,Higher Education,https://de.linkedin.com/school/fernunihagen/,,,,,,,,,,,
linkedin,"Wissenschaftliche:r Mitarbeiter:in (m/w/d), EG 13 TV-H, am Fachgebiet Geschichte der Frühen Neuzeit im Institut für Geschichte",University of Kassel,"Kassel, Hesse, Germany",2026-06-10,https://www.linkedin.com/jobs/view/4427013348 , ,li-4427013348,fulltime,,,,,,False,entry level,"Research, Analyst, and Information Technology",,,Internet Publishing,https://de.linkedin.com/school/uni-kassel/,,,,,,,,,,,
linkedin,Chemielaborant (m/w/d) R&D - 3 Jahre befristet,Vantive,"Hechingen, Baden-Württemberg, Germany",2026-06-10,https://www.linkedin.com/jobs/view/4426144260 , ,li-4426144260,fulltime,,,,,,False,entry level,"Research, Analyst, and Information Technology",,,Medical Equipment Manufacturing,https://www.linkedin.com/company/vantivehealth,,,,,,,,,,,
linkedin,Fachbereich Geowissenschaften - Institut für Geologische Wissenschaften AB Mineralogie-Petrologie,Freie Universität Berlin (Free University of Berlin),"Berlin, Berlin, Germany",2026-06-10,https://www.linkedin.com/jobs/view/4426737359 , ,li-4426737359,fulltime,,,,,,False,mid-senior level,Other,,,Higher Education,https://de.linkedin.com/school/v.h-marad-m.ed-college-sattur-dharwad/,,,,,,,,,,,
linkedin,Senior Data Scientist (f/m/x),Tourlane,"Berlin, Germany",2026-06-10,https://www.linkedin.com/jobs/view/4410187247 , ,li-4410187247,fulltime,,,,,,True,mid-senior level,Information Technology and Engineering,,,Travel Arrangements,https://de.linkedin.com/company/tourlane,,,,,,,,,,,
linkedin,Wissenschaftliche/r Mitarbeiter/in (m/w/d) - Externe Finanz- und Nachhaltigkeitsberichterstattung,Universität Rostock,"Rostock, Mecklenburg-West Pomerania, Germany",2026-06-10,https://www.linkedin.com/jobs/view/4427006423 , ,li-4427006423,fulltime,,,,,,False,mid-senior level,"Research, Analyst, and Information Technology",,,Internet Publishing,https://de.linkedin.com/school/university-of-rostock/,,,,,,,,,,,
linkedin,Manager Data Science (m/f/d),Simon-Kucher,"Berlin, Berlin, Germany",2026-06-10,https://www.linkedin.com/jobs/view/4417067110 , ,li-4417067110,fulltime,,,,,,False,mid-senior level,Engineering and Information Technology,,,Business Consulting and Services,https://de.linkedin.com/company/simon-kucher,,,,,,,,,,,
linkedin,"Senior Researcher Quantitative Sozialforschung, Geschlechterforschung (m/w/d)",GESIS - Leibniz Institute for the Social Sciences,"Mannheim, Baden-Württemberg, Germany",2026-06-10,https://www.linkedin.com/jobs/view/4423186369 , ,li-4423186369,fulltime,,,,,,False,mid-senior level,Other,,"Lena.Weber@gesis.org, franca.tosetti@gesis.org",Research Services,https://de.linkedin.com/company/gesis-org,,,,,,,,,,,
linkedin,Graduate Research Assistant (m/f/d) – Behavioral Genetics Unit,Max Planck Institute for Empirical Aesthetics,"Frankfurt, Hesse, Germany",2026-06-10,https://www.linkedin.com/jobs/view/4427010453 , ,li-4427010453,internship,,,,,,True,entry level,Health Care Provider,,,Internet Publishing,https://de.linkedin.com/school/mpiae/,,,,,,,,,,,
linkedin,Postdoctoral researcher (m/f/d/x),Leipzig University,"Leipzig, Saxony, Germany",2026-06-10,https://www.linkedin.com/jobs/view/4427078127 , ,li-4427078127,parttime,,,,,,False,internship,"Research, Analyst, and Information Technology",,,Internet Publishing,https://de.linkedin.com/school/university-of-leipzig/,,,,,,,,,,,
linkedin,Research Assistants in Functional Cancer Genomics (Doctoral Researchers/PhD),Marburg University,"Marburg an der Lahn, Hesse, Germany",2026-06-10,https://www.linkedin.com/jobs/view/4427011394 , ,li-4427011394,parttime,,,,,,False,internship,"Research, Analyst, and Information Technology",,,Internet Publishing,https://de.linkedin.com/school/philipps-universit-t-marburg/,,,,,,,,,,,
linkedin,Scientist Analytical Characterization (d/f/m),Sandoz in Deutschland,"Holzkirchen, Bavaria, Germany",2026-06-10,https://www.linkedin.com/jobs/view/4417329469 , ,li-4417329469,fulltime,,,,,,False,entry level,"Research, Analyst, and Information Technology",,,Pharmaceutical Manufacturing,https://de.linkedin.com/company/sandozde,,,,,,,,,,,
linkedin,"Fachbereich Geowissenschaften - Institut für Geologische Wissenschaften FR Planetologie und Fernerkundung, AG Postberg",Freie Universität Berlin (Free University of Berlin),"Berlin, Berlin, Germany",2026-06-10,https://www.linkedin.com/jobs/view/4426741255 , ,li-4426741255,fulltime,,,,,,False,entry level,Other,,,Higher Education,https://de.linkedin.com/school/v.h-marad-m.ed-college-sattur-dharwad/,,,,,,,,,,,
linkedin,Wissenschaftliche*n Mitarbeiter*in (w/m/d) am Lehrstuhl für Bürgerliches Recht,FernUniversität in Hagen,"Hagen, North Rhine-Westphalia, Germany",2026-06-10,https://www.linkedin.com/jobs/view/4422924485 , ,li-4422924485,parttime,,,,,,False,entry level,Education,,,Higher Education,https://de.linkedin.com/school/fernunihagen/,,,,,,,,,,,
linkedin,Versuchsmechaniker (m/w/d),Collomix,"Gaimersheim, Bavaria, Germany",2026-06-10,https://www.linkedin.com/jobs/view/4426776642 , ,li-4426776642,fulltime,,,,,,False,entry level,Engineering,,bewerbung@collomix.de,Machinery Manufacturing,https://de.linkedin.com/company/collomix-gmbh,,,,,,,,,,,
linkedin,Wiss. Mitarbeiter*in (d/m/w) - 1. Qualifizierungsphase (zur Promotion),Technische Universität Berlin,"Berlin, Berlin, Germany",2026-06-10,https://www.linkedin.com/jobs/view/4427048975 , ,li-4427048975,fulltime,,,,,,False,internship,"Research, Analyst, and Information Technology",,sekr@d2ip.tu,Education Administration Programs,https://de.linkedin.com/school/tuberlin/,,,,,,,,,,,
linkedin,AI Data Annotator(German)--Remote,Avance Consulting,,2026-06-10,https://www.linkedin.com/jobs/view/4426009483 , ,li-4426009483,contract,,,,,,True,mid-senior level,Other,,,IT Services and IT Consulting,https://uk.linkedin.com/company/avance-services,,,,,,,,,,,
linkedin,Product Data Analyst,Jobgether,,2026-06-10,https://www.linkedin.com/jobs/view/4426006966 , ,li-4426006966,fulltime,,,,,,True,associate,Information Technology,,,Internet Marketplace Platforms,https://be.linkedin.com/company/jobgether,,,,,,,,,,,
linkedin,Manager Data Science (m/f/d),Simon-Kucher,"Hamburg, Hamburg, Germany",2026-06-10,https://www.linkedin.com/jobs/view/4417045938 , ,li-4417045938,fulltime,,,,,,False,mid-senior level,Engineering and Information Technology,,,Business Consulting and Services,https://de.linkedin.com/company/simon-kucher,,,,,,,,,,,
linkedin,Wissenschaftliche Mitarbeiter (m/w/d) Öffentliches Wirtschaftsrecht,Oppenhoff,"Cologne, North Rhine-Westphalia, Germany",2026-06-09,https://www.linkedin.com/jobs/view/4426379814 , ,li-4426379814,internship,,,,,,False,internship,Legal,,,Law Practice,https://de.linkedin.com/company/oppenhoff,,,,,,,,,,,
linkedin,DH-Wirtschaftsinformatik - Data Science (m/w/d) 2027,Festool Group,"Wendlingen, Baden-Württemberg, Germany",2026-06-09,https://www.linkedin.com/jobs/view/4425849217 , ,li-4425849217,fulltime,,,,,,False,entry level,Other,,,Machinery Manufacturing,https://de.linkedin.com/company/festool-group,,,,,,,,,,,
linkedin,Particle Physics Computational Problem Designer,Mercor,,2026-06-09,https://www.linkedin.com/jobs/view/4425941791 , ,li-4425941791,parttime,description,hourly,70.0,100.0,USD,True,not applicable,Science,,support@mercor.com,Software Development,https://www.linkedin.com/company/mercor-ai,,,,,,,,,,,
linkedin,wiss. Mitarbeiterin bzw. Mitarbeiter / Doktorandin bzw. Doktorand (m/w/d),Technische Universität Dresden,"Dresden, Saxony, Germany",2026-06-09,https://www.linkedin.com/jobs/view/4426373619 , ,li-4426373619,fulltime,,,,,,False,mid-senior level,"Research, Analyst, and Information Technology",,,Research,https://de.linkedin.com/school/tu-dresden/,,,,,,,,,,,
linkedin,"Prozessmanagement, -automatisierung und Datenanalyse Accounting (m/w/d)",advita Pflegedienst GmbH,"Berlin, Germany",2026-06-09,https://www.linkedin.com/jobs/view/4422271357 , ,li-4422271357,fulltime,,,,,,False,mid-senior level,Management and Manufacturing,,,Personal Care Services,https://de.linkedin.com/company/advita-pflegedienst-gmbh,,,,,,,,,,,
linkedin,Data Analyst (all genders) - Supply Data Solutions,ABOUT YOU,"Hamburg, Hamburg, Germany",2026-06-09,https://www.linkedin.com/jobs/view/4425868126 , ,li-4425868126,fulltime,,,,,,False,associate,Analyst,,,Software Development,https://de.linkedin.com/company/about-you,,,,,,,,,,,
linkedin,"User Experience Researcher (Bangkok-based, Relocation provided)",Agoda,"Berlin, Berlin, Germany",2026-06-09,https://www.linkedin.com/jobs/view/4403432215 , ,li-4403432215,fulltime,,,,,,False,mid-senior level,Information Technology,,,"Technology, Information and Internet",https://sg.linkedin.com/company/agoda,,,,,,,,,,,
linkedin,Biology Researcher (Masters/PhDs),Alignerr,,2026-06-09,https://www.linkedin.com/jobs/view/4425947624 , ,li-4425947624,contract,,,,,,True,mid-senior level,"Research, Analyst, and Information Technology",,,"Technology, Information and Internet",https://www.linkedin.com/company/alignerr,,,,,,,,,,,
linkedin,Wissenschaftliche*r Mitarbeiter*in (Postdoktorand*in),Marburg University,"Marburg an der Lahn, Hesse, Germany",2026-06-09,https://www.linkedin.com/jobs/view/4426335448 , ,li-4426335448,fulltime,,,,,,False,entry level,"Research, Analyst, and Information Technology",,,Internet Publishing,https://de.linkedin.com/school/philipps-universit-t-marburg/,,,,,,,,,,,
linkedin,Research Assistant / Associate (f/m/d) in the field of Network or Spatial Econometrics,INOMICS,"Aachen, North Rhine-Westphalia, Germany",2026-06-09,https://www.linkedin.com/jobs/view/4426369627 , ,li-4426369627,parttime,,,,,,True,entry level,"Research, Analyst, and Information Technology",,"sabine.ott@ae.rwth, michaela.kesina@ae.rwth",Staffing and Recruiting,https://de.linkedin.com/company/inomics,,,,,,,,,,,
linkedin,Academic Researcher (f/m/d),Karlsruhe Institute of Technology (KIT),"Eggenstein-Leopoldshafen, Baden-Württemberg, Germany",2026-06-09,https://www.linkedin.com/jobs/view/4425880089 , ,li-4425880089,fulltime,,,,,,True,entry level,"Research, Analyst, and Information Technology",,"suren.chilingaryan@kit.edu, daniela.woerner@kit.edu",Higher Education,https://de.linkedin.com/school/kit/,,,,,,,,,,,
linkedin,113/2026 Wissenschaftliche*r Mitarbeiter*in (m/w/d) im Bereich Tribologie,Otto-von-Guericke University Magdeburg,"Magdeburg, Saxony-Anhalt, Germany",2026-06-09,https://www.linkedin.com/jobs/view/4422763058 , ,li-4422763058,fulltime,,,,,,False,entry level,"Research, Analyst, and Information Technology",,dirk.bartel@ovgu.de,Higher Education,https://de.linkedin.com/school/otto-von-guericke-university-magdeburg/,,,,,,,,,,,
linkedin,Doctoral researcher (f/m/d) in the field of surface chemistry and catalysis,Karlsruhe Institute of Technology (KIT),"Eggenstein-Leopoldshafen, Baden-Württemberg, Germany",2026-06-09,https://www.linkedin.com/jobs/view/4425553006 , ,li-4425553006,parttime,,,,,,True,internship,"Research, Analyst, and Information Technology",,"yuemin.wang@kit.edu, silvia.ratzel@kit.edu",Higher Education,https://de.linkedin.com/school/kit/,,,,,,,,,,,
linkedin,Wissenschaftliche Mitarbeiterin oder wissenschaftlicher Mitarbeiter (w/m/d) für das Gebiet Digital Public Health / Global Health Informatics (100 %),Hochschule Neu-Ulm,"Neu Ulm, Bavaria, Germany",2026-06-09,https://www.linkedin.com/jobs/view/4422763862 , ,li-4422763862,fulltime,,,,,,False,entry level,"Research, Analyst, and Information Technology",,bewerbung@hnu.de,Higher Education,https://de.linkedin.com/school/hochschule-neu-ulm/,,,,,,,,,,,
linkedin,Wissenschaftliche/-r Mitarbeiter/-in (m/w/d),Land Niedersachsen,,2026-06-09,https://www.linkedin.com/jobs/view/4421765966 , ,li-4421765966,fulltime,,,,,,False,entry level,"Research, Analyst, and Information Technology",,,Government Administration,https://de.linkedin.com/company/arbeitgeber-niedersachsen,,,,,,,,,,,
linkedin,"Wissenschaftliche:r Mitarbeiter:in § 28 Abs. 3 HmbHG, Lehrtherapeut:in in der Familienambulanz für affektive Störungen",University of Hamburg,"Hamburg, Hamburg, Germany",2026-06-09,https://www.linkedin.com/jobs/view/4425859058 , ,li-4425859058,fulltime,,,,,,False,mid-senior level,"Research, Analyst, and Information Technology",,,Research Services,https://de.linkedin.com/school/unihamburg/,,,,,,,,,,,
linkedin,Customer Master Data Analyst - Full time/Part time,BD,"Heidelberg, Baden-Württemberg, Germany",2026-06-09,https://www.linkedin.com/jobs/view/4426372646 , ,li-4426372646,fulltime,,,,,,False,not applicable,Customer Service,,,"Biotechnology Research, Medical Equipment Manufacturing, and Research Services",https://www.linkedin.com/company/bd1,,,,,,,,,,,
linkedin,Wissenschaftliche/-n Mitarbeiter/-in (m/w/d),Land Niedersachsen,,2026-06-09,https://www.linkedin.com/jobs/view/4421778690 , ,li-4421778690,fulltime,,,,,,False,entry level,"Research, Analyst, and Information Technology",,,Government Administration,https://de.linkedin.com/company/arbeitgeber-niedersachsen,,,,,,,,,,,
linkedin,"User Experience Researcher (Bangkok-based, Relocation provided)",Agoda,"Frankfurt, Hesse, Germany",2026-06-09,https://www.linkedin.com/jobs/view/4403439066 , ,li-4403439066,fulltime,,,,,,False,mid-senior level,Information Technology,,,"Technology, Information and Internet",https://sg.linkedin.com/company/agoda,,,,,,,,,,,
linkedin,Wissenschaftliche*r Mitarbeiter*in (m/w/d),Stiftung Universität Hildesheim,"Hildesheim, Lower Saxony, Germany",2026-06-09,https://www.linkedin.com/jobs/view/4426323619 , ,li-4426323619,fulltime,,,,,,False,internship,"Research, Analyst, and Information Technology",,,Internet Publishing,https://de.linkedin.com/school/stiftung-universitaet-hildesheim/,,,,,,,,,,,
linkedin,Data Scientist,Booz Allen Hamilton,"Wiesbaden, Hesse, Germany",2026-06-09,https://www.linkedin.com/jobs/view/4426501978 , ,li-4426501978,fulltime,,,,,,True,not applicable,Engineering and Information Technology,,,Software Development,https://www.linkedin.com/company/booz-allen-hamilton,,,,,,,,,,,
linkedin,HEMA Analyst (m/w/d),Bentley,"Hechingen, Baden-Württemberg, Germany",2026-06-08,https://www.linkedin.com/jobs/view/4421919805 , ,li-4421919805,fulltime,,,,,,False,associate,Other,,,Medical Equipment Manufacturing,https://de.linkedin.com/company/bentley-innomed,,,,,,,,,,,
linkedin,Chemielaborant (m/w/d),Bunge,"Rostock, Mecklenburg-West Pomerania, Germany",2026-06-08,https://www.linkedin.com/jobs/view/4416235331 , ,li-4416235331,fulltime,,,,,,False,associate,"Research, Analyst, and Information Technology",,sally.antemann@bunge.com,Food and Beverage Manufacturing,https://www.linkedin.com/company/bunge,,,,,,,,,,,
linkedin,Wiss. Mitarbeiter*in (w/m/d) Vollzeitbeschäftigung unbefristet Entgeltgruppe 13 TV-L FU Kennung: 21259000_2026,Freie Universität Berlin,"Berlin, Berlin, Germany",2026-06-08,https://www.linkedin.com/jobs/view/4421910520 , ,li-4421910520,fulltime,,,,,,False,mid-senior level,"Research, Analyst, and Information Technology",,,Research Services,https://de.linkedin.com/school/freie-universitat-berlin/,,,,,,,,,,,
linkedin,Research assistant (postdoc) (f/m/d) full-time job limited to 3 years salary grade (Entgeltgruppe) 13 TV-L FU reference code: DFG-GR-2026,Freie Universität Berlin,"Berlin, Berlin, Germany",2026-06-08,https://www.linkedin.com/jobs/view/4421964479 , ,li-4421964479,fulltime,,,,,,False,internship,"Research, Analyst, and Information Technology",,,Research Services,https://de.linkedin.com/school/freie-universitat-berlin/,,,,,,,,,,,
linkedin,Research assistant ReGEN Innovation Hub f/m/d,SRH University,"Berlin, Berlin, Germany",2026-06-08,https://www.linkedin.com/jobs/view/4425692049 , ,li-4425692049,fulltime,,,,,,False,entry level,"Research, Analyst, and Information Technology",,karinaelena.bach@srh.de,Individual and Family Services,https://de.linkedin.com/school/srh-university/,,,,,,,,,,,
linkedin,Wiss. Mitarbeiter*in (w/m/d) (DM-750),Freie Universität Berlin,"Berlin, Berlin, Germany",2026-06-08,https://www.linkedin.com/jobs/view/4421960489 , ,li-4421960489,parttime,,,,,,False,entry level,"Research, Analyst, and Information Technology",,,Research Services,https://de.linkedin.com/school/freie-universitat-berlin/,,,,,,,,,,,
linkedin,Wissenschaftliche/r Mitarbeiter/in (m/w/d) im Bereich Berufsbildungs- und Hochschulforschung,Universität Rostock,"Rostock, Mecklenburg-West Pomerania, Germany",2026-06-08,https://www.linkedin.com/jobs/view/4425607393 , ,li-4425607393,fulltime,,,,,,False,entry level,"Research, Analyst, and Information Technology",,,Internet Publishing,https://de.linkedin.com/school/university-of-rostock/,,,,,,,,,,,
linkedin,Wissenschaftliche*r Mitarbeiter*in,Hamburg University of Technology,"Hamburg, Hamburg, Germany",2026-06-08,https://www.linkedin.com/jobs/view/4425608421 , ,li-4425608421,fulltime,,,,,,False,entry level,"Research, Analyst, and Information Technology",,trieu@tuhh.de,Internet Publishing,https://de.linkedin.com/school/technische-universit%C3%A4t-hamburg/,,,,,,,,,,,
