site,title,company,location,date_posted,job_url,job_url_direct,id,job_type,salary_source,interval,min_amount,max_amount,currency,is_remote,job_level,job_function,listing_type,emails,company_industry,company_url,company_url_direct,company_addresses,company_num_employees,company_revenue,company_description,skills,experience_range,company_rating,company_reviews_count,vacancy_count,work_from_home_type
linkedin,wissenschaftliche:r Mitarbeiter:in / Kurator:in (d/w/m),Stiftung Preußischer Kulturbesitz,"Berlin, Berlin, Germany",2026-06-24,https://www.linkedin.com/jobs/view/4432590046 , ,li-4432590046,fulltime,,,,,,False,mid-senior level,"Research, Analyst, and Information Technology",,,Internet Publishing,https://de.linkedin.com/company/stiftung-preu%C3%9Fischer-kulturbesitz,,,,,,,,,,,
linkedin,Wissenschaftliche/r Mitarbeiter/in (m/w/d) - Allgemeine & Spezielle Zoologie,Universität Rostock,"Rostock, Mecklenburg-West Pomerania, Germany",2026-06-24,https://www.linkedin.com/jobs/view/4432837811 , ,li-4432837811,fulltime,,,,,,False,mid-senior level,"Research, Analyst, and Information Technology",,,Internet Publishing,https://de.linkedin.com/school/university-of-rostock/,,,,,,,,,,,
linkedin,Wissenschaftliche Mitarbeiter:in (w/d/m),Stiftung Preußischer Kulturbesitz,"Berlin, Berlin, Germany",2026-06-24,https://www.linkedin.com/jobs/view/4432852053 , ,li-4432852053,fulltime,,,,,,False,mid-senior level,"Research, Analyst, and Information Technology",,,Internet Publishing,https://de.linkedin.com/company/stiftung-preu%C3%9Fischer-kulturbesitz,,,,,,,,,,,
linkedin,Capabilities & Insights Analyst - Automotive & Assembly,McKinsey & Company,"Munich, Bavaria, Germany",2026-06-24,https://www.linkedin.com/jobs/view/4413091933 , ,li-4413091933,fulltime,,,,,,False,entry level,"Analyst, Consulting, and Research",,,"Motor Vehicle Manufacturing, Appliances, Electrical, and Electronics Manufacturing, and Market Research",https://www.linkedin.com/company/mckinsey,,,,,,,,,,,
linkedin,R&D Data Management (all genders) fixed term 12 months,Bayer,"Berlin, Berlin, Germany",2026-06-24,https://www.linkedin.com/jobs/view/4432551692 , ,li-4432551692,fulltime,,,,,,False,mid-senior level,"Research, Analyst, and Information Technology",,,"Chemical Manufacturing, Pharmaceutical Manufacturing, and Biotechnology Research",https://de.linkedin.com/company/bayer,,,,,,,,,,,
linkedin,Junior Fellow - Tech & AI (m/w/d),McKinsey & Company,"Munich, Bavaria, Germany",2026-06-24,https://www.linkedin.com/jobs/view/4291535431 , ,li-4291535431,fulltime,,,,,,False,entry level,Consulting and Information Technology,,,IT Services and IT Consulting and Business Consulting and Services,https://www.linkedin.com/company/mckinsey,,,,,,,,,,,
linkedin,Wissenschaftliche/r Mitarbeiter/in Öffentliches Recht (m/w/d),FAU Erlangen-Nürnberg,"Erlangen, Bavaria, Germany",2026-06-24,https://www.linkedin.com/jobs/view/4432805174 , ,li-4432805174,fulltime,,,,,,False,entry level,"Research, Analyst, and Information Technology",,,Research Services,https://de.linkedin.com/school/fau-erlangen-n%C3%BCrnberg/,,,,,,,,,,,
linkedin,Crystalization Expert (F/M/D),theion,"Berlin, Berlin, Germany",2026-06-24,https://www.linkedin.com/jobs/view/4425849693 , ,li-4425849693,fulltime,,,,,,False,associate,Science,,,Chemical Manufacturing,https://de.linkedin.com/company/theion-batteries,,,,,,,,,,,
linkedin,"1 Doctoral Researcher (m/f/d), EG 13 TV-H, Department of Social Sciences, Sociology - Department of Art and Economies",University of Kassel,"Kassel, Hesse, Germany",2026-06-24,https://www.linkedin.com/jobs/view/4432590047 , ,li-4432590047,fulltime,,,,,,False,internship,Other,,,Internet Publishing,https://de.linkedin.com/school/uni-kassel/,,,,,,,,,,,
linkedin,Wissenschaftliche Mitarbeiter / Referendare (m/w/d) Öffentliches Wirtschaftsrecht,"Greenberg Traurig Germany, LLP","Berlin, Germany",2026-06-23,https://www.linkedin.com/jobs/view/4346993779 , ,li-4346993779,parttime,,,,,,False,entry level,"Research, Analyst, and Information Technology",,recruitment@gtlaw.de,Law Practice,https://de.linkedin.com/company/greenberg-traurig-germany-llp,,,,,,,,,,,
linkedin,Wissenschaftliche/r Mitarbeiter/in (m/w/d) - Schiffstechnik,Universität Rostock,"Rostock, Mecklenburg-West Pomerania, Germany",2026-06-23,https://www.linkedin.com/jobs/view/4432429153 , ,li-4432429153,fulltime,,,,,,False,mid-senior level,"Research, Analyst, and Information Technology",,,Internet Publishing,https://de.linkedin.com/school/university-of-rostock/,,,,,,,,,,,
linkedin,Wissenschaftliche*r Mitarbeiter*in (Praedoc) (w/m/d),Freie Universität Berlin,"Berlin, Berlin, Germany",2026-06-23,https://www.linkedin.com/jobs/view/4429471742 , ,li-4429471742,fulltime,,,,,,False,internship,"Research, Analyst, and Information Technology",,,Research Services,https://de.linkedin.com/school/freie-universitat-berlin/,,,,,,,,,,,
linkedin,Student Research Assistant (m/f/div) for creating a numerical model of the Kangaroo rat,Max Planck Institute for Intelligent Systems,"Stuttgart, Baden-Württemberg, Germany",2026-06-23,https://www.linkedin.com/jobs/view/4432440032 , ,li-4432440032,fulltime,,,,,,False,entry level,"Research, Analyst, and Information Technology",,jschwaner@is.mpg.de,Internet Publishing,https://de.linkedin.com/company/max-planck-institute-for-intelligent-systems,,,,,,,,,,,
linkedin,Wissenschaftliche Mitarbeiter (m/w/d) und Stationsreferendare (m/w/d) Immobilienrecht (Real Estate),Herbert Smith Freehills Kramer,"Frankfurt, Hesse, Germany",2026-06-23,https://www.linkedin.com/jobs/view/4432421474 , ,li-4432421474,internship,,,,,,False,internship,Legal,,,Law Practice,https://uk.linkedin.com/company/hsfkramer,,,,,,,,,,,
linkedin,Ingenieurwissenschaftler/in (w/m/d) - Systementwicklung für Quantensensoren im Feldbetrieb,German Aerospace Center (DLR),"Ulm, Baden-Württemberg, Germany",2026-06-23,https://www.linkedin.com/jobs/view/4430459762 , ,li-4430459762,fulltime,,,,,,False,mid-senior level,"Research, Analyst, and Information Technology",,,Research Services,https://de.linkedin.com/company/dlr,,,,,,,,,,,
linkedin,Research Assistant - Computer Vision (f/m/x),German Aerospace Center (DLR),"Berlin, Berlin, Germany",,https://www.linkedin.com/jobs/view/4433855451 , ,li-4433855451,fulltime,,,,,,False,entry level,"Research, Analyst, and Information Technology",,,Research Services,https://de.linkedin.com/company/dlr,,,,,,,,,,,
linkedin,Wissenschaftliche*r Mitarbeiter*in,Marburg University,"Marburg an der Lahn, Hesse, Germany",,https://www.linkedin.com/jobs/view/4434742602 , ,li-4434742602,fulltime,,,,,,False,entry level,"Research, Analyst, and Information Technology",,halbleiterphotonik@physik.uni,Internet Publishing,https://de.linkedin.com/school/philipps-universit-t-marburg/,,,,,,,,,,,
linkedin,Research Assistant (Doctoral Researcher/PhD ),Marburg University,"Marburg an der Lahn, Hesse, Germany",,https://www.linkedin.com/jobs/view/4434735835 , ,li-4434735835,parttime,,,,,,False,mid-senior level,"Research, Analyst, and Information Technology",,,Internet Publishing,https://de.linkedin.com/school/philipps-universit-t-marburg/,,,,,,,,,,,
linkedin,Student Research Assistant (m/f/d) – RFID Technology & Lab Support,Linxens,"Dresden, Saxony, Germany",,https://www.linkedin.com/jobs/view/4415607917 , ,li-4415607917,parttime,,,,,,False,entry level,"Research, Analyst, and Information Technology",,,Manufacturing,https://fr.linkedin.com/company/linxens,,,,,,,,,,,
linkedin,"Wissenschaftliche/r Mitarbeiter/in (m/w/d) - Volkswirtschaftslehre, Mikroökonomie",Universität Rostock,"Rostock, Mecklenburg-West Pomerania, Germany",,https://www.linkedin.com/jobs/view/4434752221 , ,li-4434752221,fulltime,,,,,,False,mid-senior level,"Research, Analyst, and Information Technology",,,Internet Publishing,https://de.linkedin.com/school/university-of-rostock/,,,,,,,,,,,
linkedin,Wissenschaftliche/-r Mitarbeiter/-in (m/w/d),Land Niedersachsen,,,https://www.linkedin.com/jobs/view/4421765966 , ,li-4421765966,fulltime,,,,,,False,entry level,"Research, Analyst, and Information Technology",,,Government Administration,https://de.linkedin.com/company/arbeitgeber-niedersachsen,,,,,,,,,,,
linkedin,Quantum Error Correction Scientist (f/m/d),eleQtron,"Siegen, North Rhine-Westphalia, Germany",,https://www.linkedin.com/jobs/view/4434981021 , ,li-4434981021,fulltime,,,,,,False,mid-senior level,Information Technology,,,IT Services and IT Consulting,https://de.linkedin.com/company/eleqtron-qc,,,,,,,,,,,
linkedin,"PhD project ""Reaching deeper – exploring optimal root water uptake strategies at the individual and ecosystem scale""",European Geosciences Union (EGU),"Jena, Thuringia, Germany",,https://www.linkedin.com/jobs/view/4435180488 , ,li-4435180488,fulltime,,,,,,False,entry level,"Research, Analyst, and Information Technology",,,Non-profit Organization Management,https://de.linkedin.com/company/european-geosciences-union,,,,,,,,,,,
linkedin,AI Data Quality Analyst,Alignerr,,,https://www.linkedin.com/jobs/view/4434902712 , ,li-4434902712,contract,,,,,,True,entry level,Information Technology,,,"Technology, Information and Internet",https://www.linkedin.com/company/alignerr,,,,,,,,,,,
linkedin,PhD Position – Immunology & Inflammatory Bowel Disease,Universitätsklinikum Erlangen,"Erlangen, Bavaria, Germany",,https://www.linkedin.com/jobs/view/4434979507 , ,li-4434979507,fulltime,,,,,,False,mid-senior level,,,,Hospitals and Health Care,https://de.linkedin.com/company/universitatsklinikumerlangen,,,,,,,,,,,
linkedin,Senior Associate Sensory and Consumer Science Excellence (all genders),Reckitt,"Heidelberg, Baden-Württemberg, Germany",,https://www.linkedin.com/jobs/view/4435120660 , ,li-4435120660,fulltime,,,,,,False,mid-senior level,Other,,,Consumer Goods Rental,https://uk.linkedin.com/company/reckitt,,,,,,,,,,,
linkedin,Laborant Mikrobiologie (m/w/d) befristet,Fresenius Medical Care,"St. Wendel, Saarland, Germany",,https://www.linkedin.com/jobs/view/4434725815 , ,li-4434725815,fulltime,,,,,,False,entry level,"Quality Assurance, Manufacturing, and Engineering",,,Hospitals and Health Care,https://de.linkedin.com/company/freseniusmedicalcare,,,,,,,,,,,
linkedin,"Sr. Applied Scientist, Amazon Robotics",Amazon,"Berlin, Germany",,https://www.linkedin.com/jobs/view/4425925849 , ,li-4425925849,fulltime,,,,,,False,mid-senior level,"Research, Analyst, and Information Technology",,,Software Development,https://www.linkedin.com/company/amazon,,,,,,,,,,,
linkedin,Wissenschaftliche:r Mitarbeiter:in § 28 Abs. 2 HmbHG,University of Hamburg,"Hamburg, Hamburg, Germany",,https://www.linkedin.com/jobs/view/4434328636 , ,li-4434328636,fulltime,,,,,,False,not applicable,"Research, Analyst, and Information Technology",,,Research Services,https://de.linkedin.com/school/unihamburg/,,,,,,,,,,,
linkedin,Wissenschaftliche Mitarbeiter (m/w/d) / Referendare (m/w/d) / Studentische Mitarbeitende (m/w/d) Sanierung + Insolvenz,BRL BOEGE ROHDE LUEBBEHUESEN,"Munich, Bavaria, Germany",,https://www.linkedin.com/jobs/view/4434947998 , ,li-4434947998,parttime,,,,,,False,internship,"Research, Analyst, and Information Technology",,,Legal Services,https://de.linkedin.com/company/brl-boege-rohde-luebbehuesen,,,,,,,,,,,
linkedin,Wissenschaftliche Mitarbeiter (m/w/d) / Referendare (m/w/d) / Studentische Mitarbeitende (m/w/d) Sanierung + Insolvenz,BRL BOEGE ROHDE LUEBBEHUESEN,"Hamburg, Hamburg, Germany",,https://www.linkedin.com/jobs/view/4434966757 , ,li-4434966757,parttime,,,,,,False,internship,"Research, Analyst, and Information Technology",,,Legal Services,https://de.linkedin.com/company/brl-boege-rohde-luebbehuesen,,,,,,,,,,,
linkedin,Wissenschaftliche Mitarbeiter (d/w/m) | Potsdam (13/2026),Forschungsinstitut Betriebliche Bildung (f-bb),"Potsdam, Brandenburg, Germany",,https://www.linkedin.com/jobs/view/4431904560 , ,li-4431904560,contract,,,,,,False,associate,Education,,,Education Administration Programs,https://de.linkedin.com/company/f-bb-ggmbh,,,,,,,,,,,
linkedin,Wissenschaftliche*n Mitarbeiter*in (m/w/d) als Studiengangsmanager*in,Ruhr University Bochum,"Bochum, North Rhine-Westphalia, Germany",,https://www.linkedin.com/jobs/view/4434736744 , ,li-4434736744,fulltime,,,,,,False,mid-senior level,"Research, Analyst, and Information Technology",,wpr@rub.de,Internet Publishing,https://de.linkedin.com/school/ruhrunibochum/,,,,,,,,,,,
linkedin,Wissenschaftliche/r Mitarbeiter/in (m/w/d) Professur Persönlichkeitspsychologie und Diagnostik,Technische Universität Chemnitz,"Chemnitz, Saxony, Germany",,https://www.linkedin.com/jobs/view/4434314586 , ,li-4434314586,fulltime,,,,,,False,mid-senior level,"Research, Analyst, and Information Technology",,susanne.moeldner@psychologie.tu,Education Management,https://de.linkedin.com/school/technische-universitat-chemnitz/,,,,,,,,,,,
linkedin,"PhD Student Biology, Biochemistry (m/f/d)",Marburg University,"Marburg an der Lahn, Hesse, Germany",,https://www.linkedin.com/jobs/view/4434964949 , ,li-4434964949,parttime,,,,,,False,associate,Science,,,Biotechnology Research,https://de.linkedin.com/school/philipps-universit-t-marburg/,,,,,,,,,,,
linkedin,Cosmology Specialist - Fully Remote | Upto $100/hr,Mercor,"Berlin, Berlin, Germany",,https://www.linkedin.com/jobs/view/4431926352 , ,li-4431926352,parttime,description,hourly,70.0,100.0,USD,True,not applicable,Other,,support@mercor.com,Software Development,https://www.linkedin.com/company/mercor-ai,,,,,,,,,,,
linkedin,Research Analyst (Alpha Research),FVN Research,,,https://www.linkedin.com/jobs/view/4435132520 , ,li-4435132520,volunteer,,,,,,False,mid-senior level,"Research, Analyst, and Information Technology",,,Capital Markets,https://de.linkedin.com/company/fvnresearch,,,,,,,,,,,
linkedin,Doctoral Researcher in Molecular Microbiology (m/f/d),Friedrich Schiller University Jena,"Jena, Thuringia, Germany",,https://www.linkedin.com/jobs/view/4434741657 , ,li-4434741657,internship,,,,,,False,internship,"Research, Analyst, and Information Technology",,,Internet Publishing,https://de.linkedin.com/school/friedrich-schiller-universit%C3%A4t-jena/,,,,,,,,,,,
linkedin,Research Assistant (all genders) - Speech and Audio Applications,Fraunhofer IIS,"Erlangen, Bavaria, Germany",,https://www.linkedin.com/jobs/view/4413273704 , ,li-4413273704,fulltime,,,,,,False,entry level,"Research, Analyst, and Information Technology",,,Research Services,https://de.linkedin.com/company/fraunhofer-iis,,,,,,,,,,,
linkedin,Studentische/wissenschaftliche Hilfskraft (m/w/d) in der Soziologie gesucht!,Hohenheim Management Development e.V. | Master of Finance,"Hamburg, Hamburg, Germany",,https://www.linkedin.com/jobs/view/4431544681 , ,li-4431544681,fulltime,,,,,,False,entry level,"Research, Analyst, and Information Technology",,,Higher Education,https://de.linkedin.com/company/universitaet-hohenheim-master-in-finance,,,,,,,,,,,
linkedin,"Applied Scientist, Devices & Services",Amazon,"Baden-Württemberg, Germany",,https://www.linkedin.com/jobs/view/4425649334 , ,li-4425649334,fulltime,,,,,,False,not applicable,"Research, Analyst, and Information Technology",,,Software Development,https://www.linkedin.com/company/amazon,,,,,,,,,,,
