site,title,company,location,date_posted,job_url,job_url_direct,id,job_type,salary_source,interval,min_amount,max_amount,currency,is_remote,job_level,job_function,listing_type,emails,company_industry,company_url,company_url_direct,company_addresses,company_num_employees,company_revenue,company_description,skills,experience_range,company_rating,company_reviews_count,vacancy_count,work_from_home_type
linkedin,Studentische Hilfskraft (m/w/d) im Forschungsbereich Verhaltensgenetik,Max Planck Institute for Empirical Aesthetics,"Frankfurt, Hesse, Germany",2026-06-10,https://www.linkedin.com/jobs/view/4427012345 , ,li-4427012345,fulltime,,,,,,False,internship,Other,,,Internet Publishing,https://de.linkedin.com/school/mpiae/,,,,,,,,,,,
linkedin,Formelentwickler (m/w/d),BCG Baden-Baden Cosmetics Group GmbH,"Baden-Baden, Baden-Württemberg, Germany",2026-06-10,https://www.linkedin.com/jobs/view/4427009149 , ,li-4427009149,fulltime,,,,,,False,not applicable,,,,Personal Care Product Manufacturing,https://www.linkedin.com/company/bcg-baden-baden-cosmetics-group-ag,,,,,,,,,,,
linkedin,Data Scientist (Process Intelligence / Celonis),Processand,"Munich, Bavaria, Germany",2026-06-10,https://www.linkedin.com/jobs/view/4423108862 , ,li-4423108862,fulltime,,,,,,True,entry level,Information Technology,,,IT Services and IT Consulting,https://de.linkedin.com/company/processand,,,,,,,,,,,
linkedin,Wissenschaftliche/r Mitarbeiter/in (m/w/d) - Externe Finanz- und Nachhaltigkeitsberichterstattung,Universität Rostock,"Rostock, Mecklenburg-West Pomerania, Germany",2026-06-10,https://www.linkedin.com/jobs/view/4427006423 , ,li-4427006423,fulltime,,,,,,False,mid-senior level,"Research, Analyst, and Information Technology",,,Internet Publishing,https://de.linkedin.com/school/university-of-rostock/,,,,,,,,,,,
linkedin,118/2026 Wissenschaftliche*r Mitarbeiter*in (m/w/d) im Bereich Tribologie,Otto-von-Guericke University Magdeburg,"Magdeburg, Saxony-Anhalt, Germany",2026-06-09,https://www.linkedin.com/jobs/view/4422766040 , ,li-4422766040,fulltime,,,,,,False,entry level,"Research, Analyst, and Information Technology",,dirk.bartel@ovgu.de,Higher Education,https://de.linkedin.com/school/otto-von-guericke-university-magdeburg/,,,,,,,,,,,
linkedin,Junior Professorship (W1-Professur) for Computational Logic -with Tenure Track (m/f/d) - reference no. 26078,Ulm University,"Ulm, Baden-Württemberg, Germany",2026-06-09,https://www.linkedin.com/jobs/view/4426507346 , ,li-4426507346,fulltime,,,,,,False,entry level,Other,,,Internet Publishing,https://de.linkedin.com/school/ulm-university/,,,,,,,,,,,
linkedin,Wissenschaftliche/-r Mitarbeiter/-in (m/w/d/x),Leipzig University,"Leipzig, Saxony, Germany",,https://www.linkedin.com/jobs/view/4429531156 , ,li-4429531156,fulltime,,,,,,False,mid-senior level,"Research, Analyst, and Information Technology",,,Internet Publishing,https://de.linkedin.com/school/university-of-leipzig/,,,,,,,,,,,
linkedin,Doctoral Researcher in membrane protein biophysics / biochemistry (m/f/d),University of Düsseldorf,"Düsseldorf, North Rhine-Westphalia, Germany",,https://www.linkedin.com/jobs/view/4426449265 , ,li-4426449265,fulltime,,,,,,False,internship,"Research, Analyst, and Information Technology",,,Higher Education,https://de.linkedin.com/school/heinrich-heine-universitat-dusseldorf/,,,,,,,,,,,
linkedin,Taxonomy & Ontology Curator,Gramian Consulting,,,https://www.linkedin.com/jobs/view/4429544504 , ,li-4429544504,fulltime,,,,,,True,mid-senior level,Other,,,IT Services and IT Consulting,https://mk.linkedin.com/company/gramian-consulting,,,,,,,,,,,
linkedin,Research Assistant / Doctoral Student (f/m/d) in the Area of Macro Finance,Leibniz Institute for Financial Research SAFE,"Frankfurt, Hesse, Germany",,https://www.linkedin.com/jobs/view/4429528166 , ,li-4429528166,fulltime,,,,,,False,internship,"Research, Analyst, and Information Technology",,,Internet Publishing,https://de.linkedin.com/company/researchcentersafe,,,,,,,,,,,
linkedin,Wissenschaftliche*r Mitarbeiter*in,SFB 1313 | University of Stuttgart,,,https://www.linkedin.com/jobs/view/4426857472 , ,li-4426857472,fulltime,,,,,,True,mid-senior level,"Research, Analyst, and Information Technology",,,Research,https://de.linkedin.com/company/sfb-1313,,,,,,,,,,,
linkedin,wissenschaftliche*n Mitarbeiter*in (m/w/d),Ostfalia - University of Applied Sciences,"Wolfenbüttel, Lower Saxony, Germany",,https://www.linkedin.com/jobs/view/4429525225 , ,li-4429525225,fulltime,,,,,,False,entry level,"Research, Analyst, and Information Technology",,,Internet Publishing,https://de.linkedin.com/school/ostfalia---university-of-applied-sciences/,,,,,,,,,,,
linkedin,Eine*n wissenschaftliche*n Mitarbeiter*in (Post-Doc) für den Arbeitsbereich Entwicklungsdynamiken,DIPF | Leibniz Institute for Research and Information in Education,,,https://www.linkedin.com/jobs/view/4429209769 , ,li-4429209769,fulltime,,,,,,False,internship,"Research, Analyst, and Information Technology",,"f.schmiedek@dipf.de, -enbi@dipf.de",Research Services,https://de.linkedin.com/company/german-institute-for-international-educational-research,,,,,,,,,,,
linkedin,"Wissenschaftliche/r Mitarbeiter/in (Postdoc, m/w/d)",SFB 1313 | University of Stuttgart,,,https://www.linkedin.com/jobs/view/4426854471 , ,li-4426854471,fulltime,,,,,,False,internship,"Research, Analyst, and Information Technology",,Christine.Etteldorf@hi.uni,Research,https://de.linkedin.com/company/sfb-1313,,,,,,,,,,,
linkedin,Wissenschaftliche*n Mitarbeiter*in (m/w/d) als Studiengangsmanager*in,Ruhr University Bochum,"Bochum, North Rhine-Westphalia, Germany",,https://www.linkedin.com/jobs/view/4429536036 , ,li-4429536036,fulltime,,,,,,False,mid-senior level,"Research, Analyst, and Information Technology",,wpr@rub.de,Internet Publishing,https://de.linkedin.com/school/ruhrunibochum/,,,,,,,,,,,
linkedin,124/2026 Wissenschaftliche*r Mitarbeiter*in (m/w/d) im Bereich Sportwissenschaft / auf dem Gebiet Sporttechnologien/ Bewegungswissenschaft,Otto-von-Guericke University Magdeburg,"Magdeburg, Saxony-Anhalt, Germany",,https://www.linkedin.com/jobs/view/4429524106 , ,li-4429524106,fulltime,,,,,,False,mid-senior level,"Research, Analyst, and Information Technology",,kerstin.witte@ovgu.de,Higher Education,https://de.linkedin.com/school/otto-von-guericke-university-magdeburg/,,,,,,,,,,,
linkedin,Wissenschaftliche Mitarbeiter / Referendare (m/w/d) Litigation/Arbitration,"Greenberg Traurig Germany, LLP","Berlin, Germany",,https://www.linkedin.com/jobs/view/4379576834 , ,li-4379576834,parttime,,,,,,False,entry level,"Research, Analyst, and Information Technology",,recruitment@gtlaw.de,Law Practice,https://de.linkedin.com/company/greenberg-traurig-germany-llp,,,,,,,,,,,
linkedin,"Senior Epidemiologist, Data Scientist or Statistician (m/f/d)",Universitätsmedizin Greifswald,"Greifswald, Mecklenburg-West Pomerania, Germany",,https://www.linkedin.com/jobs/view/4426452840 , ,li-4426452840,fulltime,,,,,,False,mid-senior level,Engineering and Information Technology,,,Hospitals and Health Care,https://de.linkedin.com/company/umgreifswald,,,,,,,,,,,
linkedin,Wissenschaftliche Mitarbeiterin / wissenschaftlicher Mitarbeiter (w/m/d),Julius Kühn-Institut,"Kleinmachnow, Brandenburg, Germany",,https://www.linkedin.com/jobs/view/4426822312 , ,li-4426822312,fulltime,,,,,,False,entry level,"Research, Analyst, and Information Technology",,kontakt@interamt.de,Research Services,https://de.linkedin.com/company/jki-bund,,,,,,,,,,,
linkedin,Data Analyst,Haystack,"Aurich, Lower Saxony, Germany",,https://www.linkedin.com/jobs/view/4426473523 , ,li-4426473523,fulltime,,,,,,False,mid-senior level,Information Technology,,,"Technology, Information and Internet",https://uk.linkedin.com/company/wearehaystack,,,,,,,,,,,
linkedin,Wissenschaftliche Hilfskraft (WHB) (m/w/d) mit Bachelor-Abschluss,Ruhr University Bochum,"Bochum, North Rhine-Westphalia, Germany",,https://www.linkedin.com/jobs/view/4429530170 , ,li-4429530170,fulltime,,,,,,False,entry level,"Research, Analyst, and Information Technology",,wpr@rub.de,Internet Publishing,https://de.linkedin.com/school/ruhrunibochum/,,,,,,,,,,,
linkedin,Wissenschaftliche Hilfskraft (WHK) (m/w/d) mit Master-Abschluss,Ruhr University Bochum,"Bochum, North Rhine-Westphalia, Germany",,https://www.linkedin.com/jobs/view/4429528190 , ,li-4429528190,fulltime,,,,,,False,entry level,"Research, Analyst, and Information Technology",,wpr@rub.de,Internet Publishing,https://de.linkedin.com/school/ruhrunibochum/,,,,,,,,,,,
linkedin,Wirtschaftswissenschaftler/in als Wissenschaftliche/r Mitarbeiter/in - Digitale Transformation (m/w/d),FAU Erlangen-Nürnberg,"Nuremberg, Bavaria, Germany",,https://www.linkedin.com/jobs/view/4429534656 , ,li-4429534656,fulltime,,,,,,False,entry level,Finance and Sales,,,Research Services,https://de.linkedin.com/school/fau-erlangen-n%C3%BCrnberg/,,,,,,,,,,,
linkedin,wissenschaftliche*n Mitarbeiter*in (m/w/d),Fachhochschule Braunschweig-Wolfenbüttel,"Wolfenbüttel, Lower Saxony, Germany",,https://www.linkedin.com/jobs/view/4426818900 , ,li-4426818900,fulltime,,,,,,False,entry level,"Research, Analyst, and Information Technology",,,Higher Education,https://de.linkedin.com/company/fachhochschule-braunschweig-wolfenb%C3%BCttel,,,,,,,,,,,
