site,title,company,location,date_posted,job_url,job_url_direct,id,job_type,salary_source,interval,min_amount,max_amount,currency,is_remote,job_level,job_function,listing_type,emails,company_industry,company_url,company_url_direct,company_addresses,company_num_employees,company_revenue,company_description,skills,experience_range,company_rating,company_reviews_count,vacancy_count,work_from_home_type
linkedin,"Electrical, Instrumentation & Controls Engineer (m/f/d)",Kanadevia Inova,"Gummersbach, North Rhine-Westphalia, Germany",2026-05-06,https://www.linkedin.com/jobs/view/4401792633 , ,li-4401792633,fulltime,,,,,,False,mid-senior level,Engineering and Information Technology,,,Mechanical Or Industrial Engineering,https://ch.linkedin.com/company/kanadevia-inova,,,,,,,,,,,
linkedin,Technical Solutions Engineer,SENSYS - Magnetometers & Survey Solutions,"Reichenwalde, Brandenburg, Germany",2026-05-06,https://www.linkedin.com/jobs/view/4408495847 , ,li-4408495847,fulltime,,,,,,False,associate,Engineering,,,Computers and Electronics Manufacturing,https://de.linkedin.com/company/sensysmagnetometer,,,,,,,,,,,
linkedin,Software Engineer (f/m/d) - TV,smartclip,"Berlin, Germany",2026-05-06,https://www.linkedin.com/jobs/view/4372259134 , ,li-4372259134,fulltime,,,,,,True,mid-senior level,Information Technology and Engineering,,,"Technology, Information and Internet, Online Audio and Video Media, and IT Services and IT Consulting",https://de.linkedin.com/company/smartclip,,,,,,,,,,,
linkedin,SPS- Programmierer/in (m/w/d) Softwarekonstruktion// Maschinenbau,Meypack,"Nottuln, North Rhine-Westphalia, Germany",2026-05-06,https://www.linkedin.com/jobs/view/4408841158 , ,li-4408841158,contract,,,,,,False,mid-senior level,Engineering,,recruiting@meypack.dewww.meypack.de,Machinery Manufacturing,https://de.linkedin.com/company/meypack-verpackungssystemtechnik-gmbh,,,,,,,,,,,
linkedin,"Entwicklungsingenieur Elektrik/ Elektronik, all genders",SALT AND PEPPER Group,"Hamburg, Hamburg, Germany",2026-05-06,https://www.linkedin.com/jobs/view/3983798884 , ,li-3983798884,fulltime,,,,,,False,entry level,Engineering and Information Technology,,,Engineering Services,https://de.linkedin.com/company/salt-and-pepper,,,,,,,,,,,
linkedin,Embedded Software Developer Automotive (m/f/d),smartmicro,"Brunswick, Lower Saxony, Germany",,https://www.linkedin.com/jobs/view/4410147372 , ,li-4410147372,fulltime,,,,,,False,associate,Information Technology,,,Software Development,https://de.linkedin.com/company/smartmicro,,,,,,,,,,,
linkedin,Embedded Software Engineer,NXP Semiconductors,"Hamburg, Hamburg, Germany",,https://www.linkedin.com/jobs/view/4393236614 , ,li-4393236614,fulltime,,,,,,True,mid-senior level,Engineering and Information Technology,,maria.bertesteanu@nxp.com,"Semiconductor Manufacturing, Computers and Electronics Manufacturing, and Software Development",https://nl.linkedin.com/company/nxp-semiconductors,,,,,,,,,,,
linkedin,Embedded Softwareentwickler - Automotive (m/w/d),smartmicro,"Brunswick, Lower Saxony, Germany",,https://www.linkedin.com/jobs/view/4410132576 , ,li-4410132576,fulltime,,,,,,False,associate,Information Technology,,,IT Services and IT Consulting,https://de.linkedin.com/company/smartmicro,,,,,,,,,,,
linkedin,Embedded Software Engineer (m/w/d) – Autonomous Driving,Teoresi Group,,,https://www.linkedin.com/jobs/view/4410165974 , ,li-4410165974,fulltime,,,,,,True,entry level,Engineering,,,Engineering Services,https://it.linkedin.com/company/teoresigroup,,,,,,,,,,,
linkedin,Embedded Software Entwickler (m/w/d),SThree,"Oberkochen, Baden-Württemberg, Germany",,https://www.linkedin.com/jobs/view/4410129374 , ,li-4410129374,fulltime,,,,,,False,not applicable,Information Technology,,a.pellecchia@progressive.de,Information Services,https://uk.linkedin.com/company/sthree-plc,,,,,,,,,,,
linkedin,PLC Software Engineer (m/f/d) - Lübeck,Code Compass 🧭,"Lübeck, Schleswig-Holstein, Germany",,https://www.linkedin.com/jobs/view/4410190668 , ,li-4410190668,fulltime,,,,,,True,mid-senior level,"Information Technology, Engineering, and Other",,,"Staffing and Recruiting, IT Services and IT Consulting, and Technology, Information and Media",https://ch.linkedin.com/company/code-compass,,,,,,,,,,,
linkedin,Embedded Software Ingenieur (m/w/d),SAX Power GmbH,"Erbach, Baden-Württemberg, Germany",,https://www.linkedin.com/jobs/view/4413573302 , ,li-4413573302,fulltime,,,,,,False,mid-senior level,Engineering and Information Technology,,,Renewable Energy Semiconductor Manufacturing,https://de.linkedin.com/company/sax-power-gmbh,,,,,,,,,,,
linkedin,Embedded Software Developer C++ (m/w/d),Proway GmbH,"Oberkochen, Baden-Württemberg, Germany",,https://www.linkedin.com/jobs/view/4410184718 , ,li-4410184718,fulltime,,,,,,False,mid-senior level,Engineering and Information Technology,,bewerbung@proway.de,IT Services and IT Consulting,https://de.linkedin.com/company/proway-gmbh,,,,,,,,,,,
linkedin,Embedded Software Engineer – Board Controller (m/w/d),ACONEXT,"Dresden, Saxony, Germany",,https://www.linkedin.com/jobs/view/4413566431 , ,li-4413566431,fulltime,,,,,,False,entry level,Engineering and Information Technology,,,Engineering Services,https://de.linkedin.com/company/aconext-holding-gmbh,,,,,,,,,,,
linkedin,Senior Hardware Engineer (m/f/x),atmio,"Hamburg, Hamburg, Germany",,https://www.linkedin.com/jobs/view/4406396034 , ,li-4406396034,fulltime,,,,,,False,mid-senior level,Engineering,,,IT Services and IT Consulting,https://de.linkedin.com/company/useatmio,,,,,,,,,,,
linkedin,AIT Electrical Engineer (all gender),ALTEN,"Friedrichshafen, Baden-Württemberg, Germany",,https://www.linkedin.com/jobs/view/4410132204 , ,li-4410132204,fulltime,,,,,,False,executive,Information Technology,,,Software Development and IT Services and IT Consulting,https://fr.linkedin.com/company/alten,,,,,,,,,,,
linkedin,Hardware Test Engineer (m/w/d),YER Deutschland,,,https://www.linkedin.com/jobs/view/4410190126 , ,li-4410190126,fulltime,,,,,,False,entry level,Engineering,,,Aviation and Aerospace Component Manufacturing,https://de.linkedin.com/company/yerdeutschland,,,,,,,,,,,
linkedin,Lead Electrical and Instrumentation Engineer,ENG Bauen,,,https://www.linkedin.com/jobs/view/4410193487 , ,li-4410193487,fulltime,,,,,,False,mid-senior level,"Engineering, Project Management, and Consulting",,,"Electric Power Transmission, Control, and Distribution, Oil and Gas, and Engineering Services",https://www.linkedin.com/company/eng-bauen-recruitment,,,,,,,,,,,
linkedin,"Design Engineer 3 - Stuttgart, Germany","M.C. Dean, Inc.","Stuttgart, Baden-Württemberg, Germany",,https://www.linkedin.com/jobs/view/4413209341 , ,li-4413209341,fulltime,,,,,,False,not applicable,Engineering and Information Technology,,,Design Services,https://www.linkedin.com/company/m-c-dean-inc,,,,,,,,,,,
linkedin,Hardware Validation Engineer – Accelerator Boards,OPENCHIP & SOFTWARE TECHNOLOGIES,"Karlsruhe, Baden-Württemberg, Germany",,https://www.linkedin.com/jobs/view/4329935795 , ,li-4329935795,fulltime,,,,,,False,mid-senior level,Quality Assurance,,,Software Development,https://es.linkedin.com/company/openchip-software-technologies,,,,,,,,,,,
linkedin,Experienced Cellular IP Design Engineer (m/f/d),Apple,"Munich, Bavaria, Germany",,https://www.linkedin.com/jobs/view/4413586644 , ,li-4413586644,fulltime,,,,,,False,mid-senior level,Engineering and Information Technology,,,Computers and Electronics Manufacturing,https://www.linkedin.com/company/apple,,,,,,,,,,,
linkedin,GNC Engineer,The Exploration Company,"Munich, Bavaria, Germany",,https://www.linkedin.com/jobs/view/4321304490 , ,li-4321304490,fulltime,,,,,,False,entry level,Engineering and Information Technology,,,Aviation and Aerospace Component Manufacturing,https://de.linkedin.com/company/exploration-company,,,,,,,,,,,
linkedin,Optical Engineer - Freelance AI Trainer,Mindrift,"Hamburg, Hamburg, Germany",,https://www.linkedin.com/jobs/view/4413290702 , ,li-4413290702,parttime,,,,,,False,entry level,Other,,,IT Services and IT Consulting,https://www.linkedin.com/company/mindrift-ai,,,,,,,,,,,
linkedin,Optical Engineer - Freelance AI Trainer,Mindrift,"Frankfurt am Main, Hesse, Germany",,https://www.linkedin.com/jobs/view/4413293738 , ,li-4413293738,parttime,,,,,,False,entry level,Other,,,IT Services and IT Consulting,https://www.linkedin.com/company/mindrift-ai,,,,,,,,,,,
linkedin,Optical Engineer - Freelance AI Trainer,Mindrift,"Berlin, Berlin, Germany",,https://www.linkedin.com/jobs/view/4413299702 , ,li-4413299702,parttime,,,,,,False,entry level,Other,,,IT Services and IT Consulting,https://www.linkedin.com/company/mindrift-ai,,,,,,,,,,,
linkedin,Optical Engineer - Freelance AI Trainer,Mindrift,,,https://www.linkedin.com/jobs/view/4413400702 , ,li-4413400702,parttime,,,,,,False,entry level,Other,,,IT Services and IT Consulting,https://www.linkedin.com/company/mindrift-ai,,,,,,,,,,,
linkedin,Optical Engineer - Freelance AI Trainer,Mindrift,"Munich, Bavaria, Germany",,https://www.linkedin.com/jobs/view/4413287816 , ,li-4413287816,parttime,,,,,,False,entry level,Other,,,IT Services and IT Consulting,https://www.linkedin.com/company/mindrift-ai,,,,,,,,,,,
linkedin,Optical Engineer - Freelance AI Trainer,Mindrift,"Stuttgart, Baden-Württemberg, Germany",,https://www.linkedin.com/jobs/view/4413287805 , ,li-4413287805,parttime,,,,,,False,entry level,Other,,,IT Services and IT Consulting,https://www.linkedin.com/company/mindrift-ai,,,,,,,,,,,
linkedin,AI & Optimization Engineer,Jobgether,,,https://www.linkedin.com/jobs/view/4413510294 , ,li-4413510294,fulltime,,,,,,True,mid-senior level,Engineering and Information Technology,,,Internet Marketplace Platforms,https://be.linkedin.com/company/jobgether,,,,,,,,,,,
linkedin,Senior Development Engineer Transmission Technology (m/f/d) Wireless Foundation,Sennheiser,"Wedemark, Lower Saxony, Germany",,https://www.linkedin.com/jobs/view/4394717980 , ,li-4394717980,fulltime,,,,,,False,mid-senior level,Engineering and Information Technology,,jobs@sennheiser.com,"Appliances, Electrical, and Electronics Manufacturing",https://de.linkedin.com/company/sennheiser,,,,,,,,,,,
linkedin,Software Engineer,"Legrand, North America","Zwickau, Saxony, Germany",,https://www.linkedin.com/jobs/view/4410176121 , ,li-4410176121,fulltime,,,,,,True,entry level,Engineering and Information Technology,,zwickau@raritan.com,"Appliances, Electrical, and Electronics Manufacturing",https://www.linkedin.com/company/legrand-north-america,,,,,,,,,,,
linkedin,Image Processing Engineer - Medical Devices (m/f/d),Alcon,"Teltow, Brandenburg, Germany",,https://www.linkedin.com/jobs/view/4413412116 , ,li-4413412116,fulltime,,,,,,False,mid-senior level,Engineering and Information Technology,,,Medical Equipment Manufacturing,https://ch.linkedin.com/company/alcon,,,,,,,,,,,
linkedin,App-Entwickler mwd,ChoiceSelect PERSONALBERATUNG,"Bad Saulgau, Baden-Württemberg, Germany",,https://www.linkedin.com/jobs/view/4413407414 , ,li-4413407414,fulltime,,,,,,False,associate,"Information Technology, Product Management, and Art/Creative",,,"IT System Custom Software Development, Commercial and Service Industry Machinery Manufacturing, and Technology, Information and Media",https://de.linkedin.com/company/choice-select-personalberatung,,,,,,,,,,,
linkedin,AI Operations & Workflow Specialist (m/w/d),Roger,"Berlin, Berlin, Germany",,https://www.linkedin.com/jobs/view/4410154595 , ,li-4410154595,fulltime,,,,,,False,associate,Analyst,,,Software Development,https://de.linkedin.com/company/goroger,,,,,,,,,,,
linkedin,Entwickler für Systemintegration / Integration Engineer (m/w/d),D+H Deutschland GmbH,"Bünningstedt, Schleswig-Holstein, Germany",,https://www.linkedin.com/jobs/view/4410172163 , ,li-4410172163,fulltime,,,,,,False,associate,Information Technology,,,Software Development,https://de.linkedin.com/company/d-h-deutschland,,,,,,,,,,,
linkedin,SPS-Programmierer (m/w/d),HARTING Technology Group,"Espelkamp, North Rhine-Westphalia, Germany",,https://www.linkedin.com/jobs/view/4413574139 , ,li-4413574139,fulltime,,,,,,False,entry level,Engineering and Information Technology,,,Automation Machinery Manufacturing,https://de.linkedin.com/company/harting,,,,,,,,,,,
linkedin,Tech Lead Product Engineering (m/w/d) - Python / KI / Web-Services | Healthcare Startup | 65.000 - 75.000 € brutto/Jahr Grundgehalt,DOCMAiTE,"Göttingen, Lower Saxony, Germany",,https://www.linkedin.com/jobs/view/4410154831 , ,li-4410154831,fulltime,,,,,,False,mid-senior level,Information Technology,,,Software Development,https://de.linkedin.com/company/docmaite,,,,,,,,,,,
linkedin,Software Engineer,Haystack,,,https://www.linkedin.com/jobs/view/4413545111 , ,li-4413545111,fulltime,,,,,,False,mid-senior level,Information Technology,,,"Technology, Information and Internet",https://uk.linkedin.com/company/wearehaystack,,,,,,,,,,,
linkedin,Systems Engineer,Applied Intuition,"Stuttgart, Baden-Württemberg, Germany",,https://www.linkedin.com/jobs/view/4330211316 , ,li-4330211316,fulltime,,,,,,True,mid-senior level,Information Technology,,,Software Development,https://www.linkedin.com/company/applied-intuition-inc,,,,,,,,,,,
linkedin,Automation Engineer / Team Coordinator (m/w/d),Michael Page,"Friedberg, Hesse, Germany",,https://www.linkedin.com/jobs/view/4412954919 , ,li-4412954919,fulltime,,,,,,False,director,Manufacturing and Engineering,,,Staffing and Recruiting,https://uk.linkedin.com/company/michael-page,,,,,,,,,,,
linkedin,"Palantir Foundry Engineer (Frankfurt or Munich, Germany)",Unit8,"Frankfurt, Hesse, Germany",,https://www.linkedin.com/jobs/view/4410182454 , ,li-4410182454,fulltime,,,,,,False,mid-senior level,Engineering,,,IT Services and IT Consulting,https://ch.linkedin.com/company/unit8,,,,,,,,,,,
linkedin,Software Engineer - AI First (w/m/d) - GAPTEQ GmbH,Jobs via eFinancialCareers,"Brannenburg, Bavaria, Germany",,https://www.linkedin.com/jobs/view/4413417379 , ,li-4413417379,fulltime,,,,,,False,entry level,Engineering and Information Technology,,,Software Development,https://uk.linkedin.com/company/jobs-on-efinancialcareers,,,,,,,,,,,
linkedin,System Safety Ingenieur mit Schwerpunkt Maschinenverordnung und Cyber Resilience Act (m/w/d),SIEB & MEYER AG,"Lunenburg, Lower Saxony, Germany",,https://www.linkedin.com/jobs/view/4413464576 , ,li-4413464576,fulltime,,,,,,False,associate,Quality Assurance,,,"Appliances, Electrical, and Electronics Manufacturing",https://de.linkedin.com/company/sieb-&-meyer-ag,,,,,,,,,,,
linkedin,Senior Antenna Technology Developer,Umbilical Advanced,"Bavaria, Germany",,https://www.linkedin.com/jobs/view/4413569928 , ,li-4413569928,fulltime,,,,,,False,mid-senior level,Engineering,,,Staffing and Recruiting,https://de.linkedin.com/company/umbilical-advanced,,,,,,,,,,,
linkedin,Senior Expert in Protection & Resilience (m/f/d) at Allianz SE,Allianz,"Munich, Bavaria, Germany",,https://www.linkedin.com/jobs/view/4411354968 , ,li-4411354968,fulltime,,,,,,False,mid-senior level,Information Technology,,-SERVICES@allianz.com,Financial Services and Insurance,https://de.linkedin.com/company/allianz,,,,,,,,,,,
linkedin,System Engineer m/w/d Linux & Cloud (7816) - FLYERALARM GmbH,Jobs via eFinancialCareers,"Würzburg, Bavaria, Germany",,https://www.linkedin.com/jobs/view/4413420392 , ,li-4413420392,fulltime,,,,,,False,entry level,Information Technology,,,IT Services and IT Consulting,https://uk.linkedin.com/company/jobs-on-efinancialcareers,,,,,,,,,,,
linkedin,DevOps Engineer (all genders) in München - PRODYNA SE,Jobs via eFinancialCareers,"Munich, Bavaria, Germany",,https://www.linkedin.com/jobs/view/4413420393 , ,li-4413420393,fulltime,,,,,,False,entry level,Information Technology,,,IT Services and IT Consulting,https://uk.linkedin.com/company/jobs-on-efinancialcareers,,,,,,,,,,,
linkedin,Data Engineer (all genders) in Düsseldorf - PRODYNA SE,Jobs via eFinancialCareers,"Düsseldorf, North Rhine-Westphalia, Germany",,https://www.linkedin.com/jobs/view/4408818779 , ,li-4408818779,fulltime,,,,,,False,mid-senior level,Information Technology,,,IT Services and IT Consulting,https://uk.linkedin.com/company/jobs-on-efinancialcareers,,,,,,,,,,,
linkedin,"Mechanical Design Engineer (m/w/d, all levels) - Closures Engineering - Berlin, Germany",Tesla,"Berlin, Berlin, Germany",,https://www.linkedin.com/jobs/view/4413475512 , ,li-4413475512,fulltime,,,,,,False,entry level,Engineering and Information Technology,,,"Motor Vehicle Manufacturing, Renewable Energy Semiconductor Manufacturing, and Utilities",https://www.linkedin.com/company/tesla-motors,,,,,,,,,,,
linkedin,Design Engineer (d/f/m),Airbus,"Munich, Bavaria, Germany",,https://www.linkedin.com/jobs/view/4410128554 , ,li-4410128554,fulltime,,,,,,False,mid-senior level,Engineering and Information Technology,,emsom@airbus.com,Aviation and Aerospace Component Manufacturing,https://fr.linkedin.com/company/airbusgroup,,,,,,,,,,,
linkedin,Projektmanager (m/w/d) Architektur & Ingenieur Design,AECOM,"Essen, North Rhine-Westphalia, Germany",,https://www.linkedin.com/jobs/view/4412949958 , ,li-4412949958,fulltime,,,,,,True,mid-senior level,Project Management and Information Technology,,,"Architecture and Planning, Civil Engineering, and Construction",https://www.linkedin.com/company/aecom,,,,,,,,,,,
