site,title,company,location,date_posted,job_url,job_url_direct,id,job_type,salary_source,interval,min_amount,max_amount,currency,is_remote,job_level,job_function,listing_type,emails,company_industry,company_url,company_url_direct,company_addresses,company_num_employees,company_revenue,company_description,skills,experience_range,company_rating,company_reviews_count,vacancy_count,work_from_home_type
linkedin,Navigation System Engineer (d/m/w),Airbus Defence and Space,"Manching, Bavaria, Germany",2026-05-30,https://www.linkedin.com/jobs/view/4412440676 , ,li-4412440676,parttime,,,,,,False,mid-senior level,Information Technology,,emsom@airbus.com,Defense and Space Manufacturing,https://www.linkedin.com/company/airbus-defence-and-space,,,,,,,,,,,
linkedin,AI Solutions Specialist (m/w/d),MINDA,"Minden, North Rhine-Westphalia, Germany",2026-05-30,https://www.linkedin.com/jobs/view/4421343124 , ,li-4421343124,fulltime,,,,,,False,mid-senior level,Information Technology,,personal@minda.com,Information Technology & Services,https://de.linkedin.com/company/minda-industrieanlagen-gmbh,,,,,,,,,,,
linkedin,Systemingenieur MBSE Defence (m/w/d),ep group,"Altenstadt, Bavaria, Germany",2026-05-30,https://www.linkedin.com/jobs/view/4421277293 , ,li-4421277293,fulltime,,,,,,False,mid-senior level,Information Technology,,,Alternative Dispute Resolution and Alternative Medicine,https://de.linkedin.com/company/ep-group-gmbh,,,,,,,,,,,
linkedin,M365 System Engineer – Schwerpunkt Exchange Online (m/w/d),Ratiodata,"Coblenz, Rhineland-Palatinate, Germany",2026-05-30,https://www.linkedin.com/jobs/view/4367254013 , ,li-4367254013,fulltime,,,,,,False,mid-senior level,Information Technology,,,IT Services and IT Consulting,https://de.linkedin.com/company/ratiodata,,,,,,,,,,,
linkedin,DevOps Engineer (all genders) in München - PRODYNA SE,Jobs via eFinancialCareers,"Munich, Bavaria, Germany",2026-05-30,https://www.linkedin.com/jobs/view/4421339028 , ,li-4421339028,fulltime,,,,,,False,entry level,Information Technology,,,IT Services and IT Consulting,https://uk.linkedin.com/company/jobs-on-efinancialcareers,,,,,,,,,,,
linkedin,System Engineer m/w/d Linux & Cloud (7816) - FLYERALARM GmbH,Jobs via eFinancialCareers,"Würzburg, Bavaria, Germany",2026-05-30,https://www.linkedin.com/jobs/view/4421316868 , ,li-4421316868,fulltime,,,,,,False,entry level,Information Technology,,,IT Services and IT Consulting,https://uk.linkedin.com/company/jobs-on-efinancialcareers,,,,,,,,,,,
linkedin,"Space Systems Engineer, Space Operations",Planet,"Berlin, Berlin, Germany",2026-05-30,https://www.linkedin.com/jobs/view/4403140261 , ,li-4403140261,fulltime,,,,,,True,mid-senior level,Information Technology,,"accommodations@planet.com, accommodations@planet.com",Software Development,https://www.linkedin.com/company/planet-labs,,,,,,,,,,,
linkedin,Optical Engineer - Freelance AI Trainer,Mindrift,"Hamburg, Hamburg, Germany",2026-05-30,https://www.linkedin.com/jobs/view/4421333430 , ,li-4421333430,parttime,,,,,,False,entry level,Other,,,IT Services and IT Consulting,https://www.linkedin.com/company/mindrift-ai,,,,,,,,,,,
linkedin,Optical Engineer - Freelance AI Trainer,Mindrift,"Stuttgart, Baden-Württemberg, Germany",2026-05-30,https://www.linkedin.com/jobs/view/4421318492 , ,li-4421318492,parttime,,,,,,False,entry level,Other,,,IT Services and IT Consulting,https://www.linkedin.com/company/mindrift-ai,,,,,,,,,,,
linkedin,Optical Engineer - Freelance AI Trainer,Mindrift,"Munich, Bavaria, Germany",2026-05-30,https://www.linkedin.com/jobs/view/4421328524 , ,li-4421328524,parttime,,,,,,False,entry level,Other,,,IT Services and IT Consulting,https://www.linkedin.com/company/mindrift-ai,,,,,,,,,,,
linkedin,Embedded Software Developer (m/w/d),NDT Global,"Stutensee, Baden-Württemberg, Germany",2026-05-30,https://www.linkedin.com/jobs/view/4355243040 , ,li-4355243040,fulltime,,,,,,False,mid-senior level,Engineering and Information Technology,,,Energy Technology,https://ca.linkedin.com/company/ndt-global,,,,,,,,,,,
linkedin,Optical Engineer - Freelance AI Trainer,Mindrift,"Frankfurt am Main, Hesse, Germany",2026-05-30,https://www.linkedin.com/jobs/view/4421325406 , ,li-4421325406,parttime,,,,,,False,entry level,Other,,,IT Services and IT Consulting,https://www.linkedin.com/company/mindrift-ai,,,,,,,,,,,
linkedin,Optical Engineer - Freelance AI Trainer,Mindrift,"Berlin, Berlin, Germany",2026-05-30,https://www.linkedin.com/jobs/view/4421318490 , ,li-4421318490,parttime,,,,,,False,entry level,Other,,,IT Services and IT Consulting,https://www.linkedin.com/company/mindrift-ai,,,,,,,,,,,
linkedin,Optical Engineer - Freelance AI Trainer,Mindrift,,2026-05-30,https://www.linkedin.com/jobs/view/4421329425 , ,li-4421329425,parttime,,,,,,False,entry level,Other,,,IT Services and IT Consulting,https://www.linkedin.com/company/mindrift-ai,,,,,,,,,,,
linkedin,Systemingenieur / Projektingenieur (m/w/d) - Marine Systems (Defense),Bertrandt Group,"Kiel, Schleswig-Holstein, Germany",2026-05-29,https://www.linkedin.com/jobs/view/4422009737 , ,li-4422009737,fulltime,,,,,,True,entry level,Information Technology,,,Engineering Services,https://de.linkedin.com/company/bertrandt-ag,,,,,,,,,,,
linkedin,System Engineer IP-Netze (m/w/d),BRIGHT Consulting GmbH,"Backnang, Baden-Württemberg, Germany",2026-05-29,https://www.linkedin.com/jobs/view/4417943597 , ,li-4417943597,fulltime,,,,,,False,associate,Engineering,,,Industrial Machinery Manufacturing,https://de.linkedin.com/company/bright-consulting-gmbh,,,,,,,,,,,
linkedin,System Engineer - Backup & Monitoring (m/w/d),Skaylink,"Munich, Bavaria, Germany",2026-05-29,https://www.linkedin.com/jobs/view/4419895356 , ,li-4419895356,fulltime,,,,,,False,mid-senior level,Information Technology,,,IT Services and IT Consulting,https://de.linkedin.com/company/skaylink,,,,,,,,,,,
linkedin,Collaboration Systems Engineer (d/f/m),Personio,"Munich, Bavaria, Germany",2026-05-29,https://www.linkedin.com/jobs/view/4400427805 , ,li-4400427805,fulltime,,,,,,True,mid-senior level,Information Technology,,,Software Development,https://de.linkedin.com/company/personio,,,,,,,,,,,
linkedin,"AI Engineer (m/w/x) Cloud, DevOps & Data Engineering",SII Germany,"Munich, Bavaria, Germany",2026-05-29,https://www.linkedin.com/jobs/view/4420968899 , ,li-4420968899,fulltime,,,,,,False,mid-senior level,Engineering and Information Technology,,,IT Services and IT Consulting,https://de.linkedin.com/company/sii-germany,,,,,,,,,,,
linkedin,ICT System Engineer Network (a) 80-100%,Spital Emmental,"Burgdorf, Lower Saxony, Germany",2026-05-29,https://www.linkedin.com/jobs/view/4422056378 , ,li-4422056378,fulltime,,,,,,False,mid-senior level,Information Technology,,,"Health, Wellness & Fitness",https://ch.linkedin.com/company/spital-emmental,,,,,,,,,,,
linkedin,Quality Engineer (m/w/d),Magna International,"Neuenstadt am Kocher, Baden-Württemberg, Germany",2026-05-29,https://www.linkedin.com/jobs/view/4371014195 , ,li-4371014195,fulltime,,,,,,False,entry level,Quality Assurance,,,Motor Vehicle Manufacturing,https://ca.linkedin.com/company/magna-international,,,,,,,,,,,
linkedin,Entwicklungsingenieur (m/w/d) Elektronik für Mobile Devices,Pepperl+Fuchs Group,"Assamstadt, Baden-Württemberg, Germany",2026-05-29,https://www.linkedin.com/jobs/view/4420983186 , ,li-4420983186,fulltime,,,,,,False,entry level,Engineering and Information Technology,,,Automation Machinery Manufacturing,https://de.linkedin.com/company/pepperl-fuchs-group,,,,,,,,,,,
linkedin,Senior Electronics Engineer - Embedded Systems (m/f/x),go-e,"Berlin, Germany",2026-05-29,https://www.linkedin.com/jobs/view/4421790568 , ,li-4421790568,fulltime,,,,,,False,mid-senior level,Engineering,,,"Appliances, Electrical, and Electronics Manufacturing",https://at.linkedin.com/company/go-e-gmbh,,,,,,,,,,,
linkedin,Senior Robotics Hardware Engineer,Lawrence Harvey,"Munich, Bavaria, Germany",2026-05-29,https://www.linkedin.com/jobs/view/4418262945 , ,li-4418262945,fulltime,,,,,,False,mid-senior level,Engineering and Information Technology,,,"Robot Manufacturing, Robotics Engineering, and Automation Machinery Manufacturing",https://uk.linkedin.com/company/lawrence-harvey,,,,,,,,,,,
linkedin,Electronics Engineer / Hardware Engineer,Incoretex GmbH,"Aachen, North Rhine-Westphalia, Germany",2026-05-29,https://www.linkedin.com/jobs/view/4417910444 , ,li-4417910444,fulltime,,,,,,False,associate,Engineering,,,IT Services and IT Consulting,https://de.linkedin.com/company/incoretex,,,,,,,,,,,
linkedin,"AI Engineer (m/w/x) Cloud, DevOps & Data Engineering",Groupe SII,"Munich, Bavaria, Germany",2026-05-29,https://www.linkedin.com/jobs/view/4420979763 , ,li-4420979763,fulltime,,,,,,False,mid-senior level,Engineering and Information Technology,,,IT Services and IT Consulting,https://fr.linkedin.com/company/sii,,,,,,,,,,,
linkedin,RF & EMC Engineer,Helsing,"Munich, Bavaria, Germany",2026-05-29,https://www.linkedin.com/jobs/view/4417959663 , ,li-4417959663,fulltime,,,,,,True,mid-senior level,Engineering and Information Technology,,,Software Development,https://de.linkedin.com/company/helsing,,,,,,,,,,,
linkedin,Embedded Firmware Developer (Agri-Tech / Sensor Systems) (m/f/d),stenon,"Potsdam, Brandenburg, Germany",2026-05-29,https://www.linkedin.com/jobs/view/4418314474 , ,li-4418314474,fulltime,,,,,,False,associate,Information Technology,,,IT Services and IT Consulting,https://de.linkedin.com/company/stenon,,,,,,,,,,,
linkedin,Software Engineer – Aerospace (m/f/d),PACE Aerospace & IT,"Bavaria, Germany",2026-05-29,https://www.linkedin.com/jobs/view/4410813293 , ,li-4410813293,fulltime,,,,,,False,entry level,Engineering and Information Technology,,,Software Development,https://de.linkedin.com/company/pace-gmbh,,,,,,,,,,,
linkedin,Gameplay Engineer,Techtive Games,,2026-05-29,https://www.linkedin.com/jobs/view/4417940856 , ,li-4417940856,contract,,,,,,False,associate,Other,,,Computer Games,https://de.linkedin.com/company/techtive-games,,,,,,,,,,,
linkedin,Embedded Software Engineer,Optimus Search,"Karlsruhe, Baden-Württemberg, Germany",2026-05-29,https://www.linkedin.com/jobs/view/4417929177 , ,li-4417929177,fulltime,,,,,,False,mid-senior level,Engineering and Information Technology,,,"Semiconductor Manufacturing, Computers and Electronics Manufacturing, and Computer Hardware Manufacturing",https://uk.linkedin.com/company/optimus-search,,,,,,,,,,,
linkedin,Field Service Engineer (Solar PV / Inverter Systems),Manning Global AG,,2026-05-29,https://www.linkedin.com/jobs/view/4417945849 , ,li-4417945849,fulltime,,,,,,False,mid-senior level,Engineering,,,IT Services and IT Consulting,https://de.linkedin.com/company/manning-global-gmbh,,,,,,,,,,,
linkedin,Test & Integration Engineer – Embedded Systems (f/m/d),Green Fusion,"Berlin, Berlin, Germany",2026-05-29,https://www.linkedin.com/jobs/view/4417954658 , ,li-4417954658,fulltime,,,,,,True,entry level,Engineering,,,Software Development,https://de.linkedin.com/company/green-fusion-gmbh,,,,,,,,,,,
linkedin,PCB Design Senior Engineer,OPENCHIP & SOFTWARE TECHNOLOGIES,"Karlsruhe, Baden-Württemberg, Germany",2026-05-29,https://www.linkedin.com/jobs/view/4421795884 , ,li-4421795884,fulltime,,,,,,False,mid-senior level,Engineering and Information Technology,,,Software Development,https://es.linkedin.com/company/openchip-software-technologies,,,,,,,,,,,
linkedin,PCB Layout Engineer / Leiterplattenentwickler (all gender),ALTEN Germany,,2026-05-29,https://www.linkedin.com/jobs/view/4399047212 , ,li-4399047212,fulltime,,,,,,False,associate,Project Management,,,IT Services and IT Consulting,https://de.linkedin.com/company/altengermany,,,,,,,,,,,
linkedin,QA Engineer (all),mediaire,"Berlin, Berlin, Germany",2026-05-29,https://www.linkedin.com/jobs/view/4417939996 , ,li-4417939996,fulltime,,,,,,True,associate,Information Technology,,,Software Development,https://de.linkedin.com/company/mediaire,,,,,,,,,,,
linkedin,Principal Voice AI Engineer,Zendesk,"Berlin, Berlin, Germany",2026-05-29,https://www.linkedin.com/jobs/view/4388476482 , ,li-4388476482,fulltime,,,,,,True,mid-senior level,Engineering and Information Technology,,peopleandplaces@zendesk.com,Software Development,https://www.linkedin.com/company/zendesk,,,,,,,,,,,
linkedin,Hardware Engineer (f/m/d),Futurail,"Munich, Bavaria, Germany",2026-05-29,https://www.linkedin.com/jobs/view/4399864067 , ,li-4399864067,fulltime,,,,,,False,mid-senior level,Engineering,,,Software Development,https://de.linkedin.com/company/futurail,,,,,,,,,,,
linkedin,System Engineer,AVILUS,"Munich, Bavaria, Germany",2026-05-29,https://www.linkedin.com/jobs/view/4420973563 , ,li-4420973563,fulltime,,,,,,False,associate,Engineering,,,Aviation and Aerospace Component Manufacturing,https://de.linkedin.com/company/avilus,,,,,,,,,,,
linkedin,Forschungsingenieur für Fertigungstechnik mit dem Schwerpunkt datengestützter Prozessoptimierung und Modellierung (w/m/div.),Bosch,"Renningen, Baden-Württemberg, Germany",2026-05-29,https://www.linkedin.com/jobs/view/4421780608 , ,li-4421780608,fulltime,,,,,,False,associate,Research,,,Software Development,https://de.linkedin.com/company/bosch,,,,,,,,,,,
linkedin,Software Developer Simulation (d/f/m),Airbus Defence and Space,"Manching, Bavaria, Germany",2026-05-29,https://www.linkedin.com/jobs/view/4379356006 , ,li-4379356006,parttime,,,,,,False,mid-senior level,Engineering and Information Technology,,emsom@airbus.com,Defense and Space Manufacturing,https://www.linkedin.com/company/airbus-defence-and-space,,,,,,,,,,,
linkedin,Systemingenieur für Satellitenkommunikation (m/w/d),ACONEXT,"Munich, Bavaria, Germany",2026-05-28,https://www.linkedin.com/jobs/view/4417609437 , ,li-4417609437,fulltime,,,,,,False,associate,Engineering,,,Defense and Space Manufacturing and Engineering Services,https://de.linkedin.com/company/aconext-holding-gmbh,,,,,,,,,,,
linkedin,Senior RF Design Engineer,indie.inc,"Frankfurt an der Oder, Brandenburg, Germany",2026-05-28,https://www.linkedin.com/jobs/view/4389973044 , ,li-4389973044,fulltime,,,,,,False,mid-senior level,Engineering and Information Technology,,,Semiconductor Manufacturing,https://www.linkedin.com/company/indieinc,,,,,,,,,,,
linkedin,Embedded Software Engineer,Optimus Search,"Hamburg, Germany",2026-05-28,https://www.linkedin.com/jobs/view/4417611213 , ,li-4417611213,fulltime,,,,,,False,mid-senior level,Engineering and Information Technology,,,"Defense and Space Manufacturing, Aviation and Aerospace Component Manufacturing, and Space Research and Technology",https://uk.linkedin.com/company/optimus-search,,,,,,,,,,,
linkedin,System Engineer,ASAP Staffing Ltd,"Freiburg, Baden-Württemberg, Germany",2026-05-28,https://www.linkedin.com/jobs/view/4419083374 , ,li-4419083374,contract,,,,,,False,mid-senior level,Engineering,,,IT Services and IT Consulting,https://uk.linkedin.com/company/a-sap-staffing-ltd,,,,,,,,,,,
linkedin,System Engineer (all genders) – SAN/Storage,DATAGROUP Enterprise,"Ingelheim am Rhein, Rhineland-Palatinate, Germany",2026-05-28,https://www.linkedin.com/jobs/view/4419330108 , ,li-4419330108,fulltime,,,,,,False,mid-senior level,Information Technology,,,IT Services and IT Consulting,https://de.linkedin.com/company/sap-datagroup,,,,,,,,,,,
linkedin,System Engineer (m/w/d) Raum Bayern,Medialine Group,"Munich, Bavaria, Germany",2026-05-28,https://www.linkedin.com/jobs/view/4417667104 , ,li-4417667104,fulltime,,,,,,False,associate,Information Technology,,,IT Services and IT Consulting,https://de.linkedin.com/company/medialine-eurotrade-ag,,,,,,,,,,,
linkedin,Systemingenieur (w/m/d),WITTENSTEIN group,"Igersheim, Baden-Württemberg, Germany",2026-05-28,https://www.linkedin.com/jobs/view/4258391767 , ,li-4258391767,fulltime,,,,,,False,associate,Research and Engineering,,,Automation Machinery Manufacturing,https://de.linkedin.com/company/wittenstein-group,,,,,,,,,,,
linkedin,Project Manager (m/f/d) at Allianz SE,Allianz,"Munich, Bavaria, Germany",2026-05-28,https://www.linkedin.com/jobs/view/4420405502 , ,li-4420405502,fulltime,,,,,,False,mid-senior level,Information Technology,,-SERVICES@allianz.com,Financial Services and Insurance,https://de.linkedin.com/company/allianz,,,,,,,,,,,
linkedin,Embedded Softwareentwickler im Bereich Softwareentwicklung (m/w/d),Liebherr Aerospace and Transportation,"Lindenberg im Allgäu, Bavaria, Germany",2026-05-28,https://www.linkedin.com/jobs/view/4419093189 , ,li-4419093189,fulltime,,,,,,False,mid-senior level,Engineering and Information Technology,,,Industrial Machinery Manufacturing,https://fr.linkedin.com/company/liebherr-aerospace-and-transportation,,,,,,,,,,,
linkedin,Embedded Softwareentwickler Traffic Management Systems(m/w/d),smartmicro,"Brunswick, Lower Saxony, Germany",2026-05-28,https://www.linkedin.com/jobs/view/4417624040 , ,li-4417624040,fulltime,,,,,,False,associate,Information Technology,,,IT Services and IT Consulting,https://de.linkedin.com/company/smartmicro,,,,,,,,,,,
linkedin,Linux Software Engineer (m/f/d),Quantum Systems,,2026-05-28,https://www.linkedin.com/jobs/view/4419076609 , ,li-4419076609,fulltime,,,,,,True,mid-senior level,Information Technology,,,"Technology, Information and Internet",https://de.linkedin.com/company/quantum-systems-gmbh,,,,,,,,,,,
linkedin,Senior Embedded System Engineer,Optimus Search,"Dortmund, North Rhine-Westphalia, Germany",2026-05-28,https://www.linkedin.com/jobs/view/4417617163 , ,li-4417617163,fulltime,,,,,,False,not applicable,Engineering and Information Technology,,,"Energy Technology, Services for Renewable Energy, and Oil and Gas",https://uk.linkedin.com/company/optimus-search,,,,,,,,,,,
linkedin,"(Power) Electronic/Electrical Design Engineer, Drive/Traction Inverter (Powertrain) (m/f/d)",Tesla,"Berlin, Berlin, Germany",2026-05-28,https://www.linkedin.com/jobs/view/4420216717 , ,li-4420216717,fulltime,,,,,,False,mid-senior level,Engineering and Information Technology,,,"Motor Vehicle Manufacturing, Renewable Energy Semiconductor Manufacturing, and Utilities",https://www.linkedin.com/company/tesla-motors,,,,,,,,,,,
linkedin,Robotics Hardware Engineer,sensmore,"Berlin, Berlin, Germany",2026-05-28,https://www.linkedin.com/jobs/view/4420420957 , ,li-4420420957,fulltime,,,,,,False,entry level,Engineering and Information Technology,,,Software Development,https://de.linkedin.com/company/sensmore,,,,,,,,,,,
linkedin,Hardware / FPGA Developer (m/f/d) for Analog and Digital Electronics - Semiconductor Development Division,PNDetector,"Munich, Bavaria, Germany",2026-05-28,https://www.linkedin.com/jobs/view/4420299486 , ,li-4420299486,fulltime,,,,,,False,entry level,Engineering,,-pnd@pndetector.de,Semiconductor Manufacturing,https://de.linkedin.com/company/pndetector,,,,,,,,,,,
linkedin,Algorithm Engineer - Perception / Sensor Fusion (m/f/d),smartmicro,"Brunswick, Lower Saxony, Germany",2026-05-28,https://www.linkedin.com/jobs/view/4417607460 , ,li-4417607460,fulltime,,,,,,False,associate,Information Technology,,,Software Development,https://de.linkedin.com/company/smartmicro,,,,,,,,,,,
linkedin,Systems Engineer (all gender) – Electric Truck Platform / E-Mobility xxx,ALTEN Germany,"Nuremberg, Bavaria, Germany",2026-05-28,https://www.linkedin.com/jobs/view/4417618628 , ,li-4417618628,fulltime,,,,,,False,associate,Engineering,,,"Machinery Manufacturing, Aviation and Aerospace Component Manufacturing, and Motor Vehicle Manufacturing",https://de.linkedin.com/company/altengermany,,,,,,,,,,,
linkedin,Systems Engineer (all gender) – Electric Truck Platform / E-Mobility xxx,ALTEN Germany,"Munich, Bavaria, Germany",2026-05-28,https://www.linkedin.com/jobs/view/4417619581 , ,li-4417619581,fulltime,,,,,,False,associate,Engineering,,,"Machinery Manufacturing, Aviation and Aerospace Component Manufacturing, and Motor Vehicle Manufacturing",https://de.linkedin.com/company/altengermany,,,,,,,,,,,
linkedin,Electronic Systems Engineering Technician (m/w/d),Tesla,"Berlin, Berlin, Germany",2026-05-28,https://www.linkedin.com/jobs/view/4420216780 , ,li-4420216780,fulltime,,,,,,False,entry level,Information Technology,,,"Motor Vehicle Manufacturing, Renewable Energy Semiconductor Manufacturing, and Utilities",https://www.linkedin.com/company/tesla-motors,,,,,,,,,,,
linkedin,Algorithm Engineer - Radar Tracking (m/f/d),smartmicro,"Brunswick, Lower Saxony, Germany",2026-05-28,https://www.linkedin.com/jobs/view/4417612360 , ,li-4417612360,fulltime,,,,,,False,associate,Information Technology,,,Software Development,https://de.linkedin.com/company/smartmicro,,,,,,,,,,,
linkedin,Optical Engineer with Python - Freelance AI Trainer,Mindrift,"Berlin, Berlin, Germany",2026-05-28,https://www.linkedin.com/jobs/view/4420260953 , ,li-4420260953,parttime,,,,,,False,entry level,Other,,,IT Services and IT Consulting,https://www.linkedin.com/company/mindrift-ai,,,,,,,,,,,
linkedin,Optical Engineer with Python - Freelance AI Trainer,Mindrift,"Munich, Bavaria, Germany",2026-05-28,https://www.linkedin.com/jobs/view/4420274449 , ,li-4420274449,parttime,,,,,,False,entry level,Other,,,IT Services and IT Consulting,https://www.linkedin.com/company/mindrift-ai,,,,,,,,,,,
linkedin,Optical Engineer,GS Group,"Munich, Bavaria, Germany",2026-05-28,https://www.linkedin.com/jobs/view/4420266887 , ,li-4420266887,fulltime,,,,,,False,mid-senior level,"Research, Analyst, and Information Technology",,,Computer Hardware Manufacturing,https://uk.linkedin.com/company/gs-solutions-ltd,,,,,,,,,,,
linkedin,Initiative Application (m/f/x),DeepDrive,"Munich, Bavaria, Germany",2026-05-28,https://www.linkedin.com/jobs/view/4419012990 , ,li-4419012990,fulltime,,,,,,False,entry level,Information Technology,,,Motor Vehicle Parts Manufacturing,https://de.linkedin.com/company/deepdrivetech,,,,,,,,,,,
linkedin,Optical Engineer with Python - Freelance AI Trainer,Mindrift,,2026-05-28,https://www.linkedin.com/jobs/view/4420259981 , ,li-4420259981,parttime,,,,,,False,entry level,Other,,,IT Services and IT Consulting,https://www.linkedin.com/company/mindrift-ai,,,,,,,,,,,
linkedin,AI Talents Wanted (m/f/d) – Exceptional Minds Welcome,CompuGroup Medical SE & Co. KGaA,"Coblenz, Rhineland-Palatinate, Germany",2026-05-28,https://www.linkedin.com/jobs/view/4401438882 , ,li-4401438882,fulltime,,,,,,False,entry level,Human Resources,,,IT Services and IT Consulting,https://de.linkedin.com/company/compugroup-medical,,,,,,,,,,,
linkedin,Robotics Hardware Engineer,sensmore,"Potsdam, Brandenburg, Germany",2026-05-28,https://www.linkedin.com/jobs/view/4420441247 , ,li-4420441247,fulltime,,,,,,False,entry level,Engineering and Information Technology,,,Software Development,https://de.linkedin.com/company/sensmore,,,,,,,,,,,
linkedin,Electrical Engineer (m/w/d),Technip Energies,"Frankfurt am Main, Hesse, Germany",2026-05-28,https://www.linkedin.com/jobs/view/4379644720 , ,li-4379644720,fulltime,,,,,,False,mid-senior level,Engineering and Information Technology,,,Engineering Services,https://fr.linkedin.com/company/technip-energies,,,,,,,,,,,
linkedin,"Mechanical Design Engineer (m/w/d, all levels) - Closures Engineering - Berlin, Germany",Tesla,"Berlin, Berlin, Germany",2026-05-28,https://www.linkedin.com/jobs/view/4420208735 , ,li-4420208735,fulltime,,,,,,False,entry level,Engineering and Information Technology,,,"Motor Vehicle Manufacturing, Renewable Energy Semiconductor Manufacturing, and Utilities",https://www.linkedin.com/company/tesla-motors,,,,,,,,,,,
linkedin,Senior Electronic Hardware Engineer,NewSpace Technical,"Berlin, Germany",2026-05-28,https://www.linkedin.com/jobs/view/4419023405 , ,li-4419023405,fulltime,,,,,,False,mid-senior level,Engineering,,angela.olmo@newspacetechnical.com,Defense and Space Manufacturing and Space Research and Technology,https://uk.linkedin.com/company/newspacetechnical,,,,,,,,,,,
linkedin,Electrical Engineer in Deep Tech Startup (f/m/d),MAGNOTHERM,"Darmstadt, Hesse, Germany",2026-05-28,https://www.linkedin.com/jobs/view/4417615494 , ,li-4417615494,fulltime,,,,,,True,entry level,Engineering and Information Technology,,,Industrial Machinery Manufacturing,https://de.linkedin.com/company/magnotherm,,,,,,,,,,,
linkedin,"Mechanical Design Engineer (m/w/d) – Lighting & Exteriors Engineering - Berlin, Germany",Tesla,"Berlin, Berlin, Germany",2026-05-28,https://www.linkedin.com/jobs/view/4420207895 , ,li-4420207895,fulltime,,,,,,False,mid-senior level,Engineering and Information Technology,,,"Motor Vehicle Manufacturing, Renewable Energy Semiconductor Manufacturing, and Utilities",https://www.linkedin.com/company/tesla-motors,,,,,,,,,,,
linkedin,"(Senior) Electrical Design Engineer, Robotaxi Autonomous Vehicles (m/f/d)",Tesla,"Berlin, Berlin, Germany",2026-05-28,https://www.linkedin.com/jobs/view/4420223204 , ,li-4420223204,fulltime,,,,,,False,mid-senior level,Engineering and Information Technology,,,"Motor Vehicle Manufacturing, Renewable Energy Semiconductor Manufacturing, and Utilities",https://www.linkedin.com/company/tesla-motors,,,,,,,,,,,
linkedin,Electrical Design Engineer,Mane Contract Services,"Hamburg, Germany",2026-05-28,https://www.linkedin.com/jobs/view/4417656815 , ,li-4417656815,contract,,,,,,False,not applicable,Design and Engineering,,,Staffing and Recruiting,https://uk.linkedin.com/company/mane-contract-services,,,,,,,,,,,
linkedin,Hardware Engineer (m/f/d) (ID: 22339),Da Vinci Engineering GmbH,"Frankfurt am Main, Hesse, Germany",2026-05-28,https://www.linkedin.com/jobs/view/4419060729 , ,li-4419060729,fulltime,,,,,,False,mid-senior level,Engineering,,,Engineering Services,https://de.linkedin.com/company/da-vinci-engineering-gmbh,,,,,,,,,,,
linkedin,"Entwicklungsingenieur Elektrik/ Elektronik, all genders",SALT AND PEPPER Group,"Hamburg, Hamburg, Germany",2026-05-28,https://www.linkedin.com/jobs/view/3983798884 , ,li-3983798884,fulltime,,,,,,False,entry level,Engineering and Information Technology,,,Engineering Services,https://de.linkedin.com/company/salt-and-pepper,,,,,,,,,,,
