site,title,company,location,date_posted,job_url,job_url_direct,id,job_type,salary_source,interval,min_amount,max_amount,currency,is_remote,job_level,job_function,listing_type,emails,company_industry,company_url,company_url_direct,company_addresses,company_num_employees,company_revenue,company_description,skills,experience_range,company_rating,company_reviews_count,vacancy_count,work_from_home_type
linkedin,Embedded Software Developer Automotive (m/f/d),smartmicro,"Brunswick, Lower Saxony, Germany",2026-05-12,https://www.linkedin.com/jobs/view/4410147372 , ,li-4410147372,fulltime,,,,,,False,associate,Information Technology,,,Software Development,https://de.linkedin.com/company/smartmicro,,,,,,,,,,,
linkedin,Optical Engineer - Freelance AI Trainer,Mindrift,,2026-05-12,https://www.linkedin.com/jobs/view/4413400702 , ,li-4413400702,parttime,,,,,,False,entry level,Other,,,IT Services and IT Consulting,https://www.linkedin.com/company/mindrift-ai,,,,,,,,,,,
linkedin,Experienced Cellular IP Design Engineer (m/f/d),Apple,"Munich, Bavaria, Germany",2026-05-12,https://www.linkedin.com/jobs/view/4413586644 , ,li-4413586644,fulltime,,,,,,False,mid-senior level,Engineering and Information Technology,,,Computers and Electronics Manufacturing,https://www.linkedin.com/company/apple,,,,,,,,,,,
linkedin,Senior Expert in Protection & Resilience (m/f/d) at Allianz SE,Allianz,"Munich, Bavaria, Germany",2026-05-12,https://www.linkedin.com/jobs/view/4411354968 , ,li-4411354968,fulltime,,,,,,False,mid-senior level,Information Technology,,-SERVICES@allianz.com,Financial Services and Insurance,https://de.linkedin.com/company/allianz,,,,,,,,,,,
linkedin,Senior Development Engineer Transmission Technology (m/f/d) Wireless Foundation,Sennheiser,"Wedemark, Lower Saxony, Germany",2026-05-12,https://www.linkedin.com/jobs/view/4394717980 , ,li-4394717980,fulltime,,,,,,False,mid-senior level,Engineering and Information Technology,,jobs@sennheiser.com,"Appliances, Electrical, and Electronics Manufacturing",https://de.linkedin.com/company/sennheiser,,,,,,,,,,,
linkedin,Embedded Software Engineer,NXP Semiconductors,"Hamburg, Hamburg, Germany",2026-05-12,https://www.linkedin.com/jobs/view/4393236614 , ,li-4393236614,fulltime,,,,,,True,mid-senior level,Engineering and Information Technology,,maria.bertesteanu@nxp.com,"Semiconductor Manufacturing, Computers and Electronics Manufacturing, and Software Development",https://nl.linkedin.com/company/nxp-semiconductors,,,,,,,,,,,
linkedin,Reliability Engineer (m/w/d),Akkodis,"Mannheim, Baden-Württemberg, Germany",2026-05-12,https://www.linkedin.com/jobs/view/4413414008 , ,li-4413414008,fulltime,,,,,,False,entry level,Supply Chain,,,"Transportation, Logistics, Supply Chain and Storage",https://www.linkedin.com/company/akkodis,,,,,,,,,,,
linkedin,Software Engineer Full Stack (m/w/d),NT-ware Systemprogrammierungs-GmbH,"Bad Iburg, Lower Saxony, Germany",2026-05-12,https://www.linkedin.com/jobs/view/4413408874 , ,li-4413408874,fulltime,,,,,,False,entry level,Information Technology,,,Information Technology & Services,https://de.linkedin.com/company/nt-ware,,,,,,,,,,,
linkedin,Senior Developer Teamsport Footwear,PUMA Group,"Herzogenaurach, Bavaria, Germany",2026-05-12,https://www.linkedin.com/jobs/view/4404351871 , ,li-4404351871,fulltime,,,,,,False,mid-senior level,"Manufacturing, Engineering, and Production",,,Sporting Goods Manufacturing and Retail Apparel and Fashion,https://de.linkedin.com/company/puma,,,,,,,,,,,
linkedin,Softwareentwickler (m/w/d),Deloitte,"Leipzig, Saxony, Germany",2026-05-12,https://www.linkedin.com/jobs/view/4243061913 , ,li-4243061913,fulltime,,,,,,True,associate,Consulting and Information Technology,,career@deloitte.de,Business Consulting and Services,https://www.linkedin.com/company/deloitte,,,,,,,,,,,
linkedin,Research Assistant (all genders) - Speech and Audio Applications,Fraunhofer IIS,"Erlangen, Bavaria, Germany",2026-05-12,https://www.linkedin.com/jobs/view/4413273704 , ,li-4413273704,fulltime,,,,,,False,entry level,"Research, Analyst, and Information Technology",,,Research Services,https://de.linkedin.com/company/fraunhofer-iis,,,,,,,,,,,
linkedin,Optical Engineer - Freelance AI Trainer,Mindrift,"Hamburg, Hamburg, Germany",2026-05-12,https://www.linkedin.com/jobs/view/4413290702 , ,li-4413290702,parttime,,,,,,False,entry level,Other,,,IT Services and IT Consulting,https://www.linkedin.com/company/mindrift-ai,,,,,,,,,,,
linkedin,Electrical Engineer (m/f/i) - (High Voltage) motors / transformers,UL Solutions,"Neu-Isenburg, Hesse, Germany",2026-05-12,https://www.linkedin.com/jobs/view/4410174299 , ,li-4410174299,fulltime,,,,,,False,entry level,Engineering and Information Technology,,,"Professional Services, Manufacturing, and Technology, Information and Media",https://www.linkedin.com/company/ulsolutions,,,,,,,,,,,
linkedin,Optical Engineer - Freelance AI Trainer,Mindrift,"Berlin, Berlin, Germany",2026-05-12,https://www.linkedin.com/jobs/view/4413299702 , ,li-4413299702,parttime,,,,,,False,entry level,Other,,,IT Services and IT Consulting,https://www.linkedin.com/company/mindrift-ai,,,,,,,,,,,
linkedin,Optical Engineer - Freelance AI Trainer,Mindrift,"Munich, Bavaria, Germany",2026-05-12,https://www.linkedin.com/jobs/view/4413287816 , ,li-4413287816,parttime,,,,,,False,entry level,Other,,,IT Services and IT Consulting,https://www.linkedin.com/company/mindrift-ai,,,,,,,,,,,
linkedin,Optical Engineer - Freelance AI Trainer,Mindrift,"Stuttgart, Baden-Württemberg, Germany",2026-05-12,https://www.linkedin.com/jobs/view/4413287805 , ,li-4413287805,parttime,,,,,,False,entry level,Other,,,IT Services and IT Consulting,https://www.linkedin.com/company/mindrift-ai,,,,,,,,,,,
linkedin,AI & Optimization Engineer,Jobgether,,2026-05-12,https://www.linkedin.com/jobs/view/4413510294 , ,li-4413510294,fulltime,,,,,,True,mid-senior level,Engineering and Information Technology,,,Internet Marketplace Platforms,https://be.linkedin.com/company/jobgether,,,,,,,,,,,
linkedin,Development Engineer – Medical Devices,Robert Half,"Berlin, Germany",2026-05-12,https://www.linkedin.com/jobs/view/4413280711 , ,li-4413280711,fulltime,,,,,,False,associate,Engineering and Research,,,Medical Equipment Manufacturing,https://www.linkedin.com/company/robert-half-international,,,,,,,,,,,
linkedin,Robotics QA Engineer,NODE Robotics,"Stuttgart, Baden-Württemberg, Germany",2026-05-12,https://www.linkedin.com/jobs/view/4410160696 , ,li-4410160696,fulltime,,,,,,False,mid-senior level,Information Technology,,,Software Development,https://de.linkedin.com/company/node-robotics,,,,,,,,,,,
linkedin,Optical Engineer - Freelance AI Trainer,Mindrift,"Frankfurt am Main, Hesse, Germany",2026-05-12,https://www.linkedin.com/jobs/view/4413293738 , ,li-4413293738,parttime,,,,,,False,entry level,Other,,,IT Services and IT Consulting,https://www.linkedin.com/company/mindrift-ai,,,,,,,,,,,
linkedin,App-Entwickler mwd,ChoiceSelect PERSONALBERATUNG,"Bad Saulgau, Baden-Württemberg, Germany",2026-05-12,https://www.linkedin.com/jobs/view/4413407414 , ,li-4413407414,fulltime,,,,,,False,associate,"Information Technology, Product Management, and Art/Creative",,,"IT System Custom Software Development, Commercial and Service Industry Machinery Manufacturing, and Technology, Information and Media",https://de.linkedin.com/company/choice-select-personalberatung,,,,,,,,,,,
linkedin,Test Engineer,Auxo Talent,,2026-05-12,https://www.linkedin.com/jobs/view/4413593558 , ,li-4413593558,contract,,,,,,False,mid-senior level,Information Technology,,,"Technology, Information and Media",https://www.linkedin.com/company/auxotalent,,,,,,,,,,,
linkedin,Engineer Design Support / Focus IO/ESD (m/f/d),X-FAB Sarawak,"Erfurt, Thuringia, Germany",2026-05-12,https://www.linkedin.com/jobs/view/4410106194 , ,li-4410106194,fulltime,,,,,,False,entry level,Quality Assurance,,,Semiconductor Manufacturing,https://my.linkedin.com/company/xfabsarawak,,,,,,,,,,,
linkedin,System Safety Ingenieur mit Schwerpunkt Maschinenverordnung und Cyber Resilience Act (m/w/d),SIEB & MEYER AG,"Lunenburg, Lower Saxony, Germany",2026-05-12,https://www.linkedin.com/jobs/view/4413464576 , ,li-4413464576,fulltime,,,,,,False,associate,Quality Assurance,,,"Appliances, Electrical, and Electronics Manufacturing",https://de.linkedin.com/company/sieb-&-meyer-ag,,,,,,,,,,,
linkedin,Design Engineer (d/f/m) (H/F) - AEROSTACK GMBH,AEROCONTACT,"Munich, Bavaria, Germany",2026-05-12,https://www.linkedin.com/jobs/view/4413444025 , ,li-4413444025,fulltime,,,,,,False,executive,Engineering and Information Technology,,emsom@airbus.com,Staffing and Recruiting,https://fr.linkedin.com/company/aerocontact,,,,,,,,,,,
linkedin,Hardware Test Engineer (m/w/d),YER Deutschland,,2026-05-12,https://www.linkedin.com/jobs/view/4410190126 , ,li-4410190126,fulltime,,,,,,False,entry level,Engineering,,,Aviation and Aerospace Component Manufacturing,https://de.linkedin.com/company/yerdeutschland,,,,,,,,,,,
linkedin,Embedded Softwareentwickler - Automotive (m/w/d),smartmicro,"Brunswick, Lower Saxony, Germany",2026-05-12,https://www.linkedin.com/jobs/view/4410132576 , ,li-4410132576,fulltime,,,,,,False,associate,Information Technology,,,IT Services and IT Consulting,https://de.linkedin.com/company/smartmicro,,,,,,,,,,,
linkedin,PLC Software Engineer (m/f/d) - Lübeck,Code Compass 🧭,"Lübeck, Schleswig-Holstein, Germany",2026-05-12,https://www.linkedin.com/jobs/view/4410190668 , ,li-4410190668,fulltime,,,,,,True,mid-senior level,"Information Technology, Engineering, and Other",,,"Staffing and Recruiting, IT Services and IT Consulting, and Technology, Information and Media",https://ch.linkedin.com/company/code-compass,,,,,,,,,,,
linkedin,Embedded Software Engineer (m/w/d) – Autonomous Driving,Teoresi Group,,2026-05-12,https://www.linkedin.com/jobs/view/4410165974 , ,li-4410165974,fulltime,,,,,,True,entry level,Engineering,,,Engineering Services,https://it.linkedin.com/company/teoresigroup,,,,,,,,,,,
linkedin,Embedded Software Ingenieur (m/w/d),SAX Power GmbH,"Erbach, Baden-Württemberg, Germany",2026-05-12,https://www.linkedin.com/jobs/view/4413573302 , ,li-4413573302,fulltime,,,,,,False,mid-senior level,Engineering and Information Technology,,,Renewable Energy Semiconductor Manufacturing,https://de.linkedin.com/company/sax-power-gmbh,,,,,,,,,,,
linkedin,Embedded Software Entwickler (m/w/d),SThree,"Oberkochen, Baden-Württemberg, Germany",2026-05-12,https://www.linkedin.com/jobs/view/4410129374 , ,li-4410129374,fulltime,,,,,,False,not applicable,Information Technology,,a.pellecchia@progressive.de,Information Services,https://uk.linkedin.com/company/sthree-plc,,,,,,,,,,,
linkedin,Embedded Software Developer C++ (m/w/d),Proway GmbH,"Oberkochen, Baden-Württemberg, Germany",2026-05-12,https://www.linkedin.com/jobs/view/4410184718 , ,li-4410184718,fulltime,,,,,,False,mid-senior level,Engineering and Information Technology,,bewerbung@proway.de,IT Services and IT Consulting,https://de.linkedin.com/company/proway-gmbh,,,,,,,,,,,
linkedin,Embedded Software Engineer,Nokia,"Nuremberg, Bavaria, Germany",2026-05-12,https://www.linkedin.com/jobs/view/4401685723 , ,li-4401685723,fulltime,,,,,,False,not applicable,Engineering and Information Technology,,,IT Services and IT Consulting and Telecommunications,https://fi.linkedin.com/company/nokia,,,,,,,,,,,
linkedin,Embedded Software Engineer – Board Controller (m/w/d),ACONEXT,"Dresden, Saxony, Germany",2026-05-12,https://www.linkedin.com/jobs/view/4413566431 , ,li-4413566431,fulltime,,,,,,False,entry level,Engineering and Information Technology,,,Engineering Services,https://de.linkedin.com/company/aconext-holding-gmbh,,,,,,,,,,,
linkedin,Embedded Softwareentwickler (m/w/d) Standort Wangen im Allgäu,STAR Specialists,"Baden-Württemberg, Germany",2026-05-12,https://www.linkedin.com/jobs/view/4413536524 , ,li-4413536524,fulltime,,,,,,False,entry level,Engineering and Information Technology,,,"Engineering Services, Construction, and Renewable Energy Power Generation",https://nl.linkedin.com/company/starspecialists,,,,,,,,,,,
linkedin,Design Engineer (d/f/m),Airbus,"Munich, Bavaria, Germany",2026-05-12,https://www.linkedin.com/jobs/view/4410128554 , ,li-4410128554,fulltime,,,,,,False,mid-senior level,Engineering and Information Technology,,emsom@airbus.com,Aviation and Aerospace Component Manufacturing,https://fr.linkedin.com/company/airbusgroup,,,,,,,,,,,
linkedin,"Mechanical Design Engineer (m/w/d, all levels) - Closures Engineering - Berlin, Germany",Tesla,"Berlin, Berlin, Germany",2026-05-12,https://www.linkedin.com/jobs/view/4413475512 , ,li-4413475512,fulltime,,,,,,False,entry level,Engineering and Information Technology,,,"Motor Vehicle Manufacturing, Renewable Energy Semiconductor Manufacturing, and Utilities",https://www.linkedin.com/company/tesla-motors,,,,,,,,,,,
linkedin,Software Engineer - Airborne Mission Systems,Helsing,"Berlin, Berlin, Germany",2026-05-12,https://www.linkedin.com/jobs/view/4350197467 , ,li-4350197467,fulltime,,,,,,False,entry level,Engineering and Information Technology,,,Software Development,https://de.linkedin.com/company/helsing,,,,,,,,,,,
linkedin,Senior Hardware Engineer (m/f/x),atmio,"Hamburg, Hamburg, Germany",2026-05-12,https://www.linkedin.com/jobs/view/4406396034 , ,li-4406396034,fulltime,,,,,,False,mid-senior level,Engineering,,,IT Services and IT Consulting,https://de.linkedin.com/company/useatmio,,,,,,,,,,,
linkedin,CQV & CSV Engineering Opportunities – Germany,KPC International,"Frankfurt, Hesse, Germany",2026-05-11,https://www.linkedin.com/jobs/view/4225886744 , ,li-4225886744,fulltime,,,,,,False,not applicable,Engineering and Information Technology,,,Pharmaceutical Manufacturing,https://ie.linkedin.com/company/kpc-international,,,,,,,,,,,
linkedin,Staff Protocol Engineer,Jobgether,,2026-05-11,https://www.linkedin.com/jobs/view/4412740344 , ,li-4412740344,fulltime,,,,,,True,mid-senior level,Engineering and Information Technology,,,Internet Marketplace Platforms,https://be.linkedin.com/company/jobgether,,,,,,,,,,,
linkedin,Systems Engineer Eurofighter Avionics (all gender),ALTEN Germany,"Manching, Bavaria, Germany",2026-05-11,https://www.linkedin.com/jobs/view/4399522408 , ,li-4399522408,fulltime,,,,,,False,associate,Engineering,,,Aviation and Aerospace Component Manufacturing,https://de.linkedin.com/company/altengermany,,,,,,,,,,,
linkedin,Systemingenieur:in,amaxo GmbH,,2026-05-11,https://www.linkedin.com/jobs/view/4412671603 , ,li-4412671603,fulltime,,,,,,False,associate,Information Technology,,,IT System Operations and Maintenance,https://de.linkedin.com/company/amaxo-gmbh,,,,,,,,,,,
linkedin,System Engineer (m/w/d) Elektrotechnik - Jobbird.com,Jobster,"Kiel, Schleswig-Holstein, Germany",2026-05-11,https://www.linkedin.com/jobs/view/4413007300 , ,li-4413007300,fulltime,,,,,,False,entry level,Information Technology,,,IT Services and IT Consulting,https://nl.linkedin.com/company/jobster-com,,,,,,,,,,,
linkedin,"System Development Engineer (with PLC programming), WW AMZL Innovation Engineering - Jobbird.com",Jobster,"Berlin, Berlin, Germany",2026-05-11,https://www.linkedin.com/jobs/view/4412699634 , ,li-4412699634,fulltime,,,,,,False,mid-senior level,Engineering and Information Technology,,,Software Development,https://nl.linkedin.com/company/jobster-com,,,,,,,,,,,
linkedin,Senior Software Engineer – AI Systems (m/w/d),ista,"Essen, North Rhine-Westphalia, Germany",2026-05-11,https://www.linkedin.com/jobs/view/4353102959 , ,li-4353102959,fulltime,,,,,,False,associate,Information Technology,,,"IT Services and IT Consulting, Real Estate, and Environmental Services",https://de.linkedin.com/company/ista,,,,,,,,,,,
linkedin,Software Developer für KI-Projekte (m/w/d),Pexon Consulting GmbH,,2026-05-11,https://www.linkedin.com/jobs/view/4412779041 , ,li-4412779041,fulltime,,,,,,True,mid-senior level,Information Technology,,,IT Services and IT Consulting,https://de.linkedin.com/company/pexon,,,,,,,,,,,
linkedin,QNX- Field Application Engineer (Industrial Automation/Robotics/Medical Devices),QNX,"Hannover, Lower Saxony, Germany",2026-05-11,https://www.linkedin.com/jobs/view/4413091530 , ,li-4413091530,fulltime,,,,,,False,not applicable,Sales and Business Development,,,Software Development,https://ca.linkedin.com/company/qnx,,,,,,,,,,,
linkedin,Senior Navigation Payload Systems Engineer,Mindroiu Serban-Alexandru PFA,"Bremen, Bremen, Germany",2026-05-11,https://www.linkedin.com/jobs/view/4412671733 , ,li-4412671733,fulltime,,,,,,False,mid-senior level,Information Technology,,,Business Consulting and Services,https://ro.linkedin.com/company/alexandru-mindroiu-pfa,,,,,,,,,,,
linkedin,Design Engineer (m/w/d) Defense - Jobbird.com,Jobster,"Hamburg, Hamburg, Germany",2026-05-11,https://www.linkedin.com/jobs/view/4412697423 , ,li-4412697423,fulltime,,,,,,False,mid-senior level,Engineering and Information Technology,,,Software Development,https://nl.linkedin.com/company/jobster-com,,,,,,,,,,,
linkedin,Design Engineer - AI Clips Team,Jobgether,,2026-05-11,https://www.linkedin.com/jobs/view/4412733537 , ,li-4412733537,fulltime,,,,,,False,entry level,Engineering and Information Technology,,,Internet Marketplace Platforms,https://be.linkedin.com/company/jobgether,,,,,,,,,,,
linkedin,Freelance Agent Evaluation Engineer,Mindrift,"Berlin, Berlin, Germany",2026-05-11,https://www.linkedin.com/jobs/view/4412724033 , ,li-4412724033,parttime,,,,,,False,mid-senior level,Other,,,IT Services and IT Consulting,https://www.linkedin.com/company/mindrift-ai,,,,,,,,,,,
linkedin,Physical AI Lead,ABB,"Gilching, Bavaria, Germany",2026-05-11,https://www.linkedin.com/jobs/view/4403882712 , ,li-4403882712,fulltime,,,,,,False,not applicable,Other,,,"Appliances, Electrical, and Electronics Manufacturing",https://ch.linkedin.com/company/abb,,,,,,,,,,,
linkedin,"Senior Finanzberater - Geldanlage / Privatkunden / medizinischer Kundenstamm (m/w/d) - MLP Finanzberatung SE, Geschäftsstelle Augsburg",Jobs via eFinancialCareers,"Bremen, Bremen, Germany",2026-05-11,https://www.linkedin.com/jobs/view/4412931043 , ,li-4412931043,fulltime,,,,,,False,mid-senior level,Information Technology,,,IT Services and IT Consulting,https://uk.linkedin.com/company/jobs-on-efinancialcareers,,,,,,,,,,,
linkedin,"System Administrator / System Engineer (m/w/d) in der IT-Security, Standort Leipzig, München, Regensburg, Hannover, Hamburg",Infinigate Deutschland,"Regensburg, Bavaria, Germany",2026-05-11,https://www.linkedin.com/jobs/view/4412754686 , ,li-4412754686,fulltime,,,,,,True,not applicable,"Analyst, Customer Service, and Information Technology",,,"Computer Hardware Manufacturing, Software Development, and IT Services and IT Consulting",https://de.linkedin.com/company/infinigate-deutschland-gmbh,,,,,,,,,,,
linkedin,Project Engineer - Automated Systems,EUROGATE Group,"Hamburg, Germany",2026-05-11,https://www.linkedin.com/jobs/view/4413037075 , ,li-4413037075,fulltime,,,,,,False,associate,Project Management,,,"Transportation, Logistics, Supply Chain and Storage and Automation Machinery Manufacturing",https://de.linkedin.com/company/eurogate-gmbh-&-co-kgaa-kg,,,,,,,,,,,
linkedin,System Engineer Linux (m/w/d),Product Pulse,"Frankfurt am Main, Hesse, Germany",2026-05-11,https://www.linkedin.com/jobs/view/4412763668 , ,li-4412763668,fulltime,,,,,,True,entry level,Information Technology,,,IT Services and IT Consulting,https://de.linkedin.com/company/product-pulse-consulting,,,,,,,,,,,
linkedin,i-doit und/oder Netbox Engineer (m/w/d) | 90% remote | Vollzeit,Randstad Deutschland,"Berlin, Berlin, Germany",2026-05-11,https://www.linkedin.com/jobs/view/4412786461 , ,li-4412786461,fulltime,,,,,,True,mid-senior level,Engineering and Information Technology,,,Human Resources Services,https://de.linkedin.com/company/randstad-deutschland,,,,,,,,,,,
linkedin,Embedded Software Developer (m/w/d),Actana Consulting Services GmbH,"Oberkochen, Baden-Württemberg, Germany",2026-05-11,https://www.linkedin.com/jobs/view/4412938106 , ,li-4412938106,fulltime,,,,,,False,mid-senior level,Engineering,,,Professional Services,https://de.linkedin.com/company/actana-gmbh,,,,,,,,,,,
linkedin,"Design Engineer, EU",Ashby,"Berlin, Berlin, Germany",2026-05-11,https://www.linkedin.com/jobs/view/4403618587 , ,li-4403618587,internship,,,,,,False,entry level,Engineering and Information Technology,,,Software Development,https://www.linkedin.com/company/ashbyhq,,,,,,,,,,,
linkedin,Hardware Engineer,Guldberg GmbH,"Kronach, Bavaria, Germany",2026-05-11,https://www.linkedin.com/jobs/view/4413043444 , ,li-4413043444,fulltime,,,,,,False,associate,Engineering and Information Technology,,,Automation Machinery Manufacturing,https://de.linkedin.com/company/guldberggmbh,,,,,,,,,,,
linkedin,Hardware Engineer (RF Design) - (m/f/d),HARMAN International,"Ulm, Baden-Württemberg, Germany",2026-05-11,https://www.linkedin.com/jobs/view/4095517884 , ,li-4095517884,fulltime,,,,,,False,mid-senior level,Engineering and Information Technology,,harmancareers@harman.com,Computers and Electronics Manufacturing,https://www.linkedin.com/company/harman-international,,,,,,,,,,,
linkedin,Electronic Hardware Engineer (m/w/d) - Jobbird.com,Jobster,"Manching, Bavaria, Germany",2026-05-11,https://www.linkedin.com/jobs/view/4413002055 , ,li-4413002055,fulltime,,,,,,False,mid-senior level,Engineering and Information Technology,,,Software Development,https://nl.linkedin.com/company/jobster-com,,,,,,,,,,,
linkedin,Electrical Engineer,Darwin Recruitment,"Mannheim, Baden-Württemberg, Germany",2026-05-11,https://www.linkedin.com/jobs/view/4412731497 , ,li-4412731497,fulltime,,,,,,False,not applicable,Engineering and Project Management,,,Services for Renewable Energy,https://uk.linkedin.com/company/darwin-recruitment-3,,,,,,,,,,,
linkedin,Lead Electrical Engineer,The Green Recruitment Company,"Munich, Bavaria, Germany",2026-05-10,https://www.linkedin.com/jobs/view/4412382795 , ,li-4412382795,fulltime,,,,,,True,director,Engineering,,,Services for Renewable Energy,https://uk.linkedin.com/company/the-green-recruitment-company,,,,,,,,,,,
linkedin,Software Engineer,Mercor,,2026-05-10,https://www.linkedin.com/jobs/view/4412380131 , ,li-4412380131,parttime,description,hourly,50.0,70.0,USD,True,not applicable,Engineering,,support@mercor.com,Software Development,https://www.linkedin.com/company/mercor-ai,,,,,,,,,,,
linkedin,Senior Development Engineer Transmission Technology (m/w/d) Wireless Foundation,Sennheiser,"Wedemark, Lower Saxony, Germany",2026-05-10,https://www.linkedin.com/jobs/view/4398092512 , ,li-4398092512,fulltime,,,,,,False,mid-senior level,Engineering and Information Technology,,jobs@sennheiser.com,"Appliances, Electrical, and Electronics Manufacturing",https://de.linkedin.com/company/sennheiser,,,,,,,,,,,
linkedin,DSP Engineer,Axon,"Kassel, Hesse, Germany",2026-05-10,https://www.linkedin.com/jobs/view/4372256302 , ,li-4372256302,fulltime,,,,,,True,mid-senior level,Engineering,,"axongreenhousesupport@axon.com, recruitingops@axon.com, recruitingops@axon.com",Software Development,https://www.linkedin.com/company/axon-protect-life,,,,,,,,,,,
linkedin,Systemingenieur Schutz (m/w/d),Rheinmetall,"Kassel, Hesse, Germany",2026-05-10,https://www.linkedin.com/jobs/view/4406481221 , ,li-4406481221,fulltime,,,,,,False,entry level,Information Technology,,,Defense and Space Manufacturing,https://de.linkedin.com/company/rheinmetall,,,,,,,,,,,
linkedin,Design Engineer II - PCB & Mechanics,Regal Rexnord,"Ratingen, North Rhine-Westphalia, Germany",2026-05-10,https://www.linkedin.com/jobs/view/4301916525 , ,li-4301916525,fulltime,,,,,,False,mid-senior level,Management and Manufacturing,,,"Electric Power Transmission, Control, and Distribution",https://www.linkedin.com/company/regal-rexnord,,,,,,,,,,,
linkedin,Konstrukteur - Sondermaschinenbau / Anlagenbau (m/w/d),Workwise,"Dornstadt, Baden-Württemberg, Germany",2026-05-10,https://www.linkedin.com/jobs/view/4386917014 , ,li-4386917014,fulltime,,,,,,False,mid-senior level,Information Technology,,,Industrial Machinery Manufacturing,https://de.linkedin.com/company/workwise-gmbh,,,,,,,,,,,
linkedin,"Electrical Engineer PCB Design Wearable Devices (Full Time) Munich, Germany",Noxon GmbH,"Munich, Bavaria, Germany",2026-05-10,https://www.linkedin.com/jobs/view/4412541220 , ,li-4412541220,fulltime,,,,,,False,entry level,Engineering,,,Medical Equipment Manufacturing,https://de.linkedin.com/company/noxongmbh,,,,,,,,,,,
linkedin,Softwareingenieur*in – Automotive-Audio-Anwendungen (all genders),Fraunhofer IIS,"Erlangen, Bavaria, Germany",2026-05-10,https://www.linkedin.com/jobs/view/4403428359 , ,li-4403428359,fulltime,,,,,,True,entry level,Engineering and Information Technology,,,Research Services,https://de.linkedin.com/company/fraunhofer-iis,,,,,,,,,,,
linkedin,PLD/ FPGA-Entwickler Aerospace (m/w/d),Liebherr Aerospace and Transportation,"Lindenberg im Allgäu, Bavaria, Germany",2026-05-09,https://www.linkedin.com/jobs/view/4390954796 , ,li-4390954796,fulltime,,,,,,False,entry level,Engineering and Information Technology,,,Industrial Machinery Manufacturing,https://fr.linkedin.com/company/liebherr-aerospace-and-transportation,,,,,,,,,,,
linkedin,Application Engineer - Calibre Semi Manufacturing (OPC/RET) - EDA,Siemens EDA (Siemens Digital Industries Software),"Dresden, Saxony, Germany",2026-05-09,https://www.linkedin.com/jobs/view/4411961055 , ,li-4411961055,fulltime,,,,,,False,mid-senior level,Sales,,,Software Development,https://www.linkedin.com/company/siemens-eda,,,,,,,,,,,
linkedin,"Validation Engineer - Context, Semantics & Memory (f/m/x)",BMW Group,"Munich, Bavaria, Germany",2026-05-09,https://www.linkedin.com/jobs/view/4400874069 , ,li-4400874069,fulltime,,,,,,False,entry level,Quality Assurance,,,Motor Vehicle Manufacturing,https://de.linkedin.com/company/bmw-group,,,,,,,,,,,
