site,title,company,location,date_posted,job_url,job_url_direct,id,job_type,salary_source,interval,min_amount,max_amount,currency,is_remote,job_level,job_function,listing_type,emails,company_industry,company_url,company_url_direct,company_addresses,company_num_employees,company_revenue,company_description,skills,experience_range,company_rating,company_reviews_count,vacancy_count,work_from_home_type
linkedin,M365 System Engineer (m/w/d),Ratiodata,"Coblenz, Rhineland-Palatinate, Germany",2026-05-27,https://www.linkedin.com/jobs/view/4389565048 , ,li-4389565048,fulltime,,,,,,False,mid-senior level,Information Technology,,,IT Services and IT Consulting,https://de.linkedin.com/company/ratiodata,,,,,,,,,,,
linkedin,Electronics Development Engineer for Humanoid Robotics (m/f/d),SCHUNK - Hand in hand for tomorrow,,2026-05-27,https://www.linkedin.com/jobs/view/4418854611 , ,li-4418854611,fulltime,,,,,,False,associate,Engineering and Information Technology,,,Automation Machinery Manufacturing,https://de.linkedin.com/company/schunk,,,,,,,,,,,
linkedin,Embedded Software Engineer (w/m/d),Brunel,"Frankfurt am Main, Hesse, Germany",,https://www.linkedin.com/jobs/view/4422935445 , ,li-4422935445,fulltime,,,,,,False,entry level,Engineering and Information Technology,,,Staffing and Recruiting,https://nl.linkedin.com/company/brunel,,,,,,,,,,,
linkedin,Embedded Software Engineer,Nokia,"Nuremberg, Bavaria, Germany",,https://www.linkedin.com/jobs/view/4401685723 , ,li-4401685723,fulltime,,,,,,False,not applicable,Engineering and Information Technology,,,IT Services and IT Consulting and Telecommunications,https://fi.linkedin.com/company/nokia,,,,,,,,,,,
linkedin,"Software Engineer, Embedded (m/f/d)",HARMAN International,"Garching, Bavaria, Germany",,https://www.linkedin.com/jobs/view/4419679999 , ,li-4419679999,fulltime,,,,,,False,mid-senior level,Engineering and Information Technology,,harmancareers@harman.com,Computers and Electronics Manufacturing,https://www.linkedin.com/company/harman-international,,,,,,,,,,,
linkedin,Embedded Software Developer - Linux-basierte Steuerungssysteme für Digitaldruckanlagen (all gender),ALTEN Germany,"Poing, Bavaria, Germany",,https://www.linkedin.com/jobs/view/4419686002 , ,li-4419686002,fulltime,,,,,,False,entry level,Engineering,,,Machinery Manufacturing,https://de.linkedin.com/company/altengermany,,,,,,,,,,,
linkedin,Embedded / Middleware Software Developer (m/f/d),FERCHAU,"Garching, Bavaria, Germany",,https://www.linkedin.com/jobs/view/4374095351 , ,li-4374095351,fulltime,,,,,,False,mid-senior level,Engineering and Information Technology,,aviation.muc@ferchau.com,Engineering Services,https://de.linkedin.com/company/ferchau,,,,,,,,,,,
linkedin,Embedded-Software-Entwickler (m/w/d),FERCHAU,"Munich, Bavaria, Germany",,https://www.linkedin.com/jobs/view/4374074901 , ,li-4374074901,fulltime,,,,,,False,mid-senior level,Engineering and Information Technology,,yue.tang@ferchau.com,Engineering Services,https://de.linkedin.com/company/ferchau,,,,,,,,,,,
linkedin,Software Developer - Embedded Wireless Modules (m/w/d),Tria,"Aachen, North Rhine-Westphalia, Germany",,https://www.linkedin.com/jobs/view/4422951383 , ,li-4422951383,fulltime,,,,,,False,mid-senior level,Engineering and Information Technology,,"hrnow@avnet.com, hrnow.asia@avnet.com, hrnow.EMEA@avnet.eu","Technology, Information and Internet",https://de.linkedin.com/company/triatechnologies,,,,,,,,,,,
linkedin,Antenna Design Engineer,Amphenol,"Frankfurt, Hesse, Germany",,https://www.linkedin.com/jobs/view/4296794814 , ,li-4296794814,fulltime,,,,,,False,associate,Engineering,,lauren.devine@amphenolmcp.com,"Appliances, Electrical, and Electronics Manufacturing",https://www.linkedin.com/company/amphenol,,,,,,,,,,,
linkedin,Electrical Engineer (w/m/d) - Microcontroller,B. Braun Group,"Melsungen, Hesse, Germany",,https://www.linkedin.com/jobs/view/4424224165 , ,li-4424224165,fulltime,,,,,,False,mid-senior level,Engineering and Information Technology,,,Medical Equipment Manufacturing,https://de.linkedin.com/company/bbraun-group,,,,,,,,,,,
linkedin,Design Engineer (Remote),Hire Feed,,,https://www.linkedin.com/jobs/view/4422956318 , ,li-4422956318,contract,,,,,,True,not applicable,"Engineering, Information Technology, and Research",,,"Technology, Information and Media",https://www.linkedin.com/company/hirefeedd,,,,,,,,,,,
linkedin,Ingenieur Automatisierungstechnik - Technische Betreuung / Kommunikationssysteme & Mobilfunk (m/w/d),FAU Erlangen-Nürnberg,"Erlangen, Bavaria, Germany",,https://www.linkedin.com/jobs/view/4422958496 , ,li-4422958496,fulltime,,,,,,False,mid-senior level,Engineering and Information Technology,,,Research Services,https://de.linkedin.com/school/fau-erlangen-n%C3%BCrnberg/,,,,,,,,,,,
linkedin,"Applied AI, Forward Deployed Machine Learning Engineer - Munich",Mistral AI,"Munich, Bavaria, Germany",,https://www.linkedin.com/jobs/view/4422995693 , ,li-4422995693,fulltime,,,,,,False,entry level,Engineering and Information Technology,,,"Technology, Information and Internet",https://fr.linkedin.com/company/mistralai,,,,,,,,,,,
linkedin,R&D Engineer - AI Integration (m/f/d),Advantest,"Munich, Bavaria, Germany",,https://www.linkedin.com/jobs/view/4422632047 , ,li-4422632047,fulltime,,,,,,False,entry level,Engineering and Information Technology,,,Semiconductor Manufacturing,https://jp.linkedin.com/company/advantest,,,,,,,,,,,
linkedin,Robot Deployment Engineer (f/m/x),Magazino – a Jungheinrich company,,,https://www.linkedin.com/jobs/view/4406067465 , ,li-4406067465,fulltime,,,,,,False,entry level,Engineering,,,Robotics Engineering,https://de.linkedin.com/company/magazino-a-jungheinrich-company,,,,,,,,,,,
linkedin,Senior HPC Performance Engineer,NVIDIA,"Hamburg, Hamburg, Germany",,https://www.linkedin.com/jobs/view/4413846255 , ,li-4413846255,fulltime,,,,,,False,mid-senior level,Engineering,,,Computer Hardware Manufacturing,https://www.linkedin.com/company/nvidia,,,,,,,,,,,
linkedin,Realtime Software Developer (m/f/x),ZEISS Group,"Oberkochen, Baden-Württemberg, Germany",,https://www.linkedin.com/jobs/view/4422912609 , ,li-4422912609,fulltime,,,,,,False,mid-senior level,Information Technology and Other,,,"Manufacturing and Appliances, Electrical, and Electronics Manufacturing",https://de.linkedin.com/company/zeiss,,,,,,,,,,,
linkedin,System Engineer (m/f/d) Aerospace & Defence,FERCHAU,"Garching, Bavaria, Germany",,https://www.linkedin.com/jobs/view/4374082696 , ,li-4374082696,fulltime,,,,,,False,entry level,Information Technology,,aviation.muc@ferchau.com,Engineering Services,https://de.linkedin.com/company/ferchau,,,,,,,,,,,
linkedin,Software-Ingenieur (m/w/d) im Bereich Embedded Systems (C++),WIRTGEN GROUP,"Ludwigshafen, Rhineland-Palatinate, Germany",,https://www.linkedin.com/jobs/view/4418037227 , ,li-4418037227,fulltime,,,,,,False,entry level,Engineering and Information Technology,,,Machinery Manufacturing,https://de.linkedin.com/company/wirtgen-group,,,,,,,,,,,
linkedin,Robotics Software Engineer - Generalist (mid-level),Autonomous Teaming,"Munich, Bavaria, Germany",,https://www.linkedin.com/jobs/view/4422484869 , ,li-4422484869,fulltime,,,,,,False,mid-senior level,Engineering and Information Technology,,,Software Development,https://de.linkedin.com/company/autonomous-teaming,,,,,,,,,,,
linkedin,Software Developer,Haystack,"Leipzig, Saxony, Germany",,https://www.linkedin.com/jobs/view/4420112550 , ,li-4420112550,fulltime,,,,,,False,mid-senior level,Engineering and Information Technology,,,"Technology, Information and Internet",https://uk.linkedin.com/company/wearehaystack,,,,,,,,,,,
linkedin,"Fullstack Software Engineer, Perception Experience",Intrinsic,"Munich, Bavaria, Germany",,https://www.linkedin.com/jobs/view/4401972389 , ,li-4401972389,fulltime,,,,,,False,mid-senior level,Engineering,,-support@intrinsic.ai,Software Development,https://www.linkedin.com/company/intrinsic,,,,,,,,,,,
linkedin,Systemengineer Linux / C++ (m/w/d),Michael Page,"Karlsruhe, Baden-Württemberg, Germany",,https://www.linkedin.com/jobs/view/4413466204 , ,li-4413466204,fulltime,,,,,,True,mid-senior level,Information Technology and Engineering,,,Staffing and Recruiting,https://uk.linkedin.com/company/michael-page,,,,,,,,,,,
linkedin,Bachelorand oder Masterand (m/w/d) Evaluierung von Embedded Software Architekturen,ETO GRUPPE,"Stockach, Baden-Württemberg, Germany",,https://www.linkedin.com/jobs/view/4423987197 , ,li-4423987197,fulltime,,,,,,False,entry level,Education and Training,,,Automotive,https://de.linkedin.com/company/etogruppe,,,,,,,,,,,
linkedin,Senior Radio Frequency Engineer,THRYVE,,,https://www.linkedin.com/jobs/view/4422676519 , ,li-4422676519,fulltime,,,,,,True,mid-senior level,"Engineering, Information Technology, and Research",,,"Defense and Space Manufacturing, Aviation and Aerospace Component Manufacturing, and Armed Forces",https://de.linkedin.com/company/thryvetalent,,,,,,,,,,,
linkedin,Test Implementation Engineer – RF & Antenna Verification (m/f/d),Recruit-ME (Recruitment Made Easy),"Friedrichshafen, Baden-Württemberg, Germany",,https://www.linkedin.com/jobs/view/4422689423 , ,li-4422689423,other,,,,,,False,associate,Engineering and Information Technology,,,Airlines and Aviation,https://www.linkedin.com/company/recruit-me-recruitment-made-easy,,,,,,,,,,,
linkedin,RF (Radio Frequency) Test Engineer (f/m/d),eleQtron,"Siegen, North Rhine-Westphalia, Germany",,https://www.linkedin.com/jobs/view/4422443097 , ,li-4422443097,fulltime,,,,,,False,mid-senior level,Engineering,,,Engineering Services,https://de.linkedin.com/company/eleqtron-qc,,,,,,,,,,,
linkedin,HF (High Frequency) Lab Engineer (f/m/d),eleQtron,"Siegen, North Rhine-Westphalia, Germany",,https://www.linkedin.com/jobs/view/4422440033 , ,li-4422440033,fulltime,,,,,,False,mid-senior level,Engineering,,,Engineering Services,https://de.linkedin.com/company/eleqtron-qc,,,,,,,,,,,
linkedin,System Engineer,Q-BIK GmbH,"Norderstedt, Schleswig-Holstein, Germany",,https://www.linkedin.com/jobs/view/4422994918 , ,li-4422994918,fulltime,,,,,,False,entry level,Information Technology,,,Engineering Services,https://de.linkedin.com/company/q-bik-gmbh,,,,,,,,,,,
linkedin,Service Engineer (m/w/d) mit System Engineering Background,Rohde & Schwarz,"Haiger, Hesse, Germany",,https://www.linkedin.com/jobs/view/4376727030 , ,li-4376727030,fulltime,,,,,,False,not applicable,Information Technology,,,Telecommunications,https://de.linkedin.com/company/rohde-schwarz,,,,,,,,,,,
linkedin,Hardware Developer,Pixida,"Munich, Bavaria, Germany",,https://www.linkedin.com/jobs/view/4419696935 , ,li-4419696935,fulltime,,,,,,False,associate,Information Technology,,,IT Services and IT Consulting,https://de.linkedin.com/company/pixida-gmbh,,,,,,,,,,,
