site,title,company,location,date_posted,job_url,job_url_direct,id,job_type,salary_source,interval,min_amount,max_amount,currency,is_remote,job_level,job_function,listing_type,emails,company_industry,company_url,company_url_direct,company_addresses,company_num_employees,company_revenue,company_description,skills,experience_range,company_rating,company_reviews_count,vacancy_count,work_from_home_type
linkedin,Embedded Software Engineer (m/w/d),NDT Global,"Stutensee, Baden-Württemberg, Germany",2026-05-09,https://www.linkedin.com/jobs/view/4365254491 , ,li-4365254491,fulltime,,,,,,False,mid-senior level,Engineering and Information Technology,,,Energy Technology,https://ca.linkedin.com/company/ndt-global,,,,,,,,,,,
linkedin,Embedded Software Developer (m/w/d),NDT Global,"Linkenheim, Baden-Württemberg, Germany",2026-05-09,https://www.linkedin.com/jobs/view/4412474513 , ,li-4412474513,fulltime,,,,,,False,mid-senior level,Information Technology,,,Industrial Machinery Manufacturing,https://ca.linkedin.com/company/ndt-global,,,,,,,,,,,
linkedin,Software Developer - Remote,YO IT Consulting,"Munich, Bavaria, Germany",2026-05-09,https://www.linkedin.com/jobs/view/4412411955 , ,li-4412411955,fulltime,,,,,,True,mid-senior level,Engineering and Information Technology,,,Software Development,https://ae.linkedin.com/company/yohritconsulting,,,,,,,,,,,
linkedin,Application Engineer AMR (m/w/d),KUKA,"Augsburg, Bavaria, Germany",2026-05-09,https://www.linkedin.com/jobs/view/4405626843 , ,li-4405626843,fulltime,,,,,,False,mid-senior level,Engineering and Information Technology,,,Automation Machinery Manufacturing,https://de.linkedin.com/company/kukaglobal,,,,,,,,,,,
linkedin,"Systems Engineer, Managed Operations",Amazon Web Services (AWS),"Berlin, Germany",2026-05-09,https://www.linkedin.com/jobs/view/4343906573 , ,li-4343906573,fulltime,,,,,,False,not applicable,"Quality Assurance, Information Technology, and Engineering",,,IT Services and IT Consulting,https://www.linkedin.com/company/amazon-web-services,,,,,,,,,,,
linkedin,Bauer Account Manager Partner Sales – SE Asia,Regal Rexnord,"Esslingen, Baden-Württemberg, Germany",2026-05-09,https://www.linkedin.com/jobs/view/4402737000 , ,li-4402737000,fulltime,,,,,,False,mid-senior level,Information Technology,,,"Electric Power Transmission, Control, and Distribution",https://www.linkedin.com/company/regal-rexnord,,,,,,,,,,,
linkedin,Module Design Engineer (m/w/d),Bertrandt Group,"Schwäbisch Hall, Baden-Württemberg, Germany",2026-05-09,https://www.linkedin.com/jobs/view/4410496605 , ,li-4410496605,fulltime,,,,,,False,mid-senior level,Engineering and Information Technology,,,Engineering Services,https://de.linkedin.com/company/bertrandt-ag,,,,,,,,,,,
linkedin,Systems Engineer,Haystack,,2026-05-09,https://www.linkedin.com/jobs/view/4412302571 , ,li-4412302571,fulltime,,,,,,True,mid-senior level,Information Technology,,,"Technology, Information and Internet",https://uk.linkedin.com/company/wearehaystack,,,,,,,,,,,
linkedin,Trainee in System Engineering (m/f/d),Valeo,"Bietigheim-Bissingen, Baden-Württemberg, Germany",2026-05-09,https://www.linkedin.com/jobs/view/4403475405 , ,li-4403475405,fulltime,,,,,,False,internship,Information Technology,,Julia.Mittelmaier@Valeo.com,Motor Vehicle Parts Manufacturing,https://fr.linkedin.com/company/valeo,,,,,,,,,,,
linkedin,ASIC Analog Design Engineer (m/f/d) - REF5386X,AUMOVIO,"Frankfurt, Hesse, Germany",2026-05-09,https://www.linkedin.com/jobs/view/4403190970 , ,li-4403190970,fulltime,,,,,,False,mid-senior level,Design,,,Automotive,https://de.linkedin.com/company/aumovio,,,,,,,,,,,
linkedin,Freelance Embedded Software Engineer,Vivid Resourcing,,2026-05-08,https://www.linkedin.com/jobs/view/4383759739 , ,li-4383759739,contract,,,,,,True,mid-senior level,Engineering,,,Engineering Services and Industrial Machinery Manufacturing,https://uk.linkedin.com/company/vivid-resourcing-ltd,,,,,,,,,,,
linkedin,Embedded Software Developer (all gender) Linux-basierte Steuerungssysteme für Digitaldruckanlagen 400,ALTEN Germany,"Poing, Bavaria, Germany",2026-05-08,https://www.linkedin.com/jobs/view/4399941558 , ,li-4399941558,fulltime,,,,,,False,entry level,Information Technology and Engineering,,,Software Development,https://de.linkedin.com/company/altengermany,,,,,,,,,,,
linkedin,Embedded Software Developer (m/w/d),NDT Global,"Stutensee, Baden-Württemberg, Germany",2026-05-08,https://www.linkedin.com/jobs/view/4355243040 , ,li-4355243040,fulltime,,,,,,False,mid-senior level,Engineering and Information Technology,,,Energy Technology,https://ca.linkedin.com/company/ndt-global,,,,,,,,,,,
linkedin,"System Engineer IT Sicherheit, 2783",Hannover Re,"Hannover, Lower Saxony, Germany",2026-05-08,https://www.linkedin.com/jobs/view/4319135820 , ,li-4319135820,fulltime,,,,,,False,associate,Engineering and Information Technology,,,Insurance,https://de.linkedin.com/company/hannover-re,,,,,,,,,,,
linkedin,Embedded Engineer (all gender) – Hardware trifft Software,ALTEN Germany,"Munich, Bavaria, Germany",2026-05-08,https://www.linkedin.com/jobs/view/4409682702 , ,li-4409682702,fulltime,,,,,,False,associate,"Engineering, Project Management, and Information Technology",,,"Motor Vehicle Manufacturing, IT Services and IT Consulting, and Machinery Manufacturing",https://de.linkedin.com/company/altengermany,,,,,,,,,,,
linkedin,Collaboration Systems Engineer (d/f/m),Personio,"Berlin, Berlin, Germany",2026-05-08,https://www.linkedin.com/jobs/view/4400407992 , ,li-4400407992,fulltime,,,,,,True,mid-senior level,Information Technology,,,Software Development,https://de.linkedin.com/company/personio,,,,,,,,,,,
linkedin,Collaboration Systems Engineer (d/f/m),Personio,"Munich, Bavaria, Germany",2026-05-08,https://www.linkedin.com/jobs/view/4400427805 , ,li-4400427805,fulltime,,,,,,True,mid-senior level,Information Technology,,,Software Development,https://de.linkedin.com/company/personio,,,,,,,,,,,
linkedin,Systems Engineer (m/w/d),emagine,"Lübeck, Schleswig-Holstein, Germany",2026-05-08,https://www.linkedin.com/jobs/view/4411388619 , ,li-4411388619,fulltime,,,,,,True,mid-senior level,Information Technology,,,IT Services and IT Consulting,https://dk.linkedin.com/company/emagine,,,,,,,,,,,
linkedin,SAP Basis Administrator / SAP System Engineer (all genders),ALTEN Germany,"Kiel, Schleswig-Holstein, Germany",2026-05-08,https://www.linkedin.com/jobs/view/4411760507 , ,li-4411760507,fulltime,,,,,,False,associate,Information Technology and Engineering,,,IT Services and IT Consulting and Engineering Services,https://de.linkedin.com/company/altengermany,,,,,,,,,,,
linkedin,Beteiligungscontroller - Finanzen / SAP CO / Power BI (m/w/d) - KESSEL SE + Co. KG,Jobs via eFinancialCareers,"Ingolstadt, Bavaria, Germany",2026-05-08,https://www.linkedin.com/jobs/view/4412140631 , ,li-4412140631,fulltime,,,,,,False,mid-senior level,Information Technology,,,IT Services and IT Consulting,https://uk.linkedin.com/company/jobs-on-efinancialcareers,,,,,,,,,,,
linkedin,Embedded Software Engineer – Batteriesysteme (all gender) 800,ALTEN Germany,"Kaufering, Bavaria, Germany",2026-05-08,https://www.linkedin.com/jobs/view/4352529101 , ,li-4352529101,fulltime,,,,,,False,entry level,Project Management and Information Technology,,,"Machinery Manufacturing, Energy Technology, and Software Development",https://de.linkedin.com/company/altengermany,,,,,,,,,,,
linkedin,IC Electronic RF Engineer,Darwin Recruitment,"Berlin, Berlin, Germany",2026-05-08,https://www.linkedin.com/jobs/view/4411342880 , ,li-4411342880,fulltime,,,,,,False,not applicable,Engineering,,,Embedded Software Products,https://uk.linkedin.com/company/darwin-recruitment-3,,,,,,,,,,,
linkedin,RF System Validation Engineer (m/f/d),Apple,"Munich, Bavaria, Germany",2026-05-08,https://www.linkedin.com/jobs/view/4411707652 , ,li-4411707652,fulltime,,,,,,False,mid-senior level,Quality Assurance,,,Computers and Electronics Manufacturing,https://www.linkedin.com/company/apple,,,,,,,,,,,
linkedin,Entwicklungsingenieur (w/m/d) Elektronik,WITTENSTEIN group,"Igersheim, Baden-Württemberg, Germany",2026-05-08,https://www.linkedin.com/jobs/view/4242215597 , ,li-4242215597,fulltime,,,,,,False,associate,Research and Engineering,,,Automation Machinery Manufacturing,https://de.linkedin.com/company/wittenstein-group,,,,,,,,,,,
linkedin,Artificial Intelligence Researcher | Upto $75/hr Hourly,Mercor,,2026-05-08,https://www.linkedin.com/jobs/view/4411331367 , ,li-4411331367,parttime,description,hourly,35.0,75.0,USD,True,not applicable,Research,,support@mercor.com,Software Development,https://www.linkedin.com/company/mercor-ai,,,,,,,,,,,
linkedin,Wild Card,Zeit AI (YC S24),"Munich, Bavaria, Germany",2026-05-08,https://www.linkedin.com/jobs/view/4412109390 , ,li-4412109390,fulltime,,,,,,False,mid-senior level,Other,,,Data Infrastructure and Analytics,https://de.linkedin.com/company/zeit-ai,,,,,,,,,,,
linkedin,Softwareentwickler / Inbetriebnehmer (m/w/d) Automatisierungstechnik,Albert Handtmann Armaturenfabrik GmbH & Co. KG,"Biberach an der Riß, Baden-Württemberg, Germany",2026-05-08,https://www.linkedin.com/jobs/view/4411854525 , ,li-4411854525,fulltime,,,,,,False,entry level,Engineering,,,Industrial Machinery Manufacturing,https://de.linkedin.com/company/albert-handtmann-armaturenfabrik-gmbh-co-kg,,,,,,,,,,,
linkedin,Design Engineer / Strak-Koordinator (all gender) 200,ALTEN Germany,"Munich, Bavaria, Germany",2026-05-08,https://www.linkedin.com/jobs/view/4315928405 , ,li-4315928405,fulltime,,,,,,False,entry level,Engineering,,,Machinery Manufacturing,https://de.linkedin.com/company/altengermany,,,,,,,,,,,
linkedin,Electrical Engineer & Python Expert - Freelance AI Trainer,Mindrift,"Stuttgart, Baden-Württemberg, Germany",2026-05-08,https://www.linkedin.com/jobs/view/4412119472 , ,li-4412119472,parttime,,,,,,False,entry level,Other,,,IT Services and IT Consulting,https://www.linkedin.com/company/mindrift-ai,,,,,,,,,,,
linkedin,Electrical Engineer & Python Expert - Freelance AI Trainer,Mindrift,"Frankfurt am Main, Hesse, Germany",2026-05-08,https://www.linkedin.com/jobs/view/4412103912 , ,li-4412103912,parttime,,,,,,False,entry level,Other,,,IT Services and IT Consulting,https://www.linkedin.com/company/mindrift-ai,,,,,,,,,,,
linkedin,Electrical Engineer & Python Expert - Freelance AI Trainer,Mindrift,"Munich, Bavaria, Germany",2026-05-08,https://www.linkedin.com/jobs/view/4412116613 , ,li-4412116613,parttime,,,,,,False,entry level,Other,,,IT Services and IT Consulting,https://www.linkedin.com/company/mindrift-ai,,,,,,,,,,,
linkedin,Electrical Engineer & Python Expert - Freelance AI Trainer,Mindrift,"Hamburg, Hamburg, Germany",2026-05-08,https://www.linkedin.com/jobs/view/4412125083 , ,li-4412125083,parttime,,,,,,False,entry level,Other,,,IT Services and IT Consulting,https://www.linkedin.com/company/mindrift-ai,,,,,,,,,,,
linkedin,(Senior) Quality Engineer - Hardware Development Projects (m/f/d),EGYM | DACH,"Munich, Bavaria, Germany",2026-05-08,https://www.linkedin.com/jobs/view/4370546023 , ,li-4370546023,fulltime,,,,,,False,mid-senior level,Quality Assurance,,jobs@egym.com,Wellness and Fitness Services,https://de.linkedin.com/company/egym-gmbh,,,,,,,,,,,
linkedin,Design Engineer (m/w/d),SOGECLAIR,"Bremen, Bremen, Germany",2026-05-08,https://www.linkedin.com/jobs/view/4411398509 , ,li-4411398509,fulltime,,,,,,False,mid-senior level,Engineering,,,Non-profit Organizations and Primary and Secondary Education,https://fr.linkedin.com/company/groupesogeclair,,,,,,,,,,,
linkedin,Electrical Engineer,Nova Ltd.,"Bad Urach, Baden-Württemberg, Germany",2026-05-08,https://www.linkedin.com/jobs/view/4410471932 , ,li-4410471932,fulltime,,,,,,True,mid-senior level,"Engineering, Design, and Project Management",,,"Industrial Machinery Manufacturing, Appliances, Electrical, and Electronics Manufacturing, and Semiconductor Manufacturing",https://il.linkedin.com/company/nova-ltd.,,,,,,,,,,,
linkedin,Automation & Robotics Engineer (all gender) – Smart Factory,ALTEN Germany,"Munich, Bavaria, Germany",2026-05-08,https://www.linkedin.com/jobs/view/4409696427 , ,li-4409696427,fulltime,,,,,,False,associate,Engineering and Project Management,,,Motor Vehicle Manufacturing,https://de.linkedin.com/company/altengermany,,,,,,,,,,,
linkedin,Robotics Software Engineer (ROS2 & Sensor Pipelines) | Remote,Crossing Hurdles,,2026-05-08,https://www.linkedin.com/jobs/view/4411343782 , ,li-4411343782,fulltime,,,,,,True,associate,Engineering and Information Technology,,,Software Development and IT Services and IT Consulting,https://www.linkedin.com/company/crossinghurdles,,,,,,,,,,,
linkedin,Sensor Integration Engineer (m/f/d),MOTOR Ai,"Berlin, Berlin, Germany",2026-05-08,https://www.linkedin.com/jobs/view/4409673872 , ,li-4409673872,fulltime,,,,,,True,mid-senior level,Engineering,,,Software Development,https://de.linkedin.com/company/motorai,,,,,,,,,,,
linkedin,Sonar Signal Processing Engineer,Darwin Recruitment,"Bremen, Bremen, Germany",2026-05-08,https://www.linkedin.com/jobs/view/4409697011 , ,li-4409697011,fulltime,,,,,,False,not applicable,Information Technology,,,Embedded Software Products,https://uk.linkedin.com/company/darwin-recruitment-3,,,,,,,,,,,
linkedin,Optical Engineer with Python - Freelance AI Trainer,Mindrift,"Hamburg, Hamburg, Germany",2026-05-08,https://www.linkedin.com/jobs/view/4412187754 , ,li-4412187754,parttime,,,,,,False,entry level,Other,,,IT Services and IT Consulting,https://www.linkedin.com/company/mindrift-ai,,,,,,,,,,,
linkedin,Avionics Simulation Integration Engineer (all gender),ALTEN,"Friedrichshafen, Baden-Württemberg, Germany",2026-05-08,https://www.linkedin.com/jobs/view/4409686444 , ,li-4409686444,fulltime,,,,,,False,mid-senior level,"Production, Distribution, and Engineering",,,Software Development and IT Services and IT Consulting,https://fr.linkedin.com/company/alten,,,,,,,,,,,
linkedin,Software Engineer,Walaris,"Nuremberg, Bavaria, Germany",2026-05-08,https://www.linkedin.com/jobs/view/4411755743 , ,li-4411755743,fulltime,,,,,,False,associate,Engineering,,,"Technology, Information and Internet",https://www.linkedin.com/company/walaris,,,,,,,,,,,
linkedin,System Architect / Embedded & FPGA Engineer (all gender) 100,ALTEN Germany,"Berlin, Germany",2026-05-08,https://www.linkedin.com/jobs/view/4411387352 , ,li-4411387352,fulltime,,,,,,False,associate,"Engineering, Information Technology, and Production",,,"Research Services, IT System Custom Software Development, and Medical Equipment Manufacturing",https://de.linkedin.com/company/altengermany,,,,,,,,,,,
linkedin,Software Developer (all gender),ALTEN Germany,,2026-05-08,https://www.linkedin.com/jobs/view/4409693583 , ,li-4409693583,fulltime,,,,,,False,associate,"Engineering, Project Management, and Information Technology",,,"Motor Vehicle Manufacturing, IT Services and IT Consulting, and Machinery Manufacturing",https://de.linkedin.com/company/altengermany,,,,,,,,,,,
linkedin,Software Engineer,Nova Ltd.,"Bad Urach, Baden-Württemberg, Germany",2026-05-08,https://www.linkedin.com/jobs/view/4409267934 , ,li-4409267934,fulltime,,,,,,True,mid-senior level,"Engineering, Information Technology, and Project Management",,,"Semiconductor Manufacturing, Appliances, Electrical, and Electronics Manufacturing, and Automation Machinery Manufacturing",https://il.linkedin.com/company/nova-ltd.,,,,,,,,,,,
linkedin,Systemingenieur Multidomain Directional Communications Development (all gender),ALTEN Germany,"Berlin, Berlin, Germany",2026-05-08,https://www.linkedin.com/jobs/view/4348260497 , ,li-4348260497,fulltime,,,,,,False,associate,Information Technology,,,IT Services and IT Consulting,https://de.linkedin.com/company/altengermany,,,,,,,,,,,
linkedin,Junior KI-Automatisierungsspezialist (m/w/d),DCF Verlag GmbH,"Coblenz, Rhineland-Palatinate, Germany",2026-05-08,https://www.linkedin.com/jobs/view/4411394145 , ,li-4411394145,fulltime,,,,,,False,entry level,Information Technology,,,"Technology, Information and Internet",https://www.linkedin.com/company/dcfverlag,,,,,,,,,,,
linkedin,Senior Software Engineer – Edge Platform (m/f/d),AP Sensing,"Böblingen, Baden-Württemberg, Germany",2026-05-08,https://www.linkedin.com/jobs/view/4411343518 , ,li-4411343518,fulltime,,,,,,False,associate,Information Technology,,hr@apsensing.com,"Appliances, Electrical, and Electronics Manufacturing, Computers and Electronics Manufacturing, and Measuring and Control Instrument Manufacturing",https://de.linkedin.com/company/ap-sensing,,,,,,,,,,,
linkedin,Sensor & Measurement Technology Engineer,NDT Global,"Stutensee, Baden-Württemberg, Germany",2026-05-08,https://www.linkedin.com/jobs/view/4365246629 , ,li-4365246629,fulltime,,,,,,False,mid-senior level,Engineering and Information Technology,,,Energy Technology,https://ca.linkedin.com/company/ndt-global,,,,,,,,,,,
linkedin,System Engineer (m/w/d) im Bereich Verkehrstechnik,Katarina Biermann Spot On You Consulting,"Berlin, Germany",2026-05-08,https://www.linkedin.com/jobs/view/4411339837 , ,li-4411339837,fulltime,,,,,,False,associate,Information Technology,,,IT System Custom Software Development,https://de.linkedin.com/company/katarina-biermann-spot-on-you-consulting,,,,,,,,,,,
linkedin,System Engineer Subsea Telecom,Prysmian,"Nordenham, Lower Saxony, Germany",2026-05-08,https://www.linkedin.com/jobs/view/4403435713 , ,li-4403435713,fulltime,,,,,,False,mid-senior level,Information Technology,,,Manufacturing,https://it.linkedin.com/company/prysmian,,,,,,,,,,,
linkedin,Engineer (f/m/d) - Antenna Development for Satellite Navigation and Communication,German Aerospace Center (DLR),"Oberpfaffenhofen, Bavaria, Germany",2026-05-07,https://www.linkedin.com/jobs/view/4411238479 , ,li-4411238479,fulltime,,,,,,False,entry level,Engineering and Information Technology,,,Research Services,https://de.linkedin.com/company/dlr,,,,,,,,,,,
linkedin,"Flight Deck & Systems Engineer (m/f/d) (Associate, Experienced, and Senior)",Boeing,"Neu-Isenburg, Hesse, Germany",2026-05-07,https://www.linkedin.com/jobs/view/4409251703 , ,li-4409251703,fulltime,,,,,,False,not applicable,Information Technology,,,"Airlines and Aviation, Aviation and Aerospace Component Manufacturing, and Defense and Space Manufacturing",https://www.linkedin.com/company/boeing,,,,,,,,,,,
linkedin,IO Design Architect – High Speed Memory Interfaces (m/f/d),Micron Technology,"Munich, Bavaria, Germany",2026-05-07,https://www.linkedin.com/jobs/view/4410846238 , ,li-4410846238,fulltime,,,,,,False,mid-senior level,Other,,"_EMEA@micron.com, _TA@micron.com","Computer Hardware Manufacturing, Appliances, Electrical, and Electronics Manufacturing, and Semiconductor Manufacturing",https://www.linkedin.com/company/micron-technology,,,,,,,,,,,
linkedin,"Senior Quantum Algorithm Engineer, Optimization",IQM Quantum Computers,"Munich, Bavaria, Germany",2026-05-07,https://www.linkedin.com/jobs/view/4380358461 , ,li-4380358461,fulltime,,,,,,False,mid-senior level,Engineering and Information Technology,,,Computer Hardware Manufacturing,https://fi.linkedin.com/company/iqm-quantum-computers,,,,,,,,,,,
linkedin,Systemingenieur (w/m/d),WITTENSTEIN group,"Igersheim, Baden-Württemberg, Germany",2026-05-07,https://www.linkedin.com/jobs/view/4258391767 , ,li-4258391767,fulltime,,,,,,False,associate,Research and Engineering,,,Automation Machinery Manufacturing,https://de.linkedin.com/company/wittenstein-group,,,,,,,,,,,
linkedin,Ground Segment System Engineer (m/f/d),CGI,"Darmstadt, Hesse, Germany",2026-05-07,https://www.linkedin.com/jobs/view/4389748565 , ,li-4389748565,fulltime,,,,,,False,entry level,Information Technology,,,IT Services and IT Consulting,https://ca.linkedin.com/company/cgi,,,,,,,,,,,
linkedin,"Entwicklungsingenieur Embedded Software, all genders",SALT AND PEPPER Group,"Augsburg, Bavaria, Germany",2026-05-07,https://www.linkedin.com/jobs/view/4318845470 , ,li-4318845470,fulltime,,,,,,False,entry level,Engineering and Information Technology,,,Engineering Services,https://de.linkedin.com/company/salt-and-pepper,,,,,,,,,,,
linkedin,Communications Engineer (f/m/d),Omnisent,"Munich, Bavaria, Germany",2026-05-07,https://www.linkedin.com/jobs/view/4409632278 , ,li-4409632278,fulltime,,,,,,False,mid-senior level,Engineering,,,IT Services and IT Consulting,https://de.linkedin.com/company/omnisent,,,,,,,,,,,
linkedin,Avionics Systems Engineer – Communication Systems (m/f/d),TXT GROUP,"Munich, Bavaria, Germany",2026-05-07,https://www.linkedin.com/jobs/view/4410832108 , ,li-4410832108,fulltime,,,,,,False,entry level,Engineering and Information Technology,,,IT Services and IT Consulting,https://it.linkedin.com/company/txtgroup,,,,,,,,,,,
linkedin,Software Engineer - Embedded Systems,Applied Intuition,"Stuttgart, Baden-Württemberg, Germany",2026-05-07,https://www.linkedin.com/jobs/view/4410474730 , ,li-4410474730,fulltime,,,,,,True,mid-senior level,Engineering and Information Technology,,,Software Development,https://www.linkedin.com/company/applied-intuition-inc,,,,,,,,,,,
linkedin,AI Integration Engineer (m/f/d),Quantum Systems,,2026-05-07,https://www.linkedin.com/jobs/view/4410491194 , ,li-4410491194,fulltime,,,,,,False,mid-senior level,Information Technology,,,"Technology, Information and Internet",https://de.linkedin.com/company/quantum-systems-gmbh,,,,,,,,,,,
linkedin,Entwicklungsingenieur (m/w/d) autonomes Fahren / ADAS,prognum Automotive GmbH,"Stuttgart, Baden-Württemberg, Germany",2026-05-07,https://www.linkedin.com/jobs/view/4411445455 , ,li-4411445455,fulltime,,,,,,False,entry level,Engineering and Information Technology,,,Engineering Services,https://de.linkedin.com/company/prognum-automotive,,,,,,,,,,,
linkedin,Mixed Signal Design Engineer (m/f/d),Micron Technology,"Munich, Bavaria, Germany",2026-05-07,https://www.linkedin.com/jobs/view/4410839324 , ,li-4410839324,fulltime,,,,,,False,entry level,Other,,"_EMEA@micron.com, _TA@micron.com","Computer Hardware Manufacturing, Appliances, Electrical, and Electronics Manufacturing, and Semiconductor Manufacturing",https://www.linkedin.com/company/micron-technology,,,,,,,,,,,
linkedin,IoT Test Engineer (all gender) – Python / Embedded 800,ALTEN Germany,"Augsburg, Bavaria, Germany",2026-05-07,https://www.linkedin.com/jobs/view/4409248947 , ,li-4409248947,fulltime,,,,,,False,entry level,"Engineering, Information Technology, and Production",,,"Research Services, IT System Custom Software Development, and Chemical Manufacturing",https://de.linkedin.com/company/altengermany,,,,,,,,,,,
linkedin,Field Application Engineer -  Embedded Systems,Summit Recruitment AG,,2026-05-07,https://www.linkedin.com/jobs/view/4410488741 , ,li-4410488741,fulltime,,,,,,True,associate,Business Development,,ramel@summitag.ch,Computers and Electronics Manufacturing,https://ch.linkedin.com/company/summit-recruitment-ag,,,,,,,,,,,
linkedin,Electronics Hardware Engineer (Mid Level) - Berlin,Better Devices,"Berlin, Germany",2026-05-07,https://www.linkedin.com/jobs/view/4408812503 , ,li-4408812503,fulltime,,,,,,False,entry level,Engineering and Information Technology,,,Engineering Services,https://de.linkedin.com/company/better-devices,,,,,,,,,,,
linkedin,Embedded Senior Hardware Engineer,Jobgether,,2026-05-07,https://www.linkedin.com/jobs/view/4410465206 , ,li-4410465206,fulltime,,,,,,True,mid-senior level,Engineering and Information Technology,,,Internet Marketplace Platforms,https://be.linkedin.com/company/jobgether,,,,,,,,,,,
linkedin,Systemingenieur Fahrerassistenzsysteme / ADAS (m/w/d),prognum Automotive GmbH,"Stuttgart, Baden-Württemberg, Germany",2026-05-07,https://www.linkedin.com/jobs/view/4411441554 , ,li-4411441554,fulltime,,,,,,False,entry level,Information Technology,,,Engineering Services,https://de.linkedin.com/company/prognum-automotive,,,,,,,,,,,
linkedin,embedded Software Developer (m/w/d),INSYS icom,"Regensburg, Bavaria, Germany",2026-05-06,https://www.linkedin.com/jobs/view/4411243116 , ,li-4411243116,fulltime,,,,,,False,entry level,Engineering and Information Technology,,,Internet Publishing,https://de.linkedin.com/company/insys-icom,,,,,,,,,,,
linkedin,Embedded Firmware Developer (Agri-Tech / Sensor Systems) (m/f/d),stenon,"Potsdam, Brandenburg, Germany",,https://www.linkedin.com/jobs/view/4406545307 , ,li-4406545307,fulltime,,,,,,False,associate,Information Technology,,,IT Services and IT Consulting,https://de.linkedin.com/company/stenon,,,,,,,,,,,
linkedin,Embedded Software Engineer,SR2 | Socially Responsible Recruitment | Certified B Corporation™,"Munich, Bavaria, Germany",,https://www.linkedin.com/jobs/view/4402457265 , ,li-4402457265,fulltime,,,,,,True,mid-senior level,Information Technology,,,IT Services and IT Consulting and Defense and Space Manufacturing,https://uk.linkedin.com/company/sr2-socially-responsible-recruitment,,,,,,,,,,,
linkedin,Embedded System Engineer,Response Informatics,"Munich, Bavaria, Germany",,https://www.linkedin.com/jobs/view/4413989573 , ,li-4413989573,contract,,,,,,False,mid-senior level,Manufacturing and Information Technology,,,IT Services and IT Consulting,https://in.linkedin.com/company/response-informatics-ltd,,,,,,,,,,,
linkedin,Junior Embedded Systems Engineer (Firmware / IoT / ESP32),PolarisDX,"Hamburg, Hamburg, Germany",,https://www.linkedin.com/jobs/view/4413421571 , ,li-4413421571,fulltime,,,,,,False,entry level,Engineering and Information Technology,,,Medical and Diagnostic Laboratories,https://uk.linkedin.com/company/polarisdx,,,,,,,,,,,
linkedin,Embedded Firmware Engineer (m/w/d) – Elektronenmikroskopie,ZEISS Group,"Oberkochen, Baden-Württemberg, Germany",,https://www.linkedin.com/jobs/view/4413942330 , ,li-4413942330,fulltime,,,,,,False,mid-senior level,"Engineering, Information Technology, and Other",,,"Manufacturing and Appliances, Electrical, and Electronics Manufacturing",https://de.linkedin.com/company/zeiss,,,,,,,,,,,
