site,title,company,location,date_posted,job_url,job_url_direct,id,job_type,salary_source,interval,min_amount,max_amount,currency,is_remote,job_level,job_function,listing_type,emails,company_industry,company_url,company_url_direct,company_addresses,company_num_employees,company_revenue,company_description,skills,experience_range,company_rating,company_reviews_count,vacancy_count,work_from_home_type
linkedin,Embedded Software Engineer,NXP Semiconductors,"Hamburg, Hamburg, Germany",2026-06-02,https://www.linkedin.com/jobs/view/4393236614 , ,li-4393236614,fulltime,,,,,,True,mid-senior level,Engineering and Information Technology,,maria.bertesteanu@nxp.com,"Semiconductor Manufacturing, Computers and Electronics Manufacturing, and Software Development",https://nl.linkedin.com/company/nxp-semiconductors,,,,,,,,,,,
linkedin,Electrical Design Engineer – Aircraft Interior Systems,Stirling Dynamics,"Hamburg, Hamburg, Germany",2026-06-02,https://www.linkedin.com/jobs/view/4401936571 , ,li-4401936571,contract,,,,,,False,entry level,Engineering and Information Technology,,,Aviation and Aerospace Component Manufacturing,https://uk.linkedin.com/company/stirling-dynamics,,,,,,,,,,,
linkedin,Verification Validation Engineer,agap2 Germany,"Constance, Baden-Württemberg, Germany",2026-06-02,https://www.linkedin.com/jobs/view/4423904139 , ,li-4423904139,fulltime,,,,,,False,entry level,"Engineering, Project Management, and Consulting",,,"Business Consulting and Services, Engineering Services, and Operations Consulting",https://de.linkedin.com/company/agap2-germany,,,,,,,,,,,
linkedin,RF/mmWave IC Test & Characterization Engineer,Keysight Technologies,"Böblingen, Baden-Württemberg, Germany",2026-06-02,https://www.linkedin.com/jobs/view/4419296466 , ,li-4419296466,fulltime,,,,,,False,mid-senior level,"Management, Project Management, and Engineering",,,"Appliances, Electrical, and Electronics Manufacturing and Technology, Information and Internet",https://www.linkedin.com/company/keysight-technologies,,,,,,,,,,,
linkedin,Systemingenieur Helicopters (m/w/d),Akkodis,"Donau-Ries, Bavaria, Germany",2026-06-02,https://www.linkedin.com/jobs/view/4422343187 , ,li-4422343187,fulltime,,,,,,False,not applicable,Engineering,,,Manufacturing,https://www.linkedin.com/company/akkodis,,,,,,,,,,,
linkedin,System Software Integration Engineer - Autonomous Vehicles,NVIDIA,"Munich, Bavaria, Germany",2026-06-02,https://www.linkedin.com/jobs/view/4423280898 , ,li-4423280898,fulltime,,,,,,False,mid-senior level,Engineering,,,Computer Hardware Manufacturing,https://www.linkedin.com/company/nvidia,,,,,,,,,,,
linkedin,KI-Entwickler & Innovation Specialist (m/w/d),IT Fabrik Systemhaus GmbH & Co.KG,"Bitburg, Rhineland-Palatinate, Germany",2026-06-02,https://www.linkedin.com/jobs/view/4419603484 , ,li-4419603484,fulltime,,,,,,False,entry level,Information Technology,,,IT Services and IT Consulting,https://de.linkedin.com/company/it-fabrik-systemhaus,,,,,,,,,,,
linkedin,Hardwareentwickler - Systemingenieur (m/w/d),Actana Consulting Services GmbH,"Munich, Bavaria, Germany",2026-06-02,https://www.linkedin.com/jobs/view/4419279299 , ,li-4419279299,fulltime,,,,,,False,entry level,Engineering and Information Technology,,,Engineering Services,https://de.linkedin.com/company/actana-gmbh,,,,,,,,,,,
linkedin,"Python Software Engineer, Backend & APIs - Remote",dexter health,,2026-06-02,https://www.linkedin.com/jobs/view/4419290151 , ,li-4419290151,fulltime,,,,,,True,associate,Information Technology,,,Hospitals and Health Care,https://de.linkedin.com/company/dexter-health,,,,,,,,,,,
linkedin,Machine Learning Software Engineer,Applied Intuition,"Stuttgart, Baden-Württemberg, Germany",2026-06-02,https://www.linkedin.com/jobs/view/4423947986 , ,li-4423947986,fulltime,,,,,,True,mid-senior level,Engineering and Information Technology,,,Software Development,https://www.linkedin.com/company/applied-intuition-inc,,,,,,,,,,,
linkedin,100% Remote - IT-System- & DevOps-Engineer (m/w/d),APRIORI - business solutions AG,,2026-06-02,https://www.linkedin.com/jobs/view/4407760832 , ,li-4407760832,fulltime,,,,,,True,associate,Information Technology,,,IT Services and IT Consulting,https://de.linkedin.com/company/apriori---business-solutions-ag,,,,,,,,,,,
linkedin,Systemingenieur (m/w/d) Eurofighter-Simulatoren,GFD GmbH,"Wittmund, Lower Saxony, Germany",2026-06-02,https://www.linkedin.com/jobs/view/4422418256 , ,li-4422418256,fulltime,,,,,,False,mid-senior level,Information Technology,,bewerbung@gfd.de,Airlines and Aviation,https://www.linkedin.com/company/gfd-gmbh,,,,,,,,,,,
linkedin,Systemingenieur (m/w/d) Hardware & Systemintegration,ACONEXT,"Taufkirchen, Bavaria, Germany",2026-06-02,https://www.linkedin.com/jobs/view/4423912941 , ,li-4423912941,fulltime,,,,,,False,mid-senior level,Information Technology,,,Engineering Services,https://de.linkedin.com/company/aconext-holding-gmbh,,,,,,,,,,,
linkedin,Requirements Engineer (m/w/x) DOORS & Systems Engineering,SII Germany,"Oberkochen, Baden-Württemberg, Germany",2026-06-02,https://www.linkedin.com/jobs/view/4387834132 , ,li-4387834132,fulltime,,,,,,True,associate,Information Technology,,,IT Services and IT Consulting,https://de.linkedin.com/company/sii-germany,,,,,,,,,,,
linkedin,CQV & CSV Engineering Opportunities – Germany,KPC International,"Frankfurt, Hesse, Germany",2026-06-02,https://www.linkedin.com/jobs/view/4225886744 , ,li-4225886744,fulltime,,,,,,False,not applicable,Engineering and Information Technology,,,Pharmaceutical Manufacturing,https://ie.linkedin.com/company/kpc-international,,,,,,,,,,,
linkedin,UAV Solution & Integration Engineer - Jobbird.com,Jobster,"Munich, Bavaria, Germany",2026-06-02,https://www.linkedin.com/jobs/view/4423834470 , ,li-4423834470,fulltime,,,,,,False,entry level,Engineering and Information Technology,,bewerbung.aviation@orizon.de,Software Development,https://nl.linkedin.com/company/jobster-com,,,,,,,,,,,
linkedin,Operations Research Engineer (m/f/d),Idealworks,"Munich, Bavaria, Germany",2026-06-02,https://www.linkedin.com/jobs/view/4419287891 , ,li-4419287891,fulltime,,,,,,False,associate,Information Technology,,,Telecommunications,https://de.linkedin.com/company/idealworks-gmbh,,,,,,,,,,,
linkedin,Career Revolution: Hi-Tech - Germany,Insider One,"Berlin, Berlin, Germany",2026-06-02,https://www.linkedin.com/jobs/view/4422456259 , ,li-4422456259,fulltime,,,,,,False,not applicable,Engineering and Information Technology,,,Software Development,https://www.linkedin.com/company/insiderone,,,,,,,,,,,
linkedin,Software Engineer OpenIGTLink,EPM Scientific,"Berlin, Berlin, Germany",2026-06-02,https://www.linkedin.com/jobs/view/4422422750 , ,li-4422422750,contract,,,,,,True,mid-senior level,Engineering,,,Software Development,https://uk.linkedin.com/company/epm-scientific,,,,,,,,,,,
linkedin,Initiative Application Tech,VisioLab,"Osnabrück, Lower Saxony, Germany",2026-06-02,https://www.linkedin.com/jobs/view/4419276937 , ,li-4419276937,internship,,,,,,False,internship,Information Technology,,,Software Development,https://de.linkedin.com/company/visiolab,,,,,,,,,,,
linkedin,Quality Assurance Engineer (Ground Segment / Space),CROWDCONSULTANTS,"Frankfurt, Hesse, Germany",2026-06-02,https://www.linkedin.com/jobs/view/4423889598 , ,li-4423889598,fulltime,,,,,,False,mid-senior level,Quality Assurance,,,Defense and Space Manufacturing and Space Research and Technology,https://de.linkedin.com/company/crowdconsultants,,,,,,,,,,,
linkedin,FPGA Engineer – Quantum Computing (f/m/d),eleQtron,"Hamburg, Hamburg, Germany",2026-06-02,https://www.linkedin.com/jobs/view/4422393115 , ,li-4422393115,fulltime,,,,,,False,mid-senior level,Information Technology,,,IT Services and IT Consulting,https://de.linkedin.com/company/eleqtron-qc,,,,,,,,,,,
linkedin,System Engineer,Alexander Daniels Global,"Hannover, Lower Saxony, Germany",2026-06-02,https://www.linkedin.com/jobs/view/4423918540 , ,li-4423918540,fulltime,,,,,,False,entry level,Engineering,,,Aviation and Aerospace Component Manufacturing,https://uk.linkedin.com/company/alexander-daniels-global,,,,,,,,,,,
linkedin,Elektrokonstrukteur / Electrical Design Engineer (m/w/d) – EPLAN P8 | Sondermaschinenbau,pro-beam Group,"Chemnitz, Saxony, Germany",2026-06-02,https://www.linkedin.com/jobs/view/4415483544 , ,li-4415483544,fulltime,,,,,,False,entry level,Manufacturing,,,Machinery Manufacturing,https://de.linkedin.com/company/pro-beam-group,,,,,,,,,,,
linkedin,PCB Layout Designer,Christy Media Solutions,"Baden-Württemberg, Germany",2026-06-02,https://www.linkedin.com/jobs/view/4419611423 , ,li-4419611423,fulltime,,,,,,False,mid-senior level,Engineering and Design,,,"Broadcast Media Production and Distribution, Engineering Services, and Audio and Video Equipment Manufacturing",https://uk.linkedin.com/company/christy-media-solutions,,,,,,,,,,,
linkedin,Integration Engineer,Haystack,"Bavaria, Germany",2026-06-02,https://www.linkedin.com/jobs/view/4423897850 , ,li-4423897850,fulltime,,,,,,False,mid-senior level,Information Technology,,,"Technology, Information and Internet",https://uk.linkedin.com/company/wearehaystack,,,,,,,,,,,
linkedin,Software Engineer - Embedded Systems,Applied Intuition,"Stuttgart, Baden-Württemberg, Germany",2026-06-02,https://www.linkedin.com/jobs/view/4423966474 , ,li-4423966474,fulltime,,,,,,True,mid-senior level,Engineering and Information Technology,,,Software Development,https://www.linkedin.com/company/applied-intuition-inc,,,,,,,,,,,
linkedin,Senior Embedded Software Engineer,YourCode - Award Winning IT & Digital Consultancy,"Baden-Württemberg, Germany",2026-06-02,https://www.linkedin.com/jobs/view/4419263230 , ,li-4419263230,fulltime,,,,,,False,mid-senior level,Information Technology,,,Computer Hardware Manufacturing,https://uk.linkedin.com/company/yourcodeuk,,,,,,,,,,,
linkedin,QNX- Field Application Engineer (Industrial Automation/Robotics/Medical Devices),QNX,"Düsseldorf, North Rhine-Westphalia, Germany",2026-06-02,https://www.linkedin.com/jobs/view/4413094470 , ,li-4413094470,fulltime,,,,,,False,not applicable,Sales and Business Development,,,Software Development,https://ca.linkedin.com/company/qnx,,,,,,,,,,,
linkedin,QNX- Field Application Engineer (Industrial Automation/Robotics/Medical Devices),QNX,"Baden-Württemberg, Germany",2026-06-02,https://www.linkedin.com/jobs/view/4413081825 , ,li-4413081825,fulltime,,,,,,False,not applicable,Sales and Business Development,,,Software Development,https://ca.linkedin.com/company/qnx,,,,,,,,,,,
linkedin,QNX- Field Application Engineer (Industrial Automation/Robotics/Medical Devices),QNX,"Nienhagen, Lower Saxony, Germany",2026-06-02,https://www.linkedin.com/jobs/view/4413098332 , ,li-4413098332,fulltime,,,,,,False,not applicable,Sales and Business Development,,,Software Development,https://ca.linkedin.com/company/qnx,,,,,,,,,,,
linkedin,Design Engineer (m/w/d) Defense - Jobbird.com,Jobster,"Hamburg, Hamburg, Germany",2026-06-02,https://www.linkedin.com/jobs/view/4423920069 , ,li-4423920069,fulltime,,,,,,False,mid-senior level,Engineering and Information Technology,,,Software Development,https://nl.linkedin.com/company/jobster-com,,,,,,,,,,,
linkedin,Installation Design Engineer (f/m/d),Alstom,"Hamburg, Hamburg, Germany",2026-06-02,https://www.linkedin.com/jobs/view/4419234642 , ,li-4419234642,fulltime,,,,,,False,entry level,Engineering,,,Truck Transportation and Railroad Equipment Manufacturing,https://fr.linkedin.com/company/alstom,,,,,,,,,,,
linkedin,"Design Engineer, EU",Ashby,"Berlin, Berlin, Germany",2026-06-02,https://www.linkedin.com/jobs/view/4403618587 , ,li-4403618587,internship,,,,,,False,entry level,Engineering and Information Technology,,,Software Development,https://www.linkedin.com/company/ashbyhq,,,,,,,,,,,
linkedin,FPGA Design Engineer (m/w/d),AES Technology GmbH,"Göttingen, Lower Saxony, Germany",2026-06-02,https://www.linkedin.com/jobs/view/4423883825 , ,li-4423883825,fulltime,,,,,,True,associate,"Design, Information Technology, and Product Management",,,Defense and Space Manufacturing,https://de.linkedin.com/company/aes-technology-gmbh,,,,,,,,,,,
linkedin,Robotics Engineer (m/f/d) Hardware & Electrical Integration,Agile Robots SE,"Munich, Bavaria, Germany",2026-06-02,https://www.linkedin.com/jobs/view/4419299634 , ,li-4419299634,fulltime,,,,,,False,associate,Engineering,,,Software Development,https://de.linkedin.com/company/agile-robots-se,,,,,,,,,,,
linkedin,"Project Design Elec/Mech Eng, Fleet Remediation Engineering (FRE)",Amazon Web Services (AWS),"Frankfurt, Hesse, Germany",2026-06-01,https://www.linkedin.com/jobs/view/4421877500 , ,li-4421877500,fulltime,,,,,,False,not applicable,"Information Technology, Consulting, and Engineering",,,IT Services and IT Consulting,https://www.linkedin.com/company/amazon-web-services,,,,,,,,,,,
linkedin,Software Developer (all gender),ALTEN Germany,"Manching, Bavaria, Germany",2026-06-01,https://www.linkedin.com/jobs/view/4418756635 , ,li-4418756635,fulltime,,,,,,False,not applicable,Information Technology and Engineering,,,Aviation and Aerospace Component Manufacturing and Airlines and Aviation,https://de.linkedin.com/company/altengermany,,,,,,,,,,,
linkedin,Electronics Hardware Engineer (m/f/d),Optimus Search,,2026-06-01,https://www.linkedin.com/jobs/view/4418729805 , ,li-4418729805,fulltime,,,,,,False,mid-senior level,Engineering,,,"Electrical Equipment Manufacturing and Retail Appliances, Electrical, and Electronic Equipment",https://uk.linkedin.com/company/optimus-search,,,,,,,,,,,
linkedin,Electrical Engineer,"Wayzim Technology Co., Ltd.",,2026-06-01,https://www.linkedin.com/jobs/view/4400352874 , ,li-4400352874,fulltime,,,,,,False,entry level,Engineering,,,"Automation Machinery Manufacturing and Transportation, Logistics, Supply Chain and Storage",https://cn.linkedin.com/company/wayzim,,,,,,,,,,,
linkedin,Design Engineer (m/f/d),NAXCON GROUP,"Bremen, Bremen, Germany",2026-06-01,https://www.linkedin.com/jobs/view/4421687178 , ,li-4421687178,fulltime,,,,,,False,entry level,Engineering and Information Technology,,,IT Services and IT Consulting,https://de.linkedin.com/company/naxcon,,,,,,,,,,,
linkedin,Design Engineer (all gender) – Siemens NX,ALTEN Germany,"Hamburg, Germany",2026-06-01,https://www.linkedin.com/jobs/view/4418795524 , ,li-4418795524,fulltime,,,,,,False,associate,Engineering,,,Engineering Services,https://de.linkedin.com/company/altengermany,,,,,,,,,,,
linkedin,Lead Electrical Engineer,Airswift,"Cologne Bonn Region, North Rhine-Westphalia, Germany",2026-06-01,https://www.linkedin.com/jobs/view/4418752980 , ,li-4418752980,contract,,,,,,False,mid-senior level,Engineering and Information Technology,,,Staffing and Recruiting,https://www.linkedin.com/company/airswift,,,,,,,,,,,
linkedin,Packaging Design Engineer Medical Device,medmix,"Stuttgart, Baden-Württemberg, Germany",2026-06-01,https://www.linkedin.com/jobs/view/4401742937 , ,li-4401742937,fulltime,,,,,,False,associate,Engineering and Project Management,,,Medical Device,https://ch.linkedin.com/company/medmix,,,,,,,,,,,
linkedin,PLD/FPGA developer for aviation software (m/f/d),K-tronik GmbH,"Lindenberg im Allgäu, Bavaria, Germany",2026-06-01,https://www.linkedin.com/jobs/view/4418772965 , ,li-4418772965,fulltime,,,,,,False,associate,Engineering,,,IT Services and IT Consulting,https://de.linkedin.com/company/k-tronik-gmbh,,,,,,,,,,,
linkedin,Software Development Engineer - Connectivity Software (all genders),Philips,"Böblingen, Baden-Württemberg, Germany",2026-06-01,https://www.linkedin.com/jobs/view/4422885200 , ,li-4422885200,fulltime,,,,,,False,mid-senior level,Engineering and Information Technology,,,Hospitals and Health Care,https://nl.linkedin.com/company/philips,,,,,,,,,,,
linkedin,Konstrukteur Maschinen- und Anlagenbau mit CAD-Software MicroStation,ORANGE Engineering GmbH & Co. KG,"Dresden, Saxony, Germany",2026-06-01,https://www.linkedin.com/jobs/view/4418735926 , ,li-4418735926,fulltime,,,,,,False,mid-senior level,Engineering and Information Technology,,,Machinery Manufacturing,https://de.linkedin.com/company/orange-engineering-gmbh,,,,,,,,,,,
linkedin,Entwurfsingenieur Produktentwicklung – Ventil- und Druckregeltechnik (m/w/d),VTI Ventil Technik GmbH,"Iserlohn, North Rhine-Westphalia, Germany",2026-06-01,https://www.linkedin.com/jobs/view/4422820198 , ,li-4422820198,fulltime,,,,,,False,entry level,Engineering and Information Technology,,"personal@vti.de, info@vti.de",Industrial Machinery Manufacturing,https://de.linkedin.com/company/vti-ventil-technik,,,,,,,,,,,
linkedin,RF Engineer – Mission Critical Systems,Twentyfour Industries,"Munich, Bavaria, Germany",2026-06-01,https://www.linkedin.com/jobs/view/4418733323 , ,li-4418733323,fulltime,,,,,,True,associate,Science and Research,,,Software Development,https://www.linkedin.com/company/24industries,,,,,,,,,,,
linkedin,System Engineer (all gender),ALTEN Germany,"Manching, Bavaria, Germany",2026-06-01,https://www.linkedin.com/jobs/view/4418751474 , ,li-4418751474,fulltime,,,,,,False,associate,Engineering and Information Technology,,,Aviation and Aerospace Component Manufacturing and Airlines and Aviation,https://de.linkedin.com/company/altengermany,,,,,,,,,,,
linkedin,Systems Engineer (all gender),ALTEN Germany,"Friedrichshafen, Baden-Württemberg, Germany",2026-06-01,https://www.linkedin.com/jobs/view/4418765558 , ,li-4418765558,fulltime,,,,,,False,associate,Information Technology and Engineering,,,Aviation and Aerospace Component Manufacturing and Airlines and Aviation,https://de.linkedin.com/company/altengermany,,,,,,,,,,,
linkedin,Manufacturing Engineer – Digital Production Systems (m/w/d),WIKA Group,"Klingenberg am Main, Bavaria, Germany",2026-06-01,https://www.linkedin.com/jobs/view/4418770362 , ,li-4418770362,fulltime,,,,,,False,mid-senior level,Engineering and Information Technology,,,Measuring and Control Instrument Manufacturing,https://de.linkedin.com/company/wikagroup,,,,,,,,,,,
linkedin,Custom Memory Design Engineer,TSMC,"Munich, Bavaria, Germany",2026-06-01,https://www.linkedin.com/jobs/view/4148834255 , ,li-4148834255,fulltime,,,,,,False,mid-senior level,Engineering,,,Semiconductor Manufacturing,https://tw.linkedin.com/company/tsmc,,,,,,,,,,,
linkedin,Hardwaredesigner (m/f/d) - EMV/EMC,Schotstek GmbH,"Mannheim, Baden-Württemberg, Germany",2026-06-01,https://www.linkedin.com/jobs/view/4418743548 , ,li-4418743548,fulltime,,,,,,False,associate,Engineering,,,Automation Machinery Manufacturing and Motor Vehicle Manufacturing,https://de.linkedin.com/company/schotstek-gmbh,,,,,,,,,,,
linkedin,Hardware Engineer (RF Design) - (m/f/d),HARMAN International,"Ulm, Baden-Württemberg, Germany",2026-06-01,https://www.linkedin.com/jobs/view/4095517884 , ,li-4095517884,fulltime,,,,,,False,mid-senior level,Engineering and Information Technology,,harmancareers@harman.com,Computers and Electronics Manufacturing,https://www.linkedin.com/company/harman-international,,,,,,,,,,,
linkedin,Entwicklungsingenieur Hardware für Prüfmittel (m/w/x),K-tronik GmbH,"Memmingen, Bavaria, Germany",2026-06-01,https://www.linkedin.com/jobs/view/4418792000 , ,li-4418792000,fulltime,,,,,,False,entry level,Engineering,,,IT Services and IT Consulting,https://de.linkedin.com/company/k-tronik-gmbh,,,,,,,,,,,
linkedin,Usability Engineer – Software & Hardware UX (m/f/d),Agilent Technologies,"Waldbronn, Baden-Württemberg, Germany",2026-06-01,https://www.linkedin.com/jobs/view/4420494948 , ,li-4420494948,fulltime,,,,,,True,associate,Engineering,,,Biotechnology Research,https://www.linkedin.com/company/agilent-technologies,,,,,,,,,,,
linkedin,Senior Engineer Electrical (m/w/d),Urenco Global,"Gronau, North Rhine-Westphalia, Germany",2026-06-01,https://www.linkedin.com/jobs/view/4421806516 , ,li-4421806516,fulltime,,,,,,False,mid-senior level,Engineering and Information Technology,,,Utilities,https://uk.linkedin.com/company/urenco-global,,,,,,,,,,,
linkedin,Sensors Systems Engineer (all genders),STARK,"Berlin, Germany",2026-06-01,https://www.linkedin.com/jobs/view/4411208030 , ,li-4411208030,fulltime,,,,,,False,associate,Engineering and Other,,,Defense and Space Manufacturing,https://de.linkedin.com/company/stark-defence,,,,,,,,,,,
linkedin,Software Developer C++ (all genders),Schlafender Hase,"Frankfurt, Hesse, Germany",2026-06-01,https://www.linkedin.com/jobs/view/4418756652 , ,li-4418756652,fulltime,,,,,,False,associate,Information Technology,,,Software Development,https://de.linkedin.com/company/schlafender-hase,,,,,,,,,,,
linkedin,Software Engineer,AGNTX,,2026-06-01,https://www.linkedin.com/jobs/view/4418710354 , ,li-4418710354,fulltime,,,,,,False,mid-senior level,Engineering and Information Technology,,,Real Estate,https://uk.linkedin.com/company/agntx-recruitment,,,,,,,,,,,
linkedin,BESS Technical Electrical Lead Engineer,Airswift,"Cologne, North Rhine-Westphalia, Germany",2026-06-01,https://www.linkedin.com/jobs/view/4421862181 , ,li-4421862181,contract,,,,,,False,mid-senior level,Business Development,,,Staffing and Recruiting,https://www.linkedin.com/company/airswift,,,,,,,,,,,
linkedin,IoT Platform Engineer - Energy Systems (f/m/d),FION Energy,"Berlin, Berlin, Germany",2026-05-31,https://www.linkedin.com/jobs/view/4422580779 , ,li-4422580779,fulltime,,,,,,True,associate,Information Technology,,,Renewable Energy Semiconductor Manufacturing,https://de.linkedin.com/company/fion-energy,,,,,,,,,,,
linkedin,PLD/ FPGA-Entwickler Aerospace (m/w/d),Liebherr Aerospace and Transportation,"Lindenberg im Allgäu, Bavaria, Germany",2026-05-31,https://www.linkedin.com/jobs/view/4390954796 , ,li-4390954796,fulltime,,,,,,False,entry level,Engineering and Information Technology,,,Industrial Machinery Manufacturing,https://fr.linkedin.com/company/liebherr-aerospace-and-transportation,,,,,,,,,,,
linkedin,Systems Engineer Network (all genders),PŸUR | Tele Columbus,,2026-05-31,https://www.linkedin.com/jobs/view/4388924013 , ,li-4388924013,fulltime,,,,,,False,mid-senior level,Information Technology,,,Telecommunications,https://de.linkedin.com/company/telecolumbus,,,,,,,,,,,
linkedin,COBOL Engineer - AI Systems,Mercor,,2026-05-31,https://www.linkedin.com/jobs/view/4421392614 , ,li-4421392614,parttime,description,hourly,130.0,210.0,USD,True,not applicable,Engineering,,support@mercor.com,Software Development,https://www.linkedin.com/company/mercor-ai,,,,,,,,,,,
linkedin,PHP Specialist - AI Systems Engineer,Mercor,,2026-05-31,https://www.linkedin.com/jobs/view/4421390542 , ,li-4421390542,parttime,description,hourly,100.0,200.0,USD,True,not applicable,Engineering,,support@mercor.com,Software Development,https://www.linkedin.com/company/mercor-ai,,,,,,,,,,,
linkedin,Hackers wanted – Software Engineers,freiheit.com technologies,"Hamburg, Germany",2026-05-31,https://www.linkedin.com/jobs/view/4418389669 , ,li-4418389669,fulltime,,,,,,False,associate,Information Technology,,,Software Development,https://de.linkedin.com/company/freiheit-com-technologies,,,,,,,,,,,
linkedin,Freelance Agent Evaluation Engineer,Mindrift,"Hamburg, Hamburg, Germany",2026-05-31,https://www.linkedin.com/jobs/view/4421630062 , ,li-4421630062,parttime,,,,,,False,mid-senior level,Other,,,IT Services and IT Consulting,https://www.linkedin.com/company/mindrift-ai,,,,,,,,,,,
linkedin,Design / Certification Engineer DOA (m/w/d),SII Germany,"Hamburg, Hamburg, Germany",2026-05-31,https://www.linkedin.com/jobs/view/4421648168 , ,li-4421648168,fulltime,,,,,,False,mid-senior level,Management and Manufacturing,,,IT Services and IT Consulting,https://de.linkedin.com/company/sii-germany,,,,,,,,,,,
linkedin,Design Engineer,g2 Recruitment,"Dresden, Saxony, Germany",2026-05-31,https://www.linkedin.com/jobs/view/4421630653 , ,li-4421630653,fulltime,,,,,,False,associate,Engineering,,,Engineering Services,https://de.linkedin.com/company/g2-recruitment-solutions,,,,,,,,,,,
linkedin,Module Design Engineer - Composite (m/w/d),SII Germany,"Schwäbisch Hall, Baden-Württemberg, Germany",2026-05-31,https://www.linkedin.com/jobs/view/4421641221 , ,li-4421641221,fulltime,,,,,,False,entry level,Engineering and Information Technology,,,IT Services and IT Consulting,https://de.linkedin.com/company/sii-germany,,,,,,,,,,,
linkedin,RESEARCH AND DEVELOPMENT ENGINEER,ROBOVIS,"Berlin, Berlin, Germany",2026-05-31,https://www.linkedin.com/jobs/view/4418374543 , ,li-4418374543,fulltime,,,,,,False,entry level,Engineering,,,Software Development,https://de.linkedin.com/company/robovis,,,,,,,,,,,
linkedin,Embedded Software Engineer (m/w/d),NDT Global,"Stutensee, Baden-Württemberg, Germany",2026-05-31,https://www.linkedin.com/jobs/view/4365254491 , ,li-4365254491,fulltime,,,,,,False,mid-senior level,Engineering and Information Technology,,,Energy Technology,https://ca.linkedin.com/company/ndt-global,,,,,,,,,,,
linkedin,Softwareprogrammierer:in PLC (all genders),WEBER GmbH,"Bad Kreuznach, Rhineland-Palatinate, Germany",2026-05-30,https://www.linkedin.com/jobs/view/4421349086 , ,li-4421349086,fulltime,,,,,,False,entry level,Engineering,,bewerbung@webergmbh.de,Automation Machinery Manufacturing,https://de.linkedin.com/company/webergmbh,,,,,,,,,,,
linkedin,Systems Development Engineer (m/w/d) - Industrial Connectivity & Compliance,TE Connectivity,"Waiblingen, Baden-Württemberg, Germany",2026-05-30,https://www.linkedin.com/jobs/view/4388445811 , ,li-4388445811,fulltime,,,,,,False,mid-senior level,Engineering and Information Technology,,,"Appliances, Electrical, and Electronics Manufacturing",https://ie.linkedin.com/company/te-connectivity,,,,,,,,,,,
linkedin,Microelectronic System and Packaging Mold Flow Simulation Engineer,onsemi,"Munich, Bavaria, Germany",2026-05-30,https://www.linkedin.com/jobs/view/4400844322 , ,li-4400844322,fulltime,,,,,,False,not applicable,Engineering,,,Semiconductor Manufacturing,https://www.linkedin.com/company/onsemi,,,,,,,,,,,
