site,title,company,location,date_posted,job_url,job_url_direct,id,job_type,salary_source,interval,min_amount,max_amount,currency,is_remote,job_level,job_function,listing_type,emails,company_industry,company_url,company_url_direct,company_addresses,company_num_employees,company_revenue,company_description,skills,experience_range,company_rating,company_reviews_count,vacancy_count,work_from_home_type
linkedin,Service Software Engineer (PLC) (m/f/d),NVision Quantum Technologies,"Ulm, Baden-Württemberg, Germany",2026-06-02,https://www.linkedin.com/jobs/view/4419244549 , ,li-4419244549,fulltime,,,,,,False,associate,Information Technology,,,Software Development,https://de.linkedin.com/company/nvision-quantum-technologies,,,,,,,,,,,
linkedin,Software Engineer OpenIGTLink,EPM Scientific,"Berlin, Berlin, Germany",2026-06-02,https://www.linkedin.com/jobs/view/4422422750 , ,li-4422422750,contract,,,,,,True,mid-senior level,Engineering,,,Software Development,https://uk.linkedin.com/company/epm-scientific,,,,,,,,,,,
linkedin,Verification Validation Engineer,agap2 Germany,"Constance, Baden-Württemberg, Germany",2026-06-02,https://www.linkedin.com/jobs/view/4423904139 , ,li-4423904139,fulltime,,,,,,False,entry level,"Engineering, Project Management, and Consulting",,,"Business Consulting and Services, Engineering Services, and Operations Consulting",https://de.linkedin.com/company/agap2-germany,,,,,,,,,,,
linkedin,Machine Learning Software Engineer,Applied Intuition,"Stuttgart, Baden-Württemberg, Germany",2026-06-02,https://www.linkedin.com/jobs/view/4423947986 , ,li-4423947986,fulltime,,,,,,True,mid-senior level,Engineering and Information Technology,,,Software Development,https://www.linkedin.com/company/applied-intuition-inc,,,,,,,,,,,
linkedin,Software Engineer Project Operations (m/w/d),Technica Engineering GmbH,"Munich, Bavaria, Germany",2026-06-02,https://www.linkedin.com/jobs/view/4422420154 , ,li-4422420154,fulltime,,,,,,False,entry level,Engineering and Information Technology,,,Motor Vehicle Manufacturing,https://de.linkedin.com/company/technica-engineering-gmbh,,,,,,,,,,,
linkedin,System Engineer,Alexander Daniels Global,"Hannover, Lower Saxony, Germany",2026-06-02,https://www.linkedin.com/jobs/view/4423918540 , ,li-4423918540,fulltime,,,,,,False,entry level,Engineering,,,Aviation and Aerospace Component Manufacturing,https://uk.linkedin.com/company/alexander-daniels-global,,,,,,,,,,,
linkedin,"Entwicklungsingenieur (m/w/d) Sensoren&Laser für Embedded-, PC- und Steuerungssoftware",Körber,"Hamburg, Hamburg, Germany",2026-06-02,https://www.linkedin.com/jobs/view/4422461121 , ,li-4422461121,fulltime,,,,,,False,entry level,Engineering and Information Technology,,jobs@koerber.com,"Machinery Manufacturing, Industrial Machinery Manufacturing, and Tobacco Manufacturing",https://de.linkedin.com/company/k%C3%B6rber,,,,,,,,,,,
linkedin,Lead Electronics Engineer (m/f/d),Clarios,"Delbrück, North Rhine-Westphalia, Germany",2026-06-02,https://www.linkedin.com/jobs/view/4381844243 , ,li-4381844243,fulltime,,,,,,False,mid-senior level,Engineering and Information Technology,,Special.Accommodations@Clarios.com,Motor Vehicle Parts Manufacturing,https://www.linkedin.com/company/clarios,,,,,,,,,,,
linkedin,SPS Programmierer (m/w/d),ATS Industrial Automation,"Coblenz, Rhineland-Palatinate, Germany",2026-06-02,https://www.linkedin.com/jobs/view/4423983518 , ,li-4423983518,fulltime,,,,,,False,mid-senior level,Engineering and Information Technology,,,Automation Machinery Manufacturing,https://ca.linkedin.com/company/atsindustrialautomation,,,,,,,,,,,
linkedin,Full-Stack Software Engineer,GetCarl,"Cologne, North Rhine-Westphalia, Germany",2026-06-02,https://www.linkedin.com/jobs/view/4422440101 , ,li-4422440101,fulltime,,,,,,False,entry level,Engineering and Information Technology,,,Software Development,https://de.linkedin.com/company/getcarl,,,,,,,,,,,
linkedin,Forward Deployed Engineer (f/m/d),VoiceLine,"Munich, Bavaria, Germany",2026-06-02,https://www.linkedin.com/jobs/view/4417917540 , ,li-4417917540,fulltime,,,,,,False,associate,Information Technology,,,Software Development,https://de.linkedin.com/company/voiceline,,,,,,,,,,,
linkedin,IoT Test Engineer (all gender),ALTEN Germany,"Kaufering, Bavaria, Germany",2026-06-02,https://www.linkedin.com/jobs/view/4408814107 , ,li-4408814107,fulltime,,,,,,False,associate,Engineering,,,IT Services and IT Consulting,https://de.linkedin.com/company/altengermany,,,,,,,,,,,
linkedin,CQV & CSV Engineering Opportunities – Germany,KPC International,"Frankfurt, Hesse, Germany",2026-06-02,https://www.linkedin.com/jobs/view/4225886744 , ,li-4225886744,fulltime,,,,,,False,not applicable,Engineering and Information Technology,,,Pharmaceutical Manufacturing,https://ie.linkedin.com/company/kpc-international,,,,,,,,,,,
linkedin,AI Engineer Consultant (m/w/d) 100.000€ fix Remote,Computer Futures,"Frankfurt am Main, Hesse, Germany",2026-06-02,https://www.linkedin.com/jobs/view/4422348871 , ,li-4422348871,fulltime,,,,,,True,associate,Information Technology,,,Software Development,https://uk.linkedin.com/company/computerfutures,,,,,,,,,,,
linkedin,"Design Engineer, EU",Ashby,"Berlin, Berlin, Germany",2026-06-02,https://www.linkedin.com/jobs/view/4403618587 , ,li-4403618587,internship,,,,,,False,entry level,Engineering and Information Technology,,,Software Development,https://www.linkedin.com/company/ashbyhq,,,,,,,,,,,
linkedin,Electrical Engineer / Electrical Systems Engineer (m/f/d) - Naval,THE CT ENGINEERING GROUP,"Hamburg, Hamburg, Germany",2026-06-02,https://www.linkedin.com/jobs/view/4424211676 , ,li-4424211676,fulltime,,,,,,False,not applicable,Engineering,,jobs@ctengineering.de,Industrial Machinery Manufacturing,https://es.linkedin.com/company/thectengineeringgroup,,,,,,,,,,,
linkedin,Embedded Software Engineer - Marine Schiffbau (all genders),ALTEN Germany,"Bremen, Germany",2026-06-01,https://www.linkedin.com/jobs/view/4418792616 , ,li-4418792616,fulltime,,,,,,False,associate,Information Technology and Engineering,,,IT Services and IT Consulting and Engineering Services,https://de.linkedin.com/company/altengermany,,,,,,,,,,,
linkedin,Research Software Engineer (all genders) Coupled climate models on GPU-based HPC systems,German Climate Computing Center | DKRZ |,"Hamburg, Hamburg, Germany",2026-06-01,https://www.linkedin.com/jobs/view/4419220105 , ,li-4419220105,fulltime,,,,,,True,mid-senior level,Engineering,,"frauen@dkrz.de, bockelmann@dkrz.de",Research Services,https://de.linkedin.com/company/deutsches-klimarechenzentrum,,,,,,,,,,,
linkedin,Senior Electrical Engineer,Northland Power Inc.,"Hamburg, Hamburg, Germany",2026-06-01,https://www.linkedin.com/jobs/view/4422130903 , ,li-4422130903,fulltime,,,,,,True,mid-senior level,Engineering and Information Technology,,,Renewable Energy Power Generation,https://ca.linkedin.com/company/northland-power,,,,,,,,,,,
linkedin,Hardware Engineer (RF Design) - (m/f/d),HARMAN International,"Ulm, Baden-Württemberg, Germany",2026-06-01,https://www.linkedin.com/jobs/view/4095517884 , ,li-4095517884,fulltime,,,,,,False,mid-senior level,Engineering and Information Technology,,harmancareers@harman.com,Computers and Electronics Manufacturing,https://www.linkedin.com/company/harman-international,,,,,,,,,,,
linkedin,Design Engineer (all gender) – Siemens NX,ALTEN Germany,"Hamburg, Germany",2026-06-01,https://www.linkedin.com/jobs/view/4418795524 , ,li-4418795524,fulltime,,,,,,False,associate,Engineering,,,Engineering Services,https://de.linkedin.com/company/altengermany,,,,,,,,,,,
linkedin,Embedded-Software-Entwickler*,TELENOT,"Albstadt, Baden-Württemberg, Germany",,https://www.linkedin.com/jobs/view/4425468930 , ,li-4425468930,fulltime,,,,,,False,associate,Research and Science,,personal@telenot.de,Computers and Electronics Manufacturing,https://de.linkedin.com/company/telenot,,,,,,,,,,,
linkedin,Senior Embedded Software Engineer,SR2 | Socially Responsible Recruitment | Certified B Corporation™,"Munich, Bavaria, Germany",,https://www.linkedin.com/jobs/view/4421973248 , ,li-4421973248,contract,,,,,,False,mid-senior level,Engineering,,,Defense and Space Manufacturing and Aviation and Aerospace Component Manufacturing,https://uk.linkedin.com/company/sr2-socially-responsible-recruitment,,,,,,,,,,,
linkedin,Embedded Software Engineer (f/m/div),Infineon Technologies,"Ilmenau, Thuringia, Germany",,https://www.linkedin.com/jobs/view/4334356292 , ,li-4334356292,fulltime,,,,,,False,mid-senior level,Engineering and Information Technology,,,"Semiconductor Manufacturing, Appliances, Electrical, and Electronics Manufacturing, and Computer Hardware Manufacturing",https://de.linkedin.com/company/infineon-technologies,,,,,,,,,,,
linkedin,Android Developer,ProSapiens HR,,,https://www.linkedin.com/jobs/view/4425245718 , ,li-4425245718,contract,,,,,,True,mid-senior level,Information Technology,,prajakta@prosapiens.in,IT Services and IT Consulting and Automation Machinery Manufacturing,https://in.linkedin.com/company/prosapiens1,,,,,,,,,,,
linkedin,Embedded Softwareentwickler GUI (all gender),ALTEN Germany,"Stuttgart, Baden-Württemberg, Germany",,https://www.linkedin.com/jobs/view/4186246429 , ,li-4186246429,fulltime,,,,,,False,entry level,Engineering,,fabian.preidt@alten.com,Engineering Services,https://de.linkedin.com/company/altengermany,,,,,,,,,,,
linkedin,Power Electronics / Analog Engineer,iO Associates,"Bremen, Bremen, Germany",,https://www.linkedin.com/jobs/view/4425263754 , ,li-4425263754,fulltime,,,,,,False,not applicable,Engineering,,,Defense and Space Manufacturing,https://uk.linkedin.com/company/ioassociates,,,,,,,,,,,
linkedin,Hardwaredesigner (m/f/d) - EMV/EMC,Schotstek GmbH,"Mannheim, Baden-Württemberg, Germany",,https://www.linkedin.com/jobs/view/4421923921 , ,li-4421923921,fulltime,,,,,,False,associate,Engineering,,,Automation Machinery Manufacturing and Motor Vehicle Manufacturing,https://de.linkedin.com/company/schotstek-gmbh,,,,,,,,,,,
linkedin,Design Engineer Innovation (m/w/d),ITW Fastener Products,"Creglingen, Baden-Württemberg, Germany",,https://www.linkedin.com/jobs/view/4425474738 , ,li-4425474738,fulltime,,,,,,False,associate,Other,,EUGA.bewerber@itwautomotive.com,Machinery Manufacturing,https://de.linkedin.com/company/itw-fastener-products,,,,,,,,,,,
linkedin,Entwicklungsingenieur Embedded Electronics (m/w/d),SMA Solar,"Kassel, Hesse, Germany",,https://www.linkedin.com/jobs/view/4412251908 , ,li-4412251908,fulltime,,,,,,False,mid-senior level,Engineering and Information Technology,,,Renewable Energy Semiconductor Manufacturing,https://de.linkedin.com/company/sma-solar,,,,,,,,,,,
linkedin,EMV Spezialist (m/f/d) - Hardwaredesign,Schotstek GmbH,"Mannheim, Baden-Württemberg, Germany",,https://www.linkedin.com/jobs/view/4421921921 , ,li-4421921921,fulltime,,,,,,False,associate,Engineering,,,Automation Machinery Manufacturing and Motor Vehicle Manufacturing,https://de.linkedin.com/company/schotstek-gmbh,,,,,,,,,,,
linkedin,FPGA Engineer (m/w/d) Industrial Production Technology (Semiconductors),Amoria Bond,"Freiburg, Baden-Württemberg, Germany",,https://www.linkedin.com/jobs/view/4425638842 , ,li-4425638842,fulltime,,,,,,False,not applicable,Engineering,,,Embedded Software Products,https://uk.linkedin.com/company/amoria-bond,,,,,,,,,,,
linkedin,Entwicklungsingenieur Elektronik (w/m/d),dainox GmbH,"Bad Wörishofen, Bavaria, Germany",,https://www.linkedin.com/jobs/view/4425484996 , ,li-4425484996,fulltime,,,,,,False,entry level,Engineering and Information Technology,,,"Technology, Information and Internet",https://de.linkedin.com/company/dainox-gmbh,,,,,,,,,,,
linkedin,AI Application Engineer,XpertDirect,"Berlin, Germany",,https://www.linkedin.com/jobs/view/4421936481 , ,li-4421936481,fulltime,,,,,,False,mid-senior level,Engineering,,,Software Development,https://es.linkedin.com/company/xpertdirect,,,,,,,,,,,
linkedin,ML Research Engineering (m/w/d),IonKon GmbH,"Wittenberg, Saxony-Anhalt, Germany",,https://www.linkedin.com/jobs/view/4421927221 , ,li-4421927221,fulltime,,,,,,False,mid-senior level,Engineering and Information Technology,,tim.konrad@ionkon.de,Energy Technology,https://de.linkedin.com/company/ionkon-gmbh,,,,,,,,,,,
linkedin,PLC Programmer,Rise Technical,"Osnabrück, Lower Saxony, Germany",,https://www.linkedin.com/jobs/view/4421962674 , ,li-4421962674,fulltime,,,,,,True,associate,"Engineering, Design, and Other",,,"Packaging and Containers Manufacturing, Robotics Engineering, and Automation Machinery Manufacturing",https://uk.linkedin.com/company/rise-technical-recruitment-ltd,,,,,,,,,,,
linkedin,AI Systems Engineer (Offensive Cyber),Snatch UP Jobs,"Frankfurt, Hesse, Germany",,https://www.linkedin.com/jobs/view/4425089398 , ,li-4425089398,fulltime,,,,,,False,mid-senior level,Information Technology,,,Business Consulting and Services,https://www.linkedin.com/company/snatch-up-jobs,,,,,,,,,,,
linkedin,UAV Solution & Integration Engineer - Jobbird.com,Jobster,"Munich, Bavaria, Germany",,https://www.linkedin.com/jobs/view/4425212902 , ,li-4425212902,fulltime,,,,,,False,entry level,Engineering and Information Technology,,bewerbung.aviation@orizon.de,Software Development,https://nl.linkedin.com/company/jobster-com,,,,,,,,,,,
linkedin,Senior ML Ops Engineer (m/f/d),Redcare Pharmacy,"Cologne, North Rhine-Westphalia, Germany",,https://www.linkedin.com/jobs/view/4421952823 , ,li-4421952823,fulltime,,,,,,True,mid-senior level,Analyst,,,Software Development and IT Services and IT Consulting,https://nl.linkedin.com/company/redcare-pharmacy-com,,,,,,,,,,,
linkedin,Functional Developer – EV Charging & Energy Management (German Speaking) | €75k,Ingenio Global,"Ingolstadt, Bavaria, Germany",,https://www.linkedin.com/jobs/view/4425468535 , ,li-4425468535,fulltime,,,,,,False,mid-senior level,Information Technology and Manufacturing,,,"Appliances, Electrical, and Electronics Manufacturing and IT Services and IT Consulting",https://ie.linkedin.com/company/ingenio-global,,,,,,,,,,,
linkedin,Systems Engineer – GEO Spacecraft Simulation & Environment Analysis,MBS GmbH,,,https://www.linkedin.com/jobs/view/4425467694 , ,li-4425467694,fulltime,,,,,,False,associate,Engineering,,,Space Research and Technology,https://de.linkedin.com/company/mb-satellite,,,,,,,,,,,
linkedin,Data Science Specialist (m/w/d),HiperScan GmbH,"Dresden, Saxony, Germany",,https://www.linkedin.com/jobs/view/4425477827 , ,li-4425477827,fulltime,,,,,,False,mid-senior level,"Research, Business Development, and Product Management",,,Biotechnology Research,https://de.linkedin.com/company/hiperscan,,,,,,,,,,,
linkedin,Analytics Engineer (m/f/d),Getsafe,"Heidelberg, Baden-Württemberg, Germany",,https://www.linkedin.com/jobs/view/4425499982 , ,li-4425499982,fulltime,,,,,,True,associate,Information Technology,,,Insurance,https://de.linkedin.com/company/getsafe-personal-insurance,,,,,,,,,,,
linkedin,M365 System Engineer – Schwerpunkt Teams und Collaboration (m/w/d),Ratiodata,"Münster, North Rhine-Westphalia, Germany",,https://www.linkedin.com/jobs/view/4389806604 , ,li-4389806604,fulltime,,,,,,False,mid-senior level,Information Technology,,,IT Services and IT Consulting,https://de.linkedin.com/company/ratiodata,,,,,,,,,,,
linkedin,Lead Systems Engineer - Passive RF Sensing,Helsing,"Munich, Bavaria, Germany",,https://www.linkedin.com/jobs/view/4421946115 , ,li-4421946115,fulltime,,,,,,True,mid-senior level,Engineering and Information Technology,,,Software Development,https://de.linkedin.com/company/helsing,,,,,,,,,,,
linkedin,Systems Engineer for Telecommunication Missions (m/f/d),OHB SE,"Bremen, Bremen, Germany",,https://www.linkedin.com/jobs/view/4421963440 , ,li-4421963440,fulltime,,,,,,False,entry level,Engineering,,,Aviation and Aerospace Component Manufacturing and Defense and Space Manufacturing,https://de.linkedin.com/company/ohb-se,,,,,,,,,,,
linkedin,Systemengineer Linux / C++ (m/w/d),Michael Page,"Karlsruhe, Baden-Württemberg, Germany",,https://www.linkedin.com/jobs/view/4413466204 , ,li-4413466204,fulltime,,,,,,True,mid-senior level,Information Technology and Engineering,,,Staffing and Recruiting,https://uk.linkedin.com/company/michael-page,,,,,,,,,,,
linkedin,Senior Development Engineer Military Communication Systems (all gender),ALTEN Germany,"Schrobenhausen, Bavaria, Germany",,https://www.linkedin.com/jobs/view/4399511520 , ,li-4399511520,fulltime,,,,,,False,associate,Engineering,,,Aviation and Aerospace Component Manufacturing,https://de.linkedin.com/company/altengermany,,,,,,,,,,,
linkedin,Design Engineer,Collins Aerospace,"Landshut, Bavaria, Germany",,https://www.linkedin.com/jobs/view/4425462922 , ,li-4425462922,fulltime,,,,,,False,mid-senior level,Engineering and Information Technology,,,Aviation and Aerospace Component Manufacturing,https://www.linkedin.com/company/collins-aerospace,,,,,,,,,,,
linkedin,A400M Structure Design Engineer (m/w/d) Airbus,expertum Gruppe,"Bremen, Bremen, Germany",,https://www.linkedin.com/jobs/view/4425272743 , ,li-4425272743,fulltime,,,,,,False,mid-senior level,Engineering and Information Technology,,,Staffing and Recruiting,https://de.linkedin.com/company/expertumgruppe,,,,,,,,,,,
