site,title,company,location,date_posted,job_url,job_url_direct,id,job_type,salary_source,interval,min_amount,max_amount,currency,is_remote,job_level,job_function,listing_type,emails,company_industry,company_url,company_url_direct,company_addresses,company_num_employees,company_revenue,company_description,skills,experience_range,company_rating,company_reviews_count,vacancy_count,work_from_home_type
linkedin,Freelance Electrical Engineer,Vivid Resourcing,"Düsseldorf, North Rhine-Westphalia, Germany",2026-06-04,https://www.linkedin.com/jobs/view/4423527219 , ,li-4423527219,contract,,,,,,True,associate,Engineering,,,Services for Renewable Energy,https://uk.linkedin.com/company/vivid-resourcing-ltd,,,,,,,,,,,
linkedin,Systems Engineer (m/w/d) - Schwerpunkt Hardware Entwicklung,Bertrandt Group,"Munich, Bavaria, Germany",2026-06-04,https://www.linkedin.com/jobs/view/4412784855 , ,li-4412784855,fulltime,,,,,,False,mid-senior level,Engineering and Information Technology,,,Engineering Services,https://de.linkedin.com/company/bertrandt-ag,,,,,,,,,,,
linkedin,MMIC Test & Characterisation Engineer,IC Resources,"Baden-Württemberg, Germany",2026-06-04,https://www.linkedin.com/jobs/view/4424407504 , ,li-4424407504,fulltime,,,,,,False,entry level,Engineering and Information Technology,,,Staffing and Recruiting,https://uk.linkedin.com/company/icresources,,,,,,,,,,,
linkedin,Ingenieur:in Elektrotechnik Zug & Mobilfunk,Deutsche Bahn,"Munich, Bavaria, Germany",2026-06-04,https://www.linkedin.com/jobs/view/4393270735 , ,li-4393270735,fulltime,,,,,,False,mid-senior level,Engineering and Information Technology,,,Truck Transportation,https://de.linkedin.com/company/deutschebahn,,,,,,,,,,,
linkedin,Design Engineer,Boart Longyear,"Eiterfeld, Hesse, Germany",2026-06-04,https://www.linkedin.com/jobs/view/4413999911 , ,li-4413999911,fulltime,,,,,,False,entry level,"Research, Science, and Engineering",,,"Mining, Industrial Machinery Manufacturing, and Machinery Manufacturing",https://www.linkedin.com/company/boart-longyear,,,,,,,,,,,
linkedin,"AI Engineer (m/w/x) Cloud, DevOps & Data Engineering",SII Germany,"Munich, Bavaria, Germany",2026-06-04,https://www.linkedin.com/jobs/view/4423366982 , ,li-4423366982,fulltime,,,,,,False,associate,Information Technology,,,IT Services and IT Consulting,https://de.linkedin.com/company/sii-germany,,,,,,,,,,,
linkedin,Embedded Software Entwickler (all gender),ALTEN Germany,"Stuttgart, Baden-Württemberg, Germany",2026-06-04,https://www.linkedin.com/jobs/view/4420738171 , ,li-4420738171,fulltime,,,,,,False,not applicable,Engineering and Information Technology,,,Telecommunications,https://de.linkedin.com/company/altengermany,,,,,,,,,,,
linkedin,Technischer Projektleiter (m/w/d),SPECTRUM AG,"Munich, Bavaria, Germany",2026-06-03,https://www.linkedin.com/jobs/view/4419698213 , ,li-4419698213,fulltime,,,,,,False,entry level,Other,,,IT Services and IT Consulting,https://de.linkedin.com/company/spectrum-ag,,,,,,,,,,,
linkedin,System Engineer (human),NEURA Robotics,"Metzingen, Baden-Württemberg, Germany",2026-06-03,https://www.linkedin.com/jobs/view/4422965278 , ,li-4422965278,fulltime,,,,,,False,mid-senior level,Information Technology,,,Automation Machinery Manufacturing,https://de.linkedin.com/company/neura-robotics,,,,,,,,,,,
linkedin,Network Engineer,Logicalis Germany,"Frankfurt am Main, Hesse, Germany",2026-06-03,https://www.linkedin.com/jobs/view/4277722161 , ,li-4277722161,fulltime,,,,,,True,entry level,Information Technology,,de.hr@logicalis.de,IT Services and IT Consulting,https://de.linkedin.com/company/logicalisde,,,,,,,,,,,
linkedin,System Engineer,Greenjets,,2026-06-03,https://www.linkedin.com/jobs/view/4422956627 , ,li-4422956627,fulltime,,,,,,False,mid-senior level,Manufacturing and Product Management,,,Defense and Space Manufacturing and Automation Machinery Manufacturing,https://uk.linkedin.com/company/greenjetsltd,,,,,,,,,,,
linkedin,System Engineer (f/m/d) IP Transport,Deutsche Telekom,"Bonn, North Rhine-Westphalia, Germany",2026-06-03,https://www.linkedin.com/jobs/view/4422904884 , ,li-4422904884,fulltime,,,,,,False,mid-senior level,Information Technology,,,Telecommunications,https://de.linkedin.com/company/telekom,,,,,,,,,,,
linkedin,Field Integration Engineer (all genders),Coherent Corp.,"Kaiserslautern, Rhineland-Palatinate, Germany",2026-06-03,https://www.linkedin.com/jobs/view/4413891840 , ,li-4413891840,fulltime,,,,,,False,entry level,Engineering and Information Technology,,,Semiconductor Manufacturing,https://www.linkedin.com/company/coherent-corp,,,,,,,,,,,
linkedin,Systemingenieur:in,Hays,,2026-06-03,https://www.linkedin.com/jobs/view/4419681341 , ,li-4419681341,contract,,,,,,False,associate,Engineering,,,Semiconductor Manufacturing,https://uk.linkedin.com/company/hays,,,,,,,,,,,
linkedin,Systemingenieur Schutz (m/w/d),Rheinmetall,"Unterlüß, Lower Saxony, Germany",2026-06-03,https://www.linkedin.com/jobs/view/4406481221 , ,li-4406481221,fulltime,,,,,,False,entry level,Information Technology,,,Defense and Space Manufacturing,https://de.linkedin.com/company/rheinmetall,,,,,,,,,,,
linkedin,Systemingenieur Konstruktion elektronische Systeme (m/w/d) militärischer Schiffbau,ORANGE Engineering GmbH & Co. KG,"Wedel, Schleswig-Holstein, Germany",2026-06-03,https://www.linkedin.com/jobs/view/4420146909 , ,li-4420146909,fulltime,,,,,,False,mid-senior level,Information Technology,,,Machinery Manufacturing,https://de.linkedin.com/company/orange-engineering-gmbh,,,,,,,,,,,
linkedin,HF (High Frequency) Lab Engineer (f/m/d),eleQtron,"Siegen, North Rhine-Westphalia, Germany",2026-06-03,https://www.linkedin.com/jobs/view/4422440033 , ,li-4422440033,fulltime,,,,,,False,mid-senior level,Engineering,,,Engineering Services,https://de.linkedin.com/company/eleqtron-qc,,,,,,,,,,,
linkedin,Test Implementation Engineer – RF & Antenna Verification (m/f/d),Recruit-ME (Recruitment Made Easy),"Friedrichshafen, Baden-Württemberg, Germany",2026-06-03,https://www.linkedin.com/jobs/view/4422689423 , ,li-4422689423,other,,,,,,False,associate,Engineering and Information Technology,,,Airlines and Aviation,https://www.linkedin.com/company/recruit-me-recruitment-made-easy,,,,,,,,,,,
linkedin,RF (Radio Frequency) Test Engineer (f/m/d),eleQtron,"Siegen, North Rhine-Westphalia, Germany",2026-06-03,https://www.linkedin.com/jobs/view/4422443097 , ,li-4422443097,fulltime,,,,,,False,mid-senior level,Engineering,,,Engineering Services,https://de.linkedin.com/company/eleqtron-qc,,,,,,,,,,,
linkedin,Senior Radio Frequency Engineer,THRYVE,,2026-06-03,https://www.linkedin.com/jobs/view/4422676519 , ,li-4422676519,fulltime,,,,,,True,mid-senior level,"Engineering, Information Technology, and Research",,,"Defense and Space Manufacturing, Aviation and Aerospace Component Manufacturing, and Armed Forces",https://de.linkedin.com/company/thryvetalent,,,,,,,,,,,
linkedin,Antenna Design Engineer,Amphenol,"Frankfurt, Hesse, Germany",2026-06-03,https://www.linkedin.com/jobs/view/4296794814 , ,li-4296794814,fulltime,,,,,,False,associate,Engineering,,lauren.devine@amphenolmcp.com,"Appliances, Electrical, and Electronics Manufacturing",https://www.linkedin.com/company/amphenol,,,,,,,,,,,
linkedin,Design Engineer,Mercury,"Dresden, Saxony, Germany",2026-06-03,https://www.linkedin.com/jobs/view/4320062225 , ,li-4320062225,fulltime,,,,,,False,mid-senior level,Engineering and Information Technology,,,Construction,https://ie.linkedin.com/company/mercury-engineering,,,,,,,,,,,
linkedin,Verifikations- und Qualifikationsingenieur (m/w/d),Liebherr Group,"Lindau, Bavaria, Germany",2026-06-03,https://www.linkedin.com/jobs/view/4372838831 , ,li-4372838831,fulltime,,,,,,False,entry level,Management and Manufacturing,,katja.liedtke@liebherr.com,Industrial Machinery Manufacturing,https://de.linkedin.com/company/liebherr,,,,,,,,,,,
linkedin,Software Engineer (m/w/d),Afra GmbH,"Forchheim, Bavaria, Germany",2026-06-03,https://www.linkedin.com/jobs/view/4422931164 , ,li-4422931164,fulltime,,,,,,False,entry level,Information Technology,,bewerbung@afra.de,Information Technology & Services,https://de.linkedin.com/company/afra-gmbh,,,,,,,,,,,
linkedin,Entwicklungsingenieur Hardware (m/w/d),Rheinmetall,"Kassel, Hesse, Germany",2026-06-03,https://www.linkedin.com/jobs/view/4364757761 , ,li-4364757761,fulltime,,,,,,False,mid-senior level,Engineering and Information Technology,,,Defense and Space Manufacturing,https://de.linkedin.com/company/rheinmetall,,,,,,,,,,,
linkedin,Principal Engineer (m/f/d) Composite Design,TOYOTA RACING,"Cologne, North Rhine-Westphalia, Germany",2026-06-03,https://www.linkedin.com/jobs/view/4380905296 , ,li-4380905296,fulltime,,,,,,False,mid-senior level,Engineering and Information Technology,,,Motor Vehicle Manufacturing,https://de.linkedin.com/company/toyota-racing,,,,,,,,,,,
linkedin,RAMS / Diagnostic Engineer - settore DIFESA,Bertrandt Group,"Rom, Mecklenburg-West Pomerania, Germany",2026-06-03,https://www.linkedin.com/jobs/view/4424204744 , ,li-4424204744,fulltime,,,,,,False,mid-senior level,Quality Assurance,,,Engineering Services,https://de.linkedin.com/company/bertrandt-ag,,,,,,,,,,,
linkedin,Entwicklungsingenieur (m/w/x) Avionic GNSS- und Navigationssysteme,SII Group Romania,"Ottobrunn, Bavaria, Germany",2026-06-03,https://www.linkedin.com/jobs/view/4419660064 , ,li-4419660064,fulltime,,,,,,False,entry level,Engineering and Information Technology,,,IT Services and IT Consulting,https://ro.linkedin.com/company/sii-romania-,,,,,,,,,,,
linkedin,Software Engineer Image Generation (m/w/x),Reiser Simulation and Training GmbH,"Berg, Bavaria, Germany",2026-06-03,https://www.linkedin.com/jobs/view/4422933113 , ,li-4422933113,fulltime,,,,,,False,entry level,Information Technology,,,Information Technology & Services,https://de.linkedin.com/company/reiser-simulation-and-training,,,,,,,,,,,
linkedin,CUDA Kernel Optimization Specialist,Mercor,,2026-06-03,https://www.linkedin.com/jobs/view/4422628652 , ,li-4422628652,parttime,description,hourly,80.0,120.0,USD,True,not applicable,Engineering,,support@mercor.com,Software Development,https://www.linkedin.com/company/mercor-ai,,,,,,,,,,,
linkedin,Software Engineer (full-time) (Munich/Hybrid) (m/f/d),D11Z. Ventures,"Munich, Bavaria, Germany",2026-06-03,https://www.linkedin.com/jobs/view/4420122440 , ,li-4420122440,fulltime,,,,,,False,entry level,Information Technology,,,Venture Capital and Private Equity Principals,https://de.linkedin.com/company/d11z,,,,,,,,,,,
linkedin,QNX- Field Application Engineer (Industrial Automation/Robotics/Medical Devices),QNX,"Hesse, Germany",2026-06-03,https://www.linkedin.com/jobs/view/4413272573 , ,li-4413272573,fulltime,,,,,,False,not applicable,Sales and Business Development,,,Software Development,https://ca.linkedin.com/company/qnx,,,,,,,,,,,
linkedin,Realtime Software Developer (m/f/x),ZEISS Group,"Oberkochen, Baden-Württemberg, Germany",2026-06-03,https://www.linkedin.com/jobs/view/4422912609 , ,li-4422912609,fulltime,,,,,,False,mid-senior level,Information Technology and Other,,,"Manufacturing and Appliances, Electrical, and Electronics Manufacturing",https://de.linkedin.com/company/zeiss,,,,,,,,,,,
linkedin,Plasma Process & Equipment Engineer (m/f/d),TE Connectivity,"Berlin, Berlin, Germany",2026-06-03,https://www.linkedin.com/jobs/view/4422983785 , ,li-4422983785,fulltime,,,,,,False,associate,Engineering and Information Technology,,,"Appliances, Electrical, and Electronics Manufacturing",https://ie.linkedin.com/company/te-connectivity,,,,,,,,,,,
linkedin,Technology Professional (m/w/d),SMA Solar,"Kassel, Hesse, Germany",2026-06-03,https://www.linkedin.com/jobs/view/4419648580 , ,li-4419648580,fulltime,,,,,,False,entry level,Other,,,Renewable Energy Semiconductor Manufacturing,https://de.linkedin.com/company/sma-solar,,,,,,,,,,,
linkedin,Software Developer (m/f/d) Space,FERCHAU,"Immenstaad am Bodensee, Baden-Württemberg, Germany",2026-06-03,https://www.linkedin.com/jobs/view/4374077776 , ,li-4374077776,fulltime,,,,,,False,entry level,Engineering and Information Technology,,aviation.muc@ferchau.com,Engineering Services,https://de.linkedin.com/company/ferchau,,,,,,,,,,,
linkedin,Senior Research Scientist,NVIDIA,"Hamburg, Hamburg, Germany",2026-06-03,https://www.linkedin.com/jobs/view/4424005336 , ,li-4424005336,fulltime,,,,,,False,mid-senior level,Other,,,Computer Hardware Manufacturing,https://www.linkedin.com/company/nvidia,,,,,,,,,,,
linkedin,Tech Lead — Robot Communication & Connectivity (human),NEURA Robotics,"Metzingen, Baden-Württemberg, Germany",2026-06-03,https://www.linkedin.com/jobs/view/4422949607 , ,li-4422949607,fulltime,,,,,,False,mid-senior level,"Marketing, Public Relations, and Writing/Editing",,,Automation Machinery Manufacturing,https://de.linkedin.com/company/neura-robotics,,,,,,,,,,,
linkedin,CFD Software Engineer,Siemens,"Munich, Bavaria, Germany",2026-06-03,https://www.linkedin.com/jobs/view/4424220655 , ,li-4424220655,fulltime,,,,,,False,mid-senior level,Research,,,Automation Machinery Manufacturing,https://de.linkedin.com/company/siemens,,,,,,,,,,,
linkedin,Engineer Defence Naval Systems (m/w/d),P3 KOREA,"Hamburg, Hamburg, Germany",2026-06-03,https://www.linkedin.com/jobs/view/4423025962 , ,li-4423025962,fulltime,,,,,,False,mid-senior level,Information Technology,,,Business Consulting and Services,https://kr.linkedin.com/company/p3-korea,,,,,,,,,,,
linkedin,Software Developer - Embedded Wireless Modules (m/w/d),Tria,"Aachen, North Rhine-Westphalia, Germany",2026-06-03,https://www.linkedin.com/jobs/view/4422951383 , ,li-4422951383,fulltime,,,,,,False,mid-senior level,Engineering and Information Technology,,"hrnow@avnet.com, hrnow.asia@avnet.com, hrnow.EMEA@avnet.eu","Technology, Information and Internet",https://de.linkedin.com/company/triatechnologies,,,,,,,,,,,
linkedin,Embedded Software Developer for AUDIO (f/m/x),Impulse Audio Lab,"Munich, Bavaria, Germany",2026-06-03,https://www.linkedin.com/jobs/view/4412281976 , ,li-4412281976,fulltime,,,,,,True,entry level,Engineering and Information Technology,,,Design Services,https://de.linkedin.com/company/impulse-audio-lab,,,,,,,,,,,
linkedin,PCB Design & Electrical Engineer (human),NEURA Robotics,"Metzingen, Baden-Württemberg, Germany",2026-06-03,https://www.linkedin.com/jobs/view/4422959405 , ,li-4422959405,fulltime,,,,,,False,mid-senior level,Engineering and Information Technology,,,Automation Machinery Manufacturing,https://de.linkedin.com/company/neura-robotics,,,,,,,,,,,
linkedin,Hardware Architect - Cognitive Robotics (Mensch),NEURA Robotics,"Metzingen, Baden-Württemberg, Germany",2026-06-03,https://www.linkedin.com/jobs/view/4422952566 , ,li-4422952566,fulltime,,,,,,False,mid-senior level,Engineering and Information Technology,,,Automation Machinery Manufacturing,https://de.linkedin.com/company/neura-robotics,,,,,,,,,,,
linkedin,Ion Trap Designer (m/f/d),QUDORA Technologies,"Brunswick, Lower Saxony, Germany",2026-06-03,https://www.linkedin.com/jobs/view/4422630715 , ,li-4422630715,contract,,,,,,True,entry level,"Design, Art/Creative, and Information Technology",,,Computer Hardware Manufacturing,https://de.linkedin.com/company/qudora,,,,,,,,,,,
linkedin,Hardwareentwicklungsingenieur:in,Wodeer Technology Europe GmbH,"Adelberg-Dorf, Baden-Württemberg, Germany",2026-06-03,https://www.linkedin.com/jobs/view/4424205698 , ,li-4424205698,fulltime,,,,,,False,associate,Engineering,,hr@wodeer.eu,Motor Vehicle Manufacturing and Motor Vehicle Parts Manufacturing,https://de.linkedin.com/company/wodeer-technology-europe-gmbh,,,,,,,,,,,
linkedin,Embedded Software Test Development Engineer (f/m/x),ZEISS Group,"Oberkochen, Baden-Württemberg, Germany",2026-06-03,https://www.linkedin.com/jobs/view/4422902425 , ,li-4422902425,fulltime,,,,,,False,mid-senior level,Information Technology and Other,,,"Manufacturing and Appliances, Electrical, and Electronics Manufacturing",https://de.linkedin.com/company/zeiss,,,,,,,,,,,
linkedin,Electronics Engineer (m/f/d),Agile Robots SE,"Munich, Bavaria, Germany",2026-06-03,https://www.linkedin.com/jobs/view/4419681693 , ,li-4419681693,fulltime,,,,,,False,entry level,Engineering,,,"Robotics Engineering, Robot Manufacturing, and Software Development",https://de.linkedin.com/company/agile-robots-se,,,,,,,,,,,
linkedin,Embedded-Software-Entwickler (m/w/d),FERCHAU,"Brunswick, Lower Saxony, Germany",2026-06-03,https://www.linkedin.com/jobs/view/4374074884 , ,li-4374074884,fulltime,,,,,,False,entry level,Engineering and Information Technology,,braunschweig@ferchau.com,Engineering Services,https://de.linkedin.com/company/ferchau,,,,,,,,,,,
linkedin,Embedded Software Engineer,SpaceTech International,"Bremen, Germany",2026-06-03,https://www.linkedin.com/jobs/view/4419677300 , ,li-4419677300,fulltime,,,,,,False,mid-senior level,Engineering and Information Technology,,,"Defense and Space Manufacturing, Space Research and Technology, and Software Development",https://uk.linkedin.com/company/spacetech-international,,,,,,,,,,,
linkedin,Embedded Softwareentwickler (m/w/d),Bertrandt Group,"Berlin, Berlin, Germany",2026-06-03,https://www.linkedin.com/jobs/view/4424221056 , ,li-4424221056,fulltime,,,,,,False,mid-senior level,Engineering and Information Technology,,,Engineering Services,https://de.linkedin.com/company/bertrandt-ag,,,,,,,,,,,
linkedin,Embedded-Software-Entwickler (m/w/d),FERCHAU,"Munich, Bavaria, Germany",2026-06-03,https://www.linkedin.com/jobs/view/4374074901 , ,li-4374074901,fulltime,,,,,,False,mid-senior level,Engineering and Information Technology,,yue.tang@ferchau.com,Engineering Services,https://de.linkedin.com/company/ferchau,,,,,,,,,,,
linkedin,Embedded & Firmware Engineer (human),NEURA Robotics,"Metzingen, Baden-Württemberg, Germany",2026-06-03,https://www.linkedin.com/jobs/view/4422956493 , ,li-4422956493,fulltime,,,,,,False,mid-senior level,Engineering and Information Technology,,,Automation Machinery Manufacturing,https://de.linkedin.com/company/neura-robotics,,,,,,,,,,,
linkedin,Embedded Firmware Developer (FPGA/SoC),Technology & Strategy,"Berlin, Germany",2026-06-02,https://www.linkedin.com/jobs/view/4422340182 , ,li-4422340182,fulltime,,,,,,False,associate,Engineering,,,"Technology, Information and Media",https://fr.linkedin.com/company/technology-&-strategy-t&s-,,,,,,,,,,,
linkedin,Senior Systems Engineer,CesiumAstro,"Munich, Bavaria, Germany",2026-06-02,https://www.linkedin.com/jobs/view/4422383382 , ,li-4422383382,fulltime,,,,,,False,mid-senior level,Information Technology,,,Defense and Space Manufacturing,https://www.linkedin.com/company/cesiumastro,,,,,,,,,,,
linkedin,RF/mmWave IC Test & Characterization Engineer,Keysight Technologies,"Böblingen, Baden-Württemberg, Germany",2026-06-02,https://www.linkedin.com/jobs/view/4419296466 , ,li-4419296466,fulltime,,,,,,False,mid-senior level,"Management, Project Management, and Engineering",,,"Appliances, Electrical, and Electronics Manufacturing and Technology, Information and Internet",https://www.linkedin.com/company/keysight-technologies,,,,,,,,,,,
linkedin,Embedded Software Entwickler:in (all genders) 25163,WEBER GmbH,"Aschaffenburg, Bavaria, Germany",2026-06-02,https://www.linkedin.com/jobs/view/4422359300 , ,li-4422359300,fulltime,,,,,,False,associate,Engineering,,bewerbung@webergmbh.de,Automation Machinery Manufacturing,https://de.linkedin.com/company/webergmbh,,,,,,,,,,,
linkedin,Embedded Software Engineer,NXP Semiconductors,"Hamburg, Hamburg, Germany",2026-06-02,https://www.linkedin.com/jobs/view/4393236614 , ,li-4393236614,fulltime,,,,,,True,mid-senior level,Engineering and Information Technology,,maria.bertesteanu@nxp.com,"Semiconductor Manufacturing, Computers and Electronics Manufacturing, and Software Development",https://nl.linkedin.com/company/nxp-semiconductors,,,,,,,,,,,
linkedin,Forward Deployed AI Engineer | €3bn+ AUM Private Equity Firm | AI-First Strategy,AI Futures,"Munich, Bavaria, Germany",2026-06-02,https://www.linkedin.com/jobs/view/4419609606 , ,li-4419609606,fulltime,,,,,,False,mid-senior level,Information Technology and Consulting,,,"Venture Capital and Private Equity Principals, IT Services and IT Consulting, and Staffing and Recruiting",https://uk.linkedin.com/company/aifuturesgroup,,,,,,,,,,,
linkedin,Embedded SW Tech Lead Engineer (m/f/d),John Deere,"Kaiserslautern, Rhineland-Palatinate, Germany",2026-06-02,https://www.linkedin.com/jobs/view/4423939956 , ,li-4423939956,fulltime,,,,,,False,not applicable,Engineering and Information Technology,,RecruitingGermany@JohnDeere.com,Machinery Manufacturing,https://www.linkedin.com/company/john-deere,,,,,,,,,,,
linkedin,"Service Engineer or Technician (m/f/d) for spectroscopy products (UV–Vis-NIR, FTIR, RF, Raman) in full time (37,5 hours/week) to join our European Headquarters in Duisburg.",Shimadzu Sverige,"Duisburg, North Rhine-Westphalia, Germany",2026-06-02,https://www.linkedin.com/jobs/view/4422491701 , ,li-4422491701,fulltime,,,,,,True,entry level,Engineering and Information Technology,,,Biotechnology Research,https://se.linkedin.com/company/shimadzu-sverige,,,,,,,,,,,
linkedin,Systemingenieur:in,Technology & Strategy,"Berlin, Germany",2026-06-02,https://www.linkedin.com/jobs/view/4422343300 , ,li-4422343300,fulltime,,,,,,False,entry level,Engineering,,,Engineering Services,https://fr.linkedin.com/company/technology-&-strategy-t&s-,,,,,,,,,,,
linkedin,"Service Engineer or Technician (m/f/d) for spectroscopy products (UV–Vis-NIR, FTIR, RF, Raman) in full time (37,5 hours/week) to join our European Headquarters in Duisburg.",Shimadzu Europa GmbH,"Duisburg, North Rhine-Westphalia, Germany",2026-06-02,https://www.linkedin.com/jobs/view/4419606276 , ,li-4419606276,fulltime,,,,,,True,entry level,Engineering and Information Technology,,,Biotechnology Research,https://de.linkedin.com/company/shimadzu-europa-gmbh,,,,,,,,,,,
linkedin,Systemingenieur (m/w/d) Hardware & Systemintegration,ACONEXT,"Taufkirchen, Bavaria, Germany",2026-06-02,https://www.linkedin.com/jobs/view/4423912941 , ,li-4423912941,fulltime,,,,,,False,mid-senior level,Information Technology,,,Engineering Services,https://de.linkedin.com/company/aconext-holding-gmbh,,,,,,,,,,,
linkedin,Silicon Photonics verification and validation engineer (f/m/d),Scantinel,"Ulm, Baden-Württemberg, Germany",2026-06-02,https://www.linkedin.com/jobs/view/4423832155 , ,li-4423832155,fulltime,,,,,,False,mid-senior level,Quality Assurance,,,Motor Vehicle Parts Manufacturing,https://de.linkedin.com/company/scantinel,,,,,,,,,,,
linkedin,ATC Application Design Engineer (f/m/d),Alstom,"Hamburg, Hamburg, Germany",2026-06-02,https://www.linkedin.com/jobs/view/4419236633 , ,li-4419236633,fulltime,,,,,,False,entry level,Engineering,,,Truck Transportation and Railroad Equipment Manufacturing,https://fr.linkedin.com/company/alstom,,,,,,,,,,,
linkedin,Embedded Software Engineer,SR2 | Socially Responsible Recruitment | Certified B Corporation™,"Munich, Bavaria, Germany",2026-06-02,https://www.linkedin.com/jobs/view/4419267041 , ,li-4419267041,fulltime,,,,,,False,mid-senior level,Information Technology and Engineering,,,Defense and Space Manufacturing,https://uk.linkedin.com/company/sr2-socially-responsible-recruitment,,,,,,,,,,,
linkedin,PCB Layout Designer,Christy Media Solutions,"Baden-Württemberg, Germany",2026-06-02,https://www.linkedin.com/jobs/view/4419611423 , ,li-4419611423,fulltime,,,,,,False,mid-senior level,Engineering and Design,,,"Broadcast Media Production and Distribution, Engineering Services, and Audio and Video Equipment Manufacturing",https://uk.linkedin.com/company/christy-media-solutions,,,,,,,,,,,
linkedin,FPGA Design Engineer (m/w/d),AES Technology GmbH,"Göttingen, Lower Saxony, Germany",2026-06-02,https://www.linkedin.com/jobs/view/4423883825 , ,li-4423883825,fulltime,,,,,,True,associate,"Design, Information Technology, and Product Management",,,Defense and Space Manufacturing,https://de.linkedin.com/company/aes-technology-gmbh,,,,,,,,,,,
linkedin,Embedded Softwareentwickler (m/w/d) | ebs kumkeo GmbH | Kiel,dailyTalents,"Kiel, Schleswig-Holstein, Germany",2026-06-02,https://www.linkedin.com/jobs/view/4419267064 , ,li-4419267064,fulltime,,,,,,False,associate,Information Technology,,,Staffing and Recruiting,https://www.linkedin.com/company/dailytalentsio,,,,,,,,,,,
linkedin,FPGA Engineer,The Exploration Company,"Munich, Bavaria, Germany",2026-06-02,https://www.linkedin.com/jobs/view/4423916293 , ,li-4423916293,fulltime,,,,,,False,entry level,Engineering and Information Technology,,,Aviation and Aerospace Component Manufacturing,https://de.linkedin.com/company/exploration-company,,,,,,,,,,,
linkedin,Requirements Engineer (m/w/x) DOORS & Systems Engineering,SII Germany,"Oberkochen, Baden-Württemberg, Germany",2026-06-02,https://www.linkedin.com/jobs/view/4387834132 , ,li-4387834132,fulltime,,,,,,True,associate,Information Technology,,,IT Services and IT Consulting,https://de.linkedin.com/company/sii-germany,,,,,,,,,,,
linkedin,(Senior) Software Engineer (all genders welcome),aiomatic,"Hamburg, Hamburg, Germany",2026-06-02,https://www.linkedin.com/jobs/view/4419265195 , ,li-4419265195,fulltime,,,,,,False,associate,Information Technology,,,IT Services and IT Consulting,https://de.linkedin.com/company/aiomatic,,,,,,,,,,,
linkedin,Space Avionics Simulation & Software Engineer (all gender),ALTEN,"Friedrichshafen, Baden-Württemberg, Germany",2026-06-02,https://www.linkedin.com/jobs/view/4419246514 , ,li-4419246514,fulltime,,,,,,False,mid-senior level,"Production, Distribution, and Engineering",,,Software Development and IT Services and IT Consulting,https://fr.linkedin.com/company/alten,,,,,,,,,,,
linkedin,Operations Research Engineer (m/f/d),Idealworks,"Munich, Bavaria, Germany",2026-06-02,https://www.linkedin.com/jobs/view/4419287891 , ,li-4419287891,fulltime,,,,,,False,associate,Information Technology,,,Telecommunications,https://de.linkedin.com/company/idealworks-gmbh,,,,,,,,,,,
