site,title,company,location,date_posted,job_url,job_url_direct,id,job_type,salary_source,interval,min_amount,max_amount,currency,is_remote,job_level,job_function,listing_type,emails,company_industry,company_url,company_url_direct,company_addresses,company_num_employees,company_revenue,company_description,skills,experience_range,company_rating,company_reviews_count,vacancy_count,work_from_home_type
linkedin,Working Student - Industrial Design / Technical Illustration & Training Materials / Process Engineering (m/w/d) - REF93769B,Continental,"Hannover, Lower Saxony, Germany",2026-04-24,https://www.linkedin.com/jobs/view/4404109478 , ,li-4404109478,parttime,,,,,,True,not applicable,Other,,,Automotive,https://de.linkedin.com/company/continental,,,,,,,,,,,
linkedin,Werkstudent:in 5G/6G Mobilfunk,Fraunhofer FOKUS,"Berlin, Berlin, Germany",2026-04-23,https://www.linkedin.com/jobs/view/4404773381 , ,li-4404773381,fulltime,,,,,,False,internship,Administrative,,"eric.troudt@fokus.fraunhofer.de, recruiting@fokus.fraunhofer.de",Research,https://de.linkedin.com/company/fraunhoferfokus,,,,,,,,,,,
linkedin,Praktikum im Bereich Systems Engineering (w/m/d),HENSOLDT,"Ulm, Baden-Württemberg, Germany",2026-04-23,https://www.linkedin.com/jobs/view/4404009359 , ,li-4404009359,fulltime,,,,,,False,internship,Information Technology,,students@hensoldt.net,Defense and Space Manufacturing,https://de.linkedin.com/company/hensoldt,,,,,,,,,,,
linkedin,Working Student in Organizational Business Transformation at Allianz SE (m/f/d),Allianz,"Munich, Bavaria, Germany",2026-04-23,https://www.linkedin.com/jobs/view/4405812755 , ,li-4405812755,parttime,,,,,,False,internship,Information Technology,,-operations@allianz.de,Financial Services and Insurance,https://de.linkedin.com/company/allianz,,,,,,,,,,,
linkedin,VR Robot Teleoperator - Working Student (No Technical Background Needed),Poke & Wiggle,"Munich, Bavaria, Germany",2026-04-22,https://www.linkedin.com/jobs/view/4402491528 , ,li-4402491528,parttime,,,,,,False,entry level,Other,,,"Technology, Information and Media",https://de.linkedin.com/company/poke-and-wiggle,,,,,,,,,,,
linkedin,Working Student - System Application Engineering (f/m/div),Infineon Technologies,"Munich, Bavaria, Germany",,https://www.linkedin.com/jobs/view/4407846818 , ,li-4407846818,fulltime,,,,,,False,internship,Information Technology,,,"Semiconductor Manufacturing, Appliances, Electrical, and Electronics Manufacturing, and Computer Hardware Manufacturing",https://de.linkedin.com/company/infineon-technologies,,,,,,,,,,,
linkedin,Intern Business Transformation at Allianz SE (m/f/d),Allianz,"Munich, Bavaria, Germany",,https://www.linkedin.com/jobs/view/4404331796 , ,li-4404331796,fulltime,,,,,,False,internship,Information Technology,,-operations@allianz.de,Financial Services and Insurance,https://de.linkedin.com/company/allianz,,,,,,,,,,,
