site,title,company,location,date_posted,job_url,job_url_direct,id,job_type,salary_source,interval,min_amount,max_amount,currency,is_remote,job_level,job_function,listing_type,emails,company_industry,company_url,company_url_direct,company_addresses,company_num_employees,company_revenue,company_description,skills,experience_range,company_rating,company_reviews_count,vacancy_count,work_from_home_type
linkedin,Founding Engineer,SANOVIO,"Munich, Bavaria, Germany",2026-05-08,https://www.linkedin.com/jobs/view/4409673421 , ,li-4409673421,fulltime,,,,,,False,mid-senior level,Information Technology,,,Software Development,https://de.linkedin.com/company/sanovio,,,,,,,,,,,
linkedin,SCC System Engineer (d/f/m),Airbus Defence and Space,"Munich, Bavaria, Germany",2026-05-08,https://www.linkedin.com/jobs/view/4400490694 , ,li-4400490694,parttime,,,,,,False,mid-senior level,Information Technology,,emsom@airbus.com,Defense and Space Manufacturing,https://www.linkedin.com/company/airbus-defence-and-space,,,,,,,,,,,
linkedin,AI Researcher,Mercor,,2026-05-08,https://www.linkedin.com/jobs/view/4411330199 , ,li-4411330199,parttime,description,hourly,35.0,75.0,USD,True,not applicable,Research,,support@mercor.com,Software Development,https://www.linkedin.com/company/mercor-ai,,,,,,,,,,,
linkedin,Optical Engineer with Python - Freelance AI Trainer,Mindrift,"Frankfurt am Main, Hesse, Germany",2026-05-08,https://www.linkedin.com/jobs/view/4412192406 , ,li-4412192406,parttime,,,,,,False,entry level,Other,,,IT Services and IT Consulting,https://www.linkedin.com/company/mindrift-ai,,,,,,,,,,,
linkedin,Automation & Robotics Engineer (all gender) – Smart Factory,ALTEN Germany,"Munich, Bavaria, Germany",2026-05-08,https://www.linkedin.com/jobs/view/4409696427 , ,li-4409696427,fulltime,,,,,,False,associate,Engineering and Project Management,,,Motor Vehicle Manufacturing,https://de.linkedin.com/company/altengermany,,,,,,,,,,,
linkedin,Optical Engineer with Python - Freelance AI Trainer,Mindrift,"Hamburg, Hamburg, Germany",2026-05-08,https://www.linkedin.com/jobs/view/4412187754 , ,li-4412187754,parttime,,,,,,False,entry level,Other,,,IT Services and IT Consulting,https://www.linkedin.com/company/mindrift-ai,,,,,,,,,,,
linkedin,Embedded Softwareentwickler BMS (m/w/d) Standort München,STAR Specialists,"Bavaria, Germany",2026-05-08,https://www.linkedin.com/jobs/view/4411708274 , ,li-4411708274,fulltime,,,,,,False,mid-senior level,Engineering and Information Technology,,,"Engineering Services, Construction, and Renewable Energy Power Generation",https://nl.linkedin.com/company/starspecialists,,,,,,,,,,,
linkedin,Hardware Engineer Automotive (all gender),ALTEN Germany,"Kronach, Bavaria, Germany",2026-05-08,https://www.linkedin.com/jobs/view/4402463921 , ,li-4402463921,fulltime,,,,,,False,associate,Engineering,,,Motor Vehicle Manufacturing,https://de.linkedin.com/company/altengermany,,,,,,,,,,,
linkedin,Electrical Engineer,Nova Ltd.,"Bad Urach, Baden-Württemberg, Germany",2026-05-08,https://www.linkedin.com/jobs/view/4410471932 , ,li-4410471932,fulltime,,,,,,True,mid-senior level,"Engineering, Design, and Project Management",,,"Industrial Machinery Manufacturing, Appliances, Electrical, and Electronics Manufacturing, and Semiconductor Manufacturing",https://il.linkedin.com/company/nova-ltd.,,,,,,,,,,,
linkedin,Robotics Software Engineer (ROS2 & Sensor Pipelines) | Remote,Crossing Hurdles,,2026-05-08,https://www.linkedin.com/jobs/view/4411343782 , ,li-4411343782,fulltime,,,,,,True,associate,Engineering and Information Technology,,,Software Development and IT Services and IT Consulting,https://www.linkedin.com/company/crossinghurdles,,,,,,,,,,,
linkedin,Electric Hardware Engineer (m/w/d),ROTZLER GROUP,"Steinen, Baden-Württemberg, Germany",2026-05-08,https://www.linkedin.com/jobs/view/4411358886 , ,li-4411358886,fulltime,,,,,,False,entry level,Engineering and Information Technology,,,Industrial Machinery Manufacturing,https://de.linkedin.com/company/rotzler-group,,,,,,,,,,,
linkedin,Embedded Software Engineer  (m/f/d),MSA - The Safety Company,"Berlin, Berlin, Germany",2026-05-08,https://www.linkedin.com/jobs/view/4382587239 , ,li-4382587239,fulltime,,,,,,True,associate,Engineering and Information Technology,,,Public Safety,https://www.linkedin.com/company/msa-the-safety-company,,,,,,,,,,,
linkedin,Softwareentwickler Embedded Linux (m/w/d) – Autonome Baumaschinen,WIRTGEN GROUP,"Windhagen, Rhineland-Palatinate, Germany",2026-05-08,https://www.linkedin.com/jobs/view/4412199230 , ,li-4412199230,fulltime,,,,,,False,mid-senior level,Engineering and Information Technology,,,Machinery Manufacturing,https://de.linkedin.com/company/wirtgen-group,,,,,,,,,,,
linkedin,Embedded Software Developer (m/w/d),NDT Global,"Stutensee, Baden-Württemberg, Germany",2026-05-08,https://www.linkedin.com/jobs/view/4355243040 , ,li-4355243040,fulltime,,,,,,False,mid-senior level,Engineering and Information Technology,,,Energy Technology,https://ca.linkedin.com/company/ndt-global,,,,,,,,,,,
linkedin,Electrical Engineer (all gender) – Tests & High-Tech Systeme,ALTEN Germany,"Munich, Bavaria, Germany",2026-05-08,https://www.linkedin.com/jobs/view/4409691392 , ,li-4409691392,fulltime,,,,,,False,associate,Engineering and Project Management,,,Motor Vehicle Manufacturing,https://de.linkedin.com/company/altengermany,,,,,,,,,,,
linkedin,Embedded Software Developer (all gender) Linux-basierte Steuerungssysteme für Digitaldruckanlagen 400,ALTEN Germany,"Poing, Bavaria, Germany",2026-05-08,https://www.linkedin.com/jobs/view/4399941558 , ,li-4399941558,fulltime,,,,,,False,entry level,Information Technology and Engineering,,,Software Development,https://de.linkedin.com/company/altengermany,,,,,,,,,,,
linkedin,FPGA / Embedded Software Engineer (all gender) – High Power Systems 100,ALTEN Germany,"Berlin, Germany",2026-05-08,https://www.linkedin.com/jobs/view/4411381470 , ,li-4411381470,fulltime,,,,,,False,associate,"Engineering, Information Technology, and Production",,,"Research Services, IT System Custom Software Development, and Medical Equipment Manufacturing",https://de.linkedin.com/company/altengermany,,,,,,,,,,,
linkedin,Freelance Embedded Software Engineer,Vivid Resourcing,,2026-05-08,https://www.linkedin.com/jobs/view/4383759739 , ,li-4383759739,contract,,,,,,True,mid-senior level,Engineering,,,Engineering Services and Industrial Machinery Manufacturing,https://uk.linkedin.com/company/vivid-resourcing-ltd,,,,,,,,,,,
linkedin,Embedded Software Engineer für innovative Funklösungen in der Maschinensteuerung,NBB Controls + Components GmbH,"Ölbronn, Baden-Württemberg, Germany",2026-05-08,https://www.linkedin.com/jobs/view/4412133888 , ,li-4412133888,fulltime,,,,,,False,mid-senior level,Engineering,,,Manufacturing,https://de.linkedin.com/company/nbb-controls-components-gmbh,,,,,,,,,,,
linkedin,Embedded Engineer (all gender) – Hardware trifft Software,ALTEN Germany,"Munich, Bavaria, Germany",2026-05-08,https://www.linkedin.com/jobs/view/4409682702 , ,li-4409682702,fulltime,,,,,,False,associate,"Engineering, Project Management, and Information Technology",,,"Motor Vehicle Manufacturing, IT Services and IT Consulting, and Machinery Manufacturing",https://de.linkedin.com/company/altengermany,,,,,,,,,,,
linkedin,Embedded Software Engineer – Batteriesysteme (all gender) 800,ALTEN Germany,"Kaufering, Bavaria, Germany",2026-05-08,https://www.linkedin.com/jobs/view/4352529101 , ,li-4352529101,fulltime,,,,,,False,entry level,Project Management and Information Technology,,,"Machinery Manufacturing, Energy Technology, and Software Development",https://de.linkedin.com/company/altengermany,,,,,,,,,,,
linkedin,"Hardware Engineer (EMC, Design Verification) - (m/f/d)",HARMAN International,"Karlsbad, Baden-Württemberg, Germany",2026-05-08,https://www.linkedin.com/jobs/view/4412146214 , ,li-4412146214,fulltime,,,,,,True,mid-senior level,Engineering and Information Technology,,harmancareers@harman.com,Computers and Electronics Manufacturing,https://www.linkedin.com/company/harman-international,,,,,,,,,,,
linkedin,Design Engineer (m/w/d),SOGECLAIR,"Bremen, Bremen, Germany",2026-05-08,https://www.linkedin.com/jobs/view/4411398509 , ,li-4411398509,fulltime,,,,,,False,mid-senior level,Engineering,,,Non-profit Organizations and Primary and Secondary Education,https://fr.linkedin.com/company/groupesogeclair,,,,,,,,,,,
linkedin,(Senior) Quality Engineer - Hardware Development Projects (m/f/d),EGYM | DACH,"Munich, Bavaria, Germany",2026-05-08,https://www.linkedin.com/jobs/view/4370546023 , ,li-4370546023,fulltime,,,,,,False,mid-senior level,Quality Assurance,,jobs@egym.com,Wellness and Fitness Services,https://de.linkedin.com/company/egym-gmbh,,,,,,,,,,,
linkedin,.NET Software Engineer (m/f/d) - Frankfurt,Code Compass 🧭,"Frankfurt, Hesse, Germany",2026-05-08,https://www.linkedin.com/jobs/view/4411386807 , ,li-4411386807,fulltime,,,,,,True,mid-senior level,"Information Technology, Engineering, and Other",,,"Staffing and Recruiting, IT Services and IT Consulting, and Technology, Information and Media",https://ch.linkedin.com/company/code-compass,,,,,,,,,,,
linkedin,"Entwicklungsingenieur Elektrik/ Elektronik, all genders",SALT AND PEPPER Group,"Augsburg, Bavaria, Germany",2026-05-08,https://www.linkedin.com/jobs/view/4301173993 , ,li-4301173993,fulltime,,,,,,False,entry level,Engineering and Information Technology,,,Engineering Services,https://de.linkedin.com/company/salt-and-pepper,,,,,,,,,,,
linkedin,Systemingenieur Fahrerassistenzsysteme / ADAS (m/w/d),prognum Automotive GmbH,"Stuttgart, Baden-Württemberg, Germany",2026-05-07,https://www.linkedin.com/jobs/view/4411441554 , ,li-4411441554,fulltime,,,,,,False,entry level,Information Technology,,,Engineering Services,https://de.linkedin.com/company/prognum-automotive,,,,,,,,,,,
linkedin,Power Electronics Hardware Engineer (all genders),VÆRIDION,"Munich, Bavaria, Germany",2026-05-07,https://www.linkedin.com/jobs/view/4410467031 , ,li-4410467031,fulltime,,,,,,True,associate,Engineering,,,Aviation and Aerospace Component Manufacturing,https://de.linkedin.com/company/vaeridion,,,,,,,,,,,
linkedin,Senior Robotics Hardware Engineer – Next Generation Platform (m/f/d),RobCo,"Munich, Bavaria, Germany",2026-05-07,https://www.linkedin.com/jobs/view/4411632102 , ,li-4411632102,fulltime,,,,,,True,mid-senior level,Engineering and Information Technology,,,"Technology, Information and Internet",https://de.linkedin.com/company/robco-therobotcompany,,,,,,,,,,,
linkedin,Software Engineer (m/f/d),Zählerfreunde GmbH,"Munich, Bavaria, Germany",2026-05-07,https://www.linkedin.com/jobs/view/4409274366 , ,li-4409274366,fulltime,,,,,,False,mid-senior level,Engineering and Information Technology,,,Services for Renewable Energy,https://de.linkedin.com/company/zaehlerfreunde,,,,,,,,,,,
linkedin,Electronics Hardware Engineer (Mid Level) - Berlin,Better Devices,"Berlin, Germany",2026-05-07,https://www.linkedin.com/jobs/view/4408812503 , ,li-4408812503,fulltime,,,,,,False,entry level,Engineering and Information Technology,,,Engineering Services,https://de.linkedin.com/company/better-devices,,,,,,,,,,,
linkedin,Quality Engineer (m/w/d),Magna International,"Neuenstadt am Kocher, Baden-Württemberg, Germany",2026-05-07,https://www.linkedin.com/jobs/view/4371014195 , ,li-4371014195,fulltime,,,,,,False,entry level,Quality Assurance,,,Motor Vehicle Manufacturing,https://ca.linkedin.com/company/magna-international,,,,,,,,,,,
linkedin,Founding Engineer (all genders),cargovibe,"Hamburg, Germany",2026-05-07,https://www.linkedin.com/jobs/view/4411498919 , ,li-4411498919,fulltime,,,,,,True,mid-senior level,Engineering and Information Technology,,,"Transportation, Logistics, Supply Chain and Storage",https://de.linkedin.com/company/cargovibe,,,,,,,,,,,
linkedin,Systemingenieur (w/m/d),WITTENSTEIN group,"Igersheim, Baden-Württemberg, Germany",2026-05-07,https://www.linkedin.com/jobs/view/4258391767 , ,li-4258391767,fulltime,,,,,,False,associate,Research and Engineering,,,Automation Machinery Manufacturing,https://de.linkedin.com/company/wittenstein-group,,,,,,,,,,,
linkedin,Systems Engineer (m/f/d),TXT GROUP,"Munich, Bavaria, Germany",2026-05-07,https://www.linkedin.com/jobs/view/4410823243 , ,li-4410823243,fulltime,,,,,,False,entry level,Information Technology,,,IT Services and IT Consulting,https://it.linkedin.com/company/txtgroup,,,,,,,,,,,
linkedin,Systems Engineering & IT/OT-Architektur (gn*),MAGNET-SCHULTZ GmbH & Co. KG,"Memmingen, Bavaria, Germany",2026-05-07,https://www.linkedin.com/jobs/view/4411628720 , ,li-4411628720,fulltime,,,,,,False,associate,Information Technology,,,Electrical Equipment Manufacturing,https://de.linkedin.com/company/magnet-schultz-gmbh-&-co.-kg,,,,,,,,,,,
linkedin,M365 System Engineer – Schwerpunkt Teams und Collaboration (m/w/d),Ratiodata,"Hannover, Lower Saxony, Germany",2026-05-07,https://www.linkedin.com/jobs/view/4367215309 , ,li-4367215309,fulltime,,,,,,False,mid-senior level,Information Technology,,,IT Services and IT Consulting,https://de.linkedin.com/company/ratiodata,,,,,,,,,,,
linkedin,Design Engineer / Konstruktion (all gender),Actana Consulting Services GmbH,"Munich, Bavaria, Germany",2026-05-07,https://www.linkedin.com/jobs/view/4409228754 , ,li-4409228754,fulltime,,,,,,False,mid-senior level,Engineering,,,Professional Services,https://de.linkedin.com/company/actana-gmbh,,,,,,,,,,,
linkedin,Mobile UI/Design Engineer,Kraken,,2026-05-07,https://www.linkedin.com/jobs/view/4402628283 , ,li-4402628283,fulltime,,,,,,True,entry level,Engineering and Information Technology,,,Financial Services,https://www.linkedin.com/company/krakenfx,,,,,,,,,,,
linkedin,Engineer (f/m/d) - Antenna Development for Satellite Navigation and Communication,German Aerospace Center (DLR),"Oberpfaffenhofen, Bavaria, Germany",2026-05-07,https://www.linkedin.com/jobs/view/4411238479 , ,li-4411238479,fulltime,,,,,,False,entry level,Engineering and Information Technology,,,Research Services,https://de.linkedin.com/company/dlr,,,,,,,,,,,
linkedin,Embedded Senior Hardware Engineer,Jobgether,,2026-05-07,https://www.linkedin.com/jobs/view/4410465206 , ,li-4410465206,fulltime,,,,,,True,mid-senior level,Engineering and Information Technology,,,Internet Marketplace Platforms,https://be.linkedin.com/company/jobgether,,,,,,,,,,,
linkedin,IoT Test Engineer (all gender) – Python / Embedded 800,ALTEN Germany,"Augsburg, Bavaria, Germany",2026-05-07,https://www.linkedin.com/jobs/view/4409248947 , ,li-4409248947,fulltime,,,,,,False,entry level,"Engineering, Information Technology, and Production",,,"Research Services, IT System Custom Software Development, and Chemical Manufacturing",https://de.linkedin.com/company/altengermany,,,,,,,,,,,
linkedin,"Masterarbeit ""KI in der Ladefunktionsentwicklung""",Porsche AG,"Weissach, Baden-Württemberg, Germany",2026-05-07,https://www.linkedin.com/jobs/view/4378931891 , ,li-4378931891,fulltime,,,,,,False,internship,Education and Training,,,Motor Vehicle Manufacturing,https://de.linkedin.com/company/porsche-ag,,,,,,,,,,,
linkedin,Tech Lead - ML & Intelligent Automation,IPS Intelligent Process Solutions,"Munich, Bavaria, Germany",2026-05-07,https://www.linkedin.com/jobs/view/4411469707 , ,li-4411469707,fulltime,,,,,,False,mid-senior level,Information Technology,,,IT Services and IT Consulting and Software Development,https://de.linkedin.com/company/ips-intelligent-process-solutions-gmbh,,,,,,,,,,,
linkedin,Entwicklungsingenieur Infotainment/Connectivity (m/w/d),prognum Automotive GmbH,"Stuttgart, Baden-Württemberg, Germany",2026-05-07,https://www.linkedin.com/jobs/view/4411448444 , ,li-4411448444,fulltime,,,,,,False,entry level,Engineering and Information Technology,,,Engineering Services,https://de.linkedin.com/company/prognum-automotive,,,,,,,,,,,
linkedin,Communications Engineer (f/m/d),Omnisent,"Munich, Bavaria, Germany",2026-05-07,https://www.linkedin.com/jobs/view/4409632278 , ,li-4409632278,fulltime,,,,,,False,mid-senior level,Engineering,,,IT Services and IT Consulting,https://de.linkedin.com/company/omnisent,,,,,,,,,,,
linkedin,"Senior Software Engineer - Android (Hybrid Position, Aachen or Ulm)",Cerence AI,"Ulm, Baden-Württemberg, Germany",2026-05-07,https://www.linkedin.com/jobs/view/4407727867 , ,li-4407727867,fulltime,,,,,,False,mid-senior level,Other,,,Software Development,https://www.linkedin.com/company/cerence,,,,,,,,,,,
linkedin,Softwareentwickler (m/w/d) für Automatisierungstechnik,Kannegiesser,"Vlotho, North Rhine-Westphalia, Germany",2026-05-07,https://www.linkedin.com/jobs/view/4409640051 , ,li-4409640051,fulltime,,,,,,False,entry level,Engineering and Information Technology,,,Machinery Manufacturing,https://de.linkedin.com/company/kannegiesser,,,,,,,,,,,
linkedin,"Full Stack Software Engineer, Robotic Solutions Development",Intrinsic,"Munich, Bavaria, Germany",2026-05-07,https://www.linkedin.com/jobs/view/4409282303 , ,li-4409282303,fulltime,,,,,,False,mid-senior level,Engineering,,-support@intrinsic.ai,Software Development,https://www.linkedin.com/company/intrinsic,,,,,,,,,,,
linkedin,Senior Test Engineer (m/w/d),SIEVON GmbH,"Görlitz, Saxony, Germany",2026-05-07,https://www.linkedin.com/jobs/view/4409252238 , ,li-4409252238,fulltime,,,,,,False,associate,Information Technology,,,Software Development,https://de.linkedin.com/company/sievon,,,,,,,,,,,
linkedin,Embedded Software Engineer,WorkGenius Group,"Munich, Bavaria, Germany",2026-05-06,https://www.linkedin.com/jobs/view/4408493820 , ,li-4408493820,fulltime,,,,,,False,mid-senior level,Engineering,,,"Technology, Information and Internet",https://www.linkedin.com/company/workgenius-group,,,,,,,,,,,
linkedin,Head of Systems Engineering - Physical Products,Helsing,"Berlin, Berlin, Germany",2026-05-06,https://www.linkedin.com/jobs/view/4408891419 , ,li-4408891419,fulltime,,,,,,True,director,Information Technology,,,Software Development,https://de.linkedin.com/company/helsing,,,,,,,,,,,
linkedin,SPS Programmierer,EHATEC GmbH,"Bad Friedrichshall, Baden-Württemberg, Germany",2026-05-06,https://www.linkedin.com/jobs/view/4408822024 , ,li-4408822024,fulltime,,,,,,False,entry level,Engineering,,,Industrial Machinery Manufacturing,https://www.linkedin.com/company/ehatec-gmbh,,,,,,,,,,,
linkedin,Integration Engineer iPaaS / Workato (m/w/d) — Remote (DE),TEVEO,,2026-05-06,https://www.linkedin.com/jobs/view/4398492534 , ,li-4398492534,fulltime,,,,,,True,associate,Information Technology,,,Apparel & Fashion,https://de.linkedin.com/company/teveocom,,,,,,,,,,,
linkedin,Germany Electrical Plan Approval Engineer,RINA,"Hamburg, Hamburg, Germany",2026-05-06,https://www.linkedin.com/jobs/view/4408815093 , ,li-4408815093,fulltime,,,,,,False,associate,Engineering and Information Technology,,,"Mechanical Or Industrial Engineering, Environmental Services, and Information Technology & Services",https://it.linkedin.com/company/rina,,,,,,,,,,,
linkedin,Principal Analog Design Engineer,IC Resources,"Baden-Württemberg, Germany",2026-05-06,https://www.linkedin.com/jobs/view/4409792936 , ,li-4409792936,fulltime,,,,,,False,mid-senior level,Engineering,,,Staffing and Recruiting,https://uk.linkedin.com/company/icresources,,,,,,,,,,,
linkedin,Freelance Hardware BMS Engineer | Munich | 6 Month Contract,Optimus Search,"Munich, Bavaria, Germany",2026-05-06,https://www.linkedin.com/jobs/view/4408497968 , ,li-4408497968,contract,,,,,,False,mid-senior level,Engineering,,,"Appliances, Electrical, and Electronics Manufacturing",https://uk.linkedin.com/company/optimus-search,,,,,,,,,,,
linkedin,Electrical Engineer (m/w/d),Brunel,"Bremen, Germany",2026-05-06,https://www.linkedin.com/jobs/view/4409901915 , ,li-4409901915,fulltime,,,,,,False,associate,Research,,,Software Development,https://nl.linkedin.com/company/brunel,,,,,,,,,,,
linkedin,Electrical Engineer,"Wayzim Technology Co., Ltd.",,2026-05-06,https://www.linkedin.com/jobs/view/4400352874 , ,li-4400352874,fulltime,,,,,,False,entry level,Engineering,,,"Automation Machinery Manufacturing and Transportation, Logistics, Supply Chain and Storage",https://cn.linkedin.com/company/wayzim,,,,,,,,,,,
linkedin,Systemingenieur (m/w/d) Simulation & Systemarchitektur,ACONEXT,"Immenstaad am Bodensee, Baden-Württemberg, Germany",2026-05-06,https://www.linkedin.com/jobs/view/4409383570 , ,li-4409383570,fulltime,,,,,,False,entry level,Information Technology,,,Engineering Services,https://de.linkedin.com/company/aconext-holding-gmbh,,,,,,,,,,,
linkedin,"System Engineer für Entwicklungsprojekte, all genders",SALT AND PEPPER Group,"Hamburg, Hamburg, Germany",2026-05-06,https://www.linkedin.com/jobs/view/3983797937 , ,li-3983797937,fulltime,,,,,,False,entry level,Information Technology,,,Engineering Services,https://de.linkedin.com/company/salt-and-pepper,,,,,,,,,,,
linkedin,Sensors Systems Engineer (all genders),STARK,"Berlin, Germany",2026-05-06,https://www.linkedin.com/jobs/view/4411208030 , ,li-4411208030,fulltime,,,,,,False,associate,Engineering and Other,,,Defense and Space Manufacturing,https://de.linkedin.com/company/stark-defence,,,,,,,,,,,
linkedin,"Supplier Quality Engineer (f/m/d) Gas Turbine Auxiliaries, Fluid Systems",Siemens Energy,"Erlangen, Bavaria, Germany",2026-05-06,https://www.linkedin.com/jobs/view/4409951434 , ,li-4409951434,fulltime,,,,,,True,associate,Supply Chain,,,"Appliances, Electrical, and Electronics Manufacturing",https://www.linkedin.com/company/siemens-energy,,,,,,,,,,,
linkedin,Systemingenieur Hochfrequenztechnik (all gender) 100,ALTEN Germany,"Berlin, Germany",2026-05-06,https://www.linkedin.com/jobs/view/4400808233 , ,li-4400808233,fulltime,,,,,,False,entry level,"Product Management, Information Technology, and Production",,,Computers and Electronics Manufacturing and Software Development,https://de.linkedin.com/company/altengermany,,,,,,,,,,,
linkedin,Head of Systems Engineering - Physical Products,Helsing,"Munich, Bavaria, Germany",2026-05-06,https://www.linkedin.com/jobs/view/4408880663 , ,li-4408880663,fulltime,,,,,,True,director,Information Technology,,,Software Development,https://de.linkedin.com/company/helsing,,,,,,,,,,,
linkedin,Systemingenieur Elektrotechnik (m/w/d) Offshore / Maritime Energiesysteme,NEPTUN WERFT,"Rostock, Mecklenburg-West Pomerania, Germany",2026-05-06,https://www.linkedin.com/jobs/view/4409778969 , ,li-4409778969,fulltime,,,,,,False,mid-senior level,Information Technology,,,Shipbuilding,https://www.linkedin.com/company/neptun-werft-gmbh,,,,,,,,,,,
linkedin,Mechatronics Test Engineer (m/f/d),Agile Robots SE,"Munich, Bavaria, Germany",2026-05-06,https://www.linkedin.com/jobs/view/4408871719 , ,li-4408871719,fulltime,,,,,,False,entry level,Engineering,,,"Robotics Engineering, Robot Manufacturing, and Software Development",https://de.linkedin.com/company/agile-robots-se,,,,,,,,,,,
linkedin,Senior RF Design Engineer,indie.inc,"Frankfurt an der Oder, Brandenburg, Germany",2026-05-06,https://www.linkedin.com/jobs/view/4389973044 , ,li-4389973044,fulltime,,,,,,False,mid-senior level,Engineering and Information Technology,,,Semiconductor Manufacturing,https://www.linkedin.com/company/indieinc,,,,,,,,,,,
linkedin,HF-Ingenieur / Hochfrequenztechnik (all gender) 100,ALTEN Germany,"Ingolstadt, Bavaria, Germany",2026-05-06,https://www.linkedin.com/jobs/view/4364130368 , ,li-4364130368,fulltime,,,,,,False,associate,"Project Management, Engineering, and Information Technology",,,"Computers and Electronics Manufacturing, Motor Vehicle Manufacturing, and IT Services and IT Consulting",https://de.linkedin.com/company/altengermany,,,,,,,,,,,
linkedin,RF Test Engineer SDR (all gender) – Wellenform & Automation 100,ALTEN Germany,"Stuttgart, Baden-Württemberg, Germany",2026-05-06,https://www.linkedin.com/jobs/view/4400498775 , ,li-4400498775,fulltime,,,,,,False,entry level,"Product Management, Information Technology, and Production",,,Computers and Electronics Manufacturing and Software Development,https://de.linkedin.com/company/altengermany,,,,,,,,,,,
linkedin,"Senior Embedded Systems Engineer (m/w/x), 40h",AssistMe,"Berlin, Germany",2026-05-06,https://www.linkedin.com/jobs/view/4408809808 , ,li-4408809808,fulltime,,,,,,False,mid-senior level,,,,Embedded Software Products,https://de.linkedin.com/company/assistmeio,,,,,,,,,,,
linkedin,Embedded Systems Aerospace Softwareentwickler (m/w/d),Liebherr Aerospace and Transportation,"Lindenberg im Allgäu, Bavaria, Germany",2026-05-06,https://www.linkedin.com/jobs/view/4389321035 , ,li-4389321035,fulltime,,,,,,False,entry level,Engineering and Information Technology,,,Industrial Machinery Manufacturing,https://fr.linkedin.com/company/liebherr-aerospace-and-transportation,,,,,,,,,,,
linkedin,Embedded Software Engineer- Rust (m/w/d),Swobbee,"Berlin, Berlin, Germany",2026-05-06,https://www.linkedin.com/jobs/view/4409790180 , ,li-4409790180,fulltime,,,,,,False,associate,Information Technology,,,Software Development,https://de.linkedin.com/company/swobbee,,,,,,,,,,,
linkedin,Embedded Software Engineer (all gender) 100,ALTEN Germany,"Berlin, Germany",2026-05-06,https://www.linkedin.com/jobs/view/4400499628 , ,li-4400499628,fulltime,,,,,,False,entry level,"Product Management, Information Technology, and Production",,,Computers and Electronics Manufacturing and Software Development,https://de.linkedin.com/company/altengermany,,,,,,,,,,,
linkedin,embedded Software Developer (m/w/d),INSYS icom,"Regensburg, Bavaria, Germany",2026-05-06,https://www.linkedin.com/jobs/view/4411243116 , ,li-4411243116,fulltime,,,,,,False,entry level,Engineering and Information Technology,,,Internet Publishing,https://de.linkedin.com/company/insys-icom,,,,,,,,,,,
linkedin,"Field Application Engineer, Automotive Robotics",Tenstorrent,"Munich, Bavaria, Germany",2026-05-06,https://www.linkedin.com/jobs/view/4377752813 , ,li-4377752813,fulltime,,,,,,True,mid-senior level,Sales and Business Development,,,Computer Hardware Manufacturing,https://ca.linkedin.com/company/tenstorrent-inc.,,,,,,,,,,,
